,ItemName,ManufactureName,UnitQty,Quantity,QtyInPackage,ItemPrice,UnitOfMeasurePrice
1153,סופר פוליש נוזל לרצפה סנו (1 ליטר),החברה הדרומית לשיווק בעמ,יח`,,1,37.70,37.70
1154,סנובון תות לאסלה סנו (55x3 גרם),החברה הדרומית לשיווק בעמ,יח`,,1,13.20,8
1155,סנובון לאסלה לימון סנו (55x3 גרם),החברה הדרומית לשיווק בעמ,יח`,,1,13.20,8
1156,סנובון לאסלה לובר סנו (55x3 גרם),החברה הדרומית לשיווק בעמ,יח`,,1,13.20,8
1157,סנובון נוזלי 750 מל,החברה הדרומית לשיווק בעמ,יח`,,1,10.90,1.45
1158,ז`אוול מרסס לניקוי כללי לבנדר סנו (1 ליט,החברה הדרומית לשיווק בעמ,יח`,,1,21.40,21.40
1159,קוטל מעופפים קיי 400 סנו (630 מל),החברה הדרומית לשיווק בעמ,יח`,,1,27.30,6.83
1160,קוטל חרקים קיי 300 סנו (630 מל),החברה הדרומית לשיווק בעמ,יח`,,1,21.90,3.48
1161,K500,החברה הדרומית לשיווק בעמ,יח`,,1,28.40,7.01
1162,סנו-די דוחה יתושים כדורי סנו (50 מל),החברה הדרומית לשיווק בעמ,יח`,,1,21.70,43.40
1163,סנו די תרסיס,החברה הדרומית לשיווק בעמ,יח`,,1,21.70,17.36
1164,סנו די נוזל+משאבה,החברה הדרומית לשיווק בעמ,יח`,,1,23.70,47.40
1165,סנו מקסימה 4 ליטר ורוד פסים,החברה הדרומית לשיווק בעמ,יח`,,1,22.40,5.60
1166,מסיר שומנים ז`אוול קר,החברה הדרומית לשיווק בעמ,יח`,,1,20.70,2.76
1167,סנו ז`אוול מרסס 1 ליטר,החברה הדרומית לשיווק בעמ,יח`,,1,21.40,21.40
1168,מסיר שומנים פורטה פלוס סנו (750 מל),החברה הדרומית לשיווק בעמ,יח`,,1,18.30,2.44
1169,סנובון נוזלי בניחוח לבנדר סנו (750 מל),החברה הדרומית לשיווק בעמ,יח`,,1,10.90,1.45
1170,פוליויקס 2 ליטר,החברה הדרומית לשיווק בעמ,יח`,,1,24.40,12.20
1171,סנובון לאסלה קלאסיק כחול סנו (55x3 גרם),החברה הדרומית לשיווק בעמ,יח`,,1,20.30,12.30
1172,רסס ונגב לניקוי כללי תרסיס סנו (750 מל),החברה הדרומית לשיווק בעמ,יח`,,1,20.30,3.38
1173,סנו מקסימה 4 ליטר לבן,החברה הדרומית לשיווק בעמ,יח`,,1,22.40,5.60
1174,סנוג`ט יכול הכל סחלבים סנו (4 ליטר),החברה הדרומית לשיווק בעמ,יח`,,1,22.40,5.60
1175,סנומוד מדונה,החברה הדרומית לשיווק בעמ,יח`,,1,13.20,8.80
1176,מטלית ריצפה זיגזג סנו סושי (3),החברה הדרומית לשיווק בעמ,יח`,,1,14.20,14.20
1177,כרית יפנית לכלים אקטיב סנו סושי (4),החברה הדרומית לשיווק בעמ,יח`,,1,12.20,12.20
1178,שקיות אשפה לפח 65x54 סנו סושי (60),החברה הדרומית לשיווק בעמ,יח`,,1,24.40,24.40
1179,אטבי כביסה איכות סנו (20),החברה הדרומית לשיווק בעמ,יח`,,1,10.50,10.50
1180,רב מגבת ג`מבו סנו סושי,החברה הדרומית לשיווק בעמ,יח`,,1,26.50,6.79
1181,סושי רדיד אלומיניום צמד,החברה הדרומית לשיווק בעמ,יח`,,1,14.20,14.20
1182,חטיפי כרובית בציפוי פריך טבעול (500 גרם),קבוצת אסם סחר שות. מוגבלת,יח`,,1,34.60,6.92
1183,פול מצרי 560 גר,ויטה -פרי גליל (החדשה) בעמ,יח`,,1,5.90,1.05
1184,שעועית לבנה אפויה,ויטה -פרי גליל (החדשה) בעמ,יח`,,1,6.50,1.18
1185,חומוס שלם A2,ויטה -פרי גליל (החדשה) בעמ,יח`,,1,5.90,0.98
1186,אפונה גדולה A2,ויטה -פרי גליל (החדשה) בעמ,יח`,,1,5.90,0.98
1187,אפונה וגזר A2,ויטה -פרי גליל (החדשה) בעמ,יח`,,1,5.90,1.07
1188,תירס גרעינים 550 גר`,ויטה -פרי גליל (החדשה) בעמ,יח`,,1,6.20,1.13
1189,ופלים מצופים מן (22x10 גרם),רוקחמן בעמ,יח`,,1,8.40,4.20
1190,חומוסטחינה פלפל חריף מטוגן 400גר,קבוצת אסם סחר שות. מוגבלת,יח`,,1,15.20,3.80
1191,קבנוס קלאסי יחיעם (125 גרם),מעדני יחיעם (1993) בעמ,יח`,,1,14.20,11.36
1192,קבנוס פפרוני יחיעם (125 גרם),מעדני יחיעם (1993) בעמ,יח`,,1,14.20,11.36
1193,משקה קל דיאט אשכוליות ג`אמפ (1.5 ליטר),טמפו משקאות בעמ,יח`,,1,5.70,0.38
1194,משקה קל מנגו פסיפלורה ג`אמפ (1.5 ליטר),טמפו משקאות בעמ,יח`,,1,5.70,0.38
1195,מי סודה טמפו (1.5 ליטר),טמפו משקאות בעמ,יח`,,1,3.10,0.21
1196,סודה בטעם פירות יער טמפו (1.5 ליטר),טמפו משקאות בעמ,יח`,,1,4.10,2.73
1197,סודה בטעם אננס טמפו (1.5 ליטר),טמפו משקאות בעמ,יח`,,1,4.10,2.73
1198,תרכיז טבעי סיידר הגליל (330 מל),טמפו משקאות בעמ,יח`,,1,10.90,3.21
1199,מרכך כביסה ורוד בדין (4 ליטר),יוניליוור ישראל שיווק בעמ,יח`,,1,20.90,5.23
1200,מרכך כביסה צהוב בדין (4 ליטר),יוניליוור ישראל שיווק בעמ,יח`,,1,20.90,5.23
1201,מרכך כביסה כחול בדין (4 ליטר),יוניליוור ישראל שיווק בעמ,יח`,,1,20.90,5.23
1202,סלמי גליל 600 גר` טירת צבי,תנובה קפואים,יח`,,1,38.70,6.45
1203,נקניקיות פיקנטיות 400 גר` טירת צבי,תנובה קפואים,יח`,,1,15.20,3.80
1204,סלסולי כתף בקר 120 גר` טירת צבי,תנובה קפואים,יח`,,1,17.30,14.42
1205,סלסולי סלמי איטלקי 120 גר` טירת צבי,תנובה קפואים,יח`,,1,17.30,14.42
1206,דקניקים סלסולי הודו טירת צבי (120 גרם),תנובה קפואים,יח`,,1,17.30,14.42
1207,סלסולי פסטרמה גחלים 120 גר` טירת צבי,תנובה קפואים,יח`,,1,17.30,14.42
1208,נקניקיות עוף טירת צבי (400 גרם),תנובה קפואים,יח`,,1,15.20,3.80
1209,צמד כפרי 800 גר` טירת צבי,תנובה קפואים,יח`,,1,37.70,4.71
1210,לחם עינן קל פרוס אנג`ל (500 גרם),שלמה א. אנג`ל בעמ,יח`,,1,15.10,3.02
1211,נוזל לניקוי אסלות 00 סנו (1 ליטר),החברה הדרומית לשיווק בעמ,יח`,,1,9.10,9.10
1212,ממרח בטעם שוקולד השחר העולה (1 קג),השחר העולה תעשית ממתקים בעמ,יח`,,1,25.40,25.40
1213,צימקאו השחר העולה (400 גרם),השחר העולה תעשית ממתקים בעמ,יח`,,1,13.50,3.38
1214,ממרח 400 גר` חלבי בדצ השחר,השחר העולה תעשית ממתקים בעמ,יח`,,1,14.20,3.55
1215,ממרח אגוזי לוז עם קקאו 350 גר` פרווה,השחר העולה תעשית ממתקים בעמ,יח`,,1,14.90,4.26
1216,שפורפרת לחיץ שוקולד 330 גר` השחר,השחר העולה תעשית ממתקים בעמ,יח`,,1,15.20,4.61
1217,ממרח 400 גר` פרווה השחר,השחר העולה תעשית ממתקים בעמ,יח`,,1,12.20,3.05
1218,ממרח פרווה 1 קג` השחר,השחר העולה תעשית ממתקים בעמ,יח`,,1,24.40,24.40
1219,ממרח חצי חצי 350 גר` השחר,השחר העולה תעשית ממתקים בעמ,יח`,,1,13.20,3.77
1220,אבקת קקאו השחר העולה (150 גרם),השחר העולה תעשית ממתקים בעמ,יח`,,1,10.50,7
1221,אבקת קקאו השחר העולה (500 גרם),השחר העולה תעשית ממתקים בעמ,יח`,,1,30.50,6.10
1222,ממרח חלב 350 גר` השחר,השחר העולה תעשית ממתקים בעמ,יח`,,1,13.20,3.77
1223,ממרח נוגט אגוזים 350 גר` השחר,השחר העולה תעשית ממתקים בעמ,יח`,,1,14.20,4.06
1224,קפה שחור קפה לנדוור (100x3 גרם),קבוצת אסם סחר שות. מוגבלת,יח`,,1,24.40,8.13
1225,קפה לנדוור לבוקר שלישיה,קבוצת אסם סחר שות. מוגבלת,יח`,,1,24.40,8.13
1226,פופקורן פופסטאר חמישייה טבעי,דנשר (1963) בעמ,יח`,,1,18.30,3.66
1227,פופקורן פופסטאר חמישייה חמאה,דנשר (1963) בעמ,יח`,,1,18.30,3.66
1228,גלילונית לפח 60 יח`,דנשר (1963) בעמ,יח`,,1,20.30,20.30
1229,משקה מוגז בטעם קולה פפסי (1.5 ליטר),טמפו משקאות בעמ,יח`,,1,6.10,0.41
1230,משקה מוגז בטעם ליים סבן אפ (1.5 ליטר),טמפו משקאות בעמ,יח`,,1,6.10,0.41
1231,משקה אורנג` מירנדה (1.5 ליטר),טמפו משקאות בעמ,יח`,,1,6.10,0.41
1232,פפסי סבן אפ דיאט 1.5 ליטר,טמפו משקאות בעמ,יח`,,1,6.10,0.41
1233,פפסי מקס 1.5 ליטר,טמפו משקאות בעמ,יח`,,1,6.10,0.41
1234,נוזל לניקוי כללי פנטסטיק סיף (4 ליטר),יוניליוור ישראל שיווק בעמ,יח`,,1,26.50,0.66
1235,בייגלה שמונה שמונה 400 גר`,יוניליוור ישראל שיווק בעמ,יח`,,1,11.50,2.88
1236,בייגלה אחד אחד 400 גר`,יוניליוור ישראל שיווק בעמ,יח`,,1,11.50,2.88
1237,צבר חומוסיבוב ברוטב חריף 400 גרם,קבוצת אסם סחר שות. מוגבלת,יח`,,1,15.20,2.71
1238,חומוס צבר סמיר הגדול,קבוצת אסם סחר שות. מוגבלת,יח`,,1,15.20,3.80
1239,חומוס צבר אבו מרוואן,קבוצת אסם סחר שות. מוגבלת,יח`,,1,15.20,3.80
1240,לחמניות חיטה מלאה דגנית עין בר (10),דגנית עין בר תעשיות מזון ואפיה,יח`,,1,12.20,1.63
1241,לחמניות אצבע דגנית עין בר (10),דגנית עין בר תעשיות מזון ואפיה,יח`,,1,12.20,1.63
1242,לחם אקטיב ברמן (750 גרם),י.את א. ברמן בעמ,יח`,,1,15.20,2.03
1243,לחמניות אקטיב ברמן,י.את א. ברמן בעמ,יח`,,1,12.20,2.71
1244,יין אדום יבש של סגל (750 מל),טמפו משקאות בעמ,יח`,,1,22.50,2.96
1245,יין לבן יבש של סגל (750 מל),טמפו משקאות בעמ,יח`,,1,22.50,2.96
1246,יין לבן חצי יבש של סגל (750 מל),טמפו משקאות בעמ,יח`,,1,22.50,2.96
1247,מרום גליל סינגל קברנה סובניון 750 מל,טמפו משקאות בעמ,יח`,,1,43.80,5.80
1248,מרום גליל סינגל מרלו 750מל,טמפו משקאות בעמ,יח`,,1,43.80,5.80
1249,מרום גליל שרדונה,טמפו משקאות בעמ,יח`,,1,44.10,5.84
1250,נקניקיות וניר 1 קג` זוגלובק,זוגלובק שיווק בעמ,יח`,,1,31.60,31.60
1251,נקניקיות וינר זוגלובק (500 גרם),זוגלובק שיווק בעמ,יח`,,1,18.30,3.66
1252,גוליבר חריפות 400 גר` זוגלובק,זוגלובק שיווק בעמ,יח`,,1,18.60,4.65
1253,מארז פסטרמה חרמון+תה,זוגלובק שיווק בעמ,יח`,,1,35.60,4.45
1254,בורקס גבינה זוגלובק (16 יח` - 800 גרם),זוגלובק שיווק בעמ,יח`,,1,22.40,2.80
1255,נקנקיות חריפות 1,זוגלובק שיווק בעמ,יח`,,1,33.90,33.90
1256,בצק עלים זוגלובק,זוגלובק שיווק בעמ,יח`,,1,22.40,22.40
1257,קריספי סטיקס תירס,זוגלובק שיווק בעמ,יח`,,1,21.40,4.28
1258,נקניקיות עוף זוגלובק (400 גרם),זוגלובק שיווק בעמ,יח`,,1,15.20,3.80
1259,נקניקיות עוף זוגלובק (1 קג),זוגלובק שיווק בעמ,יח`,,1,32.60,32.60
1260,סטייק בורגר 400 גר` טיבונוויל,נטו מלינדה סחר בעמ,יח`,,1,21.40,5.35
1261,בשר עוף קפוא טחון טיבון ויל (500 גרם),נטו מלינדה סחר בעמ,יח`,,1,13.20,2.64
1262,בשר הודו קפוא טחון טיבון ויל (500 גרם),נטו מלינדה סחר בעמ,יח`,,1,13.20,2.64
1263,גבינת מסקרפונה 40% גד (250 גרם),מחלבות גד שיווק 1992 בעמ,יח`,,1,22.90,9.16
1264,ג`ל גילוח נגד חתכים אדג` (198 גרם),דנשר (1963) בעמ,יח`,,1,20.70,10.35
1265,אדג` ג`ל גילוח 200 מל ירוק,דנשר (1963) בעמ,יח`,,1,20.70,10.35
1266,ג`ל גילוח לעור רגיש אדג` (198 גרם),דנשר (1963) בעמ,יח`,,1,20.70,10.35
1267,אדג` ג`ל גילוח 200 מל סגול כהה,דנשר (1963) בעמ,יח`,,1,20.70,10.35
1268,אדג` ג`ל לבן לניקוי עור הפנים,דנשר (1963) בעמ,יח`,,1,21.40,10.70
1269,תערובת פיצוחים מובחרת 150 גר` פיצוחי חממ,בוטנת בעמ,יח`,,1,16.90,11.27
1270,תערובת אגוזים וחמוציות חממה (150 גרם),בוטנת בעמ,יח`,,1,14.20,9.47
1271,טחינה גולמית אחוה (1 קג),אחדות בעמ,יח`,,1,21.40,21.40
1272,לחם חיטה מלא +כוסמין דגנית,דגנית עין בר תעשיות מזון ואפיה,יח`,,1,14.20,1.89
1273,מי עדן 1.5 ליטר בודד,יפאורה,יח`,,1,3.90,2.60
1274,מים מינרלים פקק ספורט מי עדן (500x6 מל),יפאורה,יח`,,1,13.50,0.39
1275,אלמקס משחת שיניים ילדים 75מל,ש.שסטוביץ בעמ,יח`,,1,16.30,21.73
1276,פרש וואנס מגבונים רביעיה,דנשר (1963) בעמ,יח`,,1,19.90,19.90
1277,שקד מולבן פרוס 100 גר`,מיה תעשיות מזון מ.ת.מ. בעמ,יח`,,1,12.20,12.20
1278,שומשום מיה (400 גרם),מיה תעשיות מזון מ.ת.מ. בעמ,יח`,,1,13.20,3.30
1279,צמד חמד 700 גר` יחיעם,מעדני יחיעם (1993) בעמ,יח`,,1,26.50,3.79
1280,המבורגר אמיתי טיבון ויל (400 גרם),נטו מלינדה סחר בעמ,יח`,,1,21.40,5.35
1281,נקה 7 שמפו 750 מל ירוק,החברה הדרומית לשיווק בעמ,יח`,,1,14.20,1.89
1282,נקה 7 שמפו 750 מל,החברה הדרומית לשיווק בעמ,יח`,,1,14.20,1.89
1283,נקה 7 שמפו 750 מל,החברה הדרומית לשיווק בעמ,יח`,,1,14.20,1.89
1284,נקה 7 מרכך 750 מל ירוק,החברה הדרומית לשיווק בעמ,יח`,,1,14.20,1.89
1285,נקניקיות חריפות מהדרין עטרה (400 גרם),נטו מלינדה סחר - עטרה,יח`,,1,12.20,2.44
1286,אקונומיקה סמיכה 4 ליטר טאצ`,סאסאטק אגשח בעמ,יח`,,1,12.90,0.32
1287,ג`ל כביסה ירוק 3 ליטר טאצ`,סאסאטק אגשח בעמ,יח`,,1,18.90,6.30
1288,ג`ל כביסה כחול 3 ליטר טאצ`,סאסאטק אגשח בעמ,יח`,,1,18.90,6.30
1289,נוזל רצפות אורנים 4 ליטר טאצ,סאסאטק אגשח בעמ,יח`,,1,14.90,0.37
1290,נוזל רצפות מאסק 4 ליטר טאצ,סאסאטק אגשח בעמ,יח`,,1,14.90,0.37
1291,נוזל רצפות יסמין 4 ליטר טאצ`,סאסאטק אגשח בעמ,יח`,,1,14.90,0.37
1292,מרכך כביסה 4 ליטר ורוד,סאסאטק אגשח בעמ,יח`,,1,14.90,0.37
1293,מרכך כביסה 4 ליטר כחול,סאסאטק אגשח בעמ,יח`,,1,14.90,0.37
1294,מרכך כביסה 4 ליטר לבן,סאסאטק אגשח בעמ,יח`,,1,14.90,0.37
1295,נוזל רצפות לבנדר 4 ליטר טאצ,סאסאטק אגשח בעמ,יח`,,1,14.90,0.37
1296,נקטר תות בננה ספרינג (1 ליטר),יפאורה,יח`,,1,6,0.60
1297,מיץ עגבניות ספרינג (1 ליטר),יפאורה,יח`,,1,6,0.60
1298,נקטר מנגו ספרינג (1 ליטר),יפאורה,יח`,,1,6,0.60
1299,נקטר אפרסקים ספרינג (1 ליטר),יפאורה,יח`,,1,6,0.60
1300,משקה קל לימונענע ספרינג (1 ליטר),יפאורה,יח`,,1,6,0.60
1301,נקטר תפוזים ספרינג (1 ליטר),יפאורה,יח`,,1,6,0.60
1302,נקטר תפוחים ספרינג (1 ליטר),יפאורה,יח`,,1,6,0.60
1303,RC קולה פחית רגיל,יפאורה,יח`,,1,3.90,1.09
1304,משקה קל ענבים תפוזינה (1.5 ליטר),יפאורה,יח`,,1,6.90,0.46
1305,פלמוליב ח ודבש 500מל חדש,ש.שסטוביץ בעמ,יח`,,1,21.40,4.28
1306,פלמוליב כלים שקוף לימון 750 בקבוק חדש,ש.שסטוביץ בעמ,יח`,,1,13.20,1.76
1307,שטראוס קרמיסימו,גלידות שטראוס בעמ,יח`,,1,20.50,15.41
1308,שטראוס קרמיסימו שוקולד וניל,גלידות שטראוס בעמ,יח`,,1,20.50,15.41
1309,שטראוס קרמיסימו ריבת חלב,גלידות שטראוס בעמ,יח`,,1,20.50,15.41
1310,שטראוס קרמיסימו וניל,גלידות שטראוס בעמ,יח`,,1,20.50,15.41
1311,שטראוס קרמיסימו,גלידות שטראוס בעמ,יח`,,1,20.50,15.41
1312,מאגדת-מיני מגנום,גלידות שטראוס בעמ,יח`,,1,35.60,35.60
1313,גרנולה עם תוספות 1 קג,דין שיווק וקליה בעמ,יח`,,1,21.40,21.40
1314,וופל קלאסי שוקולד 200 גר` עלמה,רזיט שיווק בעמ,יח`,,1,3.20,1.60
1315,גביעי גלידה מגולגל 12 יח עלמה,רזיט שיווק בעמ,יח`,,1,12.90,12.90
1316,וופל קלאסי לימון 200 גר` עלמה,רזיט שיווק בעמ,יח`,,1,3.20,1.60
1317,מרגז מיני אקסטרה 500 גר` 8 יח,בלדי בעמ,יח`,,1,28.90,5.78
1318,שומן כבש 200,בלדי בעמ,יח`,,1,10.10,5.05
1319,פסטרמה מעודנת על גחלים 300 גר,מעדני יחיעם (1993) בעמ,יח`,,1,25.40,8.47
1320,נקניקיות וינר 400 גרם,מעדני יחיעם (1993) בעמ,יח`,,1,14.20,3.55
1321,נקניקיות חריפות 400 גרם,מעדני יחיעם (1993) בעמ,יח`,,1,14.20,3.55
1322,פסטרמה של פעם 300 גרם לחמ,מעדני יחיעם (1993) בעמ,יח`,,1,27.50,9.17
1323,פסטרמה רומנית 250 גרם לחמ,מעדני יחיעם (1993) בעמ,יח`,,1,27.50,11
1324,כתף בקר מעושן 250 גרם לחמ,מעדני יחיעם (1993) בעמ,יח`,,1,30.50,12.20
1325,סלמי מעושן בסגנון איטלקי 300 גרם,מעדני יחיעם (1993) בעמ,יח`,,1,22.40,7.47
1326,פסטרמה מעודנת 200 גר` יחיעם,מעדני יחיעם (1993) בעמ,יח`,,1,13.20,6.60
1327,סלמי איטלקי מפולפל 200 גר` יחיעם,מעדני יחיעם (1993) בעמ,יח`,,1,13.20,6.60
1328,ספירה אנתוש 70 מל,גורי ע.ע.ע בעמ,יח`,,1,14.20,20.29
1329,פחית פאנטה ענבים סליק 330 מל,החברה המרכזית להפצת משקאות בעמ,יח`,,1,4.50,1.27
1330,סודה קינלי (250 מל),החברה המרכזית להפצת משקאות בעמ,יח`,,1,3,1.08
1331,פקאן סיני פיצוחי חממה (100 גרם),בוטנת בעמ,יח`,,1,18.30,18.30
1332,אקונומיקה קצף ניקוי סנט מוריץ (1 ליטר ),קומפלקס כימיקלים בעמ,יח`,,1,12.90,1.29
1333,קצף ניקוי כלים סינטריים סנט מוריץ ( 1 לי,קומפלקס כימיקלים בעמ,יח`,,1,12.90,12.90
1334,חיוכים שוקו 900 גר`,שטראוס גרופ בעמ,יח`,,1,22.40,2.49
1335,חיוכים וניל 900 גר`,שטראוס גרופ בעמ,יח`,,1,22.40,2.49
1336,ביסקוויט פתי בר בטעם חמאה עלית (500 גרם),שטראוס גרופ בעמ,יח`,,1,11.20,2.24
1337,שוקולד פרה חלב עם עדשים עלית (100 גרם),שטראוס גרופ בעמ,יח`,,1,5,5
1338,ציטוס איקס עיגול 60 גר,שטראוס פריטו ליי בעמ,יח`,,1,3.90,6.50
1339,צ יטוס כאפה 55 גר,שטראוס פריטו ליי בעמ,יח`,,1,3.90,7.09
1340,אל סבון נוזלי וניל פמילי (1 ליטר),דנשר (1963) בעמ,יח`,,1,15.60,15.60
1341,אל סבון נוזלי לבנדר פמילי (1 ליטר),דנשר (1963) בעמ,יח`,,1,15.60,15.60
1342,אל סבון נוזלי ליים פמילי (1 ליטר),דנשר (1963) בעמ,יח`,,1,15.60,15.60
1343,אדג ג`ל גילוח-זוג,דנשר (1963) בעמ,יח`,,1,30.90,7.12
1344,מאגדת-מיני מגנום,גלידות שטראוס בעמ,יח`,,1,35.60,35.60
1345,אורז רייס ריץ` 5 קג`,סוגת תעשיות בעמ,יח`,,1,36.70,0.73
1346,קרם ידיים פנג`ל (80 מל),דנשר (1963) בעמ,יח`,,1,10.50,10.50
1347,בן ג`ריס גלידה בטעם חרוסת מהדרין 500מל,מוצרי איכות אמריקאיים בעמ,יח`,,1,20.30,4.06
1348,גלידת שמנת בטעם וניל קרמל וחתיכות גביעי,מוצרי איכות אמריקאיים בעמ,יח`,,1,20.30,4.06
1349,גלידת פיינטים שוקולד מילק קוקוס בן אנד ג,מוצרי איכות אמריקאיים בעמ,יח`,,1,20.30,4.06
1350,גלידת פיינטים שוקולד בצק עוגיות בן אנד ג,מוצרי איכות אמריקאיים בעמ,יח`,,1,20.30,4.06
1351,איטריות ביצים מס` 8 200 גר`,גורי מוצרי צריכה (1991) בעמ,יח`,,1,7.50,3.57
1352,איטריות ביצים מס 10 200 גר`,גורי מוצרי צריכה (1991) בעמ,יח`,,1,7.50,3.75
1353,איטריות ביצים מס 14 200 גר`,גורי מוצרי צריכה (1991) בעמ,יח`,,1,7.50,3.75
1354,נודלס אוריינט סיני 300גר,גורי מוצרי צריכה (1991) בעמ,יח`,,1,10.90,3.63
1355,נודלס בסגנון תאילנדי 25% תוספת ( 500 גר`,גורי מוצרי צריכה (1991) בעמ,יח`,,1,10.90,2.18
1356,זיתים ירוקים נובו קבוצת יבנה (540 גרם),קבוצת יבנה מוצרי מזון אגודה שי,יח`,,1,10.10,1.80
1357,טבעות זיתים ירוק A2,קבוצת יבנה מוצרי מזון אגודה שי,יח`,,1,10.10,1.80
1358,שיפקה 600 גרם בדצ,קבוצת יבנה מוצרי מזון אגודה שי,יח`,,1,6.40,1.07
1359,פלפל חריף שיפקה קבוצת יבנה (540 גרם),קבוצת יבנה מוצרי מזון אגודה שי,יח`,,1,6.70,1.20
1360,סלמון מעושן דלידג (100 גרם),נטו מלינדה סחר בעמ,יח`,,1,16.30,16.30
1361,המבורגר טחון 500 גר` מחפוד,עוף ירושלים שיווק בעמ,יח`,,1,18.30,3.66
1362,קבב מזרחי 500 גר` מחפוד,עוף ירושלים שיווק בעמ,יח`,,1,18.30,3.66
1363,סטייק אנטריקוט 800 גר` מחפוד,עוף ירושלים שיווק בעמ,יח`,,1,39.70,4.96
1364,טחון בקר 500 גר` מחפוד,עוף ירושלים שיווק בעמ,יח`,,1,18.30,3.66
1365,טחון הודו 500 מחפוד,עוף ירושלים שיווק בעמ,יח`,,1,15.20,3.04
1366,טחון עוף מחפוד 500 גר`,עוף ירושלים שיווק בעמ,יח`,,1,15.20,3.04
1367,קבב עוף 500 גר` מחפוד,עוף ירושלים שיווק בעמ,יח`,,1,15.20,3.04
1368,המבורגר עוף 500 גר` מחפוד,עוף ירושלים שיווק בעמ,יח`,,1,15.20,3.04
1369,טחון בקר 1 קג מחפוד,עוף ירושלים שיווק בעמ,יח`,,1,38.70,38.70
1370,בורקס פילו אצבעות בולגרית 700 גר`,נטו מלינדה סחר בעמ,יח`,,1,20.30,2.90
1371,טיבונוויל קבב אמ,נטו מלינדה סחר בעמ,יח`,,1,17.90,4.07
1372,רסק עגבניות 100 גר` פרי מבורך,זנלכל בעמ,יח`,,1,3,3
1373,רסק עגבניות BX 22% פרי מבורך (260 גרם),זנלכל בעמ,יח`,,1,5,1.92
1374,חומוס 550 גר` פרי מבורך,זנלכל בעמ,יח`,,1,7.10,1.29
1375,תירס מתוק 550 גר` פרי מבורך,זנלכל בעמ,יח`,,1,7.10,1.29
1376,טבעות דג 700 גר` דלי דג,נטו מלינדה סחר בעמ,יח`,,1,27.50,3.93
1377,שניצולני דג 600 גר דלידג,נטו מלינדה סחר בעמ,יח`,,1,27.30,4.55
1378,טונה ויליגר רביעייה 140 גר במים,נטו מלינדה סחר בעמ,יח`,,1,21.90,15.64
1379,המבורגר קפוא בלדי (400 גרם),בלדי בעמ,יח`,,1,13.90,3.48
1380,קבב כבש קפוא בלדי (400 גרם),בלדי בעמ,יח`,,1,12.90,3.23
1381,קבב מזרחי קפוא בלדי (400 גרם),בלדי בעמ,יח`,,1,12.90,3.23
1382,קבב רומני קפוא בלדי (400 גרם),בלדי בעמ,יח`,,1,12.90,3.23
1383,קמח 1 קג,טחנת קמח רוט קרית גת,יח`,,1,3.80,3.80
1384,סולת 1 קג,טחנת קמח רוט קרית גת,יח`,,1,5.30,5.30
1385,קמח מלא 1 קג,טחנת קמח רוט קרית גת,יח`,,1,4.50,4.50
1386,קמח תופח 1 קג,טחנת קמח רוט קרית גת,יח`,,1,4.50,4.50
1387,אפונה גינה 800 גר` פרי גליל,ויטה -פרי גליל (החדשה) בעמ,יח`,,1,10.90,1.36
1388,אפונה וגזר 800 גר` פרי גליל,ויטה -פרי גליל (החדשה) בעמ,יח`,,1,10.90,1.36
1389,גזר גמדי 800 גר` פרי גליל,ויטה -פרי גליל (החדשה) בעמ,יח`,,1,9.90,1.24
1390,שעועית צהובה חתוכה 800 גר` פרי גליל,ויטה -פרי גליל (החדשה) בעמ,יח`,,1,11.90,1.49
1391,שעועית ירוקה חתוכה 800 גר` פרי גליל,ויטה -פרי גליל (החדשה) בעמ,יח`,,1,11.90,1.49
1392,תירס גרעינים 800 גר`פרי גליל,ויטה -פרי גליל (החדשה) בעמ,יח`,,1,10.90,1.36
1393,אבקת אפיה מיה (10x10 גרם),מיה תעשיות מזון מ.ת.מ. בעמ,יח`,,1,3.30,3.30
