,ItemName,ManufactureName,UnitQty,Quantity,QtyInPackage,ItemPrice,UnitOfMeasurePrice
2895,בירה הייניקן 330 בקבוק,טמפו משקאות בעמ,יח`,,1,10.10,2.97
2896,בירה מכבי שנדי בודד,טמפו משקאות בעמ,יח`,,1,6.10,1.76
2897,בירה שנדי למון ליים מכבי (330x6 מל),טמפו משקאות בעמ,יח`,,1,36.90,1.77
2898,בירה היינקן (500 מל),טמפו משקאות בעמ,יח`,,1,8.50,1.46
2899,נודלס ביצים להקצפה וילי פוד (200 גרם),ג.וילי-פוד אינטרנשיונל בעמ,יח`,,1,4.90,2.45
2900,נודלס מסולסלות וילי פוד (200 גרם),ג.וילי-פוד אינטרנשיונל בעמ,יח`,,1,4.90,2.45
2901,מנת השף מרק+נודלס פיקנטי,ג.וילי-פוד אינטרנשיונל בעמ,יח`,,1,4.90,7
2902,מנת השף מרק+נודלס תירס,ג.וילי-פוד אינטרנשיונל בעמ,יח`,,1,4.90,7
2903,מנת השף מרק+נודלס פטריות,ג.וילי-פוד אינטרנשיונל בעמ,יח`,,1,4.90,7
2904,מנת השף מרק+נודלס ירקות,ג.וילי-פוד אינטרנשיונל בעמ,יח`,,1,4.90,7
2905,שקית 10 מודפס,שמחה זה אנחנו בעמ,יח`,,1,8.90,8.90
2906,טחינה מתובלת משומשום טבעי אחוה (500 גרם),אחדות בעמ,יח`,,1,11.90,2.38
2907,טחינה משומשום מלא אחוה (500 גרם),אחדות בעמ,יח`,,1,9.90,1.98
2908,טחינה משומשום טבעי אחוה (500 גרם),אחדות בעמ,יח`,,1,9.90,1.98
2909,מיני חלווה ב 3 טעמים,אחדות בעמ,יח`,,1,10,4.63
2910,חטיפי מיני חלוה ללא סוכר 15 יח`,אחדות בעמ,יח`,,1,10,10
2911,עוגה בטעם שוקולד עם שוקוצ`יפס מריר ולבן,אחדות בעמ,יח`,,1,9.90,2.20
2912,קצפיות במגש 180 גר,אחדות בעמ,יח`,,1,8.90,4.94
2913,טחינה עם שוקולד 400 גר אחוה ללא תוספת ס,אחדות בעמ,יח`,,1,11.90,2.98
2914,אגו משפחתי דאבל שוקו בלמינט 130 גר` * 13,כרמית תעשיות ממתקים בעמ,יח`,,1,8.90,6.85
2915,קונפיטורה יד מרדכי תות 250 גר`,שטראוס גרופ בעמ,יח`,,1,14.90,5.96
2916,דנונה פרי בר קורנפלקס,שטראוס גרופ בעמ/מצונן,יח`,,1,4.40,2.51
2917,משקה יוגורט תות בננה גמדים (100x8 מל),שטראוס גרופ בעמ/מצונן,יח`,,1,20,2.50
2918,דני שמיניה,שטראוס גרופ בעמ/מצונן,יח`,,1,16.40,16.40
2919,סרקל מתיר קשרים זוגות.,פישר תעשיות פרמצבטיות בעמ,יח`,,1,34.90,34.90
2920,קיסמי שיניים לבנבנים 200 יח`,קונסיגנציה- ש. י גיספאן 1993,יח`,,1,12.90,12.90
2921,גרנולה תמרים 400 גר` מנדל,גורי מוצרי צריכה (1991) בעמ,יח`,,1,17.90,4.48
2922,טחינה ירושלים 500 גר`,תה ויסוצקי (ישראל) בעמ,יח`,,1,15.90,3.18
2923,נובי כוס ומכסה 6 יח`,אינטרסן 1996 בעמ,יח`,,1,29.90,29.90
2924,צימרוני אוזניים מעץ אינטרסן (300),אינטרסן 1996 בעמ,יח`,,1,4,0.01
2925,שעועית ירוקה שלמה 800 גר`,נ.ת.נ.ג.ב החזקות יעוץ וניהול ב,יח`,,1,6.80,0.85
2926,שעועית חתוכה צהובה,נ.ת.נ.ג.ב החזקות יעוץ וניהול ב,יח`,,1,6.80,0.85
2927,אפונה קפוא 800 גר`,נ.ת.נ.ג.ב החזקות יעוץ וניהול ב,יח`,,1,9.90,1.24
2928,אפונה וגזר 800 גר`,נ.ת.נ.ג.ב החזקות יעוץ וניהול ב,יח`,,1,9.90,1.24
2929,לקט ירקות 800 גר` קפוא,נ.ת.נ.ג.ב החזקות יעוץ וניהול ב,יח`,,1,9.90,1.24
2930, שיפוד*עבה* 30 סמ-חדש ,מ.א.ייצור ויבוא מטליות בעמ,יח`,,1,4.90,4.90
2931,מברשת אבק,מ.א.ייצור ויבוא מטליות בעמ,יח`,,1,14.90,14.90
2932,מיקרופייבר  לרצפות- shiny,מ.א.ייצור ויבוא מטליות בעמ,יח`,,1,9.90,9.90
2933,4 כרות פלדה מתכת shiny,מ.א.ייצור ויבוא מטליות בעמ,יח`,,1,5.90,5.90
2934,גליל מטליות צהוב 40 יח shiny,מ.א.ייצור ויבוא מטליות בעמ,יח`,,1,16.90,16.90
2935,4 מטליות מיקרו לניקוי כללי shiny,מ.א.ייצור ויבוא מטליות בעמ,יח`,,1,6.90,6.90
2936,כף אשפה עם גומי,מ.א.ייצור ויבוא מטליות בעמ,יח`,,1,5.90,5.90
2937,דלי איטלקי עם פיה יוגב,מ.א.ייצור ויבוא מטליות בעמ,יח`,,1,11.90,11.90
2938,שקיות אוכל מנייר 100 יח`,מ.א.ייצור ויבוא מטליות בעמ,יח`,,1,11.90,0.12
2939,אטבי כביסה דולפין גדולים 20 יח`,מ.א. מטליות - המותג,יח`,,1,7.90,0.40
2940,מטאטא משובח+מקל ,מ.א.ייצור ויבוא מטליות בעמ,יח`,,1,31.90,31.90
2941,מטליות מיקרו רצפה שלישייה shiny,מ.א.ייצור ויבוא מטליות בעמ,יח`,,1,19.90,19.90
2942,מטליות מיקרו לניקוי כללי מעוצבות shiny,מ.א.ייצור ויבוא מטליות בעמ,יח`,,1,7.90,7.90
2943,להבונים טיפ טופ פאלאס (50),פאלאס תעשיות נטו (2014) בעמ,יח`,,1,9.90,0.20
2944,פנינה אל סבון 1 ליטר ירוק,פנינה רוזנבלום בעמ,יח`,,1,10.90,10.90
2945,פנינה אל סבון 1 ליטר לבן,פנינה רוזנבלום בעמ,יח`,,1,10.90,10.90
2946,קרם ידיים אפקטיב קר,פישר תעשיות פרמצבטיות בעמ,יח`,,1,18.90,12.60
2947,קרם ידיים אפקטיב קר,פישר תעשיות פרמצבטיות בעמ,יח`,,1,18.90,12.60
2948,אפקטיב קר קרם גוף 700 מל,פישר תעשיות פרמצבטיות בעמ,יח`,,1,29.90,4.27
2949,אפקטיב קר קרם גוף 700 מל,פישר תעשיות פרמצבטיות בעמ,יח`,,1,29.90,4.27
2950,מארז 6 לחמניות ללא גלוטן,מאפיית אריאל בעמ,יח`,,1,14.90,14.90
2951,בורקס תפוא כשלפ 600 ג,מאפיית אריאל בעמ,יח`,,1,20.90,3.48
2952,פיתות במרקם מיוחד פיתה אקספרס) (8,מגוון שיווק והפצת מאפים בעמ,יח`,,1,9.90,1.24
2953,פיתות בריבוע חיטה מלאה פיתה אקספרס) (8,מגוון שיווק והפצת מאפים בעמ,יח`,,1,12,1.50
2954,מארז פיתה קלה 79 קלוריות,מגוון שיווק והפצת מאפים בעמ,יח`,,1,12.50,12.50
2955,פיתות מכוסמין מלא פיתה אקספרס) (8,מגוון שיווק והפצת מאפים בעמ,יח`,,1,14.90,14.90
2956,בונזו גוי עצם פריכים,שחורי אריה ואנסטסיה,יח`,,1,13.90,15.44
2957,אגו טבלאות שוקולד לבן 85 גר` שלישייה,כרמית תעשיות ממתקים בעמ,יח`,,1,11.90,4.67
2958,שוקולד מריר פרווה ללא סוכר 85 גרם,כרמית תעשיות ממתקים בעמ,יח`,,1,5.90,6.94
2959,שוקולד חלבי ללא סוכר 85 גרם,כרמית תעשיות ממתקים בעמ,יח`,,1,5.90,6.94
2960,סטיביה מרמולייט (100),דנשר (1963) בעמ,יח`,,1,27.90,0.28
2961,טואלט דאק 750 מל זוג,דנשר (1963) בעמ,יח`,,1,18.90,1.26
2962,די לואיג`י רוסו דולצ`ה 750 מל למברוסקו,הכרם - משקאות חריפים בעמ,יח`,,1,29.90,3.95
2963,למברוסקו די לואיג`י קאוויקיולי (750 מל),הכרם - משקאות חריפים בעמ,יח`,,1,29.90,3.95
2964,כפפות אלוורה קטן סנו סושי,החברה הדרומית לשיווק בעמ,יח`,,1,12.90,12.90
2965,מטבוחה אחלה (500 גרם),שטראוס גרופ בעמ/מצונן,יח`,,1,14.90,2.98
2966,קוטג` 3% מועשר 250 גר`,החב` המרכזית - טרה,יח`,,1,5.30,2.12
2967,גבינה לבנה 3% 250 גר` פיקוח,החב` המרכזית - טרה,יח`,,1,4.75,1.90
2968,קוקה קולה זירו שישיה 1.75,החברה המרכזית להפצת משקאות בעמ,יח`,,1,35,3.33
2969,פחית קולה סליק קוקה-קולה (330 מל),החברה המרכזית להפצת משקאות בעמ,יח`,,1,4.50,1.27
2970,פחית זירו סליק קוקה-קולה (330 מל),החברה המרכזית להפצת משקאות בעמ,יח`,,1,4.50,1.27
2971,תה קר בטעם אפרסק פיוז-טי (1.5 ליטר),החברה המרכזית להפצת משקאות בעמ,יח`,,1,7.20,0.48
2972,שישית פחיות קוקה קולה פרידג`פק,החברה המרכזית להפצת משקאות בעמ,יח`,,1,19.90,9.14
2973,שישיית פחיות קוקה קולה זירו,החברה המרכזית להפצת משקאות בעמ,יח`,,1,19.90,9.14
2974,שוופס סודה לימון 1.5 ליטר,יפאורה,יח`,,1,3.90,2.60
2975,קריסטל 2 ליטר אשכוליות מוגז,יפאורה,יח`,,1,3.80,1.90
2976,מי סודה בטעם לימון שוופס (1.5x4 ליטר),יפאורה,יח`,,1,11,1.83
2977,שוופס מוגז עדין 1.5 ליטר תפוח ליים,יפאורה,יח`,,1,6.90,0.46
2978,שוופס מוגז עדין 1.5 ליטר פירות יער,יפאורה,יח`,,1,6.90,0.46
2979,משקה מוגז עדין אפרסק שוופס (1.5 ליטר),יפאורה,יח`,,1,6.90,0.46
2980,תה קר אפרסק ספרינג (1.5 ליטר),יפאורה,יח`,,1,6.40,4.27
2981,תה ירוק לימון לואיזה ספרינג (1.5 ליטר),יפאורה,יח`,,1,6.40,4.27
2982,ספרינג תה קר 0.5 ליטר אפרסק,יפאורה,יח`,,1,5,0.94
2983,שוופס מוגז עדין 1.5 ליטר ענבים ריזלינג,יפאורה,יח`,,1,6.90,0.46
2984,משקה קל תפוחים תפוזינה (1.5 ליטר),יפאורה,יח`,,1,6.50,0.43
2985,RC NO SUGAR בודד 1.5,יפאורה,יח`,,1,4.30,2.87
2986,לאבנה אבו גוש 200 גר,הגבינות של ניצן,יח`,,1,13.90,6.95
2987,שטראוס קרמיסימו בטעמי 3 שוקלד,גלידות שטראוס בעמ,יח`,,1,18.90,14.21
2988,זיקוקים 6 יח בשקית 15 סמ,שמחה זה אנחנו בעמ,יח`,,1,14.90,14.90
2989,סלרי עלים מהדרין,א.אדמה (2007) בעמ,יח`,,1,6,6
2990,בצל ירוק מהדרין,א.אדמה (2007) בעמ,יח`,,1,5.90,5.90
2991,תחליב רחצה לבנדר נקה  (17 ליטר),החברה הדרומית לשיווק בעמ,יח`,,1,12.90,12.90
2992,סבון מוצק נקה 7 רביעייה,החברה הדרומית לשיווק בעמ,יח`,,1,11.90,2.98
2993,סבון מוצק נקה 7 רביעייה,החברה הדרומית לשיווק בעמ,יח`,,1,11.90,2.98
2994,סבון מוצק ארומה נקה 7 רביעייה,החברה הדרומית לשיווק בעמ,יח`,,1,11.90,2.98
2995,סבון מוצק לחות נקה 7 רביעייה,החברה הדרומית לשיווק בעמ,יח`,,1,11.90,2.98
2996,סבון מוצק נקה 7 רביעייה,החברה הדרומית לשיווק בעמ,יח`,,1,11.90,2.98
2997,תה קמומיל ונענע ויסוצקי הגן הקסום) (25,תה ויסוצקי (ישראל) בעמ,יח`,,1,17.50,46.67
2998,גרנולה אגוזים 500 גר,משה סידס ובנו בעמ,יח`,,1,13,2.60
2999,גרנולה פקאן 500 גר,משה סידס ובנו בעמ,יח`,,1,13,2.60
3000,מוזלי קראנצ`י שקדים ואגוזים גרין (1 קג),משה סידס ובנו בעמ,יח`,,1,25.90,25.90
3001,גרין מוזלי תפוחים חמניות וקינמון 1 קג,משה סידס ובנו בעמ,יח`,,1,25.90,25.90
3002,גרין מוזלי אגוזים ושקדים מופחת שומן 1 ק,משה סידס ובנו בעמ,יח`,,1,25.90,2.59
3003,סודה לימון ליים 1.5בודד,טמפו משקאות בעמ,יח`,,1,4,2.67
3004,סודה לימון ליים 1.5 רביעייה,טמפו משקאות בעמ,יח`,,1,10.90,1.82
3005,בירה שנדי תפוח מכבי (330x6 מל),טמפו משקאות בעמ,יח`,,1,36.90,1.77
3006,בירה שנדי אפרסק מכבי (330x6 מל),טמפו משקאות בעמ,יח`,,1,36.90,1.77
3007,לחם שיפון 550 גר`,מאפיית דואט בעמ,יח`,,1,10.90,1.98
3008,לחם דגנים 630 גר`,מאפיית דואט בעמ,יח`,,1,10.90,1.73
3009,מארז לחמניות 450  גר`דואט,מאפיית דואט בעמ,יח`,,1,10.90,10.90
3010,לחם מרוקאי מסורתי 550 גר`,מאפיית דואט בעמ,יח`,,1,12.90,2.35
3011,לחם בריאות 630 גר`,מאפיית דואט בעמ,יח`,,1,10.90,1.73
3012,לחם שיפון  (900100%  גר`),מאפיית דואט בעמ,יח`,,1,14.90,1.66
3013,נייר אכיל בוב ספוג,שמחה זה אנחנו בעמ,יח`,,1,17.90,137.69
3014,צ`יפס אמריקאי 1.5  קג`פרי גליל,ויטה -פרי גליל (החדשה) בעמ,יח`,,1,14.90,0.99
3015,צ`יפס בטטה 700 גר` פרי גליל,ויטה -פרי גליל (החדשה) בעמ,יח`,,1,16.90,2.41
3016,דניאלה מעדן בטעם בננה שטראוס (88 גרם),שטראוס גרופ בעמ/מצונן,יח`,,1,4,2.67
3017,גבינת  קוטג`5% שטראוס (250 גרם),שטראוס גרופ בעמ/מצונן,יח`,,1,5.90,2.36
3018,עלים לקרמשניט 300 גר`,דנשר (1963) בעמ,יח`,,1,17.90,5.97
3019,בישקוטים ליידיפינגרז בונומי (200 גרם),דנשר (1963) בעמ,יח`,,1,7.90,3.95
3020,מגע המשי רצועות שעווה אלוורה 16יח,דנשר (1963) בעמ,יח`,,1,27.90,1.74
3021,מגע המשי רצועות שעווה אזורים רגישים 12יח,דנשר (1963) בעמ,יח`,,1,27.90,1.74
3022,גלילונית שקיות לסנדוויץ 350 יח,דנשר (1963) בעמ,יח`,,1,10.90,10.90
3023,ריבת חלב דולכור (454 גרם),דנשר (1963) בעמ,יח`,,1,17.90,3.94
3024,ג`ל לאסלה טיפות טל טואלט דאק (55 מל),דנשר (1963) בעמ,יח`,,1,12.90,23.45
3025,אל סבון פמילי שלישייה מעורב פירות,דנשר (1963) בעמ,יח`,,1,15.90,15.90
3026,חטיפים שונים 300 גר`,סוכנויות עמוס ממתקים בעמ,יח`,,1,13.90,4.63
3027,רולים 100 גר` בטעם שוקולד עלמה,רזיט שיווק בעמ,יח`,,1,3.90,3.90
3028,דוחן 500 גר`,מיה תעשיות מזון מ.ת.מ. בעמ,יח`,,1,8.90,1.78
3029,קינואה מיה (500 גרם),מיה תעשיות מזון מ.ת.מ. בעמ,יח`,,1,19.90,3.98
3030,קינואה מיה (1 קג),מיה תעשיות מזון מ.ת.מ. בעמ,יח`,,1,29.90,2.99
3031,ג`לטין טהור 25 גר`,מיה תעשיות מזון מ.ת.מ. בעמ,יח`,,1,11.90,47.60
3032,שעועית לוביה 400 גר`,מיה תעשיות מזון מ.ת.מ. בעמ,יח`,,1,11.90,2.98
3033,שעועית ארגנטינאית מיה (500 גרם),מיה תעשיות מזון מ.ת.מ. בעמ,יח`,,1,11.90,2.38
3034,סוכריות ג`לי 125 גר`,מיה תעשיות מזון מ.ת.מ. בעמ,יח`,,1,6.90,5.52
3035,קמיל בלו מגבונאף דר. פישר (30x3),פישר תעשיות פרמצבטיות בעמ,יח`,,1,24.90,24.90
3036,מאגת חלבה ללא סוכר ווניל,קבוצת אסם סחר שות. מוגבלת,יח`,,1,11.90,11.90
3037,חלבה קלאסית שוקו וניל,קבוצת אסם סחר שות. מוגבלת,יח`,,1,13.90,3.97
3038,מאגדת חלבה פיסטוק,קבוצת אסם סחר שות. מוגבלת,יח`,,1,11.90,11.90
3039,דבש מפרחי בר בלחיץ 650 גר`,שטראוס גרופ בעמ,יח`,,1,34.90,5.37
3040,תחליף חלב שלב 2 חלבי מטרנה (700 גרם),קבוצת אסם סחר שות. מוגבלת,יח`,,1,49.90,7.13
3041,תחליף חלב שלב 3 חלבי מטרנה (700 גרם),קבוצת אסם סחר שות. מוגבלת,יח`,,1,49.90,7.13
3042,תחליף חלב שלב 2 מהדרין מטרנה (700 גרם),קבוצת אסם סחר שות. מוגבלת,יח`,,1,49.90,7.13
3043,דפיוזר מלבני 100ML,מוסקו בעמ,יח`,,1,19.90,19.90
3044,גבינת פטה כבשים 20% גד (250 גרם),מחלבות גד שיווק 1992 בעמ,יח`,,1,25.90,10.36
3045,גבינה בולגרית 5% גד (250 גרם),מחלבות גד שיווק 1992 בעמ,יח`,,1,23.90,9.56
3046,גבינה בולגרית 16% גד (250 גרם),מחלבות גד שיווק 1992 בעמ,יח`,,1,23.90,9.56
3047,בולגרית לסלט 5% 200 גר`,מחלבות גד שיווק 1992 בעמ,יח`,,1,21.90,10.95
3048,פטה עיזים מעודנת 5% גד,מחלבות גד שיווק 1992 בעמ,יח`,,1,30.90,12.36
3049,גבינה בולגרית מעודנת 5% גד (250 גרם),מחלבות גד שיווק 1992 בעמ,יח`,,1,23.90,9.56
3050,גבינת קשקאבל 26% שומן גד (200 גרם),מחלבות גד שיווק 1992 בעמ,יח`,,1,25.90,12.95
3051,גבינה פטה עיזים 20% גד (200 גרם),מחלבות גד שיווק 1992 בעמ,יח`,,1,26.90,13.45
3052,גבינת חלומי 24% מחלב בקר גד (200 גרם),מחלבות גד שיווק 1992 בעמ,יח`,,1,21.90,10.95
3053,גבינת במרקם שמנת 5% טבעי גד,מחלבות גד שיווק 1992 בעמ,יח`,,1,11.90,5.95
3054,לאבנה דרוזית 9% גד (500 גרם),מחלבות גד שיווק 1992 בעמ,יח`,,1,19.90,3.98
3055,גבינת שמנת 30% 200 גר` גד,מחלבות גד שיווק 1992 בעמ,יח`,,1,12.90,6.45
3056,גבינת ניו יורק 30% שום שמיר גד,מחלבות גד שיווק 1992 בעמ,יח`,,1,12.90,6.45
3057,גבינת ריקוטה פרסקה 9% גד (300 גרם),מחלבות גד שיווק 1992 בעמ,יח`,,1,17.90,5.97
3058,חמוציות דל סוכר שקדיה (250 גרם),דין שיווק וקליה בעמ,יח`,,1,14.90,5.96
3059,שיפודי במבוק עבים 75 יח`,אינטרסן 1996 בעמ,יח`,,1,3.90,3.90
3060,מאגדת אקסטרים וניל 6 יח`,נגה גלידות שותפות מוגבלת,יח`,,1,31.90,7.38
3061,אקטימל בטעם תות דנונה (100x14 מל),שטראוס גרופ בעמ/מצונן,יח`,,1,29.90,21.36
3062,גרגרי חומוס מוקפאים 800 גר` פרי גליל,ויטה -פרי גליל (החדשה) בעמ,יח`,,1,9.90,1.24
3063,שעועית לבנה מבושלת קפוא 800 גר` פרי גליל,ויטה -פרי גליל (החדשה) בעמ,יח`,,1,9.90,1.24
3064,קמיל בלו סנסיטיב אל סבון שיבולית שועל 50,פישר תעשיות פרמצבטיות בעמ,יח`,,1,21.90,21.90
3065,קמיל בלו סנסטיב אל סבון,פישר תעשיות פרמצבטיות בעמ,יח`,,1,29.90,29.90
3066,מינוט סלמון 300  גר`.,בלדי בעמ,יח`,,1,39.90,13.30
3067,קרפציו עגל 210  גר`בלדי,בלדי בעמ,יח`,,1,39.90,19
3068,ציפוי בטעם שום לשניצל 400 גר`-המותג,דין שיווק - עטרת,יח`,,1,10.90,2.73
3069,קמח נטול גלוטן-כרגיל  עוגה בטעם וניל 450,תומר יבוא ושיווק מוצרי מזון (1,יח`,,1,15.90,3.53
3070,קמח נטול גלוטן-כרגיל  עוגה בטעעם שוקולד,תומר יבוא ושיווק מוצרי מזון (1,יח`,,1,15.90,3.53
3071,קמח נטול גלוטן-כרגיל  פנקייק 450 גר,תומר יבוא ושיווק מוצרי מזון (1,יח`,,1,15.90,3.53
3072,הפי למקלחון מחליק  מים- שקוף,יעקב יעקבי ובניו בעמ,יח`,,1,20.90,2.79
3073,תירס גמדי תומר (420 גרם),תומר יבוא ושיווק מוצרי מזון (1,יח`,,1,3.90,0.98
3074,פילה אנשובי בשמן תומר (45 גרם),תומר יבוא ושיווק מוצרי מזון (1,יח`,,1,5.90,13.11
3075,מקרל מרוקאי בשמן,תומר יבוא ושיווק מוצרי מזון (1,יח`,,1,3.90,3.12
3076,מקרל מרוקאי חריף,תומר יבוא ושיווק מוצרי מזון (1,יח`,,1,3.90,3.12
3077,מממרח עגבניות פסטו 360  גר`תומר,תומר יבוא ושיווק מוצרי מזון (1,יח`,,1,12.90,3.58
3078,נודלס דק 200  גר`תומר,תומר יבוא ושיווק מוצרי מזון (1,יח`,,1,2.90,1.45
3079,נודלס עבה 200  גר`תומר,תומר יבוא ושיווק מוצרי מזון (1,יח`,,1,2.90,1.45
3080,זיתים סורי ירוק מבוקע 800 גר` סבא חביב,אבאל יזמות בעמ,יח`,,1,19.90,2.49
3081,סנו אנטי קאלק 4ב1 700 מל,החברה הדרומית לשיווק בעמ,יח`,,1,19.90,2.84
3082,סנו מקסימה 4 ליטר ורוד,החברה הדרומית לשיווק בעמ,יח`,,1,19.90,4.98
3083,שכבות ביסקויט ושוקולד במילוי MOOI מואי,דנשר (1963) בעמ,יח`,,1,17.90,9.94
3084,נגיסי אורז לתינוק בטעם בננה,דנשר (1963) בעמ,יח`,,1,13.90,27.80
3085,רייד מכשיר חשמלי +2נוזל,דנשר (1963) בעמ,יח`,,1,44.90,44.90
3086,מסכה לשיער רגיל,פנינה רוזנבלום בעמ,יח`,,1,26.90,6.73
3087,פטרוזיליה מהדרין,א.אדמה (2007) בעמ,יח`,,1,4.90,4.90
3088,כוסברה מהדרין,א.אדמה (2007) בעמ,יח`,,1,4.90,4.90
3089,שמיר מהדרין,א.אדמה (2007) בעמ,יח`,,1,4.90,4.90
3090,נענע מהדרין,א.אדמה (2007) בעמ,יח`,,1,4.90,4.90
3091,חסה מהדרין,א.אדמה (2007) בעמ,יח`,,1,5.90,5.90
3092,סלק עלים מהדרין,א.אדמה (2007) בעמ,יח`,,1,5.90,5.90
3093,בצל ירוק מהדרין,א.אדמה (2007) בעמ,יח`,,1,5.90,5.90
3094,מן ג`ל גילוח לעור רגיל קרמה (200 מל),החברה הדרומית לשיווק בעמ,יח`,,1,16.90,8.45
3095,מברשת פלוס שעון לילדים 4-8 אורביטול,החברה הדרומית לשיווק בעמ,יח`,,1,9.90,9.90
3096,משחת שיניים אורביטול בוב ספוג 70 גרם,החברה הדרומית לשיווק בעמ,יח`,,1,7.90,11.29
3097,מטבוחה מרוקאית רפי כהן צבר (400 גרם),קבוצת אסם סחר שות. מוגבלת,יח`,,1,15.90,3.98
3098,סלט פלפלים רפי כהן צבר (400 גרם),קבוצת אסם סחר שות. מוגבלת,יח`,,1,15.90,3.98
3099,טחינה בלאדי רפי כהן צבר (400 גרם),קבוצת אסם סחר שות. מוגבלת,יח`,,1,15.90,3.98
3100,ביסבול תירס תפוגן (700 גרם),קבוצת אסם סחר שות. מוגבלת,יח`,,1,12.90,1.84
3101,תפוגן ביסבול בצל 700 גר`,קבוצת אסם סחר שות. מוגבלת,יח`,,1,12.90,1.84
3102,שניצל עוף ותירס מאמא עוף (750 גרם),תנובה קפואים,יח`,,1,36,4.80
3103,סנו סושי רדיד אלומיניום,החברה הדרומית לשיווק בעמ,יח`,,1,12.90,12.90
3104,סנומוד מסק,החברה הדרומית לשיווק בעמ,יח`,,1,11.90,7.93
3105,אינסטלטור פותח סתימות סנו (200 גרם),החברה הדרומית לשיווק בעמ,יח`,,1,15.90,7.95
3106,סנו מקסימה 6 קג מאסק,החברה הדרומית לשיווק בעמ,יח`,,1,49.90,0.83
3107,ליסטרין טאגד פלוריד 500 מל,שקד תבל בעמ,יח`,,1,19.90,3.98
3108,זית סורי בתיבול חריף 215 גרם,תה ויסוצקי (ישראל) בעמ,יח`,,1,12.90,6
3109,שום גבישי 120 גר`,תבליני טעם וריח בעמ,יח`,,1,8.90,7.42
3110,מלח לימון 170 גר`,תבליני טעם וריח בעמ,יח`,,1,8.90,5.24
3111,תיבול על האש 100 גר`,תבליני טעם וריח בעמ,יח`,,1,8.90,8.90
3112,תיבול לשווארמה 100 גר`,תבליני טעם וריח בעמ,יח`,,1,8.90,8.90
3113,מגבונים לחים טייגר 72 יח,פאלאס תעשיות נטו (2014) בעמ,יח`,,1,2.90,2.90
3114,מגבונים לחים טייגר חמישייה 72 יח,פאלאס תעשיות נטו (2014) בעמ,יח`,,1,11.90,2.38
3115,אטריות ביצים טעמי אסיה (454 גרם),טעמי אסיה בעמ,יח`,,1,9.90,2.18
3116,צ`ילי חריף 700,טעמי אסיה בעמ,יח`,,1,8.90,1.27
3117,רוטב צ`ילי מתוק טעמי אסיה (700 מל),טעמי אסיה בעמ,יח`,,1,8.90,1.27
3118,רוטב סויה בסגנון יפני 280,טעמי אסיה בעמ,יח`,,1,9.90,3.54
3119,חומץ אורז לבן לסושי טעמי אסיה (250 מל),טעמי אסיה בעמ,יח`,,1,9.90,3.96
3120,אטריות אורז דקות טעמי אסיה (400 גרם),טעמי אסיה בעמ,יח`,,1,9.90,2.48
3121,רוטב חמוץ מתוק 300 מל,טעמי אסיה בעמ,יח`,,1,9.90,3.30
3122,חומץ אורז לסושי 500 מל,טעמי אסיה בעמ,יח`,,1,11.90,2.38
3123,קמח טמפורה כשר מזרח ומערב 500 גר`,טעמי אסיה בעמ,יח`,,1,10.90,2.18
3124,פנקו טעמי אסיה (200 גרם),טעמי אסיה בעמ,יח`,,1,10.90,5.45
3125,רוטב טריאקי טעמי אסיה (300 מל),טעמי אסיה בעמ,יח`,,1,10.90,3.63
3126,חרדל דיגון גרעינים 350 גרם,דיפלומט היינץ,יח`,,1,12.90,3.79
3127,רסק תפוע רביעייה תומר,תומר יבוא ושיווק מוצרי מזון (1,יח`,,1,9.90,2.19
3128,סלמון תומר 213 גר,תומר יבוא ושיווק מוצרי מזון (1,יח`,,1,12.90,6.06
3129,קריספיות,דילייט 2005 בעמ,יח`,,1,11.90,19.83
3130,קריספיות חיטה מלאה,דילייט 2005 בעמ,יח`,,1,13.90,18.53
3131,קריספיות קידס 30 גרם,דילייט 2005 בעמ,יח`,,1,10.90,36.33
3132,טבק לגלגול נקסט פיין (40 גרם),פיליפ מוריס בעמ,יח`,,1,70,70
3133,אל.אמ קצר רד לייבל חפיסה) (20,פיליפ מוריס בעמ,יח`,,1,28,28
3134,אל.אמ בלו לייבל קצר חפיסה) (20,פיליפ מוריס בעמ,יח`,,1,28,28
