,ItemName,ManufactureName,UnitQty,Quantity,QtyInPackage,ItemPrice,UnitOfMeasurePrice
986,אופניימר מרציפן מצופה שוקולד 40 גרם,תה ויסוצקי (ישראל) בעמ,יח`,,1,4.90,4.08
987,משקה קל תפוזים ספרינג (1.5 ליטר),יפאורה,יח`,,1,6.40,0.43
988,משקה קל מנגו ספרינג (1.5 ליטר),יפאורה,יח`,,1,6.40,0.43
989,משקה קל אפרסקים ספרינג (1.5 ליטר),יפאורה,יח`,,1,6.40,0.43
990,ספרינג אשכוליות אננס לייט 1.5 ליטר,יפאורה,יח`,,1,6.40,0.43
991,נייר טואלט לב מולט) (32,קימברלי קלארק ישראל שיווק בעמ,יח`,,1,26.90,1.45
992,נייר טואלט מולט לב אדום 40 גלילים.,קימברלי קלארק ישראל שיווק בעמ,יח`,,1,34.90,0.11
993,חיתולי ליטל בייביס שלב 1 האגיס) (40,קימברלי קלארק ישראל שיווק בעמ,יח`,,1,34.90,34.90
994,מיץ לימון משומר עסיס (1 ליטר),קבוצת אסם סחר שות. מוגבלת,יח`,,1,9.90,9.90
995,חומץ 5% עסיס (1 ליטר),קבוצת אסם סחר שות. מוגבלת,יח`,,1,7.90,7.90
996,בקבוק קוקה-קולה (1.5 ליטר),החברה המרכזית להפצת משקאות בעמ,יח`,,1,6.50,0.43
997,סודה קינלי (1.5 ליטר),החברה המרכזית להפצת משקאות בעמ,יח`,,1,4,2.67
998,בקבוק דיאט קוקה-קולה (1.5 ליטר),החברה המרכזית להפצת משקאות בעמ,יח`,,1,6.50,4.33
999,מי סודה שוופס (1.5 ליטר),יפאורה,יח`,,1,3.50,0.23
1000,כרית יפנית סנו סושי (6),החברה הדרומית לשיווק בעמ,יח`,,1,11.90,1.98
1001,מטלית לכל סנו סושי (9),החברה הדרומית לשיווק בעמ,יח`,,1,11.90,1.32
1002,ניילון נצמד סנו סושי (30x2 מטר),החברה הדרומית לשיווק בעמ,יח`,,1,10.90,10.90
1003,קל רסס וכבס סנו (750 מל),החברה הדרומית לשיווק בעמ,יח`,,1,19.90,3.32
1004,תרסיס רהיט סנו (300 מל),החברה הדרומית לשיווק בעמ,יח`,,1,16.90,5.54
1005,סנובון תות לאסלה סנו (55x3 גרם),החברה הדרומית לשיווק בעמ,יח`,,1,11.90,7.21
1006,סנובון לאסלה לימון סנו (55x3 גרם),החברה הדרומית לשיווק בעמ,יח`,,1,11.90,7.21
1007,סנובון לאסלה לובר סנו (55x3 גרם),החברה הדרומית לשיווק בעמ,יח`,,1,11.90,7.21
1008,סנובון נוזלי 750 מל,החברה הדרומית לשיווק בעמ,יח`,,1,9.90,1.32
1009,אנטי קאלק לאסלה 750 מל,החברה הדרומית לשיווק בעמ,יח`,,1,15.90,2.12
1010,אקונומיקה ז`אוול לימון סנו (1 ליטר),החברה הדרומית לשיווק בעמ,יח`,,1,8.90,8.90
1011,אקונומיקה ז`אוול לימון סנו (4 ליטר),החברה הדרומית לשיווק בעמ,יח`,,1,15.90,0.40
1012,אקונומיקה כחולה סנו (4 ליטר),החברה הדרומית לשיווק בעמ,יח`,,1,10.90,2.73
1013,ז`אוול מרסס לניקוי כללי לבנדר סנו (1 ליט,החברה הדרומית לשיווק בעמ,יח`,,1,19.90,19.90
1014,לימון 2 ליטר JAVEL אקונומיקה,החברה הדרומית לשיווק בעמ,יח`,,1,10.90,5.45
1015,קוטל מעופפים קיי 400 סנו (630 מל),החברה הדרומית לשיווק בעמ,יח`,,1,25,6.25
1016,סנומט 30 טבליות,החברה הדרומית לשיווק בעמ,יח`,,1,14.90,14.90
1017,קוטל חרקים קיי 300 סנו (630 מל),החברה הדרומית לשיווק בעמ,יח`,,1,21.90,3.48
1018,קוטל זבובים יתושים קיי 600 סנו (500 מל),החברה הדרומית לשיווק בעמ,יח`,,1,24,5.05
1019,סנו מקסימה 4 ליטר ורוד פסים,החברה הדרומית לשיווק בעמ,יח`,,1,19.90,4.98
1020,סנו מקסימה 1.25 קג`,החברה הדרומית לשיווק בעמ,יח`,,1,13.90,11.12
1021,סנו ז`אוול מרסס 1 ליטר,החברה הדרומית לשיווק בעמ,יח`,,1,19.90,19.90
1022,סושי שקיות אשפה גדולות 50 יח`,החברה הדרומית לשיווק בעמ,יח`,,1,19.90,19.90
1023,מסיר שומנים פורטה פלוס סנו (750 מל),החברה הדרומית לשיווק בעמ,יח`,,1,16.90,2.25
1024,סנופרש יבש,החברה הדרומית לשיווק בעמ,יח`,,1,12.90,3.44
1025,סנובון נוזלי בניחוח לבנדר סנו (750 מל),החברה הדרומית לשיווק בעמ,יח`,,1,9.90,1.32
1026,פוליויקס 2 ליטר,החברה הדרומית לשיווק בעמ,יח`,,1,22.90,11.45
1027,סנומט דוחה יתושים מילוי סנו) (45,החברה הדרומית לשיווק בעמ,יח`,,1,21.90,21.90
1028,סנו מקסימה 4 ליטר לבן,החברה הדרומית לשיווק בעמ,יח`,,1,19.90,4.98
1029,ג`ל רחצה לגבר אקטיב בלוק קרמה (700 מל),החברה הדרומית לשיווק בעמ,יח`,,1,20.90,2.99
1030,אנטי קלאק מרסס ברזים/ כיורים,החברה הדרומית לשיווק בעמ,יח`,,1,16.90,16.90
1031,אקונומיקה ז`אוול לבנדר סנו (4 ליטר),החברה הדרומית לשיווק בעמ,יח`,,1,15.90,0.40
1032,אקונומיקה ז`אוול סמיכה סנו (4 ליטר),החברה הדרומית לשיווק בעמ,יח`,,1,15.90,0.40
1033,מטלית ריצפה זיגזג סנו סושי (3),החברה הדרומית לשיווק בעמ,יח`,,1,12.90,12.90
1034,סנו מקסימה 1.25 קג`,החברה הדרומית לשיווק בעמ,יח`,,1,13.90,11.12
1035,סנו מקסימה 1.25 קג`,החברה הדרומית לשיווק בעמ,יח`,,1,13.90,11.12
1036,סנו מקסימה 2.5 קג`,החברה הדרומית לשיווק בעמ,יח`,,1,24.90,9.96
1037,שקיות אשפה לפח 65x54 סנו סושי (60),החברה הדרומית לשיווק בעמ,יח`,,1,22.90,22.90
1038,שקיות סנדביצ`ים סנו סושי (150x2),החברה הדרומית לשיווק בעמ,יח`,,1,13.90,13.90
1039,רב מגבת ג`מבו סנו סושי,החברה הדרומית לשיווק בעמ,יח`,,1,24.90,6.38
1040,סושי רדיד אלומיניום צמד,החברה הדרומית לשיווק בעמ,יח`,,1,12.90,12.90
1041,סנו סושי - רדיד אלומיניום צמד 7.5*45,החברה הדרומית לשיווק בעמ,יח`,,1,16.90,16.90
1042,נוזל לניקוי אסלה 00 סנו (750x2 מל),החברה הדרומית לשיווק בעמ,יח`,,1,16.90,11.27
1043,ספוגיות אל חלד סנו) (3,החברה הדרומית לשיווק בעמ,יח`,,1,10.90,10.90
1044,טבעול-שניצל תירס 750 גרם,קבוצת אסם סחר שות. מוגבלת,יח`,,1,24.90,3.32
1045,שעועית לבנה אפויה,ויטה -פרי גליל (החדשה) בעמ,יח`,,1,5.90,1.07
1046,חומוס שלם A2,ויטה -פרי גליל (החדשה) בעמ,יח`,,1,5.90,0.98
1047,רביעיות סלט טונה 160  גר`יונה,סטארקיסט דיפלומט היינץ,יח`,,1,17.90,2.80
1048,אפונה גדולה A2,ויטה -פרי גליל (החדשה) בעמ,יח`,,1,5.90,0.98
1049,אפונה וגזר A2,ויטה -פרי גליל (החדשה) בעמ,יח`,,1,5.90,1.07
1050,תירס גרעינים 550 גר`,ויטה -פרי גליל (החדשה) בעמ,יח`,,1,5.90,1.07
1051,עוגיות גרנולה בטעם שוקולד מן (250 גרם),רוקחמן בעמ,יח`,,1,7.90,2.63
1052,וופלים מקמח חיטה מלאה מן,רוקחמן בעמ,יח`,,1,5.90,1.18
1053,וופל שוקולד מן (200 גרם),רוקחמן בעמ,יח`,,1,4.90,2.45
1054,וופלים לימון מן (200 גרם),רוקחמן בעמ,יח`,,1,4.90,2.45
1055,וופלים 200 גר` קפה מן,רוקחמן בעמ,יח`,,1,4.90,2.45
1056,ופל מן מצופה 250 גר מן,רוקחמן בעמ,יח`,,1,5.90,2.36
1057,וופל 180 גר` חלבה מן,רוקחמן בעמ,יח`,,1,4.90,2.72
1058,וופלים מצופים מן (1 קג),רוקחמן בעמ,יח`,,1,22.90,22.90
1059,וופל אגוזית 10יח*28גר מן,רוקחמן בעמ,יח`,,1,10.90,3.89
1060,וופל בטעם שוקולד 10יח*21גר מן,רוקחמן בעמ,יח`,,1,7.90,3.76
1061,ופלים מצופים מן (22x10 גרם),רוקחמן בעמ,יח`,,1,7.90,3.95
1062,וופל שוקולד מן (500 גרם),רוקחמן בעמ,יח`,,1,8.90,1.78
1063,וופלים 500 גר לימון מן,רוקחמן בעמ,יח`,,1,8.90,1.78
1064,עוגיות חיטה מלאה מן (300 גרם),רוקחמן בעמ,יח`,,1,6.90,2.30
1065,עוגיות כוכבים בטעם שוקולד מן (300 גרם),רוקחמן בעמ,יח`,,1,6.90,2.30
1066,עוגיות חיטה מלאה בטעם חלווה 250 גרם,רוקחמן בעמ,יח`,,1,6.90,2.76
1067,ופלים ללא תוספת סוכר בטעם שוקולד,רוקחמן בעמ,יח`,,1,7.90,4.39
1068,ופלים ללא תוספת סוכר בטעם וניל,רוקחמן בעמ,יח`,,1,7.90,4.39
1069,עוגיות גרנולה ללא תוספת סוכר,רוקחמן בעמ,יח`,,1,8.90,4.45
1070,חברים זהבה 3 דובים שוקו,קבוצת אסם סחר שות. מוגבלת,יח`,,1,7.90,3.16
1071,נקניקיות ביס יחיעם (380 גרם),מעדני יחיעם (1993) בעמ,יח`,,1,10.90,2.87
1072,כתף בקר מפולפל 150  גר`יחיעם,מעדני יחיעם (1993) בעמ,יח`,,1,24.90,16.60
1073,סלמי סרוולט יחיעם (250 גרם),מעדני יחיעם (1993) בעמ,יח`,,1,34.90,13.96
1074,נקניקיות וינר 1 קג,מעדני יחיעם (1993) בעמ,יח`,,1,19.90,1.99
1075,קבנוס קלאסי יחיעם (125 גרם),מעדני יחיעם (1993) בעמ,יח`,,1,12.90,10.32
1076,פפסי קולה שישייה 1.5 ליטר,טמפו משקאות בעמ,יח`,,1,24.90,24.90
1077,מי סודה טמפו (1.5 ליטר),טמפו משקאות בעמ,יח`,,1,3,0.20
1078,טבעות בצל תפוגן (700 גרם),קבוצת אסם סחר שות. מוגבלת,יח`,,1,16.90,2.41
1079,אמריקן צ`יפס תפוגן (1.5 קג),קבוצת אסם סחר שות. מוגבלת,יח`,,1,27.90,18.60
1080,משחת כלים קלין 500 גר`,יוניליוור ישראל שיווק בעמ,יח`,,1,9.90,1.98
1081,מרכך כביסה כחול בדין (4 ליטר),יוניליוור ישראל שיווק בעמ,יח`,,1,19.90,4.98
1082,תה ירוק עלים ויסוצקי (125 גרם),תה ויסוצקי (ישראל) בעמ,יח`,,1,14.90,11.92
1083,תה ארל גריי 200 גר`,תה ויסוצקי (ישראל) בעמ,יח`,,1,31.90,15.95
1084,תה מעודן ויסוצקי) (25,תה ויסוצקי (ישראל) בעמ,יח`,,1,6.90,27.60
1085,תה מעודן ויסוצקי (100),תה ויסוצקי (ישראל) בעמ,יח`,,1,16.90,16.90
1086,תה קלאסיק ויסוצקי) (25,תה ויסוצקי (ישראל) בעמ,יח`,,1,7.30,19.47
1087,תה קלאסיק ויסוצקי (100),תה ויסוצקי (ישראל) בעמ,יח`,,1,16.90,11.27
1088,תה ארל גריי ויסוצקי) (25,תה ויסוצקי (ישראל) בעמ,יח`,,1,15.90,42.40
1089,תה נענע ויסוצקי) (25,תה ויסוצקי (ישראל) בעמ,יח`,,1,16.90,45.07
1090,תה אפרסק ויסוצקי) (25,תה ויסוצקי (ישראל) בעמ,יח`,,1,16.90,33.80
1091,תה קמומיל בבונג ויסוצקי הגן הקסום) (50,תה ויסוצקי (ישראל) בעמ,יח`,,1,33.90,45.20
1092,תה הילולי פירות ויסוצקי הגן הקסום) (25,תה ויסוצקי (ישראל) בעמ,יח`,,1,17.50,28
1093,תה פירות היער ויסוצקי הגן הקסום) (25,תה ויסוצקי (ישראל) בעמ,יח`,,1,17.50,25.93
1094,תה קמומיל ויסוצקי הגן הקסום) (25,תה ויסוצקי (ישראל) בעמ,יח`,,1,17.50,46.67
1095,הגן הקסום ורד הבר 25 שקיקים,תה ויסוצקי (ישראל) בעמ,יח`,,1,17.50,23.33
1096,תה לואיזה וורבנה ויסוצקי הגן הקסום) (25,תה ויסוצקי (ישראל) בעמ,יח`,,1,17.50,35
1097,תה נענע ויסוצקי (50),תה ויסוצקי (ישראל) בעמ,יח`,,1,29.90,39.87
1098,תה ירוק נענע ויסוצקי (25),תה ויסוצקי (ישראל) בעמ,יח`,,1,24.90,66.40
1099,תה ירוק לימונית ולואיזה ויסוצקי (25),תה ויסוצקי (ישראל) בעמ,יח`,,1,24.90,66.40
1100,סלסולי כתף בקר 120 גר` טירת צבי,תנובה קפואים,יח`,,1,15.90,13.25
1101,סלסולי סלמי איטלקי 120 גר` טירת צבי,תנובה קפואים,יח`,,1,15.90,13.25
1102,נקניקיות עוף טירת צבי (1 קג),תנובה קפואים,יח`,,1,22.90,22.90
1103,נקניקיות עוף טירת צבי (400 גרם),תנובה קפואים,יח`,,1,13.90,3.48
1104,צמד כפרי 800 גר` טירת צבי,תנובה קפואים,יח`,,1,34.90,4.36
1105,בוטנים מטוגנים קליית גת (200 גרם),ליימן שליסל בעמ,יח`,,1,7.90,3.95
1106,נאש צ אנס שקית 200 גר,ליימן שליסל בעמ,יח`,,1,8.90,4.45
1107,גרעיני אבטיח 200  גר`גת,ליימן שליסל בעמ,יח`,,1,13.90,6.95
1108,לחם אחיד פרוס (750 גרם פיקוח,שלמה א. אנג`ל בעמ,יח`,,1,6.60,0.88
1109,לחם עינן קל פרוס אנג`ל (500 גרם),שלמה א. אנג`ל בעמ,יח`,,1,14.80,2.96
1110,לחם שחור פיקוח,שלמה א. אנג`ל בעמ,יח`,,1,3.90,0.52
1111,חלה רגילה אנג`ל/דגנית (500 גרם) מובי,שלמה א. אנג`ל בעמ,יח`,,1,4.45,0.89
1112,חלה קלועה,שלמה א. אנג`ל בעמ,יח`,,1,4.40,0.88
1113,חלה עגולה אנג`ל,שלמה א. אנג`ל בעמ,יח`,,1,4.40,0.88
1114,יוגורט ביו 3% דנונה (200 גרם),שטראוס גרופ בעמ/מצונן,יח`,,1,3.40,1.70
1115,דנונה פרי בר פיצפוצים,שטראוס גרופ בעמ/מצונן,יח`,,1,4.40,2.54
1116,נוזל לניקוי אסלות 00 סנו (1 ליטר),החברה הדרומית לשיווק בעמ,יח`,,1,8.90,8.90
1117,ממרח בטעם שוקולד השחר העולה (500 גרם),השחר העולה תעשית ממתקים בעמ,יח`,,1,12.90,2.58
1118,ממרח בטעם שוקולד השחר העולה (1 קג),השחר העולה תעשית ממתקים בעמ,יח`,,1,23.90,23.90
1119,ממרח פרווה 1 קג` השחר,השחר העולה תעשית ממתקים בעמ,יח`,,1,22.90,22.90
1120,ממרח חצי חצי 350 גר` השחר,השחר העולה תעשית ממתקים בעמ,יח`,,1,11.90,3.40
1121,ממרח נוגט אגוזים 350 גר` השחר,השחר העולה תעשית ממתקים בעמ,יח`,,1,12.90,3.69
1122,קפה שחור קפה לנדוור (100 גרם),קבוצת אסם סחר שות. מוגבלת,יח`,,1,7.90,7.90
1123,קפה לנדוור לבוקר שלישיה,קבוצת אסם סחר שות. מוגבלת,יח`,,1,22.90,7.63
1124,פופקורן פופסטאר חמישייה טבעי,דנשר (1963) בעמ,יח`,,1,16.90,3.38
1125,פופקורן פופסטאר חמישייה חמאה,דנשר (1963) בעמ,יח`,,1,16.90,3.38
1126,נרות שבת 4  יח`פאלאס,פאלאס תעשיות נטו (2014) בעמ,יח`,,1,3.90,2.79
1127,נר זכרון 48 שעות פאלאס,פאלאס תעשיות נטו (2014) בעמ,יח`,,1,5.90,5.90
1128,נר זכרון לשבוע נר ציון,פאלאס תעשיות נטו (2014) בעמ,יח`,,1,11.90,11.90
1129,נריות בפלסטיק 5 שעות 72 יח,פאלאס תעשיות נטו (2014) בעמ,יח`,,1,24.90,24.90
1130,משקה אורנג` מירנדה (1.5 ליטר),טמפו משקאות בעמ,יח`,,1,5.90,0.39
1131,פמינה 220 מל,גורי ע.ע.ע בעמ,יח`,,1,22.90,10.41
1132,תרכיז 1.2 ליטר,בטר אנד דיפרנט בעמ,יח`,,1,32.90,2.74
1133,חמאת בוטנים מתוקה בי & די (350 גרם),בטר אנד דיפרנט בעמ,יח`,,1,12.90,3.69
1134,שמרים טריים שמרית (50 גרם),שטראוס גרופ בעמ/מצונן,יח`,,1,4.50,9
1135,מרגרינה בטעם חמאה -שמרית,שטראוס גרופ בעמ/מצונן,יח`,,1,4.90,2.45
1136,בייגלה אחד אחד 400 גר`,יוניליוור ישראל שיווק בעמ,יח`,,1,10.90,2.73
1137,גדול גדול 400,יוניליוור ישראל שיווק בעמ,יח`,,1,12.90,3.23
1138,קוקטייל זיתים בית השיטה (560 גרם),קבוצת אסם סחר שות. מוגבלת,יח`,,1,11.90,2.13
1139,זיתים מושחרים טבעות בית השיטה (560 גרם),קבוצת אסם סחר שות. מוגבלת,יח`,,1,10.90,1.95
1140,מלפפון במלח 10-12 A2,קבוצת אסם סחר שות. מוגבלת,יח`,,1,7.90,1.46
1141,מלפפון במלח 13-17 A2,קבוצת אסם סחר שות. מוגבלת,יח`,,1,9.90,3.09
1142,מלפפון במלח 18-25 A2,קבוצת אסם סחר שות. מוגבלת,יח`,,1,10.90,2.84
1143,מלפפון במלח בלאדי 13-17,קבוצת אסם סחר שות. מוגבלת,יח`,,1,9.90,2.91
1144,חומוס צבר סמיר הגדול,קבוצת אסם סחר שות. מוגבלת,יח`,,1,13.90,3.48
1145,מלפפון בחומץ 10-12 A2,קבוצת אסם סחר שות. מוגבלת,יח`,,1,7.90,2.72
1146,מלפפון בחומץ 13-17 A2,קבוצת אסם סחר שות. מוגבלת,יח`,,1,9.90,3.09
1147,מלפפון בחומץ 18-25 A2,קבוצת אסם סחר שות. מוגבלת,יח`,,1,10.90,3.41
1148,חומוס צבר אבו מרוואן,קבוצת אסם סחר שות. מוגבלת,יח`,,1,13.90,3.48
1149,פלפל חריף כבוש שיפקה בית השיטה (560 גרם),קבוצת אסם סחר שות. מוגבלת,יח`,,1,6.90,3
1150,חלב 3% בשקית טרה (1  ליטר)פיקוח,החב` המרכזית - טרה,יח`,,1,5.17,5.17
1151,חלב 1% בקרטון טרה (1  ליטר)פ,החב` המרכזית - טרה,יח`,,1,5.59,5.59
1152,שמנת חמוצה 15% טרה (200 מל),החב` המרכזית - טרה,יח`,,1,2.28,1.14
1153,גבינה לבנה 5% 250 גר` פיקוח,החב` המרכזית - טרה,יח`,,1,4.75,1.90
1154,גבינת טוב טעם,החב` המרכזית - טרה,יח`,,1,10.90,4.36
1155,גבינה צהובה מגורדת 28% נעם (500 גרם),החב` המרכזית - טרה,יח`,,1,32.90,6.58
1156,שיבולת שועל קוואקר (500 גרם),שטראוס פריטו ליי בעמ,יח`,,1,11.90,2.38
1157,10 פיתות בטעם ביתי דגנית עין בר,דגנית עין בר תעשיות מזון ואפיה,יח`,,1,9.90,0.99
1158,לחמניות חיטה מלאה דגנית עין בר (10),דגנית עין בר תעשיות מזון ואפיה,יח`,,1,11.90,1.59
1159,לחמניות אצבע דגנית עין בר (10),דגנית עין בר תעשיות מזון ואפיה,יח`,,1,11.90,1.59
1160,קוקי ענק שקיות צליה 5 יח,ש.שסטוביץ בעמ,יח`,,1,12.90,12.90
1161,עלית הארק יקב הגליל (700 מל),יקב הגליל שיווק בעמ,יח`,,1,59.90,7.95
1162,רוטב פטריות אסם (30 גרם),קבוצת אסם סחר שות. מוגבלת,יח`,,1,4.90,16.33
1163,לחם אקטיב ברמן (750 גרם),י.את א. ברמן בעמ,יח`,,1,14.90,1.99
1164,לחם אחיד כהה פרוס ברמן (750  גרם)פי,י.את א. ברמן בעמ,יח`,,1,6.60,0.88
1165,פיתות אסלי ברמן) (5,י.את א. ברמן בעמ,יח`,,1,6.90,1.38
1166,לחמניות שישייה,י.את א. ברמן בעמ,יח`,,1,7.90,1.76
1167,לחם קל ברמן לענין קמח חיטה מלאה,י.את א. ברמן בעמ,יח`,,1,12.90,1.72
1168,לחם ברמן לעניין פרוס ברמן (750 גרם),י.את א. ברמן בעמ,יח`,,1,12.90,1.72
1169,דגני קלות פרוס ברמן (500 גרם),י.את א. ברמן בעמ,יח`,,1,12.90,2.58
1170,לחם מקמח מלא 750  גר`E FREE ברמן,י.את א. ברמן בעמ,יח`,,1,14.90,1.99
1171,לחמניה רגילה,י.את א. ברמן בעמ,יח`,,1,1.90,2.53
1172,לחם כהה פיקוח,י.את א. ברמן בעמ,יח`,,1,3.90,0.52
1173,חלה רגילה (500 גרם) פיקוח,י.את א. ברמן בעמ,יח`,,1,4.45,0.89
1174,חלה מתוקה,י.את א. ברמן בעמ,יח`,,1,8.90,1.78
1175,סוכרזית פטריה) (300,שטראוס גרופ בעמ,יח`,,1,7.90,3.21
1176,סוכרזית פטנט) (700,שטראוס גרופ בעמ,יח`,,1,15.90,2.77
1177,סבון לשטיפה אינטימית קליאו (500 מל),שקד תבל בעמ,יח`,,1,9.90,1.98
1178,יין אדום יבש של סגל (750 מל),טמפו משקאות בעמ,יח`,,1,21,2.76
1179,מרום גליל סינגל קברנה סובניון 750 מל,טמפו משקאות בעמ,יח`,,1,39.90,5.28
1180,מרום גליל סינגל מרלו 750מל,טמפו משקאות בעמ,יח`,,1,39.90,5.28
1181,מלח ים יבש מלח הארץ (250 גרם),תה ויסוצקי (ישראל) בעמ,יח`,,1,5.90,2.95
1182,מיץ תפוזים סחוט טבעי פרימור (1 ליטר),שטראוס גרופ בעמ/מצונן,יח`,,1,16.20,16.20
1183,נקניק סלמי מעושן 7000 זוגלובק (600 גרם),זוגלובק שיווק בעמ,יח`,,1,34.90,4.36
1184,נקניק סלמי בשן זוגלובק (470 גרם),זוגלובק שיווק בעמ,יח`,,1,28.90,4.13
1185,המבורגר זהב,זוגלובק שיווק בעמ,יח`,,1,19.90,4.98
1186,נקניקיות וניר 1 קג` זוגלובק,זוגלובק שיווק בעמ,יח`,,1,29.90,29.90
1187,גוליבר חריפות 400 גר` זוגלובק,זוגלובק שיווק בעמ,יח`,,1,17.90,4.48
1188,מארז פסטרמה חרמון+תה,זוגלובק שיווק בעמ,יח`,,1,33.90,4.24
1189,סטייק בורגר,זוגלובק שיווק בעמ,יח`,,1,19.90,4.98
1190,בורקס גבינה זוגלובק (16 יח` - 800 גרם),זוגלובק שיווק בעמ,יח`,,1,19.90,2.49
1191,נקנקיות חריפות 1,זוגלובק שיווק בעמ,יח`,,1,32.90,32.90
1192,בצק עלים זוגלובק,זוגלובק שיווק בעמ,יח`,,1,19.90,19.90
1193,טבע נקניקיה זוגלובק (1 קג),זוגלובק שיווק בעמ,יח`,,1,39.90,39.90
1194,נקניקיות עוף זוגלובק (400 גרם),זוגלובק שיווק בעמ,יח`,,1,13.90,3.48
1195,נקניקיות עוף זוגלובק (1 קג),זוגלובק שיווק בעמ,יח`,,1,29.90,29.90
1196,תה מעושן 200,זוגלובק שיווק בעמ,יח`,,1,14.90,7.45
1197,סטייק בורגר 400 גר` טיבונוויל,נטו מלינדה סחר בעמ,יח`,,1,20.90,5.23
1198,בשר עוף קפוא טחון טיבון ויל (500 גרם),נטו מלינדה סחר בעמ,יח`,,1,12.90,2.58
1199,בשר הודו קפוא טחון טיבון ויל (500 גרם),נטו מלינדה סחר בעמ,יח`,,1,12.90,2.58
1200,בשר טחון-טיבון,נטו מלינדה סחר בעמ,יח`,,1,26.90,5.38
1201,מעדן חלב מלבי גד (160 גרם),מחלבות גד שיווק 1992 בעמ,יח`,,1,5.60,3.50
1202,גבינה מוצרלה 22% גד (180 גרם),מחלבות גד שיווק 1992 בעמ,יח`,,1,16.90,9.39
1203,גבינה צפתית מעודנת 5% גד (200 גרם),מחלבות גד שיווק 1992 בעמ,יח`,,1,14.90,7.45
1204,מוצרלה מגורדת 22% גד (300 גרם),מחלבות גד שיווק 1992 בעמ,יח`,,1,24.50,8.17
1205,לבנה בשמן זית-גד - מדף,מחלבות גד שיווק 1992 בעמ,יח`,,1,13.90,5.56
1206,גבינת ריקוטה 5% גד (250 גרם),מחלבות גד שיווק 1992 בעמ,יח`,,1,14.90,5.96
1207,גבינת מסקרפונה 40% גד (250 גרם),מחלבות גד שיווק 1992 בעמ,יח`,,1,21.90,8.76
1208,ג`ל גילוח נגד חתכים אדג` (198 גרם),דנשר (1963) בעמ,יח`,,1,19.90,9.95
1209,תערובת פיצוחים מובחרת 150 גר` פיצוחי חממ,בוטנת בעמ,יח`,,1,15.90,10.60
1210,תערובת אגוזים וחמוציות חממה (150 גרם),בוטנת בעמ,יח`,,1,12.90,8.60
1211,חמוציות 200 גר` פיצוחי חממה,בוטנת בעמ,יח`,,1,12.90,6.45
1212,גרעין חמניה 200 גר` חממה,בוטנת בעמ,יח`,,1,5.90,2.95
1213,בוטן קלוף קלוי פיצוחי חממה (200 גרם),בוטנת בעמ,יח`,,1,6.90,3.45
1214,גרעיני דלעת קלויים פיצוחי חממה (200 גרם),בוטנת בעמ,יח`,,1,7.90,3.95
1215,צימוק בהיר 200 גר` פיצוחי חממה,בוטנת בעמ,יח`,,1,9.90,4.95
1216,צימוק כהה 200 גר פיצוחי חממה,בוטנת בעמ,יח`,,1,9.90,4.95
1217,משמש 200 גר` פיצוחי חממה,בוטנת בעמ,יח`,,1,9.90,4.95
1218,אגוזי מלך קלופים 150 גר` פיצוחי חממה,בוטנת בעמ,יח`,,1,9.90,6.60
1219,גרעין אבטיח 200 גר`,בוטנת בעמ,יח`,,1,13.90,6.95
1220,מנצ`יס פיצוחי חממה (200 גרם),בוטנת בעמ,יח`,,1,8.90,4.45
1221,בוטנים מצופים פיצוחי חממה (200 גרם),בוטנת בעמ,יח`,,1,5.90,2.95
1222,צנובר פיצוחי חממה (100 גרם),בוטנת בעמ,יח`,,1,26.90,26.90
1223,חלבה וניל אחוה (100 גרם),אחדות בעמ,יח`,,1,2.90,2.90
1224,חלבה וניל אחוה (500 גרם),אחדות בעמ,יח`,,1,9.90,1.98
1225,חלבה פיסטוק אחוה (400 גרם),אחדות בעמ,יח`,,1,12.90,3.23
1226,סירופ בטעמים 4 ליטר אחוה,אחדות בעמ,יח`,,1,21.90,5.48
1227,חלבה בקופסא ללא סוכר 11 יח`,אחדות בעמ,יח`,,1,11.90,4.31
1228,חלבה וניל קקאו ואגוזים אחוה (25x12 גרם),אחדות בעמ,יח`,,1,11.90,3.97
