,ItemName,ManufactureName,UnitQty,Quantity,QtyInPackage,ItemPrice,UnitOfMeasurePrice
1154,מטלית לכל סנו סושי (9),החברה הדרומית לשיווק בעמ,יח`,,1,13.20,1.47
1155,ניילון נצמד סנו סושי (30x2 מטר),החברה הדרומית לשיווק בעמ,יח`,,1,12.20,12.20
1156,קל רסס וכבס סנו (750 מל),החברה הדרומית לשיווק בעמ,יח`,,1,21.40,3.57
1157,שמפו שטיחים ספריי סנו (600 מל),החברה הדרומית לשיווק בעמ,יח`,,1,26.50,4.42
1158,תרסיס רהיט סנו (300 מל),החברה הדרומית לשיווק בעמ,יח`,,1,18.30,6
1159,סופר פוליש נוזל לרצפה סנו (1 ליטר),החברה הדרומית לשיווק בעמ,יח`,,1,37.70,37.70
1160,סנובון תות לאסלה סנו (55x3 גרם),החברה הדרומית לשיווק בעמ,יח`,,1,13.20,8
1161,סנובון לאסלה לימון סנו (55x3 גרם),החברה הדרומית לשיווק בעמ,יח`,,1,13.20,8
1162,סנובון לאסלה לובר סנו (55x3 גרם),החברה הדרומית לשיווק בעמ,יח`,,1,13.20,8
1163,סנובון נוזלי 750 מל,החברה הדרומית לשיווק בעמ,יח`,,1,10.90,1.45
1164,ז`אוול מרסס לניקוי כללי לבנדר סנו (1 ליט,החברה הדרומית לשיווק בעמ,יח`,,1,21.40,21.40
1165,קוטל מעופפים קיי 400 סנו (630 מל),החברה הדרומית לשיווק בעמ,יח`,,1,27.30,6.83
1166,קוטל חרקים קיי 300 סנו (630 מל),החברה הדרומית לשיווק בעמ,יח`,,1,21.90,3.48
1167,K500,החברה הדרומית לשיווק בעמ,יח`,,1,28.40,7.01
1168,סנו-די דוחה יתושים כדורי סנו (50 מל),החברה הדרומית לשיווק בעמ,יח`,,1,21.70,43.40
1169,סנו די תרסיס,החברה הדרומית לשיווק בעמ,יח`,,1,21.70,17.36
1170,סנו די נוזל+משאבה,החברה הדרומית לשיווק בעמ,יח`,,1,23.70,47.40
1171,סנו מקסימה 4 ליטר ורוד פסים,החברה הדרומית לשיווק בעמ,יח`,,1,22.40,5.60
1172,מסיר שומנים ז`אוול קר,החברה הדרומית לשיווק בעמ,יח`,,1,20.70,2.76
1173,סנו ז`אוול מרסס 1 ליטר,החברה הדרומית לשיווק בעמ,יח`,,1,21.40,21.40
1174,מסיר שומנים פורטה פלוס סנו (750 מל),החברה הדרומית לשיווק בעמ,יח`,,1,18.30,2.44
1175,סנובון נוזלי בניחוח לבנדר סנו (750 מל),החברה הדרומית לשיווק בעמ,יח`,,1,10.90,1.45
1176,פוליויקס 2 ליטר,החברה הדרומית לשיווק בעמ,יח`,,1,24.40,12.20
1177,סנובון לאסלה קלאסיק כחול סנו (55x3 גרם),החברה הדרומית לשיווק בעמ,יח`,,1,20.30,12.30
1178,רסס ונגב לניקוי כללי תרסיס סנו (750 מל),החברה הדרומית לשיווק בעמ,יח`,,1,20.30,3.38
1179,סנו מקסימה 4 ליטר לבן,החברה הדרומית לשיווק בעמ,יח`,,1,22.40,5.60
1180,סנוג`ט יכול הכל סחלבים סנו (4 ליטר),החברה הדרומית לשיווק בעמ,יח`,,1,22.40,5.60
1181,סנומוד מדונה,החברה הדרומית לשיווק בעמ,יח`,,1,13.20,8.80
1182,מטלית ריצפה זיגזג סנו סושי (3),החברה הדרומית לשיווק בעמ,יח`,,1,14.20,14.20
1183,כרית יפנית לכלים אקטיב סנו סושי (4),החברה הדרומית לשיווק בעמ,יח`,,1,12.20,12.20
1184,שקיות אשפה לפח 65x54 סנו סושי (60),החברה הדרומית לשיווק בעמ,יח`,,1,24.40,24.40
1185,אטבי כביסה איכות סנו (20),החברה הדרומית לשיווק בעמ,יח`,,1,10.50,10.50
1186,רב מגבת ג`מבו סנו סושי,החברה הדרומית לשיווק בעמ,יח`,,1,26.50,6.79
1187,סושי רדיד אלומיניום צמד,החברה הדרומית לשיווק בעמ,יח`,,1,14.20,14.20
1188,חטיפי כרובית בציפוי פריך טבעול (500 גרם),קבוצת אסם סחר שות. מוגבלת,יח`,,1,34.60,6.92
1189,פול מצרי 560 גר,ויטה -פרי גליל (החדשה) בעמ,יח`,,1,5.90,1.05
1190,שעועית לבנה אפויה,ויטה -פרי גליל (החדשה) בעמ,יח`,,1,5.90,1.07
1191,חומוס שלם A2,ויטה -פרי גליל (החדשה) בעמ,יח`,,1,5.90,0.98
1192,אפונה גדולה A2,ויטה -פרי גליל (החדשה) בעמ,יח`,,1,5.90,0.98
1193,אפונה וגזר A2,ויטה -פרי גליל (החדשה) בעמ,יח`,,1,5.90,1.07
1194,תירס גרעינים 550 גר`,ויטה -פרי גליל (החדשה) בעמ,יח`,,1,5.90,1.07
1195,וופל שוקולד מן (200 גרם),רוקחמן בעמ,יח`,,1,5,2.50
1196,וופלים לימון מן (200 גרם),רוקחמן בעמ,יח`,,1,5,2.50
1197,וופלים 200 גר` קפה מן,רוקחמן בעמ,יח`,,1,5,2.50
1198,וופל 200 גר` וניל מן,רוקחמן בעמ,יח`,,1,5,2.50
1199,וופל 180 גר` חלבה מן,רוקחמן בעמ,יח`,,1,5,2.78
1200,ופלים מצופים מן (22x10 גרם),רוקחמן בעמ,יח`,,1,8.40,4.20
1201,חומוסטחינה פלפל חריף מטוגן 400גר,קבוצת אסם סחר שות. מוגבלת,יח`,,1,15.20,3.80
1202,קבנוס קלאסי יחיעם (125 גרם),מעדני יחיעם (1993) בעמ,יח`,,1,14.20,11.36
1203,קבנוס פפרוני יחיעם (125 גרם),מעדני יחיעם (1993) בעמ,יח`,,1,14.20,11.36
1204,משקה קל דיאט אשכוליות ג`אמפ (1.5 ליטר),טמפו משקאות בעמ,יח`,,1,5.70,0.38
1205,משקה קל מנגו פסיפלורה ג`אמפ (1.5 ליטר),טמפו משקאות בעמ,יח`,,1,5.70,0.38
1206,מי סודה טמפו (1.5 ליטר),טמפו משקאות בעמ,יח`,,1,3.10,0.21
1207,סודה בטעם פירות יער טמפו (1.5 ליטר),טמפו משקאות בעמ,יח`,,1,4.10,2.73
1208,סודה בטעם אננס טמפו (1.5 ליטר),טמפו משקאות בעמ,יח`,,1,4.10,2.73
1209,תרכיז טבעי סיידר הגליל (330 מל),טמפו משקאות בעמ,יח`,,1,10.90,3.21
1210,מרכך כביסה ורוד בדין (4 ליטר),יוניליוור ישראל שיווק בעמ,יח`,,1,20.90,5.23
1211,מרכך כביסה צהוב בדין (4 ליטר),יוניליוור ישראל שיווק בעמ,יח`,,1,20.90,5.23
1212,מרכך כביסה כחול בדין (4 ליטר),יוניליוור ישראל שיווק בעמ,יח`,,1,20.90,5.23
1213,סלמי גליל 600 גר` טירת צבי,תנובה קפואים,יח`,,1,38.70,6.45
1214,נקניקיות פיקנטיות 400 גר` טירת צבי,תנובה קפואים,יח`,,1,15.20,3.80
1215,סלסולי כתף בקר 120 גר` טירת צבי,תנובה קפואים,יח`,,1,17.30,14.42
1216,סלסולי סלמי איטלקי 120 גר` טירת צבי,תנובה קפואים,יח`,,1,17.30,14.42
1217,דקניקים סלסולי הודו טירת צבי (120 גרם),תנובה קפואים,יח`,,1,17.30,14.42
1218,סלסולי פסטרמה גחלים 120 גר` טירת צבי,תנובה קפואים,יח`,,1,17.30,14.42
1219,נקניקיות עוף טירת צבי (400 גרם),תנובה קפואים,יח`,,1,15.20,3.80
1220,צמד כפרי 800 גר` טירת צבי,תנובה קפואים,יח`,,1,37.70,4.71
1221,לחם עינן קל פרוס אנג`ל (500 גרם),שלמה א. אנג`ל בעמ,יח`,,1,15.10,3.02
1222,נוזל לניקוי אסלות 00 סנו (1 ליטר),החברה הדרומית לשיווק בעמ,יח`,,1,9.10,9.10
1223,ממרח בטעם שוקולד השחר העולה (1 קג),השחר העולה תעשית ממתקים בעמ,יח`,,1,25.40,25.40
1224,צימקאו השחר העולה (400 גרם),השחר העולה תעשית ממתקים בעמ,יח`,,1,13.50,3.38
1225,ממרח 400 גר` חלבי בדצ השחר,השחר העולה תעשית ממתקים בעמ,יח`,,1,14.20,3.55
1226,ממרח אגוזי לוז עם קקאו 350 גר` פרווה,השחר העולה תעשית ממתקים בעמ,יח`,,1,14.90,4.26
1227,שפורפרת לחיץ שוקולד 330 גר` השחר,השחר העולה תעשית ממתקים בעמ,יח`,,1,15.20,4.61
1228,ממרח 400 גר` פרווה השחר,השחר העולה תעשית ממתקים בעמ,יח`,,1,12.20,3.05
1229,ממרח פרווה 1 קג` השחר,השחר העולה תעשית ממתקים בעמ,יח`,,1,24.40,24.40
1230,ממרח חצי חצי 350 גר` השחר,השחר העולה תעשית ממתקים בעמ,יח`,,1,13.20,3.77
1231,אבקת קקאו השחר העולה (150 גרם),השחר העולה תעשית ממתקים בעמ,יח`,,1,10.50,7
1232,אבקת קקאו השחר העולה (500 גרם),השחר העולה תעשית ממתקים בעמ,יח`,,1,30.50,6.10
1233,ממרח חלב 350 גר` השחר,השחר העולה תעשית ממתקים בעמ,יח`,,1,13.20,3.77
1234,ממרח נוגט אגוזים 350 גר` השחר,השחר העולה תעשית ממתקים בעמ,יח`,,1,14.20,4.06
1235,קפה שחור קפה לנדוור (100x3 גרם),קבוצת אסם סחר שות. מוגבלת,יח`,,1,24.40,8.13
1236,קפה לנדוור לבוקר שלישיה,קבוצת אסם סחר שות. מוגבלת,יח`,,1,24.40,8.13
1237,פופקורן פופסטאר חמישייה טבעי,דנשר (1963) בעמ,יח`,,1,18.30,3.66
1238,פופקורן פופסטאר חמישייה חמאה,דנשר (1963) בעמ,יח`,,1,18.30,3.66
1239,גלילונית לפח 60 יח`,דנשר (1963) בעמ,יח`,,1,20.30,20.30
1240,משקה מוגז בטעם קולה פפסי (1.5 ליטר),טמפו משקאות בעמ,יח`,,1,6.10,0.41
1241,משקה מוגז בטעם ליים סבן אפ (1.5 ליטר),טמפו משקאות בעמ,יח`,,1,6.10,0.41
1242,משקה אורנג` מירנדה (1.5 ליטר),טמפו משקאות בעמ,יח`,,1,6.10,0.41
1243,פפסי סבן אפ דיאט 1.5 ליטר,טמפו משקאות בעמ,יח`,,1,6.10,0.41
1244,פפסי מקס 1.5 ליטר,טמפו משקאות בעמ,יח`,,1,6.10,0.41
1245,נוזל לניקוי כללי פנטסטיק סיף (4 ליטר),יוניליוור ישראל שיווק בעמ,יח`,,1,26.50,0.66
1246,בייגלה שמונה שמונה 400 גר`,יוניליוור ישראל שיווק בעמ,יח`,,1,11.50,2.88
1247,בייגלה אחד אחד 400 גר`,יוניליוור ישראל שיווק בעמ,יח`,,1,11.50,2.88
1248,צבר חומוסיבוב ברוטב חריף 400 גרם,קבוצת אסם סחר שות. מוגבלת,יח`,,1,15.20,2.71
1249,חומוס צבר סמיר הגדול,קבוצת אסם סחר שות. מוגבלת,יח`,,1,15.20,3.80
1250,חומוס צבר אבו מרוואן,קבוצת אסם סחר שות. מוגבלת,יח`,,1,15.20,3.80
1251,לחמניות חיטה מלאה דגנית עין בר (10),דגנית עין בר תעשיות מזון ואפיה,יח`,,1,12.20,1.63
1252,לחמניות אצבע דגנית עין בר (10),דגנית עין בר תעשיות מזון ואפיה,יח`,,1,12.20,1.63
1253,לחם אקטיב ברמן (750 גרם),י.את א. ברמן בעמ,יח`,,1,15.20,2.03
1254,לחמניות אקטיב ברמן,י.את א. ברמן בעמ,יח`,,1,12.20,2.71
1255,יין אדום יבש של סגל (750 מל),טמפו משקאות בעמ,יח`,,1,22.50,2.96
1256,יין לבן יבש של סגל (750 מל),טמפו משקאות בעמ,יח`,,1,22.50,2.96
1257,יין לבן חצי יבש של סגל (750 מל),טמפו משקאות בעמ,יח`,,1,22.50,2.96
1258,מרום גליל סינגל קברנה סובניון 750 מל,טמפו משקאות בעמ,יח`,,1,43.80,5.80
1259,מרום גליל סינגל מרלו 750מל,טמפו משקאות בעמ,יח`,,1,43.80,5.80
1260,מרום גליל שרדונה,טמפו משקאות בעמ,יח`,,1,44.10,5.84
1261,נקניקיות וניר 1 קג` זוגלובק,זוגלובק שיווק בעמ,יח`,,1,31.60,31.60
1262,נקניקיות וינר זוגלובק (500 גרם),זוגלובק שיווק בעמ,יח`,,1,18.30,3.66
1263,גוליבר חריפות 400 גר` זוגלובק,זוגלובק שיווק בעמ,יח`,,1,18.60,4.65
1264,מארז פסטרמה חרמון+תה,זוגלובק שיווק בעמ,יח`,,1,35.60,4.45
1265,בורקס גבינה זוגלובק (16 יח` - 800 גרם),זוגלובק שיווק בעמ,יח`,,1,22.40,2.80
1266,נקנקיות חריפות 1,זוגלובק שיווק בעמ,יח`,,1,33.90,33.90
1267,בצק עלים זוגלובק,זוגלובק שיווק בעמ,יח`,,1,22.40,22.40
1268,קריספי סטיקס תירס,זוגלובק שיווק בעמ,יח`,,1,21.40,4.28
1269,נקניקיות עוף זוגלובק (400 גרם),זוגלובק שיווק בעמ,יח`,,1,15.20,3.80
1270,נקניקיות עוף זוגלובק (1 קג),זוגלובק שיווק בעמ,יח`,,1,32.60,32.60
1271,סטייק בורגר 400 גר` טיבונוויל,נטו מלינדה סחר בעמ,יח`,,1,21.40,5.35
1272,בשר עוף קפוא טחון טיבון ויל (500 גרם),נטו מלינדה סחר בעמ,יח`,,1,13.20,2.64
1273,בשר הודו קפוא טחון טיבון ויל (500 גרם),נטו מלינדה סחר בעמ,יח`,,1,13.20,2.64
1274,גבינת מסקרפונה 40% גד (250 גרם),מחלבות גד שיווק 1992 בעמ,יח`,,1,22.90,9.16
1275,ג`ל גילוח נגד חתכים אדג` (198 גרם),דנשר (1963) בעמ,יח`,,1,20.70,10.35
1276,אדג` ג`ל גילוח 200 מל ירוק,דנשר (1963) בעמ,יח`,,1,20.70,10.35
1277,ג`ל גילוח לעור רגיש אדג` (198 גרם),דנשר (1963) בעמ,יח`,,1,20.70,10.35
1278,אדג` ג`ל גילוח 200 מל סגול כהה,דנשר (1963) בעמ,יח`,,1,20.70,10.35
1279,אדג` ג`ל לבן לניקוי עור הפנים,דנשר (1963) בעמ,יח`,,1,21.40,10.70
1280,תערובת פיצוחים מובחרת 150 גר` פיצוחי חממ,בוטנת בעמ,יח`,,1,16.90,11.27
1281,תערובת אגוזים וחמוציות חממה (150 גרם),בוטנת בעמ,יח`,,1,14.20,9.47
1282,טחינה גולמית אחוה (1 קג),אחדות בעמ,יח`,,1,21.40,21.40
1283,לחם חיטה מלא +כוסמין דגנית,דגנית עין בר תעשיות מזון ואפיה,יח`,,1,14.20,1.89
1284,מי עדן 1.5 ליטר בודד,יפאורה,יח`,,1,3.90,2.60
1285,מים מינרלים פקק ספורט מי עדן (500x6 מל),יפאורה,יח`,,1,13.50,0.39
1286,אלמקס משחת שיניים ילדים 75מל,ש.שסטוביץ בעמ,יח`,,1,16.30,21.73
1287,פרש וואנס מגבונים רביעיה,דנשר (1963) בעמ,יח`,,1,19.90,19.90
1288,שקד מולבן פרוס 100 גר`,מיה תעשיות מזון מ.ת.מ. בעמ,יח`,,1,12.20,12.20
1289,שומשום מיה (400 גרם),מיה תעשיות מזון מ.ת.מ. בעמ,יח`,,1,13.20,3.30
1290,צמד חמד 700 גר` יחיעם,מעדני יחיעם (1993) בעמ,יח`,,1,26.50,3.79
1291,המבורגר אמיתי טיבון ויל (400 גרם),נטו מלינדה סחר בעמ,יח`,,1,21.40,5.35
1292,נקה 7 שמפו 750 מל ירוק,החברה הדרומית לשיווק בעמ,יח`,,1,14.20,1.89
1293,נקה 7 שמפו 750 מל,החברה הדרומית לשיווק בעמ,יח`,,1,14.20,1.89
1294,נקה 7 שמפו 750 מל,החברה הדרומית לשיווק בעמ,יח`,,1,14.20,1.89
1295,נקה 7 מרכך 750 מל ירוק,החברה הדרומית לשיווק בעמ,יח`,,1,14.20,1.89
1296,נקניקיות חריפות מהדרין עטרה (400 גרם),נטו מלינדה סחר - עטרה,יח`,,1,12.20,2.44
1297,אקונומיקה סמיכה 4 ליטר טאצ`,סאסאטק אגשח בעמ,יח`,,1,12.90,0.32
1298,ג`ל כביסה ירוק 3 ליטר טאצ`,סאסאטק אגשח בעמ,יח`,,1,18.90,6.30
1299,ג`ל כביסה כחול 3 ליטר טאצ`,סאסאטק אגשח בעמ,יח`,,1,18.90,6.30
1300,נוזל רצפות אורנים 4 ליטר טאצ,סאסאטק אגשח בעמ,יח`,,1,14.90,0.37
1301,נוזל רצפות מאסק 4 ליטר טאצ,סאסאטק אגשח בעמ,יח`,,1,14.90,0.37
1302,נוזל רצפות יסמין 4 ליטר טאצ`,סאסאטק אגשח בעמ,יח`,,1,14.90,0.37
1303,מרכך כביסה 4 ליטר ורוד,סאסאטק אגשח בעמ,יח`,,1,14.90,0.37
1304,מרכך כביסה 4 ליטר כחול,סאסאטק אגשח בעמ,יח`,,1,14.90,0.37
1305,מרכך כביסה 4 ליטר לבן,סאסאטק אגשח בעמ,יח`,,1,14.90,0.37
1306,נוזל רצפות לבנדר 4 ליטר טאצ,סאסאטק אגשח בעמ,יח`,,1,14.90,0.37
1307,נקטר תות בננה ספרינג (1 ליטר),יפאורה,יח`,,1,6,0.60
1308,מיץ עגבניות ספרינג (1 ליטר),יפאורה,יח`,,1,6,0.60
1309,נקטר מנגו ספרינג (1 ליטר),יפאורה,יח`,,1,6,0.60
1310,נקטר אפרסקים ספרינג (1 ליטר),יפאורה,יח`,,1,6,0.60
1311,משקה קל לימונענע ספרינג (1 ליטר),יפאורה,יח`,,1,6,0.60
1312,נקטר תפוזים ספרינג (1 ליטר),יפאורה,יח`,,1,6,0.60
1313,נקטר תפוחים ספרינג (1 ליטר),יפאורה,יח`,,1,6,0.60
1314,RC קולה פחית רגיל,יפאורה,יח`,,1,3.90,1.09
1315,משקה קל ענבים תפוזינה (1.5 ליטר),יפאורה,יח`,,1,6.90,0.46
1316,פלמוליב ח ודבש 500מל חדש,ש.שסטוביץ בעמ,יח`,,1,21.40,4.28
1317,פלמוליב כלים שקוף לימון 750 בקבוק חדש,ש.שסטוביץ בעמ,יח`,,1,13.20,1.76
1318,שטראוס קרמיסימו,גלידות שטראוס בעמ,יח`,,1,20.50,15.41
1319,שטראוס קרמיסימו שוקולד וניל,גלידות שטראוס בעמ,יח`,,1,20.50,15.41
1320,שטראוס קרמיסימו ריבת חלב,גלידות שטראוס בעמ,יח`,,1,20.50,15.41
1321,שטראוס קרמיסימו וניל,גלידות שטראוס בעמ,יח`,,1,20.50,15.41
1322,שטראוס קרמיסימו,גלידות שטראוס בעמ,יח`,,1,20.50,15.41
1323,מאגדת-מיני מגנום,גלידות שטראוס בעמ,יח`,,1,35.60,35.60
1324,גרנולה עם תוספות 1 קג,דין שיווק וקליה בעמ,יח`,,1,21.40,21.40
1325,וופל קלאסי שוקולד 200 גר` עלמה,רזיט שיווק בעמ,יח`,,1,3.20,1.60
1326,גביעי גלידה מגולגל 12 יח עלמה,רזיט שיווק בעמ,יח`,,1,12.90,12.90
1327,וופל קלאסי לימון 200 גר` עלמה,רזיט שיווק בעמ,יח`,,1,3.20,1.60
1328,מרגז מיני אקסטרה 500 גר` 8 יח,בלדי בעמ,יח`,,1,28.90,5.78
1329,שומן כבש 200,בלדי בעמ,יח`,,1,10.10,5.05
1330,פסטרמה מעודנת על גחלים 300 גר,מעדני יחיעם (1993) בעמ,יח`,,1,25.40,8.47
1331,נקניקיות וינר 400 גרם,מעדני יחיעם (1993) בעמ,יח`,,1,14.20,3.55
1332,נקניקיות חריפות 400 גרם,מעדני יחיעם (1993) בעמ,יח`,,1,14.20,3.55
1333,פסטרמה של פעם 300 גרם לחמ,מעדני יחיעם (1993) בעמ,יח`,,1,27.50,9.17
1334,פסטרמה רומנית 250 גרם לחמ,מעדני יחיעם (1993) בעמ,יח`,,1,27.50,11
1335,כתף בקר מעושן 250 גרם לחמ,מעדני יחיעם (1993) בעמ,יח`,,1,30.50,12.20
1336,סלמי מעושן בסגנון איטלקי 300 גרם,מעדני יחיעם (1993) בעמ,יח`,,1,22.40,7.47
1337,פסטרמה מעודנת 200 גר` יחיעם,מעדני יחיעם (1993) בעמ,יח`,,1,13.20,6.60
1338,סלמי איטלקי מפולפל 200 גר` יחיעם,מעדני יחיעם (1993) בעמ,יח`,,1,13.20,6.60
1339,ספירה אנתוש 70 מל,גורי ע.ע.ע בעמ,יח`,,1,14.20,20.29
1340,פחית פאנטה ענבים סליק 330 מל,החברה המרכזית להפצת משקאות בעמ,יח`,,1,4.50,1.27
1341,סודה קינלי (250 מל),החברה המרכזית להפצת משקאות בעמ,יח`,,1,3,1.08
1342,פקאן סיני פיצוחי חממה (100 גרם),בוטנת בעמ,יח`,,1,18.30,18.30
1343,אקונומיקה קצף ניקוי סנט מוריץ (1 ליטר ),קומפלקס כימיקלים בעמ,יח`,,1,12.90,1.29
1344,קצף ניקוי כלים סינטריים סנט מוריץ ( 1 לי,קומפלקס כימיקלים בעמ,יח`,,1,12.90,12.90
1345,חיוכים שוקו 900 גר`,שטראוס גרופ בעמ,יח`,,1,22.40,2.49
1346,חיוכים וניל 900 גר`,שטראוס גרופ בעמ,יח`,,1,22.40,2.49
1347,ביסקוויט פתי בר בטעם חמאה עלית (500 גרם),שטראוס גרופ בעמ,יח`,,1,11.20,2.24
1348,שוקולד פרה חלב עם עדשים עלית (100 גרם),שטראוס גרופ בעמ,יח`,,1,5,5
1349,ציטוס איקס עיגול 60 גר,שטראוס פריטו ליי בעמ,יח`,,1,3.90,6.50
1350,צ יטוס כאפה 55 גר,שטראוס פריטו ליי בעמ,יח`,,1,3.90,7.09
1351,אל סבון נוזלי וניל פמילי (1 ליטר),דנשר (1963) בעמ,יח`,,1,15.60,15.60
1352,אל סבון נוזלי לבנדר פמילי (1 ליטר),דנשר (1963) בעמ,יח`,,1,15.60,15.60
1353,אל סבון נוזלי ליים פמילי (1 ליטר),דנשר (1963) בעמ,יח`,,1,15.60,15.60
1354,אדג ג`ל גילוח-זוג,דנשר (1963) בעמ,יח`,,1,30.90,7.12
1355,מאגדת-מיני מגנום,גלידות שטראוס בעמ,יח`,,1,35.60,35.60
1356,אורז רייס ריץ` 5 קג`,סוגת תעשיות בעמ,יח`,,1,36.70,0.73
1357,קרם ידיים פנג`ל (80 מל),דנשר (1963) בעמ,יח`,,1,10.50,10.50
1358,בן ג`ריס גלידה בטעם חרוסת מהדרין 500מל,מוצרי איכות אמריקאיים בעמ,יח`,,1,20.30,4.06
1359,גלידת שמנת בטעם וניל קרמל וחתיכות גביעי,מוצרי איכות אמריקאיים בעמ,יח`,,1,20.30,4.06
1360,גלידת פיינטים שוקולד מילק קוקוס בן אנד ג,מוצרי איכות אמריקאיים בעמ,יח`,,1,20.30,4.06
1361,גלידת פיינטים שוקולד בצק עוגיות בן אנד ג,מוצרי איכות אמריקאיים בעמ,יח`,,1,20.30,4.06
1362,איטריות ביצים מס` 8 200 גר`,גורי מוצרי צריכה (1991) בעמ,יח`,,1,7.50,3.57
1363,איטריות ביצים מס 10 200 גר`,גורי מוצרי צריכה (1991) בעמ,יח`,,1,7.50,3.75
1364,איטריות ביצים מס 14 200 גר`,גורי מוצרי צריכה (1991) בעמ,יח`,,1,7.50,3.75
1365,נודלס אוריינט סיני 300גר,גורי מוצרי צריכה (1991) בעמ,יח`,,1,10.90,3.63
1366,נודלס בסגנון תאילנדי 25% תוספת ( 500 גר`,גורי מוצרי צריכה (1991) בעמ,יח`,,1,10.90,2.18
1367,זיתים ירוקים נובו קבוצת יבנה (540 גרם),קבוצת יבנה מוצרי מזון אגודה שי,יח`,,1,10.10,1.80
1368,טבעות זיתים ירוק A2,קבוצת יבנה מוצרי מזון אגודה שי,יח`,,1,10.10,1.80
1369,שיפקה 600 גרם בדצ,קבוצת יבנה מוצרי מזון אגודה שי,יח`,,1,6.40,1.07
1370,פלפל חריף שיפקה קבוצת יבנה (540 גרם),קבוצת יבנה מוצרי מזון אגודה שי,יח`,,1,6.70,1.20
1371,סלמון מעושן דלידג (100 גרם),נטו מלינדה סחר בעמ,יח`,,1,16.30,16.30
1372,המבורגר טחון 500 גר` מחפוד,עוף ירושלים שיווק בעמ,יח`,,1,18.30,3.66
1373,קבב מזרחי 500 גר` מחפוד,עוף ירושלים שיווק בעמ,יח`,,1,18.30,3.66
1374,סטייק אנטריקוט 800 גר` מחפוד,עוף ירושלים שיווק בעמ,יח`,,1,39.70,4.96
1375,טחון בקר 500 גר` מחפוד,עוף ירושלים שיווק בעמ,יח`,,1,18.30,3.66
1376,טחון הודו 500 מחפוד,עוף ירושלים שיווק בעמ,יח`,,1,15.20,3.04
1377,טחון עוף מחפוד 500 גר`,עוף ירושלים שיווק בעמ,יח`,,1,15.20,3.04
1378,קבב עוף 500 גר` מחפוד,עוף ירושלים שיווק בעמ,יח`,,1,15.20,3.04
1379,המבורגר עוף 500 גר` מחפוד,עוף ירושלים שיווק בעמ,יח`,,1,15.20,3.04
1380,טחון בקר 1 קג מחפוד,עוף ירושלים שיווק בעמ,יח`,,1,38.70,38.70
1381,בורקס פילו אצבעות בולגרית 700 גר`,נטו מלינדה סחר בעמ,יח`,,1,20.30,2.90
1382,טיבונוויל קבב אמ,נטו מלינדה סחר בעמ,יח`,,1,16.70,3.80
1383,רסק עגבניות 100 גר` פרי מבורך,זנלכל בעמ,יח`,,1,3,3
1384,A2 רסק תפוע מתו,זנלכל בעמ,יח`,,1,5.90,1.05
1385,רסק עגבניות BX 22% פרי מבורך (260 גרם),זנלכל בעמ,יח`,,1,5,1.92
1386,חומוס 550 גר` פרי מבורך,זנלכל בעמ,יח`,,1,7.10,1.29
1387,תירס מתוק 550 גר` פרי מבורך,זנלכל בעמ,יח`,,1,7.10,1.29
1388,טבעות דג 700 גר` דלי דג,נטו מלינדה סחר בעמ,יח`,,1,27.50,3.93
1389,שניצולני דג 600 גר דלידג,נטו מלינדה סחר בעמ,יח`,,1,27.30,4.55
1390,טונה ויליגר רביעייה 140 גר במים,נטו מלינדה סחר בעמ,יח`,,1,21.90,15.64
1391,המבורגר קפוא בלדי (400 גרם),בלדי בעמ,יח`,,1,13.90,3.48
1392,קבב כבש קפוא בלדי (400 גרם),בלדי בעמ,יח`,,1,12.90,3.23
1393,קבב מזרחי קפוא בלדי (400 גרם),בלדי בעמ,יח`,,1,12.90,3.23
1394,קבב רומני קפוא בלדי (400 גרם),בלדי בעמ,יח`,,1,12.90,3.23
1395,קמח 1 קג,טחנת קמח רוט קרית גת,יח`,,1,3.80,3.80
1396,סולת 1 קג,טחנת קמח רוט קרית גת,יח`,,1,5.30,5.30
