,ItemName,ManufactureName,UnitQty,Quantity,QtyInPackage,ItemPrice,UnitOfMeasurePrice
2335,פסטה א-לה רומר להקפצה 450 גר` מאמא עוף,תנובה קפואים,יח`,,1,20.90,4.64
2336,חגיגה אסייתית להקפצה 450 גר` מאמא עוף,תנובה קפואים,יח`,,1,20.90,4.64
2337,ירוק גלילי להקפצה 450 גר` מאמא עוף,תנובה קפואים,יח`,,1,20.90,4.64
2338,אבקת שוקו 500 גר`,מיה תעשיות מזון מ.ת.מ. בעמ,יח`,,1,7.10,1.42
2339,מים בטעם פירות יער שוופס (1.5 ליטר),יפאורה,יח`,,1,6.70,0.45
2340,מים בטעם אפרסק שוופס (1.5 ליטר),יפאורה,יח`,,1,6.70,0.45
2341,שוופס ווטר אפרסק 500מל,יפאורה,יח`,,1,4.90,0.92
2342,מים בטעם ענבים שוופס (1.5 ליטר),יפאורה,יח`,,1,6.70,0.45
2343,שוופס ווטר ענבים 500מל,יפאורה,יח`,,1,4.90,0.92
2344,מים בטעם תפוח שוופס (1.5 ליטר),יפאורה,יח`,,1,6.70,0.45
2345,שוופס ווטר תפוח 500מל,יפאורה,יח`,,1,4.90,0.92
2346,משקה מוגז לימונייד שוופס (1.5 ליטר),יפאורה,יח`,,1,7.50,0.50
2347,משקה מוגז לימונדה ורודה שוופס (1.5 ליטר),יפאורה,יח`,,1,7.50,0.50
2348,משקה מוגז למון ליים שוופס (1.5 ליטר),יפאורה,יח`,,1,7.70,0.51
2349,שוופס דיאט למון ליים 1.5 ל`,יפאורה,יח`,,1,7.70,0.51
2350,שוופס מוגז עדין 1.5 ליטר אננס,יפאורה,יח`,,1,7.50,0.50
2351,שישיית שוופס למון ליים 1.5 ל`,יפאורה,יח`,,1,36.70,36.70
2352,שישיית שוופס דיאט למון ליים 1.5 ל`,יפאורה,יח`,,1,36.70,36.70
2353,משקה פירות בטעם גווארנה שוופס (1.5 ליטר),יפאורה,יח`,,1,7.50,5
2354,בירה ג`מס בקבוק פילס 330 מל,יורוסטנדרט בעמ,יח`,,1,13.90,4.12
2355,בירה ג`מס בקבוק חיטה 330 מל,יורוסטנדרט בעמ,יח`,,1,13.90,4.12
2356,בירה ג`מס בקבוק 8.80% אלכוהול ( 330 מל),יורוסטנדרט בעמ,יח`,,1,13.90,4.12
2357,משוקלדים חמוציות מריר 160 גר` בקופסא,דין שיווק וקליה בעמ,יח`,,1,13.20,8.25
2358,משוקלדים פקאן מריר 160 גר` בקופסא,דין שיווק וקליה בעמ,יח`,,1,13.20,8.25
2359,משוקלדים חמוציות חלב 160 גר` בקופסא,דין שיווק וקליה בעמ,יח`,,1,13.20,8.25
2360,משוקלדים שקד חלב 160 גר` בקופסא,דין שיווק וקליה בעמ,יח`,,1,13.20,8.25
2361,משוקלדים צימוק מריר 160 גר` בקופסא,דין שיווק וקליה בעמ,יח`,,1,13.20,8.25
2362,משוקלדים בוטן מריר 160 גר` בקופסא,דין שיווק וקליה בעמ,יח`,,1,13.20,8.25
2363,משוקלדים לוז חלב 160 גר` בקופסא,דין שיווק וקליה בעמ,יח`,,1,13.20,8.25
2364,משוקלדים לוז מריר 160 גר` בקופסא,דין שיווק וקליה בעמ,יח`,,1,13.20,8.25
2365,משוקלדים שומשום חלב 160 גר` בקופסא,דין שיווק וקליה בעמ,יח`,,1,13.20,8.25
2366,משוקלדים שומשום מריר 160 גר` בקופסא,דין שיווק וקליה בעמ,יח`,,1,13.20,8.25
2367,מגבונים לניקוי כללי סנו סושי (50),החברה הדרומית לשיווק בעמ,יח`,,1,11.20,11.20
2368,קרמה דאודורנט ספריי -קלאסי,החברה הדרומית לשיווק בעמ,יח`,,1,21.40,14.27
2369,דאודורנט ספריי מאסק קרמה (150 מל),החברה הדרומית לשיווק בעמ,יח`,,1,21.40,14.27
2370,קרמה דאודורנט ספריי -אורכידאה,החברה הדרומית לשיווק בעמ,יח`,,1,21.40,14.27
2371,משוקלדים צימוק חלב 160 גר` בקופסא,דין שיווק וקליה בעמ,יח`,,1,13.20,8.25
2372,משוקלדים בוטן חלב 160 גר` בקופסא,דין שיווק וקליה בעמ,יח`,,1,13.20,8.25
2373,נקניקיות פרגיות 300 גר` טירת צבי,תנובה קפואים,יח`,,1,16.30,5.43
2374,פסטרמה שום וצילי טירת צבי (400 גרם),תנובה קפואים,יח`,,1,34.60,8.65
2375,נקניקיות וינר 1 קג` טירת צבי,תנובה קפואים,יח`,,1,34.60,6.92
2376,סלמי גלבוע 400 גר` טירת צבי,תנובה קפואים,יח`,,1,25.40,6.35
2377,קבנוס 120 גר` טירת צבי,תנובה קפואים,יח`,,1,13.20,11
2378,קבנוס 120 גר` פיקנטי טירת צבי,תנובה קפואים,יח`,,1,13.20,11
2379,חטיפי קבנוס 120 גר` טירת צבי,תנובה קפואים,יח`,,1,13.20,11
2380,צמד כפרי ברבקיו ודבש 600 גר טירת צבי,תנובה קפואים,יח`,,1,31.60,5.27
2381,טרין מוס כבד עוף 120 גר` תנובה,תנובה קפואים,יח`,,1,17.30,14.42
2382,סירופ בטעם ענבים מועשר בויטמינים 1 ליטר,אחדות בעמ,יח`,,1,8.90,8.90
2383,סירופ בטעם פטל מועשר בויטמינים 1 ליטר אח,אחדות בעמ,יח`,,1,8.90,8.90
2384,סירופ בטעם אננס מועשר בויטמינים 1 ליטר א,אחדות בעמ,יח`,,1,8.90,8.90
2385,ממרח טחינה עם דבש 400 גר` אחווה,אחדות בעמ,יח`,,1,13.20,3.30
2386,ערק ג`באלנא מצדה 40%,בני פאוזי שמשום (2009) בעמ,יח`,,1,52,7.39
2387,צמד פסטרמות 600 גר` יחיעם,מעדני יחיעם (1993) בעמ,יח`,,1,26.50,4.42
2388,נשנושי קבנוס יחיעם (125 גרם),מעדני יחיעם (1993) בעמ,יח`,,1,13.20,10.56
2389,נקניקיות עוף 1.5 קג,מעדני יחיעם (1993) בעמ,יח`,,1,31.60,31.60
2390,פסטרמה ברביקיו דק דק יחיעם (140 גרם),מעדני יחיעם (1993) בעמ,יח`,,1,13.20,9.43
2391,פסטרמה בדבש דק דק יחיעם (140 גרם),מעדני יחיעם (1993) בעמ,יח`,,1,13.20,9.43
2392,פסטרמה של פעם דק דק יחיעם (140 גרם),מעדני יחיעם (1993) בעמ,יח`,,1,13.20,9.43
2393,פסטרמה מעודנת על גחלים יחיעם (300 גרם),מעדני יחיעם (1993) בעמ,יח`,,1,25.40,8.47
2394,סלמי תה יחיעם (300 גרם),מעדני יחיעם (1993) בעמ,יח`,,1,26.50,8.83
2395,סלמי פפרוני 200 גר` יחיעם,מעדני יחיעם (1993) בעמ,יח`,,1,15.20,7.60
2396,גבינת גאודה פרוסות 150 גר,ג.וילי-פוד אינטרנשיונל בעמ,יח`,,1,10.90,7.27
2397,אורז בסמטי אהרוני (1 קג),דין שיווק וקליה בעמ,יח`,,1,13.50,13.50
2398,שיבולת שועל דקה שקדיה (500 גרם),דין שיווק וקליה בעמ,יח`,,1,7.10,1.42
2399,משוקלדים שקד מריר 160 גר` בקופסא,דין שיווק וקליה בעמ,יח`,,1,13.20,8.25
2400,משוקלדים פקאן חלב 160 גר` בקופסא,דין שיווק וקליה בעמ,יח`,,1,13.20,8.25
2401,שיבולת שועל עבה שקדיה (500 גרם),דין שיווק וקליה בעמ,יח`,,1,7.10,1.42
2402,בישקוטים וניל קקאו בונומי (200 גרם),דנשר (1963) בעמ,יח`,,1,8.40,4.20
2403,מואי עוגיות קקאו ושוקלד מריר עם קרם אספר,דנשר (1963) בעמ,יח`,,1,18.60,10.33
2404,מואי עוגיות קקאו ושוקולד עם קרם ברולה,דנשר (1963) בעמ,יח`,,1,19.30,10.72
2405,אל סבון נוזלי פנינה רוזנבלום (500x3 גרם),פנינה רוזנבלום בעמ,יח`,,1,14.20,9.47
2406,גרנולה שוקולד מריר+לבן 400 גר` פנינה רוז,פנינה רוזנבלום בעמ,יח`,,1,31.60,7.90
2407,מרכך לאחר החלקה 750 מל פנינה רוזנבלום,פנינה רוזנבלום בעמ,יח`,,1,31.60,4.21
2408,שמפו לאחר החלקה 750 מל פנינה רוזנבלום,פנינה רוזנבלום בעמ,יח`,,1,31.60,4.21
2409,מסיכה לאחר החלקה 500 מל פנינה רוזנבלום,פנינה רוזנבלום בעמ,יח`,,1,36.70,7.34
2410,רוטב עוף 800 גרם,פנינה רוזנבלום בעמ,יח`,,1,19.30,2.41
2411,קריניאנו 750 מל BUZZ,אגודת הכורמים,יח`,,1,28.50,3.76
2412,מוסקטו 750 מל BUZZ,אגודת הכורמים,יח`,,1,28.50,3.76
2413,קורנפלור מיה (500 גרם),מיה תעשיות מזון מ.ת.מ. בעמ,יח`,,1,9.40,1.88
2414,שקיות מזון סנו סושי (300),החברה הדרומית לשיווק בעמ,יח`,,1,13.20,13.20
2415,מקסימה מרכך מרוכז חלב ודבש סנו (1 ליטר),החברה הדרומית לשיווק בעמ,יח`,,1,19.30,1.93
2416,סנו מקסימה מרכך 1 ליטר ורוד,החברה הדרומית לשיווק בעמ,יח`,,1,19.30,1.93
2417,אוקסיג`ן ג`ל 3 ליטר כביסה לבנה,החברה הדרומית לשיווק בעמ,יח`,,1,32.60,10.87
2418,סנופרש הום נטול גז 350 מל בניחוח בוקר א,החברה הדרומית לשיווק בעמ,יח`,,1,16.30,4.66
2419,מקסימה מרכך חלב ודבש סנו (4 ליטר),החברה הדרומית לשיווק בעמ,יח`,,1,22.40,5.60
2420,פוליויקס 3 ליטר,החברה הדרומית לשיווק בעמ,יח`,,1,24.40,12.20
2421,סנובון ג`ל בניחוח פריחה,החברה הדרומית לשיווק בעמ,יח`,,1,14.20,14.20
2422,מקסימה מרכך פריחה לבנה סנו (4 ליטר),החברה הדרומית לשיווק בעמ,יח`,,1,22.40,5.60
2423,מנקה אסלות 00 1 ליטר ניחוח רענן,החברה הדרומית לשיווק בעמ,יח`,,1,12.30,12.30
2424,סנובון מוצק WAVE בתוספת אקונומיקה,החברה הדרומית לשיווק בעמ,יח`,,1,11.20,11.20
2425,פרוסות צ`יפס תפוגן (1.5 קג),קבוצת אסם סחר שות. מוגבלת,יח`,,1,26.50,1.77
2426,הר חרמון אינדיגו,היכל היין שקד גולן בעמ,יח`,,1,31.90,4.21
2427,הר חרמון מוסקט יקב רמת הגולן (750 מל),היכל היין שקד גולן בעמ,יח`,,1,31.90,4.21
2428,יין גמלא מרלו,היכל היין שקד גולן בעמ,יח`,,1,61.10,61.10
2429,מוזלי בוטנים אגוזים ושקדים 1קג - שקדיה,דין שיווק וקליה בעמ,יח`,,1,21.40,2.14
2430,מוזלי עם פירות שקדיה (1 קג),דין שיווק וקליה בעמ,יח`,,1,21.40,2.14
2431,מוזלי צימוקים תפוח קינומון 1קג - שקדיה,דין שיווק וקליה בעמ,יח`,,1,21.40,2.14
2432,גרנולה אגוזים 1קג - שקדיה,דין שיווק וקליה בעמ,יח`,,1,21.40,2.14
2433,קונפיטוריה פטל אדום 450גר`.,דין שיווק וקליה בעמ,יח`,,1,11.90,2.64
2434,קונפיטוריה תות שדה 450 גר`,דין שיווק וקליה בעמ,יח`,,1,11.90,2.64
2435,קונפיטוריה פטל שחור 450 גר`,דין שיווק וקליה בעמ,יח`,,1,11.90,2.64
2436,קונפיטוריה משמש 450 גר` שקדיה,דין שיווק וקליה בעמ,יח`,,1,11.90,2.64
2437,יין אדום יבש יובלים יקב דלתון (750 מל),הכרם - משקאות חריפים בעמ,יח`,,1,50.90,6.75
2438,יין לבן יובלים יקב דלתון (750 מל),הכרם - משקאות חריפים בעמ,יח`,,1,50.90,6.75
2439,יין כנען רוזה יקב דלתון (750 מל),הכרם - משקאות חריפים בעמ,יח`,,1,50.90,6.75
2440,מרבה סלים פרוט בטעם יוגורט ותפוח,ש.שסטוביץ בעמ,יח`,,1,15.20,8.35
2441,מרבה סלים פרוט בטעם יוגורט ותות,ש.שסטוביץ בעמ,יח`,,1,15.20,8.35
2442,מרבה סלים פרוט בטעם פירות יער,ש.שסטוביץ בעמ,יח`,,1,15.20,8.35
2443,מרבה סלים פרוט בטעם יוגורט ופירות יער,ש.שסטוביץ בעמ,יח`,,1,15.20,12.67
2444,סלים דליס קריספי תות מרבה (125 גרם),ש.שסטוביץ בעמ,יח`,,1,15.20,12.67
2445,סלים דליס קריספי אוכמניות מרבה (125 גרם),ש.שסטוביץ בעמ,יח`,,1,15.20,12.16
2446,סלים דליס קריספי שוקולד מרבה (125 גרם),ש.שסטוביץ בעמ,יח`,,1,15.20,12.16
2447,מרבה שוקודליס בציפוי שוקולד חלב 145 גר`,ש.שסטוביץ בעמ,יח`,,1,13.90,9.59
2448,מרבה שוקודליס עו,ש.שסטוביץ בעמ,יח`,,1,13.90,7.90
2449,מרבה שוקודליס עו,ש.שסטוביץ בעמ,יח`,,1,13.90,7.90
2450,מרבה שוקודליס במילוי קרם בטעם קפוצינו 14,ש.שסטוביץ בעמ,יח`,,1,13.90,9.59
2451,לה פסטה פסטה צינור 400 גר`,תומר יבוא ושיווק מוצרי מזון (1,יח`,,1,2.90,0.73
2452,לה פסטה קונכיה 53 400 גר`,תומר יבוא ושיווק מוצרי מזון (1,יח`,,1,2.90,0.73
2453,לה פסטה פסטה פרפר 81 400 גר`,תומר יבוא ושיווק מוצרי מזון (1,יח`,,1,2.90,0.73
2454,לה פסטה פסטה בורג 64 400 גר`,תומר יבוא ושיווק מוצרי מזון (1,יח`,,1,2.90,0.73
2455,לה פסטה פסטה תלתל 65 400 גר`,תומר יבוא ושיווק מוצרי מזון (1,יח`,,1,2.90,0.73
2456,לה פסטה פסטה אטריות מרק 400 גר`,תומר יבוא ושיווק מוצרי מזון (1,יח`,,1,2.90,0.73
2457,מאגדת-מיני מגנום דאבל,גלידות שטראוס בעמ,יח`,,1,30.50,30.50
2458,שטראוס קרמיסימו סנדיי וניל,גלידות שטראוס בעמ,יח`,,1,20.50,15.41
2459,שטראוס קרמסימו מסטיגם 1.33 ליטר,גלידות שטראוס בעמ,יח`,,1,20.50,15.41
2460,פירורי לחם זהוב תבליני מימון (800 גרם),א.ל.ייצור ושיווק תבלינים בעמ,יח`,,1,18.30,2.29
2461,גבינת ברי 125 גר,ג.וילי-פוד אינטרנשיונל בעמ,יח`,,1,20.30,16.24
2462,גבינת קממבר 125 גר,ג.וילי-פוד אינטרנשיונל בעמ,יח`,,1,20.30,16.24
2463,שיני שום במי מלח 340 גרם,ג.וילי-פוד אינטרנשיונל בעמ,יח`,,1,13.20,3.88
2464,עגבניות מיובשות בשמן 340 גר,ג.וילי-פוד אינטרנשיונל בעמ,יח`,,1,13.20,3.88
2465,פתיתים מגורדת וילי פוד (500 גרם) GOLDEN,ג.וילי-פוד אינטרנשיונל בעמ,יח`,,1,23.40,4.68
2466,גבינת מוצרלה מגורדת סיי צ`יז (200 גרם),ג.וילי-פוד אינטרנשיונל בעמ,יח`,,1,15.20,7.60
2467,גבינה מוצרלה בייבי 150 גר` כפיר,צ.י תעשיות מזון יבנה בעמ,יח`,,1,14.90,9.93
2468,שניצל ביתי עם צ`יפס שמח 600 גר` עוף טוב,קבוצת אסם סחר שות. מוגבלת,יח`,,1,41.80,6.97
2469,שניצל עוף דקיק קריספי 700 גר` עוף טוב,קבוצת אסם סחר שות. מוגבלת,יח`,,1,37.70,5.39
2470,שניצל דק ענקיסטי 700 גר` עוף טוב,קבוצת אסם סחר שות. מוגבלת,יח`,,1,37.70,5.39
2471,שניצל עוף ביתי כזה 700 גר` עוף טוב,קבוצת אסם סחר שות. מוגבלת,יח`,,1,46.90,6.70
2472,שניצל עוף היער הקסום 600 גר` עוף טוב,קבוצת אסם סחר שות. מוגבלת,יח`,,1,33.90,5.65
2473,שניצל עוף ביתי שומשום 700 גר` עוף טוב,קבוצת אסם סחר שות. מוגבלת,יח`,,1,46.90,6.70
2474,שניצל עוף ביתי קריספי 700 גר` עוף טוב,קבוצת אסם סחר שות. מוגבלת,יח`,,1,46.90,6.70
2475,שניצל עוף ביתי מתובל 600 גר` עוף טוב,קבוצת אסם סחר שות. מוגבלת,יח`,,1,38.90,6.48
2476,שניצל עוף ביתי עדין כזה 700 גר` עוף טוב,קבוצת אסם סחר שות. מוגבלת,יח`,,1,46.90,6.70
2477,צונגו רצועות שניצל ציפס 600 גר` עוף טוב,קבוצת אסם סחר שות. מוגבלת,יח`,,1,43.90,7.32
2478,צונגו רצועות שניצל חריף מתוק 600 גר` עוף,קבוצת אסם סחר שות. מוגבלת,יח`,,1,43.90,7.32
2479,צונגו רצועות שניצל גריל 600 גר` עוף טוב,קבוצת אסם סחר שות. מוגבלת,יח`,,1,43.90,7.32
2480,יוגורט ביו 3% תנובה (150x8 גרם),תנובה - חלב,יח`,,1,16.50,1.38
2481,יוגורט ביו 1.5% תנובה (150x8 גרם),תנובה - חלב,יח`,,1,16.50,1.38
2482,משקה שקדים טרי תנובה (1 ליטר),תנובה - חלב,יח`,,1,12.20,1.22
2483,יופלה דיאט תות ב,תנובה - חלב,יח`,,1,5,3.33
2484,מעדן שוקולד חלב יולו (123 גרם),תנובה - חלב,יח`,,1,4.50,3.66
2485,מעדן שוקולד מריר יולו (123 גרם),תנובה - חלב,יח`,,1,4.50,3.66
2486,מעדן שוקולד לבן יולו (123 גרם),תנובה - חלב,יח`,,1,4.50,3.66
2487,יולו מעדן שכבות שוקולד חלבי לבן,תנובה - חלב,יח`,,1,4.50,3.66
2488,יולו מעדן שכבות שוקולד מריר לבן,תנובה - חלב,יח`,,1,4.50,3.66
2489,דייאט יופלה 0% אוכמניות בתחתית,תנובה - חלב,יח`,,1,5,3.33
2490,משקה טעם וניל תנובה GO,תנובה - חלב,יח`,,1,6.10,2.44
2491,תה קר בטעם ענבים ספרינג (1.5 ליטר),יפאורה,יח`,,1,6.70,4.47
2492,שוופס ווטר 0 קלוריות תפוח 1.5 ליטר,יפאורה,יח`,,1,6.70,0.45
2493,שוופס ווטר 0 קלוריות אפרסק 1.5 ליטר,יפאורה,יח`,,1,6.70,0.45
2494,משקה מוגז בטעם ענבים שוופס (1.5 ליטר),יפאורה,יח`,,1,7.50,5
2495,משקה קל לימונדה נענע תפוזינה (1.5 ליטר),יפאורה,יח`,,1,6.90,0.46
2496,שוופס סודה נענע ליים 1.5 ליטר,יפאורה,יח`,,1,4.30,0.29
2497,משקה בטעם ענבים פרוט ווטר (1.5 ליטר),יפאורה,יח`,,1,8.10,0.54
2498,משקה בטעם אננס פרוט ווטר (1.5 ליטר),יפאורה,יח`,,1,8.10,0.54
2499,משקה בטעם אפרסק פרוט ווטר (1.5 ליטר),יפאורה,יח`,,1,8.10,0.54
2500,משקה בטעם אבטיח פרוט ווטר (1.5 ליטר),יפאורה,יח`,,1,8.10,0.54
2501,משקה בטעם תות פרוט ווטר (1.5 ליטר),יפאורה,יח`,,1,8.10,0.54
2502,מגבונים בייביסיטר רביעייה,שקד תבל בעמ,יח`,,1,19.30,19.30
2503,מגבונים בייביסיטר רביעייה,שקד תבל בעמ,יח`,,1,19.30,19.30
2504,שמפו קרטין 750 מל סטייל,גורי ע.ע.ע בעמ,יח`,,1,31.60,4.21
2505,מרכך קרטין 750 מל סטייל,גורי ע.ע.ע בעמ,יח`,,1,31.60,4.21
2506,מסיכה קרטין 500 מל סטייל,גורי ע.ע.ע בעמ,יח`,,1,41.80,8.36
2507,אקווה פרש מברשת שיניים גוניור,גורי ע.ע.ע בעמ,יח`,,1,13.50,13.50
2508,אקוה פרש הגנה כוללת 100 מל,גורי ע.ע.ע בעמ,יח`,,1,18.90,18.90
2509,מלפפונים במלח 690 גר` לינה,יורוסטנדרט בעמ,יח`,,1,11.20,1.62
2510,קורנישונים במלח 690 גר` לינה,יורוסטנדרט בעמ,יח`,,1,11.20,1.62
2511,ערק יודה 700 מל,יורוסטנדרט בעמ,יח`,,1,55.90,7.94
2512,לחם פשוט מלא לילדים פרוס אנג`ל (750 גרם),שלמה א. אנג`ל בעמ,יח`,,1,14.20,2.84
2513,אוטן אקטיב ספריי יבש דוחה יתושים,דנשר (1963) בעמ,יח`,,1,21.70,21.70
2514,אוטן ג`וניור ג`ל לילדים דוחה יתושים,דנשר (1963) בעמ,יח`,,1,21.70,21.70
2515,אוטן אפטר בייט 25 מל - דוחה יתושים,דנשר (1963) בעמ,יח`,,1,26.50,26.50
2516,גביעי גלידה 24 יח -גילרו,רזיט שיווק בעמ,יח`,,1,6.90,6.90
2517,גביעי גלידריה ללא גלוטן 12 יח,רזיט שיווק בעמ,יח`,,1,14.90,14.90
2518,פרש וואנס רביעייה מגבונים לחים קשמיר קיי,דנשר (1963) בעמ,יח`,,1,16.90,16.90
2519,טונה בשמן רביעייה 160 גר - וילי פוד,ג.וילי-פוד אינטרנשיונל בעמ,יח`,,1,22.90,3.58
2520,טונה במים רביעייה 160 גר - וילי פוד,ג.וילי-פוד אינטרנשיונל בעמ,יח`,,1,22.90,3.58
2521,מיקסים בייגלה מצ,כרמית תעשיות ממתקים בעמ,יח`,,1,4,4
2522,מיקסים קוביות וופל 55 גר 16 בקרטון,כרמית תעשיות ממתקים בעמ,יח`,,1,4,4
2523,פאוץ` פרינוק תפוח 120 גר`,גורי מוצרי צריכה (1991) בעמ,יח`,,1,6.20,5.17
2524,פאוץ` פרינוק תפוח בננה 120 גר`,גורי מוצרי צריכה (1991) בעמ,יח`,,1,6.20,5.17
2525,פאוץ` פרינוק מחית סלט פירות 120 גר,גורי מוצרי צריכה (1991) בעמ,יח`,,1,6.20,5.17
2526,פאוץ` פרינוק תפוח אכומניות 120 גר`,גורי מוצרי צריכה (1991) בעמ,יח`,,1,6.20,5.17
2527,פאוץ` פרינוק פירות טרופיים 120 גר`,גורי מוצרי צריכה (1991) בעמ,יח`,,1,6.20,5.17
2528,פאוץ` פרינוק לפתן פירות 120 גר`,גורי מוצרי צריכה (1991) בעמ,יח`,,1,6.20,5.17
2529,פאוץ` פרינוק פירות מעורבים 120 גר`,גורי מוצרי צריכה (1991) בעמ,יח`,,1,6.20,5.17
2530,פלפל שחור גרוס 80 גר`,תבליני טעם וריח בעמ,יח`,,1,9.90,12.38
2531,פלפל שחור טחון 80 גר`,תבליני טעם וריח בעמ,יח`,,1,9.90,12.38
2532,פפריקה מתוקה בשמן 80 גר`,תבליני טעם וריח בעמ,יח`,,1,5.90,7.38
2533,פפריקה חריפה 80 גר`,תבליני טעם וריח בעמ,יח`,,1,5.90,7.38
2534,פפריקה מתוקה 80 גר`,תבליני טעם וריח בעמ,יח`,,1,5.90,7.38
2535,גריל עוף 80 גר`,תבליני טעם וריח בעמ,יח`,,1,5.90,7.38
2536,זעתר מעורב 80 גר`,תבליני טעם וריח בעמ,יח`,,1,5.90,7.38
2537,מלח לימון 80 גר`,תבליני טעם וריח בעמ,יח`,,1,5.90,7.38
2538,כמון טחון 80 גר`,תבליני טעם וריח בעמ,יח`,,1,5.90,7.38
2539,כורכום טחון 80 גר`,תבליני טעם וריח בעמ,יח`,,1,5.90,7.38
2540,בהרט 80 גר`,תבליני טעם וריח בעמ,יח`,,1,5.90,7.38
2541,שום גבישי 80 גר`,תבליני טעם וריח בעמ,יח`,,1,7.90,9.88
2542,חוואיג` למרק 80 גר`,תבליני טעם וריח בעמ,יח`,,1,5.90,7.38
2543,תיבול על האש 80 גר`,תבליני טעם וריח בעמ,יח`,,1,5.90,7.38
2544,תיבול לשווארמה 80 גר`,תבליני טעם וריח בעמ,יח`,,1,5.90,7.38
2545,מרינדת עוף קלאסי- פפריקה שום עגבניות 25,תבליני טעם וריח בעמ,יח`,,1,5.90,23.60
2546,מרינדת עוף פיקנטי- צ`ילי שום עגבניות 25,תבליני טעם וריח בעמ,יח`,,1,5.90,23.60
2547,מרינדת עוף איטלקי לימון- שום עשבי תיבול,תבליני טעם וריח בעמ,יח`,,1,5.90,23.60
2548,פפריקה מתוקה שקית 250 גרם,תבליני טעם וריח בעמ,יח`,,1,9.90,3.96
2549,כורכום שקית 250 גרם,תבליני טעם וריח בעמ,יח`,,1,9.90,3.96
2550,פפריקה מרוקאית מתוקה בשמן שקית 250גר`,תבליני טעם וריח בעמ,יח`,,1,9.90,3.96
2551,מלח לימון שקית 500 גר`,תבליני טעם וריח בעמ,יח`,,1,9.90,1.98
2552,סודה לשתיה 80 גר`,תבליני טעם וריח בעמ,יח`,,1,3.90,4.88
2553,תערובת במתיקות מעודנת 70 גר`,תבליני טעם וריח בעמ,יח`,,1,5.90,8.43
2554,תערובת הודית 70 גר`,תבליני טעם וריח בעמ,יח`,,1,5.90,8.43
2555,תערובת פרסית 70 גר`,תבליני טעם וריח בעמ,יח`,,1,5.90,8.43
2556,תערובת מזרחית 70 גר`,תבליני טעם וריח בעמ,יח`,,1,5.90,8.43
2557,תערובת מקסיקנית חריפה 70 גר`,תבליני טעם וריח בעמ,יח`,,1,5.90,8.43
2558,פלפל שחור שלם 80 גר`,תבליני טעם וריח בעמ,יח`,,1,9.90,12.38
2559,נטיפי שוקולד לאפייה שוקולדמריר 250גר,מיה תעשיות מזון מ.ת.מ. בעמ,יח`,,1,11.20,4.48
2560,אמיליאנו למברוסק,טמפו משקאות בעמ,יח`,,1,31.60,4.17
2561,יין למברסקו ביאנקו לבן 750 מל,טמפו משקאות בעמ,יח`,,1,31.60,4.17
2562,אמיליאנו למברוסק,טמפו משקאות בעמ,יח`,,1,31.60,4.17
2563,ריחן קברנה סוביניון 750 מל ברקן,טמפו משקאות בעמ,יח`,,1,67.30,8.93
2564,מרום גליל רוזה 750 מל,טמפו משקאות בעמ,יח`,,1,44.10,5.84
2565,ברנדי שטוק 84 דבש ( 750 מל),טמפו משקאות בעמ,יח`,,1,71.30,9.47
2566,רזרב מוסקט ורוד חצי יבש 750 מל יקבי ברק,טמפו משקאות בעמ,יח`,,1,53,7.03
2567,אקווה פרש הגנה כוללת מלבינה 100 מל,גורי ע.ע.ע בעמ,יח`,,1,18.90,18.90
2568,ספירה מכשיר חשמלי להרחקת יתושים,גורי ע.ע.ע בעמ,יח`,,1,37.70,37.70
2569,ספירה מכשיר חשמלי להרחקת יתושים,גורי ע.ע.ע בעמ,יח`,,1,47.90,47.90
2570,אקוה פרש 100 מל עדין,גורי ע.ע.ע בעמ,יח`,,1,9.10,9.10
2571,משחת שיניים בטעם מנטה אקוהפרש (100 מל),גורי ע.ע.ע בעמ,יח`,,1,9.10,9.10
