,ItemName,ManufactureName,UnitQty,Quantity,QtyInPackage,ItemPrice,UnitOfMeasurePrice
2102,אנטי קאלק מגבונים לניקוי כללי,החברה הדרומית לשיווק בעמ,יח`,,1,10.90,10.90
2103,סנו מקסימה מרכך 1 ליטר ורוד פסים,החברה הדרומית לשיווק בעמ,יח`,,1,17.90,1.79
2104,סנו פרש מטליות לחות לרצפה ריצפז (10),החברה הדרומית לשיווק בעמ,יח`,,1,11.90,11.90
2105,מטליות לחות לריצפה סנו סושי (10),החברה הדרומית לשיווק בעמ,יח`,,1,9.90,9.90
2106,ריצפז פרש 2 ליטר,החברה הדרומית לשיווק בעמ,יח`,,1,21.90,0.01
2107,רסס ונגב - מילוי סנו (750 מל),החברה הדרומית לשיווק בעמ,יח`,,1,11.90,1.59
2108,מחית תפוחי עץ שלב 3 בילובד (190 גרם),שקד תבל בעמ,יח`,,1,5.90,3.11
2109,מחית תפוחי עץ ואפרסק 190גר,שקד תבל בעמ,יח`,,1,5.90,3.11
2110,מחית סלט פירות שלב 3 בילובד (190 גרם),שקד תבל בעמ,יח`,,1,5.90,3.11
2111,קרם קוקוס טעמי אסיה (400 מל),טעמי אסיה בעמ,יח`,,1,9.90,2.48
2112,בירה בהירה בירה מלכה (330 מל),הכרם - משקאות חריפים בעמ,יח`,,1,13.90,4.12
2113,בירה אדמונית בירה מלכה (330 מל),הכרם - משקאות חריפים בעמ,יח`,,1,13.90,4.12
2114,בירה מלכה חיטה 330 מל,הכרם - משקאות חריפים בעמ,יח`,,1,13.90,4.12
2115,הלבנה עדינה סנסודיין (75 מל),גורי ע.ע.ע בעמ,יח`,,1,20,26.67
2116,משחת שיניים בטעם מנטה סנסודיין (75 מל),גורי ע.ע.ע בעמ,יח`,,1,20,26.67
2117,אקווה פרש מי פה 500 מל,גורי ע.ע.ע בעמ,יח`,,1,19.90,3.98
2118,משקה קל תפוחים ג`אמפ (1.5 ליטר),טמפו משקאות בעמ,יח`,,1,5.50,0.37
2119,מטרנה אקסטרא קייר 700 גר` שלב 1,קבוצת אסם סחר שות. מוגבלת,יח`,,1,59.90,8.56
2120,מטרנה אקסטרא קייר 700 גר` שלב 2,קבוצת אסם סחר שות. מוגבלת,יח`,,1,59.90,8.56
2121,מטרנה אקסטרא קייר 700 גר` שלב3,קבוצת אסם סחר שות. מוגבלת,יח`,,1,59.90,8.56
2122,בורקס פילו גבינה מעדנות,תנובה קפואים,יח`,,1,21.90,3.65
2123,בורקס פילו תפוא מעדנות,תנובה קפואים,יח`,,1,21.90,3.65
2124,בורקס פילו פיצה מעדנות,תנובה קפואים,יח`,,1,21.90,3.65
2125,בורקס פילו בולגרית מעדנות,תנובה קפואים,יח`,,1,21.90,3.65
2126,בצק פריך מתוק 900 גר` מעדנות,תנובה קפואים,יח`,,1,24,2.67
2127,בצק פריך מלוח 900 גר` מעדנות,תנובה קפואים,יח`,,1,24,2.67
2128,בצק שמרים מתוק מעדנות,תנובה קפואים,יח`,,1,22.90,2.54
2129,תערובת עוגת שוקולד 560 גר`,מימונס אפיה בעמ,יח`,,1,17.90,3.20
2130,תערובת בראוניס 600 גר`,מימונס אפיה בעמ,יח`,,1,15.90,2.65
2131,תערובת כדורי שוקולד 500 גר`,מימונס אפיה בעמ,יח`,,1,17.90,3.58
2132,תערובת להכנת פנקייק מימונס (400 גרם),מימונס אפיה בעמ,יח`,,1,15.90,3.98
2133,תערובת עוגת וניל מימונס (560 גרם),מימונס אפיה בעמ,יח`,,1,15.90,2.84
2134,תערובת עוגת שיש 560 גר`,מימונס אפיה בעמ,יח`,,1,15.90,2.84
2135,פודינג בטעם וניל 85 גר` מימונס,מימונס אפיה בעמ,יח`,,1,5.90,6.94
2136,פודינג בטעם שוקולד 95 גר` מימונס,מימונס אפיה בעמ,יח`,,1,5.90,6.21
2137,ג`לי בטעם תות 85 גר` מימונס,מימונס אפיה בעמ,יח`,,1,5.90,6.94
2138,גלילית וופל למילוי ג`וני,מימונס אפיה בעמ,יח`,,1,22.90,5.73
2139,סירופ מייפל אמיתי מימונס (236 מל),מימונס אפיה בעמ,יח`,,1,38.90,16.48
2140,אגוז מלך קלוף מימונס (100 גרם),מימונס אפיה בעמ,יח`,,1,11.90,11.90
2141,אגוז מלך טחון מימונס (100 גרם),מימונס אפיה בעמ,יח`,,1,11.90,11.90
2142,100%סירופ מייפל אמיתי 187 מל,מימונס אפיה בעמ,יח`,,1,29.90,15.99
2143,עלים לקרמשניט 300 גר,מימונס אפיה בעמ,יח`,,1,15.90,5.30
2144,ג`ל טעם לימון 95 גר מימונס,מימונס אפיה בעמ,יח`,,1,5.90,6.21
2145,פודינג בטעם וניל לבן 80 גר` מימונס,מימונס אפיה בעמ,יח`,,1,5.90,7.38
2146,פודינג בטעם שוקולד 80 גר` מימונס,מימונס אפיה בעמ,יח`,,1,5.90,7.38
2147,מלית פרג 400 גר`,מימונס אפיה בעמ,יח`,,1,19.90,4.98
2148,מלית אוכמניות 70% פרי 400 גר`,מימונס אפיה בעמ,יח`,,1,19.90,4.98
2149,מלית תפוח עץ 70% פרי 400 גר`.,מימונס אפיה בעמ,יח`,,1,19.90,4.98
2150,מלית דובדבנים 70% פרי 400 גר`,מימונס אפיה בעמ,יח`,,1,19.90,4.98
2151,מלית תות שדה 400 גר`,מימונס אפיה בעמ,יח`,,1,19.90,4.98
2152,מלית שוקולד,מימונס אפיה בעמ,יח`,,1,11.90,2.98
2153,ממרח קרם נוגט,מימונס אפיה בעמ,יח`,,1,15.90,4.54
2154,מארז 8 יח תחתיות מרנג 10 גר` מימונס,מימונס אפיה בעמ,יח`,,1,18.90,18.90
2155,תחתיות בצק פריך לאפייה ומילוי -טארטלטים,מימונס אפיה בעמ,יח`,,1,18.90,18.90
2156,סירופ בטעם קרמל מלוח 500 גר` מימונס,מימונס אפיה בעמ,יח`,,1,17.90,3.58
2157,כוכבים תכלת ירוק לבן לקישוט 60 גר` מימונ,מימונס אפיה בעמ,יח`,,1,10.90,18.17
2158,אטריות צבעוניות לקישוט 55 גר` מימונס,מימונס אפיה בעמ,יח`,,1,10.90,19.82
2159,סוכריות לב סגול לבן לקישוט 60 מימונס,מימונס אפיה בעמ,יח`,,1,10.90,18.17
2160,מיקס טרופי א.מ שרון (500 גרם),א.מ. שרון שיווק (2014) בעמ,יח`,,1,24.90,4.98
2161,דובדבן קפוא א.מ שרון (500 גרם),א.מ. שרון שיווק (2014) בעמ,יח`,,1,19.90,3.98
2162,פטל אדום א.מ שרון (500 גרם),א.מ. שרון שיווק (2014) בעמ,יח`,,1,24.90,4.98
2163,דומדמנית שחורה א.מ שרון (500 גרם),א.מ. שרון שיווק (2014) בעמ,יח`,,1,24.90,4.98
2164,מיקס פירות שדה א.מ שרון (500 גרם),א.מ. שרון שיווק (2014) בעמ,יח`,,1,24.90,4.98
2165,פטל שחור א.מ שרון (500 גרם),א.מ. שרון שיווק (2014) בעמ,יח`,,1,24.90,4.98
2166,חמוצית גן א.מ שרון (400 גרם),א.מ. שרון שיווק (2014) בעמ,יח`,,1,24.90,6.23
2167,דומדמנית אדומה 500 גרם,א.מ. שרון שיווק (2014) בעמ,יח`,,1,24.90,4.98
2168,מיקס פירות יער א.מ שרון (500 גרם),א.מ. שרון שיווק (2014) בעמ,יח`,,1,24.90,4.98
2169,תות שדה א.מ שרון (500 גרם),א.מ. שרון שיווק (2014) בעמ,יח`,,1,24.90,4.98
2170,אוכמנית א.מ שרון (400 גרם),א.מ. שרון שיווק (2014) בעמ,יח`,,1,24.90,6.23
2171,אננס קפוא 500 גר`,א.מ. שרון שיווק (2014) בעמ,יח`,,1,24.90,4.98
2172,מנגו קפוא 500 גר`,א.מ. שרון שיווק (2014) בעמ,יח`,,1,24.90,4.98
2173,מלון קפוא 500 גר`,א.מ. שרון שיווק (2014) בעמ,יח`,,1,24.90,4.98
2174,שטראוס קרמיסימו,גלידות שטראוס בעמ,יח`,,1,18.90,14.21
2175,מאגדת מיני סולרו פירות טרופי,גלידות שטראוס בעמ,יח`,,1,21.90,4.56
2176,סנו מקסימה מרכך 1 ליטר כחול פסים,החברה הדרומית לשיווק בעמ,יח`,,1,17.90,1.79
2177,סנו מקסימה מרכך 1 ליטר סגול,החברה הדרומית לשיווק בעמ,יח`,,1,17.90,1.79
2178,ריצפז פרש 2 ליטר מאסק,החברה הדרומית לשיווק בעמ,יח`,,1,21.90,10.95
2179,אוקסיג`ן ג`ל 3 ליטר,החברה הדרומית לשיווק בעמ,יח`,,1,29.90,9.97
2180,מקסימה ג`ל כביסה 3 ליטר,החברה הדרומית לשיווק בעמ,יח`,,1,29.60,9.87
2181,סנובון שלישיה מאסק,החברה הדרומית לשיווק בעמ,יח`,,1,11.90,6.10
2182,מקסימה מרכך סופר מרוכז ביו סנו (1 ליטר),החברה הדרומית לשיווק בעמ,יח`,,1,17.90,1.79
2183,מטליות לחות למוצרי עור סנו (20),החברה הדרומית לשיווק בעמ,יח`,,1,19.90,19.90
2184,מקסימה ג`ל כביסה 3 ליטר,החברה הדרומית לשיווק בעמ,יח`,,1,29.60,9.87
2185,מקסימה ג`ל כביסה 3 ליטר,החברה הדרומית לשיווק בעמ,יח`,,1,29.60,0.01
2186,ריצפז פרש מטליות חד פעמיות 10 יח`,החברה הדרומית לשיווק בעמ,יח`,,1,12.90,12.90
2187,ריצפז 3 ליטר פנטזיה,החברה הדרומית לשיווק בעמ,יח`,,1,17.90,5.97
2188,סנובון ג`ל בניחוח לימון,החברה הדרומית לשיווק בעמ,יח`,,1,12.90,19.85
2189,סנובון ג`ל בניחוח אוקיינוס,החברה הדרומית לשיווק בעמ,יח`,,1,12.90,19.85
2190,אורביטול מברשת שיניים פיות,החברה הדרומית לשיווק בעמ,יח`,,1,12.90,12.90
2191,מפות שולחן 120*180 סמ סנו (2),החברה הדרומית לשיווק בעמ,יח`,,1,9.90,9.90
2192,קוטל חרקים קיי 333 סנו (750 מל),החברה הדרומית לשיווק בעמ,יח`,,1,36.90,4.92
2193,קוטל מעופפים קיי פירטרום סנו (400 מל),החברה הדרומית לשיווק בעמ,יח`,,1,24.90,6.23
2194,בירה נגב אואזיס 330 מל,הכרם - משקאות חריפים בעמ,יח`,,1,13.90,4.12
2195,בירה נגב אמבר אייל 330 מל,הכרם - משקאות חריפים בעמ,יח`,,1,13.90,4.12
2196,פירורי לחם מוזהבים מאסטר שף (320גרם),ש.שסטוביץ בעמ,יח`,,1,7.90,2.47
2197,פירורי לחם פנקו מוזהבים 300 גר` מנה מאסט,ש.שסטוביץ בעמ,יח`,,1,9.90,3.30
2198,פירורי לחם פנקו מוזהבים שום 300 גר` מנה,ש.שסטוביץ בעמ,יח`,,1,9.90,3.30
2199,רוטב טריאקי מאסטר שף (300 מל),ש.שסטוביץ בעמ,יח`,,1,11.90,3.97
2200,רוטב צ`ילי מתוק מאסטר שף (700 מל),ש.שסטוביץ בעמ,יח`,,1,12.90,1.84
2201,רוטב צ`ילי חריף מאסטר שף (700 מל),ש.שסטוביץ בעמ,יח`,,1,12.90,1.84
2202,חצאי אפרסקים 820 גר` מהדרין,ג.וילי-פוד אינטרנשיונל בעמ,יח`,,1,7.90,0.96
2203,סירופ 1 ליטר דיאט לימונענע,זנלכל בעמ,יח`,,1,7.90,0.79
2204,פחית דיאט ספרייט 330 מל,החברה המרכזית להפצת משקאות בעמ,יח`,,1,4.50,1.27
2205,משקה קל לימונענע פריגת (1.5 ליטר),החברה המרכזית להפצת משקאות בעמ,יח`,,1,7.20,0.48
2206,ספרייט זירו 330 מל סילק,החברה המרכזית להפצת משקאות בעמ,יח`,,1,4.50,1.27
2207,מארז מיוחד בירה קרלסברג (330x6 מל),החברה המרכזית להפצת משקאות בעמ,יח`,,1,36.90,1.77
2208,מארז סודה קינלי 1.5 ליטר שישייה,החברה המרכזית להפצת משקאות בעמ,יח`,,1,19.90,0.22
2209,מארז ספרייט 6 פחיות FRIDGE PACK,החברה המרכזית להפצת משקאות בעמ,יח`,,1,19.90,19.90
2210,ויסוצקי ice נענע 1.5 ליטר,החברה המרכזית להפצת משקאות בעמ,יח`,,1,7.90,5.27
2211,ויסוצקי ice לימונית לואיזה 1.5 ליטר,החברה המרכזית להפצת משקאות בעמ,יח`,,1,7.90,5.27
2212,ויסוצקי ice היביסקוס פ.אדומים 1.5 ליטר,החברה המרכזית להפצת משקאות בעמ,יח`,,1,7.90,5.27
2213,ויסוצקי ice ארל גריי 1.5 ליטר,החברה המרכזית להפצת משקאות בעמ,יח`,,1,7.90,5.27
2214,מיץ רימונים סחוט פרימור (1 ליטר),שטראוס גרופ בעמ/מצונן,יח`,,1,23.20,23.20
2215,מיץ תפוזים אורגני 750 מל פרימור 100%,שטראוס גרופ בעמ/מצונן,יח`,,1,14.90,14.90
2216,מיץ אשכולית אדומה אורגני 750 מל,שטראוס גרופ בעמ/מצונן,יח`,,1,14.90,14.90
2217,שניצל אותיות מאמא עוף (700 גרם),תנובה קפואים,יח`,,1,34.90,4.99
2218,שניצל כלי תחבורה מאמא עוף (700 גרם),תנובה קפואים,יח`,,1,34.90,4.99
2219,פסטה א-לה רומר להקפצה 450 גר` מאמא עוף,תנובה קפואים,יח`,,1,19.90,4.42
2220,חגיגה אסייתית להקפצה 450 גר` מאמא עוף,תנובה קפואים,יח`,,1,19.90,4.42
2221,ירוק גלילי להקפצה 450 גר` מאמא עוף,תנובה קפואים,יח`,,1,19.90,4.42
2222,אבקת שוקו 500 גר`,מיה תעשיות מזון מ.ת.מ. בעמ,יח`,,1,6.90,1.38
2223,מים בטעם פירות יער שוופס (1.5 ליטר),יפאורה,יח`,,1,6.30,0.42
2224,מים בטעם אפרסק שוופס (1.5 ליטר),יפאורה,יח`,,1,6.30,0.42
2225,שוופס ווטר אפרסק 500מל,יפאורה,יח`,,1,4.80,0.90
2226,מים בטעם ענבים שוופס (1.5 ליטר),יפאורה,יח`,,1,6.30,0.42
2227,שוופס ווטר ענבים 500מל,יפאורה,יח`,,1,4.80,0.90
2228,מים בטעם תפוח שוופס (1.5 ליטר),יפאורה,יח`,,1,6.30,0.42
2229,שוופס ווטר תפוח 500מל,יפאורה,יח`,,1,4.80,0.90
2230,משקה מוגז לימונייד שוופס (1.5 ליטר),יפאורה,יח`,,1,6.90,0.46
2231,משקה מוגז לימונדה ורודה שוופס (1.5 ליטר),יפאורה,יח`,,1,6.90,0.46
2232,משקה מוגז למון ליים שוופס (1.5 ליטר),יפאורה,יח`,,1,6.90,0.46
2233,שוופס דיאט למון ליים 1.5 ל`,יפאורה,יח`,,1,6.90,0.46
2234,שוופס מוגז עדין 1.5 ליטר אננס,יפאורה,יח`,,1,6.90,0.46
2235,שישיית שוופס למון ליים 1.5 ל`,יפאורה,יח`,,1,34.90,34.90
2236,שישיית שוופס דיאט למון ליים 1.5 ל`,יפאורה,יח`,,1,34.90,34.90
2237,משקה פירות בטעם גווארנה שוופס (1.5 ליטר),יפאורה,יח`,,1,6.90,4.60
2238,בירה ג`מס בקבוק פילס 330 מל,יורוסטנדרט בעמ,יח`,,1,12.90,3.82
2239,בירה ג`מס בקבוק חיטה 330 מל,יורוסטנדרט בעמ,יח`,,1,12.90,3.82
2240,בירה ג`מס בקבוק 8.80% אלכוהול ( 330 מל),יורוסטנדרט בעמ,יח`,,1,12.90,3.82
2241,משוקלדים חמוציות מריר 160 גר` בקופסא,דין שיווק וקליה בעמ,יח`,,1,11.90,7.44
2242,משוקלדים פקאן מריר 160 גר` בקופסא,דין שיווק וקליה בעמ,יח`,,1,11.90,7.44
2243,משוקלדים חמוציות חלב 160 גר` בקופסא,דין שיווק וקליה בעמ,יח`,,1,11.90,7.44
2244,משוקלדים שקד חלב 160 גר` בקופסא,דין שיווק וקליה בעמ,יח`,,1,11.90,7.44
2245,משוקלדים צימוק מריר 160 גר` בקופסא,דין שיווק וקליה בעמ,יח`,,1,11.90,7.44
2246,משוקלדים בוטן מריר 160 גר` בקופסא,דין שיווק וקליה בעמ,יח`,,1,11.90,7.44
2247,משוקלדים לוז חלב 160 גר` בקופסא,דין שיווק וקליה בעמ,יח`,,1,11.90,7.44
2248,משוקלדים לוז מריר 160 גר` בקופסא,דין שיווק וקליה בעמ,יח`,,1,11.90,7.44
2249,משוקלדים שומשום חלב 160 גר` בקופסא,דין שיווק וקליה בעמ,יח`,,1,11.90,7.44
2250,משוקלדים שומשום מריר 160 גר` בקופסא,דין שיווק וקליה בעמ,יח`,,1,11.90,7.44
2251,מגבונים לניקוי כללי סנו סושי (50),החברה הדרומית לשיווק בעמ,יח`,,1,9.90,9.90
2252,קרמה דאודורנט ספריי -קלאסי,החברה הדרומית לשיווק בעמ,יח`,,1,19.90,13.27
2253,דאודורנט ספריי מאסק קרמה (150 מל),החברה הדרומית לשיווק בעמ,יח`,,1,19.90,13.27
2254,קרמה דאודורנט ספריי -אורכידאה,החברה הדרומית לשיווק בעמ,יח`,,1,19.90,13.27
2255,משוקלדים צימוק חלב 160 גר` בקופסא,דין שיווק וקליה בעמ,יח`,,1,11.90,7.44
2256,משוקלדים בוטן חלב 160 גר` בקופסא,דין שיווק וקליה בעמ,יח`,,1,11.90,7.44
2257,נקניקיות פרגיות 300 גר` טירת צבי,תנובה קפואים,יח`,,1,13.90,4.63
2258,פסטרמה שום וצילי טירת צבי (400 גרם),תנובה קפואים,יח`,,1,31.90,7.98
2259,נקניקיות וינר 1 קג` טירת צבי,תנובה קפואים,יח`,,1,32.90,6.58
2260,סלמי גלבוע 400 גר` טירת צבי,תנובה קפואים,יח`,,1,23.90,5.98
2261,קבנוס 120 גר` טירת צבי,תנובה קפואים,יח`,,1,11.90,9.92
2262,קבנוס 120 גר` פיקנטי טירת צבי,תנובה קפואים,יח`,,1,11.90,9.92
2263,חטיפי קבנוס 120 גר` טירת צבי,תנובה קפואים,יח`,,1,11.90,9.92
2264,צמד כפרי ברבקיו ודבש 600 גר טירת צבי,תנובה קפואים,יח`,,1,29.90,4.98
2265,טרין מוס כבד עוף 120 גר` תנובה,תנובה קפואים,יח`,,1,15.90,13.25
2266,סירופ בטעם ענבים מועשר בויטמינים 1 ליטר,אחדות בעמ,יח`,,1,8.50,8.50
2267,סירופ בטעם פטל מועשר בויטמינים 1 ליטר אח,אחדות בעמ,יח`,,1,8.50,8.50
2268,סירופ בטעם אננס מועשר בויטמינים 1 ליטר א,אחדות בעמ,יח`,,1,8.50,8.50
2269,ממרח טחינה עם דבש 400 גר` אחווה,אחדות בעמ,יח`,,1,11.90,2.98
2270,נשנושי קבנוס יחיעם (125 גרם),מעדני יחיעם (1993) בעמ,יח`,,1,12.90,10.32
2271,נקניקיות עוף 1.5 קג,מעדני יחיעם (1993) בעמ,יח`,,1,29.90,29.90
2272,פסטרמה ברביקיו דק דק יחיעם (140 גרם),מעדני יחיעם (1993) בעמ,יח`,,1,12.90,9.21
2273,פסטרמה בדבש דק דק יחיעם (140 גרם),מעדני יחיעם (1993) בעמ,יח`,,1,12.90,9.21
2274,פסטרמה של פעם דק דק יחיעם (140 גרם),מעדני יחיעם (1993) בעמ,יח`,,1,12.90,9.21
2275,פסטרמה מעודנת על גחלים יחיעם (300 גרם),מעדני יחיעם (1993) בעמ,יח`,,1,23.90,7.97
2276,סלמי תה יחיעם (300 גרם),מעדני יחיעם (1993) בעמ,יח`,,1,25.90,8.63
2277,סלמי פפרוני 200 גר` יחיעם,מעדני יחיעם (1993) בעמ,יח`,,1,14.90,7.45
2278,גבינת גאודה פרוסות 150 גר,ג.וילי-פוד אינטרנשיונל בעמ,יח`,,1,9.90,6.60
2279,אורז בסמטי אהרוני (1 קג),דין שיווק וקליה בעמ,יח`,,1,12.90,12.90
2280,שיבולת שועל דקה שקדיה (500 גרם),דין שיווק וקליה בעמ,יח`,,1,5.90,1.18
2281,משוקלדים שקד מריר 160 גר` בקופסא,דין שיווק וקליה בעמ,יח`,,1,11.90,7.44
2282,משוקלדים פקאן חלב 160 גר` בקופסא,דין שיווק וקליה בעמ,יח`,,1,11.90,7.44
2283,שיבולת שועל עבה שקדיה (500 גרם),דין שיווק וקליה בעמ,יח`,,1,5.90,1.18
2284,בישקוטים וניל קקאו בונומי (200 גרם),דנשר (1963) בעמ,יח`,,1,7.90,3.95
2285,מואי עוגיות קקאו ושוקלד מריר עם קרם אספר,דנשר (1963) בעמ,יח`,,1,17.90,9.94
2286,מואי עוגיות קקאו ושוקולד עם קרם ברולה,דנשר (1963) בעמ,יח`,,1,17.90,9.94
2287,אל סבון נוזלי פנינה רוזנבלום (500x3 גרם),פנינה רוזנבלום בעמ,יח`,,1,13.90,9.27
2288,גרנולה שוקולד מריר+לבן 400 גר` פנינה רוז,פנינה רוזנבלום בעמ,יח`,,1,29.90,7.48
2289,מרכך לאחר החלקה 750 מל פנינה רוזנבלום,פנינה רוזנבלום בעמ,יח`,,1,29.90,3.99
2290,שמפו לאחר החלקה 750 מל פנינה רוזנבלום,פנינה רוזנבלום בעמ,יח`,,1,29.90,3.99
2291,מסיכה לאחר החלקה 500 מל פנינה רוזנבלום,פנינה רוזנבלום בעמ,יח`,,1,34.90,6.98
2292,רוטב עוף 800 גרם,פנינה רוזנבלום בעמ,יח`,,1,17.90,2.24
2293,קריניאנו 750 מל BUZZ,אגודת הכורמים,יח`,,1,26.90,3.55
2294,מוסקטו 750 מל BUZZ,אגודת הכורמים,יח`,,1,26.90,3.55
2295,קורנפלור מיה (500 גרם),מיה תעשיות מזון מ.ת.מ. בעמ,יח`,,1,8.90,1.78
2296,שקיות מזון סנו סושי (300),החברה הדרומית לשיווק בעמ,יח`,,1,11.90,11.90
2297,מקסימה מרכך מרוכז חלב ודבש סנו (1 ליטר),החברה הדרומית לשיווק בעמ,יח`,,1,17.90,1.79
2298,סנו מקסימה מרכך 1 ליטר ורוד,החברה הדרומית לשיווק בעמ,יח`,,1,17.90,1.79
2299,אוקסיג`ן ג`ל 3 ליטר כביסה לבנה,החברה הדרומית לשיווק בעמ,יח`,,1,29.90,9.97
2300,סנופרש הום נטול גז 350 מל בניחוח בוקר א,החברה הדרומית לשיווק בעמ,יח`,,1,14.90,4.26
2301,פוליויקס 3 ליטר,החברה הדרומית לשיווק בעמ,יח`,,1,22.90,11.45
2302,סנובון ג`ל בניחוח פריחה,החברה הדרומית לשיווק בעמ,יח`,,1,12.90,12.90
2303,מנקה אסלות 00 1 ליטר ניחוח רענן,החברה הדרומית לשיווק בעמ,יח`,,1,10.90,10.90
2304,סנובון מוצק WAVE בתוספת אקונומיקה,החברה הדרומית לשיווק בעמ,יח`,,1,9.90,9.90
2305,פרוסות צ`יפס תפוגן (1.5 קג),קבוצת אסם סחר שות. מוגבלת,יח`,,1,24.90,1.66
2306,הר חרמון אינדיגו,היכל היין שקד גולן בעמ,יח`,,1,30.90,4.08
2307,הר חרמון מוסקט יקב רמת הגולן (750 מל),היכל היין שקד גולן בעמ,יח`,,1,30.90,4.08
2308,מוזלי בוטנים אגוזים ושקדים 1קג - שקדיה,דין שיווק וקליה בעמ,יח`,,1,19.90,1.99
2309,מוזלי עם פירות שקדיה (1 קג),דין שיווק וקליה בעמ,יח`,,1,19.90,1.99
2310,מוזלי צימוקים תפוח קינומון 1קג - שקדיה,דין שיווק וקליה בעמ,יח`,,1,19.90,1.99
2311,גרנולה אגוזים 1קג - שקדיה,דין שיווק וקליה בעמ,יח`,,1,19.90,1.99
2312,קונפיטוריה פטל אדום 450גר`.,דין שיווק וקליה בעמ,יח`,,1,10.90,2.42
2313,קונפיטוריה תות שדה 450 גר`,דין שיווק וקליה בעמ,יח`,,1,10.90,2.42
2314,קונפיטוריה פטל שחור 450 גר`,דין שיווק וקליה בעמ,יח`,,1,10.90,2.42
2315,קונפיטוריה משמש 450 גר` שקדיה,דין שיווק וקליה בעמ,יח`,,1,10.90,2.42
2316,יין אדום יבש יובלים יקב דלתון (750 מל),הכרם - משקאות חריפים בעמ,יח`,,1,48.90,6.48
2317,יין לבן יובלים יקב דלתון (750 מל),הכרם - משקאות חריפים בעמ,יח`,,1,48.90,6.48
2318,יין כנען רוזה יקב דלתון (750 מל),הכרם - משקאות חריפים בעמ,יח`,,1,48.90,6.48
2319,מרבה סלים פרוט בטעם יוגורט ותפוח,ש.שסטוביץ בעמ,יח`,,1,10.90,5.99
2320,מרבה סלים פרוט בטעם יוגורט ותות,ש.שסטוביץ בעמ,יח`,,1,10.90,5.99
2321,מרבה סלים פרוט בטעם פירות יער,ש.שסטוביץ בעמ,יח`,,1,10.90,5.99
2322,מרבה סלים פרוט בטעם יוגורט ופירות יער,ש.שסטוביץ בעמ,יח`,,1,10.90,9.08
2323,סלים דליס קריספי תות מרבה (125 גרם),ש.שסטוביץ בעמ,יח`,,1,10.90,9.08
2324,סלים דליס קריספי אוכמניות מרבה (125 גרם),ש.שסטוביץ בעמ,יח`,,1,10.90,8.72
2325,סלים דליס קריספי שוקולד מרבה (125 גרם),ש.שסטוביץ בעמ,יח`,,1,10.90,8.72
2326,מרבה שוקודליס בציפוי שוקולד חלב 145 גר`,ש.שסטוביץ בעמ,יח`,,1,12.90,8.90
2327,מרבה שוקודליס עו,ש.שסטוביץ בעמ,יח`,,1,12.90,7.33
2328,מרבה שוקודליס עו,ש.שסטוביץ בעמ,יח`,,1,12.90,7.33
2329,מרבה שוקודליס במילוי קרם בטעם קפוצינו 14,ש.שסטוביץ בעמ,יח`,,1,12.90,8.90
2330,לה פסטה פסטה צינור 400 גר`,תומר יבוא ושיווק מוצרי מזון (1,יח`,,1,2.50,0.63
2331,לה פסטה קונכיה 53 400 גר`,תומר יבוא ושיווק מוצרי מזון (1,יח`,,1,2.50,0.63
2332,לה פסטה פסטה פרפר 81 400 גר`,תומר יבוא ושיווק מוצרי מזון (1,יח`,,1,2.50,0.63
2333,לה פסטה פסטה בורג 64 400 גר`,תומר יבוא ושיווק מוצרי מזון (1,יח`,,1,2.50,0.63
2334,לה פסטה פסטה תלתל 65 400 גר`,תומר יבוא ושיווק מוצרי מזון (1,יח`,,1,2.50,0.63
