,ItemName,ManufactureName,UnitQty,Quantity,QtyInPackage,ItemPrice,UnitOfMeasurePrice
1154,שמפו שטיחים ספריי סנו (600 מל),החברה הדרומית לשיווק בעמ,יח`,,1,26.50,4.42
1155,תרסיס רהיט סנו (300 מל),החברה הדרומית לשיווק בעמ,יח`,,1,18.30,6
1156,סופר פוליש נוזל לרצפה סנו (1 ליטר),החברה הדרומית לשיווק בעמ,יח`,,1,37.70,37.70
1157,סנובון תות לאסלה סנו (55x3 גרם),החברה הדרומית לשיווק בעמ,יח`,,1,13.20,8
1158,סנובון לאסלה לימון סנו (55x3 גרם),החברה הדרומית לשיווק בעמ,יח`,,1,13.20,8
1159,סנובון לאסלה לובר סנו (55x3 גרם),החברה הדרומית לשיווק בעמ,יח`,,1,13.20,8
1160,סנובון נוזלי 750 מל,החברה הדרומית לשיווק בעמ,יח`,,1,10.90,1.45
1161,ז`אוול מרסס לניקוי כללי לבנדר סנו (1 ליט,החברה הדרומית לשיווק בעמ,יח`,,1,21.40,21.40
1162,קוטל מעופפים קיי 400 סנו (630 מל),החברה הדרומית לשיווק בעמ,יח`,,1,27.30,6.83
1163,קוטל חרקים קיי 300 סנו (630 מל),החברה הדרומית לשיווק בעמ,יח`,,1,21.90,3.48
1164,K500,החברה הדרומית לשיווק בעמ,יח`,,1,28.40,7.01
1165,סנו-די דוחה יתושים כדורי סנו (50 מל),החברה הדרומית לשיווק בעמ,יח`,,1,21.70,43.40
1166,סנו די תרסיס,החברה הדרומית לשיווק בעמ,יח`,,1,21.70,17.36
1167,סנו די נוזל+משאבה,החברה הדרומית לשיווק בעמ,יח`,,1,23.70,47.40
1168,סנו מקסימה 4 ליטר ורוד פסים,החברה הדרומית לשיווק בעמ,יח`,,1,22.40,5.60
1169,מסיר שומנים ז`אוול קר,החברה הדרומית לשיווק בעמ,יח`,,1,20.70,2.76
1170,סנו ז`אוול מרסס 1 ליטר,החברה הדרומית לשיווק בעמ,יח`,,1,21.40,21.40
1171,מסיר שומנים פורטה פלוס סנו (750 מל),החברה הדרומית לשיווק בעמ,יח`,,1,18.30,2.44
1172,סנובון נוזלי בניחוח לבנדר סנו (750 מל),החברה הדרומית לשיווק בעמ,יח`,,1,10.90,1.45
1173,פוליויקס 2 ליטר,החברה הדרומית לשיווק בעמ,יח`,,1,24.40,12.20
1174,סנובון לאסלה קלאסיק כחול סנו (55x3 גרם),החברה הדרומית לשיווק בעמ,יח`,,1,20.30,12.30
1175,רסס ונגב לניקוי כללי תרסיס סנו (750 מל),החברה הדרומית לשיווק בעמ,יח`,,1,20.30,3.38
1176,סנו מקסימה 4 ליטר לבן,החברה הדרומית לשיווק בעמ,יח`,,1,22.40,5.60
1177,סנוג`ט יכול הכל סחלבים סנו (4 ליטר),החברה הדרומית לשיווק בעמ,יח`,,1,22.40,5.60
1178,סנומוד מדונה,החברה הדרומית לשיווק בעמ,יח`,,1,13.20,8.80
1179,מטלית ריצפה זיגזג סנו סושי (3),החברה הדרומית לשיווק בעמ,יח`,,1,14.20,14.20
1180,כרית יפנית לכלים אקטיב סנו סושי (4),החברה הדרומית לשיווק בעמ,יח`,,1,12.20,12.20
1181,שקיות אשפה לפח 65x54 סנו סושי (60),החברה הדרומית לשיווק בעמ,יח`,,1,24.40,24.40
1182,אטבי כביסה איכות סנו (20),החברה הדרומית לשיווק בעמ,יח`,,1,10.50,10.50
1183,רב מגבת ג`מבו סנו סושי,החברה הדרומית לשיווק בעמ,יח`,,1,26.50,6.79
1184,סושי רדיד אלומיניום צמד,החברה הדרומית לשיווק בעמ,יח`,,1,14.20,14.20
1185,חטיפי כרובית בציפוי פריך טבעול (500 גרם),קבוצת אסם סחר שות. מוגבלת,יח`,,1,34.60,6.92
1186,פול מצרי 560 גר,ויטה -פרי גליל (החדשה) בעמ,יח`,,1,5.90,1.05
1187,שעועית לבנה אפויה,ויטה -פרי גליל (החדשה) בעמ,יח`,,1,5.90,1.07
1188,חומוס שלם A2,ויטה -פרי גליל (החדשה) בעמ,יח`,,1,5.90,0.98
1189,אפונה גדולה A2,ויטה -פרי גליל (החדשה) בעמ,יח`,,1,5.90,0.98
1190,אפונה וגזר A2,ויטה -פרי גליל (החדשה) בעמ,יח`,,1,5.90,1.07
1191,תירס גרעינים 550 גר`,ויטה -פרי גליל (החדשה) בעמ,יח`,,1,5.90,1.07
1192,ופלים מצופים מן (22x10 גרם),רוקחמן בעמ,יח`,,1,8.40,4.20
1193,חומוסטחינה פלפל חריף מטוגן 400גר,קבוצת אסם סחר שות. מוגבלת,יח`,,1,15.20,3.80
1194,קבנוס קלאסי יחיעם (125 גרם),מעדני יחיעם (1993) בעמ,יח`,,1,14.20,11.36
1195,קבנוס פפרוני יחיעם (125 גרם),מעדני יחיעם (1993) בעמ,יח`,,1,14.20,11.36
1196,משקה קל דיאט אשכוליות ג`אמפ (1.5 ליטר),טמפו משקאות בעמ,יח`,,1,5.70,0.38
1197,משקה קל מנגו פסיפלורה ג`אמפ (1.5 ליטר),טמפו משקאות בעמ,יח`,,1,5.70,0.38
1198,מי סודה טמפו (1.5 ליטר),טמפו משקאות בעמ,יח`,,1,3.10,0.21
1199,סודה בטעם פירות יער טמפו (1.5 ליטר),טמפו משקאות בעמ,יח`,,1,4.10,2.73
1200,סודה בטעם אננס טמפו (1.5 ליטר),טמפו משקאות בעמ,יח`,,1,4.10,2.73
1201,תרכיז טבעי סיידר הגליל (330 מל),טמפו משקאות בעמ,יח`,,1,10.90,3.21
1202,מרכך כביסה ורוד בדין (4 ליטר),יוניליוור ישראל שיווק בעמ,יח`,,1,20.90,5.23
1203,מרכך כביסה צהוב בדין (4 ליטר),יוניליוור ישראל שיווק בעמ,יח`,,1,20.90,5.23
1204,מרכך כביסה כחול בדין (4 ליטר),יוניליוור ישראל שיווק בעמ,יח`,,1,20.90,5.23
1205,סלמי גליל 600 גר` טירת צבי,תנובה קפואים,יח`,,1,38.70,6.45
1206,נקניקיות פיקנטיות 400 גר` טירת צבי,תנובה קפואים,יח`,,1,15.20,3.80
1207,סלסולי כתף בקר 120 גר` טירת צבי,תנובה קפואים,יח`,,1,17.30,14.42
1208,סלסולי סלמי איטלקי 120 גר` טירת צבי,תנובה קפואים,יח`,,1,17.30,14.42
1209,דקניקים סלסולי הודו טירת צבי (120 גרם),תנובה קפואים,יח`,,1,17.30,14.42
1210,סלסולי פסטרמה גחלים 120 גר` טירת צבי,תנובה קפואים,יח`,,1,17.30,14.42
1211,נקניקיות עוף טירת צבי (400 גרם),תנובה קפואים,יח`,,1,15.20,3.80
1212,צמד כפרי 800 גר` טירת צבי,תנובה קפואים,יח`,,1,37.70,4.71
1213,לחם עינן קל פרוס אנג`ל (500 גרם),שלמה א. אנג`ל בעמ,יח`,,1,15.10,3.02
1214,נוזל לניקוי אסלות 00 סנו (1 ליטר),החברה הדרומית לשיווק בעמ,יח`,,1,9.10,9.10
1215,ממרח בטעם שוקולד השחר העולה (1 קג),השחר העולה תעשית ממתקים בעמ,יח`,,1,25.40,25.40
1216,צימקאו השחר העולה (400 גרם),השחר העולה תעשית ממתקים בעמ,יח`,,1,13.50,3.38
1217,ממרח 400 גר` חלבי בדצ השחר,השחר העולה תעשית ממתקים בעמ,יח`,,1,14.20,3.55
1218,ממרח אגוזי לוז עם קקאו 350 גר` פרווה,השחר העולה תעשית ממתקים בעמ,יח`,,1,14.90,4.26
1219,שפורפרת לחיץ שוקולד 330 גר` השחר,השחר העולה תעשית ממתקים בעמ,יח`,,1,15.20,4.61
1220,ממרח 400 גר` פרווה השחר,השחר העולה תעשית ממתקים בעמ,יח`,,1,12.20,3.05
1221,ממרח פרווה 1 קג` השחר,השחר העולה תעשית ממתקים בעמ,יח`,,1,24.40,24.40
1222,ממרח חצי חצי 350 גר` השחר,השחר העולה תעשית ממתקים בעמ,יח`,,1,13.20,3.77
1223,אבקת קקאו השחר העולה (150 גרם),השחר העולה תעשית ממתקים בעמ,יח`,,1,10.50,7
1224,אבקת קקאו השחר העולה (500 גרם),השחר העולה תעשית ממתקים בעמ,יח`,,1,30.50,6.10
1225,ממרח חלב 350 גר` השחר,השחר העולה תעשית ממתקים בעמ,יח`,,1,13.20,3.77
1226,ממרח נוגט אגוזים 350 גר` השחר,השחר העולה תעשית ממתקים בעמ,יח`,,1,14.20,4.06
1227,קפה שחור קפה לנדוור (100x3 גרם),קבוצת אסם סחר שות. מוגבלת,יח`,,1,24.40,8.13
1228,קפה לנדוור לבוקר שלישיה,קבוצת אסם סחר שות. מוגבלת,יח`,,1,24.40,8.13
1229,פופקורן פופסטאר חמישייה טבעי,דנשר (1963) בעמ,יח`,,1,18.30,3.66
1230,פופקורן פופסטאר חמישייה חמאה,דנשר (1963) בעמ,יח`,,1,18.30,3.66
1231,גלילונית לפח 60 יח`,דנשר (1963) בעמ,יח`,,1,20.30,20.30
1232,משקה מוגז בטעם קולה פפסי (1.5 ליטר),טמפו משקאות בעמ,יח`,,1,6.10,0.41
1233,משקה מוגז בטעם ליים סבן אפ (1.5 ליטר),טמפו משקאות בעמ,יח`,,1,6.10,0.41
1234,משקה אורנג` מירנדה (1.5 ליטר),טמפו משקאות בעמ,יח`,,1,6.10,0.41
1235,פפסי סבן אפ דיאט 1.5 ליטר,טמפו משקאות בעמ,יח`,,1,6.10,0.41
1236,פפסי מקס 1.5 ליטר,טמפו משקאות בעמ,יח`,,1,6.10,0.41
1237,נוזל לניקוי כללי פנטסטיק סיף (4 ליטר),יוניליוור ישראל שיווק בעמ,יח`,,1,26.50,0.66
1238,בייגלה שמונה שמונה 400 גר`,יוניליוור ישראל שיווק בעמ,יח`,,1,11.50,2.88
1239,בייגלה אחד אחד 400 גר`,יוניליוור ישראל שיווק בעמ,יח`,,1,11.50,2.88
1240,צבר חומוסיבוב ברוטב חריף 400 גרם,קבוצת אסם סחר שות. מוגבלת,יח`,,1,15.20,2.71
1241,חומוס צבר סמיר הגדול,קבוצת אסם סחר שות. מוגבלת,יח`,,1,15.20,3.80
1242,חומוס צבר אבו מרוואן,קבוצת אסם סחר שות. מוגבלת,יח`,,1,15.20,3.80
1243,לחמניות חיטה מלאה דגנית עין בר (10),דגנית עין בר תעשיות מזון ואפיה,יח`,,1,12.20,1.63
1244,לחמניות אצבע דגנית עין בר (10),דגנית עין בר תעשיות מזון ואפיה,יח`,,1,12.20,1.63
1245,לחם אקטיב ברמן (750 גרם),י.את א. ברמן בעמ,יח`,,1,15.20,2.03
1246,לחמניות אקטיב ברמן,י.את א. ברמן בעמ,יח`,,1,12.20,2.71
1247,יין אדום יבש של סגל (750 מל),טמפו משקאות בעמ,יח`,,1,22.50,2.96
1248,יין לבן יבש של סגל (750 מל),טמפו משקאות בעמ,יח`,,1,22.50,2.96
1249,יין לבן חצי יבש של סגל (750 מל),טמפו משקאות בעמ,יח`,,1,22.50,2.96
1250,מרום גליל סינגל קברנה סובניון 750 מל,טמפו משקאות בעמ,יח`,,1,43.80,5.80
1251,מרום גליל סינגל מרלו 750מל,טמפו משקאות בעמ,יח`,,1,43.80,5.80
1252,מרום גליל שרדונה,טמפו משקאות בעמ,יח`,,1,44.10,5.84
1253,נקניקיות וניר 1 קג` זוגלובק,זוגלובק שיווק בעמ,יח`,,1,31.60,31.60
1254,נקניקיות וינר זוגלובק (500 גרם),זוגלובק שיווק בעמ,יח`,,1,18.30,3.66
1255,גוליבר חריפות 400 גר` זוגלובק,זוגלובק שיווק בעמ,יח`,,1,18.60,4.65
1256,מארז פסטרמה חרמון+תה,זוגלובק שיווק בעמ,יח`,,1,35.60,4.45
1257,בורקס גבינה זוגלובק (16 יח` - 800 גרם),זוגלובק שיווק בעמ,יח`,,1,22.40,2.80
1258,נקנקיות חריפות 1,זוגלובק שיווק בעמ,יח`,,1,33.90,33.90
1259,בצק עלים זוגלובק,זוגלובק שיווק בעמ,יח`,,1,22.40,22.40
1260,קריספי סטיקס תירס,זוגלובק שיווק בעמ,יח`,,1,21.40,4.28
1261,נקניקיות עוף זוגלובק (400 גרם),זוגלובק שיווק בעמ,יח`,,1,15.20,3.80
1262,נקניקיות עוף זוגלובק (1 קג),זוגלובק שיווק בעמ,יח`,,1,32.60,32.60
1263,סטייק בורגר 400 גר` טיבונוויל,נטו מלינדה סחר בעמ,יח`,,1,21.40,5.35
1264,בשר עוף קפוא טחון טיבון ויל (500 גרם),נטו מלינדה סחר בעמ,יח`,,1,13.20,2.64
1265,בשר הודו קפוא טחון טיבון ויל (500 גרם),נטו מלינדה סחר בעמ,יח`,,1,13.20,2.64
1266,גבינת מסקרפונה 40% גד (250 גרם),מחלבות גד שיווק 1992 בעמ,יח`,,1,22.90,9.16
1267,ג`ל גילוח נגד חתכים אדג` (198 גרם),דנשר (1963) בעמ,יח`,,1,20.70,10.35
1268,אדג` ג`ל גילוח 200 מל ירוק,דנשר (1963) בעמ,יח`,,1,20.70,10.35
1269,ג`ל גילוח לעור רגיש אדג` (198 גרם),דנשר (1963) בעמ,יח`,,1,20.70,10.35
1270,אדג` ג`ל גילוח 200 מל סגול כהה,דנשר (1963) בעמ,יח`,,1,20.70,10.35
1271,אדג` ג`ל לבן לניקוי עור הפנים,דנשר (1963) בעמ,יח`,,1,21.40,10.70
1272,תערובת פיצוחים מובחרת 150 גר` פיצוחי חממ,בוטנת בעמ,יח`,,1,16.90,11.27
1273,תערובת אגוזים וחמוציות חממה (150 גרם),בוטנת בעמ,יח`,,1,14.20,9.47
1274,טחינה גולמית אחוה (1 קג),אחדות בעמ,יח`,,1,21.40,21.40
1275,לחם חיטה מלא +כוסמין דגנית,דגנית עין בר תעשיות מזון ואפיה,יח`,,1,14.20,1.89
1276,מי עדן 1.5 ליטר בודד,יפאורה,יח`,,1,3.90,2.60
1277,מים מינרלים פקק ספורט מי עדן (500x6 מל),יפאורה,יח`,,1,13.50,0.39
1278,אלמקס משחת שיניים ילדים 75מל,ש.שסטוביץ בעמ,יח`,,1,16.30,21.73
1279,פרש וואנס מגבונים רביעיה,דנשר (1963) בעמ,יח`,,1,19.90,19.90
1280,שקד מולבן פרוס 100 גר`,מיה תעשיות מזון מ.ת.מ. בעמ,יח`,,1,12.20,12.20
1281,שומשום מיה (400 גרם),מיה תעשיות מזון מ.ת.מ. בעמ,יח`,,1,13.20,3.30
1282,צמד חמד 700 גר` יחיעם,מעדני יחיעם (1993) בעמ,יח`,,1,26.50,3.79
1283,המבורגר אמיתי טיבון ויל (400 גרם),נטו מלינדה סחר בעמ,יח`,,1,21.40,5.35
1284,נקה 7 שמפו 750 מל ירוק,החברה הדרומית לשיווק בעמ,יח`,,1,14.20,1.89
1285,נקה 7 שמפו 750 מל,החברה הדרומית לשיווק בעמ,יח`,,1,14.20,1.89
1286,נקה 7 שמפו 750 מל,החברה הדרומית לשיווק בעמ,יח`,,1,14.20,1.89
1287,נקה 7 מרכך 750 מל ירוק,החברה הדרומית לשיווק בעמ,יח`,,1,14.20,1.89
1288,נקניקיות חריפות מהדרין עטרה (400 גרם),נטו מלינדה סחר - עטרה,יח`,,1,12.20,2.44
1289,אקונומיקה סמיכה 4 ליטר טאצ`,סאסאטק אגשח בעמ,יח`,,1,12.90,0.32
1290,ג`ל כביסה ירוק 3 ליטר טאצ`,סאסאטק אגשח בעמ,יח`,,1,18.90,6.30
1291,ג`ל כביסה כחול 3 ליטר טאצ`,סאסאטק אגשח בעמ,יח`,,1,18.90,6.30
1292,נוזל רצפות אורנים 4 ליטר טאצ,סאסאטק אגשח בעמ,יח`,,1,14.90,0.37
1293,נוזל רצפות מאסק 4 ליטר טאצ,סאסאטק אגשח בעמ,יח`,,1,14.90,0.37
1294,נוזל רצפות יסמין 4 ליטר טאצ`,סאסאטק אגשח בעמ,יח`,,1,14.90,0.37
1295,מרכך כביסה 4 ליטר ורוד,סאסאטק אגשח בעמ,יח`,,1,14.90,0.37
1296,מרכך כביסה 4 ליטר כחול,סאסאטק אגשח בעמ,יח`,,1,14.90,0.37
1297,מרכך כביסה 4 ליטר לבן,סאסאטק אגשח בעמ,יח`,,1,14.90,0.37
1298,נוזל רצפות לבנדר 4 ליטר טאצ,סאסאטק אגשח בעמ,יח`,,1,14.90,0.37
1299,נקטר תות בננה ספרינג (1 ליטר),יפאורה,יח`,,1,6,0.60
1300,מיץ עגבניות ספרינג (1 ליטר),יפאורה,יח`,,1,6,0.60
1301,נקטר מנגו ספרינג (1 ליטר),יפאורה,יח`,,1,6,0.60
1302,נקטר אפרסקים ספרינג (1 ליטר),יפאורה,יח`,,1,6,0.60
1303,משקה קל לימונענע ספרינג (1 ליטר),יפאורה,יח`,,1,6,0.60
1304,נקטר תפוזים ספרינג (1 ליטר),יפאורה,יח`,,1,6,0.60
1305,נקטר תפוחים ספרינג (1 ליטר),יפאורה,יח`,,1,6,0.60
1306,RC קולה פחית רגיל,יפאורה,יח`,,1,3.90,1.09
1307,משקה קל ענבים תפוזינה (1.5 ליטר),יפאורה,יח`,,1,6.90,0.46
1308,פלמוליב ח ודבש 500מל חדש,ש.שסטוביץ בעמ,יח`,,1,21.40,4.28
1309,פלמוליב כלים שקוף לימון 750 בקבוק חדש,ש.שסטוביץ בעמ,יח`,,1,13.20,1.76
1310,שטראוס קרמיסימו,גלידות שטראוס בעמ,יח`,,1,20.50,15.41
1311,שטראוס קרמיסימו שוקולד וניל,גלידות שטראוס בעמ,יח`,,1,20.50,15.41
1312,שטראוס קרמיסימו ריבת חלב,גלידות שטראוס בעמ,יח`,,1,20.50,15.41
1313,שטראוס קרמיסימו וניל,גלידות שטראוס בעמ,יח`,,1,20.50,15.41
1314,שטראוס קרמיסימו,גלידות שטראוס בעמ,יח`,,1,20.50,15.41
1315,מאגדת-מיני מגנום,גלידות שטראוס בעמ,יח`,,1,35.60,35.60
1316,גרנולה עם תוספות 1 קג,דין שיווק וקליה בעמ,יח`,,1,21.40,21.40
1317,וופל קלאסי שוקולד 200 גר` עלמה,רזיט שיווק בעמ,יח`,,1,3.20,1.60
1318,גביעי גלידה מגולגל 12 יח עלמה,רזיט שיווק בעמ,יח`,,1,12.90,12.90
1319,וופל קלאסי לימון 200 גר` עלמה,רזיט שיווק בעמ,יח`,,1,3.20,1.60
1320,מרגז מיני אקסטרה 500 גר` 8 יח,בלדי בעמ,יח`,,1,28.90,5.78
1321,שומן כבש 200,בלדי בעמ,יח`,,1,10.10,5.05
1322,פסטרמה מעודנת על גחלים 300 גר,מעדני יחיעם (1993) בעמ,יח`,,1,25.40,8.47
1323,נקניקיות וינר 400 גרם,מעדני יחיעם (1993) בעמ,יח`,,1,14.20,3.55
1324,נקניקיות חריפות 400 גרם,מעדני יחיעם (1993) בעמ,יח`,,1,14.20,3.55
1325,פסטרמה של פעם 300 גרם לחמ,מעדני יחיעם (1993) בעמ,יח`,,1,27.50,9.17
1326,פסטרמה רומנית 250 גרם לחמ,מעדני יחיעם (1993) בעמ,יח`,,1,27.50,11
1327,כתף בקר מעושן 250 גרם לחמ,מעדני יחיעם (1993) בעמ,יח`,,1,30.50,12.20
1328,סלמי מעושן בסגנון איטלקי 300 גרם,מעדני יחיעם (1993) בעמ,יח`,,1,22.40,7.47
1329,פסטרמה מעודנת 200 גר` יחיעם,מעדני יחיעם (1993) בעמ,יח`,,1,13.20,6.60
1330,סלמי איטלקי מפולפל 200 גר` יחיעם,מעדני יחיעם (1993) בעמ,יח`,,1,13.20,6.60
1331,ספירה אנתוש 70 מל,גורי ע.ע.ע בעמ,יח`,,1,14.20,20.29
1332,פחית פאנטה ענבים סליק 330 מל,החברה המרכזית להפצת משקאות בעמ,יח`,,1,4.50,1.27
1333,סודה קינלי (250 מל),החברה המרכזית להפצת משקאות בעמ,יח`,,1,3,1.08
1334,פקאן סיני פיצוחי חממה (100 גרם),בוטנת בעמ,יח`,,1,18.30,18.30
1335,אקונומיקה קצף ניקוי סנט מוריץ (1 ליטר ),קומפלקס כימיקלים בעמ,יח`,,1,12.90,1.29
1336,קצף ניקוי כלים סינטריים סנט מוריץ ( 1 לי,קומפלקס כימיקלים בעמ,יח`,,1,12.90,12.90
1337,חיוכים שוקו 900 גר`,שטראוס גרופ בעמ,יח`,,1,22.40,2.49
1338,חיוכים וניל 900 גר`,שטראוס גרופ בעמ,יח`,,1,22.40,2.49
1339,ביסקוויט פתי בר בטעם חמאה עלית (500 גרם),שטראוס גרופ בעמ,יח`,,1,11.20,2.24
1340,שוקולד פרה חלב עם עדשים עלית (100 גרם),שטראוס גרופ בעמ,יח`,,1,5,5
1341,ציטוס איקס עיגול 60 גר,שטראוס פריטו ליי בעמ,יח`,,1,3.90,6.50
1342,צ יטוס כאפה 55 גר,שטראוס פריטו ליי בעמ,יח`,,1,3.90,7.09
1343,אל סבון נוזלי וניל פמילי (1 ליטר),דנשר (1963) בעמ,יח`,,1,15.60,15.60
1344,אל סבון נוזלי לבנדר פמילי (1 ליטר),דנשר (1963) בעמ,יח`,,1,15.60,15.60
1345,אל סבון נוזלי ליים פמילי (1 ליטר),דנשר (1963) בעמ,יח`,,1,15.60,15.60
1346,אדג ג`ל גילוח-זוג,דנשר (1963) בעמ,יח`,,1,30.90,7.12
1347,מאגדת-מיני מגנום,גלידות שטראוס בעמ,יח`,,1,35.60,35.60
1348,אורז רייס ריץ` 5 קג`,סוגת תעשיות בעמ,יח`,,1,36.70,0.73
1349,קרם ידיים פנג`ל (80 מל),דנשר (1963) בעמ,יח`,,1,10.50,10.50
1350,בן ג`ריס גלידה בטעם חרוסת מהדרין 500מל,מוצרי איכות אמריקאיים בעמ,יח`,,1,20.30,4.06
1351,גלידת שמנת בטעם וניל קרמל וחתיכות גביעי,מוצרי איכות אמריקאיים בעמ,יח`,,1,20.30,4.06
1352,גלידת פיינטים שוקולד מילק קוקוס בן אנד ג,מוצרי איכות אמריקאיים בעמ,יח`,,1,20.30,4.06
1353,גלידת פיינטים שוקולד בצק עוגיות בן אנד ג,מוצרי איכות אמריקאיים בעמ,יח`,,1,20.30,4.06
1354,איטריות ביצים מס` 8 200 גר`,גורי מוצרי צריכה (1991) בעמ,יח`,,1,7.50,3.57
1355,איטריות ביצים מס 10 200 גר`,גורי מוצרי צריכה (1991) בעמ,יח`,,1,7.50,3.75
1356,איטריות ביצים מס 14 200 גר`,גורי מוצרי צריכה (1991) בעמ,יח`,,1,7.50,3.75
1357,נודלס אוריינט סיני 300גר,גורי מוצרי צריכה (1991) בעמ,יח`,,1,10.90,3.63
1358,נודלס בסגנון תאילנדי 25% תוספת ( 500 גר`,גורי מוצרי צריכה (1991) בעמ,יח`,,1,10.90,2.18
1359,זיתים ירוקים נובו קבוצת יבנה (540 גרם),קבוצת יבנה מוצרי מזון אגודה שי,יח`,,1,10.10,1.80
1360,טבעות זיתים ירוק A2,קבוצת יבנה מוצרי מזון אגודה שי,יח`,,1,10.10,1.80
1361,שיפקה 600 גרם בדצ,קבוצת יבנה מוצרי מזון אגודה שי,יח`,,1,6.40,1.07
1362,פלפל חריף שיפקה קבוצת יבנה (540 גרם),קבוצת יבנה מוצרי מזון אגודה שי,יח`,,1,6.70,1.20
1363,סלמון מעושן דלידג (100 גרם),נטו מלינדה סחר בעמ,יח`,,1,16.30,16.30
1364,המבורגר טחון 500 גר` מחפוד,עוף ירושלים שיווק בעמ,יח`,,1,18.30,3.66
1365,קבב מזרחי 500 גר` מחפוד,עוף ירושלים שיווק בעמ,יח`,,1,18.30,3.66
1366,סטייק אנטריקוט 800 גר` מחפוד,עוף ירושלים שיווק בעמ,יח`,,1,39.70,4.96
1367,טחון בקר 500 גר` מחפוד,עוף ירושלים שיווק בעמ,יח`,,1,18.30,3.66
1368,טחון הודו 500 מחפוד,עוף ירושלים שיווק בעמ,יח`,,1,15.20,3.04
1369,טחון עוף מחפוד 500 גר`,עוף ירושלים שיווק בעמ,יח`,,1,15.20,3.04
1370,קבב עוף 500 גר` מחפוד,עוף ירושלים שיווק בעמ,יח`,,1,15.20,3.04
1371,המבורגר עוף 500 גר` מחפוד,עוף ירושלים שיווק בעמ,יח`,,1,15.20,3.04
1372,טחון בקר 1 קג מחפוד,עוף ירושלים שיווק בעמ,יח`,,1,38.70,38.70
1373,בורקס פילו אצבעות בולגרית 700 גר`,נטו מלינדה סחר בעמ,יח`,,1,20.30,2.90
1374,רסק עגבניות 100 גר` פרי מבורך,זנלכל בעמ,יח`,,1,3,3
1375,רסק עגבניות BX 22% פרי מבורך (260 גרם),זנלכל בעמ,יח`,,1,5,1.92
1376,חומוס 550 גר` פרי מבורך,זנלכל בעמ,יח`,,1,7.10,1.29
1377,תירס מתוק 550 גר` פרי מבורך,זנלכל בעמ,יח`,,1,7.10,1.29
1378,טבעות דג 700 גר` דלי דג,נטו מלינדה סחר בעמ,יח`,,1,27.50,3.93
1379,שניצולני דג 600 גר דלידג,נטו מלינדה סחר בעמ,יח`,,1,27.30,4.55
1380,טונה ויליגר רביעייה 140 גר במים,נטו מלינדה סחר בעמ,יח`,,1,21.90,15.64
1381,המבורגר קפוא בלדי (400 גרם),בלדי בעמ,יח`,,1,13.90,3.48
1382,קבב כבש קפוא בלדי (400 גרם),בלדי בעמ,יח`,,1,12.90,3.23
1383,קבב מזרחי קפוא בלדי (400 גרם),בלדי בעמ,יח`,,1,12.90,3.23
1384,קבב רומני קפוא בלדי (400 גרם),בלדי בעמ,יח`,,1,12.90,3.23
1385,קמח 1 קג,טחנת קמח רוט קרית גת,יח`,,1,3.80,3.80
1386,סולת 1 קג,טחנת קמח רוט קרית גת,יח`,,1,5.30,5.30
1387,קמח מלא 1 קג,טחנת קמח רוט קרית גת,יח`,,1,4.50,4.50
1388,קמח תופח 1 קג,טחנת קמח רוט קרית גת,יח`,,1,4.50,4.50
1389,אפונה גינה 800 גר` פרי גליל,ויטה -פרי גליל (החדשה) בעמ,יח`,,1,10.90,1.36
1390,אפונה וגזר 800 גר` פרי גליל,ויטה -פרי גליל (החדשה) בעמ,יח`,,1,10.90,1.36
1391,גזר גמדי 800 גר` פרי גליל,ויטה -פרי גליל (החדשה) בעמ,יח`,,1,9.90,1.24
1392,שעועית צהובה חתוכה 800 גר` פרי גליל,ויטה -פרי גליל (החדשה) בעמ,יח`,,1,11.90,1.49
1393,שעועית ירוקה חתוכה 800 גר` פרי גליל,ויטה -פרי גליל (החדשה) בעמ,יח`,,1,11.90,1.49
1394,תירס גרעינים 800 גר`פרי גליל,ויטה -פרי גליל (החדשה) בעמ,יח`,,1,10.90,1.36
