,ItemName,ManufactureName,UnitQty,Quantity,QtyInPackage,ItemPrice,UnitOfMeasurePrice
3249,נקה 7 מרכך שמני הזנה 750 מל,החברה הדרומית לשיווק בעמ,יח`,,1,10.90,1.45
3250,תחליב רחצה כיף ניחוח שקד 700 מל,החברה הדרומית לשיווק בעמ,יח`,,1,12.90,1.84
3251,תחליב רחצה כיף ניחוח דבש 700 מל,החברה הדרומית לשיווק בעמ,יח`,,1,12.90,1.84
3252,תחליב רחצה כיף ניחוח קוקוס וניל 700 מל,החברה הדרומית לשיווק בעמ,יח`,,1,12.90,1.84
3253,תחליב רחצה כיף ניחוח לבנדר 700 מל,החברה הדרומית לשיווק בעמ,יח`,,1,12.90,1.84
3254,תחליב רחצה כיף בניחוח שמן אמבר וגרדניה 7,החברה הדרומית לשיווק בעמ,יח`,,1,12.90,1.84
3255,תחליב רחצה כיף ניחוח מאסק יסמין 700 מל,החברה הדרומית לשיווק בעמ,יח`,,1,12.90,1.84
3256,תחליב רחצה כיף ניחוח אוקיינס 700 מל,החברה הדרומית לשיווק בעמ,יח`,,1,12.90,1.84
3257,תחליב רחצה כיף בניחוח אננס וקוקס 700,החברה הדרומית לשיווק בעמ,יח`,,1,12.90,1.84
3258,תחליב רחצה בניחוח וטיבר ומלח ים 700,החברה הדרומית לשיווק בעמ,יח`,,1,12.90,1.84
3259,תחליב רחצה כיף בניחוח ברגמוט ונרולי 700,החברה הדרומית לשיווק בעמ,יח`,,1,12.90,1.84
3260,כיף שמפו לשיער רגיל תפוח זרעי צ`יה 700,החברה הדרומית לשיווק בעמ,יח`,,1,12.90,1.84
3261,כיף שמפו לשיער רגיל יבש רימונים ושמן ארג,החברה הדרומית לשיווק בעמ,יח`,,1,12.90,1.84
3262,כיף שמפו לשיער דק ושביר 700,החברה הדרומית לשיווק בעמ,יח`,,1,12.90,1.84
3263,כיף שמפו ומרכך 2+1 תאנה ומנטה 700,החברה הדרומית לשיווק בעמ,יח`,,1,12.90,1.84
3264,כיף שמפו לשיער מעוצב קרטין וחמאת שיאה 70,החברה הדרומית לשיווק בעמ,יח`,,1,12.90,1.84
3265,כיף מרכך לשיער רגיל תפוח זרעי צ`יה 700,החברה הדרומית לשיווק בעמ,יח`,,1,12.90,1.84
3266,כיף מרכך לשיער רגיל יבש רימונים ושמן ארג,החברה הדרומית לשיווק בעמ,יח`,,1,12.90,1.84
3267,כיף מרכך לשיער דק ושביר 700,החברה הדרומית לשיווק בעמ,יח`,,1,12.90,1.84
3268,כיף מרכך לשיער מעוצב קרטין וחמאת שיאה 70,החברה הדרומית לשיווק בעמ,יח`,,1,12.90,1.84
3269,גבינת גאודה מגורדת 500 גר` 28% שומן הולנ,ג.וילי-פוד אינטרנשיונל בעמ,יח`,,1,26.90,5.38
3270,גבינת מוצרלה פרוסות 150 גר` וילי פוד,ג.וילי-פוד אינטרנשיונל בעמ,יח`,,1,14.90,9.93
3271,גבינת חלומי 200 גר` SAY CHEESE וילי פוד,ג.וילי-פוד אינטרנשיונל בעמ,יח`,,1,24.90,12.45
3272,ממרח חמאה 250 גר` ללא מלח Euro spread ו,ג.וילי-פוד אינטרנשיונל בעמ,יח`,,1,11.90,4.76
3273,ממרח חמאה 250 גר` במליחות עדינה Euro spr,ג.וילי-פוד אינטרנשיונל בעמ,יח`,,1,11.90,4.76
3274,ממרח חמאה 250 גר` לייט לא מלח Euro sprea,ג.וילי-פוד אינטרנשיונל בעמ,יח`,,1,11.90,4.76
3275,ממרח חמאה 250 גר` לייט במליחות עדינה Eur,ג.וילי-פוד אינטרנשיונל בעמ,יח`,,1,11.90,4.76
3276,מאפה יוני במילוי קרם בטעם וניל 400 גר` ו,ג.וילי-פוד אינטרנשיונל בעמ,יח`,,1,19.90,4.98
3277,מאפה יוני במילוי גבינת פטה 400 גר` וילי,ג.וילי-פוד אינטרנשיונל בעמ,יח`,,1,19.90,4.98
3278,מאפה יוני במילוי תרד וגבינת פטה 400 גר`,ג.וילי-פוד אינטרנשיונל בעמ,יח`,,1,19.90,4.98
3279,חטיף שקדים וצימוקים HAPPY NUTS וילי פוד,ג.וילי-פוד אינטרנשיונל בעמ,יח`,,1,14.90,10.64
3280,חטיף שקדים וחמוציות HAPPY NUTS וילי פוד,ג.וילי-פוד אינטרנשיונל בעמ,יח`,,1,14.90,10.64
3281,גבינת עיזים רכה בציפוי תפוזים 29% שומן (,ג.וילי-פוד אינטרנשיונל בעמ,יח`,,1,14.90,13.55
3282,גבינת עיזים רכה בציפוי צ`לי 29% שומן (11,ג.וילי-פוד אינטרנשיונל בעמ,יח`,,1,14.90,13.55
3283,4 יח תחתיות לפיצה וילי פוד,ג.וילי-פוד אינטרנשיונל בעמ,יח`,,1,13.90,2.90
3284,גבינת שמנת טבעי 200 גר` EURO CHEESE,ג.וילי-פוד אינטרנשיונל בעמ,יח`,,1,12.90,6.45
3285,גבינת שמנת לייט טבעי 200 גר` EURO CHEESE,ג.וילי-פוד אינטרנשיונל בעמ,יח`,,1,12.90,6.45
3286,גבינת שמנת עשבי תיבול 200 גר` EURO CHEES,ג.וילי-פוד אינטרנשיונל בעמ,יח`,,1,12.90,6.45
3287,גבינת שמנת לייט עשבי תיבול 200 גר` EURO,ג.וילי-פוד אינטרנשיונל בעמ,יח`,,1,12.90,6.45
3288,גבינת שמנת שום 200 גר` EURO CHEESE,ג.וילי-פוד אינטרנשיונל בעמ,יח`,,1,12.90,6.45
3289,גבינת שמנת לייט שום 200 גר` EURO CHEESE,ג.וילי-פוד אינטרנשיונל בעמ,יח`,,1,12.90,6.45
3290,גבינת גאודה פרוסות 400 גר` וילי פוד,ג.וילי-פוד אינטרנשיונל בעמ,יח`,,1,19.90,4.98
3291,מלפפונים כבושים במלח 18-25 קטנים מאוד (8,ג.וילי-פוד אינטרנשיונל בעמ,יח`,,1,14.90,1.86
3292,פסטו בזיליקום 190 גר` וילי פוד,ג.וילי-פוד אינטרנשיונל בעמ,יח`,,1,9.90,5.21
3293,רוטב עגבניות עם זיתים וצלפים 400 גר` ויל,ג.וילי-פוד אינטרנשיונל בעמ,יח`,,1,9.90,2.48
3294,רוטב עגבניות עם פטריות פורצ`יני 400 גר`,ג.וילי-פוד אינטרנשיונל בעמ,יח`,,1,9.90,2.48
3295,רוטב עגבניות עם חצילים 400 גר`,ג.וילי-פוד אינטרנשיונל בעמ,יח`,,1,9.90,2.48
3296,רוטב עגבניות פיקנטי 400 גר` וילי פוד,ג.וילי-פוד אינטרנשיונל בעמ,יח`,,1,9.90,2.48
3297,מארז תפוחונים (3 יח +1 ),ג.וילי-פוד אינטרנשיונל בעמ,יח`,,1,12.90,12.90
3298,מדליוני גבינת עיזים 6 יח *20 גר` ( 120 ג,ג.וילי-פוד אינטרנשיונל בעמ,יח`,,1,14.90,12.42
3299,צנימים טעם טבעי 100 גר` melba toast,ג.וילי-פוד אינטרנשיונל בעמ,יח`,,1,7.90,7.90
3300,לזנה איטלקית 500 גר` (וילי פוד),ג.וילי-פוד אינטרנשיונל בעמ,יח`,,1,10.90,2.18
3301,צנימים עם שומשום 100 גר` melba toast,ג.וילי-פוד אינטרנשיונל בעמ,יח`,,1,7.90,7.90
3302,ממרח חמאה 250 גר` valio,ג.וילי-פוד אינטרנשיונל בעמ,יח`,,1,16.90,6.76
3303,ממרח חמאה 250 גר` לייט VALIO,ג.וילי-פוד אינטרנשיונל בעמ,יח`,,1,16.90,6.76
3304,פיצה מרגריטה 380 גר` וילי פוד,ג.וילי-פוד אינטרנשיונל בעמ,יח`,,1,13.90,3.66
3305,פיצה עם פטריות 390 גר` וילי פוד,ג.וילי-פוד אינטרנשיונל בעמ,יח`,,1,13.90,3.56
3306,פיצה עם זיתים 385 גר` וילי פוד,ג.וילי-פוד אינטרנשיונל בעמ,יח`,,1,13.90,3.61
3307,כדורי בייבי גבינת מוצרלה 200 גר` וילי פו,ג.וילי-פוד אינטרנשיונל בעמ,יח`,,1,19.90,9.95
3308,משקה יוגורט אפרסק 500 מל וילי פוד 0.1%,ג.וילי-פוד אינטרנשיונל בעמ,יח`,,1,9.90,9.90
3309,משקה יוגורט תות 500 מל וילי פוד 0.1%,ג.וילי-פוד אינטרנשיונל בעמ,יח`,,1,9.90,9.90
3310,משקה יוגורט תות ודודבן 500 מל וילי פוד,ג.וילי-פוד אינטרנשיונל בעמ,יח`,,1,9.90,9.90
3311,משקה יוגורט אוכמניות וסמבוק 500 מל וילי,ג.וילי-פוד אינטרנשיונל בעמ,יח`,,1,9.90,9.90
3312,גבינת שמנת עם זיתים 200 גר` EURO CHEESE,ג.וילי-פוד אינטרנשיונל בעמ,יח`,,1,12.90,6.45
3313,גבינת שמנת עם חלפיניו 200 גר` EURO CHEES,ג.וילי-פוד אינטרנשיונל בעמ,יח`,,1,12.90,6.45
3314,גבינת שמנת לייט עם זיתים 200 גר` EURO CH,ג.וילי-פוד אינטרנשיונל בעמ,יח`,,1,12.90,6.45
3315,גבינת שמנת לייט עם חלפיניו 200 גר` EURO,ג.וילי-פוד אינטרנשיונל בעמ,יח`,,1,12.90,6.45
3316,גבינת פטה 200 גר` טבעונית,ג.וילי-פוד אינטרנשיונל בעמ,יח`,,1,17.90,8.95
3317,גבינה טבעונית קוביות פטה במי מלח 200 גר,ג.וילי-פוד אינטרנשיונל בעמ,יח`,,1,17.90,8.95
3318,גבינה גוש מוצרלה 200 גר` טבעונית,ג.וילי-פוד אינטרנשיונל בעמ,יח`,,1,17.90,8.95
3319,גבינה פרוסות מוצרלה 200 גר` טבעונית,ג.וילי-פוד אינטרנשיונל בעמ,יח`,,1,17.90,8.95
3320,גבינה גוש גאודה 200 גר` טבעונית,ג.וילי-פוד אינטרנשיונל בעמ,יח`,,1,17.90,8.95
3321,גבינה פרוסות גאודה 200 גר` טבעונית,ג.וילי-פוד אינטרנשיונל בעמ,יח`,,1,17.90,8.95
3322,גבינה גוש גאודה מעושנת 200 גר` ולי פוד,ג.וילי-פוד אינטרנשיונל בעמ,יח`,,1,17.90,8.95
3323,גבינה גוש מוצרלה לפיצה 200 גר` טבעונית,ג.וילי-פוד אינטרנשיונל בעמ,יח`,,1,17.90,8.95
3324,גבינה גוש צ`דר כתום 200 גר`,ג.וילי-פוד אינטרנשיונל בעמ,יח`,,1,17.90,8.95
3325,מאפה יוני במילוי ירקות ירוקים 400 גר` וי,ג.וילי-פוד אינטרנשיונל בעמ,יח`,,1,19.90,4.98
3326,חומוסטחינה חלק צבר (400 גרם),קבוצת אסם סחר שות. מוגבלת,יח`,,1,13.90,3.48
3327,ביסלי חטיף בטעם סלסה פיקנטית 70 גר` אס,קבוצת אסם סחר שות. מוגבלת,יח`,,1,3.90,5.57
3328,חומוסיבוב עגבניות מיובשות ועשבי תיבול 40,קבוצת אסם סחר שות. מוגבלת,יח`,,1,13.90,3.48
3329,פודינג אינסטנט ורוד קיטי 80 גר` אסם,קבוצת אסם סחר שות. מוגבלת,יח`,,1,5.90,7.38
3330,פרפקטו ספגטי 500 גר עתיר בסיבים,קבוצת אסם סחר שות. מוגבלת,יח`,,1,6.90,1.38
3331,פסטה פארפאלה אסם פרפקטו (500 גרם),קבוצת אסם סחר שות. מוגבלת,יח`,,1,7.90,1.58
3332,פסטה פאפארדלה אסם פרפקטו (500 גרם),קבוצת אסם סחר שות. מוגבלת,יח`,,1,7.90,1.58
3333,פסטה ספירלי טריו אסם פרפקטו (500 גרם),קבוצת אסם סחר שות. מוגבלת,יח`,,1,6.90,1.38
3334,מנה חמה קוסקוס עם עדשים אסם (87 גרם),קבוצת אסם סחר שות. מוגבלת,יח`,,1,6.90,7.93
3335,סלט חזרת 180 גר` צבר,קבוצת אסם סחר שות. מוגבלת,יח`,,1,12.90,7.17
3336,חומוס עם המון טחינה וגרגרים 375 גר` צבר,קבוצת אסם סחר שות. מוגבלת,יח`,,1,12,3.20
3337,חציל פיקנטי מלך הסלטים 400 גר` צבר,קבוצת אסם סחר שות. מוגבלת,יח`,,1,15.90,3.98
3338,ביסקוויט פתי בר ללא גלוטן אסם (200 גרם),קבוצת אסם סחר שות. מוגבלת,יח`,,1,9.90,4.95
3339,פתי בר שוקו ללא גלוטן 200 גרם,קבוצת אסם סחר שות. מוגבלת,יח`,,1,9.90,4.95
3340,אטריות דקיקות פלוס 330גר אסם,קבוצת אסם סחר שות. מוגבלת,יח`,,1,7.90,2.39
3341,פסטה מסולסלים פלוס 400 גר אסם,קבוצת אסם סחר שות. מוגבלת,יח`,,1,5.90,1.48
3342,ספגטי פלוס 400 גר אסם,קבוצת אסם סחר שות. מוגבלת,יח`,,1,5.90,1.48
3343,קראנץ` רולס 450 גר דגני בוקר,קבוצת אסם סחר שות. מוגבלת,יח`,,1,26.90,5.98
3344,בירה מולר 500 מל,בני פאוזי שמשום (2009) בעמ,יח`,,1,3.90,0.72
3345,פחית פאנטה תות 330 מל סילק,החברה המרכזית להפצת משקאות בעמ,יח`,,1,4.50,1.27
3346,פריגת צלול בטעם ענבים 1.5 ליטר,החברה המרכזית להפצת משקאות בעמ,יח`,,1,7.20,0.48
3347,פריגת צלול בטעם תפוחים 1.5 ליטר,החברה המרכזית להפצת משקאות בעמ,יח`,,1,7.20,0.48
3348,פריגת צלול בטעם אפרסק 1.5 ליטר,החברה המרכזית להפצת משקאות בעמ,יח`,,1,7.20,0.48
3349,פריגת צלול בטעם אננס 1.5 ליטר,החברה המרכזית להפצת משקאות בעמ,יח`,,1,7.20,0.48
3350,פחית קוקה קוה סליק זירו לימון 330 מל,החברה המרכזית להפצת משקאות בעמ,יח`,,1,4.50,1.27
3351,פחית ספרייט ליים 330 מל סליק,החברה המרכזית להפצת משקאות בעמ,יח`,,1,4.50,1.27
3352,מארז ספרייט 6 פחיות FRIDGE PACK,החברה המרכזית להפצת משקאות בעמ,יח`,,1,19.90,19.90
3353,פריגת צלול בטעם לימוענע 1.5 ליטר,החברה המרכזית להפצת משקאות בעמ,יח`,,1,7.20,0.48
3354,פאנטה שישית פחיות פרידג`פק,החברה המרכזית להפצת משקאות בעמ,יח`,,1,19.90,9.14
3355,פריגת צלול בטעם תפוזים 1.5 ליטר,החברה המרכזית להפצת משקאות בעמ,יח`,,1,7.20,0.48
3356,פריגת צלול בטעם אשכוליות 1.5 ליטר,החברה המרכזית להפצת משקאות בעמ,יח`,,1,7.20,0.48
3357,משקה יופלה בטעם תות שמינייה תנובה,תנובה - חלב,יח`,,1,17.50,1944.44
3358,משקה יופלה בטעם קלאסי שמינייה תנובה,תנובה - חלב,יח`,,1,17.50,1944.44
3359,GO יופלה 200 מל תנובה,תנובה - חלב,יח`,,1,5.30,2.65
3360,GO יופלה במתיקות מעודנת 200,תנובה - חלב,יח`,,1,5.30,2.65
3361,יולו שוקולד לבן בטעם קרם פטיסייר ופטל 12,תנובה - חלב,יח`,,1,4.50,3.69
3362,מעדן יולו שכבות שוקולד לבן וחלב בטעם קרמ,תנובה - חלב,יח`,,1,4.50,3.69
3363,יופלה דיאט קוקוס 150 מל תנובה,תנובה - חלב,יח`,,1,4.90,3.27
3364,יופלה תות GO 200 מל,תנובה - חלב,יח`,,1,5.60,2.80
3365,יופלה אפרסק GO 200 מל,תנובה - חלב,יח`,,1,5.60,2.80
3366,יופלה פירות יער 200 מל GO תנובה,תנובה - חלב,יח`,,1,5.60,2.80
3367,יופלה משקה יוגורט מועשר בחלבון עם בננה ו,תנובה - חלב,יח`,,1,6.10,6.10
3368,יופלה משקה יוגורט מועשר בחלבון עם תות ופ,תנובה - חלב,יח`,,1,6.10,6.10
3369,יופלה בטעם אננס 200 גר` GO,תנובה - חלב,יח`,,1,5.60,2.80
3370,יוגורט GO בתוספת גרנולה מעושרת בחלבון ע,תנובה - חלב,יח`,,1,5.90,3.47
3371,יוגורט GO בתוספת גרנולה מעושרת בחלבון ע,תנובה - חלב,יח`,,1,5.90,3.47
3372,יוגורט GO עם דובדבן מופחת קולריות 200 ג,תנובה - חלב,יח`,,1,5.50,2.75
3373,יוגורט GO עם אפרסק מופחת קלוריות 200 גר,תנובה - חלב,יח`,,1,5.50,2.75
3374,יוגורט GO עם פירות יער מופחת קולריות 20,תנובה - חלב,יח`,,1,5.50,2.75
3375,משקה קוקוס שקדים 1 ליטר תנובה,תנובה - חלב,יח`,,1,11.90,1.19
3376,יולו שוקולד חלב עם קצפת 42% מוצקי קקאו(1,תנובה - חלב,יח`,,1,3.70,3.08
3377,יולו שוקולד עם קצפת 36% מוצקי קקאו 120 ג,תנובה - חלב,יח`,,1,3.70,3.08
3378,משקה חלב עם קפה 340 גר` 27 גר` חלבון go,תנובה - חלב,יח`,,1,7.90,2.32
3379,יופלה לייט בטעם אננס 200 גר` GO,תנובה - חלב,יח`,,1,5.60,2.80
3380,משקה יופלה יוגורט פירות טרופיים 250 מל,תנובה - חלב,יח`,,1,6.10,6.10
3381,יופלה און טופ ( 157 גר` ) party,תנובה - חלב,יח`,,1,4.90,3.12
3382,יופלה און טופ ( 157 גר` ) SUMMER,תנובה - חלב,יח`,,1,4.90,3.12
3383,יופלה און טופ ( 157 גר` ) BLACK WHITE,תנובה - חלב,יח`,,1,4.90,3.12
3384,משקה חלב בטעם וניל 340 גר` 27 גר` חלבון,תנובה - חלב,יח`,,1,7.90,2.32
3385,משקה יוגורט גו לייט תות בננה 250 מל,תנובה - חלב,יח`,,1,6.10,6.10
3386,משקה יוגורט גו לייט מנגו אננס 250 מל,תנובה - חלב,יח`,,1,6.10,6.10
3387,משקה שיבולת שועל 1 ליטר תנובה,תנובה - חלב,יח`,,1,11.90,1.19
3388,יופלה 200 גר` GO קינמון,תנובה - חלב,יח`,,1,5.60,2.80
3389,יופלה GO טבעי 0.7% שומן ( 150 גר`) תנוב,תנובה - חלב,יח`,,1,4.90,3.27
3390,יופלה GO לייט עם תות 150 גר תנובה,תנובה - חלב,יח`,,1,4.90,3.27
3391,יופלה GO לייט עם קוקוס 150 גר תנובה,תנובה - חלב,יח`,,1,4.90,3.27
3392,משקה תנובה GO אייס קפה 250 מל,תנובה - חלב,יח`,,1,5.90,2.36
3393,יופלה און טופ פצפוצים 157 גר`,תנובה - חלב,יח`,,1,4.90,3.12
3394,יופלה און טופ קורנפלקס 157 גר`,תנובה - חלב,יח`,,1,4.90,3.12
3395,יופלה און טופ גרנולה 157 גר` תנובה,תנובה - חלב,יח`,,1,4.90,3.12
3396,פריכיות הטעימות עשיר חלבון אנרג`י,שטראוס גרופ בעמ,יח`,,1,12.90,9.56
3397,ספלנדיד צריר אגוזי לוז חמוציות 105 גר` ע,שטראוס גרופ בעמ,יח`,,1,13.90,13.24
3398,ספלנדיד חלב אגוזי לוז קוקוס קלוי 105 גר`,שטראוס גרופ בעמ,יח`,,1,13.90,13.24
3399,דנונה מ.מעודנת ללא סוכר 150 גרם,שטראוס גרופ בעמ/מצונן,יח`,,1,3.70,2.47
3400,רבע לשבע מריר 60% עלית 120 גר`,שטראוס גרופ בעמ,יח`,,1,12.90,10.75
3401,קפסולות קפה עלית קולומביה 08,שטראוס גרופ בעמ,יח`,,1,16.90,33.80
3402,צנצנת בוקסי מנטה אקליפטוס 64 גר` עלית,שטראוס גרופ בעמ,יח`,,1,9.90,15.47
3403,צנצנת בוקסי מנטה פטל 64 גר` עלית,שטראוס גרופ בעמ,יח`,,1,9.90,15.47
3404,חטיף מקופלת בלונדי עלית (25 גרם),שטראוס גרופ בעמ,יח`,,1,3.90,15.60
3405,קונפיטורת תות במתיקות מעודנת 265 גר` יד,שטראוס גרופ בעמ,יח`,,1,14.90,5.62
3406,קונפיטורת משמש במתיקות מעודנת 265 גר` יד,שטראוס גרופ בעמ,יח`,,1,14.90,5.62
3407,קונפיטורת פירות יער במתיקות מעודנת 265 ג,שטראוס גרופ בעמ,יח`,,1,14.90,5.62
3408,מגבונים להסרת לק (10 יח) ICARE,שקד תבל בעמ,יח`,,1,7.90,7.90
3409,דר עור תחליב רחצה קלאסי 700 מל-קוקוס,שקד תבל בעמ,יח`,,1,19.90,2.84
3410,מגבונים להסרת איפור ( 25 יח ) ICARE,שקד תבל בעמ,יח`,,1,7.90,7.90
3411,מגבונים לניקוי משקפיים ( 24 יח) ICARE,שקד תבל בעמ,יח`,,1,7.90,7.90
3412,ניקול מטליות לחות לשיש ניחוח מרכך כביסה,קימברלי קלארק ישראל שיווק בעמ,יח`,,1,11.90,11.90
3413,ניקול מטליות לחות לריצפה ניחוח מרכך כביס,קימברלי קלארק ישראל שיווק בעמ,יח`,,1,13.90,13.90
3414,ניקול רדיד אלומיניום חסכוני 60 מטר עם סכ,קימברלי קלארק ישראל שיווק בעמ,יח`,,1,44.90,44.90
3415,מפיות אירוח איכותיות ונעימות למגע ניקול,קימברלי קלארק ישראל שיווק בעמ,יח`,,1,8.90,8.90
3416,תחבושות קוטקס אקטיב נורמל דואו ( 24 יח),קימברלי קלארק ישראל שיווק בעמ,יח`,,1,14.90,14.90
3417,תחבושות קוטקס אקטיב סופר דאו ( 18 יח),קימברלי קלארק ישראל שיווק בעמ,יח`,,1,14.90,14.90
3418,כריות יפניות אנטיבקטריאליות ניקול,קימברלי קלארק ישראל שיווק בעמ,יח`,,1,12.90,12.90
3419,מטליות לחות אנטיבקטריאלי,קימברלי קלארק ישראל שיווק בעמ,יח`,,1,12.90,12.90
3420,מטליות מייקרופייבר למשטחים אנטיבקטריאלי,קימברלי קלארק ישראל שיווק בעמ,יח`,,1,14.90,14.90
3421,מפיות אירוח איכותיות צבעוני - ניקול,קימברלי קלארק ישראל שיווק בעמ,יח`,,1,8.90,8.90
3422,מגן תחתון ג`גיה נורמל קוטקס (76 ),קימברלי קלארק ישראל שיווק בעמ,יח`,,1,19.90,19.90
3423,מגן תחתון לארג` ג`גיה קוטקס (64 ),קימברלי קלארק ישראל שיווק בעמ,יח`,,1,19.90,19.90
3424,מגן תחתון יאנג ג`יגה קוטקס (76),קימברלי קלארק ישראל שיווק בעמ,יח`,,1,19.90,19.90
3425,תערובת אגוזים ואננס 150 גר` קליית גת,ליימן שליסל בעמ,יח`,,1,19.90,13.27
3426,תערובת אגוזים קלויים ללא מלח 150 גר` קלי,ליימן שליסל בעמ,יח`,,1,19.90,13.27
3427,מנה חמה קוסקוס עגבניות פיקנטי,קבוצת אסם סחר שות. מוגבלת,יח`,,1,6.90,7.93
3428,חומוס צבר סמיר הגדול מוגדל 600 גר`,קבוצת אסם סחר שות. מוגבלת,יח`,,1,13.90,2.32
3429,סלט חציל פיקנטי מרובע 400 גר` צבר,קבוצת אסם סחר שות. מוגבלת,יח`,,1,11.90,2.98
3430,סלט טורקי מרובע 400 גר` צבר,קבוצת אסם סחר שות. מוגבלת,יח`,,1,11.90,2.98
3431,חומוס עם המון מטבוחה 375 גר` צבר,קבוצת אסם סחר שות. מוגבלת,יח`,,1,12,3.20
3432,חומוס עם המון פלפלים חריפים 375 גר` צבר,קבוצת אסם סחר שות. מוגבלת,יח`,,1,12,3.20
3433,סלט מטבוחה חריפה מרובע 400 גר` צבר,קבוצת אסם סחר שות. מוגבלת,יח`,,1,10.90,2.73
3434,פסטה ספירלי מהדורה מיוחדת 20% אסם (600 ג,קבוצת אסם סחר שות. מוגבלת,יח`,,1,5.90,1.18
3435,ספגטי מהדורה מיוחדת ( 600 גר` ) אסם,קבוצת אסם סחר שות. מוגבלת,יח`,,1,5.90,0.98
3436,פסטה צינורות פלוס 400 גר` אסם,קבוצת אסם סחר שות. מוגבלת,יח`,,1,5.90,1.48
3437,פיטנס פריכיות 3 דגנים דקות 120 גר` אסם,קבוצת אסם סחר שות. מוגבלת,יח`,,1,11.90,9.92
3438,פיטנס פריכיות דקות עם קינואה 120 גר` אסם,קבוצת אסם סחר שות. מוגבלת,יח`,,1,11.90,9.92
3439,המבורגר מן הצומח 630 גר` טבעול,קבוצת אסם סחר שות. מוגבלת,יח`,,1,32.90,5.22
3440,כדורי בשר מן הצומח 500 גר` טבעול,קבוצת אסם סחר שות. מוגבלת,יח`,,1,32.90,6.58
3441,ביסלי מעושן 70 גר` אסם,קבוצת אסם סחר שות. מוגבלת,יח`,,1,3.90,5.57
3442,ביסלי ספייסי צ`לי 70 גר` אסם,קבוצת אסם סחר שות. מוגבלת,יח`,,1,3.90,5.57
3443,קציצות כרובית אדממה וטחינה 525 גר` טבעול,קבוצת אסם סחר שות. מוגבלת,יח`,,1,32.90,6.27
3444,קציצות דלורית אדממה קנואה אדומה 525 גר`,קבוצת אסם סחר שות. מוגבלת,יח`,,1,32.90,6.27
3445,פסטה פרפקטו קנלוני 500 גר` אסם,קבוצת אסם סחר שות. מוגבלת,יח`,,1,10.90,2.18
3446,פנה פלוס 50% יותר חלבון 400 גר` אסם,קבוצת אסם סחר שות. מוגבלת,יח`,,1,5.90,1.48
3447,ספגטי פלוס 50% יותר חלבון 400 גר` אסם,קבוצת אסם סחר שות. מוגבלת,יח`,,1,5.90,1.48
3448,במבה ביסלי מיקס 80 גר` אסם,קבוצת אסם סחר שות. מוגבלת,יח`,,1,4.30,5.38
3449,פלאפל מרכיבים ביתיים בלבד 590 גר` טבעול,קבוצת אסם סחר שות. מוגבלת,יח`,,1,32.90,5.58
3450,שניצל ברוקולי 667 גר` טבעול,קבוצת אסם סחר שות. מוגבלת,יח`,,1,32.90,4.93
3451,שניצל דק בטעם צ`לי חריף 564 גר` טבעול,קבוצת אסם סחר שות. מוגבלת,יח`,,1,32.90,5.83
3452,חטיפי תירס 657 גר` טבעול,קבוצת אסם סחר שות. מוגבלת,יח`,,1,29.90,4.55
3453,שווארמה צמחונית 500 גר` טבעול,קבוצת אסם סחר שות. מוגבלת,יח`,,1,32.90,6.58
3454,שניצל דק מן הצומח 564 גר` טבעול,קבוצת אסם סחר שות. מוגבלת,יח`,,1,32.90,5.83
3455,נקניקיות טינר צמחוניות 680 גר` טבעול,קבוצת אסם סחר שות. מוגבלת,יח`,,1,32.90,4.84
