,ItemName,ManufactureName,UnitQty,Quantity,QtyInPackage,ItemPrice,UnitOfMeasurePrice
3140,מעדן בטעם תות בננה גמדים (100x8 גרם),שטראוס גרופ בעמ/מצונן,יח`,,1,18.80,2.35
3141,מילקי טופ עדשים,שטראוס גרופ בעמ/מצונן,יח`,,1,4.60,2.71
3142,טחינה משומשום מלא אחלה (500 גרם),שטראוס גרופ בעמ/מצונן,יח`,,1,14.90,2.98
3143,אפרופו 50 גר` איטליאנו,קבוצת אסם סחר שות. מוגבלת,יח`,,1,5,10
3144,פודינג בטעם וניל צרפתי 80  גר`אסם,קבוצת אסם סחר שות. מוגבלת,יח`,,1,5.90,7.38
3145,דובונים חטיף תפוחי אדמה אסם (20x5 גרם),קבוצת אסם סחר שות. מוגבלת,יח`,,1,13.90,13.90
3146,גביעי גלידה אסם) (24,קבוצת אסם סחר שות. מוגבלת,יח`,,1,13.90,14.63
3147,גביעי גלידה אמריקאים אסם) (24,קבוצת אסם סחר שות. מוגבלת,יח`,,1,13.90,11.58
3148,במבה אסם (200 גרם),קבוצת אסם סחר שות. מוגבלת,יח`,,1,9.90,4.95
3149,תמר כבוש 500 גר` בית שאן שוקחה,בני ג`ורג` שוקחה (חיפה) בעמ,יח`,,1,12.90,2.58
3150,מארז 8 דני וניל,שטראוס גרופ בעמ/מצונן,יח`,,1,16.40,16.40
3151,רצועות פלפלים קלויים אחלה (400 גרם),שטראוס גרופ בעמ/מצונן,יח`,,1,16.50,4.13
3152,קפה טורקי עלית (85x3 גרם),שטראוס גרופ בעמ,יח`,,1,19.90,7.80
3153,עוגת שוקולד עם קרם שוקולד,שטראוס גרופ בעמ,יח`,,1,17.90,5.42
3154,תפוצ`יפס 200 גר` שמנת בצל,שטראוס פריטו ליי בעמ,יח`,,1,10.90,5.45
3155,שוקולד פרה עם קרם נוגט עלית (100  גרם)מ,שטראוס גרופ בעמ,יח`,,1,4.90,4.90
3156,מארז 4 דני לשתייה,שטראוס גרופ בעמ/מצונן,יח`,,1,11,2.20
3157,מילקי שמיניה,שטראוס גרופ בעמ/מצונן,יח`,,1,19.90,2.29
3158,שוקולד מריר עלית (100x5 גרם),שטראוס גרופ בעמ,יח`,,1,22.90,4.58
3159,שמן זית כתית מעולה יד מרדכי (750 מל),שטראוס גרופ בעמ,יח`,,1,32.90,4.39
3160,שוקולד פרה חלב עלית (100x5 גרם),שטראוס גרופ בעמ,יח`,,1,22.90,4.58
3161,צלחות ענק קרם) (25 פאלאס,פאלאס תעשיות נטו (2014) בעמ,יח`,,1,14.90,14.90
3162,צלחות ענק זהב פאלאס) (25,פאלאס תעשיות נטו (2014) בעמ,יח`,,1,14.90,14.90
3163,צלחת גדולה קרם 25 יח פאלאס,פאלאס תעשיות נטו (2014) בעמ,יח`,,1,8.90,8.90
3164,צלחת גדולה זהב 25 יח פאלאס,פאלאס תעשיות נטו (2014) בעמ,יח`,,1,8.90,8.90
3165,צלחת קטנה קרם 25 יח פאלאס,פאלאס תעשיות נטו (2014) בעמ,יח`,,1,5.90,5.90
3166,קערית אובלית זהב 25 יח פאלאס,פאלאס תעשיות נטו (2014) בעמ,יח`,,1,4.90,4.90
3167,נר נשמה בפחית פאלאס,פאלאס תעשיות נטו (2014) בעמ,יח`,,1,1.90,1.90
3168,מגבון טואלט שלישייה פאלס,פאלאס תעשיות נטו (2014) בעמ,יח`,,1,9.90,9.90
3169,תבנית אלומניום קטנה R29 + מכסה,פאלאס תעשיות נטו (2014) בעמ,יח`,,1,11.90,11.90
3170,כוסות נייר b8 פאלאס (50),פאלאס תעשיות נטו (2014) בעמ,יח`,,1,7.90,0.16
3171,מפות  אלבד+ דוגמא 2יח 2.70*1.20,פאלאס תעשיות נטו (2014) בעמ,יח`,,1,12.90,12.90
3172,מפיות אירוח נקודות 80 יח לפיד,פאלאס תעשיות נטו (2014) בעמ,יח`,,1,5.90,5.90
3173,כוסות חד פעמיות לשתיה קרה פאלאס (100),פאלאס תעשיות נטו (2014) בעמ,יח`,,1,3.90,3.90
3174,מגש עגול מחולק ל  -5 שקוף,פאלאס תעשיות נטו (2014) בעמ,יח`,,1,6.90,6.90
3175,נר הבדלה שטוח פאלס,פאלאס תעשיות נטו (2014) בעמ,יח`,,1,6.90,6.90
3176,פתיל צף עגול 50 יח,פאלאס תעשיות נטו (2014) בעמ,יח`,,1,3.90,3.90
3177,מפיות לבנות 100 יח לפיד,פאלאס תעשיות נטו (2014) בעמ,יח`,,1,3.90,3.90
3178,כוסיות  יין- 50 יח פאלאס,פאלאס תעשיות נטו (2014) בעמ,יח`,,1,7.90,7.90
3179,קעריות אובלי שקוף 50 יח פאלאס,פאלאס תעשיות נטו (2014) בעמ,יח`,,1,7.90,7.90
3180,תבנית אלומניום בינונית R31 פאלאס 7 יח,פאלאס תעשיות נטו (2014) בעמ,יח`,,1,8.90,8.90
3181,תחליב רחצה בניחוח קמומיל נקה 7 (750 מל),החברה הדרומית לשיווק בעמ,יח`,,1,11.90,1.59
3182,תחליב רחצה נקה 7 ירוק אלוורה,החברה הדרומית לשיווק בעמ,יח`,,1,11.90,1.59
3183,תחליב רחצה נקה 7 וניל שקד,החברה הדרומית לשיווק בעמ,יח`,,1,11.90,1.59
3184,ספריי תחליב לילדים 300/50,החברה הדרומית לשיווק בעמ,יח`,,1,49.90,49.90
3185,טיטניום ספרי גוף קלאסי 150 מל,החברה הדרומית לשיווק בעמ,יח`,,1,9.90,6.60
3186,טיטניום ספרי גוף בלק 150 מל,החברה הדרומית לשיווק בעמ,יח`,,1,9.90,6.60
3187,דאו סטיק קרליין  נושם+,החברה הדרומית לשיווק בעמ,יח`,,1,19.90,39.80
3188,דאו ספריי נושם קרליין,החברה הדרומית לשיווק בעמ,יח`,,1,12.90,6.45
3189,סופטקר מגבונים רביעייה,החברה הדרומית לשיווק בעמ,יח`,,1,17.90,17.90
3190,סופטקר מגבונים רביעייה,החברה הדרומית לשיווק בעמ,יח`,,1,19.90,19.90
3191,סקינגארד סקין ספריי שקוף 300/50,החברה הדרומית לשיווק בעמ,יח`,,1,54.90,18.30
3192,סקינגארד רולאון 70/50 מל,החברה הדרומית לשיווק בעמ,יח`,,1,29.90,29.90
3193,תח הגנה 250-50 ילדים s.g,החברה הדרומית לשיווק בעמ,יח`,,1,41.90,41.90
3194,סקינגארד סקין משפחתי 300/50 ווט,החברה הדרומית לשיווק בעמ,יח`,,1,54.90,18.30
3195,קפסולות 10 חזק ועוצמתי עלית (10),שטראוס גרופ בעמ,יח`,,1,16.90,33.80
3196,קפסולות 7 עדין וקטיפתי עלית (10),שטראוס גרופ בעמ,יח`,,1,16.90,33.80
3197,שמן זית כתית מעולה חזק 750 מל,שטראוס גרופ בעמ,יח`,,1,32.90,4.39
3198,שמנת לבישול 15% יטבתה (250 מל),שטראוס גרופ בעמ/מצונן,יח`,,1,8,3.20
3199,כיף כף מגדים 45 גרם,שטראוס גרופ בעמ,יח`,,1,3.90,8.67
3200,מקלות כיף כף קלאסי עלית (40 גרם),שטראוס גרופ בעמ,יח`,,1,5,12.50
3201,כיף כף מקלות פצפוצים,שטראוס גרופ בעמ,יח`,,1,5,12.50
3202,מקלות כיף כף אגוזים עלית (42 גרם),שטראוס גרופ בעמ,יח`,,1,5,11.90
3203,ביסקוויט עד חצות לבן 200 גר`,שטראוס גרופ בעמ,יח`,,1,13.90,6.95
3204,טחינה לבנה אחלה (400 גרם),שטראוס גרופ בעמ/מצונן,יח`,,1,15.50,3.88
3205,סימפוניה פלפל שיפקה חריף,שטראוס גרופ בעמ/מצונן,יח`,,1,11.40,5.70
3206,חומוס עם פלפל שיפקה אחלה (400 גרם),שטראוס גרופ בעמ/מצונן,יח`,,1,11.50,2.88
3207,שמנת עמידה לקצפת 32% שומן,שטראוס גרופ בעמ/מצונן,יח`,,1,6.90,2.76
3208,שמנת חמוצה 9% יטבתה (200 מל),שטראוס גרופ בעמ/מצונן,יח`,,1,3.10,1.55
3209,משקה פונץ בננה 250 מל,שטראוס גרופ בעמ/מצונן,יח`,,1,5.30,2.12
3210,סימפוניה בצל ירוק 5%,שטראוס גרופ בעמ/מצונן,יח`,,1,11.40,5.70
3211,צ`יטוס דולפינים עלית (55 גרם),שטראוס פריטו ליי בעמ,יח`,,1,3.50,6.36
3212,ליידי ספיד סטיק,ש.שסטוביץ בעמ,יח`,,1,14.90,29.80
3213,פלמוליב ספא קוקוס גרגרים 500 מל,ש.שסטוביץ בעמ,יח`,,1,19.90,3.98
3214,ספיד סטיק נוטרו,ש.שסטוביץ בעמ,יח`,,1,16.90,16.90
3215,ספיד סטיק כחול א,ש.שסטוביץ בעמ,יח`,,1,24.90,24.90
3216,נייר אפיה קוקי) (40,ש.שסטוביץ בעמ,יח`,,1,9.90,9.90
3217,מיונז הולנדי מאסטר שף (483 גר`),ש.שסטוביץ בעמ,יח`,,1,9.90,2.05
3218,וודקה פינלנדיה 700 מל,מ. אקרמן בעמ,יח`,,1,64.90,9.23
3219,וויסקי ג`ק דניאלס 700 מל,מ. אקרמן בעמ,יח`,,1,129.90,18.51
3220,חטיף טורטיה שום ובצל אסם (60 גרם),קבוצת אסם סחר שות. מוגבלת,יח`,,1,7.90,13.17
3221,עוגיות ביס בטעם חמאה,קבוצת אסם סחר שות. מוגבלת,יח`,,1,10.90,3.63
3222,רוטב לסלט סויה בסגנון סיני,קבוצת אסם סחר שות. מוגבלת,יח`,,1,12.90,4.45
3223,במבה אסם (25x10 גרם),קבוצת אסם סחר שות. מוגבלת,יח`,,1,16.90,6.76
3224,עוגת הבית דמקה שוקו וניל 320 גר` בחושות,קבוצת אסם סחר שות. מוגבלת,יח`,,1,11.90,3.72
3225,פירורית זהב שומשום אסם (200 גרם),קבוצת אסם סחר שות. מוגבלת,יח`,,1,6.90,3.45
3226,פתיתים אפויים 500 גר` אורז עם אטריות אסם,קבוצת אסם סחר שות. מוגבלת,יח`,,1,6.90,6.90
3227,עוגת בראוניז פאדג`,קבוצת אסם סחר שות. מוגבלת,יח`,,1,18.90,4.73
3228,שוקולד מריר 85% ספלנדיד (100 גרם),שטראוס גרופ בעמ,יח`,,1,10.90,10.90
3229,חומוס אחלה (400 גרם),שטראוס גרופ בעמ/מצונן,יח`,,1,8.90,2.23
3230,דנונה לשתיה תות בננה,שטראוס גרופ בעמ/מצונן,יח`,,1,4.90,1.86
3231,רביולי עם בטטה פרווה שטראוס (400 גרם),שטראוס גרופ בעמ/מצונן,יח`,,1,20.90,5.23
3232,רבע לשבע,שטראוס גרופ בעמ,יח`,,1,12.90,8.06
3233,דנונה פרו תות,שטראוס גרופ בעמ/מצונן,יח`,,1,4.60,3.07
3234,עוגה אישית מילקי  -CAKE רביעייה,שטראוס גרופ בעמ/מצונן,יח`,,1,10.90,8.01
3235,סלט טורקי אחלה (400 גרם),שטראוס גרופ בעמ/מצונן,יח`,,1,16.50,4.13
3236,קוביות סלק אחלה (400 גרם),שטראוס גרופ בעמ/מצונן,יח`,,1,15.50,3.88
3237,מאגדת טוויסט עלית (28x4 גרם),שטראוס גרופ בעמ,יח`,,1,13.90,13.90
3238,חטיף פופס תפוצ`יפס (60 גרם),שטראוס פריטו ליי בעמ,יח`,,1,3.90,6.50
3239,שוקולית לאפיה 500 גר`,שטראוס גרופ בעמ,יח`,,1,14.90,2.98
3240,קפסולות קפה עלית ברזיל) (10,שטראוס גרופ בעמ,יח`,,1,16.90,33.80
3241,קפסולות קפה עלית נטול קפאין אספרסו (10),שטראוס גרופ בעמ,יח`,,1,16.90,33.80
3242,אנרג`י פריכיות תחתית שוקולד,שטראוס גרופ בעמ,יח`,,1,8.90,12.71
3243,חטיף תירס בטעם טבעי דוריטוס (185 גרם),שטראוס פריטו ליי בעמ,יח`,,1,7.50,4.05
3244,רוטב לסלט צ`ילי מתוק,קבוצת אסם סחר שות. מוגבלת,יח`,,1,12.90,4.45
3245,קרקר לחמית חמישה דגנים אסם (190 גרם),קבוצת אסם סחר שות. מוגבלת,יח`,,1,8.90,4.68
3246,חטיפי טורטיה בטעם חמוץ מתוק אסם (60 גרם),קבוצת אסם סחר שות. מוגבלת,יח`,,1,7.90,13.17
3247,קמח שמרים לפיצה ופוקצ`ה אסם 1 קג`,קבוצת אסם סחר שות. מוגבלת,יח`,,1,10.90,1.09
3248,קריספי טאפאס זיתים,קבוצת אסם סחר שות. מוגבלת,יח`,,1,11.90,7.93
3249,חומוס עם טחינה צבר (400 גרם),קבוצת אסם סחר שות. מוגבלת,יח`,,1,12,3
3250,חומוס עם צנוברים צבר (400 גרם),קבוצת אסם סחר שות. מוגבלת,יח`,,1,12,3
3251,חומוס אבו גוש צבר (400 גרם),קבוצת אסם סחר שות. מוגבלת,יח`,,1,11.90,2.98
3252,בייגלה שטוחים עם שומשום,קבוצת אסם סחר שות. מוגבלת,יח`,,1,9.90,3.30
3253,בייגלה שטוחים טבעות עם מלח אסם (300 גרם),קבוצת אסם סחר שות. מוגבלת,יח`,,1,9.90,3.30
3254,עוגת הבית סופלה טעם שוקו וניל,קבוצת אסם סחר שות. מוגבלת,יח`,,1,11.90,3.50
3255,חומוס צבר (400 גרם),קבוצת אסם סחר שות. מוגבלת,יח`,,1,11.90,2.38
3256,חומוס מסעדה צבר (700 גרם),קבוצת אסם סחר שות. מוגבלת,יח`,,1,11.90,1.70
3257,לה קרמריה 1.4 וניל,נגה גלידות שותפות מוגבלת,יח`,,1,22.90,1.64
3258,לה קרמריה 1.4 ריבת חלב,נגה גלידות שותפות מוגבלת,יח`,,1,22.90,1.64
3259,לה קרמריה 1.4 פונטש בננה,נגה גלידות שותפות מוגבלת,יח`,,1,22.90,16.36
3260,לה קרמריה 1.4 תותים בשמנת,נגה גלידות שותפות מוגבלת,יח`,,1,22.90,1.64
3261,לה קרמריה 1.4 שוקו וניל פרווה,נגה גלידות שותפות מוגבלת,יח`,,1,22.90,16.36
3262,לה קרמריה 1.4 שוקולד,נגה גלידות שותפות מוגבלת,יח`,,1,22.90,1.64
3263,לה קרמריה 1.4 וניל שוקו,נגה גלידות שותפות מוגבלת,יח`,,1,22.90,1.64
3264,טחינה אמיתית צבר (400 גרם),קבוצת אסם סחר שות. מוגבלת,יח`,,1,11.90,2.98
3265,סלט חציל על האש בטחינה צבר (400 גרם),קבוצת אסם סחר שות. מוגבלת,יח`,,1,12.90,3.23
3266,חציל במיונז על האש צבר (400 גרם),קבוצת אסם סחר שות. מוגבלת,יח`,,1,11.90,2.98
3267,סלט כרוב אדום צבר (400 גרם),קבוצת אסם סחר שות. מוגבלת,יח`,,1,10.90,2.73
3268,רוגעלך 560  גר`בונז`ור ולתנור קפוא,קבוצת אסם סחר שות. מוגבלת,יח`,,1,19.90,3.55
3269,דגני בוקר שיבולת שועל 340 גר`,קבוצת אסם סחר שות. מוגבלת,יח`,,1,17.90,5.26
3270,דובונים חטיף תפוחי אדמה אסם (100 גרם),קבוצת אסם סחר שות. מוגבלת,יח`,,1,9.90,9.90
3271,עוגת הבית שמרים שוקולד קלסית,קבוצת אסם סחר שות. מוגבלת,יח`,,1,17.90,5.11
3272,מאגדת טעמי מגדים,שטראוס גרופ בעמ,יח`,,1,13.90,8.69
3273,פיתה קראנצ` בטעם זעתר עלית (300 גרם),שטראוס פריטו ליי בעמ,יח`,,1,13,4.33
3274,תפוצ`יפס 50 גר` אקסטרא,שטראוס פריטו ליי בעמ,יח`,,1,3.90,3.90
3275,פופקורן בטעם טבעי עלית (65 גרם),שטראוס פריטו ליי בעמ,יח`,,1,3.90,6
3276,בפלות טורטית מהדרין עלית (360 גרם),שטראוס גרופ בעמ,יח`,,1,15.80,4.39
3277,תפוצ`יפס 200 גר` אקסטרא,שטראוס פריטו ליי בעמ,יח`,,1,10.90,5.45
3278,טורטית מגדים,שטראוס גרופ בעמ,יח`,,1,3.90,9.75
3279,חטיף תירס ובוטנים צ`יטוס (80 גרם),שטראוס פריטו ליי בעמ,יח`,,1,4.50,5.63
3280,קונפיטורת תות לייט יד מרדכי (230 גרם),שטראוס גרופ בעמ,יח`,,1,14.90,5.96
3281,לאבנה שמן זית וזעתר %10שומן,שטראוס גרופ בעמ/מצונן,יח`,,1,13.90,3.48
3282,חטיף תירס חמוץ חריף דוריטוס (185 גרם),שטראוס פריטו ליי בעמ,יח`,,1,7.50,4.05
3283,יד מרדכי מיץ לימון 250 מל,שטראוס גרופ בעמ,יח`,,1,8.90,3.56
3284,חטיף תירס בטעם גבינה צ`יטוס (80 גרם),שטראוס פריטו ליי בעמ,יח`,,1,4.50,5.63
3285,מסטיק ללא סוכר בזוקה (66 גרם),שטראוס גרופ בעמ,יח`,,1,9.90,15
3286,מאסט ללא סוכר צנצנת,שטראוס גרופ בעמ,יח`,,1,9.90,15
3287,צנצנת ספירמינט צ`יקלט,שטראוס גרופ בעמ,יח`,,1,9.90,15
3288,חיוכים וניל 150 גר`,שטראוס גרופ בעמ,יח`,,1,4.90,3.27
3289,דנונה פרו אננס,שטראוס גרופ בעמ/מצונן,יח`,,1,4.60,3.07
3290,כיף כף פצפצים עלית (135 גרם),שטראוס גרופ בעמ,יח`,,1,9.90,7.33
3291,חלב טבעי 3.6% יטבתה (1 ליטר),שטראוס גרופ בעמ/מצונן,יח`,,1,7.50,0.75
3292,עוגת בראוניז טורטית 380 גר` עלית,שטראוס גרופ בעמ,יח`,,1,16.90,4.45
3293,יוגורט תות 3% דנונה (150x8 גרם),שטראוס גרופ בעמ/מצונן,יח`,,1,24.90,2.08
3294,מגבוני בד לחים ליטופים (72x5),החברה הדרומית לשיווק בעמ,יח`,,1,21.90,21.90
3295,מטליות לחות לניקוי כללי סושי סנו (50x3),החברה הדרומית לשיווק בעמ,יח`,,1,20,20
3296,מגבוני טואלט לחים סנו סופט (48x3),החברה הדרומית לשיווק בעמ,יח`,,1,19.90,19.90
3297,שקיות אשפה חזקות 90x78 סנו סושי (20),החברה הדרומית לשיווק בעמ,יח`,,1,24.90,24.90
3298,תחליב רחצה פרח וניל קרמה (750 מל),החברה הדרומית לשיווק בעמ,יח`,,1,19.90,2.65
3299,ריצפז פרש מטליות חד פעמיות ניחוח מלון מפ,החברה הדרומית לשיווק בעמ,יח`,,1,12.90,12.90
3300,ג`ל בייבי סנו אוקסיג`ן (3 ליטר),החברה הדרומית לשיווק בעמ,יח`,,1,29.90,9.97
3301,ספארק טבליות למדיח סנו (100),החברה הדרומית לשיווק בעמ,יח`,,1,54.90,54.90
3302,סנו מקסימה א. כביסה בייבי 3.25 קג,החברה הדרומית לשיווק בעמ,יח`,,1,31.90,9.82
3303,ספארק נוזל הברקה למדיח סנו (700 מל),החברה הדרומית לשיווק בעמ,יח`,,1,14.90,1.66
3304,ספארק מלח למדיח סנו (2 קג),החברה הדרומית לשיווק בעמ,יח`,,1,10.90,5.45
3305,נוזל לניקוי כלים לימון 700 מל,החברה הדרומית לשיווק בעמ,יח`,,1,7.90,1.13
3306,נוזל לניקוי כלים 700מל בניחוח לבנדר,החברה הדרומית לשיווק בעמ,יח`,,1,7.90,1.13
3307,נוזל לניקוי כלים קלאסי 700 מל,החברה הדרומית לשיווק בעמ,יח`,,1,7.90,1.13
3308,נוזל לניקוי כלים בניחוח לימון 1ליטר,החברה הדרומית לשיווק בעמ,יח`,,1,10.90,10.90
3309,קוטל חרקים K301 סנו (300 מל),החברה הדרומית לשיווק בעמ,יח`,,1,14.90,4.97
3310,מצנם לבן דפנות קרות FIX,אוהב ציון בעמ (מבצעים),יח`,,1,49.90,49.90
3311,חטיף כריות ממולא קרם חלב ושוקולד לבן כשל,יוניליוור ישראל שיווק בעמ,יח`,,1,17.90,11.93
3312,מאגדת חטיפי שוגי קורנפלקס שישייה,יוניליוור ישראל שיווק בעמ,יח`,,1,14.90,9.55
3313,מאגדת חטיפי ילדים שוגי שוקו שישייה,יוניליוור ישראל שיווק בעמ,יח`,,1,14.90,9.55
3314,מאגדת חטיפי ילדים שוגי פצפוצים שישייה,יוניליוור ישראל שיווק בעמ,יח`,,1,14.90,10.80
3315,מאגדת מיני סולרו קוקוס אננס,גלידות שטראוס בעמ,יח`,,1,21.90,4.56
3316,שטראוס קרמיסימו בננה טופי,גלידות שטראוס בעמ,יח`,,1,18.90,18.90
3317,קוקומן חום לבן 20% פחות סוכר 375 גר`,יוניליוור ישראל שיווק בעמ,יח`,,1,21.90,5.84
3318,דגני פיצי מהדרין תלמה (500 גרם),יוניליוור ישראל שיווק בעמ,יח`,,1,21.90,4.38
3319,ברנפלקס מהדרין תלמה (500 גרם),יוניליוור ישראל שיווק בעמ,יח`,,1,22.90,4.58
3320,שוגי 500 גר`,יוניליוור ישראל שיווק בעמ,יח`,,1,18.90,3.78
3321,מגה מקלות שומשום 150 גר`,יוניליוור ישראל שיווק בעמ,יח`,,1,5.90,3.93
3322,טבעות שומשום 300 גרם,יוניליוור ישראל שיווק בעמ,יח`,,1,10.90,3.63
3323,קליק טבלאות עם קורפלקס ופצפוצים 85 גר`,יוניליוור ישראל שיווק בעמ,יח`,,1,5.90,6.94
3324,גלידת שטראוס 2 ליטר כשלפ,גלידות שטראוס בעמ,יח`,,1,24.90,1.25
3325,שטראוס קרמיסימו טעם פיסטוק ושוקולד עם,גלידות שטראוס בעמ,יח`,,1,18.90,14.21
3326,מאגדת מצופים שוקולד בננה,גלידות שטראוס בעמ,יח`,,1,31.90,31.90
3327,חמישיית קולבי קטיפה,ש.עג`מי חשמל פלוס בעמ,יח`,,1,9.90,9.90
3328,פריכונים מאורז מלא אסם (310 גרם),קבוצת אסם סחר שות. מוגבלת,יח`,,1,13.90,4.48
3329,פסטה צינורות מהדרין אסם (500 גרם),קבוצת אסם סחר שות. מוגבלת,יח`,,1,5.90,1.18
3330,עוגיות מיני עם שוקוצ`יפס אסם (225 גרם),קבוצת אסם סחר שות. מוגבלת,יח`,,1,9.90,4.40
3331,בייגלה עיגולים אסם (300 גרם),קבוצת אסם סחר שות. מוגבלת,יח`,,1,13.90,4.63
3332,לה קרמריה 1.4 פיסטוק מוקה פרווה בדצ,נגה גלידות שותפות מוגבלת,יח`,,1,22.90,1.64
3333,בייגלה עיגולים בטעם זעתר 300 גר` אסם,קבוצת אסם סחר שות. מוגבלת,יח`,,1,9.90,3.30
3334,כיף כף פצפצים עלית (40 גרם),שטראוס גרופ בעמ,יח`,,1,4.90,12.25
3335,חלב 3% מועשר בבקבוק יטבתה (1 ליטר),שטראוס גרופ בעמ/מצונן,יח`,,1,7.50,0.75
3336,חלב מועשר 1% בבקבוק יטבתה (1 ליטר),שטראוס גרופ בעמ/מצונן,יח`,,1,7.50,0.75
3337,ג`לי ברכות 540 גר`-כשלפ,שטראוס גרופ בעמ,יח`,,1,19.90,3.69
3338,חלב 2% דל לקטוז בבקבוק יטבתה (1 ליטר),שטראוס גרופ בעמ/מצונן,יח`,,1,7.50,0.75
3339,אקטיביה יוגורט 1.5% דנונה (150x8 גרם),שטראוס גרופ בעמ/מצונן,יח`,,1,19.90,16.58
3340,דנונה יווני לבן 7%,שטראוס גרופ בעמ/מצונן,יח`,,1,3.30,2.54
3341,עד חצות עיגולים 225 גר`,שטראוס גרופ בעמ,יח`,,1,14.90,6.62
3342,צנצנת קוביות ספירמינט גומי לעיסה 58גר,שטראוס גרופ בעמ,יח`,,1,9.90,17.07
3343,צנצנת קוביות בזוקה גומי לעיסה 58גר,שטראוס גרופ בעמ,יח`,,1,9.90,17.07
3344,אקטימל תות שמינייה בנים,שטראוס גרופ בעמ/מצונן,יח`,,1,19.90,2.30
3345,חציל על האש אחלה (500 גרם),שטראוס גרופ בעמ/מצונן,יח`,,1,15.50,3.10
3346,מעדן חלב עם שוקולד ספלנדיד (130 גרם),שטראוס גרופ בעמ/מצונן,יח`,,1,3.20,2.46
3347,מילקי שוקולד עשיר 133 גר,שטראוס גרופ בעמ/מצונן,יח`,,1,3.70,2.78
3348,ממרח פסק זמן מגדים 350 גר`,שטראוס גרופ בעמ,יח`,,1,11.90,3.40
3349,שמנת חמוצה מהערבה 27% שומן יטבתה,שטראוס גרופ בעמ/מצונן,יח`,,1,3.90,1.95
3350,קוואקר שיבולת שועל ללא גולטן 511 גר`,שטראוס פריטו ליי בעמ,יח`,,1,19.90,3.89
3351,רולדה קפה נמס ווסטהיים 350 גר`,שטראוס גרופ בעמ,יח`,,1,15.90,4.54
3352,אגוזי 45 גר` כשלפ,שטראוס גרופ בעמ,יח`,,1,3.90,3.90
3353,סימפוניה שום שמיר 5%,שטראוס גרופ בעמ/מצונן,יח`,,1,11.40,5.70
3354,מאגדת אנרג`י מצופה טעמי,שטראוס גרופ בעמ,יח`,,1,14.90,8.87
3355,מעדן שטראוס דיאט וניל 0%,שטראוס גרופ בעמ/מצונן,יח`,,1,3.20,2.46
3356,מעדן שטראוס דיאט שוקולד מריר,שטראוס גרופ בעמ/מצונן,יח`,,1,3.20,2.46
3357,מעדן שטראוס דיאט שוקולד 0%,שטראוס גרופ בעמ/מצונן,יח`,,1,3.20,2.46
3358,מילקי קצפת קפוצ`ינו 133 גר,שטראוס גרופ בעמ/מצונן,יח`,,1,3.70,2.78
3359,בפלות שוקולד 200  גר`עלית,שטראוס גרופ בעמ,יח`,,1,3.90,1.95
3360,קונפיטורת שזיף 340 גר,שטראוס גרופ בעמ,יח`,,1,14.90,4.38
3361,בלונדי שקדים 100  גר`עלית,שטראוס גרופ בעמ,יח`,,1,7.50,7.50
3362,מיקס מעורב 190 גר כשלפ,שטראוס גרופ בעמ,יח`,,1,13.90,7.32
3363,מארז טורקי לדרך כשלפ,שטראוס גרופ בעמ,יח`,,1,17.90,10.65
3364,בראוניז פסק זמן בדצ 380 גר`,שטראוס גרופ בעמ,יח`,,1,16.90,4.45
3365,עוגיות שוקולד צ`יפס תחתית לבן 180 גר` על,שטראוס גרופ בעמ,יח`,,1,9.90,5.50
3366,עוגיות שוקוציפס תחתית חלב 180 גר` עלית,שטראוס גרופ בעמ,יח`,,1,9.90,5.50
3367,קפסולות קפה עלית אספרסו בטעם קרמל,שטראוס גרופ בעמ,יח`,,1,16.90,33.80
3368,קפסולות קפה עלית אוגנדה 13 למכונות נספרו,שטראוס גרופ בעמ,יח`,,1,16.90,33.80
3369,סימפוניה זיתים פיקנטים 200 גר`,שטראוס גרופ בעמ/מצונן,יח`,,1,11.40,5.70
