,ItemName,ManufactureName,UnitQty,Quantity,QtyInPackage,ItemPrice,UnitOfMeasurePrice
3244,תחליב רחצה כיף ניחוח קוקוס וניל 700 מל,החברה הדרומית לשיווק בעמ,יח`,,1,12.90,1.84
3245,תחליב רחצה כיף ניחוח לבנדר 700 מל,החברה הדרומית לשיווק בעמ,יח`,,1,12.90,1.84
3246,תחליב רחצה כיף ניחוח מאסק יסמין 700 מל,החברה הדרומית לשיווק בעמ,יח`,,1,12.90,1.84
3247,תחליב רחצה כיף ניחוח אוקיינס 700 מל,החברה הדרומית לשיווק בעמ,יח`,,1,12.90,1.84
3248,כיף שמפו לשיער רגיל תפוח זרעי צ`יה 700,החברה הדרומית לשיווק בעמ,יח`,,1,12.90,1.84
3249,כיף שמפו לשיער רגיל יבש רימונים ושמן ארג,החברה הדרומית לשיווק בעמ,יח`,,1,12.90,1.84
3250,כיף שמפו לשיער דק ושביר 700,החברה הדרומית לשיווק בעמ,יח`,,1,12.90,1.84
3251,כיף שמפו ומרכך 2+1 תאנה ומנטה 700,החברה הדרומית לשיווק בעמ,יח`,,1,12.90,1.84
3252,כיף שמפו לשיער מעוצב קרטין וחמאת שיאה 70,החברה הדרומית לשיווק בעמ,יח`,,1,12.90,1.84
3253,כיף מרכך לשיער רגיל תפוח זרעי צ`יה 700,החברה הדרומית לשיווק בעמ,יח`,,1,12.90,1.84
3254,כיף מרכך לשיער רגיל יבש רימונים ושמן ארג,החברה הדרומית לשיווק בעמ,יח`,,1,12.90,1.84
3255,כיף מרכך לשיער דק ושביר 700,החברה הדרומית לשיווק בעמ,יח`,,1,12.90,1.84
3256,כיף מרכך לשיער מעוצב קרטין וחמאת שיאה 70,החברה הדרומית לשיווק בעמ,יח`,,1,12.90,1.84
3257,גבינת גאודה מגורדת 500 גר` 28% שומן הולנ,ג.וילי-פוד אינטרנשיונל בעמ,יח`,,1,26.90,5.38
3258,גבינת מוצרלה פרוסות 150 גר` וילי פוד,ג.וילי-פוד אינטרנשיונל בעמ,יח`,,1,14.90,9.93
3259,גבינת חלומי 200 גר` SAY CHEESE וילי פוד,ג.וילי-פוד אינטרנשיונל בעמ,יח`,,1,24.90,12.45
3260,ממרח חמאה 250 גר` ללא מלח Euro spread ו,ג.וילי-פוד אינטרנשיונל בעמ,יח`,,1,11.90,4.76
3261,ממרח חמאה 250 גר` במליחות עדינה Euro spr,ג.וילי-פוד אינטרנשיונל בעמ,יח`,,1,11.90,4.76
3262,ממרח חמאה 250 גר` לייט לא מלח Euro sprea,ג.וילי-פוד אינטרנשיונל בעמ,יח`,,1,11.90,4.76
3263,ממרח חמאה 250 גר` לייט במליחות עדינה Eur,ג.וילי-פוד אינטרנשיונל בעמ,יח`,,1,11.90,4.76
3264,מאפה יוני במילוי קרם בטעם וניל 400 גר` ו,ג.וילי-פוד אינטרנשיונל בעמ,יח`,,1,19.90,4.98
3265,מאפה יוני במילוי גבינת פטה 400 גר` וילי,ג.וילי-פוד אינטרנשיונל בעמ,יח`,,1,19.90,4.98
3266,מאפה יוני במילוי תרד וגבינת פטה 400 גר`,ג.וילי-פוד אינטרנשיונל בעמ,יח`,,1,19.90,4.98
3267,חטיף שקדים וצימוקים HAPPY NUTS וילי פוד,ג.וילי-פוד אינטרנשיונל בעמ,יח`,,1,14.90,10.64
3268,חטיף שקדים וחמוציות HAPPY NUTS וילי פוד,ג.וילי-פוד אינטרנשיונל בעמ,יח`,,1,14.90,10.64
3269,גבינת עיזים רכה בציפוי תפוזים 29% שומן (,ג.וילי-פוד אינטרנשיונל בעמ,יח`,,1,14.90,13.55
3270,גבינת עיזים רכה בציפוי צ`לי 29% שומן (11,ג.וילי-פוד אינטרנשיונל בעמ,יח`,,1,14.90,13.55
3271,4 יח תחתיות לפיצה וילי פוד,ג.וילי-פוד אינטרנשיונל בעמ,יח`,,1,13.90,2.90
3272,גבינת שמנת טבעי 200 גר` EURO CHEESE,ג.וילי-פוד אינטרנשיונל בעמ,יח`,,1,12.90,6.45
3273,גבינת שמנת לייט טבעי 200 גר` EURO CHEESE,ג.וילי-פוד אינטרנשיונל בעמ,יח`,,1,12.90,6.45
3274,גבינת שמנת עשבי תיבול 200 גר` EURO CHEES,ג.וילי-פוד אינטרנשיונל בעמ,יח`,,1,12.90,6.45
3275,גבינת שמנת לייט עשבי תיבול 200 גר` EURO,ג.וילי-פוד אינטרנשיונל בעמ,יח`,,1,12.90,6.45
3276,גבינת שמנת שום 200 גר` EURO CHEESE,ג.וילי-פוד אינטרנשיונל בעמ,יח`,,1,12.90,6.45
3277,גבינת שמנת לייט שום 200 גר` EURO CHEESE,ג.וילי-פוד אינטרנשיונל בעמ,יח`,,1,12.90,6.45
3278,גבינת גאודה פרוסות 400 גר` וילי פוד,ג.וילי-פוד אינטרנשיונל בעמ,יח`,,1,19.90,4.98
3279,מלפפונים כבושים במלח 18-25 קטנים מאוד (8,ג.וילי-פוד אינטרנשיונל בעמ,יח`,,1,14.90,1.86
3280,פסטו בזיליקום 190 גר` וילי פוד,ג.וילי-פוד אינטרנשיונל בעמ,יח`,,1,9.90,5.21
3281,רוטב עגבניות עם זיתים וצלפים 400 גר` ויל,ג.וילי-פוד אינטרנשיונל בעמ,יח`,,1,9.90,2.48
3282,רוטב עגבניות עם פטריות פורצ`יני 400 גר`,ג.וילי-פוד אינטרנשיונל בעמ,יח`,,1,9.90,2.48
3283,רוטב עגבניות עם חצילים 400 גר`,ג.וילי-פוד אינטרנשיונל בעמ,יח`,,1,9.90,2.48
3284,רוטב עגבניות פיקנטי 400 גר` וילי פוד,ג.וילי-פוד אינטרנשיונל בעמ,יח`,,1,9.90,2.48
3285,מארז תפוחונים (3 יח +1 ),ג.וילי-פוד אינטרנשיונל בעמ,יח`,,1,12.90,12.90
3286,מדליוני גבינת עיזים 6 יח *20 גר` ( 120 ג,ג.וילי-פוד אינטרנשיונל בעמ,יח`,,1,14.90,12.42
3287,צנימים טעם טבעי 100 גר` melba toast,ג.וילי-פוד אינטרנשיונל בעמ,יח`,,1,7.90,7.90
3288,לזנה איטלקית 500 גר` (וילי פוד),ג.וילי-פוד אינטרנשיונל בעמ,יח`,,1,10.90,2.18
3289,צנימים עם שומשום 100 גר` melba toast,ג.וילי-פוד אינטרנשיונל בעמ,יח`,,1,7.90,7.90
3290,ממרח חמאה 250 גר` valio,ג.וילי-פוד אינטרנשיונל בעמ,יח`,,1,16.90,6.76
3291,ממרח חמאה 250 גר` לייט VALIO,ג.וילי-פוד אינטרנשיונל בעמ,יח`,,1,16.90,6.76
3292,פיצה מרגריטה 380 גר` וילי פוד,ג.וילי-פוד אינטרנשיונל בעמ,יח`,,1,13.90,3.66
3293,פיצה עם פטריות 390 גר` וילי פוד,ג.וילי-פוד אינטרנשיונל בעמ,יח`,,1,13.90,3.56
3294,פיצה עם זיתים 385 גר` וילי פוד,ג.וילי-פוד אינטרנשיונל בעמ,יח`,,1,13.90,3.61
3295,כדורי בייבי גבינת מוצרלה 200 גר` וילי פו,ג.וילי-פוד אינטרנשיונל בעמ,יח`,,1,19.90,9.95
3296,משקה יוגורט אפרסק 500 מל וילי פוד 0.1%,ג.וילי-פוד אינטרנשיונל בעמ,יח`,,1,9.90,9.90
3297,משקה יוגורט תות 500 מל וילי פוד 0.1%,ג.וילי-פוד אינטרנשיונל בעמ,יח`,,1,9.90,9.90
3298,משקה יוגורט תות ודודבן 500 מל וילי פוד,ג.וילי-פוד אינטרנשיונל בעמ,יח`,,1,9.90,9.90
3299,משקה יוגורט אוכמניות וסמבוק 500 מל וילי,ג.וילי-פוד אינטרנשיונל בעמ,יח`,,1,9.90,9.90
3300,גבינת שמנת עם זיתים 200 גר` EURO CHEESE,ג.וילי-פוד אינטרנשיונל בעמ,יח`,,1,12.90,6.45
3301,גבינת שמנת עם חלפיניו 200 גר` EURO CHEES,ג.וילי-פוד אינטרנשיונל בעמ,יח`,,1,12.90,6.45
3302,גבינת שמנת לייט עם זיתים 200 גר` EURO CH,ג.וילי-פוד אינטרנשיונל בעמ,יח`,,1,12.90,6.45
3303,גבינת שמנת לייט עם חלפיניו 200 גר` EURO,ג.וילי-פוד אינטרנשיונל בעמ,יח`,,1,12.90,6.45
3304,גבינת פטה 200 גר` טבעונית,ג.וילי-פוד אינטרנשיונל בעמ,יח`,,1,17.90,8.95
3305,גבינה טבעונית קוביות פטה במי מלח 200 גר,ג.וילי-פוד אינטרנשיונל בעמ,יח`,,1,17.90,8.95
3306,גבינה גוש מוצרלה 200 גר` טבעונית,ג.וילי-פוד אינטרנשיונל בעמ,יח`,,1,17.90,8.95
3307,גבינה פרוסות מוצרלה 200 גר` טבעונית,ג.וילי-פוד אינטרנשיונל בעמ,יח`,,1,17.90,8.95
3308,גבינה גוש גאודה 200 גר` טבעונית,ג.וילי-פוד אינטרנשיונל בעמ,יח`,,1,17.90,8.95
3309,גבינה פרוסות גאודה 200 גר` טבעונית,ג.וילי-פוד אינטרנשיונל בעמ,יח`,,1,17.90,8.95
3310,גבינה גוש גאודה מעושנת 200 גר` ולי פוד,ג.וילי-פוד אינטרנשיונל בעמ,יח`,,1,17.90,8.95
3311,גבינה גוש מוצרלה לפיצה 200 גר` טבעונית,ג.וילי-פוד אינטרנשיונל בעמ,יח`,,1,17.90,8.95
3312,גבינה גוש צ`דר כתום 200 גר`,ג.וילי-פוד אינטרנשיונל בעמ,יח`,,1,17.90,8.95
3313,מאפה יוני במילוי ירקות ירוקים 400 גר` וי,ג.וילי-פוד אינטרנשיונל בעמ,יח`,,1,19.90,4.98
3314,חומוסטחינה חלק צבר (400 גרם),קבוצת אסם סחר שות. מוגבלת,יח`,,1,13.90,3.48
3315,ביסלי חטיף בטעם סלסה פיקנטית 70 גר` אס,קבוצת אסם סחר שות. מוגבלת,יח`,,1,3.90,5.57
3316,חומוסיבוב עגבניות מיובשות ועשבי תיבול 40,קבוצת אסם סחר שות. מוגבלת,יח`,,1,13.90,3.48
3317,פודינג אינסטנט ורוד קיטי 80 גר` אסם,קבוצת אסם סחר שות. מוגבלת,יח`,,1,5.90,7.38
3318,פרפקטו ספגטי 500 גר עתיר בסיבים,קבוצת אסם סחר שות. מוגבלת,יח`,,1,6.90,1.38
3319,פסטה פארפאלה אסם פרפקטו (500 גרם),קבוצת אסם סחר שות. מוגבלת,יח`,,1,7.90,1.58
3320,פסטה פאפארדלה אסם פרפקטו (500 גרם),קבוצת אסם סחר שות. מוגבלת,יח`,,1,7.90,1.58
3321,פסטה ספירלי טריו אסם פרפקטו (500 גרם),קבוצת אסם סחר שות. מוגבלת,יח`,,1,6.90,1.38
3322,מנה חמה קוסקוס עם עדשים אסם (87 גרם),קבוצת אסם סחר שות. מוגבלת,יח`,,1,6.90,7.93
3323,סלט חזרת 180 גר` צבר,קבוצת אסם סחר שות. מוגבלת,יח`,,1,12.90,7.17
3324,חומוס עם המון טחינה וגרגרים 375 גר` צבר,קבוצת אסם סחר שות. מוגבלת,יח`,,1,12,3.20
3325,חציל פיקנטי מלך הסלטים 400 גר` צבר,קבוצת אסם סחר שות. מוגבלת,יח`,,1,15.90,3.98
3326,ביסקוויט פתי בר ללא גלוטן אסם (200 גרם),קבוצת אסם סחר שות. מוגבלת,יח`,,1,9.90,4.95
3327,פתי בר שוקו ללא גלוטן 200 גרם,קבוצת אסם סחר שות. מוגבלת,יח`,,1,9.90,4.95
3328,אטריות דקיקות פלוס 330גר אסם,קבוצת אסם סחר שות. מוגבלת,יח`,,1,7.90,2.39
3329,פסטה מסולסלים פלוס 400 גר אסם,קבוצת אסם סחר שות. מוגבלת,יח`,,1,5.90,1.48
3330,ספגטי פלוס 400 גר אסם,קבוצת אסם סחר שות. מוגבלת,יח`,,1,5.90,1.48
3331,קראנץ` רולס 450 גר דגני בוקר,קבוצת אסם סחר שות. מוגבלת,יח`,,1,26.90,5.98
3332,בירה מולר 500 מל,בני פאוזי שמשום (2009) בעמ,יח`,,1,3.90,0.72
3333,פחית פאנטה תות 330 מל סילק,החברה המרכזית להפצת משקאות בעמ,יח`,,1,4.50,1.27
3334,פריגת צלול בטעם ענבים 1.5 ליטר,החברה המרכזית להפצת משקאות בעמ,יח`,,1,7.20,0.48
3335,פריגת צלול בטעם תפוחים 1.5 ליטר,החברה המרכזית להפצת משקאות בעמ,יח`,,1,7.20,0.48
3336,פריגת צלול בטעם אפרסק 1.5 ליטר,החברה המרכזית להפצת משקאות בעמ,יח`,,1,7.20,0.48
3337,פריגת צלול בטעם אננס 1.5 ליטר,החברה המרכזית להפצת משקאות בעמ,יח`,,1,7.20,0.48
3338,פחית קוקה קוה סליק זירו לימון 330 מל,החברה המרכזית להפצת משקאות בעמ,יח`,,1,4.50,1.27
3339,פחית ספרייט ליים 330 מל סליק,החברה המרכזית להפצת משקאות בעמ,יח`,,1,4.50,1.27
3340,מארז ספרייט 6 פחיות FRIDGE PACK,החברה המרכזית להפצת משקאות בעמ,יח`,,1,19.90,19.90
3341,פריגת צלול בטעם לימוענע 1.5 ליטר,החברה המרכזית להפצת משקאות בעמ,יח`,,1,7.20,0.48
3342,פאנטה שישית פחיות פרידג`פק,החברה המרכזית להפצת משקאות בעמ,יח`,,1,19.90,9.14
3343,פריגת צלול בטעם תפוזים 1.5 ליטר,החברה המרכזית להפצת משקאות בעמ,יח`,,1,7.20,0.48
3344,פריגת צלול בטעם אשכוליות 1.5 ליטר,החברה המרכזית להפצת משקאות בעמ,יח`,,1,7.20,0.48
3345,משקה יופלה בטעם תות שמינייה תנובה,תנובה - חלב,יח`,,1,17.50,1944.44
3346,משקה יופלה בטעם קלאסי שמינייה תנובה,תנובה - חלב,יח`,,1,17.50,1944.44
3347,GO יופלה 200 מל תנובה,תנובה - חלב,יח`,,1,5.30,2.65
3348,GO יופלה במתיקות מעודנת 200,תנובה - חלב,יח`,,1,5.30,2.65
3349,יולו שוקולד לבן בטעם קרם פטיסייר ופטל 12,תנובה - חלב,יח`,,1,4.50,3.69
3350,מעדן יולו שכבות שוקולד לבן וחלב בטעם קרמ,תנובה - חלב,יח`,,1,4.50,3.69
3351,יופלה דיאט קוקוס 150 מל תנובה,תנובה - חלב,יח`,,1,4.90,3.27
3352,יופלה תות GO 200 מל,תנובה - חלב,יח`,,1,5.60,2.80
3353,יופלה אפרסק GO 200 מל,תנובה - חלב,יח`,,1,5.60,2.80
3354,יופלה פירות יער 200 מל GO תנובה,תנובה - חלב,יח`,,1,5.60,2.80
3355,יופלה משקה יוגורט מועשר בחלבון עם בננה ו,תנובה - חלב,יח`,,1,6.10,6.10
3356,יופלה משקה יוגורט מועשר בחלבון עם תות ופ,תנובה - חלב,יח`,,1,6.10,6.10
3357,יופלה בטעם אננס 200 גר` GO,תנובה - חלב,יח`,,1,5.60,2.80
3358,יוגורט GO בתוספת גרנולה מעושרת בחלבון ע,תנובה - חלב,יח`,,1,5.90,3.47
3359,יוגורט GO בתוספת גרנולה מעושרת בחלבון ע,תנובה - חלב,יח`,,1,5.90,3.47
3360,יוגורט GO עם דובדבן מופחת קולריות 200 ג,תנובה - חלב,יח`,,1,5.50,2.75
3361,יוגורט GO עם אפרסק מופחת קלוריות 200 גר,תנובה - חלב,יח`,,1,5.50,2.75
3362,יוגורט GO עם פירות יער מופחת קולריות 20,תנובה - חלב,יח`,,1,5.50,2.75
3363,משקה קוקוס שקדים 1 ליטר תנובה,תנובה - חלב,יח`,,1,11.90,1.19
3364,יולו שוקולד חלב עם קצפת 42% מוצקי קקאו(1,תנובה - חלב,יח`,,1,3.70,3.08
3365,יולו שוקולד עם קצפת 36% מוצקי קקאו 120 ג,תנובה - חלב,יח`,,1,3.70,3.08
3366,משקה חלב עם קפה 340 גר` 27 גר` חלבון go,תנובה - חלב,יח`,,1,7.90,2.32
3367,יופלה לייט בטעם אננס 200 גר` GO,תנובה - חלב,יח`,,1,5.60,2.80
3368,משקה יופלה יוגורט פירות טרופיים 250 מל,תנובה - חלב,יח`,,1,6.10,6.10
3369,יופלה און טופ ( 157 גר` ) party,תנובה - חלב,יח`,,1,4.90,3.12
3370,יופלה און טופ ( 157 גר` ) SUMMER,תנובה - חלב,יח`,,1,4.90,3.12
3371,יופלה און טופ ( 157 גר` ) BLACK WHITE,תנובה - חלב,יח`,,1,4.90,3.12
3372,משקה חלב בטעם וניל 340 גר` 27 גר` חלבון,תנובה - חלב,יח`,,1,7.90,2.32
3373,משקה יוגורט גו לייט תות בננה 250 מל,תנובה - חלב,יח`,,1,6.10,6.10
3374,משקה יוגורט גו לייט מנגו אננס 250 מל,תנובה - חלב,יח`,,1,6.10,6.10
3375,משקה שיבולת שועל 1 ליטר תנובה,תנובה - חלב,יח`,,1,11.90,1.19
3376,יופלה 200 גר` GO קינמון,תנובה - חלב,יח`,,1,5.60,2.80
3377,יופלה GO טבעי 0.7% שומן ( 150 גר`) תנוב,תנובה - חלב,יח`,,1,4.90,3.27
3378,יופלה GO לייט עם תות 150 גר תנובה,תנובה - חלב,יח`,,1,4.90,3.27
3379,יופלה GO לייט עם קוקוס 150 גר תנובה,תנובה - חלב,יח`,,1,4.90,3.27
3380,משקה תנובה GO אייס קפה 250 מל,תנובה - חלב,יח`,,1,5.90,2.36
3381,יופלה און טופ פצפוצים 157 גר`,תנובה - חלב,יח`,,1,4.90,3.12
3382,יופלה און טופ קורנפלקס 157 גר`,תנובה - חלב,יח`,,1,4.90,3.12
3383,יופלה און טופ גרנולה 157 גר` תנובה,תנובה - חלב,יח`,,1,4.90,3.12
3384,פריכיות הטעימות עשיר חלבון אנרג`י,שטראוס גרופ בעמ,יח`,,1,12.90,9.56
3385,ספלנדיד צריר אגוזי לוז חמוציות 105 גר` ע,שטראוס גרופ בעמ,יח`,,1,13.90,13.24
3386,ספלנדיד חלב אגוזי לוז קוקוס קלוי 105 גר`,שטראוס גרופ בעמ,יח`,,1,13.90,13.24
3387,דנונה מ.מעודנת ללא סוכר 150 גרם,שטראוס גרופ בעמ/מצונן,יח`,,1,3.70,2.47
3388,רבע לשבע מריר 60% עלית 120 גר`,שטראוס גרופ בעמ,יח`,,1,12.90,10.75
3389,קפסולות קפה עלית קולומביה 08,שטראוס גרופ בעמ,יח`,,1,16.90,33.80
3390,צנצנת בוקסי מנטה אקליפטוס 64 גר` עלית,שטראוס גרופ בעמ,יח`,,1,9.90,15.47
3391,צנצנת בוקסי מנטה פטל 64 גר` עלית,שטראוס גרופ בעמ,יח`,,1,9.90,15.47
3392,חטיף מקופלת בלונדי עלית (25 גרם),שטראוס גרופ בעמ,יח`,,1,3.90,15.60
3393,קונפיטורת תות במתיקות מעודנת 265 גר` יד,שטראוס גרופ בעמ,יח`,,1,14.90,5.62
3394,קונפיטורת משמש במתיקות מעודנת 265 גר` יד,שטראוס גרופ בעמ,יח`,,1,14.90,5.62
3395,קונפיטורת פירות יער במתיקות מעודנת 265 ג,שטראוס גרופ בעמ,יח`,,1,14.90,5.62
3396,מגבונים להסרת לק (10 יח) ICARE,שקד תבל בעמ,יח`,,1,7.90,7.90
3397,דר עור תחליב רחצה קלאסי 700 מל-קוקוס,שקד תבל בעמ,יח`,,1,19.90,2.84
3398,מגבונים להסרת איפור ( 25 יח ) ICARE,שקד תבל בעמ,יח`,,1,7.90,7.90
3399,מגבונים לניקוי משקפיים ( 24 יח) ICARE,שקד תבל בעמ,יח`,,1,7.90,7.90
3400,ניקול מטליות לחות לשיש ניחוח מרכך כביסה,קימברלי קלארק ישראל שיווק בעמ,יח`,,1,11.90,11.90
3401,ניקול מטליות לחות לריצפה ניחוח מרכך כביס,קימברלי קלארק ישראל שיווק בעמ,יח`,,1,13.90,13.90
3402,ניקול רדיד אלומיניום חסכוני 60 מטר עם סכ,קימברלי קלארק ישראל שיווק בעמ,יח`,,1,44.90,44.90
3403,מפיות אירוח איכותיות ונעימות למגע ניקול,קימברלי קלארק ישראל שיווק בעמ,יח`,,1,8.90,8.90
3404,תחבושות קוטקס אקטיב נורמל דואו ( 24 יח),קימברלי קלארק ישראל שיווק בעמ,יח`,,1,14.90,14.90
3405,תחבושות קוטקס אקטיב סופר דאו ( 18 יח),קימברלי קלארק ישראל שיווק בעמ,יח`,,1,14.90,14.90
3406,כריות יפניות אנטיבקטריאליות ניקול,קימברלי קלארק ישראל שיווק בעמ,יח`,,1,12.90,12.90
3407,מטליות לחות אנטיבקטריאלי,קימברלי קלארק ישראל שיווק בעמ,יח`,,1,12.90,12.90
3408,מטליות מייקרופייבר למשטחים אנטיבקטריאלי,קימברלי קלארק ישראל שיווק בעמ,יח`,,1,14.90,14.90
3409,מפיות אירוח איכותיות צבעוני - ניקול,קימברלי קלארק ישראל שיווק בעמ,יח`,,1,8.90,8.90
3410,מגן תחתון ג`גיה נורמל קוטקס (76 ),קימברלי קלארק ישראל שיווק בעמ,יח`,,1,19.90,19.90
3411,מגן תחתון לארג` ג`גיה קוטקס (64 ),קימברלי קלארק ישראל שיווק בעמ,יח`,,1,19.90,19.90
3412,מגן תחתון יאנג ג`יגה קוטקס (76),קימברלי קלארק ישראל שיווק בעמ,יח`,,1,19.90,19.90
3413,תערובת אגוזים ואננס 150 גר` קליית גת,ליימן שליסל בעמ,יח`,,1,19.90,13.27
3414,תערובת אגוזים קלויים ללא מלח 150 גר` קלי,ליימן שליסל בעמ,יח`,,1,19.90,13.27
3415,מנה חמה קוסקוס עגבניות פיקנטי,קבוצת אסם סחר שות. מוגבלת,יח`,,1,6.90,7.93
3416,חומוס צבר סמיר הגדול מוגדל 600 גר`,קבוצת אסם סחר שות. מוגבלת,יח`,,1,13.90,2.32
3417,סלט חציל פיקנטי מרובע 400 גר` צבר,קבוצת אסם סחר שות. מוגבלת,יח`,,1,11.90,2.98
3418,סלט טורקי מרובע 400 גר` צבר,קבוצת אסם סחר שות. מוגבלת,יח`,,1,11.90,2.98
3419,חומוס עם המון מטבוחה 375 גר` צבר,קבוצת אסם סחר שות. מוגבלת,יח`,,1,12,3.20
3420,חומוס עם המון פלפלים חריפים 375 גר` צבר,קבוצת אסם סחר שות. מוגבלת,יח`,,1,12,3.20
3421,סלט מטבוחה חריפה מרובע 400 גר` צבר,קבוצת אסם סחר שות. מוגבלת,יח`,,1,10.90,2.73
3422,פסטה ספירלי מהדורה מיוחדת 20% אסם (600 ג,קבוצת אסם סחר שות. מוגבלת,יח`,,1,5.90,1.18
3423,ספגטי מהדורה מיוחדת ( 600 גר` ) אסם,קבוצת אסם סחר שות. מוגבלת,יח`,,1,5.90,0.98
3424,פסטה צינורות פלוס 400 גר` אסם,קבוצת אסם סחר שות. מוגבלת,יח`,,1,5.90,1.48
3425,פיטנס פריכיות 3 דגנים דקות 120 גר` אסם,קבוצת אסם סחר שות. מוגבלת,יח`,,1,11.90,9.92
3426,פיטנס פריכיות דקות עם קינואה 120 גר` אסם,קבוצת אסם סחר שות. מוגבלת,יח`,,1,11.90,9.92
3427,המבורגר מן הצומח 630 גר` טבעול,קבוצת אסם סחר שות. מוגבלת,יח`,,1,32.90,5.22
3428,כדורי בשר מן הצומח 500 גר` טבעול,קבוצת אסם סחר שות. מוגבלת,יח`,,1,32.90,6.58
3429,ביסלי מעושן 70 גר` אסם,קבוצת אסם סחר שות. מוגבלת,יח`,,1,3.90,5.57
3430,ביסלי ספייסי צ`לי 70 גר` אסם,קבוצת אסם סחר שות. מוגבלת,יח`,,1,3.90,5.57
3431,קציצות כרובית אדממה וטחינה 525 גר` טבעול,קבוצת אסם סחר שות. מוגבלת,יח`,,1,32.90,6.27
3432,קציצות דלורית אדממה קנואה אדומה 525 גר`,קבוצת אסם סחר שות. מוגבלת,יח`,,1,32.90,6.27
3433,פסטה פרפקטו קנלוני 500 גר` אסם,קבוצת אסם סחר שות. מוגבלת,יח`,,1,10.90,2.18
3434,פנה פלוס 50% יותר חלבון 400 גר` אסם,קבוצת אסם סחר שות. מוגבלת,יח`,,1,5.90,1.48
3435,ספגטי פלוס 50% יותר חלבון 400 גר` אסם,קבוצת אסם סחר שות. מוגבלת,יח`,,1,5.90,1.48
3436,במבה ביסלי מיקס 80 גר` אסם,קבוצת אסם סחר שות. מוגבלת,יח`,,1,4.30,5.38
3437,פלאפל מרכיבים ביתיים בלבד 590 גר` טבעול,קבוצת אסם סחר שות. מוגבלת,יח`,,1,32.90,5.58
3438,שניצל ברוקולי 667 גר` טבעול,קבוצת אסם סחר שות. מוגבלת,יח`,,1,32.90,4.93
3439,שניצל דק בטעם צ`לי חריף 564 גר` טבעול,קבוצת אסם סחר שות. מוגבלת,יח`,,1,32.90,5.83
3440,חטיפי תירס 657 גר` טבעול,קבוצת אסם סחר שות. מוגבלת,יח`,,1,29.90,4.55
3441,שווארמה צמחונית 500 גר` טבעול,קבוצת אסם סחר שות. מוגבלת,יח`,,1,32.90,6.58
3442,שניצל דק מן הצומח 564 גר` טבעול,קבוצת אסם סחר שות. מוגבלת,יח`,,1,32.90,5.83
3443,נקניקיות טינר צמחוניות 680 גר` טבעול,קבוצת אסם סחר שות. מוגבלת,יח`,,1,32.90,4.84
3444,טחון מן הצומח טבעול (500גרם),קבוצת אסם סחר שות. מוגבלת,יח`,,1,32.90,6.58
3445,קציצות קינואה ובורוקלי 525 גר` טבעול,קבוצת אסם סחר שות. מוגבלת,יח`,,1,32.90,6.27
3446,חזה בגריל צמחוני 99 קלוריות 560 גר` טבע,קבוצת אסם סחר שות. מוגבלת,יח`,,1,32.90,5.88
3447,שניצל ברוקולי 99 קלוריות 560 גר` טבעול,קבוצת אסם סחר שות. מוגבלת,יח`,,1,32.90,5.88
3448,שניצל צמחוני 99 קלוריות 650 גר` טבעול,קבוצת אסם סחר שות. מוגבלת,יח`,,1,32.90,5.06
3449,קציצות עדשים כתומות 530 גר` טבעול,קבוצת אסם סחר שות. מוגבלת,יח`,,1,32.90,6.21
3450,שניצל תרד 99 קלוריות 560 גר` טבעול,קבוצת אסם סחר שות. מוגבלת,יח`,,1,32.90,5.88
