,ItemName,ManufactureName,UnitQty,Quantity,QtyInPackage,ItemPrice,UnitOfMeasurePrice
2101,יין פרימייר אדום -קברנה סובניון ומלבק,טמפו משקאות בעמ,יח`,,1,24.90,3.28
2102,פרמייר אמרלד ריזלינג יקבי ברקן (750 מל),טמפו משקאות בעמ,יח`,,1,24.90,3.28
2103,לה פסטה ספגטי 5 400 גר`,תומר יבוא ושיווק מוצרי מזון (1,יח`,,1,2.50,0.63
2104,חתיכות אננס בסירופ קל תומר (113x4 גרם),תומר יבוא ושיווק מוצרי מזון (1,יח`,,1,9.90,2.19
2105,אפרסק פירות בכוסות רביעיה,תומר יבוא ושיווק מוצרי מזון (1,יח`,,1,9.90,2.19
2106,קוקטייל פירות בסירופ קל תומר (113x4 גרם),תומר יבוא ושיווק מוצרי מזון (1,יח`,,1,9.90,2.19
2107,יוגורט עיזים בטעם טיבעי 150 גר` חלב האר,שטראוס גרופ בעמ/מצונן,יח`,,1,5.90,3.93
2108,פרש וואנס מגבונים רביעיה,דנשר (1963) בעמ,יח`,,1,19.90,19.90
2109,קוטל מעופפים רייד (300 מל),דנשר (1963) בעמ,יח`,,1,17.90,5.97
2110,מואי שכבות ביסקוויט ושוקולד MOOI,דנשר (1963) בעמ,יח`,,1,17.90,9.94
2111,מואי שכבות ביסקוויט ושוקולד MOOI,דנשר (1963) בעמ,יח`,,1,17.90,9.94
2112,אל סבון נוזלי יסמין ולבנדר כיף (1 ליטר),החברה הדרומית לשיווק בעמ,יח`,,1,13.90,1.39
2113,אנטי קאלק מגבונים לניקוי כללי,החברה הדרומית לשיווק בעמ,יח`,,1,10.90,10.90
2114,סנו מקסימה מרכך 1 ליטר ורוד פסים,החברה הדרומית לשיווק בעמ,יח`,,1,17.90,1.79
2115,סנו פרש מטליות לחות לרצפה ריצפז (10),החברה הדרומית לשיווק בעמ,יח`,,1,11.90,11.90
2116,מטליות לחות לריצפה סנו סושי (10),החברה הדרומית לשיווק בעמ,יח`,,1,9.90,9.90
2117,ריצפז פרש 2 ליטר,החברה הדרומית לשיווק בעמ,יח`,,1,21.90,0.01
2118,רסס ונגב - מילוי סנו (750 מל),החברה הדרומית לשיווק בעמ,יח`,,1,11.90,1.59
2119,מחית תפוחי עץ שלב 3 בילובד (190 גרם),שקד תבל בעמ,יח`,,1,5.90,3.11
2120,מחית תפוחי עץ ואפרסק 190גר,שקד תבל בעמ,יח`,,1,5.90,3.11
2121,מחית סלט פירות שלב 3 בילובד (190 גרם),שקד תבל בעמ,יח`,,1,5.90,3.11
2122,קרם קוקוס טעמי אסיה (400 מל),טעמי אסיה בעמ,יח`,,1,9.90,2.48
2123,בירה בהירה בירה מלכה (330 מל),הכרם - משקאות חריפים בעמ,יח`,,1,13.90,4.12
2124,בירה אדמונית בירה מלכה (330 מל),הכרם - משקאות חריפים בעמ,יח`,,1,13.90,4.12
2125,בירה מלכה חיטה 330 מל,הכרם - משקאות חריפים בעמ,יח`,,1,13.90,4.12
2126,הלבנה עדינה סנסודיין (75 מל),גורי ע.ע.ע בעמ,יח`,,1,20,26.67
2127,משחת שיניים בטעם מנטה סנסודיין (75 מל),גורי ע.ע.ע בעמ,יח`,,1,20,26.67
2128,אקווה פרש מי פה 500 מל,גורי ע.ע.ע בעמ,יח`,,1,19.90,3.98
2129,משקה קל תפוחים ג`אמפ (1.5 ליטר),טמפו משקאות בעמ,יח`,,1,5.50,0.37
2130,מטרנה אקסטרא קייר 700 גר` שלב 1,קבוצת אסם סחר שות. מוגבלת,יח`,,1,59.90,8.56
2131,מטרנה אקסטרא קייר 700 גר` שלב 2,קבוצת אסם סחר שות. מוגבלת,יח`,,1,59.90,8.56
2132,מטרנה אקסטרא קייר 700 גר` שלב3,קבוצת אסם סחר שות. מוגבלת,יח`,,1,59.90,8.56
2133,בורקס פילו גבינה מעדנות,תנובה קפואים,יח`,,1,21.90,3.65
2134,בורקס פילו תפוא מעדנות,תנובה קפואים,יח`,,1,21.90,3.65
2135,בורקס פילו פיצה מעדנות,תנובה קפואים,יח`,,1,21.90,3.65
2136,בורקס פילו בולגרית מעדנות,תנובה קפואים,יח`,,1,21.90,3.65
2137,בצק פריך מתוק 900 גר` מעדנות,תנובה קפואים,יח`,,1,24,2.67
2138,בצק פריך מלוח 900 גר` מעדנות,תנובה קפואים,יח`,,1,24,2.67
2139,בצק שמרים מתוק מעדנות,תנובה קפואים,יח`,,1,22.90,2.54
2140,תערובת עוגת שוקולד 560 גר`,מימונס אפיה בעמ,יח`,,1,17.90,3.20
2141,תערובת בראוניס 600 גר`,מימונס אפיה בעמ,יח`,,1,15.90,2.65
2142,תערובת כדורי שוקולד 500 גר`,מימונס אפיה בעמ,יח`,,1,17.90,3.58
2143,תערובת להכנת פנקייק מימונס (400 גרם),מימונס אפיה בעמ,יח`,,1,15.90,3.98
2144,תערובת עוגת וניל מימונס (560 גרם),מימונס אפיה בעמ,יח`,,1,15.90,2.84
2145,תערובת עוגת שיש 560 גר`,מימונס אפיה בעמ,יח`,,1,15.90,2.84
2146,פודינג בטעם וניל 85 גר` מימונס,מימונס אפיה בעמ,יח`,,1,5.90,6.94
2147,פודינג בטעם שוקולד 95 גר` מימונס,מימונס אפיה בעמ,יח`,,1,5.90,6.21
2148,ג`לי בטעם תות 85 גר` מימונס,מימונס אפיה בעמ,יח`,,1,5.90,6.94
2149,גלילית וופל למילוי ג`וני,מימונס אפיה בעמ,יח`,,1,22.90,5.73
2150,סירופ מייפל אמיתי מימונס (236 מל),מימונס אפיה בעמ,יח`,,1,38.90,16.48
2151,אגוז מלך קלוף מימונס (100 גרם),מימונס אפיה בעמ,יח`,,1,11.90,11.90
2152,אגוז מלך טחון מימונס (100 גרם),מימונס אפיה בעמ,יח`,,1,11.90,11.90
2153,100%סירופ מייפל אמיתי 187 מל,מימונס אפיה בעמ,יח`,,1,29.90,15.99
2154,עלים לקרמשניט 300 גר,מימונס אפיה בעמ,יח`,,1,15.90,5.30
2155,ג`ל טעם לימון 95 גר מימונס,מימונס אפיה בעמ,יח`,,1,5.90,6.21
2156,פודינג בטעם וניל לבן 80 גר` מימונס,מימונס אפיה בעמ,יח`,,1,5.90,7.38
2157,פודינג בטעם שוקולד 80 גר` מימונס,מימונס אפיה בעמ,יח`,,1,5.90,7.38
2158,מלית פרג 400 גר`,מימונס אפיה בעמ,יח`,,1,19.90,4.98
2159,מלית אוכמניות 70% פרי 400 גר`,מימונס אפיה בעמ,יח`,,1,19.90,4.98
2160,מלית תפוח עץ 70% פרי 400 גר`.,מימונס אפיה בעמ,יח`,,1,19.90,4.98
2161,מלית דובדבנים 70% פרי 400 גר`,מימונס אפיה בעמ,יח`,,1,19.90,4.98
2162,מלית תות שדה 400 גר`,מימונס אפיה בעמ,יח`,,1,19.90,4.98
2163,מלית שוקולד,מימונס אפיה בעמ,יח`,,1,11.90,2.98
2164,ממרח קרם נוגט,מימונס אפיה בעמ,יח`,,1,15.90,4.54
2165,מארז 8 יח תחתיות מרנג 10 גר` מימונס,מימונס אפיה בעמ,יח`,,1,18.90,18.90
2166,תחתיות בצק פריך לאפייה ומילוי -טארטלטים,מימונס אפיה בעמ,יח`,,1,18.90,18.90
2167,סירופ בטעם קרמל מלוח 500 גר` מימונס,מימונס אפיה בעמ,יח`,,1,17.90,3.58
2168,כוכבים תכלת ירוק לבן לקישוט 60 גר` מימונ,מימונס אפיה בעמ,יח`,,1,10.90,18.17
2169,אטריות צבעוניות לקישוט 55 גר` מימונס,מימונס אפיה בעמ,יח`,,1,10.90,19.82
2170,סוכריות לב סגול לבן לקישוט 60 מימונס,מימונס אפיה בעמ,יח`,,1,10.90,18.17
2171,מיקס טרופי א.מ שרון (500 גרם),א.מ. שרון שיווק (2014) בעמ,יח`,,1,24.90,4.98
2172,דובדבן קפוא א.מ שרון (500 גרם),א.מ. שרון שיווק (2014) בעמ,יח`,,1,19.90,3.98
2173,פטל אדום א.מ שרון (500 גרם),א.מ. שרון שיווק (2014) בעמ,יח`,,1,24.90,4.98
2174,דומדמנית שחורה א.מ שרון (500 גרם),א.מ. שרון שיווק (2014) בעמ,יח`,,1,24.90,4.98
2175,מיקס פירות שדה א.מ שרון (500 גרם),א.מ. שרון שיווק (2014) בעמ,יח`,,1,24.90,4.98
2176,פטל שחור א.מ שרון (500 גרם),א.מ. שרון שיווק (2014) בעמ,יח`,,1,24.90,4.98
2177,חמוצית גן א.מ שרון (400 גרם),א.מ. שרון שיווק (2014) בעמ,יח`,,1,24.90,6.23
2178,דומדמנית אדומה 500 גרם,א.מ. שרון שיווק (2014) בעמ,יח`,,1,24.90,4.98
2179,מיקס פירות יער א.מ שרון (500 גרם),א.מ. שרון שיווק (2014) בעמ,יח`,,1,24.90,4.98
2180,תות שדה א.מ שרון (500 גרם),א.מ. שרון שיווק (2014) בעמ,יח`,,1,24.90,4.98
2181,אוכמנית א.מ שרון (400 גרם),א.מ. שרון שיווק (2014) בעמ,יח`,,1,24.90,6.23
2182,אננס קפוא 500 גר`,א.מ. שרון שיווק (2014) בעמ,יח`,,1,24.90,4.98
2183,מנגו קפוא 500 גר`,א.מ. שרון שיווק (2014) בעמ,יח`,,1,24.90,4.98
2184,מלון קפוא 500 גר`,א.מ. שרון שיווק (2014) בעמ,יח`,,1,24.90,4.98
2185,שטראוס קרמיסימו,גלידות שטראוס בעמ,יח`,,1,18.90,14.21
2186,מאגדת מיני סולרו פירות טרופי,גלידות שטראוס בעמ,יח`,,1,21.90,4.56
2187,סנו מקסימה מרכך 1 ליטר כחול פסים,החברה הדרומית לשיווק בעמ,יח`,,1,17.90,1.79
2188,סנו מקסימה מרכך 1 ליטר סגול,החברה הדרומית לשיווק בעמ,יח`,,1,17.90,1.79
2189,ריצפז פרש 2 ליטר מאסק,החברה הדרומית לשיווק בעמ,יח`,,1,21.90,10.95
2190,אוקסיג`ן ג`ל 3 ליטר,החברה הדרומית לשיווק בעמ,יח`,,1,29.90,9.97
2191,מקסימה ג`ל כביסה 3 ליטר,החברה הדרומית לשיווק בעמ,יח`,,1,29.60,9.87
2192,סנובון שלישיה מאסק,החברה הדרומית לשיווק בעמ,יח`,,1,11.90,6.10
2193,מקסימה מרכך סופר מרוכז ביו סנו (1 ליטר),החברה הדרומית לשיווק בעמ,יח`,,1,17.90,1.79
2194,מטליות לחות למוצרי עור סנו (20),החברה הדרומית לשיווק בעמ,יח`,,1,19.90,19.90
2195,מקסימה ג`ל כביסה 3 ליטר,החברה הדרומית לשיווק בעמ,יח`,,1,29.60,9.87
2196,מקסימה ג`ל כביסה 3 ליטר,החברה הדרומית לשיווק בעמ,יח`,,1,29.60,0.01
2197,ריצפז פרש מטליות חד פעמיות 10 יח`,החברה הדרומית לשיווק בעמ,יח`,,1,12.90,12.90
2198,ריצפז 3 ליטר פנטזיה,החברה הדרומית לשיווק בעמ,יח`,,1,17.90,5.97
2199,סנובון ג`ל בניחוח לימון,החברה הדרומית לשיווק בעמ,יח`,,1,12.90,19.85
2200,סנובון ג`ל בניחוח אוקיינוס,החברה הדרומית לשיווק בעמ,יח`,,1,12.90,19.85
2201,אורביטול מברשת שיניים פיות,החברה הדרומית לשיווק בעמ,יח`,,1,12.90,12.90
2202,מפות שולחן 120*180 סמ סנו (2),החברה הדרומית לשיווק בעמ,יח`,,1,9.90,9.90
2203,קוטל חרקים קיי 333 סנו (750 מל),החברה הדרומית לשיווק בעמ,יח`,,1,36.90,4.92
2204,קוטל מעופפים קיי פירטרום סנו (400 מל),החברה הדרומית לשיווק בעמ,יח`,,1,24.90,6.23
2205,בירה נגב אואזיס 330 מל,הכרם - משקאות חריפים בעמ,יח`,,1,13.90,4.12
2206,בירה נגב אמבר אייל 330 מל,הכרם - משקאות חריפים בעמ,יח`,,1,13.90,4.12
2207,פירורי לחם מוזהבים מאסטר שף (320גרם),ש.שסטוביץ בעמ,יח`,,1,7.90,2.47
2208,פירורי לחם פנקו מוזהבים 300 גר` מנה מאסט,ש.שסטוביץ בעמ,יח`,,1,9.90,3.30
2209,פירורי לחם פנקו מוזהבים שום 300 גר` מנה,ש.שסטוביץ בעמ,יח`,,1,9.90,3.30
2210,רוטב טריאקי מאסטר שף (300 מל),ש.שסטוביץ בעמ,יח`,,1,11.90,3.97
2211,רוטב צ`ילי מתוק מאסטר שף (700 מל),ש.שסטוביץ בעמ,יח`,,1,12.90,1.84
2212,רוטב צ`ילי חריף מאסטר שף (700 מל),ש.שסטוביץ בעמ,יח`,,1,12.90,1.84
2213,חצאי אפרסקים 820 גר` מהדרין,ג.וילי-פוד אינטרנשיונל בעמ,יח`,,1,7.90,0.96
2214,סירופ 1 ליטר דיאט לימונענע,זנלכל בעמ,יח`,,1,7.90,0.79
2215,פחית דיאט ספרייט 330 מל,החברה המרכזית להפצת משקאות בעמ,יח`,,1,4.50,1.27
2216,משקה קל לימונענע פריגת (1.5 ליטר),החברה המרכזית להפצת משקאות בעמ,יח`,,1,7.20,0.48
2217,ספרייט זירו 330 מל סילק,החברה המרכזית להפצת משקאות בעמ,יח`,,1,4.50,1.27
2218,מארז מיוחד בירה קרלסברג (330x6 מל),החברה המרכזית להפצת משקאות בעמ,יח`,,1,36.90,1.77
2219,מארז סודה קינלי 1.5 ליטר שישייה,החברה המרכזית להפצת משקאות בעמ,יח`,,1,19.90,0.22
2220,מארז ספרייט 6 פחיות FRIDGE PACK,החברה המרכזית להפצת משקאות בעמ,יח`,,1,19.90,19.90
2221,ויסוצקי ice נענע 1.5 ליטר,החברה המרכזית להפצת משקאות בעמ,יח`,,1,7.90,5.27
2222,ויסוצקי ice לימונית לואיזה 1.5 ליטר,החברה המרכזית להפצת משקאות בעמ,יח`,,1,7.90,5.27
2223,ויסוצקי ice היביסקוס פ.אדומים 1.5 ליטר,החברה המרכזית להפצת משקאות בעמ,יח`,,1,7.90,5.27
2224,ויסוצקי ice ארל גריי 1.5 ליטר,החברה המרכזית להפצת משקאות בעמ,יח`,,1,7.90,5.27
2225,מיץ רימונים סחוט פרימור (1 ליטר),שטראוס גרופ בעמ/מצונן,יח`,,1,23.20,23.20
2226,מיץ תפוזים אורגני 750 מל פרימור 100%,שטראוס גרופ בעמ/מצונן,יח`,,1,14.90,14.90
2227,מיץ אשכולית אדומה אורגני 750 מל,שטראוס גרופ בעמ/מצונן,יח`,,1,14.90,14.90
2228,שניצל אותיות מאמא עוף (700 גרם),תנובה קפואים,יח`,,1,34.90,4.99
2229,שניצל כלי תחבורה מאמא עוף (700 גרם),תנובה קפואים,יח`,,1,34.90,4.99
2230,פסטה א-לה רומר להקפצה 450 גר` מאמא עוף,תנובה קפואים,יח`,,1,19.90,4.42
2231,חגיגה אסייתית להקפצה 450 גר` מאמא עוף,תנובה קפואים,יח`,,1,19.90,4.42
2232,ירוק גלילי להקפצה 450 גר` מאמא עוף,תנובה קפואים,יח`,,1,19.90,4.42
2233,אבקת שוקו 500 גר`,מיה תעשיות מזון מ.ת.מ. בעמ,יח`,,1,6.90,1.38
2234,מים בטעם פירות יער שוופס (1.5 ליטר),יפאורה,יח`,,1,6.30,0.42
2235,מים בטעם אפרסק שוופס (1.5 ליטר),יפאורה,יח`,,1,6.30,0.42
2236,שוופס ווטר אפרסק 500מל,יפאורה,יח`,,1,4.80,0.90
2237,מים בטעם ענבים שוופס (1.5 ליטר),יפאורה,יח`,,1,6.30,0.42
2238,שוופס ווטר ענבים 500מל,יפאורה,יח`,,1,4.80,0.90
2239,מים בטעם תפוח שוופס (1.5 ליטר),יפאורה,יח`,,1,6.30,0.42
2240,שוופס ווטר תפוח 500מל,יפאורה,יח`,,1,4.80,0.90
2241,משקה מוגז לימונייד שוופס (1.5 ליטר),יפאורה,יח`,,1,6.90,0.46
2242,משקה מוגז לימונדה ורודה שוופס (1.5 ליטר),יפאורה,יח`,,1,6.90,0.46
2243,משקה מוגז למון ליים שוופס (1.5 ליטר),יפאורה,יח`,,1,6.90,0.46
2244,שוופס דיאט למון ליים 1.5 ל`,יפאורה,יח`,,1,6.90,0.46
2245,שוופס מוגז עדין 1.5 ליטר אננס,יפאורה,יח`,,1,6.90,0.46
2246,שישיית שוופס למון ליים 1.5 ל`,יפאורה,יח`,,1,34.90,34.90
2247,שישיית שוופס דיאט למון ליים 1.5 ל`,יפאורה,יח`,,1,34.90,34.90
2248,משקה פירות בטעם גווארנה שוופס (1.5 ליטר),יפאורה,יח`,,1,6.90,4.60
2249,בירה ג`מס בקבוק פילס 330 מל,יורוסטנדרט בעמ,יח`,,1,12.90,3.82
2250,בירה ג`מס בקבוק חיטה 330 מל,יורוסטנדרט בעמ,יח`,,1,12.90,3.82
2251,בירה ג`מס בקבוק 8.80% אלכוהול ( 330 מל),יורוסטנדרט בעמ,יח`,,1,12.90,3.82
2252,משוקלדים חמוציות מריר 160 גר` בקופסא,דין שיווק וקליה בעמ,יח`,,1,11.90,7.44
2253,משוקלדים פקאן מריר 160 גר` בקופסא,דין שיווק וקליה בעמ,יח`,,1,11.90,7.44
2254,משוקלדים חמוציות חלב 160 גר` בקופסא,דין שיווק וקליה בעמ,יח`,,1,11.90,7.44
2255,משוקלדים שקד חלב 160 גר` בקופסא,דין שיווק וקליה בעמ,יח`,,1,11.90,7.44
2256,משוקלדים צימוק מריר 160 גר` בקופסא,דין שיווק וקליה בעמ,יח`,,1,11.90,7.44
2257,משוקלדים בוטן מריר 160 גר` בקופסא,דין שיווק וקליה בעמ,יח`,,1,11.90,7.44
2258,משוקלדים לוז חלב 160 גר` בקופסא,דין שיווק וקליה בעמ,יח`,,1,11.90,7.44
2259,משוקלדים לוז מריר 160 גר` בקופסא,דין שיווק וקליה בעמ,יח`,,1,11.90,7.44
2260,משוקלדים שומשום חלב 160 גר` בקופסא,דין שיווק וקליה בעמ,יח`,,1,11.90,7.44
2261,משוקלדים שומשום מריר 160 גר` בקופסא,דין שיווק וקליה בעמ,יח`,,1,11.90,7.44
2262,מגבונים לניקוי כללי סנו סושי (50),החברה הדרומית לשיווק בעמ,יח`,,1,9.90,9.90
2263,קרמה דאודורנט ספריי -קלאסי,החברה הדרומית לשיווק בעמ,יח`,,1,19.90,13.27
2264,דאודורנט ספריי מאסק קרמה (150 מל),החברה הדרומית לשיווק בעמ,יח`,,1,19.90,13.27
2265,קרמה דאודורנט ספריי -אורכידאה,החברה הדרומית לשיווק בעמ,יח`,,1,19.90,13.27
2266,משוקלדים צימוק חלב 160 גר` בקופסא,דין שיווק וקליה בעמ,יח`,,1,11.90,7.44
2267,משוקלדים בוטן חלב 160 גר` בקופסא,דין שיווק וקליה בעמ,יח`,,1,11.90,7.44
2268,נקניקיות פרגיות 300 גר` טירת צבי,תנובה קפואים,יח`,,1,13.90,4.63
2269,פסטרמה שום וצילי טירת צבי (400 גרם),תנובה קפואים,יח`,,1,31.90,7.98
2270,נקניקיות וינר 1 קג` טירת צבי,תנובה קפואים,יח`,,1,32.90,6.58
2271,סלמי גלבוע 400 גר` טירת צבי,תנובה קפואים,יח`,,1,23.90,5.98
2272,קבנוס 120 גר` טירת צבי,תנובה קפואים,יח`,,1,11.90,9.92
2273,קבנוס 120 גר` פיקנטי טירת צבי,תנובה קפואים,יח`,,1,11.90,9.92
2274,חטיפי קבנוס 120 גר` טירת צבי,תנובה קפואים,יח`,,1,11.90,9.92
2275,צמד כפרי ברבקיו ודבש 600 גר טירת צבי,תנובה קפואים,יח`,,1,29.90,4.98
2276,טרין מוס כבד עוף 120 גר` תנובה,תנובה קפואים,יח`,,1,15.90,13.25
2277,סירופ בטעם ענבים מועשר בויטמינים 1 ליטר,אחדות בעמ,יח`,,1,8.50,8.50
2278,סירופ בטעם פטל מועשר בויטמינים 1 ליטר אח,אחדות בעמ,יח`,,1,8.50,8.50
2279,סירופ בטעם אננס מועשר בויטמינים 1 ליטר א,אחדות בעמ,יח`,,1,8.50,8.50
2280,ממרח טחינה עם דבש 400 גר` אחווה,אחדות בעמ,יח`,,1,11.90,2.98
2281,נשנושי קבנוס יחיעם (125 גרם),מעדני יחיעם (1993) בעמ,יח`,,1,12.90,10.32
2282,נקניקיות עוף 1.5 קג,מעדני יחיעם (1993) בעמ,יח`,,1,29.90,29.90
2283,פסטרמה ברביקיו דק דק יחיעם (140 גרם),מעדני יחיעם (1993) בעמ,יח`,,1,12.90,9.21
2284,פסטרמה בדבש דק דק יחיעם (140 גרם),מעדני יחיעם (1993) בעמ,יח`,,1,12.90,9.21
2285,פסטרמה של פעם דק דק יחיעם (140 גרם),מעדני יחיעם (1993) בעמ,יח`,,1,12.90,9.21
2286,פסטרמה מעודנת על גחלים יחיעם (300 גרם),מעדני יחיעם (1993) בעמ,יח`,,1,23.90,7.97
2287,סלמי תה יחיעם (300 גרם),מעדני יחיעם (1993) בעמ,יח`,,1,25.90,8.63
2288,סלמי פפרוני 200 גר` יחיעם,מעדני יחיעם (1993) בעמ,יח`,,1,14.90,7.45
2289,גבינת גאודה פרוסות 150 גר,ג.וילי-פוד אינטרנשיונל בעמ,יח`,,1,9.90,6.60
2290,אורז בסמטי אהרוני (1 קג),דין שיווק וקליה בעמ,יח`,,1,12.90,12.90
2291,שיבולת שועל דקה שקדיה (500 גרם),דין שיווק וקליה בעמ,יח`,,1,5.90,1.18
2292,משוקלדים שקד מריר 160 גר` בקופסא,דין שיווק וקליה בעמ,יח`,,1,11.90,7.44
2293,משוקלדים פקאן חלב 160 גר` בקופסא,דין שיווק וקליה בעמ,יח`,,1,11.90,7.44
2294,שיבולת שועל עבה שקדיה (500 גרם),דין שיווק וקליה בעמ,יח`,,1,5.90,1.18
2295,בישקוטים וניל קקאו בונומי (200 גרם),דנשר (1963) בעמ,יח`,,1,7.90,3.95
2296,מואי עוגיות קקאו ושוקלד מריר עם קרם אספר,דנשר (1963) בעמ,יח`,,1,17.90,9.94
2297,מואי עוגיות קקאו ושוקולד עם קרם ברולה,דנשר (1963) בעמ,יח`,,1,17.90,9.94
2298,אל סבון נוזלי פנינה רוזנבלום (500x3 גרם),פנינה רוזנבלום בעמ,יח`,,1,13.90,9.27
2299,גרנולה שוקולד מריר+לבן 400 גר` פנינה רוז,פנינה רוזנבלום בעמ,יח`,,1,29.90,7.48
2300,מרכך לאחר החלקה 750 מל פנינה רוזנבלום,פנינה רוזנבלום בעמ,יח`,,1,29.90,3.99
2301,שמפו לאחר החלקה 750 מל פנינה רוזנבלום,פנינה רוזנבלום בעמ,יח`,,1,29.90,3.99
2302,מסיכה לאחר החלקה 500 מל פנינה רוזנבלום,פנינה רוזנבלום בעמ,יח`,,1,34.90,6.98
2303,רוטב עוף 800 גרם,פנינה רוזנבלום בעמ,יח`,,1,17.90,2.24
2304,קריניאנו 750 מל BUZZ,אגודת הכורמים,יח`,,1,26.90,3.55
2305,מוסקטו 750 מל BUZZ,אגודת הכורמים,יח`,,1,26.90,3.55
2306,קורנפלור מיה (500 גרם),מיה תעשיות מזון מ.ת.מ. בעמ,יח`,,1,8.90,1.78
2307,שקיות מזון סנו סושי (300),החברה הדרומית לשיווק בעמ,יח`,,1,11.90,11.90
2308,מקסימה מרכך מרוכז חלב ודבש סנו (1 ליטר),החברה הדרומית לשיווק בעמ,יח`,,1,17.90,1.79
2309,סנו מקסימה מרכך 1 ליטר ורוד,החברה הדרומית לשיווק בעמ,יח`,,1,17.90,1.79
2310,אוקסיג`ן ג`ל 3 ליטר כביסה לבנה,החברה הדרומית לשיווק בעמ,יח`,,1,29.90,9.97
2311,סנופרש הום נטול גז 350 מל בניחוח בוקר א,החברה הדרומית לשיווק בעמ,יח`,,1,14.90,4.26
2312,פוליויקס 3 ליטר,החברה הדרומית לשיווק בעמ,יח`,,1,22.90,11.45
2313,סנובון ג`ל בניחוח פריחה,החברה הדרומית לשיווק בעמ,יח`,,1,12.90,12.90
2314,מנקה אסלות 00 1 ליטר ניחוח רענן,החברה הדרומית לשיווק בעמ,יח`,,1,10.90,10.90
2315,סנובון מוצק WAVE בתוספת אקונומיקה,החברה הדרומית לשיווק בעמ,יח`,,1,9.90,9.90
2316,פרוסות צ`יפס תפוגן (1.5 קג),קבוצת אסם סחר שות. מוגבלת,יח`,,1,24.90,1.66
2317,הר חרמון אינדיגו,היכל היין שקד גולן בעמ,יח`,,1,30.90,4.08
2318,הר חרמון מוסקט יקב רמת הגולן (750 מל),היכל היין שקד גולן בעמ,יח`,,1,30.90,4.08
2319,מוזלי בוטנים אגוזים ושקדים 1קג - שקדיה,דין שיווק וקליה בעמ,יח`,,1,19.90,1.99
2320,מוזלי עם פירות שקדיה (1 קג),דין שיווק וקליה בעמ,יח`,,1,19.90,1.99
2321,מוזלי צימוקים תפוח קינומון 1קג - שקדיה,דין שיווק וקליה בעמ,יח`,,1,19.90,1.99
2322,גרנולה אגוזים 1קג - שקדיה,דין שיווק וקליה בעמ,יח`,,1,19.90,1.99
2323,קונפיטוריה פטל אדום 450גר`.,דין שיווק וקליה בעמ,יח`,,1,10.90,2.42
2324,קונפיטוריה תות שדה 450 גר`,דין שיווק וקליה בעמ,יח`,,1,10.90,2.42
2325,קונפיטוריה פטל שחור 450 גר`,דין שיווק וקליה בעמ,יח`,,1,10.90,2.42
2326,קונפיטוריה משמש 450 גר` שקדיה,דין שיווק וקליה בעמ,יח`,,1,10.90,2.42
2327,יין אדום יבש יובלים יקב דלתון (750 מל),הכרם - משקאות חריפים בעמ,יח`,,1,48.90,6.48
2328,יין לבן יובלים יקב דלתון (750 מל),הכרם - משקאות חריפים בעמ,יח`,,1,48.90,6.48
2329,יין כנען רוזה יקב דלתון (750 מל),הכרם - משקאות חריפים בעמ,יח`,,1,48.90,6.48
2330,מרבה סלים פרוט בטעם יוגורט ותפוח,ש.שסטוביץ בעמ,יח`,,1,10.90,5.99
2331,מרבה סלים פרוט בטעם יוגורט ותות,ש.שסטוביץ בעמ,יח`,,1,10.90,5.99
2332,מרבה סלים פרוט בטעם פירות יער,ש.שסטוביץ בעמ,יח`,,1,10.90,5.99
2333,מרבה סלים פרוט בטעם יוגורט ופירות יער,ש.שסטוביץ בעמ,יח`,,1,10.90,9.08
