,ItemName,ManufactureName,UnitQty,Quantity,QtyInPackage,ItemPrice,UnitOfMeasurePrice
2426,קינמון טחון תבליני מימון (100 גרם),א.ל.ייצור ושיווק תבלינים בעמ,יח`,,1,10.90,10.90
2427,צ`ילי גרוס תבליני מימון (70 גרם),א.ל.ייצור ושיווק תבלינים בעמ,יח`,,1,11.90,17
2428,תבלין מדראס קארי תבליני מימון (100 גרם),א.ל.ייצור ושיווק תבלינים בעמ,יח`,,1,11.90,11.90
2429,אורגנו תבליני מימון (40 גרם),א.ל.ייצור ושיווק תבלינים בעמ,יח`,,1,10.90,27.25
2430,בזיליקום תבליני מימון (40 גרם),א.ל.ייצור ושיווק תבלינים בעמ,יח`,,1,10.90,21.80
2431,פטרוזיליה 25 גר`,א.ל.ייצור ושיווק תבלינים בעמ,יח`,,1,10.90,43.60
2432,שמיר 25 גר`,א.ל.ייצור ושיווק תבלינים בעמ,יח`,,1,10.90,43.60
2433,שום טחון תבליני מימון (100 גרם),א.ל.ייצור ושיווק תבלינים בעמ,יח`,,1,14.90,14.90
2434,כוסברה ירוקה תבליני מימון (20 גרם),א.ל.ייצור ושיווק תבלינים בעמ,יח`,,1,10.90,36.33
2435,שבבי בצל מטוגן 200 גר`,א.ל.ייצור ושיווק תבלינים בעמ,יח`,,1,9.90,4.95
2436,פפריקה מתוקה תבליני מימון (80 גרם),א.ל.ייצור ושיווק תבלינים בעמ,יח`,,1,5.90,7.38
2437,פלפל שחור טחון תבליני מימון (50 גרם),א.ל.ייצור ושיווק תבלינים בעמ,יח`,,1,7.90,15.80
2438,כמון טחון תבליני מימון (50 גרם),א.ל.ייצור ושיווק תבלינים בעמ,יח`,,1,5.90,11.80
2439,תבלין לגריל עוף תבליני מימון (80 גרם),א.ל.ייצור ושיווק תבלינים בעמ,יח`,,1,5.90,7.38
2440,פירורי לחם זהוב 200 גר`,א.ל.ייצור ושיווק תבלינים בעמ,יח`,,1,6.90,3.45
2441,מלח לימון תבליני מימון (100 גרם),א.ל.ייצור ושיווק תבלינים בעמ,יח`,,1,5.90,5.90
2442,זעתר ושומשום בשקית תבליני מימון (80 גרם),א.ל.ייצור ושיווק תבלינים בעמ,יח`,,1,5.90,7.38
2443,פפריקה חריפה בשקית תבליני מימון (80 גרם),א.ל.ייצור ושיווק תבלינים בעמ,יח`,,1,5.90,7.38
2444,קינמון טחון תבליני מימון (80 גרם),א.ל.ייצור ושיווק תבלינים בעמ,יח`,,1,5.90,7.38
2445,אורגנו תבליני מימון (20 גרם),א.ל.ייצור ושיווק תבלינים בעמ,יח`,,1,5.90,29.50
2446,פטרוזיליה תבליני מימון (20 גרם),א.ל.ייצור ושיווק תבלינים בעמ,יח`,,1,5.90,7.38
2447,פפריקה מתוקה 250 גר`,א.ל.ייצור ושיווק תבלינים בעמ,יח`,,1,19.90,7.96
2448,מארז כדורי שוקולוד 250 גר`,לייבוביץ,יח`,,1,19.90,7.96
2449,קצפת טעמים קדאיף 200 גר`,לייבוביץ,יח`,,1,19.90,9.95
2450,פס ארוז 500  גר`טעמי העולם,לייבוביץ,יח`,,1,34.90,6.98
2451,סברינה 250 גר`,לייבוביץ,יח`,,1,12.90,6.45
2452,פס ארוז 500 גר`,לייבוביץ,יח`,,1,34.90,6.98
2453,עוגה עגולה קטנה 700 גר`,לייבוביץ,יח`,,1,69.90,9.99
2454,פס טבעוני 500 גר`,לייבוביץ,יח`,,1,34.90,6.98
2455,עוגיות מלבן שקדים לחמי (250 גרם),תה ויסוצקי (ישראל) בעמ,יח`,,1,17.90,6.39
2456,עוגיות נסיכה לחמי (250 גרם),תה ויסוצקי (ישראל) בעמ,יח`,,1,17.90,7.16
2457,בזיליקום א.אדמה,א.אדמה (2007) בעמ,יח`,,1,4.90,4.90
2458,סלט ביבי מיקס בנספק,א.אדמה (2007) בעמ,יח`,,1,7.90,7.90
2459,לבבות חסה קיסר,א.אדמה (2007) בעמ,יח`,,1,9.90,9.90
2460,רוזמרין ארוז,א.אדמה (2007) בעמ,יח`,,1,4,4
2461,טימין / קורנית,א.אדמה (2007) בעמ,יח`,,1,4.90,4.90
2462,מרווה,א.אדמה (2007) בעמ,יח`,,1,4.90,4.90
2463,תרד עלים אורגני א.אדמה,א.אדמה (2007) בעמ,יח`,,1,8.90,4.94
2464,סלרי ראש.,א.אדמה (2007) בעמ,יח`,,1,4.90,1.63
2465,לוף ארוז - א.אדמה,א.אדמה (2007) בעמ,יח`,,1,9.90,9.90
2466,מחית פרינוק תפו,גורי מוצרי צריכה (1991) בעמ,יח`,,1,4.90,3.77
2467,מחית לפתן פירות שלב 3 פרינוק (190 גרם),גורי מוצרי צריכה (1991) בעמ,יח`,,1,5.90,3.11
2468,פילטונה בשמן רביעיה,פילטונה תעשיות בעמ,יח`,,1,19.90,19.90
2469,פילטונה במים רביעיה,פילטונה תעשיות בעמ,יח`,,1,19.90,3.11
2470,פילטונה נתחי טונה בשמן זית רביעייה,פילטונה תעשיות בעמ,יח`,,1,25.90,4.05
2471,ביסקוויט פתי בר בטעם שוקו עלית (500 גרם),שטראוס גרופ בעמ,יח`,,1,9.50,1.90
2472,חטיף תירס חריף אש דוריטוס (70 גרם),שטראוס פריטו ליי בעמ,יח`,,1,3.90,5.57
2473,חטיף צ`יפס בטעם טבעי תפוצ`יפס (40x6 גרם),שטראוס פריטו ליי בעמ,יח`,,1,12.90,5.38
2474,שניצל בקר מלינסה אל מטאדור 250 גר`,בלדי בעמ,יח`,,1,12.90,5.16
2475,סינטה בקר דק דק אל מטאדור 250 גר`,בלדי בעמ,יח`,,1,14.90,5.96
2476,שומן כבש 200,בלדי בעמ,יח`,,1,9.90,4.95
2477,עוגיות רוגלך טעם שוקולד 400 גר`,שיבולים יצור ושיווק מוצרי מאפה,יח`,,1,11.90,2.98
2478,שעועית ענק מיה (400 גרם),מיה תעשיות מזון מ.ת.מ. בעמ,יח`,,1,11.90,2.98
2479,ג`ריש 500 גר` מיה,מיה תעשיות מזון מ.ת.מ. בעמ,יח`,,1,5.90,1.18
2480,חומץ טבעי מיה (1 ליטר),מיה תעשיות מזון מ.ת.מ. בעמ,יח`,,1,7.90,7.90
2481,קונפיטורה דובדבנים 340 גר`,מיה תעשיות מזון מ.ת.מ. בעמ,יח`,,1,9.90,2.91
2482,ציפוי לשניצל עם עשבי תיבול 500 גר` מיה,מיה תעשיות מזון מ.ת.מ. בעמ,יח`,,1,11.90,2.38
2483,ציפוי לשניצל עם תיבול עדין מיה (500 גרם),מיה תעשיות מזון מ.ת.מ. בעמ,יח`,,1,11.90,2.38
2484,ריבת חלב מיה (400 גרם),מיה תעשיות מזון מ.ת.מ. בעמ,יח`,,1,13.90,4.63
2485,ריבת חלב בטעם שמנת 400 גר`,מיה תעשיות מזון מ.ת.מ. בעמ,יח`,,1,13.90,3.48
2486,אורז בסמטי בסגנון הודי מיה (1 קג),מיה תעשיות מזון מ.ת.מ. בעמ,יח`,,1,9.90,0.99
2487,אורז ריזוטו עגול 1 קג,מיה תעשיות מזון מ.ת.מ. בעמ,יח`,,1,11.90,11.90
2488,סחוג תימני תבליני ביטון יוחאי (250 גרם),נטו מלינדה סחר בעמ,יח`,,1,13.90,5.56
2489,לימון בלאדי תבליני ביטון יוחאי (250 גרם),נטו מלינדה סחר בעמ,יח`,,1,13.60,5.44
2490,אריסה מתוקה תבליני ביטון יוחאי (250 גרם),נטו מלינדה סחר בעמ,יח`,,1,13.60,5.44
2491,עמבה תבליני ביטון יוחאי (250 גרם),נטו מלינדה סחר בעמ,יח`,,1,13.90,5.56
2492,פלפל צ`ומה תבליני ביטון יוחאי (250 גרם),נטו מלינדה סחר בעמ,יח`,,1,14.90,5.96
2493,סחוג אדום 130 גר ביטון,נטו מלינדה סחר בעמ,יח`,,1,8.90,6.85
2494,צנובר 100 גרם שקית שקדיה,דין שיווק וקליה בעמ,יח`,,1,21.90,21.90
2495,מרלו יקב הרי גליל (750 מל),היכל היין שקד גולן בעמ,יח`,,1,34.90,4.61
2496,קברנה סובניון יקב הרי גליל (750 מל),היכל היין שקד גולן בעמ,יח`,,1,36.90,4.88
2497,שיראז יקב הרי גליל (750 מל),היכל היין שקד גולן בעמ,יח`,,1,34.90,4.61
2498,אל סבון ארומטי משאבה סטייל,גורי ע.ע.ע בעמ,יח`,,1,6.90,1.38
2499,פפסי קול מקס 500 מל,טמפו משקאות בעמ,יח`,,1,3.90,0.72
2500,משקה מוגז בטעם תפוזים מירנדה (500 מל),טמפו משקאות בעמ,יח`,,1,3.90,0.72
2501,משקה מוגז בטעם ליים סבן אפ (500 מל),טמפו משקאות בעמ,יח`,,1,3.90,0.72
2502,פפסי קול סבן אפ דיאט 500 מל,טמפו משקאות בעמ,יח`,,1,3.90,0.72
2503,בירה שחורה נשר מאלט (1.5 ליטר),טמפו משקאות בעמ,יח`,,1,7.50,0.50
2504,בירה שחורה דיאט נשר מאלט (1.5 ליטר),טמפו משקאות בעמ,יח`,,1,7.50,5
2505,בירה הייניקן 330 בקבוק,טמפו משקאות בעמ,יח`,,1,10.10,2.97
2506,בירה שנדי למון ליים מכבי (330x6 מל),טמפו משקאות בעמ,יח`,,1,36.90,1.77
2507,בירה היינקן (500 מל),טמפו משקאות בעמ,יח`,,1,8.50,1.46
2508,שקיות להכנת קוביות קרח-המותג,דין שיווק - עטרת,יח`,,1,3.90,0.33
2509,תבניות גדולות המותג) (3,דין שיווק - עטרת,יח`,,1,5.90,1.97
2510,תבניות אלומיניום גדולות וצרות המותג) (4,דין שיווק - עטרת,יח`,,1,5.90,1.48
2511,נודלס ביצים להקצפה וילי פוד (200 גרם),ג.וילי-פוד אינטרנשיונל בעמ,יח`,,1,4.90,2.45
2512,נודלס מסולסלות וילי פוד (200 גרם),ג.וילי-פוד אינטרנשיונל בעמ,יח`,,1,4.90,2.45
2513,מנת השף נודלס בטעם עוף וילי פוד (70 גרם),ג.וילי-פוד אינטרנשיונל בעמ,יח`,,1,4.90,7
2514,מנת השף מרק+נודלס פיקנטי,ג.וילי-פוד אינטרנשיונל בעמ,יח`,,1,4.90,7
2515,מרגרינה ללא מלח וילי פוד (200 גרם),ג.וילי-פוד אינטרנשיונל בעמ,יח`,,1,2.90,1.45
2516,שקית 10 מודפס,שמחה זה אנחנו בעמ,יח`,,1,8.90,8.90
2517,חלבה מסולסלת 250 גר`,אחדות בעמ,יח`,,1,9.90,3.96
2518,טחינה משומשום מלא אחוה (500 גרם),אחדות בעמ,יח`,,1,9.90,1.98
2519,טחינה משומשום טבעי אחוה (500 גרם),אחדות בעמ,יח`,,1,9.90,1.98
2520,חלבה עם פולי קקאו 400 גר אחוה,אחדות בעמ,יח`,,1,12.90,3.23
2521,קצפיות במגש 180 גר,אחדות בעמ,יח`,,1,8.90,4.94
2522,טחינה עם שוקולד 400 גר אחוה,אחדות בעמ,יח`,,1,11.90,2.98
2523,ממרח טחינה עם סילאן 400 גר` אחוה,אחדות בעמ,יח`,,1,11.90,2.98
2524,אגו משפחתי דאבל שוקו בלמינט 130 גר` * 13,כרמית תעשיות ממתקים בעמ,יח`,,1,8.90,6.85
2525,דנונה פרי בר קורנפלקס,שטראוס גרופ בעמ/מצונן,יח`,,1,4.40,2.51
2526,משקה יוגורט תות בננה גמדים (100x8 מל),שטראוס גרופ בעמ/מצונן,יח`,,1,20,2.50
2527,דני שמיניה,שטראוס גרופ בעמ/מצונן,יח`,,1,16.40,16.40
2528,שתי  יח` קופ`למברשת שיניים,קונסיגנציה- ש. י גיספאן 1993,יח`,,1,13.90,13.90
2529,סליל דבק דו צדדי לבן ושחור,קונסיגנציה- ש. י גיספאן 1993,יח`,,1,13.90,13.90
2530,סופר גלו חזק 3  יח`+  בק`נוזלי,קונסיגנציה- ש. י גיספאן 1993,יח`,,1,13.90,13.90
2531,כובע רחצה/(עבה  משי),קונסיגנציה- ש. י גיספאן 1993,יח`,,1,9.90,9.90
2532,גלידת שטראוס 2 ליטר שוקו וניל פיסטוק קרמ,גלידות שטראוס בעמ,יח`,,1,24.90,1.25
2533,טחינה ירושלים 500 גר`,תה ויסוצקי (ישראל) בעמ,יח`,,1,15.90,3.18
2534,נובי כוס ומכסה 6 יח`,אינטרסן 1996 בעמ,יח`,,1,29.90,29.90
2535,צימרוני אוזניים מעץ אינטרסן (300),אינטרסן 1996 בעמ,יח`,,1,4,0.01
2536,שעועית ירוקה שלמה 800 גר`,נ.ת.נ.ג.ב החזקות יעוץ וניהול ב,יח`,,1,6.80,0.85
2537,שעועית חתוכה ירוקה 800  גר`קפוא,נ.ת.נ.ג.ב החזקות יעוץ וניהול ב,יח`,,1,6.80,0.85
2538,שעועית חתוכה צהובה,נ.ת.נ.ג.ב החזקות יעוץ וניהול ב,יח`,,1,6.80,0.85
2539,אפונה קפוא 800 גר`,נ.ת.נ.ג.ב החזקות יעוץ וניהול ב,יח`,,1,9.90,1.24
2540,אפונה וגזר 800 גר`,נ.ת.נ.ג.ב החזקות יעוץ וניהול ב,יח`,,1,9.90,1.24
2541,לקט ירקות 800 גר` קפוא,נ.ת.נ.ג.ב החזקות יעוץ וניהול ב,יח`,,1,9.90,1.24
2542, שיפוד*עבה* 30 סמ-חדש ,מ.א.ייצור ויבוא מטליות בעמ,יח`,,1,4.90,4.90
2543,4 מטליות מיקרו לניקוי כללי shiny,מ.א.ייצור ויבוא מטליות בעמ,יח`,,1,6.90,6.90
2544,כף אשפה עם גומי,מ.א.ייצור ויבוא מטליות בעמ,יח`,,1,5.90,5.90
2545,דלי איטלקי עם פיה יוגב,מ.א.ייצור ויבוא מטליות בעמ,יח`,,1,11.90,11.90
2546,מטאטא משובח+מקל ,מ.א.ייצור ויבוא מטליות בעמ,יח`,,1,30.20,30.20
2547,מטליות מיקרו רצפה שלישייה shiny,מ.א.ייצור ויבוא מטליות בעמ,יח`,,1,19.90,19.90
2548,מגש שקוף9*13 פאלאס,פאלאס תעשיות נטו (2014) בעמ,יח`,,1,4.90,4.90
2549,להבונים טיפ טופ פאלאס (50),פאלאס תעשיות נטו (2014) בעמ,יח`,,1,9.90,0.20
2550,קרם גוף איזבלה ורוד פנינה,פנינה רוזנבלום בעמ,יח`,,1,17.90,4.48
2551,בורקס תפוא כשלפ 600 ג,מאפיית אריאל בעמ,יח`,,1,20.90,3.48
2552,רוטב פיצה אוליביה (430 גרם),גורי מוצרי צריכה (1991) בעמ,יח`,,1,16.90,4.07
2553,אגו טבלאות שוקולד מריר 85 גר` שלישייה,כרמית תעשיות ממתקים בעמ,יח`,,1,11.90,4.67
2554,אגו טבלאות שוקולד לבן 85 גר` שלישייה,כרמית תעשיות ממתקים בעמ,יח`,,1,11.90,4.67
2555,שוקולד מריר פרווה ללא סוכר 85 גרם,כרמית תעשיות ממתקים בעמ,יח`,,1,5.90,6.94
2556,שוקולד חלבי ללא סוכר 85 גרם,כרמית תעשיות ממתקים בעמ,יח`,,1,5.90,6.94
2557,סטיביה מרמולייט (100),דנשר (1963) בעמ,יח`,,1,27.90,0.28
2558,די לואיג`י רוסו דולצ`ה 750 מל למברוסקו,הכרם - משקאות חריפים בעמ,יח`,,1,29.90,3.95
2559,ריאל אימפריאל מבעבע קאווה די מארמו,הכרם - משקאות חריפים בעמ,יח`,,1,30.20,3.99
2560,כפפות אלוורה גדול סנו סושי,החברה הדרומית לשיווק בעמ,יח`,,1,10.90,10.90
2561,כפפות אלוורה קטן סנו סושי,החברה הדרומית לשיווק בעמ,יח`,,1,12.90,12.90
2562,כפפות אלוורה בינוני סנו סושי,החברה הדרומית לשיווק בעמ,יח`,,1,10.90,10.90
2563,מטבוחה אחלה (500 גרם),שטראוס גרופ בעמ/מצונן,יח`,,1,13.80,2.76
2564,קוטג` 3% מועשר 250 גר`,החב` המרכזית - טרה,יח`,,1,5.30,2.12
2565,גבינה לבנה 3% 250 גר` פיקוח,החב` המרכזית - טרה,יח`,,1,4.75,1.90
2566,גבינה לבנה 5% 500  גר`פיקוח,החב` המרכזית - טרה,יח`,,1,9.50,1.90
2567,יין רימון 750 מל,יורוסטנדרט בעמ,יח`,,1,69,9.16
2568,סירופ 3 פריגת,החברה המרכזית להפצת משקאות בעמ,יח`,,1,41.90,13.97
2569,קוקה קולה זירו שישיה 1.75,החברה המרכזית להפצת משקאות בעמ,יח`,,1,35,3.33
2570,פחית קולה סליק קוקה-קולה (330 מל),החברה המרכזית להפצת משקאות בעמ,יח`,,1,4.50,1.27
2571,פחית זירו סליק קוקה-קולה (330 מל),החברה המרכזית להפצת משקאות בעמ,יח`,,1,4.50,1.27
2572,תה קר בטעם אפרסק פיוז-טי (1.5 ליטר),החברה המרכזית להפצת משקאות בעמ,יח`,,1,7.20,0.48
2573,תה קר דיאט בטעם אפרסק פיוז-טי (1.5 ליטר),החברה המרכזית להפצת משקאות בעמ,יח`,,1,7.20,0.48
2574,פיוז תה אפרסק רביעיה,החברה המרכזית להפצת משקאות בעמ,יח`,,1,27.90,27.90
2575,משקה מוגז אורנג` פאנטה (330 מל),החברה המרכזית להפצת משקאות בעמ,יח`,,1,4.50,1.27
2576,תה קר בטעם ענבים פיוז-טי (1.5 ליטר),החברה המרכזית להפצת משקאות בעמ,יח`,,1,7.20,4.80
2577,שישית פחיות קוקה קולה פרידג`פק,החברה המרכזית להפצת משקאות בעמ,יח`,,1,19.90,9.14
2578,שישיית פחיות קוקה קולה זירו,החברה המרכזית להפצת משקאות בעמ,יח`,,1,19.90,9.14
2579,סרקל שמפו+מרכך 1 ליטר,פישר תעשיות פרמצבטיות בעמ,יח`,,1,27.90,2.79
2580,שמפו לשיער כסוף לגבר 400 מל דר פישר,פישר תעשיות פרמצבטיות בעמ,יח`,,1,24.90,6.23
2581,קמיל בלו סנסיטיב 500 מל,פישר תעשיות פרמצבטיות בעמ,יח`,,1,20.90,4.18
2582,קמיל בלו סנסיטיב 500 מל,פישר תעשיות פרמצבטיות בעמ,יח`,,1,20.90,4.18
2583,שוופס סודה לימון 1.5 ליטר,יפאורה,יח`,,1,3.90,2.60
2584,קריסטל 2 ליטר אשכוליות מוגז,יפאורה,יח`,,1,3.80,1.90
2585,מי סודה בטעם לימון שוופס (1.5x4 ליטר),יפאורה,יח`,,1,9.90,1.65
2586,שוופס מוגז עדין 1.5 ליטר תפוח ליים,יפאורה,יח`,,1,6.90,0.46
2587,שוופס מוגז עדין 1.5 ליטר פירות יער,יפאורה,יח`,,1,6.90,0.46
2588,משקה מוגז עדין אפרסק שוופס (1.5 ליטר),יפאורה,יח`,,1,6.90,0.46
2589,תה קר אפרסק ספרינג (1.5 ליטר),יפאורה,יח`,,1,6.40,4.27
2590,תה ירוק לימון לואיזה ספרינג (1.5 ליטר),יפאורה,יח`,,1,6.40,4.27
2591,ספרינג תה קר 0.5 ליטר אפרסק,יפאורה,יח`,,1,5,0.94
2592,שוופס מוגז עדין 1.5 ליטר ענבים ריזלינג,יפאורה,יח`,,1,6.90,0.46
2593,משקה קל תפוחים תפוזינה (1.5 ליטר),יפאורה,יח`,,1,6.50,0.43
2594,תפוזינה תפוח 500מל,יפאורה,יח`,,1,4.50,0.84
2595,תבלין לפיצה מטחנה 50 גר,א.ל.ייצור ושיווק תבלינים בעמ,יח`,,1,17.90,35.80
2596,שטראוס קרמיסימו בטעמי 3 שוקלד,גלידות שטראוס בעמ,יח`,,1,18.90,14.21
2597,שטראוס קרמיסימו,גלידות שטראוס בעמ,יח`,,1,18.90,14.21
2598,תה קמומיל ונענע ויסוצקי הגן הקסום) (25,תה ויסוצקי (ישראל) בעמ,יח`,,1,17.50,46.67
2599,תה קמומיל ודבש ויסוצקי הגן הקסום) (25,תה ויסוצקי (ישראל) בעמ,יח`,,1,17.50,46.67
2600,מוזלי קראנצ`י תפוח בדבש גרין (1 קג),משה סידס ובנו בעמ,יח`,,1,25.90,2.59
2601,מוזלי חלבה מיקס גרין (1 קג),משה סידס ובנו בעמ,יח`,,1,25.90,25.90
2602,סודה לימון ליים 1.5 רביעייה,טמפו משקאות בעמ,יח`,,1,10.90,1.82
2603,בירה שנדי תפוח מכבי (330x6 מל),טמפו משקאות בעמ,יח`,,1,36.90,1.77
2604,בירה שנדי אפרסק מכבי (330x6 מל),טמפו משקאות בעמ,יח`,,1,36.90,1.77
2605,לחם שיפון 550 גר`,מאפיית דואט בעמ,יח`,,1,10.90,1.98
2606,לחם שיפון כפרי 600 גר,מאפיית דואט בעמ,יח`,,1,10.90,1.82
2607,לחם שיפון ביתי 630 גר`,מאפיית דואט בעמ,יח`,,1,10.90,1.73
2608,לחם דגנים 630 גר`,מאפיית דואט בעמ,יח`,,1,10.90,1.73
2609,מארז לחמניות 450  גר`דואט,מאפיית דואט בעמ,יח`,,1,10.90,10.90
2610,מארז לחמניות מתוקות 450  גר`דואט,מאפיית דואט בעמ,יח`,,1,10.90,10.90
2611,לחם מרוקאי מסורתי 550 גר`,מאפיית דואט בעמ,יח`,,1,12.90,2.35
2612,לחם שבע דגנים 1100 גר`,מאפיית דואט בעמ,יח`,,1,15.90,1.45
2613,לחם בריאות 630 גר`,מאפיית דואט בעמ,יח`,,1,10.90,1.73
2614,לחם כוסמין,מאפיית דואט בעמ,יח`,,1,14.90,14.90
2615,לחם שיפון  (900100%  גר`),מאפיית דואט בעמ,יח`,,1,14.90,1.66
2616,צ`יפס אמריקאי 1.5  קג`פרי גליל,ויטה -פרי גליל (החדשה) בעמ,יח`,,1,14.90,0.99
2617,צ`יפס בטטה 700 גר` פרי גליל,ויטה -פרי גליל (החדשה) בעמ,יח`,,1,16.90,2.41
2618,אפונה עדינה קפואה 600  גר`פרי גליל,ויטה -פרי גליל (החדשה) בעמ,יח`,,1,10.90,1.82
2619,דניאלה מעדן בטעם בננה שטראוס (88 גרם),שטראוס גרופ בעמ/מצונן,יח`,,1,4,2.67
2620,עלים לקרמשניט 300 גר`,דנשר (1963) בעמ,יח`,,1,17.90,5.97
2621,בישקוטים ליידיפינגרז בונומי (200 גרם),דנשר (1963) בעמ,יח`,,1,7.90,3.95
2622,מגע המשי רצועות שעווה אלוורה 16יח,דנשר (1963) בעמ,יח`,,1,27.90,1.74
2623,גלילונית שקיות לסנדוויץ 350 יח,דנשר (1963) בעמ,יח`,,1,10.90,10.90
2624,ריבת חלב דולכור (454 גרם),דנשר (1963) בעמ,יח`,,1,17.90,3.94
2625,ג`ל לאסלה טיפות טל טואלט דאק (55 מל),דנשר (1963) בעמ,יח`,,1,12.90,23.45
2626,ג`ל לאסלה לבנדר טואלט דאק (55 מל),דנשר (1963) בעמ,יח`,,1,12.90,23.45
2627,אל סבון פמילי שלישייה מעורב פירות,דנשר (1963) בעמ,יח`,,1,15.90,15.90
2628,חטיפים שונים 300 גר`,סוכנויות עמוס ממתקים בעמ,יח`,,1,13.90,4.63
2629,רולים 100 גר` בטעם שוקולד עלמה,רזיט שיווק בעמ,יח`,,1,3.90,3.90
2630,זרעי פשתן 450 גר`,מיה תעשיות מזון מ.ת.מ. בעמ,יח`,,1,9.90,2.20
2631,קינואה מיה (500 גרם),מיה תעשיות מזון מ.ת.מ. בעמ,יח`,,1,14.90,2.98
2632,עדשים שחורות מיה (500 גרם),מיה תעשיות מזון מ.ת.מ. בעמ,יח`,,1,11.90,2.38
2633,סוכריות ג`לי בטעמים 125 גר`,מיה תעשיות מזון מ.ת.מ. בעמ,יח`,,1,6.90,5.52
2634,נענע עלי הבשור מהדרין,א.אדמה (2007) בעמ,יח`,,1,5.90,5.90
2635,קרקר חיטה מלאה 270 גר` עם פשתן,יוניליוור ישראל שיווק בעמ,יח`,,1,9.90,3.67
2636,חלבה קלאסית שוקו וניל,קבוצת אסם סחר שות. מוגבלת,יח`,,1,13.90,3.97
2637,משקה בטעם קפה בקבוק 350,שטראוס גרופ בעמ/מצונן,יח`,,1,6.30,1.80
2638,תחליף חלב שלב 2 חלבי מטרנה (700 גרם),קבוצת אסם סחר שות. מוגבלת,יח`,,1,49.90,7.13
2639,תחליף חלב שלב 3 חלבי מטרנה (700 גרם),קבוצת אסם סחר שות. מוגבלת,יח`,,1,49.90,7.13
2640,תחליף חלב שלב 1 מהדרין מטרנה (700 גרם),קבוצת אסם סחר שות. מוגבלת,יח`,,1,49.90,7.13
2641,פרורי ביסקוויט שוקו 300 גר הדר,רזיט שיווק בעמ,יח`,,1,5.90,1.97
2642,גבינת פטה כבשים 20% גד (250 גרם),מחלבות גד שיווק 1992 בעמ,יח`,,1,25.90,10.36
2643,בולגרית לסלט 5% 200 גר`,מחלבות גד שיווק 1992 בעמ,יח`,,1,21.90,10.95
2644,גבינה בולגרית מעודנת 5% גד (250 גרם),מחלבות גד שיווק 1992 בעמ,יח`,,1,23.90,9.56
2645,גבינת חלומי 24% מחלב בקר גד (200 גרם),מחלבות גד שיווק 1992 בעמ,יח`,,1,21.90,10.95
2646,גבינת במרקם שמנת 5% טבעי גד,מחלבות גד שיווק 1992 בעמ,יח`,,1,11.90,5.95
2647,גבינת שמנת 30% 200 גר` גד,מחלבות גד שיווק 1992 בעמ,יח`,,1,12.90,6.45
2648,גבינת שמנת 30% זיתים 200 גר` גד,מחלבות גד שיווק 1992 בעמ,יח`,,1,12.90,6.45
2649,natural touch נובי נשכן רך במיוחד עם קופ,אינטרסן 1996 בעמ,יח`,,1,24.90,24.90
2650,שיפודי במבוק עבים 75 יח`,אינטרסן 1996 בעמ,יח`,,1,3.90,3.90
2651,מאגדת אקסטרים וניל 6 יח`,נגה גלידות שותפות מוגבלת,יח`,,1,31.90,7.38
2652,מאגדת לייט ריבת חלב 6 יח`,נגה גלידות שותפות מוגבלת,יח`,,1,27.90,8.94
2653,אקטימל בטעם תות דנונה (100x14 מל),שטראוס גרופ בעמ/מצונן,יח`,,1,29.90,21.36
2654,גרגרי חומוס מוקפאים 800 גר` פרי גליל,ויטה -פרי גליל (החדשה) בעמ,יח`,,1,9.90,1.24
2655,שעועית לבנה מבושלת קפוא 800 גר` פרי גליל,ויטה -פרי גליל (החדשה) בעמ,יח`,,1,9.90,1.24
2656,קמיל בלו סנסיטיב אל סבון שיבולית שועל 50,פישר תעשיות פרמצבטיות בעמ,יח`,,1,21.90,21.90
2657,קמיל בלו סנסטיב שמפו,פישר תעשיות פרמצבטיות בעמ,יח`,,1,29.90,29.90
2658,קרפציו עגל 210  גר`בלדי,בלדי בעמ,יח`,,1,39.90,19
2659,קרוטונים למרק בטעם עוף 400 גר`-המותג,דין שיווק - עטרת,יח`,,1,13.90,3.48
2660,קרוטונים לסלט במיכל 250 גר`-המותג,דין שיווק - עטרת,יח`,,1,9.90,3.96
