,ItemName,ManufactureName,UnitQty,Quantity,QtyInPackage,ItemPrice,UnitOfMeasurePrice
1903,כשלפ פריכיות אנרג`י תחתית שוק` לבן,שטראוס גרופ בעמ,יח`,,1,8.90,12.71
1904,חלב 3% מועשר בבקבוק יטבתה (1 ליטר),שטראוס גרופ בעמ/מצונן,יח`,,1,7.50,0.75
1905,משקה חלב עם דגנים  ובננה- ארוחה בקטנה,שטראוס גרופ בעמ/מצונן,יח`,,1,4.90,1.96
1906,משקה חלב עם דגנים  ותות- ארוחה בקטנה,שטראוס גרופ בעמ/מצונן,יח`,,1,4.90,1.96
1907,דנונה יווני לבן 7%,שטראוס גרופ בעמ/מצונן,יח`,,1,3.30,2.54
1908,עד חצות עיגולים 225 גר`,שטראוס גרופ בעמ,יח`,,1,14.90,6.62
1909,חרדל דיז`ון גרגרים יד מרדכי (350 גרם),שטראוס גרופ בעמ,יח`,,1,11.90,3.40
1910,חרדל דיז`ון חלק 370 גרם,שטראוס גרופ בעמ,יח`,,1,11.90,3.22
1911,צנצנת קוביות בזוקה גומי לעיסה 58גר,שטראוס גרופ בעמ,יח`,,1,9.90,17.07
1912,אקטימל תות שמינייה בנים,שטראוס גרופ בעמ/מצונן,יח`,,1,19.90,2.30
1913,גרנולה עם שוקולד בננה 400 גרם אנרג`י,שטראוס גרופ בעמ,יח`,,1,17.90,4.48
1914,מילקי שוקולד עשיר 133 גר,שטראוס גרופ בעמ/מצונן,יח`,,1,3.70,2.78
1915,רבע לשבע לבן 120 גר,שטראוס גרופ בעמ,יח`,,1,12.90,10.75
1916,סימפוניה שום שמיר 5%,שטראוס גרופ בעמ/מצונן,יח`,,1,11.40,5.70
1917,מאגדת אנרג`י מצופה טעמי,שטראוס גרופ בעמ,יח`,,1,14.90,8.87
1918,מאגדת אנרג`י מצופה שוקולד חלב,שטראוס גרופ בעמ,יח`,,1,14.90,8.87
1919,פרה אקסטרא וניל ועוגיות שוקו 100 גרם,שטראוס גרופ בעמ,יח`,,1,6.90,6.90
1920,מילקי קצפת קפוצ`ינו 133 גר,שטראוס גרופ בעמ/מצונן,יח`,,1,3.70,2.78
1921,משקה יטבתה פרו וניל 250 מל,שטראוס גרופ בעמ/מצונן,יח`,,1,4.90,1.96
1922,מיקס מעורב 190 גר כשלפ,שטראוס גרופ בעמ,יח`,,1,13.90,7.32
1923,בלונדי קרמל ומלח 100  גר`עלית,שטראוס גרופ בעמ,יח`,,1,7.50,7.50
1924,מארז טורקי לדרך כשלפ,שטראוס גרופ בעמ,יח`,,1,17.90,10.65
1925,בראוניז פסק זמן בדצ 380 גר`,שטראוס גרופ בעמ,יח`,,1,16.90,4.45
1926,קונפיטורת פירות יער 340 גר יד מרדכי,שטראוס גרופ בעמ,יח`,,1,14.90,4.38
1927,משקה יטבתה פרו קפה 350 מל,שטראוס גרופ בעמ/מצונן,יח`,,1,6.50,1.86
1928,שוקולד חלב במתיקות מעודנת 100 גר` עלית,שטראוס גרופ בעמ,יח`,,1,7.90,7.90
1929,שוקולד קוקוס במתיקות מעודנת 100 גר` עלית,שטראוס גרופ בעמ,יח`,,1,7.90,7.90
1930,תרסיס שמן זית 150 מל יד מרדכי,שטראוס גרופ בעמ,יח`,,1,17.90,11.93
1931,עוגיות שוקולד צ`יפס תחתית לבן 180 גר` על,שטראוס גרופ בעמ,יח`,,1,9.90,5.50
1932,עוגיות שוקוציפס תחתית חלב 180 גר` עלית,שטראוס גרופ בעמ,יח`,,1,9.90,5.50
1933,קפסולות קפה עלית אספרסו בטעם קרמל,שטראוס גרופ בעמ,יח`,,1,16.90,33.80
1934,קפסולות אספרסו בטעם אגוזים עלית,שטראוס גרופ בעמ,יח`,,1,16.90,33.80
1935,קפסולות קפה עלית אוגנדה 13 למכונות נספרו,שטראוס גרופ בעמ,יח`,,1,16.90,33.80
1936,קפסולות קפה עלית אידונזיה מס` 12,שטראוס גרופ בעמ,יח`,,1,16.90,33.80
1937,דניאלה מעדן בטעם אפרסק שטראוס (88 גרם),שטראוס גרופ בעמ/מצונן,יח`,,1,4,2.67
1938,מארז 8 דנונה מתיקות מעודנת ללא סוכר וממת,שטראוס גרופ בעמ/מצונן,יח`,,1,18.50,15.42
1939,אצבעות שוקולד קרם חלבי ועדשים 96 גר`,שטראוס גרופ בעמ,יח`,,1,7.90,8.23
1940,רבע לשבע רולס קרם קפה 120 גר` עלית,שטראוס גרופ בעמ,יח`,,1,12.90,10.75
1941,קולגיט אופטיק וויטן אנד ריסטור 75 מל,ש.שסטוביץ בעמ,יח`,,1,24.90,24.90
1942,מנה קוסקוס דורום בינוני 500 גר`,ש.שסטוביץ בעמ,יח`,,1,7.90,1.58
1943,ליידי ספיד סטיק אלוורה ג`ל 65,ש.שסטוביץ בעמ,יח`,,1,16.90,26
1944,מנה אורז יסמין 1 קג כשר לפסח,ש.שסטוביץ בעמ,יח`,,1,8.90,0.89
1945,ממרח מתובל ספייסי 252 גר מנה מאסטר שף,ש.שסטוביץ בעמ,יח`,,1,7.90,3.13
1946,ליידי ספיד סטיק אלוורה 45 גר,ש.שסטוביץ בעמ,יח`,,1,29.90,66.44
1947,ספיד סטיק כח הטבע אולנג ג`ל,ש.שסטוביץ בעמ,יח`,,1,16.90,26
1948,מנה רוטב סויה תסיסה טבעית 620 גר,ש.שסטוביץ בעמ,יח`,,1,19.90,3.21
1949,מנה רוטב סויה דל נתרן 620 גר,ש.שסטוביץ בעמ,יח`,,1,19.90,3.21
1950,פלמוליב סבון מוצק רביעייה קמומיל,ש.שסטוביץ בעמ,יח`,,1,16.90,4.69
1951,פלמוליב סבון לומינוס אבוקדו 500 מל,ש.שסטוביץ בעמ,יח`,,1,19.90,3.98
1952,פלמוליב סבון לומינוס מקדמיה 500 מל,ש.שסטוביץ בעמ,יח`,,1,19.90,3.98
1953,מאסטר שף איטריות דקיקות 400 גר,ש.שסטוביץ בעמ,יח`,,1,5.90,1.48
1954,מאסטר שף איטריות דקות 400 גר,ש.שסטוביץ בעמ,יח`,,1,5.90,1.48
1955,מאסטר שף איטריות בינוניות 400 גר,ש.שסטוביץ בעמ,יח`,,1,5.90,1.48
1956,ג`ל להסרת כתמים גולד וניש קליה (940 מל),רקיט בנקיזר (ניר איסט) בעמ,יח`,,1,19.90,2.12
1957,וניש גולד אבקה 470גר` ורוד,רקיט בנקיזר (ניר איסט) בעמ,יח`,,1,19.90,4.23
1958,אירוויק מקלות לבנדר,רקיט בנקיזר (ניר איסט) בעמ,יח`,,1,25.90,86.33
1959,קולון קפסולות לכביסה 28 יח,רקיט בנקיזר (ניר איסט) בעמ,יח`,,1,24.90,24.90
1960,סנו מקסימה מרכך 1 ליטר blue blossom,החברה הדרומית לשיווק בעמ,יח`,,1,17.90,1.79
1961,מקסימה מרכך כביסה סופט סילק סנו (1 ליטר),החברה הדרומית לשיווק בעמ,יח`,,1,17.90,1.79
1962,פורטה 750 מל free,החברה הדרומית לשיווק בעמ,יח`,,1,16.90,2.25
1963,אל סבון נוזלי כיף מיניונים (500x3 מל),החברה הדרומית לשיווק בעמ,יח`,,1,19.90,19.90
1964,ג`ט פלוס לניקוי אסלות+חומץ  750 ל סנו,החברה הדרומית לשיווק בעמ,יח`,,1,13.90,1.85
1965,סנו מקסימה קפסולות לכביסה 28 יח,החברה הדרומית לשיווק בעמ,יח`,,1,29.90,29.90
1966,ג`ט פלוס לניקוי אסלות בניחוח הדרים,החברה הדרומית לשיווק בעמ,יח`,,1,13.90,1.85
1967,סנו מקסימה סופר מרוכז (1 ליטר) - בריזה,החברה הדרומית לשיווק בעמ,יח`,,1,17.90,1.79
1968,סנו מקסימה סופר מרוכז (1 ליטר) - פרחוני,החברה הדרומית לשיווק בעמ,יח`,,1,17.90,1.79
1969,סנו מקסימה מרכך כביסה 4 ליטר floral tou,החברה הדרומית לשיווק בעמ,יח`,,1,19.90,497.50
1970,מטלית במבוק לניקוי סנו סושי,החברה הדרומית לשיווק בעמ,יח`,,1,8.90,8.90
1971,תחליב רחצה כיף ניחוח דבש 700 מל,החברה הדרומית לשיווק בעמ,יח`,,1,12.90,1.84
1972,תחליב רחצה כיף ניחוח קוקוס וניל 700 מל,החברה הדרומית לשיווק בעמ,יח`,,1,12.90,1.84
1973,תחליב רחצה כיף ניחוח לבנדר 700 מל,החברה הדרומית לשיווק בעמ,יח`,,1,12.90,1.84
1974,תחליב רחצה כיף בניחוח שמן אמבר וגרדניה 7,החברה הדרומית לשיווק בעמ,יח`,,1,12.90,1.84
1975,תחליב רחצה כיף ניחוח מאסק יסמין 700 מל,החברה הדרומית לשיווק בעמ,יח`,,1,12.90,1.84
1976,תחליב רחצה כיף ניחוח אוקיינס 700 מל,החברה הדרומית לשיווק בעמ,יח`,,1,12.90,1.84
1977,תחליב רחצה כיף בניחוח אננס וקוקס 700,החברה הדרומית לשיווק בעמ,יח`,,1,12.90,1.84
1978,תחליב רחצה בניחוח וטיבר ומלח ים 700,החברה הדרומית לשיווק בעמ,יח`,,1,12.90,1.84
1979,תחליב רחצה כיף בניחוח ברגמוט ונרולי 700,החברה הדרומית לשיווק בעמ,יח`,,1,12.90,1.84
1980,כיף שמפו לשיער רגיל תפוח זרעי צ`יה 700,החברה הדרומית לשיווק בעמ,יח`,,1,12.90,1.84
1981,כיף שמפו לשיער רגיל יבש רימונים ושמן ארג,החברה הדרומית לשיווק בעמ,יח`,,1,12.90,1.84
1982,כיף מרכך לשיער רגיל תפוח זרעי צ`יה 700,החברה הדרומית לשיווק בעמ,יח`,,1,12.90,1.84
1983,כיף מרכך לשיער רגיל יבש רימונים ושמן ארג,החברה הדרומית לשיווק בעמ,יח`,,1,12.90,1.84
1984,בייבי כיף שמפו אל דמע (1 ליטר),החברה הדרומית לשיווק בעמ,יח`,,1,22.90,22.90
1985,גבינת גאודה מגורדת 500 גר` 28% שומן הולנ,ג.וילי-פוד אינטרנשיונל בעמ,יח`,,1,26.90,5.38
1986,אנשובי ארוך אמיתי בשמן 45  גר`וילי פוד,ג.וילי-פוד אינטרנשיונל בעמ,יח`,,1,6.90,6.90
1987,גבינת חלומי 200 גר` SAY CHEESE וילי פוד,ג.וילי-פוד אינטרנשיונל בעמ,יח`,,1,24.90,12.45
1988,גבינת שמנת עשבי תיבול 200 גר` EURO CHEES,ג.וילי-פוד אינטרנשיונל בעמ,יח`,,1,12.90,6.45
1989,רוטב עגבניות עם חצילים 400 גר`,ג.וילי-פוד אינטרנשיונל בעמ,יח`,,1,9.90,2.48
1990,מארז תפוחונים (3 יח +1 ),ג.וילי-פוד אינטרנשיונל בעמ,יח`,,1,12.90,12.90
1991,יוגורט יוני 150 גר` ( 2% שומן) וילי פוד,ג.וילי-פוד אינטרנשיונל בעמ,יח`,,1,5.90,3.93
1992,יוגורט יוני 150 גר` ( 10% שומן) וילי פוד,ג.וילי-פוד אינטרנשיונל בעמ,יח`,,1,5.90,3.93
1993,יוגורט יווני עם אפרסק 150 גר` 0.90% שומן,ג.וילי-פוד אינטרנשיונל בעמ,יח`,,1,5.90,3.93
1994,יוגורט יווני עם תות שדה 150 גר` ( 0.90%,ג.וילי-פוד אינטרנשיונל בעמ,יח`,,1,5.90,3.93
1995,חלב כחוש מרוכז וממותק מופחת שומן 397 גר`,ג.וילי-פוד אינטרנשיונל בעמ,יח`,,1,9.90,2.49
1996,משקה יוגורט אפרסק 500 מל וילי פוד 0.1%,ג.וילי-פוד אינטרנשיונל בעמ,יח`,,1,9.90,9.90
1997,משקה יוגורט תות 500 מל וילי פוד 0.1%,ג.וילי-פוד אינטרנשיונל בעמ,יח`,,1,9.90,9.90
1998,משקה יוגורט תות ודודבן 500 מל וילי פוד,ג.וילי-פוד אינטרנשיונל בעמ,יח`,,1,9.90,9.90
1999,משקה יוגורט אוכמניות וסמבוק 500 מל וילי,ג.וילי-פוד אינטרנשיונל בעמ,יח`,,1,9.90,9.90
2000,פרלינים שוקולד ג`אנדויה ואגוזי לוז 150 ג,ג.וילי-פוד אינטרנשיונל בעמ,יח`,,1,15.90,10.60
2001,פרלינים שוקולד ג`אנדויה ואגוזי לוז 150 ג,ג.וילי-פוד אינטרנשיונל בעמ,יח`,,1,15.90,10.60
2002,חומוסטחינה חלק צבר (400 גרם),קבוצת אסם סחר שות. מוגבלת,יח`,,1,13.90,3.48
2003,פסטה פארפאלה אסם פרפקטו (500 גרם),קבוצת אסם סחר שות. מוגבלת,יח`,,1,7.90,1.58
2004,מנה חמה קוסקוס עם עדשים אסם (87 גרם),קבוצת אסם סחר שות. מוגבלת,יח`,,1,6.90,7.93
2005,קרמוגית במילוי חלווה 200 גר` אסם,קבוצת אסם סחר שות. מוגבלת,יח`,,1,11.90,5.95
2006,קטשופ מופחת סוכר אסם (710 גרם),קבוצת אסם סחר שות. מוגבלת,יח`,,1,11.90,1.59
2007,קראנץ` רולס 450 גר דגני בוקר,קבוצת אסם סחר שות. מוגבלת,יח`,,1,26.90,5.98
2008,המבורגר אנטריקוט בתוספת פטריות יער 360 ג,זוגלובק שיווק בעמ,יח`,,1,23.90,6.64
2009,המבורגר אנטריקוט קלאסי 360 גר` זוגלובק,זוגלובק שיווק בעמ,יח`,,1,23.90,6.64
2010,בורגר אנטיקוט ספייסי 360 גר` זוגלובק,זוגלובק שיווק בעמ,יח`,,1,23.90,6.64
2011,פריגת צלול בטעם ענבים 1.5 ליטר,החברה המרכזית להפצת משקאות בעמ,יח`,,1,7.20,0.48
2012,פריגת צלול בטעם תפוחים 1.5 ליטר,החברה המרכזית להפצת משקאות בעמ,יח`,,1,7.20,0.48
2013,פריגת צלול בטעם אפרסק 1.5 ליטר,החברה המרכזית להפצת משקאות בעמ,יח`,,1,7.20,0.48
2014,ספרייט ליים 1.5 ליטר,החברה המרכזית להפצת משקאות בעמ,יח`,,1,6.90,4.60
2015,פחית ספרייט ליים 330 מל סליק,החברה המרכזית להפצת משקאות בעמ,יח`,,1,4.50,1.27
2016,פריגת 1.5 ליטר אננס קוקוס,החברה המרכזית להפצת משקאות בעמ,יח`,,1,7.20,7.20
2017,בירה קרלסברג (330x6  מל)0% אלכוהול,החברה המרכזית להפצת משקאות בעמ,יח`,,1,27.90,13.18
2018,מעדן סויה BIO ללא סוכר (125 גר`) תנובה,תנובה - חלב,יח`,,1,3.90,3.12
2019,פתיתי עמק למאפים 28% 500 גר,תנובה - חלב,יח`,,1,34.90,6.98
2020,פרילי אפרסק 125  גר`1.5% שומן,תנובה - חלב,יח`,,1,3.50,2.80
2021,יופלה תות GO 200 מל,תנובה - חלב,יח`,,1,5.60,2.80
2022,יופלה אפרסק GO 200 מל,תנובה - חלב,יח`,,1,5.60,2.80
2023,יופלה פירות יער 200 מל GO תנובה,תנובה - חלב,יח`,,1,5.60,2.80
2024,טופו בטעם טבעי 300  גר`תנובה,תנובה - חלב,יח`,,1,11.90,3.97
2025,טופו בטעם בזיליקום 300  גר`תנובה,תנובה - חלב,יח`,,1,11.90,3.97
2026,יופלה טיוב במרקם חלק בטעם תות בננה 348 ג,תנובה - חלב,יח`,,1,11.90,3.42
2027,יופלה בטעם אננס 200 גר` GO,תנובה - חלב,יח`,,1,5.60,2.80
2028,יופלה טיוב במרקם חלק בטעם תות 348 גר` מה,תנובה - חלב,יח`,,1,11.90,3.42
2029,יופלה יוגורט בכוס עם קשית בטעם עוגיות אח,תנובה - חלב,יח`,,1,5.90,2.95
2030,פרוסות גאודה 170  גר`תנובה,תנובה - חלב,יח`,,1,19.90,11.71
2031,פריכיות משולשות -אפונה ירוקה 30 גר` אנרג,שטראוס גרופ בעמ,יח`,,1,5.90,19.67
2032,תפוציפס אפוי עשבי תיבול 45 גר` עלית,שטראוס פריטו ליי בעמ,יח`,,1,3.90,8.67
2033,1 ליטר חלב דל לקטוז 3%,שטראוס גרופ בעמ/מצונן,יח`,,1,7.50,0.75
2034,חלב נטול לקטוז 2% יטבתה בקבוק,שטראוס גרופ בעמ/מצונן,יח`,,1,8.90,0.89
2035,מאגדת אנרג`י תחתית חלב,שטראוס גרופ בעמ,יח`,,1,14.90,10.35
2036,חטיף אנרגי מאג תחתית לבן ופירות,שטראוס גרופ בעמ,יח`,,1,14.90,10.35
2037,חומוס הסדרה המובחרת עשיר 30% טחינה 400 ג,שטראוס גרופ בעמ/מצונן,יח`,,1,13.90,3.48
2038,בלונדי קרם בראוניז 100  גר`עלית,שטראוס גרופ בעמ,יח`,,1,7.50,7.50
2039,בלונדי קרם אגוזי לוז 100  גר`עלית,שטראוס גרופ בעמ,יח`,,1,7.50,7.50
2040,חומוס הסדרה המובחרת עשיר 40% טחינה 400 ג,שטראוס גרופ בעמ/מצונן,יח`,,1,13.90,3.48
2041,חומוס הסדרה המובחרת 30% טחינה 600 גר`,שטראוס גרופ בעמ/מצונן,יח`,,1,14.90,2.48
2042,מעדן ג`לי בטעם פטל חלבי שטראוס (125 גרם,שטראוס גרופ בעמ/מצונן,יח`,,1,2,1.60
2043,יטבתה פרו קפה ללא סוכר 250 מל,שטראוס גרופ בעמ/מצונן,יח`,,1,4.90,1.96
2044,דנונה פרו 20 גר` חלבון,שטראוס גרופ בעמ/מצונן,יח`,,1,5.90,2.95
2045,מארז טורקי לדרך עם הל 168 גר`,שטראוס גרופ בעמ,יח`,,1,17.90,10.65
2046,בפלות אצבעות בלונדי קרמל מלוח 120  גר`על,שטראוס גרופ בעמ,יח`,,1,11.90,9.92
2047,בפלות אצבעות פסק זמן מריר 120  גר`עלית,שטראוס גרופ בעמ,יח`,,1,11.90,9.92
2048,קפסולות קפה עלית קולומביה 08,שטראוס גרופ בעמ,יח`,,1,16.90,33.80
2049,דנונה פרו 200 גר` תות,שטראוס גרופ בעמ/מצונן,יח`,,1,5.90,2.95
2050,צנצנת בוקסי מנטה אקליפטוס 64 גר` עלית,שטראוס גרופ בעמ,יח`,,1,9.90,15.47
2051,קצפת צמחית 21% שומן 250 מל יטבתה,שטראוס גרופ בעמ/מצונן,יח`,,1,7.50,3
2052,משקה יטבתה פרו וניל 350 מל,שטראוס גרופ בעמ/מצונן,יח`,,1,6.50,1.86
2053,קונפיטורת פירות יער במתיקות מעודנת 265 ג,שטראוס גרופ בעמ,יח`,,1,14.90,5.62
2054,רוטב לעוף גריל (310 גר`) יד מרדכי,שטראוס גרופ בעמ,יח`,,1,14.90,4.81
2055,מטליות לאמבטיה ושירותים ריח לבנדר 40 יח,שקד תבל בעמ,יח`,,1,8.90,8.90
2056,מפיות אירוח איכותיות ונעימות למגע ניקול,קימברלי קלארק ישראל שיווק בעמ,יח`,,1,8.90,8.90
2057,מטליות לחות אנטיבקטריאלי,קימברלי קלארק ישראל שיווק בעמ,יח`,,1,12.90,12.90
2058,מפיות אירוח איכותיות צבעוני - ניקול,קימברלי קלארק ישראל שיווק בעמ,יח`,,1,8.90,8.90
2059,רסק תפוחי עץ טבעי בצנצנת 670 גר קלית גת,ליימן שליסל בעמ,יח`,,1,11.90,1.78
2060,ממרח עוגיות בטעם קרמל 400 גר` צ`וקטה,ליימן שליסל בעמ,יח`,,1,16.90,4.23
2061,שוקולד מריר 48% אריזת חמיישיה צו`קטה,ליימן שליסל בעמ,יח`,,1,16.90,3.38
2062,חטיפי מיניס בוטנים וקרמל 180 גר`,ליימן שליסל בעמ,יח`,,1,7.90,4.39
2063,סוכריות גומי נחשים 800  גר`יוגטה,ליימן שליסל בעמ,יח`,,1,19.90,2.49
2064,ביסקוויט סנדוויץ בטעם שוקולד במילוי קרם,ליימן שליסל בעמ,יח`,,1,5.90,3.35
2065,צ`וקטה אצבעות שוקולד 100 גר`,ליימן שליסל בעמ,יח`,,1,5.90,0.06
2066,תערובת אגוזים קלויים ללא מלח 150 גר` קלי,ליימן שליסל בעמ,יח`,,1,19.90,13.27
2067,עלי וופל דקים בטעם חמאה 100 גר` צוקטה,ליימן שליסל בעמ,יח`,,1,9.90,9.90
2068,שוקולד חלב צ`וקטה (90x3 גר`) מארז שליישי,ליימן שליסל בעמ,יח`,,1,9.90,3.67
2069,גלילי וופל בציפוי שוקולד חלב 180 גר` צוק,ליימן שליסל בעמ,יח`,,1,9.90,5.50
2070,ממרח חלב וממרח אגוזי לוז 700  גר`צוקטה,ליימן שליסל בעמ,יח`,,1,17.90,2.56
2071,וופל במילוי קרמל 175 גר` צוקטה,ליימן שליסל בעמ,יח`,,1,9.90,5.66
2072,ביסקוויט במילוי קרם בטעם וניל בציפוי שו,ליימן שליסל בעמ,יח`,,1,9.90,6.60
2073,וופל חמאה בציפוי שוקולד מריר מעולה 110 ג,ליימן שליסל בעמ,יח`,,1,9.90,9
2074,עוגיות דלי אצבע שוקולד 600 גר`,שיבולים יצור ושיווק מוצרי מאפה,יח`,,1,11.90,1.98
2075,שיבולים עוגיות בדלי 500 גר,שיבולים יצור ושיווק מוצרי מאפה,יח`,,1,11.90,2.38
2076,עוגיות בדלי שיבולת שועל גרנולה 500 גר`,שיבולים יצור ושיווק מוצרי מאפה,יח`,,1,11.90,1.98
2077,קמח תופח עם 30% חיטה מלאה 1 קג אסם,קבוצת אסם סחר שות. מוגבלת,יח`,,1,11.90,1.19
2078,סלט מטבוחה חריפה מרובע 400 גר` צבר,קבוצת אסם סחר שות. מוגבלת,יח`,,1,10.90,2.73
2079,פיטנס פריכיות 3 דגנים דקות 120 גר` אסם,קבוצת אסם סחר שות. מוגבלת,יח`,,1,11.90,9.92
2080,פיטנס פריכיות דקות עם קינואה 120 גר` אסם,קבוצת אסם סחר שות. מוגבלת,יח`,,1,11.90,9.92
2081,פסטה פרפקטו קנלוני 500 גר` אסם,קבוצת אסם סחר שות. מוגבלת,יח`,,1,10.90,2.18
2082,אוראו מאגדת סנדביץ,נגה גלידות שותפות מוגבלת,יח`,,1,24.90,12.58
2083,חטיפי תירס 657 גר` טבעול,קבוצת אסם סחר שות. מוגבלת,יח`,,1,29.90,4.55
2084,חזה בגריל צמחוני 99 קלוריות 560 גר` טבע,קבוצת אסם סחר שות. מוגבלת,יח`,,1,32.90,5.88
2085,המבורגר צמחוני 99 קלוריות 600 גר` טבעול,קבוצת אסם סחר שות. מוגבלת,יח`,,1,32.90,5.48
2086,נודלס אטריות להקפצה 350  גר`אסם,קבוצת אסם סחר שות. מוגבלת,יח`,,1,9.90,2.83
2087,נודלס אטריות עם תרד 300  גר`אסם,קבוצת אסם סחר שות. מוגבלת,יח`,,1,9.90,3.30
2088,נודלס אטריות ביצים רחבות מאוד 400  גר`אס,קבוצת אסם סחר שות. מוגבלת,יח`,,1,9.90,2.48
2089,פרורית פנקו 300  גר`אסם,קבוצת אסם סחר שות. מוגבלת,יח`,,1,7.90,2.63
2090,רוטב טריאקי מופחת נתרן  וסוכר( 290 מל),קבוצת אסם סחר שות. מוגבלת,יח`,,1,12.90,12.90
2091,רוטב אסייתי למוקפץ 290 מל אסם,קבוצת אסם סחר שות. מוגבלת,יח`,,1,14.90,5.14
2092,משחת שיניים קולגייט טוטל קילן מינט זוג כ,ש.שסטוביץ בעמ,יח`,,1,28.90,14.45
2093,אטריות להקפצה 350  גר`מאסטר שף,ש.שסטוביץ בעמ,יח`,,1,7.90,2.26
2094,משחת שיניים קולגייט טוטל הלבנה 100 זוכ כ,ש.שסטוביץ בעמ,יח`,,1,28.90,14.45
2095,פרי חטיפי בריאות מארז 5 תמרים קשיו ונגיע,ש.שסטוביץ בעמ,יח`,,1,17.90,14.32
2096,פוף לבבות קלאסי 50 גר` כשר לפסח,ש.שסטוביץ בעמ,יח`,,1,3.90,7.80
2097,דטול תרסיס לניקוי כללי 750 מל,רקיט בנקיזר (ניר איסט) בעמ,יח`,,1,14.90,1.99
2098,קולון מנקה מכונות לימון 250 מל,רקיט בנקיזר (ניר איסט) בעמ,יח`,,1,19.90,19.90
2099,פיניש מנקה מחדש בריח לימון,רקיט בנקיזר (ניר איסט) בעמ,יח`,,1,20.90,20.90
2100,סיליט באנג אמבטיות 750 מל,רקיט בנקיזר (ניר איסט) בעמ,יח`,,1,9.90,1.32
2101,קולון ג`ל 2.5 ליטר כביסה מרוכז סגול,רקיט בנקיזר (ניר איסט) בעמ,יח`,,1,24.90,24.90
2102,קולון ג`ל 2.5 ליטר בניחוח מרענן ירוק,רקיט בנקיזר (ניר איסט) בעמ,יח`,,1,24.90,24.90
2103,איירוויק ג`ל מוצק בניחוח לבנדר,רקיט בנקיזר (ניר איסט) בעמ,יח`,,1,14.90,14.90
2104,שמן זית כתית מעולה 750 מל בדצ,א.ג בחירה חכמה בעמ,יח`,,1,19.90,19.90
2105,דנונה פרו 200 גר` וניל 0% שומן,שטראוס גרופ בעמ/מצונן,יח`,,1,5.90,2.95
2106,דנונה פרו 200 גר` פירות יער 0% שומן,שטראוס גרופ בעמ/מצונן,יח`,,1,5.90,2.95
2107,רבע לשבע טורטית 120 גר עלית,שטראוס גרופ בעמ,יח`,,1,12.90,10.75
2108,פריכיות משולשות -אורז בתיבול סלק ומלח ים,שטראוס גרופ בעמ,יח`,,1,5.90,19.67
2109,עוגיות קרם פסק זמן אגוזים 200 גר` עלית,שטראוס גרופ בעמ,יח`,,1,10.90,5.45
2110,סלט כרובית בטחינה 330 גר` אחלה,שטראוס גרופ בעמ/מצונן,יח`,,1,16.50,5
2111,שוקולית אבקת שוקו עלית,שטראוס גרופ בעמ,יח`,,1,18.50,1.98
2112,מרשמלו טעם וניל 150 גר,שטראוס גרופ בעמ,יח`,,1,6.90,4.60
2113,חטיף תירס בטעם חמוץ חריף צ`יטוס (80 גרם),שטראוס פריטו ליי בעמ,יח`,,1,4.50,5.63
2114,פריכיות הטעימות קצח ודגנים 135,שטראוס גרופ בעמ,יח`,,1,12.90,9.56
2115,הפריכות הטעימות פוטטוס 135 גר`,שטראוס גרופ בעמ,יח`,,1,12.90,9.56
2116,סוכריות ללא סוכר מנגו 80 גר` מאסט,שטראוס גרופ בעמ,יח`,,1,8.90,11.13
2117,עד חצות סנדוויץ 135  גר`עלית,שטראוס גרופ בעמ,יח`,,1,10.90,8.07
2118,מאסט סוכריות לימון 80 גר ללא סוכר,שטראוס גרופ בעמ,יח`,,1,8.90,11.13
2119,דנונה פרו 21% חלבון 0,שטראוס גרופ בעמ/מצונן,יח`,,1,5.90,2.95
