,ItemName,ManufactureName,UnitQty,Quantity,QtyInPackage,ItemPrice,UnitOfMeasurePrice
2420,סמיון לבן אפרת (1 ליטר),יקב טפרברג 1870 בעמ (יינות ומש,יח`,,1,19.90,1.96
2421,פריגת 1.5 ליטר,החברה המרכזית להפצת משקאות בעמ,יח`,,1,7.40,4.93
2422,משקה אורנג` מנגו פאנטה (1.5 ליטר),החברה המרכזית להפצת משקאות בעמ,יח`,,1,7.90,5.27
2423,בירה רד לייבל טובורג (330x6 מל),החברה המרכזית להפצת משקאות בעמ,יח`,,1,43.80,21.21
2424,בקבוק זירו קוקה-קולה (1.5 ליטר),החברה המרכזית להפצת משקאות בעמ,יח`,,1,7.10,4.73
2425,מארז זירו קוקה-קולה (1.5x6 ליטר),החברה המרכזית להפצת משקאות בעמ,יח`,,1,38.90,4.32
2426,שקיות אשפה לפח מטבח 65x52 גלילונית (40),דנשר (1963) בעמ,יח`,,1,17.30,0.43
2427,שקיות אשפה לפח ענק 90x75 גלילונית (50),דנשר (1963) בעמ,יח`,,1,17.30,17.30
2428,תחליף חלב שלב 3 מהדרין מטרנה (700 גרם),קבוצת אסם סחר שות. מוגבלת,יח`,,1,57.10,8.16
2429,פריכיות אורז שלישיה,בטר אנד דיפרנט בעמ,יח`,,1,13.50,4.50
2430,בטר פצפוצי אורז מלא 450  גר`ללא גלוטן,בטר אנד דיפרנט בעמ,יח`,,1,15.50,3.44
2431,ציפוי לשניצל פריך ללא גלוטן 300 גר`,בטר אנד דיפרנט בעמ,יח`,,1,9.10,3.03
2432,שלווה מצופה בדבש בשקית,בטר אנד דיפרנט בעמ,יח`,,1,13.50,3.38
2433,סירופ אפרסק 1.2 ליטר,בטר אנד דיפרנט בעמ,יח`,,1,21.70,18.08
2434,כורכום תבליני מימון (100 גרם),א.ל.ייצור ושיווק תבלינים בעמ,יח`,,1,13.20,13.20
2435,כמון טחון תבליני מימון (100 גרם),א.ל.ייצור ושיווק תבלינים בעמ,יח`,,1,13.20,13.20
2436,פלפל לבן טחון תבליני מימון (100 גרם),א.ל.ייצור ושיווק תבלינים בעמ,יח`,,1,21.40,21.40
2437,פלפל שחור טחון תבליני מימון (100 גרם),א.ל.ייצור ושיווק תבלינים בעמ,יח`,,1,17.30,17.30
2438,פלפל שחור גרוס גס תבליני מימון (90 גרם),א.ל.ייצור ושיווק תבלינים בעמ,יח`,,1,17.30,19.22
2439,פפריקה הונגרית מתוקה 100 גר`,א.ל.ייצור ושיווק תבלינים בעמ,יח`,,1,13.20,13.20
2440,פפריקה הונגרית חריפה 100 גר`,א.ל.ייצור ושיווק תבלינים בעמ,יח`,,1,13.20,13.20
2441,פפריקה מרוקאית מתוקה 100 גר`,א.ל.ייצור ושיווק תבלינים בעמ,יח`,,1,13.20,13.20
2442,פפריקה מרוקאית חריפה 100 גר`,א.ל.ייצור ושיווק תבלינים בעמ,יח`,,1,13.20,13.20
2443,קינמון טחון תבליני מימון (100 גרם),א.ל.ייצור ושיווק תבלינים בעמ,יח`,,1,12.20,12.20
2444,צ`ילי גרוס תבליני מימון (70 גרם),א.ל.ייצור ושיווק תבלינים בעמ,יח`,,1,13.20,18.86
2445,תיבול על האש 100 גר`,א.ל.ייצור ושיווק תבלינים בעמ,יח`,,1,13.20,13.20
2446,זעתר ושומשום בלדי תבליני מימון (100 גרם),א.ל.ייצור ושיווק תבלינים בעמ,יח`,,1,13.20,13.20
2447,תבלין מדראס קארי תבליני מימון (100 גרם),א.ל.ייצור ושיווק תבלינים בעמ,יח`,,1,13.20,13.20
2448,בזיליקום תבליני מימון (40 גרם),א.ל.ייצור ושיווק תבלינים בעמ,יח`,,1,12.20,24.40
2449,טימין הררי תבליני מימון (40 גרם),א.ל.ייצור ושיווק תבלינים בעמ,יח`,,1,12.20,24.40
2450,עלי דפנה תבליני מימון (20 גרם),א.ל.ייצור ושיווק תבלינים בעמ,יח`,,1,12.20,61
2451,שום גבישי תבליני מימון (120 גרם),א.ל.ייצור ושיווק תבלינים בעמ,יח`,,1,16.30,13.58
2452,פפריקה מרוקאית מתוקה 400 גר`,א.ל.ייצור ושיווק תבלינים בעמ,יח`,,1,26.50,6.63
2453,עלי דפנה שקית תבליני מימון (20 גרם),א.ל.ייצור ושיווק תבלינים בעמ,יח`,,1,7.10,35.50
2454,פפריקה מתוקה תבליני מימון (80 גרם),א.ל.ייצור ושיווק תבלינים בעמ,יח`,,1,7.10,8.88
2455,כמון טחון תבליני מימון (50 גרם),א.ל.ייצור ושיווק תבלינים בעמ,יח`,,1,7.10,14.20
2456,תבלין לגריל עוף תבליני מימון (80 גרם),א.ל.ייצור ושיווק תבלינים בעמ,יח`,,1,7.10,8.88
2457,מלח לימון תבליני מימון (100 גרם),א.ל.ייצור ושיווק תבלינים בעמ,יח`,,1,7.10,7.10
2458,אורגנו תבליני מימון (20 גרם),א.ל.ייצור ושיווק תבלינים בעמ,יח`,,1,7.10,35.50
2459,עוגיות חמאה פריכות לחמי (250 גרם),תה ויסוצקי (ישראל) בעמ,יח`,,1,19.30,7.72
2460,עוגיות מלבן שקדים לחמי (250 גרם),תה ויסוצקי (ישראל) בעמ,יח`,,1,19.30,6.89
2461,עוגיות נסיכה לחמי (250 גרם),תה ויסוצקי (ישראל) בעמ,יח`,,1,19.30,7.72
2462,בזיליקום א.אדמה,א.אדמה (2007) בעמ,יח`,,1,4.90,4.90
2463,סלט ביבי מיקס בנספק,א.אדמה (2007) בעמ,יח`,,1,7.90,7.90
2464,לבבות חסה קיסר,א.אדמה (2007) בעמ,יח`,,1,10.10,10.10
2465,רוזמרין ארוז,א.אדמה (2007) בעמ,יח`,,1,4.10,4.10
2466,טימין / קורנית,א.אדמה (2007) בעמ,יח`,,1,4.90,4.90
2467,תרד עלים אורגני א.אדמה,א.אדמה (2007) בעמ,יח`,,1,8.90,4.94
2468,סלרי ראש.,א.אדמה (2007) בעמ,יח`,,1,5,1.67
2469,לוף ארוז - א.אדמה,א.אדמה (2007) בעמ,יח`,,1,10.10,10.10
2470,סלרי חתוך,א.אדמה (2007) בעמ,יח`,,1,6.10,6.10
2471,לבבות חסה בשקית,א.אדמה (2007) בעמ,יח`,,1,9.90,9.90
2472,חסה סלנובה,א.אדמה (2007) בעמ,יח`,,1,10.10,10.10
2473,מחית פרינוק תפו,גורי מוצרי צריכה (1991) בעמ,יח`,,1,5.70,4.38
2474,מחית פרינוק סלט,גורי מוצרי צריכה (1991) בעמ,יח`,,1,5.70,4.38
2475,מחית תפוחי עץ שלב 3 פרינוק (190 גרם),גורי מוצרי צריכה (1991) בעמ,יח`,,1,6.70,3.53
2476,מחית פרינוק 190 גר`,גורי מוצרי צריכה (1991) בעמ,יח`,,1,6.70,3.53
2477,מחית פרינוק 190  גר`פרי טרופי,גורי מוצרי צריכה (1991) בעמ,יח`,,1,6.70,3.53
2478,פילטונה בשמן רביעיה,פילטונה תעשיות בעמ,יח`,,1,19.90,19.90
2479,פילטונה במים רביעיה,פילטונה תעשיות בעמ,יח`,,1,19.90,3.11
2480,פילטונה בשמן קנולה רביעיה,פילטונה תעשיות בעמ,יח`,,1,19.90,3.11
2481,פילטונה נתחי טונה בשמן זית רביעייה,פילטונה תעשיות בעמ,יח`,,1,26.90,4.20
2482,טונה בשמן 960  גר` פרינס(פילטונה),פילטונה תעשיות בעמ,יח`,,1,27.50,2.86
2483,חטיף תירס חריף אש דוריטוס (70 גרם),שטראוס פריטו ליי בעמ,יח`,,1,4,5.71
2484,חטיף צ`יפס בטעם טבעי תפוצ`יפס (40x6 גרם),שטראוס פריטו ליי בעמ,יח`,,1,13.20,5.50
2485,סטייק בורגר 400  גר`בלדי,בלדי בעמ,יח`,,1,16.90,4.23
2486,שניצל בקר מלינסה אל מטאדור 250 גר`,בלדי בעמ,יח`,,1,12.90,5.16
2487,סינטה בקר דק דק אל מטאדור 250 גר`,בלדי בעמ,יח`,,1,15.90,6.36
2488,עוגיות רייף 350  גר`אנג`ל,שיבולים יצור ושיווק מוצרי מאפה,יח`,,1,15.30,4.37
2489,עוגיות לקפה 350  גר`אנג`ל,שיבולים יצור ושיווק מוצרי מאפה,יח`,,1,15.30,4.37
2490,עוגיות מלוח ארוך 350  גר`רוסטיקו,שיבולים יצור ושיווק מוצרי מאפה,יח`,,1,15.30,4.37
2491,עוגיות מרוקאיות 350  גר`אנגל,שיבולים יצור ושיווק מוצרי מאפה,יח`,,1,15.30,4.37
2492,עוגת קרנץ טעם שוקולד 500 גר`,שיבולים יצור ושיווק מוצרי מאפה,יח`,,1,13.90,2.78
2493,עוגיות רוגלך טעם שוקולד 400 גר`,שיבולים יצור ושיווק מוצרי מאפה,יח`,,1,12.90,3.23
2494,ג`ריש 500 גר` מיה,מיה תעשיות מזון מ.ת.מ. בעמ,יח`,,1,6.40,1.28
2495,חומץ טבעי מיה (1 ליטר),מיה תעשיות מזון מ.ת.מ. בעמ,יח`,,1,8.10,8.10
2496,ציפוי לשניצל עם עשבי תיבול 500 גר` מיה,מיה תעשיות מזון מ.ת.מ. בעמ,יח`,,1,12.20,2.44
2497,ציפוי לשניצל עם תיבול עדין מיה (500 גרם),מיה תעשיות מזון מ.ת.מ. בעמ,יח`,,1,12.20,2.44
2498,ריבת חלב מיה (400 גרם),מיה תעשיות מזון מ.ת.מ. בעמ,יח`,,1,15.20,5.07
2499,ריבת חלב בטעם שמנת 400 גר`,מיה תעשיות מזון מ.ת.מ. בעמ,יח`,,1,15.20,3.80
2500,אורז בסמטי בסגנון הודי מיה (1 קג),מיה תעשיות מזון מ.ת.מ. בעמ,יח`,,1,10.10,1.01
2501,אורז ריזוטו עגול 1 קג,מיה תעשיות מזון מ.ת.מ. בעמ,יח`,,1,12.50,12.50
2502,סחוג תימני תבליני ביטון יוחאי (250 גרם),נטו מלינדה סחר בעמ,יח`,,1,15.20,6.08
2503,לימון בלאדי תבליני ביטון יוחאי (250 גרם),נטו מלינדה סחר בעמ,יח`,,1,16.60,6.64
2504,אריסה מתוקה תבליני ביטון יוחאי (250 גרם),נטו מלינדה סחר בעמ,יח`,,1,15.60,6.24
2505,סלט חזרת ביתית תבליני ביטון יוחאי (250 ג,נטו מלינדה סחר בעמ,יח`,,1,15.20,6.08
2506,פלפל צ`ומה תבליני ביטון יוחאי (250 גרם),נטו מלינדה סחר בעמ,יח`,,1,16.30,6.52
2507,מרלו יקב הרי גליל (750 מל),היכל היין שקד גולן בעמ,יח`,,1,35.60,4.71
2508,קברנה סובניון יקב הרי גליל (750 מל),היכל היין שקד גולן בעמ,יח`,,1,37.70,4.99
2509,שיראז יקב הרי גליל (750 מל),היכל היין שקד גולן בעמ,יח`,,1,35.60,4.71
2510,פפסי מקס שמיניה,טמפו משקאות בעמ,יח`,,1,30.50,2.54
2511,פפסי קול מקס 500 מל,טמפו משקאות בעמ,יח`,,1,4,0.74
2512,בירה שחורה נשר מאלט (1.5 ליטר),טמפו משקאות בעמ,יח`,,1,7.70,0.51
2513,בירה שחורה דיאט נשר מאלט (1.5 ליטר),טמפו משקאות בעמ,יח`,,1,7.70,5.13
2514,בירה הייניקן 330 בקבוק,טמפו משקאות בעמ,יח`,,1,10.30,3.03
2515,בירה שנדי למון ליים מכבי (330x6 מל),טמפו משקאות בעמ,יח`,,1,37.90,1.82
2516,בירה היינקן (500 מל),טמפו משקאות בעמ,יח`,,1,8.90,1.54
2517,נודלס ביצים להקצפה וילי פוד (200 גרם),ג.וילי-פוד אינטרנשיונל בעמ,יח`,,1,5,2.50
2518,נודלס מסולסלות וילי פוד (200 גרם),ג.וילי-פוד אינטרנשיונל בעמ,יח`,,1,5,2.50
2519,מרגרינה ללא מלח וילי פוד (200 גרם),ג.וילי-פוד אינטרנשיונל בעמ,יח`,,1,3,1.50
2520,צנימים וילי פוד (250 גרם),ג.וילי-פוד אינטרנשיונל בעמ,יח`,,1,9.10,3.64
2521,שקית 10 מודפס,שמחה זה אנחנו בעמ,יח`,,1,8.90,8.90
2522,טחינה משומשום מלא אחוה (500 גרם),אחדות בעמ,יח`,,1,11.20,2.24
2523,טחינה משומשום טבעי אחוה (500 גרם),אחדות בעמ,יח`,,1,11.20,2.24
2524,מיני חלווה ב 3 טעמים,אחדות בעמ,יח`,,1,10.20,4.72
2525,חטיפי מיני חלוה ללא סוכר 15 יח`,אחדות בעמ,יח`,,1,10.20,10.20
2526,עוגה בטעם שוקולד עם שוקוצ`יפס מריר ולבן,אחדות בעמ,יח`,,1,11.20,2.49
2527,קצפיות במגש 180 גר,אחדות בעמ,יח`,,1,10.10,5.61
2528,קונפיטורה יד מרדכי תות 250 גר`,שטראוס גרופ בעמ,יח`,,1,15.60,6.24
2529,דנונה פרי בר קורנפלקס,שטראוס גרופ בעמ/מצונן,יח`,,1,4.50,2.57
2530,משקה יוגורט תות בננה גמדים (100x8 מל),שטראוס גרופ בעמ/מצונן,יח`,,1,20.40,2.55
2531,דני שמיניה,שטראוס גרופ בעמ/מצונן,יח`,,1,16.80,16.80
2532,זוג  קופ`למשקפיים,קונסיגנציה- ש. י גיספאן 1993,יח`,,1,14.90,14.90
2533,סופר גלו חזק 3  יח`+  בק`נוזלי,קונסיגנציה- ש. י גיספאן 1993,יח`,,1,13.90,13.90
2534,קיסמי שיניים לבנבנים 200 יח`,קונסיגנציה- ש. י גיספאן 1993,יח`,,1,12.90,12.90
2535, סקוטץ`קוצים 2 יח`,קונסיגנציה- ש. י גיספאן 1993,יח`,,1,12.90,12.90
2536,גרנולה ללא תוספת סוכר 400 גר` מנדל,גורי מוצרי צריכה (1991) בעמ,יח`,,1,19.30,4.83
2537,גרנולה בסילאן ללא תוספות סוכר 400 גר` מנ,גורי מוצרי צריכה (1991) בעמ,יח`,,1,19.30,4.83
2538,טחינה ירושלים 500 גר`,תה ויסוצקי (ישראל) בעמ,יח`,,1,16.90,3.38
2539,טחינה ירושלים 500 גר` שומשום מלא,תה ויסוצקי (ישראל) בעמ,יח`,,1,16.90,16.90
2540,נובי כוס ומכסה 6 יח`,אינטרסן 1996 בעמ,יח`,,1,33.60,33.60
2541,נובי קערה ומכסה 6 יח`,אינטרסן 1996 בעמ,יח`,,1,36.90,36.90
2542,צימרוני אוזניים מעץ אינטרסן (300),אינטרסן 1996 בעמ,יח`,,1,3.80,0.01
2543,שעועית ירוקה שלמה 800 גר`,נ.ת.נ.ג.ב החזקות יעוץ וניהול ב,יח`,,1,6.80,0.85
2544,שעועית חתוכה ירוקה 800  גר`קפוא,נ.ת.נ.ג.ב החזקות יעוץ וניהול ב,יח`,,1,6.80,0.85
2545,אפונה קפוא 800 גר`,נ.ת.נ.ג.ב החזקות יעוץ וניהול ב,יח`,,1,9.90,1.24
2546,אפונה וגזר 800 גר`,נ.ת.נ.ג.ב החזקות יעוץ וניהול ב,יח`,,1,9.90,1.24
2547,לקט ירקות 800 גר` קפוא,נ.ת.נ.ג.ב החזקות יעוץ וניהול ב,יח`,,1,9.90,1.24
2548,4 כרות פלדה מתכת shiny,מ.א.ייצור ויבוא מטליות בעמ,יח`,,1,6.90,6.90
2549,גליל מטליות צהוב 40 יח shiny,מ.א.ייצור ויבוא מטליות בעמ,יח`,,1,17.90,17.90
2550,כף אשפה עם גומי,מ.א.ייצור ויבוא מטליות בעמ,יח`,,1,6.40,6.40
2551,דלי איטלקי עם פיה יוגב,מ.א.ייצור ויבוא מטליות בעמ,יח`,,1,12.50,12.50
2552,מטליות מיקרו רצפה שלישייה shiny,מ.א.ייצור ויבוא מטליות בעמ,יח`,,1,21.40,21.40
2553,מטליות מיקרו לניקוי כללי מעוצבות shiny,מ.א.ייצור ויבוא מטליות בעמ,יח`,,1,8.90,8.90
2554,להבונים טיפ טופ פאלאס (50),פאלאס תעשיות נטו (2014) בעמ,יח`,,1,10.10,0.20
2555,פנינה אל סבון 1 ליטר ירוק,פנינה רוזנבלום בעמ,יח`,,1,11.50,11.50
2556,בורקס גבינה כשלפ 600 ג,מאפיית אריאל בעמ,יח`,,1,20.90,3.48
2557,רוטב פסטה בולונז 420 גר` אוליביה,גורי מוצרי צריכה (1991) בעמ,יח`,,1,16.30,3.88
2558,רוטב שקשוקה אוליביה (415 גרם),גורי מוצרי צריכה (1991) בעמ,יח`,,1,17.30,4.17
2559,רוטב פיצה אוליביה (430 גרם),גורי מוצרי צריכה (1991) בעמ,יח`,,1,18.30,4.41
2560,פיתות במרקם מיוחד פיתה אקספרס) (8,מגוון שיווק והפצת מאפים בעמ,יח`,,1,10.10,1.26
2561,פיתות בריבוע חיטה מלאה פיתה אקספרס) (8,מגוון שיווק והפצת מאפים בעמ,יח`,,1,13.30,1.66
2562,פיתות בריבוע פיתה אקספרס) (10,מגוון שיווק והפצת מאפים בעמ,יח`,,1,13.30,1.33
2563,פיתות ביס פיתה אקספרס (10  יח`- 600 גרם),מגוון שיווק והפצת מאפים בעמ,יח`,,1,13.30,1330
2564,מארז פיתה קלה 79 קלוריות,מגוון שיווק והפצת מאפים בעמ,יח`,,1,12.50,12.50
2565,פיתות מכוסמין מלא פיתה אקספרס) (8,מגוון שיווק והפצת מאפים בעמ,יח`,,1,15.20,15.20
2566,סטיביה מרמולייט (100),דנשר (1963) בעמ,יח`,,1,28.90,0.29
2567,טואלט דאק 750 מל זוג,דנשר (1963) בעמ,יח`,,1,19.90,1.33
2568,די לואיג`י רוסו דולצ`ה 750 מל למברוסקו,הכרם - משקאות חריפים בעמ,יח`,,1,32.60,4.31
2569,די לואיג`י ביאנקו 750 מל למברוסקו,הכרם - משקאות חריפים בעמ,יח`,,1,34.60,4.57
2570,כפפות אלוורה גדול סנו סושי,החברה הדרומית לשיווק בעמ,יח`,,1,12.20,12.20
2571,כפפות אלוורה קטן סנו סושי,החברה הדרומית לשיווק בעמ,יח`,,1,13.50,13.50
2572,כפפות אלוורה בינוני סנו סושי,החברה הדרומית לשיווק בעמ,יח`,,1,12.20,12.20
2573,מטבוחה אחלה (500 גרם),שטראוס גרופ בעמ/מצונן,יח`,,1,15.60,3.12
2574,קוטג` 3% מועשר 250 גר`,החב` המרכזית - טרה,יח`,,1,5.50,2.20
2575,גבינה לבנה 3% 250 גר` פיקוח,החב` המרכזית - טרה,יח`,,1,4.75,1.90
2576,קוקה קולה זירו שישיה 1.75,החברה המרכזית להפצת משקאות בעמ,יח`,,1,37.80,3.60
2577,פחית קולה סליק קוקה-קולה (330 מל),החברה המרכזית להפצת משקאות בעמ,יח`,,1,4.50,1.27
2578,פחית זירו סליק קוקה-קולה (330 מל),החברה המרכזית להפצת משקאות בעמ,יח`,,1,4.50,1.27
2579,פחית דיאט קולה סליק קוקה-קולה (330 מל),החברה המרכזית להפצת משקאות בעמ,יח`,,1,4.50,1.27
2580,תה קר בטעם מנגו אננס פיוז-טי (1.5 ליטר),החברה המרכזית להפצת משקאות בעמ,יח`,,1,7.40,4.93
2581,תה קר בטעם אפרסק פיוז-טי (1.5 ליטר),החברה המרכזית להפצת משקאות בעמ,יח`,,1,7.40,0.49
2582,תה קר דיאט בטעם אפרסק פיוז-טי (1.5 ליטר),החברה המרכזית להפצת משקאות בעמ,יח`,,1,7.40,0.49
2583,פיוז תה אפרסק רביעיה,החברה המרכזית להפצת משקאות בעמ,יח`,,1,28.90,28.90
2584,משקה מוגז אורנג` פאנטה (330 מל),החברה המרכזית להפצת משקאות בעמ,יח`,,1,4.50,1.27
2585,סיידר אלכוהולי 4.5% סומרסבי (330 מל),החברה המרכזית להפצת משקאות בעמ,יח`,,1,10.10,2.97
2586,תה קר בטעם ענבים פיוז-טי (1.5 ליטר),החברה המרכזית להפצת משקאות בעמ,יח`,,1,7.40,4.93
2587,סרקל שמפו+מרכך 1 ליטר,פישר תעשיות פרמצבטיות בעמ,יח`,,1,29.50,2.95
2588,קריסטל 2 ליטר אשכוליות מוגז,יפאורה,יח`,,1,4.20,2.10
2589,מי סודה בטעם לימון שוופס (1.5x4 ליטר),יפאורה,יח`,,1,11,1.83
2590,שוופס מוגז עדין 1.5 ליטר פירות יער,יפאורה,יח`,,1,7.50,0.50
2591,משקה מוגז עדין אפרסק שוופס (1.5 ליטר),יפאורה,יח`,,1,7.50,0.50
2592,תה ירוק לימון לואיזה ספרינג (1.5 ליטר),יפאורה,יח`,,1,6.70,4.47
2593,ספרינג תה קר 0.5 ליטר אפרסק,יפאורה,יח`,,1,5.50,1.04
2594,משקה קל תפוחים תפוזינה (1.5 ליטר),יפאורה,יח`,,1,6.90,0.46
2595,בולגרית בעיר מעדן גבינה למריחה 200 גרם,הגבינות של ניצן,יח`,,1,14.20,7.10
2596,פלפלוני שרי ממולא בגבינה 125 גר,הגבינות של ניצן,יח`,,1,21.40,17.12
2597,מעדן פתיתי בולגרית פסטו 200 גר`,הגבינות של ניצן,יח`,,1,18.30,9.15
2598,שטראוס קרמיסימו בטעמי 3 שוקלד,גלידות שטראוס בעמ,יח`,,1,20.50,15.41
2599,שטראוס קרמיסימו,גלידות שטראוס בעמ,יח`,,1,20.50,15.41
2600,שמיר מהדרין,א.אדמה (2007) בעמ,יח`,,1,4.90,4.90
2601,נענע גוש,א.אדמה (2007) בעמ,יח`,,1,4.90,4.90
2602,תחליב רחצה לבנדר נקה  (17 ליטר),החברה הדרומית לשיווק בעמ,יח`,,1,14.20,14.20
2603,תה קמומיל ונענע ויסוצקי הגן הקסום) (25,תה ויסוצקי (ישראל) בעמ,יח`,,1,17.90,47.73
2604,תה ירוק מרווה ויסוצקי) (25,תה ויסוצקי (ישראל) בעמ,יח`,,1,28.30,75.47
2605,תה ירוק ארל גריי ויסוצקי) (25,תה ויסוצקי (ישראל) בעמ,יח`,,1,28.30,75.47
2606,מוזלי קראנצ`י שקדים ואגוזים גרין (1 קג),משה סידס ובנו בעמ,יח`,,1,28.50,28.50
2607,גרין מוזלי 30% פירות מופחת שומן 1 קג,משה סידס ובנו בעמ,יח`,,1,28.50,2.85
2608,גרין מוזלי אגוזים ושקדים מופחת שומן 1 ק,משה סידס ובנו בעמ,יח`,,1,28.50,2.85
2609,גרנולה בתוספת שקדים ואגוזים גרין (1 קג),משה סידס ובנו בעמ,יח`,,1,28.40,28.40
2610,בירה פאולנר רביעיות,טמפו משקאות בעמ,יח`,,1,50.90,3.77
2611,סודה לימון ליים 1.5בודד,טמפו משקאות בעמ,יח`,,1,4.10,2.73
2612,סודה לימון ליים 1.5 רביעייה,טמפו משקאות בעמ,יח`,,1,12.20,2.03
2613,בירה שנדי תפוח מכבי (330x6 מל),טמפו משקאות בעמ,יח`,,1,37.90,1.82
2614,בירה שנדי אפרסק מכבי (330x6 מל),טמפו משקאות בעמ,יח`,,1,37.90,1.82
2615,עוגה  מלבנית- חגיגה של עוגה 850 גר.,קפולסקי אדל בעמ,יח`,,1,64.20,7.55
2616,דניאלה מעדן בטעם בננה שטראוס (88 גרם),שטראוס גרופ בעמ/מצונן,יח`,,1,4.10,2.73
2617,גבינת  קוטג`5% שטראוס (250 גרם),שטראוס גרופ בעמ/מצונן,יח`,,1,6.10,2.44
2618,בישקוטים ליידיפינגרז בונומי (200 גרם),דנשר (1963) בעמ,יח`,,1,8.40,4.20
2619,גלילונית שקיות לסנדוויץ 350 יח,דנשר (1963) בעמ,יח`,,1,12.20,12.20
2620,ריבת חלב דולכור (454 גרם),דנשר (1963) בעמ,יח`,,1,18.60,4.10
2621,ופל בלגי בטעם לימון 200  גר`המותג,דין שיווק - עטרת,יח`,,1,5,2.50
2622,זרעי פשתן 450 גר`,מיה תעשיות מזון מ.ת.מ. בעמ,יח`,,1,10.50,2.33
2623,קינואה מיה (500 גרם),מיה תעשיות מזון מ.ת.מ. בעמ,יח`,,1,21.40,4.28
2624,תערובת לקדירה לקט הכפר 600 גר`,מיה תעשיות מזון מ.ת.מ. בעמ,יח`,,1,14.50,2.42
2625,ג`לטין טהור 25 גר`,מיה תעשיות מזון מ.ת.מ. בעמ,יח`,,1,12.90,51.60
2626,שעועית שחורה 500  גר`מיה,מיה תעשיות מזון מ.ת.מ. בעמ,יח`,,1,12.50,2.50
2627,שעועית ארגנטינאית מיה (500 גרם),מיה תעשיות מזון מ.ת.מ. בעמ,יח`,,1,13.20,2.64
2628,שעועית ארגנטינאית 1 קג,מיה תעשיות מזון מ.ת.מ. בעמ,יח`,,1,20.90,20.90
2629,חלבה בארכה ללא סוכר 350 גר`,קבוצת אסם סחר שות. מוגבלת,יח`,,1,16.30,4.66
2630,מאגדת חלבה וניל,קבוצת אסם סחר שות. מוגבלת,יח`,,1,13.20,13.20
2631,מאגדת חלבה פיסטוק,קבוצת אסם סחר שות. מוגבלת,יח`,,1,13.20,13.20
2632,דבש מפרחי בר בלחיץ 650 גר`,שטראוס גרופ בעמ,יח`,,1,44.80,6.89
2633,תחליף חלב שלב 1 חלבי מטרנה (700 גרם),קבוצת אסם סחר שות. מוגבלת,יח`,,1,57.10,8.16
2634,תחליף חלב שלב 3 חלבי מטרנה (700 גרם),קבוצת אסם סחר שות. מוגבלת,יח`,,1,57.10,8.16
2635,גבינת פטה כבשים 20% גד (250 גרם),מחלבות גד שיווק 1992 בעמ,יח`,,1,27.90,11.16
2636,גבינה בולגרית 5% גד (250 גרם),מחלבות גד שיווק 1992 בעמ,יח`,,1,24.90,9.96
2637,גבינה בולגרית 16% גד (250 גרם),מחלבות גד שיווק 1992 בעמ,יח`,,1,24.90,9.96
2638,בולגרית לסלט 5% 200 גר`,מחלבות גד שיווק 1992 בעמ,יח`,,1,22.90,11.45
2639,פטה עיזים מעודנת 5% גד,מחלבות גד שיווק 1992 בעמ,יח`,,1,31.90,12.76
2640,גבינה בולגרית מעודנת 5% גד (250 גרם),מחלבות גד שיווק 1992 בעמ,יח`,,1,24.90,9.96
2641,גבינה פטה עיזים 20% גד (200 גרם),מחלבות גד שיווק 1992 בעמ,יח`,,1,27.90,13.95
2642,גבינת חלומי 24% מחלב בקר גד (200 גרם),מחלבות גד שיווק 1992 בעמ,יח`,,1,22.90,11.45
2643,גבינת במרקם שמנת 5% טבעי גד,מחלבות גד שיווק 1992 בעמ,יח`,,1,12.90,6.45
2644,לאבנה דרוזית 9% גד (500 גרם),מחלבות גד שיווק 1992 בעמ,יח`,,1,20.90,4.18
2645,גבינת שמנת 30% 200 גר` גד,מחלבות גד שיווק 1992 בעמ,יח`,,1,13.90,6.95
2646,גבינת ריקוטה פרסקה 9% גד (300 גרם),מחלבות גד שיווק 1992 בעמ,יח`,,1,18.90,6.30
