,ItemName,ManufactureName,UnitQty,Quantity,QtyInPackage,ItemPrice,UnitOfMeasurePrice
3371,עוגה בטעם שוקולד עם שוקוצ`יפס מריר ולבן,אחדות בעמ,יח`,,1,9.90,2.20
3372,קצפיות במגש 180 גר,אחדות בעמ,יח`,,1,8.90,4.94
3373,טחינה עם שוקולד 400 גר אחוה,אחדות בעמ,יח`,,1,11.90,2.98
3374,חטיף חלבה 50 גר` אחוה,אחדות בעמ,יח`,,1,1.50,1.50
3375,טחינה עם שוקולד 400 גר אחוה ללא תוספת ס,אחדות בעמ,יח`,,1,11.90,2.98
3376,אגו משפחתי דאבל שוקו בלמינט 130 גר` * 13,כרמית תעשיות ממתקים בעמ,יח`,,1,8.90,6.85
3377,דנונה פרי בר קורנפלקס,שטראוס גרופ בעמ/מצונן,יח`,,1,4.40,2.51
3378,משקה יוגורט תות בננה גמדים (100x8 מל),שטראוס גרופ בעמ/מצונן,יח`,,1,20,2.50
3379,דני שמיניה,שטראוס גרופ בעמ/מצונן,יח`,,1,16.40,16.40
3380,מברשת רחצה לגב,קונסיגנציה- ש. י גיספאן 1993,יח`,,1,15.90,15.90
3381,מברשת לצביעת שיער 3 יח`,קונסיגנציה- ש. י גיספאן 1993,יח`,,1,10.90,10.90
3382, סקוטץ`קוצים 2 יח`,קונסיגנציה- ש. י גיספאן 1993,יח`,,1,12.90,12.90
3383,טחינה ירושלים 500 גר`,תה ויסוצקי (ישראל) בעמ,יח`,,1,15.90,3.18
3384,כוס אימון+ידיות רכות,אינטרסן 1996 בעמ,יח`,,1,16,16
3385,מיכל לאבקות חלבי נובי,אינטרסן 1996 בעמ,יח`,,1,18.90,18.90
3386,מוצץ גומי 3 יח מיני קטן טוליפס,אינטרסן 1996 בעמ,יח`,,1,11.90,11.90
3387,צימרוני אוזניים מעץ אינטרסן (300),אינטרסן 1996 בעמ,יח`,,1,4,0.01
3388,שעועית ירוקה שלמה 800 גר`,נ.ת.נ.ג.ב החזקות יעוץ וניהול ב,יח`,,1,6.80,0.85
3389,שעועית חתוכה ירוקה 800  גר`קפוא,נ.ת.נ.ג.ב החזקות יעוץ וניהול ב,יח`,,1,6.80,0.85
3390,שעועית חתוכה צהובה,נ.ת.נ.ג.ב החזקות יעוץ וניהול ב,יח`,,1,6.80,0.85
3391,אפונה קפוא 800 גר`,נ.ת.נ.ג.ב החזקות יעוץ וניהול ב,יח`,,1,9.90,1.24
3392,אפונה וגזר 800 גר`,נ.ת.נ.ג.ב החזקות יעוץ וניהול ב,יח`,,1,9.90,1.24
3393,לקט ירקות 800 גר` קפוא,נ.ת.נ.ג.ב החזקות יעוץ וניהול ב,יח`,,1,9.90,1.24
3394,כרוב  על- קייל,א.אדמה (2007) בעמ,יח`,,1,10.90,10.90
3395,נרות יום  הולדת+ ברכה,שמחה זה אנחנו בעמ,יח`,,1,5.90,5.90
3396,מברשת אבק,מ.א.ייצור ויבוא מטליות בעמ,יח`,,1,14.90,14.90
3397,מיקרופייבר  לרצפות- shiny,מ.א.ייצור ויבוא מטליות בעמ,יח`,,1,9.90,9.90
3398,4 כרות פלדה מתכת shiny,מ.א.ייצור ויבוא מטליות בעמ,יח`,,1,5.90,5.90
3399,גליל מטליות צהוב 40 יח shiny,מ.א.ייצור ויבוא מטליות בעמ,יח`,,1,16.90,16.90
3400,4 מטליות מיקרו לניקוי כללי shiny,מ.א.ייצור ויבוא מטליות בעמ,יח`,,1,6.90,6.90
3401,כף אשפה עם גומי,מ.א.ייצור ויבוא מטליות בעמ,יח`,,1,5.90,5.90
3402,דלי איטלקי עם פיה יוגב,מ.א.ייצור ויבוא מטליות בעמ,יח`,,1,11.90,11.90
3403,שקיות אוכל מנייר 100 יח`,מ.א.ייצור ויבוא מטליות בעמ,יח`,,1,11.90,0.12
3404,מטליות מיקרו רצפה שלישייה shiny,מ.א.ייצור ויבוא מטליות בעמ,יח`,,1,19.90,19.90
3405,מטליות מיקרו לניקוי כללי מעוצבות shiny,מ.א.ייצור ויבוא מטליות בעמ,יח`,,1,7.90,7.90
3406,מטליות תשיעייה רב שימושיות פרימיום shiny,מ.א.ייצור ויבוא מטליות בעמ,יח`,,1,6.90,6.90
3407,להבונים טיפ טופ פאלאס (50),פאלאס תעשיות נטו (2014) בעמ,יח`,,1,9.90,0.20
3408,קרם גוף איזבלה ורוד פנינה,פנינה רוזנבלום בעמ,יח`,,1,17.90,4.48
3409,פנינה אל סבון 1 ליטר ירוק,פנינה רוזנבלום בעמ,יח`,,1,10.90,10.90
3410,פנינה אל סבון 1 ליטר לבן,פנינה רוזנבלום בעמ,יח`,,1,10.90,10.90
3411,קרם ידיים אפקטיב קר,פישר תעשיות פרמצבטיות בעמ,יח`,,1,18.90,12.60
3412,קרם ידיים אפקטיב קר,פישר תעשיות פרמצבטיות בעמ,יח`,,1,18.90,12.60
3413,אפקטיב קר קרם גוף 700 מל,פישר תעשיות פרמצבטיות בעמ,יח`,,1,29.90,4.27
3414,אפקטיב קר קרם גוף 700 מל,פישר תעשיות פרמצבטיות בעמ,יח`,,1,29.90,4.27
3415,רוטב שקשוקה אוליביה (415 גרם),גורי מוצרי צריכה (1991) בעמ,יח`,,1,15.90,3.83
3416,רוטב פיצה אוליביה (430 גרם),גורי מוצרי צריכה (1991) בעמ,יח`,,1,16.90,4.07
3417,פיתות ביס פיתה אקספרס (10  יח`- 600 גרם),מגוון שיווק והפצת מאפים בעמ,יח`,,1,12,1200
3418,מארז פיתה קלה 79 קלוריות,מגוון שיווק והפצת מאפים בעמ,יח`,,1,12.50,12.50
3419,פיתות מכוסמין מלא פיתה אקספרס) (8,מגוון שיווק והפצת מאפים בעמ,יח`,,1,14.90,14.90
3420,אגו טבלאות שוקולד מריר 85 גר` שלישייה,כרמית תעשיות ממתקים בעמ,יח`,,1,11.90,4.67
3421,אגו טבלאות שוקולד לבן 85 גר` שלישייה,כרמית תעשיות ממתקים בעמ,יח`,,1,11.90,4.67
3422,שוקולד מריר פרווה ללא סוכר 85 גרם,כרמית תעשיות ממתקים בעמ,יח`,,1,5.90,6.94
3423,שוקולד חלבי ללא סוכר 85 גרם,כרמית תעשיות ממתקים בעמ,יח`,,1,5.90,6.94
3424,סטיביה מרמולייט (100),דנשר (1963) בעמ,יח`,,1,27.90,0.28
3425,טואלט דאק 750 מל זוג,דנשר (1963) בעמ,יח`,,1,18.90,1.26
3426,די לואיג`י ביאנקו 750 מל למברוסקו,הכרם - משקאות חריפים בעמ,יח`,,1,31.90,4.21
3427,שניצל תירס 1 קג בדצ,קפוא-זן תעשיות מזון בעמ - תפוג,יח`,,1,18.90,1.89
3428,שניצל צמחי 1 קג בדצ,קפוא-זן תעשיות מזון בעמ - תפוג,יח`,,1,18.90,1.89
3429,מטבוחה אחלה (500 גרם),שטראוס גרופ בעמ/מצונן,יח`,,1,14.90,2.98
3430,קוטג` 3% מועשר 250 גר`,החב` המרכזית - טרה,יח`,,1,5.30,2.12
3431,גבינה לבנה 3% 250 גר` פיקוח,החב` המרכזית - טרה,יח`,,1,4.75,1.90
3432,גבינה לבנה 5% 500  גר`פיקוח,החב` המרכזית - טרה,יח`,,1,9.50,1.90
3433,סירופ דיאט לימונענע פריגת (750 מל),החברה המרכזית להפצת משקאות בעמ,יח`,,1,17.90,2.39
3434,פחית קולה סליק קוקה-קולה (330 מל),החברה המרכזית להפצת משקאות בעמ,יח`,,1,4.50,1.27
3435,פחית זירו סליק קוקה-קולה (330 מל),החברה המרכזית להפצת משקאות בעמ,יח`,,1,4.50,1.27
3436,תה קר בטעם מנגו אננס פיוז-טי (1.5 ליטר),החברה המרכזית להפצת משקאות בעמ,יח`,,1,7.20,4.80
3437,תה קר בטעם אפרסק פיוז-טי (1.5 ליטר),החברה המרכזית להפצת משקאות בעמ,יח`,,1,7.20,0.48
3438,תה קר דיאט בטעם אפרסק פיוז-טי (1.5 ליטר),החברה המרכזית להפצת משקאות בעמ,יח`,,1,7.20,0.48
3439,פיוז תה אפרסק רביעיה,החברה המרכזית להפצת משקאות בעמ,יח`,,1,27.90,27.90
3440,משקה מוגז אורנג` פאנטה (330 מל),החברה המרכזית להפצת משקאות בעמ,יח`,,1,4.50,1.27
3441,תה קר בטעם ענבים פיוז-טי (1.5 ליטר),החברה המרכזית להפצת משקאות בעמ,יח`,,1,7.20,4.80
3442,שישית פחיות קוקה קולה פרידג`פק,החברה המרכזית להפצת משקאות בעמ,יח`,,1,19.90,9.14
3443,שישיית פחיות קוקה קולה זירו,החברה המרכזית להפצת משקאות בעמ,יח`,,1,19.90,9.14
3444,סרקל שמפו+מרכך 1 ליטר,פישר תעשיות פרמצבטיות בעמ,יח`,,1,27.90,2.79
3445,קריסטל 2 ליטר אשכוליות מוגז,יפאורה,יח`,,1,3.80,1.90
3446,מי סודה בטעם לימון שוופס (1.5x4 ליטר),יפאורה,יח`,,1,11,1.83
3447,שוופס מוגז עדין 1.5 ליטר תפוח ליים,יפאורה,יח`,,1,6.90,0.46
3448,שוופס מוגז עדין 1.5 ליטר פירות יער,יפאורה,יח`,,1,6.90,0.46
3449,משקה מוגז עדין אפרסק שוופס (1.5 ליטר),יפאורה,יח`,,1,6.90,0.46
3450,תה קר אפרסק ספרינג (1.5 ליטר),יפאורה,יח`,,1,6.40,4.27
3451,תה ירוק לימון לואיזה ספרינג (1.5 ליטר),יפאורה,יח`,,1,6.40,4.27
3452,ספרינג תה קר 0.5 ליטר אפרסק,יפאורה,יח`,,1,5,0.94
3453,שוופס מוגז עדין 1.5 ליטר ענבים ריזלינג,יפאורה,יח`,,1,6.90,0.46
3454,משקה קל תפוחים תפוזינה (1.5 ליטר),יפאורה,יח`,,1,6.50,0.43
3455,לאבנה אבו גוש 200 גר,הגבינות של ניצן,יח`,,1,13.90,6.95
3456,פלפלוני שרי ממולא בגבינה 125 גר,הגבינות של ניצן,יח`,,1,19.90,15.92
3457,פלפל שחור מטחנות 60 גר,א.ל.ייצור ושיווק תבלינים בעמ,יח`,,1,16.90,28.17
3458,וניש מגבונים להסרת כתמים,רקיט בנקיזר (ניר איסט) בעמ,יח`,,1,14.90,7.45
3459,שטראוס קרמיסימו בטעמי 3 שוקלד,גלידות שטראוס בעמ,יח`,,1,18.90,14.21
3460,שטראוס קרמיסימו,גלידות שטראוס בעמ,יח`,,1,18.90,14.21
3461,זיקוקים 6 יח בשקית 15 סמ,שמחה זה אנחנו בעמ,יח`,,1,14.90,14.90
3462,סבון מוצק לחות נקה 7 רביעייה,החברה הדרומית לשיווק בעמ,יח`,,1,11.90,2.98
3463,תחליב רחצה לבנדר נקה  (17 ליטר),החברה הדרומית לשיווק בעמ,יח`,,1,12.90,12.90
3464,סבון מוצק נקה 7 רביעייה,החברה הדרומית לשיווק בעמ,יח`,,1,11.90,2.98
3465,סבון מוצק ארומה נקה 7 רביעייה,החברה הדרומית לשיווק בעמ,יח`,,1,11.90,2.98
3466,סבון מוצק לחות נקה 7 רביעייה,החברה הדרומית לשיווק בעמ,יח`,,1,11.90,2.98
3467,סבון מוצק לחות נקה 7 רביעייה,החברה הדרומית לשיווק בעמ,יח`,,1,11.90,2.98
3468,גרין גרנולה פקאן,משה סידס ובנו בעמ,יח`,,1,25.90,25.90
3469,גרנולה פקאן 500 גר,משה סידס ובנו בעמ,יח`,,1,13,2.60
3470,מוזלי קראנצ`י 30% פירות גרין (1 קג),משה סידס ובנו בעמ,יח`,,1,25.90,25.90
3471,גרין מוזלי 30% פירות מופחת שומן 1 קג,משה סידס ובנו בעמ,יח`,,1,25.90,2.59
3472,מוזלי קראנצ`י ביג מיקס גרין (1 קג),משה סידס ובנו בעמ,יח`,,1,25.90,0.26
3473,סודה לימון ליים 1.5 רביעייה,טמפו משקאות בעמ,יח`,,1,10.90,1.82
3474,בירה שנדי תפוח מכבי (330x6 מל),טמפו משקאות בעמ,יח`,,1,36.90,1.77
3475,בירה שנדי אפרסק מכבי (330x6 מל),טמפו משקאות בעמ,יח`,,1,36.90,1.77
3476,לחם שיפון 550 גר`,מאפיית דואט בעמ,יח`,,1,10.90,1.98
3477,מארז לחמניות 450  גר`דואט,מאפיית דואט בעמ,יח`,,1,10.90,10.90
3478,מארז לחמניות מתוקות 450  גר`דואט,מאפיית דואט בעמ,יח`,,1,10.90,10.90
3479,לחם מרוקאי מסורתי 550 גר`,מאפיית דואט בעמ,יח`,,1,12.90,2.35
3480,נייר אכיל בוב ספוג,שמחה זה אנחנו בעמ,יח`,,1,17.90,137.69
3481,סילאן 360גרם טעמי הגליל,ל.י.ב. (לחיות יותר בטבע) בעמ,יח`,,1,17.90,4.97
3482,צ`יפס בטטה 700 גר` פרי גליל,ויטה -פרי גליל (החדשה) בעמ,יח`,,1,16.90,2.41
3483,דניאלה מעדן בטעם בננה שטראוס (88 גרם),שטראוס גרופ בעמ/מצונן,יח`,,1,4,2.67
3484,גבינת  קוטג`5% שטראוס (250 גרם),שטראוס גרופ בעמ/מצונן,יח`,,1,5.90,2.36
3485,עלים לקרמשניט 300 גר`,דנשר (1963) בעמ,יח`,,1,17.90,5.97
3486,בישקוטים ליידיפינגרז בונומי (200 גרם),דנשר (1963) בעמ,יח`,,1,7.90,3.95
3487,גלילונית שקיות לסנדוויץ 350 יח,דנשר (1963) בעמ,יח`,,1,10.90,10.90
3488,ריבת חלב דולכור (454 גרם),דנשר (1963) בעמ,יח`,,1,17.90,3.94
3489,אל סבון פמילי שלישייה מעורב פירות,דנשר (1963) בעמ,יח`,,1,15.90,15.90
3490,חטיפים שונים 300 גר`,סוכנויות עמוס ממתקים בעמ,יח`,,1,13.90,4.63
3491,רולים 100 גר` בטעם שוקולד עלמה,רזיט שיווק בעמ,יח`,,1,3.90,3.90
3492,רולים 100 גר` בטעם אגוז עלמה,רזיט שיווק בעמ,יח`,,1,3.90,3.90
3493,דוחן 500 גר`,מיה תעשיות מזון מ.ת.מ. בעמ,יח`,,1,8.90,1.78
3494,קינואה מיה (500 גרם),מיה תעשיות מזון מ.ת.מ. בעמ,יח`,,1,19.90,3.98
3495,תן צ`אפ טבעות שמינייה טבעי,מיה תעשיות מזון מ.ת.מ. בעמ,יח`,,1,9.90,16.50
3496,תן צ`אפ טבעות שמינייה ברביקיו,מיה תעשיות מזון מ.ת.מ. בעמ,יח`,,1,9.90,3.96
3497,חמוציות 150  גר`מיה,מיה תעשיות מזון מ.ת.מ. בעמ,יח`,,1,10.90,7.27
3498,תערובת לקדירה לקט בריאות 600 גר`,מיה תעשיות מזון מ.ת.מ. בעמ,יח`,,1,13.90,2.32
3499,ג`לטין טהור 25 גר`,מיה תעשיות מזון מ.ת.מ. בעמ,יח`,,1,11.90,47.60
3500,סוכריות ג`לי 125 גר`,מיה תעשיות מזון מ.ת.מ. בעמ,יח`,,1,6.90,5.52
3501,סוכריות ג`לי 125 גר`,מיה תעשיות מזון מ.ת.מ. בעמ,יח`,,1,6.90,5.52
3502,סוכריות ג`לי בטעמים 125 גר`,מיה תעשיות מזון מ.ת.מ. בעמ,יח`,,1,6.90,5.52
3503,קרקר שישה דגנים בייגל בייגל (200 גרם),יוניליוור ישראל שיווק בעמ,יח`,,1,8.90,4.45
3504,קרקר שום ועישבי תיבול 285 גרם,יוניליוור ישראל שיווק בעמ,יח`,,1,9.90,3.47
3505,מאגדת חלבה פיסטוק,קבוצת אסם סחר שות. מוגבלת,יח`,,1,11.90,11.90
3506,דבש מפרחי בר בלחיץ 650 גר`,שטראוס גרופ בעמ,יח`,,1,34.90,5.37
3507,תחליף חלב שלב 2 חלבי מטרנה (700 גרם),קבוצת אסם סחר שות. מוגבלת,יח`,,1,49.90,7.13
3508,תחליף חלב שלב 3 חלבי מטרנה (700 גרם),קבוצת אסם סחר שות. מוגבלת,יח`,,1,49.90,7.13
3509,תחליף חלב שלב 1 מהדרין מטרנה (700 גרם),קבוצת אסם סחר שות. מוגבלת,יח`,,1,49.90,7.13
3510,תחליף חלב שלב 2 מהדרין מטרנה (700 גרם),קבוצת אסם סחר שות. מוגבלת,יח`,,1,49.90,7.13
3511,סופרקט בקר וכבד 3 קג,דיפלומט היינץ,יח`,,1,44.90,1496.67
3512,גבינת פטה כבשים 20% גד (250 גרם),מחלבות גד שיווק 1992 בעמ,יח`,,1,25.90,10.36
3513,גבינה בולגרית 5% גד (250 גרם),מחלבות גד שיווק 1992 בעמ,יח`,,1,23.90,9.56
3514,גבינה בולגרית 16% גד (250 גרם),מחלבות גד שיווק 1992 בעמ,יח`,,1,23.90,9.56
3515,בולגרית לסלט 5% 200 גר`,מחלבות גד שיווק 1992 בעמ,יח`,,1,21.90,10.95
3516,פטה עיזים מעודנת 5% גד,מחלבות גד שיווק 1992 בעמ,יח`,,1,30.90,12.36
3517,גבינה בולגרית מעודנת 5% גד (250 גרם),מחלבות גד שיווק 1992 בעמ,יח`,,1,23.90,9.56
3518,גבינת חלומי 24% מחלב בקר גד (200 גרם),מחלבות גד שיווק 1992 בעמ,יח`,,1,21.90,10.95
3519,לאבנה דרוזית 9% גד (500 גרם),מחלבות גד שיווק 1992 בעמ,יח`,,1,19.90,3.98
3520,גבינת שמנת 30% 200 גר` גד,מחלבות גד שיווק 1992 בעמ,יח`,,1,12.90,6.45
3521,גבינת ניו יורק 30% שום שמיר גד,מחלבות גד שיווק 1992 בעמ,יח`,,1,12.90,6.45
3522,גבינת ריקוטה פרסקה 9% גד (300 גרם),מחלבות גד שיווק 1992 בעמ,יח`,,1,17.90,5.97
3523,גבינת שמנת 30% זיתים 200 גר` גד,מחלבות גד שיווק 1992 בעמ,יח`,,1,12.90,6.45
3524,נובי הנגיסון למזון טרי,אינטרסן 1996 בעמ,יח`,,1,38.90,38.90
3525,קיסמי שיניים פלסטיק הוסטס) (200,אינטרסן 1996 בעמ,יח`,,1,9.90,9.90
3526,אקטימל בטעם תות דנונה (100x14 מל),שטראוס גרופ בעמ/מצונן,יח`,,1,29.90,21.36
3527,גרגרי חומוס מוקפאים 800 גר` פרי גליל,ויטה -פרי גליל (החדשה) בעמ,יח`,,1,9.90,1.24
3528,קמיל בלו סנסיטיב אל סבון שיבולית שועל 50,פישר תעשיות פרמצבטיות בעמ,יח`,,1,21.90,21.90
3529,קמיל בלו סנסטיב שמפו,פישר תעשיות פרמצבטיות בעמ,יח`,,1,29.90,29.90
3530,קרפציו עגל 210  גר`בלדי,בלדי בעמ,יח`,,1,39.90,19
3531,קמח ללא גלוטן גלעם (1 קג),תומר יבוא ושיווק מוצרי מזון (1,יח`,,1,4.90,0.49
3532,קמח נטול גלוטן-כרגיל  קונדיטור,תומר יבוא ושיווק מוצרי מזון (1,יח`,,1,15.90,3.53
3533,קמח כרגיל  ללחם- ללא גלוטן,תומר יבוא ושיווק מוצרי מזון (1,יח`,,1,15.90,3.18
3534,הפי למקלחון מחליק  מים- שקוף,יעקב יעקבי ובניו בעמ,יח`,,1,20.90,2.79
3535,דבק סופר גלו ג`ל 3  גר`יעקובי,יעקב יעקבי ובניו בעמ,יח`,,1,12.90,430
3536,תירס גמדי תומר (420 גרם),תומר יבוא ושיווק מוצרי מזון (1,יח`,,1,3.90,0.98
3537,פילה אנשובי בשמן תומר (45 גרם),תומר יבוא ושיווק מוצרי מזון (1,יח`,,1,5.90,13.11
3538,מקרל מרוקאי בשמן,תומר יבוא ושיווק מוצרי מזון (1,יח`,,1,3.90,3.12
3539,נודלס דק 200  גר`תומר,תומר יבוא ושיווק מוצרי מזון (1,יח`,,1,2.90,1.45
3540,זיתים סורי ירוק מבוקע 800 גר` סבא חביב,אבאל יזמות בעמ,יח`,,1,19.90,2.49
3541,סנו אנטי קאלק 4ב1 700 מל,החברה הדרומית לשיווק בעמ,יח`,,1,19.90,2.84
3542,פרש אוטומטיק מאסק סנו (250 מל),החברה הדרומית לשיווק בעמ,יח`,,1,13.90,5.56
3543,מטלית רצפה מיקרופייבר סנו סושי,החברה הדרומית לשיווק בעמ,יח`,,1,11.90,11.90
3544,סנו מקסימה 4 ליטר ורוד,החברה הדרומית לשיווק בעמ,יח`,,1,19.90,4.98
3545,קולון 1.25 קג 101 כתמים,רקיט בנקיזר (ניר איסט) בעמ,יח`,,1,19.90,15.92
3546,נגיסי אורז לתינוקות טעם טבעי,דנשר (1963) בעמ,יח`,,1,13.90,27.80
3547,בייבי ביס בטעם ירקות,דנשר (1963) בעמ,יח`,,1,13.90,27.80
3548,בייבי ביס בטעם גזר,דנשר (1963) בעמ,יח`,,1,13.90,27.80
3549,שכבות ביסקויט ושוקולד במילוי MOOI מואי,דנשר (1963) בעמ,יח`,,1,17.90,9.94
3550,נגיסי אורז לתינוק בטעם בננה,דנשר (1963) בעמ,יח`,,1,13.90,27.80
3551,מסכה אובלפיחה 400,פנינה רוזנבלום בעמ,יח`,,1,26.90,6.73
3552,גרנולה טעם עשיר 500 גר` פנינה רוזנבלום,פנינה רוזנבלום בעמ,יח`,,1,29.90,5.98
3553,טחינה 500 גר`-הר  ברכה,רזיט שיווק בעמ,יח`,,1,16.90,3.38
3554,שמיר מהדרין,א.אדמה (2007) בעמ,יח`,,1,4.90,4.90
3555,חסה מהדרין,א.אדמה (2007) בעמ,יח`,,1,5.90,5.90
3556,משחת שיניים פרונאמל סנסודיין (75 מל),גורי ע.ע.ע בעמ,יח`,,1,19.90,26.53
3557,משחת שיניים ילדים ג`וניור 50 מל,גורי ע.ע.ע בעמ,יח`,,1,13.90,27.80
3558,ס. מדיק היגניק ג`ל לניקוי יד +אלוורה 100,החברה הדרומית לשיווק בעמ,יח`,,1,12.90,12.90
3559,מברשת שיניים אורביטול,החברה הדרומית לשיווק בעמ,יח`,,1,7.90,7.90
3560,בוב ספוג שמפו לילדים כיף (750 מל).,החברה הדרומית לשיווק בעמ,יח`,,1,11.90,1.59
3561,בוב ספוג מרכך שיער לילדים כיף (750 מל).,החברה הדרומית לשיווק בעמ,יח`,,1,11.90,1.59
3562,בוב ספוג אל סבון כיף (750 מל),החברה הדרומית לשיווק בעמ,יח`,,1,13.90,1.85
3563,משחת שיניים אורביטול בוב ספוג 70 גרם,החברה הדרומית לשיווק בעמ,יח`,,1,7.90,11.29
3564,מטבוחה מרוקאית רפי כהן צבר (400 גרם),קבוצת אסם סחר שות. מוגבלת,יח`,,1,15.90,3.98
3565,סלט פלפלים רפי כהן צבר (400 גרם),קבוצת אסם סחר שות. מוגבלת,יח`,,1,15.90,3.98
3566,טחינה בלאדי רפי כהן צבר (400 גרם),קבוצת אסם סחר שות. מוגבלת,יח`,,1,15.90,3.98
3567,ביסבול כדורי פירה תפוגן (700 גרם),קבוצת אסם סחר שות. מוגבלת,יח`,,1,12.90,1.84
3568,ביסבול תירס תפוגן (700 גרם),קבוצת אסם סחר שות. מוגבלת,יח`,,1,12.90,1.84
3569,סנו סושי רדיד אלומיניום,החברה הדרומית לשיווק בעמ,יח`,,1,12.90,12.90
3570,אינסטלטור פותח סתימות סנו (200 גרם),החברה הדרומית לשיווק בעמ,יח`,,1,15.90,7.95
3571,סנו מקסימה 6 קג מאסק,החברה הדרומית לשיווק בעמ,יח`,,1,49.90,0.83
3572,ליסטרין טאגד פלוריד 500 מל,שקד תבל בעמ,יח`,,1,19.90,3.98
3573,טופו אורגני ליב (300 גרם),ל.י.ב. (לחיות יותר בטבע) בעמ,יח`,,1,11.90,3.97
3574,סוכרלוז נוזלי סוכרזית (220 מל),שטראוס גרופ בעמ,יח`,,1,25.90,11.77
3575,קערה שקופה לסלט9.5 פאלאס,פאלאס תעשיות נטו (2014) בעמ,יח`,,1,5.90,5.90
3576,זית ירוק בתיבול גלילי זיתא (215 גרם),תה ויסוצקי (ישראל) בעמ,יח`,,1,12.90,5.94
3577,זיתי קלמטה 215 גר,תה ויסוצקי (ישראל) בעמ,יח`,,1,12.90,6
3578,שום גבישי 120 גר`,תבליני טעם וריח בעמ,יח`,,1,8.90,7.42
3579,כורכום 400 גר`,תבליני טעם וריח בעמ,יח`,,1,19.90,4.98
3580,תיבול על האש 100 גר`,תבליני טעם וריח בעמ,יח`,,1,8.90,8.90
3581,תיבול לשווארמה 100 גר`,תבליני טעם וריח בעמ,יח`,,1,8.90,8.90
3582,מגבונים לחים טייגר 72 יח,פאלאס תעשיות נטו (2014) בעמ,יח`,,1,2.90,2.90
3583,מגבונים לחים טייגר חמישייה 72 יח,פאלאס תעשיות נטו (2014) בעמ,יח`,,1,11.90,2.38
3584,נודלס אטריות תרד טעמי אסיה (454 גרם),טעמי אסיה בעמ,יח`,,1,9.90,2.18
3585,אטריות ביצים טעמי אסיה (454 גרם),טעמי אסיה בעמ,יח`,,1,9.90,2.18
3586,אורז לסושי טעמי אסיה (1 קג),טעמי אסיה בעמ,יח`,,1,12.90,12.90
3587,צ`ילי חריף 700,טעמי אסיה בעמ,יח`,,1,8.90,1.27
3588,רוטב צ`לי מתוק 300 מל אסיה,טעמי אסיה בעמ,יח`,,1,7.90,2.63
3589,רוטב צ`ילי מתוק טעמי אסיה (700 מל),טעמי אסיה בעמ,יח`,,1,8.90,1.27
3590,מי קוקוס טעמי אסיה (400 מל),טעמי אסיה בעמ,יח`,,1,7.90,1.98
3591,אטריות אורז 5 סמ טעמי אסיה (400 גרם),טעמי אסיה בעמ,יח`,,1,9.90,2.48
3592,רוטב חמוץ מתוק 300 מל,טעמי אסיה בעמ,יח`,,1,9.90,3.30
3593,רוטב פאד תאי טעמי אסיה (300 מל),טעמי אסיה בעמ,יח`,,1,16.90,4.62
3594,טעם אסיה אצות וקאמה 100גר,טעמי אסיה בעמ,יח`,,1,11.90,11.90
3595,קמח טמפורה כשר מזרח ומערב 500 גר`,טעמי אסיה בעמ,יח`,,1,10.90,2.18
3596,פנקו טעמי אסיה (200 גרם),טעמי אסיה בעמ,יח`,,1,10.90,5.45
3597,אבקת רוטב ווסבי 70 גר`,טעמי אסיה בעמ,יח`,,1,17.90,25.57
3598,מקלוני שעועית טעמי אסיה (250 גרם),טעמי אסיה בעמ,יח`,,1,5.90,2.36
3599,רוטב טריאקי טעמי אסיה (300 מל),טעמי אסיה בעמ,יח`,,1,10.90,3.63
3600,חרדל דיגון גרעינים 350 גרם,דיפלומט היינץ,יח`,,1,12.90,3.79
3601,רסק תפוע רביעייה תומר,תומר יבוא ושיווק מוצרי מזון (1,יח`,,1,9.90,2.19
3602,רסק תפוע רביעייה קינמון תומר,תומר יבוא ושיווק מוצרי מזון (1,יח`,,1,9.90,2.19
3603,סלמון תומר 213 גר,תומר יבוא ושיווק מוצרי מזון (1,יח`,,1,12.90,6.06
3604,קריספיות,דילייט 2005 בעמ,יח`,,1,11.90,19.83
3605,קריספיות חיטה מלאה,דילייט 2005 בעמ,יח`,,1,13.90,18.53
