,ItemName,ManufactureName,UnitQty,Quantity,QtyInPackage,ItemPrice,UnitOfMeasurePrice
0,פיתה,מאפיית כפיר צ. ידעי בעמ,יח`,,1,1.50,1.50
1,טחון עוף,שיווק מילועוף אנטגרצית פטם אגש,"ק""ג",,1,34.90,34.90
2,סנדוויץ` עובד,קבוצת אסם סחר שות. מוגבלת,יח`,,1,3.50,3.50
3,אבוקדו,צמח שיווק תוצרת חקלאית אגשח בע,"ק""ג",,1,15.90,15.90
4,אבטיח,יבולי החמישה ו.ב,"ק""ג",,1,5.90,5.90
5,ארטישוק,ג`אן ציון,"ק""ג",,1,6.90,6.90
6,בטטה,החקלאי תלמי אל-בועז חדד,"ק""ג",,1,8.90,8.90
7,בננות,גליל שוק מקומי אגשח בעמ,"ק""ג",,1,6.90,6.90
8,בצל יבש,אום אל נור לגידולים חקלאיים בע,"ק""ג",,1,3.90,3.90
9,בצל ירוק,א.אדמה (2007) בעמ,יח`,,1,6,6
10,אננס,ח.ע בסד שיווק פירות בעמ,יח`,,1,39.90,39.90
11,גויאבה,אלדד קליימן שיווק בעמ,"ק""ג",,1,14.90,14.90
12,גזר ארוז,גזר שליט (חוות מיכאל)בעמ,"ק""ג",,1,4.90,4.90
13,דלעת,שוסטר תעשיות מזון בעמ,"ק""ג",,1,12.90,12.90
14,דלורית,שוסטר תעשיות מזון בעמ,"ק""ג",,1,9.90,9.90
15,תפוח זהוב,בראשית - אגודה שיתופית חקלאית,"ק""ג",,1,9.90,9.90
16,חסה עגולה,הירוקים של רצון בעמ,יח`,,1,5.90,5.90
17,חסה רגילה,הירוקים של רצון בעמ,יח`,,1,4.90,4.90
18,חצילים,שיווק רפול אוליאל,"ק""ג",,1,6.90,6.90
19,ירק,א.אדמה (2007) בעמ,יח`,,1,3.90,3.90
20,תפוח יונתן,בראשית - אגודה שיתופית חקלאית,"ק""ג",,1,9.90,9.90
21,כרוב לבן,תעשיות תוצרת חקלאית אביטן בני,"ק""ג",,1,3.90,3.90
22,כרובית,ד.ע. ימין גידול ושיווק ירקות ב,יח`,,1,9.90,9.90
23,לימון,יהודה כרמלה,"ק""ג",,1,9.90,9.90
24,מלפפון,ד. חי שווק תוצרת חקלאית בעמ,"ק""ג",,1,5.90,5.90
25,מלון,יבולי תנובת הדרום בעמ,"ק""ג",,1,8.90,8.90
26,עלי סלרי,א.אדמה (2007) בעמ,יח`,,1,4.90,4.90
27,שורש פטרוזיליה,א.אדמה (2007) בעמ,יח`,,1,4.90,4.90
28,תפוח סמיט,בראשית - אגודה שיתופית חקלאית,"ק""ג",,1,9.90,9.90
29,תפוח סטארקינג חרמון,בראשית - אגודה שיתופית חקלאית,"ק""ג",,1,9.90,9.90
30,סלק,תעשיות תוצרת חקלאית אביטן בני,"ק""ג",,1,5.90,5.90
31,עגבניה,שיווק העשור ירקות הזהב בעמ,"ק""ג",,1,4.90,4.90
32,פטריות שמפיניון יחידה,חוות השמפיניון בעמ,יח`,,1,9.90,9.90
33,פומלה,מהדרין תנופורט יצוא ( ש.מ.),"ק""ג",,1,9.90,9.90
34,פלפל ירוק,ד. חי שווק תוצרת חקלאית בעמ,"ק""ג",,1,9.90,9.90
35,פלפל חריף,ד. חי שווק תוצרת חקלאית בעמ,"ק""ג",,1,9.90,9.90
36,צנונית,יראון - עבודות חקלאיות בעמ,יח`,,1,5.90,5.90
37,צנון,עמית בראון שיווק עמ,"ק""ג",,1,5.90,5.90
38,קולורבי,תעשיות תוצרת חקלאית אביטן בני,"ק""ג",,1,6.90,6.90
39,קלמנטינה,תעשיות תוצרת חקלאית אביטן בני,"ק""ג",,1,6.90,6.90
40,קישואים,ד. חי שווק תוצרת חקלאית בעמ,"ק""ג",,1,7.90,7.90
41,קיווי,בראשית - אגודה שיתופית חקלאית,"ק""ג",,1,12.90,12.90
42,לפת,מלוא הסל שיווק ירקות בעמ,"ק""ג",,1,5.90,5.90
43,שום יבש,חברת יוסף אופנהימר 1986 בעמ,יח`,,1,10,10
44,שומר,תעשיות תוצרת חקלאית אביטן בני,"ק""ג",,1,7.90,7.90
45,תותים,גידול ושיווק אדום ירוק בעמ,יח`,,1,10,10
46,תפוא לבן,עוגן שיווק *בימי שני תפוא ב -,"ק""ג",,1,3.90,3.90
47,תפוזים,תעשיות תוצרת חקלאית אביטן בני,"ק""ג",,1,5.90,5.90
48,תירס ארוז,בננות החוף אגשח בעמ,"ק""ג",,1,8.90,8.90
49,פלפל אדום,י.ל החקלאים שיווק והפצה בעמ,"ק""ג",,1,8.90,8.90
50,אגס,בראשית - אגודה שיתופית חקלאית,"ק""ג",,1,12.90,12.90
51,כרוב אדום,תעשיות תוצרת חקלאית אביטן בני,"ק""ג",,1,5.90,5.90
52,פלפל חריף אדום,דובדבן שיווק בעמ,"ק""ג",,1,11.90,11.90
53,פלפל בהיר,ד. חי שווק תוצרת חקלאית בעמ,"ק""ג",,1,9.90,9.90
54,פלפל צהוב,ד. חי שווק תוצרת חקלאית בעמ,"ק""ג",,1,9.90,9.90
55,אפרסמון,מור פירות השרון בעמ,"ק""ג",,1,9.90,9.90
56,מלפפון בייבי,א.אדמה (2007) בעמ,יח`,,1,8.90,8.90
57,בצל אדום,אום אל נור לגידולים חקלאיים בע,"ק""ג",,1,5.90,5.90
58,שרי ארוז,צימן עגבניות,יח`,,1,9.90,9.90
59,נקטרינה,מיטב פרי הרמה (1995) בעמ,"ק""ג",,1,15.90,15.90
60,תפוח פינק ליידי,בראשית - אגודה שיתופית חקלאית,"ק""ג",,1,14.90,14.90
61,מג`הול תמר בקופסא,דין שיווק וקליה בעמ,יח`,,1,19.90,19.90
62,שסק,אלדד קליימן שיווק בעמ,"ק""ג",,1,12.90,12.90
63,אפרסק,מיטב פרי הרמה (1995) בעמ,"ק""ג",,1,15.90,15.90
64,פלפל שושקה,ד. חי שווק תוצרת חקלאית בעמ,"ק""ג",,1,9.90,9.90
65,תפוח ענה,לכיש מושב עובדים להתישבות חקלא,"ק""ג",,1,3.90,3.90
66,דובדבנים ארוז,בראשית - אגודה שיתופית חקלאית,יח`,,1,29.90,29.90
67,משמש,גליל שוק מקומי אגשח בעמ,"ק""ג",,1,29.90,29.90
68,סלק עלים מנגולד,א.אדמה (2007) בעמ,יח`,,1,4.90,4.90
69,תמר צהוב,אוחיון יעקב חקלאות,"ק""ג",,1,9.90,9.90
70,פלפל כתום,י.ל החקלאים שיווק והפצה בעמ,"ק""ג",,1,9.90,9.90
71,פול ירוק,דובדבן שיווק בעמ,"ק""ג",,1,7.90,7.90
72,תפוא אדום,עוגן שיווק *בימי שני תפוא ב -,"ק""ג",,1,4.90,4.90
73,ברוקולי ארוז,בננות החוף אגשח בעמ,יח`,,1,9.90,9.90
74,עירית ארוזה,א.אדמה (2007) בעמ,יח`,,1,4.90,4.90
75,אספרגוס ארוז,א.אדמה (2007) בעמ,יח`,,1,24.90,24.90
76,תפוזים ברשת,מהדרין תנופורט יצוא ( ש.מ.),"ק""ג",,1,4.90,4.90
77,קלמנטינה ברשת,מהדרין תנופורט יצוא ( ש.מ.),"ק""ג",,1,3.90,3.90
78,תפוא תפזורת,בכורי שדה דרום 2002 בעמ,"ק""ג",,1,5.90,5.90
79,פטריות חומות תפזורת גדולות למילוי,חוות השמפיניון בעמ,"ק""ג",,1,39.90,39.90
80,חציל בלדי,י.ל החקלאים שיווק והפצה בעמ,"ק""ג",,1,8.90,8.90
81,עגבנית תמר,שיווק העשור ירקות הזהב בעמ,"ק""ג",,1,5.90,5.90
82,ענבי טלי ירוקים,לכיש מושב עובדים להתישבות חקלא,"ק""ג",,1,29.90,29.90
83,תפוח גלה,בראשית - אגודה שיתופית חקלאית,"ק""ג",,1,12.90,12.90
84,פטריות לבנות תפזורת גדולות למילוי,חוות השמפיניון בעמ,"ק""ג",,1,29.90,29.90
85,גבינה מגורדת מעדנייה,תנובה - חלב,"ק""ג",,1,41.30,4.13
86,מסיכת הגנה 3 שכבות בודד,ספקים שונים,יח`,,1,9.90,9.90
87,מסיכת הגנה לפנים 50 יח`,ספקים שונים,יח`,,1,100,100
88,מסיכות בד שלישייה,אומנות התפירה,יח`,,1,19.90,19.90
89,KN95 בודד מסיכת פנים,גל-אור נכסים בעמ,יח`,,1,9.90,9.90
90,KN95 מארז 10  יח`מסיכת פנים,ספקים שונים,יח`,,1,69,69
91,תבנית בינונית המותג,דין שיווק - עטרת,יח`,,1,1.90,1.90
92,תבנית ענק המותג,דין שיווק - עטרת,יח`,,1,2.90,2.90
93,פאלאס תבניות אלומיניום קטן/אינגליש,פאלאס תעשיות נטו (2014) בעמ,יח`,,1,0.90,0.90
94,פאלאס תבניות אלומניום ענק,פאלאס תעשיות נטו (2014) בעמ,יח`,,1,1.90,1.90
95,פאלאס תבנית גדולה/רחבה/עמוקה/עגולה,פאלאס תעשיות נטו (2014) בעמ,יח`,,1,1.50,1.50
96,צוואר עגל טרי חלק עם עצם,אדום אדום - תנובה בקר,"ק""ג",,1,49.90,49.90
97,פיתה אפויה מאפית,מגוון שיווק והפצת מאפים בעמ,יח`,,1,1.50,1.50
98,בייגלה רומני בונז`ור,קבוצת אסם סחר שות. מוגבלת,יח`,,1,4,4
99,מעושנת א.ח.נוכרי,צ.י תעשיות מזון יבנה בעמ,"ק""ג",,1,38,3.80
100,מקסיקנית א.ח נוכרי במישקל,צ.י תעשיות מזון יבנה בעמ,"ק""ג",,1,36,3.60
101,גבינה שום שמיר+זיתים במישקל,צ.י תעשיות מזון יבנה בעמ,"ק""ג",,1,36,3.60
102,חלה באגט (מאפית),קבוצת אסם סחר שות. מוגבלת,יח`,,1,10,10
103,פיתה אפויה מארז 10 יח,מגוון שיווק והפצת מאפים בעמ,יח`,,1,11.90,11.90
104,דג סלמון נורבגי טרי שלם - נקי,מאסטרפוד בעמ,"ק""ג",,1,59.90,59.90
105,עוגיות שוקולדצ`יפס בונז`ור משקל,קבוצת אסם סחר שות. מוגבלת,"ק""ג",,1,37,37
106,בריוש גבינה בונז`ור,קבוצת אסם סחר שות. מוגבלת,יח`,,1,24.90,24.90
107,בשר ראש טרי מוכשר,אדום אדום - תנובה בקר,"ק""ג",,1,49.90,49.90
108,גבינת גלבוע 22% תנובה,תנובה - חלב,"ק""ג",,1,40.59,4.06
109,מוצרלה חריץ תנובה,תנובה - חלב,"ק""ג",,1,76,7.60
110,קולאג 23% פרמזן חריץ תנובה,תנובה - חלב,"ק""ג",,1,113,11.30
111,סקנדינבית 31% תנובה,תנובה - חלב,"ק""ג",,1,76,7.60
112,קשקבל (27% גלעד) תנובה,תנובה - חלב,"ק""ג",,1,121,12.10
113,רוקפור (26% גליל) חריץ תנובה,תנובה - חלב,"ק""ג",,1,122,12.20
114,בולגרית 24% פח 3  קג`תנובה,תנובה - חלב,"ק""ג",,1,56,5.60
115,טל העמק 32% צהובה,תנובה - חלב,"ק""ג",,1,55,5.50
116,צפתית מלבנית 5% פיראוס מעודנת,תנובה - חלב,"ק""ג",,1,42,4.20
117,עמק פיקוח 28% צהובה מעדנייה,תנובה - חלב,"ק""ג",,1,42.70,4.27
118, דנאבלו(רוקפור),ג.וילי-פוד אינטרנשיונל בעמ,"ק""ג",,1,85,8.50
119,בלוז מעדנייה שטראוס,שטראוס גרופ בעמ/מצונן,"ק""ג",,1,50,5
120,גבינת עיזים הולנד מעדנייה,נטו מלינדה סחר בעמ,"ק""ג",,1,149,14.90
121,פטינה מעדנייה שטראוס,שטראוס גרופ בעמ/מצונן,"ק""ג",,1,22,2.20
122,חזה אסאדו טרי חלק,אדום אדום - תנובה בקר,"ק""ג",,1,49.90,49.90
123,אוסובוקו עגל טרי חלק,אדום אדום - תנובה בקר,"ק""ג",,1,49.90,49.90
124,סטייק עם עצם חלק,אדום אדום - תנובה בקר,"ק""ג",,1,99,99
125,לחם מחמצת דגנים 480  גר`בונז`ור,קבוצת אסם סחר שות. מוגבלת,יח`,,1,11.90,2.48
126,מסכה פלסטיק שלישייה,גרפיקה בצלאל בעמ,יח`,,1,22,22
127,בריוש תפוחים עם אגוזים 550  גר`בונז`ור,קבוצת אסם סחר שות. מוגבלת,יח`,,1,24.90,4.53
128,4ב...לחמניות מאפית,קבוצת אסם סחר שות. מוגבלת,יח`,,1,10.90,10.90
129,דג לברק טרי נקי,מאסטרפוד בעמ,"ק""ג",,1,59.90,59.90
130,גבינת ברס בלו,נטו מלינדה סחר בעמ,"ק""ג",,1,149,14.90
131,בורקס פילו פיצה בונז`ור,קבוצת אסם סחר שות. מוגבלת,"ק""ג",,1,38,38
132,פסטרמה ברבקיו יחיעם,מעדני יחיעם (1993) בעמ,"ק""ג",,1,69,6.90
133,חזה הודו בדבש יחיעם,מעדני יחיעם (1993) בעמ,"ק""ג",,1,79,7.90
134,כתף בקר מפולפל יחיעם,מעדני יחיעם (1993) בעמ,"ק""ג",,1,103,10.30
135,פסטרמת הגליל 400גרם,מעדני יחיעם (1993) בעמ,יח`,,1,17.90,4.48
136,סלמי מעושן 500גרם,מעדני יחיעם (1993) בעמ,יח`,,1,29.90,5.98
137,סלמי קוניאק יחיעם,מעדני יחיעם (1993) בעמ,"ק""ג",,1,75,7.50
138,סלמי צרפתי יחיעם,מעדני יחיעם (1993) בעמ,"ק""ג",,1,149,14.90
139,נקניקיות עוף 400  גר`יחיעם,מעדני יחיעם (1993) בעמ,יח`,,1,10.90,2.73
140,נק .עוף ... 900גרם,מעדני יחיעם (1993) בעמ,יח`,,1,19.90,2.21
141,סלמי צרפתי יחיעם (100 גרם),מעדני יחיעם (1993) בעמ,יח`,,1,19.90,19.90
142,צלעות בקר על האש יחיעם,מעדני יחיעם (1993) בעמ,"ק""ג",,1,129,12.90
143,פילה מדומה טרי חלק,אדום אדום - תנובה בקר,"ק""ג",,1,79.90,79.90
144,שריר עגל טרי חלק,אדום אדום - תנובה בקר,"ק""ג",,1,64.90,64.90
145,לחמניה כריך ח.מלאה בונז`ור,קבוצת אסם סחר שות. מוגבלת,יח`,,1,3.90,3.90
146,אמנון טרי נקי,מאסטרפוד בעמ,"ק""ג",,1,29.90,29.90
147,קוניאק מובחר טירת צבי,תנובה קפואים,"ק""ג",,1,80,8
148,סרוולד טירת צבי,תנובה קפואים,"ק""ג",,1,148,14.80
149,סלמי פפרוני טירת צבי,תנובה קפואים,"ק""ג",,1,80,8
150,סלמי איטלקי טירת צבי,תנובה קפואים,"ק""ג",,1,80,8
151,נקניק תה טירת צבי,תנובה קפואים,"ק""ג",,1,53,5.30
152,נקניקיות עוף טירת צבי לפי משקל (500 גרם),תנובה קפואים,"ק""ג",,1,23.90,23.90
153,כתף בקר מפולפל טירת צבי,תנובה קפואים,"ק""ג",,1,98,9.80
154,חזה הודו בדבש טירת צבי,תנובה קפואים,"ק""ג",,1,80,8
155,צלי כתף טרי חלק,אדום אדום - תנובה בקר,"ק""ג",,1,89.90,89.90
156,פסטרמה הודו מעושנת טירת צבי,תנובה קפואים,"ק""ג",,1,80,8
157,פסטרמה גחלים טירת צבי,תנובה קפואים,"ק""ג",,1,80,8
158,דג בורי טרי נקי,מאסטרפוד בעמ,"ק""ג",,1,39,39
159,לבנה אבו גוש במשקל,הגבינות של ניצן,"ק""ג",,1,50,5
160,דג ברמונדי נקי שלם,מאסטרפוד בעמ,"ק""ג",,1,49.90,49.90
161,גבנצ 28% נעם חריץ פיקוח מעדנייה,החב` המרכזית - טרה,"ק""ג",,1,42.70,4.27
162,גבנצ 9% נעם חריץ מעדנייה,החב` המרכזית - טרה,"ק""ג",,1,72,7.20
163,גבנצ 22% נעם חריץ פיקוח מעדנייה,החב` המרכזית - טרה,"ק""ג",,1,39,3.90
164,לב בקר קפוא מוביל,ציון שמכה ובניו בעמ,"ק""ג",,1,22.90,22.90
165,חלבה א.ח נוכרי חלבי בלוק נוגט,השחר העולה תעשית ממתקים בעמ,"ק""ג",,1,42.90,28.60
166,לחמניות דגנים/קלועה/קשר/כריך/חצי באגט בו,קבוצת אסם סחר שות. מוגבלת,יח`,,1,10,2
167,בולגריה בקוביות עם שמן ותבלינים,ג.וילי-פוד אינטרנשיונל בעמ,"ק""ג",,1,75,7.50
168,לחם מחמצת אגוזים אפוי קפוא 480  גר`בו,קבוצת אסם סחר שות. מוגבלת,יח`,,1,14.90,3.10
169,לחם מחמצת זתי קלמנטה/אגוזים בונז`ור,קבוצת אסם סחר שות. מוגבלת,יח`,,1,16.90,3.52
170,נקניק תה זוגלובק,זוגלובק שיווק בעמ,"ק""ג",,1,49,4.90
171,סלמי פפרוני זוגלובק,זוגלובק שיווק בעמ,"ק""ג",,1,56,5.60
172,קוניאק זוגלובק,זוגלובק שיווק בעמ,"ק""ג",,1,87,8.70
173,מרטודלה רחב זוגלובק,זוגלובק שיווק בעמ,"ק""ג",,1,35,3.50
174,הודו נהריה זוגלובק,זוגלובק שיווק בעמ,"ק""ג",,1,47,4.70
175,כתף בקר מעושן זוגלובק,זוגלובק שיווק בעמ,"ק""ג",,1,100,10
176,חזה עוף מעושן זוגלובק,זוגלובק שיווק בעמ,"ק""ג",,1,79,7.90
177,פסטרמה חזה הודו זוגלובק,זוגלובק שיווק בעמ,"ק""ג",,1,79,7.90
178,טורו-כתף בקר זוגלובק,זוגלובק שיווק בעמ,"ק""ג",,1,110,11
179,פסטרממיה חזה עוף זוגלובק,זוגלובק שיווק בעמ,"ק""ג",,1,79,7.90
180,פסטרממיה צלויה זוגלובק,זוגלובק שיווק בעמ,"ק""ג",,1,79,7.90
181,פסטרממיה מעושנת זוגלובק,זוגלובק שיווק בעמ,"ק""ג",,1,79,7.90
182,תבור-חזה מעושן זוגלובק 2% שומן,זוגלובק שיווק בעמ,"ק""ג",,1,79,7.90
183,פסטרמה רומנית זוגלובק,זוגלובק שיווק בעמ,"ק""ג",,1,79,7.90
184,חרמון חזה הודו זוגלובק,זוגלובק שיווק בעמ,"ק""ג",,1,50,5
185,פסטרמה כפרית 2% שומן זוגלובק,זוגלובק שיווק בעמ,"ק""ג",,1,79,7.90
186,קאשקבל משולש מעדנייה גד,מחלבות גד שיווק 1992 בעמ,"ק""ג",,1,120,12
187,מוצרלה נקניק מעושן 22% מעדנייה גד,מחלבות גד שיווק 1992 בעמ,"ק""ג",,1,84,8.40
188,בולגרית 5% 16%  מעודנת- גד מעדניה,מחלבות גד שיווק 1992 בעמ,"ק""ג",,1,56,5.60
189,גבינת מוצרלה נקניק מעדנייה גד,מחלבות גד שיווק 1992 בעמ,"ק""ג",,1,80,8
190,גבינה צפתית רכה 5% מעדנייה גד,מחלבות גד שיווק 1992 בעמ,"ק""ג",,1,60,6
191,ריקוטה מעדנייה גד,מחלבות גד שיווק 1992 בעמ,"ק""ג",,1,57,5.70
192,שמנות 30% בטעמים מעדנייה גד,מחלבות גד שיווק 1992 בעמ,"ק""ג",,1,45,4.50
193,לאבנה טבעית מעדנייה גד,מחלבות גד שיווק 1992 בעמ,"ק""ג",,1,38,3.80
194,מוצרלה במים גד מעדניה,מחלבות גד שיווק 1992 בעמ,"ק""ג",,1,92,9.20
195,לחמניה המבורגר בונז`ור,קבוצת אסם סחר שות. מוגבלת,יח`,,1,3.90,3.90
196,דג קרפיון מצונן נקי,מאסטרפוד בעמ,"ק""ג",,1,32.90,32.90
197,גאודה 30% חריץ מעדניה,תנובה - חלב,"ק""ג",,1,108,10.80
198,גאודה כמון 30%,תנובה - חלב,"ק""ג",,1,108,10.80
199,גאודה עז 28%,תנובה - חלב,"ק""ג",,1,144,14.40
200,גאודה מעושנת 30% במשקל,תנובה - חלב,"ק""ג",,1,108,10.80
201,כבד עוף קפוא,קורניש חן (1987) בעמ,"ק""ג",,1,14.90,1.49
202,לב עוף קפוא,עוף עוז שיווק בעמ,"ק""ג",,1,19.90,1.99
203,עוף מס -2עטרה,נטו מלינדה סחר - עטרה,"ק""ג",,1,22.90,2.29
204,חזה עוף-עטרה,נטו מלינדה סחר - עטרה,"ק""ג",,1,31.90,3.19
205,כרעיים-עטרה,נטו מלינדה סחר - עטרה,"ק""ג",,1,31.90,3.19
206,ירכיים עוף-עטרה,נטו מלינדה סחר - עטרה,"ק""ג",,1,31.90,3.19
207,שוקיים עוף-עטרה,נטו מלינדה סחר - עטרה,"ק""ג",,1,34.90,3.49
208,כנפיים עוף-עטרה,נטו מלינדה סחר - עטרה,"ק""ג",,1,17.90,1.79
209,פילה סלמון תנובה מנות,תנובה קפואים,"ק""ג",,1,79.90,7.99
210,נילוס פרוס,תנובה קפואים,"ק""ג",,1,34.90,34.90
211,שיפודי פרגיות קפוא,קורניש חן (1987) בעמ,"ק""ג",,1,54.90,5.49
212,כנפיים עוף מחפוד קפוא,קורניש חן (1987) בעמ,"ק""ג",,1,9.90,0.99
213,בשר ראש קפוא,תנובה קפואים,"ק""ג",,1,69.90,6.99
214,פילה סלמון תנובה קפוא בוואקום,תנובה קפואים,"ק""ג",,1,64.90,6.49
215,נתח פילה סלמון קפוא,תנובה קפואים,"ק""ג",,1,87.90,8.79
216,כתף טרי חלק ללא עצם,אדום אדום - תנובה בקר,"ק""ג",,1,79.90,79.90
217,חצי בגט,מאפיית קציר חיטים בעמ,יח`,,1,3.90,3.90
218,7ב...לחמניות מאפית,קבוצת אסם סחר שות. מוגבלת,יח`,,1,10.90,10.90
219,סטייק עין קפוא פריגומרק מוביל,מאסטרפוד בעמ,"ק""ג",,1,49.90,49.90
220,אצבעות  קשתית(אנטריקוט) קפוא,בלדי בעמ,"ק""ג",,1,49.90,49.90
221,שוק אווז קפוא ארוז,בלדי בעמ,"ק""ג",,1,44.90,44.90
222,פסטרמה כפרית טירת צבי,תנובה קפואים,"ק""ג",,1,53,5.30
223,קשיו קלוי,קונסיגנציה דין שיווק וקליה בעמ,"ק""ג",,1,95,9.50
224,גרעין אבטיח,קונסיגנציה דין שיווק וקליה בעמ,"ק""ג",,1,58,5.80
225,גרעיני דלעת מקולפת,קונסיגנציה דין שיווק וקליה בעמ,"ק""ג",,1,65,6.50
226,צימוק חום,קונסיגנציה דין שיווק וקליה בעמ,"ק""ג",,1,30,3
227,אפונה קלויה,קונסיגנציה דין שיווק וקליה בעמ,"ק""ג",,1,50,5
228,צנובר,קונסיגנציה דין שיווק וקליה בעמ,"ק""ג",,1,199,19.90
229,פול  מצרי/ אפונה קלויה,קונסיגנציה דין שיווק וקליה בעמ,"ק""ג",,1,55,5.50
230,משמש,קונסיגנציה דין שיווק וקליה בעמ,"ק""ג",,1,55,5.50
231,פקאן טבעי,קונסיגנציה דין שיווק וקליה בעמ,"ק""ג",,1,135,13.50
232, תירס/ סויה,קונסיגנציה דין שיווק וקליה בעמ,"ק""ג",,1,50,5
233,בונדוק קלוי,קונסיגנציה דין שיווק וקליה בעמ,"ק""ג",,1,130,13
234,מנצ`ס,קונסיגנציה דין שיווק וקליה בעמ,"ק""ג",,1,55,5.50
235,אגוז מלך קלוף,קונסיגנציה דין שיווק וקליה בעמ,"ק""ג",,1,79,7.90
236,שקד מולבן משובב,קונסיגנציה דין שיווק וקליה בעמ,"ק""ג",,1,120,12
237,פיסטוק קלוף,קונסיגנציה דין שיווק וקליה בעמ,"ק""ג",,1,199,19.90
238,שקד מולבן חצאים,קונסיגנציה דין שיווק וקליה בעמ,"ק""ג",,1,120,12
239,פקאן סיני מסוכר,קונסיגנציה דין שיווק וקליה בעמ,"ק""ג",,1,118,11.80
240,קבוקים,קונסיגנציה דין שיווק וקליה בעמ,"ק""ג",,1,35,3.50
241,פיסטוק קלוי,קונסיגנציה דין שיווק וקליה בעמ,"ק""ג",,1,97,9.70
242,חומוס קלוי,קונסיגנציה דין שיווק וקליה בעמ,"ק""ג",,1,40,4
243,קשיו טבעי,קונסיגנציה דין שיווק וקליה בעמ,"ק""ג",,1,89,8.90
244,תערובת פיצוחים,קונסיגנציה דין שיווק וקליה בעמ,"ק""ג",,1,95,9.50
245,אגוז מקדמיה טבעי,קונסיגנציה דין שיווק וקליה בעמ,"ק""ג",,1,150,15
246,בוטן מסוכר,קונסיגנציה דין שיווק וקליה בעמ,"ק""ג",,1,45,4.50
247,בוטן קלוי ענק,קונסיגנציה דין שיווק וקליה בעמ,"ק""ג",,1,37,3.70
248,גרעין לבן,קונסיגנציה דין שיווק וקליה בעמ,"ק""ג",,1,45,4.50
249,בונדוק טבעי,קונסיגנציה דין שיווק וקליה בעמ,"ק""ג",,1,110,11
250,חטיף יפני,קונסיגנציה דין שיווק וקליה בעמ,"ק""ג",,1,65,6.50
251,שקד קלוי,קונסיגנציה דין שיווק וקליה בעמ,"ק""ג",,1,98,9.80
252,פקאן קלוף קלוי,קונסיגנציה דין שיווק וקליה בעמ,"ק""ג",,1,150,15
253,אגוז ברזיל טבעי,קונסיגנציה דין שיווק וקליה בעמ,"ק""ג",,1,100,10
254,צימוק ג`מבו,קונסיגנציה דין שיווק וקליה בעמ,"ק""ג",,1,44,4.40
255,תאנים יבשות,קונסיגנציה דין שיווק וקליה בעמ,"ק""ג",,1,49,4.90
256,שזיפים ללא גלעין,קונסיגנציה דין שיווק וקליה בעמ,"ק""ג",,1,47,4.70
257,צימוק לבן קטן,קונסיגנציה דין שיווק וקליה בעמ,"ק""ג",,1,37,3.70
258,אננס פלחים,קונסיגנציה דין שיווק וקליה בעמ,"ק""ג",,1,40,4
259,בננה צ`יפס,קונסיגנציה דין שיווק וקליה בעמ,"ק""ג",,1,35,3.50
260,מנגו מסוכר,קונסיגנציה דין שיווק וקליה בעמ,"ק""ג",,1,40,4
261,עשבי תיבול,קונסיגנציה דין שיווק וקליה בעמ,"ק""ג",,1,90,9
262,פירות טרופים,קונסיגנציה דין שיווק וקליה בעמ,"ק""ג",,1,70,7
263,ענבים אדומים ארוז,פירות אביב בעמ,יח`,,1,12.90,12.90
264,שקד טחון,קונסיגנציה דין שיווק וקליה בעמ,"ק""ג",,1,90,9
265,3ב...לחמניות מאפית,קבוצת אסם סחר שות. מוגבלת,יח`,,1,10.90,10.90
266,קורנדביף 4% שומן יחיעם (180 גרם),מעדני יחיעם (1993) בעמ,יח`,,1,24.90,13.83
267,פסטרמה מעודנת בפפריקה 300 גר` יחיעם,מעדני יחיעם (1993) בעמ,יח`,,1,21.90,7.30
268,סלמי הרץ יחיעם (150 גרם),מעדני יחיעם (1993) בעמ,יח`,,1,24.90,16.60
269,עוף קפוא טחון מהדרין עטרה (500 גרם),נטו מלינדה סחר - עטרה,יח`,,1,13.90,2.78
270,כאמל בוקס,גלוברנדס בעמ - שיווק סיגריות,יח`,,1,28.50,28.50
271,כאמל כחול,גלוברנדס בעמ - שיווק סיגריות,יח`,,1,28.50,28.50
272,וינסטון בוקס,גלוברנדס בעמ - שיווק סיגריות,יח`,,1,30.50,30.50
