,ItemName,ManufactureName,UnitQty,Quantity,QtyInPackage,ItemPrice,UnitOfMeasurePrice
3254,מאגדת חטיפי שוגי קורנפלקס שישייה,יוניליוור ישראל שיווק בעמ,יח`,,1,16.30,10.45
3255,מאגדת חטיפי ילדים קוקומן פצפוצים שישייה,יוניליוור ישראל שיווק בעמ,יח`,,1,16.30,12.94
3256,מטליות לחות לניקוי כללי בניחוח לימון,יוניליוור ישראל שיווק בעמ,יח`,,1,11.20,11.20
3257,מטליות לחות לניקוי רצפות בניחוח לימון,יוניליוור ישראל שיווק בעמ,יח`,,1,12.20,12.20
3258,מאגדת חטיפי ילדים שוגי שוקו שישייה,יוניליוור ישראל שיווק בעמ,יח`,,1,16.30,10.45
3259,מאגדת חטיפי ילדים שוגי פצפוצים שישייה,יוניליוור ישראל שיווק בעמ,יח`,,1,16.30,11.81
3260,נפולינה רוטב עגבניות לפסטה 415 גר` קנור,יוניליוור ישראל שיווק בעמ,יח`,,1,14.20,3.42
3261,ארביאטה רוטב עגבניות חריף לפסטה 415 גר`,יוניליוור ישראל שיווק בעמ,יח`,,1,14.20,3.42
3262,רוטב עגבניות ופלפלים לשקשוקה 415 גר` קנו,יוניליוור ישראל שיווק בעמ,יח`,,1,13.90,3.35
3263,ברנפלקס אקסטרה פייבר 410 גר` תלמה,יוניליוור ישראל שיווק בעמ,יח`,,1,26.50,6.46
3264,קרמיסימו תותים ושוקולד לבן,גלידות שטראוס בעמ,יח`,,1,20.50,15.41
3265,שלישיית סבון אסלה ל5 פעולות בניחוח אוקיי,יוניליוור ישראל שיווק בעמ,יח`,,1,15.90,15.90
3266,שלישיית סבון אסלה ל5 פעולות בניחוח ים ד,יוניליוור ישראל שיווק בעמ,יח`,,1,15.90,15.90
3267,גלידת שוקולד מריר ושקדים 280 גר` גודיז,גלידות שטראוס בעמ,יח`,,1,19.50,6.96
3268,גלידת וניל עוגיות 280 גר` גודיז,גלידות שטראוס בעמ,יח`,,1,19.50,3.75
3269,גלידת שוקולד ציפס 280 גר` גודיס,גלידות שטראוס בעמ,יח`,,1,19.50,3.75
3270,גלידת וניל תות שדה 280 גר` גודיז,גלידות שטראוס בעמ,יח`,,1,19.50,6.96
3271,מאגדת טילון קורנטו ללא גלוטן כשלפ,גלידות שטראוס בעמ,יח`,,1,35.60,10.79
3272,מאגדת מיני סולרו קוקוס אננס,גלידות שטראוס בעמ,יח`,,1,23.40,4.88
3273,שטראוס קרמיסימו בננה טופי,גלידות שטראוס בעמ,יח`,,1,20.50,20.50
3274,קוקומן כדורים בדצ מופחת סוכר,יוניליוור ישראל שיווק בעמ,יח`,,1,22.40,4.48
3275,קוקומן חום לבן 20% פחות סוכר 375 גר`,יוניליוור ישראל שיווק בעמ,יח`,,1,23.40,6.24
3276,דגני פיצי מהדרין תלמה (500 גרם),יוניליוור ישראל שיווק בעמ,יח`,,1,22.40,4.48
3277,ברנפלקס ללא תוספת סוכר 500 גר` בדצ,יוניליוור ישראל שיווק בעמ,יח`,,1,23.40,4.68
3278,ברנפלקס מהדרין תלמה (500 גרם),יוניליוור ישראל שיווק בעמ,יח`,,1,23.40,4.68
3279,שוגי 500 גר`,יוניליוור ישראל שיווק בעמ,יח`,,1,20.30,4.06
3280,פינוק שמפו בתוספת תמצית תה ירוק וויטמין,יוניליוור ישראל שיווק בעמ,יח`,,1,13.20,1.89
3281,פינוק מרכך בתוספת תמצית תה ירוק וויטמין,יוניליוור ישראל שיווק בעמ,יח`,,1,13.20,1.89
3282,קליק קרם נוגט 38 גר`,יוניליוור ישראל שיווק בעמ,יח`,,1,5.40,14.21
3283,רוטב לעוף שום ועשבי תיבול 310 גר` קנור,יוניליוור ישראל שיווק בעמ,יח`,,1,15.20,4.90
3284,ברנפלקס קרנצ`ים קינמון 375 גר`,יוניליוור ישראל שיווק בעמ,יח`,,1,24.40,6.51
3285,ברנפלקס קרנצ`ים מייפל 375 גר`,יוניליוור ישראל שיווק בעמ,יח`,,1,24.40,6.51
3286,רוטב עגבניות בזיליקום 415 גר קנור,יוניליוור ישראל שיווק בעמ,יח`,,1,14.20,3.42
3287,רוטב פומודורו לפסטה 415 גר` קנור,יוניליוור ישראל שיווק בעמ,יח`,,1,14.20,3.42
3288,שמפו עם קמומיל ואלוורה 700 מל פינוק,יוניליוור ישראל שיווק בעמ,יח`,,1,13.20,1.89
3289,מרכך עם קמומיל ואלוורה 700 מל פינוק,יוניליוור ישראל שיווק בעמ,יח`,,1,13.20,1.89
3290,טבעות שומשום 300 גרם,יוניליוור ישראל שיווק בעמ,יח`,,1,11.50,3.83
3291,קליק קרם חלב 38 גר,יוניליוור ישראל שיווק בעמ,יח`,,1,5.40,14.21
3292,קליק טבלאות עם קורפלקס ופצפוצים 85 גר`,יוניליוור ישראל שיווק בעמ,יח`,,1,6.70,7.88
3293,קליק טבלאות שוקולד לבן קוקוס מקורמל 85 ג,יוניליוור ישראל שיווק בעמ,יח`,,1,6.70,7.88
3294,גלידת שטראוס 2 ליטר כשלפ,גלידות שטראוס בעמ,יח`,,1,27.50,1.38
3295,גלידת פרפה פיסטוק 280 גר` גודיס,גלידות שטראוס בעמ,יח`,,1,19.50,3.75
3296,גלידת קפוצ`ינו 280 גר` גודיס,גלידות שטראוס בעמ,יח`,,1,19.50,3.75
3297,שטראוס קרמיסימו טעם פיסטוק ושוקולד עם,גלידות שטראוס בעמ,יח`,,1,20.50,15.41
3298,פריכונים מאורז מלא אסם (310 גרם),קבוצת אסם סחר שות. מוגבלת,יח`,,1,14.20,4.58
3299,פסטה צינורות מהדרין אסם (500 גרם),קבוצת אסם סחר שות. מוגבלת,יח`,,1,6.10,1.22
3300,חומוס עם חריף צבר (400 גרם),קבוצת אסם סחר שות. מוגבלת,יח`,,1,13.30,3.33
3301,ביסלי חטיף בטעם גריל אסם (55x4 גרם),קבוצת אסם סחר שות. מוגבלת,יח`,,1,13.20,6
3302,במבה בומבה 60 גר.,קבוצת אסם סחר שות. מוגבלת,יח`,,1,4.30,4.30
3303,במבה 50 גר` שישייה אסם,קבוצת אסם סחר שות. מוגבלת,יח`,,1,17.30,5.77
3304,ביסלי ברביקיו מארז 4יח*55גרם,קבוצת אסם סחר שות. מוגבלת,יח`,,1,13.20,6
3305,במבה במילוי נוגט אסם (30x5 גרם),קבוצת אסם סחר שות. מוגבלת,יח`,,1,16.30,10.87
3306,קונפיטורת דובדבן יד מרדכי (340 גרם),שטראוס גרופ בעמ,יח`,,1,16.30,4.79
3307,שוקולד אקסטרא חלב 100 גר` בדצ,שטראוס גרופ בעמ,יח`,,1,8.10,8.10
3308,שוקולד פרה אקסטרא קרם יוגורט תות ועוגיות,שטראוס גרופ בעמ,יח`,,1,8.10,8.10
3309,פריכיות גדולות 3 דגנים אנרג`י,שטראוס גרופ בעמ,יח`,,1,14.20,10.52
3310,עד חצות עיגולים 225 גר`,שטראוס גרופ בעמ,יח`,,1,15.60,6.93
3311,חרדל דיז`ון גרגרים יד מרדכי (350 גרם),שטראוס גרופ בעמ,יח`,,1,13.20,3.77
3312,חרדל דיז`ון חלק 370 גרם,שטראוס גרופ בעמ,יח`,,1,13.20,3.57
3313,רבע לשבע אגוזים בודד 27 גרם,שטראוס גרופ בעמ,יח`,,1,4.30,15.93
3314,צנצנת קוביות ספירמינט גומי לעיסה 58גר,שטראוס גרופ בעמ,יח`,,1,11.20,19.31
3315,צנצנת קוביות פפירמינט גומי לעיסה 58גר,שטראוס גרופ בעמ,יח`,,1,11.20,19.31
3316,צנצנת קוביות בזוקה גומי לעיסה 58גר,שטראוס גרופ בעמ,יח`,,1,11.20,19.31
3317,קפסולות קפה עלית 100% גואטמלה (10),שטראוס גרופ בעמ,יח`,,1,18.30,36.60
3318,דוריטוס טקסס גריל70 גר,שטראוס פריטו ליי בעמ,יח`,,1,4,5.71
3319,דוריטוס שקשוקה 70 גר.,שטראוס פריטו ליי בעמ,יח`,,1,4,5.71
3320,רולדה קפה נמס ווסטהיים 350 גר`,שטראוס גרופ בעמ,יח`,,1,16.90,4.83
3321,רבע לשבע לבן 120 גר,שטראוס גרופ בעמ,יח`,,1,14.20,11.83
3322,אגוזי 45 גר` כשלפ,שטראוס גרופ בעמ,יח`,,1,4.30,4.30
3323,קונפיטורת משמש 340 גר,שטראוס גרופ בעמ,יח`,,1,16.30,4.79
3324,שוקולד פרה אקסטרה חלב עלית (100 גרם),שטראוס גרופ בעמ,יח`,,1,8.10,8.10
3325,פרה אקסטרא וניל ועוגיות שוקו 100 גרם,שטראוס גרופ בעמ,יח`,,1,8.10,8.10
3326,שוקולד פרה אקסטרא קרם יוגורט תות ועוגיות,שטראוס גרופ בעמ,יח`,,1,8.10,8.10
3327,שוקולד פרה אקסטרא צימוקים ואגוזים 100 גר,שטראוס גרופ בעמ,יח`,,1,8.10,8.10
3328,חטיף מקופלת ספלנדיד 23 גר` עלית,שטראוס גרופ בעמ,יח`,,1,4.30,18.70
3329,קונפיטורת שזיף 340 גר,שטראוס גרופ בעמ,יח`,,1,16.30,4.79
3330,שוקלוד פרה במילוי תות 50 גר כשלפ,שטראוס גרופ בעמ,יח`,,1,4.30,4.30
3331,מאסט באבלמינט מגדים 66 גר כשלפ,שטראוס גרופ בעמ,יח`,,1,11.20,16.97
3332,צנצנת קוביות ענבים 58 גר,שטראוס גרופ בעמ,יח`,,1,11.20,19.31
3333,קונפיטורת תאנה אגס 340 גר` יד מרדכי,שטראוס גרופ בעמ,יח`,,1,16.30,4.79
3334,קונפיטורת פירות יער 340 גר יד מרדכי,שטראוס גרופ בעמ,יח`,,1,16.30,4.79
3335,שוקולד חלב במתיקות מעודנת 100 גר` עלית,שטראוס גרופ בעמ,יח`,,1,8.90,8.90
3336,שוקולד אגוזים במתיקות מעודנת 100 גר` עלי,שטראוס גרופ בעמ,יח`,,1,8.90,8.90
3337,שוקולד קוקוס במתיקות מעודנת 100 גר` עלית,שטראוס גרופ בעמ,יח`,,1,8.90,8.90
3338,מאסט לארג אבטיח 80 גר`,שטראוס גרופ בעמ,יח`,,1,15.20,19
3339,מאסט לארג מנטה עדינה 80 גר`,שטראוס גרופ בעמ,יח`,,1,15.20,19
3340,קפסולות קפה עלית אספרסו בטעם קרמל,שטראוס גרופ בעמ,יח`,,1,18.30,36.60
3341,קפסולות אספרסו בטעם אגוזים עלית,שטראוס גרופ בעמ,יח`,,1,18.30,36.60
3342,קפסולות קפה עלית אוגנדה 13 למכונות נספרו,שטראוס גרופ בעמ,יח`,,1,18.30,36.60
3343,קפסולות קפה עלית אידונזיה מס` 12,שטראוס גרופ בעמ,יח`,,1,18.30,36.60
3344,צנצנת עלמה בטעם אוכמניות 66 גר`,שטראוס גרופ בעמ,יח`,,1,11.20,11.20
3345,צנצנת עלמה בטעם ספירמינט 66 גר`,שטראוס גרופ בעמ,יח`,,1,11.20,11.20
3346,רבע לשבע רולס שוקולד 120 גר` עלית,שטראוס גרופ בעמ,יח`,,1,14.20,11.83
3347,רבע לשבע רולס קרם קפה 120 גר` עלית,שטראוס גרופ בעמ,יח`,,1,14.20,11.83
3348,מארז עגבניות קצוצות דק שלישייה מנה מאסט,ש.שסטוביץ בעמ,יח`,,1,18.30,1.53
3349,עלי טורטיה קמח מלא 320 גר` מנה מאסטר שף,ש.שסטוביץ בעמ,יח`,,1,11.20,3.50
3350,עלי טורטיה קמח לבן 320 גר` מנה מאסטר שף,ש.שסטוביץ בעמ,יח`,,1,11.20,3.50
3351,ליידי ספיד סטיק אלוורה 45 גר,ש.שסטוביץ בעמ,יח`,,1,32.60,72.44
3352,ספיד סטיק כח הטבע אולנג ג`ל,ש.שסטוביץ בעמ,יח`,,1,18.30,28.15
3353,מנה רוטב סויה תסיסה טבעית 620 גר,ש.שסטוביץ בעמ,יח`,,1,21.40,3.45
3354,מנה רוטב סויה דל נתרן 620 גר,ש.שסטוביץ בעמ,יח`,,1,21.40,3.45
3355,פלמוליב סבון לומינוס אבוקדו 500 מל,ש.שסטוביץ בעמ,יח`,,1,21.40,4.28
3356,פלמוליב סבון לומינוס מקדמיה 500 מל,ש.שסטוביץ בעמ,יח`,,1,21.40,4.28
3357,מאסטר שף איטריות דקיקות 400 גר,ש.שסטוביץ בעמ,יח`,,1,7.10,1.78
3358,מאסטר שף איטריות דקות 400 גר,ש.שסטוביץ בעמ,יח`,,1,7.10,1.78
3359,מאסטר שף איטריות בינוניות 400 גר,ש.שסטוביץ בעמ,יח`,,1,7.10,1.78
3360,קראנצוס גריל 70 גר`,ש.שסטוביץ בעמ,יח`,,1,4,5.71
3361,קראנצוס פלאפל 70 גר`,ש.שסטוביץ בעמ,יח`,,1,4,5.71
3362,וניש גולד אבקה 1.35 קג ורוד,רקיט בנקיזר (ניר איסט) בעמ,יח`,,1,36.70,2.72
3363,וניש גולד אבקה 1.35 קג לבן,רקיט בנקיזר (ניר איסט) בעמ,יח`,,1,36.70,2.72
3364,וניש גולד אבקה 470גר` ורוד,רקיט בנקיזר (ניר איסט) בעמ,יח`,,1,21.40,4.55
3365,וניש גולד אבקה 470 גר` לבן,רקיט בנקיזר (ניר איסט) בעמ,יח`,,1,21.40,4.55
3366,אירוויק מקלות לבנדר,רקיט בנקיזר (ניר איסט) בעמ,יח`,,1,27.50,91.67
3367,קולון 101 אבקה 2.5 קג,רקיט בנקיזר (ניר איסט) בעמ,יח`,,1,26.50,26.50
3368,ג`ל להסרת כתמים גולד וניש קליה (2 ליטר),רקיט בנקיזר (ניר איסט) בעמ,יח`,,1,26.50,13.25
3369,וניש אבקה 1620 גר` ורוד,רקיט בנקיזר (ניר איסט) בעמ,יח`,,1,31.60,1.95
3370,דטול ספריי חיטוי בניוח כביסה 400,רקיט בנקיזר (ניר איסט) בעמ,יח`,,1,25.90,6.48
3371,וולייט ג`ל כביסה גולד 1.5 ליטר,רקיט בנקיזר (ניר איסט) בעמ,יח`,,1,21.40,1426.67
3372,וניש אבקה 1620 גר` לבן,רקיט בנקיזר (ניר איסט) בעמ,יח`,,1,31.60,1.95
3373,דטול ספריי חיטוי בניחוח פריחה 400,רקיט בנקיזר (ניר איסט) בעמ,יח`,,1,25.90,6.48
3374,וולייט ג`ל לכביסה עדינה 1.5 ליטר,רקיט בנקיזר (ניר איסט) בעמ,יח`,,1,21.40,1426.67
3375,דטול ספריי חיטוי בניחוח אביבי 400,רקיט בנקיזר (ניר איסט) בעמ,יח`,,1,25.90,6.48
3376,כרית קרצוף עם ספוג מקציף סנו סושי (6),החברה הדרומית לשיווק בעמ,יח`,,1,12.20,12.20
3377,סנובון מוצק דאבל אקשן בניחוח תפוז,החברה הדרומית לשיווק בעמ,יח`,,1,21.40,21.40
3378,סנו מקסימה מרכך 1 ליטר blue blossom,החברה הדרומית לשיווק בעמ,יח`,,1,19.30,1.93
3379,מקסימה מרכך כביסה סופט סילק סנו (1 ליטר),החברה הדרומית לשיווק בעמ,יח`,,1,19.30,1.93
3380,כיף פיות קרם להתרת קשרים 350מל,החברה הדרומית לשיווק בעמ,יח`,,1,21.40,6.11
3381,תרסיס מתיר קשרים לילדים כיף (350 מל),החברה הדרומית לשיווק בעמ,יח`,,1,21.40,6.11
3382,כיף בוב ספוג קרם להתרת קשרים 350מל,החברה הדרומית לשיווק בעמ,יח`,,1,21.40,6.11
3383,פורטה 750 מל free,החברה הדרומית לשיווק בעמ,יח`,,1,18.30,2.44
3384,סנובון שלישיה מוצק WAVE בניחוח אורנים,החברה הדרומית לשיווק בעמ,יח`,,1,18.30,18.30
3385,סנובון שלישיה מוצק WAVE בניחוח פרחים ור,החברה הדרומית לשיווק בעמ,יח`,,1,18.30,18.30
3386,סנובון שלישיה מוצק WAVE בניחוח למון מרענ,החברה הדרומית לשיווק בעמ,יח`,,1,18.30,18.30
3387,ג`ל מרוכז 500 מל פורטה פלוס,החברה הדרומית לשיווק בעמ,יח`,,1,15.20,3.04
3388,מרכך כביסה מקסימה Soft Silk,החברה הדרומית לשיווק בעמ,יח`,,1,22.40,5.60
3389,מרכך כביסה מקסימה 4 ליטר Blue Dlosson,החברה הדרומית לשיווק בעמ,יח`,,1,22.40,5.60
3390,מרכך לילדים מיניונים נקה 7 (750 מל),החברה הדרומית לשיווק בעמ,יח`,,1,16.30,2.17
3391,שמפו/מרכך מיניונים נקה 7 - קידס,החברה הדרומית לשיווק בעמ,יח`,,1,16.30,2.17
3392,אל סבון מיניונים נקה 7 - קידס,החברה הדרומית לשיווק בעמ,יח`,,1,16.30,2.17
3393,בייבי כיף אלסבון לפני השינה 750 מל,החברה הדרומית לשיווק בעמ,יח`,,1,25.90,3.45
3394,בייבי כיף קרם גוף לפני השינה 500 מל,החברה הדרומית לשיווק בעמ,יח`,,1,25.90,5.18
3395,נקה 7 שמפו שמני הזנה 750 מל,החברה הדרומית לשיווק בעמ,יח`,,1,14.20,1.89
3396,נקה 7 מרכך שמני הזנה 750 מל,החברה הדרומית לשיווק בעמ,יח`,,1,14.20,1.89
3397,תחליב רחצה כיף ניחוח שקד 700 מל,החברה הדרומית לשיווק בעמ,יח`,,1,13.50,1.93
3398,תחליב רחצה כיף ניחוח דבש 700 מל,החברה הדרומית לשיווק בעמ,יח`,,1,13.50,1.93
3399,תחליב רחצה כיף ניחוח קוקוס וניל 700 מל,החברה הדרומית לשיווק בעמ,יח`,,1,13.50,1.93
3400,תחליב רחצה כיף ניחוח לבנדר 700 מל,החברה הדרומית לשיווק בעמ,יח`,,1,13.50,1.93
3401,תחליב רחצה כיף בניחוח שמן אמבר וגרדניה 7,החברה הדרומית לשיווק בעמ,יח`,,1,13.50,1.93
3402,תחליב רחצה כיף ניחוח מאסק יסמין 700 מל,החברה הדרומית לשיווק בעמ,יח`,,1,13.50,1.93
3403,תחליב רחצה כיף ניחוח אוקיינס 700 מל,החברה הדרומית לשיווק בעמ,יח`,,1,13.50,1.93
3404,תחליב רחצה כיף בניחוח אננס וקוקס 700,החברה הדרומית לשיווק בעמ,יח`,,1,13.50,1.93
3405,תחליב רחצה בניחוח וטיבר ומלח ים 700,החברה הדרומית לשיווק בעמ,יח`,,1,13.50,1.93
3406,תחליב רחצה כיף בניחוח ברגמוט ונרולי 700,החברה הדרומית לשיווק בעמ,יח`,,1,13.50,1.93
3407,כיף שמפו לשיער רגיל תפוח זרעי צ`יה 700,החברה הדרומית לשיווק בעמ,יח`,,1,13.90,1.99
3408,כיף שמפו לשיער רגיל יבש רימונים ושמן ארג,החברה הדרומית לשיווק בעמ,יח`,,1,13.90,1.99
3409,כיף שמפו לשיער דק ושביר 700,החברה הדרומית לשיווק בעמ,יח`,,1,13.90,1.99
3410,כיף שמפו ומרכך 2+1 תאנה ומנטה 700,החברה הדרומית לשיווק בעמ,יח`,,1,13.90,1.99
3411,כיף שמפו לשיער מעוצב קרטין וחמאת שיאה 70,החברה הדרומית לשיווק בעמ,יח`,,1,13.90,1.99
3412,כיף מרכך לשיער רגיל תפוח זרעי צ`יה 700,החברה הדרומית לשיווק בעמ,יח`,,1,13.90,1.99
3413,כיף מרכך לשיער רגיל יבש רימונים ושמן ארג,החברה הדרומית לשיווק בעמ,יח`,,1,13.90,1.99
3414,כיף מרכך לשיער דק ושביר 700,החברה הדרומית לשיווק בעמ,יח`,,1,13.90,1.99
3415,כיף מרכך לשיער מעוצב קרטין וחמאת שיאה 70,החברה הדרומית לשיווק בעמ,יח`,,1,13.90,1.99
3416,בייבי קרם גוף כיף (500 מל),החברה הדרומית לשיווק בעמ,יח`,,1,25.90,5.18
3417,בייבי שמן לתינוק לעור עדין כיף (500 מל),החברה הדרומית לשיווק בעמ,יח`,,1,25.90,5.18
3418,בייבי כיף שמפו אל דמע (1 ליטר),החברה הדרומית לשיווק בעמ,יח`,,1,23.90,23.90
3419,בייבי כיף אלסבון 1 ליטר,החברה הדרומית לשיווק בעמ,יח`,,1,23.90,23.90
3420,גבינת גאודה מגורדת 500 גר` 28% שומן הולנ,ג.וילי-פוד אינטרנשיונל בעמ,יח`,,1,28.50,5.70
3421,גבינת מוצרלה פרוסות 150 גר` וילי פוד,ג.וילי-פוד אינטרנשיונל בעמ,יח`,,1,16.30,10.87
3422,גבינת חלומי 200 גר` SAY CHEESE וילי פוד,ג.וילי-פוד אינטרנשיונל בעמ,יח`,,1,26.50,13.25
3423,ממרח חמאה 250 גר` ללא מלח Euro spread ו,ג.וילי-פוד אינטרנשיונל בעמ,יח`,,1,12.90,5.16
3424,ממרח חמאה 250 גר` במליחות עדינה Euro spr,ג.וילי-פוד אינטרנשיונל בעמ,יח`,,1,12.90,5.16
3425,ממרח חמאה 250 גר` לייט לא מלח Euro sprea,ג.וילי-פוד אינטרנשיונל בעמ,יח`,,1,12.90,5.16
3426,ממרח חמאה 250 גר` לייט במליחות עדינה Eur,ג.וילי-פוד אינטרנשיונל בעמ,יח`,,1,12.90,5.16
3427,מאפה יוני במילוי קרם בטעם וניל 400 גר` ו,ג.וילי-פוד אינטרנשיונל בעמ,יח`,,1,20.90,5.23
3428,מאפה יוני במילוי גבינת פטה 400 גר` וילי,ג.וילי-פוד אינטרנשיונל בעמ,יח`,,1,20.90,5.23
3429,מאפה יוני במילוי תרד וגבינת פטה 400 גר`,ג.וילי-פוד אינטרנשיונל בעמ,יח`,,1,20.90,5.23
3430,חטיף שקדים וצימוקים HAPPY NUTS וילי פוד,ג.וילי-פוד אינטרנשיונל בעמ,יח`,,1,15.90,11.36
3431,חטיף שקדים וחמוציות HAPPY NUTS וילי פוד,ג.וילי-פוד אינטרנשיונל בעמ,יח`,,1,15.90,11.36
3432,גבינת עיזים רכה בציפוי תפוזים 29% שומן (,ג.וילי-פוד אינטרנשיונל בעמ,יח`,,1,15.90,14.45
3433,גבינת עיזים רכה בציפוי צ`לי 29% שומן (11,ג.וילי-פוד אינטרנשיונל בעמ,יח`,,1,15.90,14.45
3434,4 יח תחתיות לפיצה וילי פוד,ג.וילי-פוד אינטרנשיונל בעמ,יח`,,1,14.90,3.10
3435,גבינת שמנת טבעי 200 גר` EURO CHEESE,ג.וילי-פוד אינטרנשיונל בעמ,יח`,,1,13.90,6.95
3436,גבינת שמנת לייט טבעי 200 גר` EURO CHEESE,ג.וילי-פוד אינטרנשיונל בעמ,יח`,,1,13.90,6.95
3437,גבינת שמנת עשבי תיבול 200 גר` EURO CHEES,ג.וילי-פוד אינטרנשיונל בעמ,יח`,,1,13.90,6.95
3438,גבינת שמנת לייט עשבי תיבול 200 גר` EURO,ג.וילי-פוד אינטרנשיונל בעמ,יח`,,1,13.90,6.95
3439,גבינת שמנת שום 200 גר` EURO CHEESE,ג.וילי-פוד אינטרנשיונל בעמ,יח`,,1,13.90,6.95
3440,גבינת שמנת לייט שום 200 גר` EURO CHEESE,ג.וילי-פוד אינטרנשיונל בעמ,יח`,,1,13.90,6.95
3441,גבינת גאודה פרוסות 400 גר` וילי פוד,ג.וילי-פוד אינטרנשיונל בעמ,יח`,,1,20.90,5.23
3442,מלפפונים כבושים במלח 18-25 קטנים מאוד (8,ג.וילי-פוד אינטרנשיונל בעמ,יח`,,1,15.90,1.99
3443,פסטו בזיליקום 190 גר` וילי פוד,ג.וילי-פוד אינטרנשיונל בעמ,יח`,,1,10.90,5.74
3444,רוטב עגבניות עם זיתים וצלפים 400 גר` ויל,ג.וילי-פוד אינטרנשיונל בעמ,יח`,,1,10.90,2.73
3445,רוטב עגבניות עם פטריות פורצ`יני 400 גר`,ג.וילי-פוד אינטרנשיונל בעמ,יח`,,1,10.90,2.73
3446,רוטב עגבניות עם חצילים 400 גר`,ג.וילי-פוד אינטרנשיונל בעמ,יח`,,1,10.90,2.73
3447,רוטב עגבניות פיקנטי 400 גר` וילי פוד,ג.וילי-פוד אינטרנשיונל בעמ,יח`,,1,10.90,2.73
3448,מארז תפוחונים (3 יח +1 ),ג.וילי-פוד אינטרנשיונל בעמ,יח`,,1,13.90,13.90
3449,מדליוני גבינת עיזים 6 יח *20 גר` ( 120 ג,ג.וילי-פוד אינטרנשיונל בעמ,יח`,,1,15.90,13.25
3450,צנימים טעם טבעי 100 גר` melba toast,ג.וילי-פוד אינטרנשיונל בעמ,יח`,,1,8.90,8.90
3451,לזנה איטלקית 500 גר` (וילי פוד),ג.וילי-פוד אינטרנשיונל בעמ,יח`,,1,11.50,2.30
3452,צנימים עם שומשום 100 גר` melba toast,ג.וילי-פוד אינטרנשיונל בעמ,יח`,,1,8.90,8.90
3453,ממרח חמאה 250 גר` valio,ג.וילי-פוד אינטרנשיונל בעמ,יח`,,1,17.90,7.16
3454,ממרח חמאה 250 גר` לייט VALIO,ג.וילי-פוד אינטרנשיונל בעמ,יח`,,1,17.90,7.16
3455,פיצה מרגריטה 380 גר` וילי פוד,ג.וילי-פוד אינטרנשיונל בעמ,יח`,,1,14.90,3.92
3456,פיצה עם פטריות 390 גר` וילי פוד,ג.וילי-פוד אינטרנשיונל בעמ,יח`,,1,14.90,3.82
3457,פיצה עם זיתים 385 גר` וילי פוד,ג.וילי-פוד אינטרנשיונל בעמ,יח`,,1,14.90,3.87
3458,כדורי בייבי גבינת מוצרלה 200 גר` וילי פו,ג.וילי-פוד אינטרנשיונל בעמ,יח`,,1,20.90,10.45
3459,משקה יוגורט אפרסק 500 מל וילי פוד 0.1%,ג.וילי-פוד אינטרנשיונל בעמ,יח`,,1,10.90,10.90
3460,משקה יוגורט תות 500 מל וילי פוד 0.1%,ג.וילי-פוד אינטרנשיונל בעמ,יח`,,1,10.90,10.90
3461,משקה יוגורט תות ודודבן 500 מל וילי פוד,ג.וילי-פוד אינטרנשיונל בעמ,יח`,,1,10.90,10.90
3462,משקה יוגורט אוכמניות וסמבוק 500 מל וילי,ג.וילי-פוד אינטרנשיונל בעמ,יח`,,1,10.90,10.90
3463,גבינת שמנת עם זיתים 200 גר` EURO CHEESE,ג.וילי-פוד אינטרנשיונל בעמ,יח`,,1,13.90,6.95
