,ItemName,ManufactureName,UnitQty,Quantity,QtyInPackage,ItemPrice,UnitOfMeasurePrice
0,גזר ארוז,גזר שליט (חוות מיכאל)בעמ,"ק""ג",,1,4.90,4.90
1,לימון,יהודה כרמלה,"ק""ג",,1,9.90,9.90
2,מלון,יבולי תנובת הדרום בעמ,"ק""ג",,1,8.90,8.90
3,פומלה,מהדרין תנופורט יצוא ( ש.מ.),"ק""ג",,1,9.90,9.90
4,קולורבי,תעשיות תוצרת חקלאית אביטן בני,"ק""ג",,1,6.90,6.90
5,קלמנטינה,תעשיות תוצרת חקלאית אביטן בני,"ק""ג",,1,6.90,6.90
6,קישואים,ד. חי שווק תוצרת חקלאית בעמ,"ק""ג",,1,7.90,7.90
7,דג סלמון נורבגי טרי שלם - נקי,מאסטרפוד בעמ,"ק""ג",,1,59.90,59.90
8,דג לברק טרי נקי,מאסטרפוד בעמ,"ק""ג",,1,59.90,59.90
9,דג בורי טרי נקי,מאסטרפוד בעמ,"ק""ג",,1,39,39
10,דג ברמונדי נקי שלם,מאסטרפוד בעמ,"ק""ג",,1,49.90,49.90
11,פילה סלמון נורבגי שלם -טרי,מאסטרפוד בעמ,"ק""ג",,1,99,9.90
12,פילסברי עוגת שמרים תפוע,קונסיגנציה ג`נרל מילס ישראל בע,יח`,,1,21.90,21.90
13,פילסברי עוגת שמרים שוקולד,קונסיגנציה ג`נרל מילס ישראל בע,יח`,,1,21.90,21.90
14,פילסברי עוגת שמרים אגוזים,קונסיגנציה ג`נרל מילס ישראל בע,יח`,,1,21.90,21.90
15,פילסברי עוגת שמרים קינמון,קונסיגנציה ג`נרל מילס ישראל בע,יח`,,1,21.90,21.90
16,פילסברי חלה מתוקה (חת כדורים),קונסיגנציה ג`נרל מילס ישראל בע,יח`,,1,11.90,11.90
17,פילסברי חלה שמינייה,קונסיגנציה ג`נרל מילס ישראל בע,יח`,,1,11.90,11.90
18,פילסברי לחם מחמצת לבן,קונסיגנציה ג`נרל מילס ישראל בע,יח`,,1,16.90,16.90
19,פילסברי לחם מחמצת דגנים,קונסיגנציה ג`נרל מילס ישראל בע,יח`,,1,16.90,16.90
20,כרעיים עוף טרי ארוז,טל הל יסכה בעמ,"ק""ג",,1,26.90,26.90
21,ירך עוף טרי ארוז,עוף עוז שיווק בעמ,"ק""ג",,1,26.90,26.90
22,סטייק פרגית ללא עור,טל הל יסכה בעמ,"ק""ג",,1,44.90,44.90
23,כבד עוף לצליה טרי ארוז,עוף עוז שיווק בעמ,"ק""ג",,1,23.90,23.90
24,פילסברי בייגל רומני,קונסיגנציה ג`נרל מילס ישראל בע,יח`,,1,4.20,4.20
25,פילסברי לחם כוסמין מלא בחוש,קונסיגנציה ג`נרל מילס ישראל בע,יח`,,1,16.90,16.90
26,פילסברי לחמניית בגט (רבע בגט),קונסיגנציה ג`נרל מילס ישראל בע,יח`,,1,1.70,1.70
27,פילסברי לחם מחמצת זיתי קלמנטה,קונסיגנציה ג`נרל מילס ישראל בע,יח`,,1,16.90,16.90
28,פילסברי לחם מחמצת מקמח מלא,קונסיגנציה ג`נרל מילס ישראל בע,יח`,,1,16.90,16.90
29,פילסברי לחם מחמצת כוסמין,קונסיגנציה ג`נרל מילס ישראל בע,יח`,,1,16.90,16.90
30,פילסברי מחמצת שיפון כהה וחמוציות,קונסיגנציה ג`נרל מילס ישראל בע,יח`,,1,16.90,16.90
31,פילסברי מחמצת טוסקאני דגנים,קונסיגנציה ג`נרל מילס ישראל בע,יח`,,1,16.90,16.90
32,פילסברי חליות,קונסיגנציה ג`נרל מילס ישראל בע,יח`,,1,2.20,2.20
33,פילסברי ג`בטה כפרית,קונסיגנציה ג`נרל מילס ישראל בע,יח`,,1,4.20,4.20
34,פילסברי לחם רוסטיק עגבניות מיובשות,קונסיגנציה ג`נרל מילס ישראל בע,יח`,,1,16.90,16.90
35,פילסברי מחמצת טוסקאני כפרי עגול,קונסיגנציה ג`נרל מילס ישראל בע,יח`,,1,16.90,16.90
36,פילסברי מחמצת טוסקאני לבן עגול,קונסיגנציה ג`נרל מילס ישראל בע,יח`,,1,16.90,16.90
37,חצי בגט כפרי פיל,קונסיגנציה ג`נרל מילס ישראל בע,יח`,,1,3,3
38,פילסברי חלה קלועה מתוקה,קונסיגנציה ג`נרל מילס ישראל בע,יח`,,1,11.90,11.90
39,סטייק אנטריקוט מוכשר מעובד מופשר,נטו בשרים,"ק""ג",,1,99,99
40,סטייק אנטריקוט חלק מעובד מופשר,נטו בשרים,"ק""ג",,1,79.90,79.90
41,פילסברי בייגל סימיט,קונסיגנציה ג`נרל מילס ישראל בע,יח`,,1,4.20,4.20
42,פילסברי מחמצת שיפון אגוזים,קונסיגנציה ג`נרל מילס ישראל בע,יח`,,1,16.90,16.90
43,פילסברי כריך (ילדים) לבן,קונסיגנציה ג`נרל מילס ישראל בע,יח`,,1,1.50,1.50
44,פילסברי לחמניות כריך (ילדים) כפרי,קונסיגנציה ג`נרל מילס ישראל בע,יח`,,1,1.50,1.50
45,פילסברי בפרצל,קונסיגנציה ג`נרל מילס ישראל בע,יח`,,1,4.20,4.20
46,פילסברי עוגת שמרים גבינה,קונסיגנציה ג`נרל מילס ישראל בע,יח`,,1,21.90,21.90
47,חצי בגט פילסברי,קונסיגנציה ג`נרל מילס ישראל בע,יח`,,1,2.90,2.90
48,פילסברי שליש בגט לבן,קונסיגנציה ג`נרל מילס ישראל בע,יח`,,1,2.50,2.50
49,פילסברי שליש בגט כפרי,קונסיגנציה ג`נרל מילס ישראל בע,יח`,,1,2.50,2.50
50,פילסברי לחמניית שמינייה דגנים,קונסיגנציה ג`נרל מילס ישראל בע,יח`,,1,4.20,4.20
51,פילסברי לחמנייה דגנים וגרעינים,קונסיגנציה ג`נרל מילס ישראל בע,יח`,,1,4.20,4.20
52,פילסברי לחמניית שמינייה קלועה,קונסיגנציה ג`נרל מילס ישראל בע,יח`,,1,4.20,4.20
53,פילסברי לחמנייה עגולה לבנה,קונסיגנציה ג`נרל מילס ישראל בע,יח`,,1,4.20,4.20
54,פילסברי לחמניית קוראסול,קונסיגנציה ג`נרל מילס ישראל בע,יח`,,1,4.20,4.20
55,פופקורנס טעם בצל 50 גר,אבאל יזמות בעמ,יח`,,1,4.90,9.80
56,פופקורנס טעם גבינה 50 גר,אבאל יזמות בעמ,יח`,,1,4.90,9.80
57,פופקורנס טעם גריל 50 גר,אבאל יזמות בעמ,יח`,,1,4.90,9.80
58,פופקורנס קרמל מלוח 50 גר,אבאל יזמות בעמ,יח`,,1,4.90,9.80
59,וודקה סטוליצ`יניה (700 מל),הכרם - משקאות חריפים בעמ,יח`,,1,79.90,11.37
60,וודקה רוסקי יורוסטנדרט (700 מל),יורוסטנדרט בעמ,יח`,,1,59.90,8.51
61,הוט פופ 600 גר`,ליימן שליסל בעמ,יח`,,1,15.90,10.60
62,הוט פופ חמאה 600 גר`,ליימן שליסל בעמ,יח`,,1,15.90,2.65
63,הוט פופ לייט 600גר`,ליימן שליסל בעמ,יח`,,1,15.90,2.65
64,הוט פופ 600 גר`,ליימן שליסל בעמ,יח`,,1,15.90,2.65
65,אפונה 800 גר` סנפרוסט,תנובה קפואים,יח`,,1,16.90,2.11
66,עלית הארק יקב הגליל (700 מל),יקב הגליל שיווק בעמ,יח`,,1,59.90,7.95
67,זן בר פריכיות כוסמין ללא מלח 120 גר,אבאל יזמות בעמ,יח`,,1,7.90,6.58
68,זן בר פריכיות כוסמת עם מלח 120 גר,אבאל יזמות בעמ,יח`,,1,7.90,6.58
69,זן בר פריכיות כוסמת ללא מלח 120 גר,אבאל יזמות בעמ,יח`,,1,7.90,6.58
70,זן בר פריכיות תירס עם מלח 120 גר,אבאל יזמות בעמ,יח`,,1,7.90,6.58
71,שוקולד מריר עלית (100x5 גרם),שטראוס גרופ בעמ,יח`,,1,22.90,4.58
72,שוקולד פרה חלב עלית (100x5 גרם),שטראוס גרופ בעמ,יח`,,1,22.90,4.58
73,וודקה פינלנדיה 700 מל,מ. אקרמן בעמ,יח`,,1,64.90,9.23
