,ItemName,ManufactureName,UnitQty,Quantity,QtyInPackage,ItemPrice,UnitOfMeasurePrice
1656,קולון 1.25 קג 101 כתמים,רקיט בנקיזר (ניר איסט) בעמ,יח`,,1,14.30,11.44
1657,קולון 5 קג` 101 כתמים,רקיט בנקיזר (ניר איסט) בעמ,יח`,,1,57.90,11.58
1658,שכבות ביסקויט ושוקולד במילוי MOOI מואי,דנשר (1963) בעמ,יח`,,1,17.90,9.94
1659,שכבות ביסקוויט ושוקולד במילוי MOOI מואי,דנשר (1963) בעמ,יח`,,1,9,5
1660,ביסקוויטמינים לפעוטות וילדים 150גר,גורי מוצרי צריכה (1991) בעמ,יח`,,1,10,6.67
1661,חטיף בריאות לילדים כתמטמינים (45 גרם),גורי מוצרי צריכה (1991) בעמ,יח`,,1,5.90,12.83
1662,גרנולה פירות יבשים 500 גר פנינה רוזנבלום,פנינה רוזנבלום בעמ,יח`,,1,29.90,5.98
1663,גרנולה טעם עשיר 500 גר` פנינה רוזנבלום,פנינה רוזנבלום בעמ,יח`,,1,29.90,5.98
1664,משחת שיניים מלבינה,גורי ע.ע.ע בעמ,יח`,,1,18.90,18.90
1665,ס. מדיק היגניק ג`ל לניקוי יד +אלוורה 100,החברה הדרומית לשיווק בעמ,יח`,,1,9.90,9.90
1666,בוב ספוג שמפו לילדים כיף (750 מל).,החברה הדרומית לשיווק בעמ,יח`,,1,11.90,1.59
1667,שמפו+מרכך כיף בו,החברה הדרומית לשיווק בעמ,יח`,,1,11.90,1.59
1668,בוב ספוג מרכך שיער לילדים כיף (750 מל).,החברה הדרומית לשיווק בעמ,יח`,,1,11.50,1.53
1669,בוב ספוג אל סבון כיף (750 מל),החברה הדרומית לשיווק בעמ,יח`,,1,13.90,1.85
1670,מברשת שיניים אורביטול,החברה הדרומית לשיווק בעמ,יח`,,1,9.70,9.70
1671,מטבוחה מרוקאית רפי כהן צבר (400 גרם),קבוצת אסם סחר שות. מוגבלת,יח`,,1,15.90,3.98
1672,סלט פלפלים רפי כהן צבר (400 גרם),קבוצת אסם סחר שות. מוגבלת,יח`,,1,15.90,3.98
1673,חציל בטחינה 400 גר`,קבוצת אסם סחר שות. מוגבלת,יח`,,1,15.90,3.98
1674,טחינה בלאדי רפי כהן צבר (400 גרם),קבוצת אסם סחר שות. מוגבלת,יח`,,1,15.90,3.98
1675,חציל בשמן זית 400 גר`,קבוצת אסם סחר שות. מוגבלת,יח`,,1,15.90,3.98
1676,סנומוד מסק,החברה הדרומית לשיווק בעמ,יח`,,1,11.90,7.93
1677,קרם נגד גירויים,החברה הדרומית לשיווק בעמ,יח`,,1,16.90,16.90
1678,אינסטלטור פותח סתימות סנו (200 גרם),החברה הדרומית לשיווק בעמ,יח`,,1,15.90,7.95
1679,אורביטול מי פה,החברה הדרומית לשיווק בעמ,יח`,,1,27.90,5.58
1680,אורביטול מי פה,החברה הדרומית לשיווק בעמ,יח`,,1,20.90,4.18
1681,גלידת שטראוס 2 ליטר שוקו עוגיות וניל ציפ,גלידות שטראוס בעמ,יח`,,1,19.90,1
1682,מכשיר ג`נסיס לבן,סודהסטרים ישראל בעמ,יח`,,1,350,350
1683,איטריות עגבניות 454 גר`,טעמי אסיה בעמ,יח`,,1,9.90,2.18
1684,נודלס אטריות תרד טעמי אסיה (454 גרם),טעמי אסיה בעמ,יח`,,1,9.90,2.18
1685,אטריות ביצים טעמי אסיה (454 גרם),טעמי אסיה בעמ,יח`,,1,9.90,2.18
1686,מי קוקוס טעמי אסיה (400 מל),טעמי אסיה בעמ,יח`,,1,7.90,1.98
1687,שמפו פיות כיף (750 מל),החברה הדרומית לשיווק בעמ,יח`,,1,11.90,1.59
1688,מרכך פיות כיף (750 מל),החברה הדרומית לשיווק בעמ,יח`,,1,11.90,1.59
1689,אל סבון כיף פיות,החברה הדרומית לשיווק בעמ,יח`,,1,10.70,1.43
1690,כיף אלסבון פיות אלוורה 750 מל`,החברה הדרומית לשיווק בעמ,יח`,,1,13.90,1.85
1691,סנובון לאסלה לבנדר סנו (50x3 גרם),החברה הדרומית לשיווק בעמ,יח`,,1,18.90,9.69
1692,פוליויקס גרניט פורצלן 2 ליטר,החברה הדרומית לשיווק בעמ,יח`,,1,22.90,11.45
1693,אנטי קאלק מנקה כללי סנו (2 ליטר),החברה הדרומית לשיווק בעמ,יח`,,1,19.90,9.95
1694,מברשת שיניים אורביטול (4),החברה הדרומית לשיווק בעמ,יח`,,1,8.90,8.90
1695,נוזל לניקוי אמבטיה 00 סנו (1 ליטר),החברה הדרומית לשיווק בעמ,יח`,,1,7.60,7.60
1696,סנוקליר שקית מילוי 750 מל,החברה הדרומית לשיווק בעמ,יח`,,1,7.90,1.05
1697,ריצפז פרש 2 ליטר לילך,החברה הדרומית לשיווק בעמ,יח`,,1,21.90,10.95
1698,סנו מקסימה מרכך 1 ליטר כחול,החברה הדרומית לשיווק בעמ,יח`,,1,15.90,1.59
1699,סנו קליר 750 מל לחלונות,החברה הדרומית לשיווק בעמ,יח`,,1,13.90,1.85
1700,מיונז לינה (430 גרם),יורוסטנדרט בעמ,יח`,,1,10,2.33
1701,מיונז לינה 860 גר`,יורוסטנדרט בעמ,יח`,,1,18,2.09
1702,מיונז טעם זיתים 430 גר,יורוסטנדרט בעמ,יח`,,1,7.50,1.74
1703,יין לבן יבש מבעבע גוטה דה מרוויה,יורוסטנדרט בעמ,יח`,,1,25.30,3.57
1704,יין לבן יבש מבעבע גוטה דה מרוויה,יורוסטנדרט בעמ,יח`,,1,25.30,3.33
1705,אל סבון פרחי בר ורוד פמילי (1 ליטר),דנשר (1963) בעמ,יח`,,1,14.90,1.49
1706,פרש וואנס מגבונים רביעיה,דנשר (1963) בעמ,יח`,,1,19.90,19.90
1707,קבנוס זוגלובק (45x3 גרם),זוגלובק שיווק בעמ,יח`,,1,11.90,8.81
1708,קבנוס בטעם שום זוגלובק (45x3 גרם),זוגלובק שיווק בעמ,יח`,,1,11.90,8.81
1709,קבנוס 135 גר` עם צ`ילי חריף זוגלובק,זוגלובק שיווק בעמ,יח`,,1,11.90,8.81
1710,קבנוס בטעם בצל זוגלובק (45x3 גרם),זוגלובק שיווק בעמ,יח`,,1,11.90,8.81
1711,חרמון כפרית 300 גר`+ברביקיו 300 גר`,זוגלובק שיווק בעמ,יח`,,1,33.90,5.65
1712,זוג חרמון כפרית ותה - מחפוד,זוגלובק שיווק בעמ,יח`,,1,34.90,5.82
1713,זוג חרמון כפרית וחרמון ברבקיו -מחפוד,זוגלובק שיווק בעמ,יח`,,1,34.90,5.82
1714,קריספי סטיקס פלאפל,זוגלובק שיווק בעמ,יח`,,1,19.90,3.98
1715,קבנוס מעודן 135 גרם,זוגלובק שיווק בעמ,יח`,,1,9,6.67
1716,קבנוס סטיקס 50 גר` זוגלובק,זוגלובק שיווק בעמ,יח`,,1,9.90,19.80
1717,קבב בסגנון סורי 560 גר` זוגלובק,זוגלובק שיווק בעמ,יח`,,1,29.90,5.34
1718,קבב בסגנון לבנוני 560 גר` זוגלובק,זוגלובק שיווק בעמ,יח`,,1,29.90,5.34
1719,המבורגר בטחינה גסה 560 גר` זוגלובק,זוגלובק שיווק בעמ,יח`,,1,29.90,5.34
1720,קבנוס סטיקס בטעם סיציליאני 50 גר` זוגלו,זוגלובק שיווק בעמ,יח`,,1,9.90,19.80
1721,קבנוס סטיקס בטעם מקסיקני 50 גר` זוגלובק,זוגלובק שיווק בעמ,יח`,,1,9.90,19.80
1722,נשנושים פסטרמה הודו עם פסטו 130 גר` זוגל,זוגלובק שיווק בעמ,יח`,,1,16.90,13
1723,נשנושים פסטרמה הודו עם צ`לי מתוק 130 גר`,זוגלובק שיווק בעמ,יח`,,1,16.90,13
1724,נשנושים פסטרמה הודו עם עשבי תיבול 130 גר,זוגלובק שיווק בעמ,יח`,,1,16.90,13
1725,מלפפון פרוסות במלח,קבוצת יבנה מוצרי מזון אגודה שי,יח`,,1,6.90,1.28
1726,קרם לחות+שמן לשיער יבש,החברה הדרומית לשיווק בעמ,יח`,,1,27.20,6.80
1727,קרם לחות+שמן לשיער מתולתל,החברה הדרומית לשיווק בעמ,יח`,,1,21.30,5.33
1728,קרם ידיים אפקטיב קר,פישר תעשיות פרמצבטיות בעמ,יח`,,1,17.90,17.90
1729,משקה פירות תפוחים שוופס (1.5 ליטר),יפאורה,יח`,,1,6.90,0.46
1730,שוופס מוגז פירות אשכולית אדומה 1.5 ליטר,יפאורה,יח`,,1,6.90,4.60
1731,משקה קל מנגו עסיסי תפוזינה (1.5 ליטר),יפאורה,יח`,,1,6.50,0.43
1732,תה קר מנגו אפרסק ספרינג (1.5 ליטר),יפאורה,יח`,,1,6.40,4.27
1733,קישוטי עוגה 70 גר`,מיה תעשיות מזון מ.ת.מ. בעמ,יח`,,1,5.30,7.57
1734,קישוטי עוגה 70 גר`,מיה תעשיות מזון מ.ת.מ. בעמ,יח`,,1,5.90,8.43
1735,רזרב גוורצטרמינר 750 מל יקבי ברקן,טמפו משקאות בעמ,יח`,,1,49.90,6.61
1736,יין פרימייר אדום -קברנה סובניון ומלבק,טמפו משקאות בעמ,יח`,,1,24.90,3.28
1737,פרמייר אמרלד ריזלינג יקבי ברקן (750 מל),טמפו משקאות בעמ,יח`,,1,24.90,3.28
1738,לה פסטה ספגטי 5 400 גר`,תומר יבוא ושיווק מוצרי מזון (1,יח`,,1,2.90,0.73
1739,חתיכות אננס בסירופ קל תומר (113x4 גרם),תומר יבוא ושיווק מוצרי מזון (1,יח`,,1,9.90,2.19
1740,קוקטייל פירות בסירופ קל תומר (113x4 גרם),תומר יבוא ושיווק מוצרי מזון (1,יח`,,1,9.90,2.19
1741,יוגורט עיזים בטעם טיבעי 150 גר` חלב האר,שטראוס גרופ בעמ/מצונן,יח`,,1,5.90,3.93
1742,פרש וואנס מגבונים רביעיה,דנשר (1963) בעמ,יח`,,1,19.90,19.90
1743,קוטל מעופפים רייד (300 מל),דנשר (1963) בעמ,יח`,,1,17.90,5.97
1744,מואי שכבות ביסקוויט ושוקולד MOOI,דנשר (1963) בעמ,יח`,,1,17.90,9.94
1745,מואי שכבות ביסקוויט ושוקולד MOOI,דנשר (1963) בעמ,יח`,,1,9,5
1746,אל סבון נוזלי יסמין ולבנדר כיף (1 ליטר),החברה הדרומית לשיווק בעמ,יח`,,1,13.90,1.39
1747,אנטי קאלק מגבונים לניקוי כללי,החברה הדרומית לשיווק בעמ,יח`,,1,10.40,10.40
1748,סנו מקסימה מרכך 1 ליטר ורוד פסים,החברה הדרומית לשיווק בעמ,יח`,,1,17.90,1.79
1749,סנו פרש מטליות לחות לרצפה ריצפז (10),החברה הדרומית לשיווק בעמ,יח`,,1,11.90,11.90
1750,מטליות לחות לריצפה סנו סושי (10),החברה הדרומית לשיווק בעמ,יח`,,1,9.90,9.90
1751,ריצפז פרש 2 ליטר,החברה הדרומית לשיווק בעמ,יח`,,1,21.90,0.01
1752,רסס ונגב - מילוי סנו (750 מל),החברה הדרומית לשיווק בעמ,יח`,,1,11.90,1.59
1753,מחית תפוחי עץ שלב 3 בילובד (190 גרם),שקד תבל בעמ,יח`,,1,5.90,3.11
1754,מחית תפוחי עץ ואפרסק 190גר,שקד תבל בעמ,יח`,,1,5.90,3.11
1755,מחית סלט פירות שלב 3 בילובד (190 גרם),שקד תבל בעמ,יח`,,1,5.90,3.11
1756,קרם קוקוס טעמי אסיה (400 מל),טעמי אסיה בעמ,יח`,,1,9.90,2.48
1757,בירה בהירה בירה מלכה (330 מל),הכרם - משקאות חריפים בעמ,יח`,,1,13.90,4.12
1758,בירה אדמונית בירה מלכה (330 מל),הכרם - משקאות חריפים בעמ,יח`,,1,13.90,4.12
1759,בירה מלכה חיטה 330 מל,הכרם - משקאות חריפים בעמ,יח`,,1,13.90,4.12
1760,הלבנה עדינה סנסודיין (75 מל),גורי ע.ע.ע בעמ,יח`,,1,20,26.67
1761,משחת שיניים בטעם מנטה סנסודיין (75 מל),גורי ע.ע.ע בעמ,יח`,,1,20,26.67
1762,משקה קל תפוחים ג`אמפ (1.5 ליטר),טמפו משקאות בעמ,יח`,,1,5.50,0.37
1763,בורקס פילו גבינה מעדנות,תנובה קפואים,יח`,,1,21.90,3.65
1764,בורקס פילו תפוא מעדנות,תנובה קפואים,יח`,,1,21.90,3.65
1765,בורקס פילו פיצה מעדנות,תנובה קפואים,יח`,,1,21.90,3.65
1766,בורקס פילו בולגרית מעדנות,תנובה קפואים,יח`,,1,21.90,3.65
1767,בצק פריך מתוק 900 גר` מעדנות,תנובה קפואים,יח`,,1,24,2.67
1768,בצק פריך מלוח 900 גר` מעדנות,תנובה קפואים,יח`,,1,24,2.67
1769,בצק שמרים מתוק מעדנות,תנובה קפואים,יח`,,1,22.90,2.54
1770,תערובת עוגת שוקולד 560 גר`,מימונס אפיה בעמ,יח`,,1,17.90,3.20
1771,תערובת בראוניס 600 גר`,מימונס אפיה בעמ,יח`,,1,11,1.83
1772,תערובת כדורי שוקולד 500 גר`,מימונס אפיה בעמ,יח`,,1,17.90,3.58
1773,תערובת להכנת פנקייק מימונס (400 גרם),מימונס אפיה בעמ,יח`,,1,15.90,3.98
1774,תערובת עוגת וניל מימונס (560 גרם),מימונס אפיה בעמ,יח`,,1,15.90,2.84
1775,תערובת עוגת שיש 560 גר`,מימונס אפיה בעמ,יח`,,1,16.90,3.02
1776,פודינג בטעם וניל 85 גר` מימונס,מימונס אפיה בעמ,יח`,,1,5.30,6.24
1777,פודינג בטעם שוקולד 95 גר` מימונס,מימונס אפיה בעמ,יח`,,1,3.60,3.79
1778,ג`לי בטעם תות 85 גר` מימונס,מימונס אפיה בעמ,יח`,,1,5.60,6.59
1779,גלילית וופל למילוי ג`וני,מימונס אפיה בעמ,יח`,,1,22.90,5.73
1780,סירופ מייפל אמיתי מימונס (236 מל),מימונס אפיה בעמ,יח`,,1,38.90,16.48
1781,אגוז מלך קלוף מימונס (100 גרם),מימונס אפיה בעמ,יח`,,1,11.90,11.90
1782,אגוז מלך טחון מימונס (100 גרם),מימונס אפיה בעמ,יח`,,1,11.90,11.90
1783,ג`ל טעם לימון 95 גר מימונס,מימונס אפיה בעמ,יח`,,1,6.90,7.26
1784,פודינג בטעם וניל לבן 80 גר` מימונס,מימונס אפיה בעמ,יח`,,1,5.30,6.63
1785,פודינג בטעם שוקולד 80 גר` מימונס,מימונס אפיה בעמ,יח`,,1,5.50,6.88
1786,מלית פרג 400 גר`,מימונס אפיה בעמ,יח`,,1,17.50,4.38
1787,מלית אוכמניות 70% פרי 400 גר`,מימונס אפיה בעמ,יח`,,1,19.90,4.98
1788,מלית דובדבנים 70% פרי 400 גר`,מימונס אפיה בעמ,יח`,,1,19.90,4.98
1789,ממרח קרם נוגט,מימונס אפיה בעמ,יח`,,1,14.90,4.26
1790,מיקס טרופי א.מ שרון (500 גרם),א.מ. שרון שיווק (2014) בעמ,יח`,,1,24.90,4.98
1791,דובדבן קפוא א.מ שרון (500 גרם),א.מ. שרון שיווק (2014) בעמ,יח`,,1,19.90,3.98
1792,פטל אדום א.מ שרון (500 גרם),א.מ. שרון שיווק (2014) בעמ,יח`,,1,24.90,4.98
1793,דומדמנית שחורה א.מ שרון (500 גרם),א.מ. שרון שיווק (2014) בעמ,יח`,,1,24.90,4.98
1794,מיקס פירות שדה א.מ שרון (500 גרם),א.מ. שרון שיווק (2014) בעמ,יח`,,1,24.90,4.98
1795,פטל שחור א.מ שרון (500 גרם),א.מ. שרון שיווק (2014) בעמ,יח`,,1,24.90,4.98
1796,חמוצית גן א.מ שרון (400 גרם),א.מ. שרון שיווק (2014) בעמ,יח`,,1,24.90,6.23
1797,דומדמנית אדומה 500 גרם,א.מ. שרון שיווק (2014) בעמ,יח`,,1,24.90,4.98
1798,מיקס פירות יער א.מ שרון (500 גרם),א.מ. שרון שיווק (2014) בעמ,יח`,,1,24.90,4.98
1799,תות שדה א.מ שרון (500 גרם),א.מ. שרון שיווק (2014) בעמ,יח`,,1,24.90,4.98
1800,אוכמנית א.מ שרון (400 גרם),א.מ. שרון שיווק (2014) בעמ,יח`,,1,24.90,6.23
1801,אננס קפוא 500 גר`,א.מ. שרון שיווק (2014) בעמ,יח`,,1,24.90,4.98
1802,מנגו קפוא 500 גר`,א.מ. שרון שיווק (2014) בעמ,יח`,,1,24.90,4.98
1803,מלון קפוא 500 גר`,א.מ. שרון שיווק (2014) בעמ,יח`,,1,24.90,4.98
1804,שטראוס קרמיסימו,גלידות שטראוס בעמ,יח`,,1,17.90,13.46
1805,סנו מקסימה מרכך 1 ליטר כחול פסים,החברה הדרומית לשיווק בעמ,יח`,,1,17.90,1.79
1806,סנו מקסימה מרכך 1 ליטר סגול,החברה הדרומית לשיווק בעמ,יח`,,1,12.90,1.29
1807,ריצפז פרש 2 ליטר מאסק,החברה הדרומית לשיווק בעמ,יח`,,1,21.90,10.95
1808,אוקסיג`ן ג`ל 3 ליטר,החברה הדרומית לשיווק בעמ,יח`,,1,29.90,9.97
1809,מקסימה ג`ל כביסה 3 ליטר,החברה הדרומית לשיווק בעמ,יח`,,1,29.60,9.87
1810,סנובון שלישיה מאסק,החברה הדרומית לשיווק בעמ,יח`,,1,11.90,6.10
1811,מקסימה מרכך סופר מרוכז ביו סנו (1 ליטר),החברה הדרומית לשיווק בעמ,יח`,,1,15.90,1.59
1812,מטליות לחות למוצרי עור סנו (20),החברה הדרומית לשיווק בעמ,יח`,,1,19.10,19.10
1813,מקסימה ג`ל כביסה 3 ליטר,החברה הדרומית לשיווק בעמ,יח`,,1,29.60,9.87
1814,מקסימה ג`ל כביסה 3 ליטר,החברה הדרומית לשיווק בעמ,יח`,,1,29.60,0.01
1815,ריצפז פרש מטליות חד פעמיות 10 יח`,החברה הדרומית לשיווק בעמ,יח`,,1,12.90,12.90
1816,ריצפז 3 ליטר פנטזיה,החברה הדרומית לשיווק בעמ,יח`,,1,17.90,5.97
1817,סנובון ג`ל בניחוח לימון,החברה הדרומית לשיווק בעמ,יח`,,1,12.90,19.85
1818,סנובון ג`ל בניחוח אוקיינוס,החברה הדרומית לשיווק בעמ,יח`,,1,12.90,19.85
1819,אורביטול מברשת שיניים פיות,החברה הדרומית לשיווק בעמ,יח`,,1,12.90,12.90
1820,מפות שולחן 120*180 סמ סנו (2),החברה הדרומית לשיווק בעמ,יח`,,1,9.90,9.90
1821,קוטל חרקים קיי 333 סנו (750 מל),החברה הדרומית לשיווק בעמ,יח`,,1,36.90,4.92
1822,קוטל מעופפים קיי פירטרום סנו (400 מל),החברה הדרומית לשיווק בעמ,יח`,,1,24.90,6.23
1823,בירה נגב אואזיס 330 מל,הכרם - משקאות חריפים בעמ,יח`,,1,13.90,4.12
1824,בירה נגב אמבר אייל 330 מל,הכרם - משקאות חריפים בעמ,יח`,,1,13.90,4.12
1825,פירורי לחם מוזהבים מאסטר שף (320גרם),ש.שסטוביץ בעמ,יח`,,1,7.90,2.47
1826,פירורי לחם פנקו מוזהבים 300 גר` מנה מאסט,ש.שסטוביץ בעמ,יח`,,1,9.90,3.30
1827,פירורי לחם פנקו מוזהבים שום 300 גר` מנה,ש.שסטוביץ בעמ,יח`,,1,9.90,3.30
1828,רוטב טריאקי מאסטר שף (300 מל),ש.שסטוביץ בעמ,יח`,,1,11.90,3.97
1829,רוטב צ`ילי מתוק מאסטר שף (700 מל),ש.שסטוביץ בעמ,יח`,,1,12.90,1.84
1830,רוטב צ`ילי חריף מאסטר שף (700 מל),ש.שסטוביץ בעמ,יח`,,1,12.90,1.84
1831,סירופ 1 ליטר דיאט לימונענע,זנלכל בעמ,יח`,,1,7.80,0.78
1832,פחית דיאט ספרייט 330 מל,החברה המרכזית להפצת משקאות בעמ,יח`,,1,3,0.82
1833,משקה קל לימונענע פריגת (1.5 ליטר),החברה המרכזית להפצת משקאות בעמ,יח`,,1,7.20,0.48
1834,ספרייט זירו 330 מל סילק,החברה המרכזית להפצת משקאות בעמ,יח`,,1,4.50,1.27
1835,מארז מיוחד בירה קרלסברג (330x6 מל),החברה המרכזית להפצת משקאות בעמ,יח`,,1,36.90,1.77
1836,מארז סודה קינלי 1.5 ליטר שישייה,החברה המרכזית להפצת משקאות בעמ,יח`,,1,19.90,0.22
1837,ויסוצקי ice נענע 1.5 ליטר,החברה המרכזית להפצת משקאות בעמ,יח`,,1,7.90,5.27
1838,ויסוצקי ice לימונית לואיזה 1.5 ליטר,החברה המרכזית להפצת משקאות בעמ,יח`,,1,7.90,5.27
1839,ויסוצקי ice היביסקוס פ.אדומים 1.5 ליטר,החברה המרכזית להפצת משקאות בעמ,יח`,,1,7.90,5.27
1840,ויסוצקי ice ארל גריי 1.5 ליטר,החברה המרכזית להפצת משקאות בעמ,יח`,,1,7.90,5.27
1841,מיץ רימונים סחוט פרימור (1 ליטר),שטראוס גרופ בעמ/מצונן,יח`,,1,23.20,23.20
1842,שניצל אותיות מאמא עוף (700 גרם),תנובה קפואים,יח`,,1,34.90,4.99
1843,פסטה א-לה רומר להקפצה 450 גר` מאמא עוף,תנובה קפואים,יח`,,1,19.90,4.42
1844,חגיגה אסייתית להקפצה 450 גר` מאמא עוף,תנובה קפואים,יח`,,1,19.90,4.42
1845,ירוק גלילי להקפצה 450 גר` מאמא עוף,תנובה קפואים,יח`,,1,19.90,4.42
1846,מים בטעם פירות יער שוופס (1.5 ליטר),יפאורה,יח`,,1,6.30,0.42
1847,מים בטעם אפרסק שוופס (1.5 ליטר),יפאורה,יח`,,1,6.30,0.42
1848,שוופס ווטר אפרסק 500מל,יפאורה,יח`,,1,4.80,0.90
1849,מים בטעם ענבים שוופס (1.5 ליטר),יפאורה,יח`,,1,6.30,0.42
1850,מים בטעם תפוח שוופס (1.5 ליטר),יפאורה,יח`,,1,6.30,0.42
1851,משקה מוגז לימונייד שוופס (1.5 ליטר),יפאורה,יח`,,1,6.90,0.46
1852,משקה מוגז לימונדה ורודה שוופס (1.5 ליטר),יפאורה,יח`,,1,6.90,0.46
1853,משקה מוגז למון ליים שוופס (1.5 ליטר),יפאורה,יח`,,1,4.80,0.32
1854,שוופס דיאט למון ליים 1.5 ל`,יפאורה,יח`,,1,4.80,0.32
1855,שוופס מוגז עדין 1.5 ליטר אננס,יפאורה,יח`,,1,6.90,0.46
1856,שישיית שוופס למון ליים 1.5 ל`,יפאורה,יח`,,1,23,23
1857,שישיית שוופס דיאט למון ליים 1.5 ל`,יפאורה,יח`,,1,34.90,34.90
1858,משקה פירות בטעם גווארנה שוופס (1.5 ליטר),יפאורה,יח`,,1,6.90,4.60
1859,משוקלדים חמוציות מריר 160 גר` בקופסא,דין שיווק וקליה בעמ,יח`,,1,10,6.25
1860,משוקלדים פקאן מריר 160 גר` בקופסא,דין שיווק וקליה בעמ,יח`,,1,10,6.25
1861,משוקלדים חמוציות חלב 160 גר` בקופסא,דין שיווק וקליה בעמ,יח`,,1,10,6.25
1862,משוקלדים שקד חלב 160 גר` בקופסא,דין שיווק וקליה בעמ,יח`,,1,10,6.25
1863,משוקלדים צימוק מריר 160 גר` בקופסא,דין שיווק וקליה בעמ,יח`,,1,10,6.25
1864,משוקלדים בוטן מריר 160 גר` בקופסא,דין שיווק וקליה בעמ,יח`,,1,10,6.25
1865,משוקלדים לוז חלב 160 גר` בקופסא,דין שיווק וקליה בעמ,יח`,,1,10,6.25
1866,משוקלדים לוז מריר 160 גר` בקופסא,דין שיווק וקליה בעמ,יח`,,1,10,6.25
1867,משוקלדים שומשום חלב 160 גר` בקופסא,דין שיווק וקליה בעמ,יח`,,1,10,6.25
1868,משוקלדים שומשום מריר 160 גר` בקופסא,דין שיווק וקליה בעמ,יח`,,1,10,6.25
1869,מגבונים לניקוי כללי סנו סושי (50),החברה הדרומית לשיווק בעמ,יח`,,1,7.10,7.10
1870,כיף סבון מוצק רב,ספקים שונים,יח`,,1,13.90,13.90
1871,דאודורנט ספריי מאסק קרמה (150 מל),החברה הדרומית לשיווק בעמ,יח`,,1,19.90,13.27
1872,משוקלדים צימוק חלב 160 גר` בקופסא,דין שיווק וקליה בעמ,יח`,,1,10,6.25
1873,משוקלדים בוטן חלב 160 גר` בקופסא,דין שיווק וקליה בעמ,יח`,,1,11.90,7.44
1874,נקניקיות פרגיות 300 גר` טירת צבי,תנובה קפואים,יח`,,1,13.90,4.63
1875,פסטרמה שום וצילי טירת צבי (400 גרם),תנובה קפואים,יח`,,1,31.90,7.98
1876,נקניקיות וינר 1 קג` טירת צבי,תנובה קפואים,יח`,,1,32.90,6.58
1877,קבנוס 120 גר` טירת צבי,תנובה קפואים,יח`,,1,7.50,6.25
1878,קבנוס 120 גר` פיקנטי טירת צבי,תנובה קפואים,יח`,,1,9,7.50
1879,חטיפי קבנוס 120 גר` טירת צבי,תנובה קפואים,יח`,,1,9,7.50
1880,צמד כפרי ברבקיו ודבש 600 גר טירת צבי,תנובה קפואים,יח`,,1,29.90,4.98
1881,טרין מוס כבד עוף 120 גר` תנובה,תנובה קפואים,יח`,,1,15.90,13.25
1882,נשנושי קבנוס יחיעם (125 גרם),מעדני יחיעם (1993) בעמ,יח`,,1,12.90,10.32
1883,נקניקיות עוף 1.5 קג,מעדני יחיעם (1993) בעמ,יח`,,1,29.90,29.90
1884,פסטרמה ברביקיו דק דק יחיעם (140 גרם),מעדני יחיעם (1993) בעמ,יח`,,1,12.90,9.21
1885,פסטרמה בדבש דק דק יחיעם (140 גרם),מעדני יחיעם (1993) בעמ,יח`,,1,12.90,9.21
1886,פסטרמה של פעם דק דק יחיעם (140 גרם),מעדני יחיעם (1993) בעמ,יח`,,1,12.90,9.21
1887,פסטרמה מעודנת על גחלים יחיעם (300 גרם),מעדני יחיעם (1993) בעמ,יח`,,1,23.90,7.97
1888,סלמי תה יחיעם (300 גרם),מעדני יחיעם (1993) בעמ,יח`,,1,25.90,8.63
1889,סלמי פפרוני 200 גר` יחיעם,מעדני יחיעם (1993) בעמ,יח`,,1,14.90,7.45
