,ItemName,ManufactureName,UnitQty,Quantity,QtyInPackage,ItemPrice,UnitOfMeasurePrice
1686,אקונומיקה כחולה סנו (4 ליטר),החברה הדרומית לשיווק בעמ,יח`,,1,10.90,2.73
1687,ז`אוול מרסס לניקוי כללי לבנדר סנו (1 ליט,החברה הדרומית לשיווק בעמ,יח`,,1,19.90,19.90
1688,אבקת ניקוי ז אוול מילוי,החברה הדרומית לשיווק בעמ,יח`,,1,10.90,1.82
1689,סנומט 30 טבליות,החברה הדרומית לשיווק בעמ,יח`,,1,14.90,14.90
1690,קוטל חרקים קיי 300 סנו (630 מל),החברה הדרומית לשיווק בעמ,יח`,,1,21.90,3.48
1691,קוטל זבובים יתושים קיי 600 סנו (500 מל),החברה הדרומית לשיווק בעמ,יח`,,1,24,5.05
1692,סנו מקסימה 4 ליטר ורוד פסים,החברה הדרומית לשיווק בעמ,יח`,,1,19.90,4.98
1693,סנו ז`אוול מרסס 1 ליטר,החברה הדרומית לשיווק בעמ,יח`,,1,19.90,19.90
1694,סנו k3 פיתיון ג`ל קוטל  נמלים- סנו,החברה הדרומית לשיווק בעמ,יח`,,1,49.90,49.90
1695,ז`אוול מונטבלאן ג`ל לאסלות סנו (750 מל),החברה הדרומית לשיווק בעמ,יח`,,1,9.90,1.32
1696,סושי שקיות אשפה גדולות 50 יח`,החברה הדרומית לשיווק בעמ,יח`,,1,19.90,19.90
1697,קרם לניקוי כללי לימון סנו (750 מל),החברה הדרומית לשיווק בעמ,יח`,,1,11.90,1.59
1698,מש.שיניים אורביטול ילדים,החברה הדרומית לשיווק בעמ,יח`,,1,9.90,6.83
1699,מסיר שומנים פורטה פלוס סנו (750 מל),החברה הדרומית לשיווק בעמ,יח`,,1,16.90,2.25
1700,סנופרש יבש,החברה הדרומית לשיווק בעמ,יח`,,1,12.90,3.44
1701,תחליב לניקוי מוצרי עור סנו (500 מל),החברה הדרומית לשיווק בעמ,יח`,,1,29.90,5.98
1702,פוליויקס 2 ליטר,החברה הדרומית לשיווק בעמ,יח`,,1,22.90,11.45
1703,קוטל חרקים K2000 ללא ריח סנו (750 מל),החברה הדרומית לשיווק בעמ,יח`,,1,31.90,4.25
1704,סנובון לאסלה קלאסיק כחול סנו (55x3 גרם),החברה הדרומית לשיווק בעמ,יח`,,1,18.90,11.45
1705,סנו מקסימה 4 ליטר לבן,החברה הדרומית לשיווק בעמ,יח`,,1,19.90,4.98
1706,אנטי קלאק מרסס ברזים/ כיורים,החברה הדרומית לשיווק בעמ,יח`,,1,16.90,16.90
1707,סנוג`ט יכול הכל סחלבים סנו (4 ליטר),החברה הדרומית לשיווק בעמ,יח`,,1,19.90,4.98
1708,סנומוד מדונה,החברה הדרומית לשיווק בעמ,יח`,,1,11.90,7.93
1709,אקונומיקה ז`אוול לבנדר סנו (4 ליטר),החברה הדרומית לשיווק בעמ,יח`,,1,15.90,0.40
1710,אקונומיקה ז`אוול סמיכה סנו (4 ליטר),החברה הדרומית לשיווק בעמ,יח`,,1,15.90,0.40
1711,מטלית ריצפה זיגזג סנו סושי (3),החברה הדרומית לשיווק בעמ,יח`,,1,12.90,12.90
1712,כרית יפנית לכלים אקטיב סנו סושי (4),החברה הדרומית לשיווק בעמ,יח`,,1,11.90,11.90
1713,סנו מקסימה 2.5 קג`,החברה הדרומית לשיווק בעמ,יח`,,1,24.90,9.96
1714,שקיות אשפה לפח 65x54 סנו סושי (60),החברה הדרומית לשיווק בעמ,יח`,,1,22.90,22.90
1715,שקיות סנדביצ`ים סנו סושי (150x2),החברה הדרומית לשיווק בעמ,יח`,,1,13.90,13.90
1716,רב מגבת ג`מבו סנו סושי,החברה הדרומית לשיווק בעמ,יח`,,1,24.90,6.38
1717,סושי רדיד אלומיניום צמד,החברה הדרומית לשיווק בעמ,יח`,,1,12.90,12.90
1718,סנו סושי - רדיד אלומיניום צמד 7.5*45,החברה הדרומית לשיווק בעמ,יח`,,1,16.90,16.90
1719,ספוגיות אל חלד סנו) (3,החברה הדרומית לשיווק בעמ,יח`,,1,10.90,10.90
1720,טבעול-שניצל תירס 750 גרם,קבוצת אסם סחר שות. מוגבלת,יח`,,1,24.90,3.32
1721,חטיפי כרובית בציפוי פריך טבעול (500 גרם),קבוצת אסם סחר שות. מוגבלת,יח`,,1,31.90,6.38
1722,פאקט טיים רד,דובק בעמ,יח`,,1,268,1.34
1723,פאקט גולף גולד 100,דובק בעמ,יח`,,1,280,280
1724,פאקט גולף סילבר 100,דובק בעמ,יח`,,1,280,280
1725,פול מצרי 560 גר,ויטה -פרי גליל (החדשה) בעמ,יח`,,1,4.90,0.88
1726,שעועית לבנה אפויה,ויטה -פרי גליל (החדשה) בעמ,יח`,,1,5.90,1.07
1727,חומוס שלם A2,ויטה -פרי גליל (החדשה) בעמ,יח`,,1,5.90,0.98
1728,סלט טונה פיקנטי נון (160 גרם),סטארקיסט דיפלומט היינץ,יח`,,1,6.90,4.31
1729,רביעיות סלט טונה 160  גר`יונה,סטארקיסט דיפלומט היינץ,יח`,,1,17.90,2.80
1730,אפונה גדולה A2,ויטה -פרי גליל (החדשה) בעמ,יח`,,1,5.90,0.98
1731,אפונה וגזר A2,ויטה -פרי גליל (החדשה) בעמ,יח`,,1,5.90,1.07
1732,תירס גרעינים 340,ויטה -פרי גליל (החדשה) בעמ,יח`,,1,4.90,1.09
1733,תירס גרעינים 550 גר`,ויטה -פרי גליל (החדשה) בעמ,יח`,,1,5.90,1.07
1734,עוגיות גרנולה בטעם שוקולד מן (250 גרם),רוקחמן בעמ,יח`,,1,7.90,2.63
1735,מינימן לא מצופה 200  גר`מן,רוקחמן בעמ,יח`,,1,5.90,2.95
1736,וופלים מקמח חיטה מלאה מן,רוקחמן בעמ,יח`,,1,5.90,1.18
1737,עוגיות מן דגנים,רוקחמן בעמ,יח`,,1,7.90,3.16
1738,עוגיות מובחרות בטעם חמאה מן (300 גרם),רוקחמן בעמ,יח`,,1,6.90,2.30
1739,וופל עשיריות 25*10 מן,רוקחמן בעמ,יח`,,1,7.90,3.16
1740,וופל שוקולד מן (200 גרם),רוקחמן בעמ,יח`,,1,4.90,2.45
1741,וופלים לימון מן (200 גרם),רוקחמן בעמ,יח`,,1,4.90,2.45
1742,וופלים 200 גר` קפה מן,רוקחמן בעמ,יח`,,1,4.90,2.45
1743,וופל 200 גר` וניל מן,רוקחמן בעמ,יח`,,1,4.90,2.45
1744,ופל מן מצופה 250 גר מן,רוקחמן בעמ,יח`,,1,5.90,2.36
1745,מיני ופל מצופה 200 גר`,רוקחמן בעמ,יח`,,1,7.90,3.95
1746,וופלים מצופים מן (1 קג),רוקחמן בעמ,יח`,,1,22.90,22.90
1747,וופל אגוזית 10יח*28גר מן,רוקחמן בעמ,יח`,,1,10.90,3.89
1748,וופל בטעם שוקולד 10יח*21גר מן,רוקחמן בעמ,יח`,,1,7.90,3.76
1749,ופלים מצופים מן (22x10 גרם),רוקחמן בעמ,יח`,,1,7.90,3.95
1750,וופל שוקולד מן (500 גרם),רוקחמן בעמ,יח`,,1,8.90,1.78
1751,וופלים 500 גר לימון מן,רוקחמן בעמ,יח`,,1,8.90,1.78
1752,עוגיות חיטה מלאה מן (300 גרם),רוקחמן בעמ,יח`,,1,6.90,2.30
1753,עוגיות כוכבים בטעם שוקולד מן (300 גרם),רוקחמן בעמ,יח`,,1,6.90,2.30
1754,עוגיות בטעם וניל 300 גר` מן,רוקחמן בעמ,יח`,,1,6.90,2.30
1755,עוגיות חיטה מלאה בטעם חלווה 250 גרם,רוקחמן בעמ,יח`,,1,6.90,2.76
1756,ופלים ללא תוספת סוכר בטעם שוקולד,רוקחמן בעמ,יח`,,1,7.90,4.39
1757,ופלים ללא תוספת סוכר בטעם וניל,רוקחמן בעמ,יח`,,1,7.90,4.39
1758,עוגיות גרנולה ללא תוספת סוכר,רוקחמן בעמ,יח`,,1,8.90,4.45
1759,חברים זהבה 3 דובים שוקו,קבוצת אסם סחר שות. מוגבלת,יח`,,1,7.90,3.16
1760,נודלס אטריות ביצים שטוחות אסם (300 גרם),קבוצת אסם סחר שות. מוגבלת,יח`,,1,9.90,3.30
1761,נודלס אטריות מסולסלות אסם (50x4 גרם),קבוצת אסם סחר שות. מוגבלת,יח`,,1,9.90,4.95
1762,ציר עוף קנור (300 גרם),יוניליוור ישראל שיווק בעמ,יח`,,1,25.90,8.63
1763,קורנפלקס מלא בדצ 500 גר`,יוניליוור ישראל שיווק בעמ,יח`,,1,15.90,3.18
1764,נקניקיות ביס יחיעם (380 גרם),מעדני יחיעם (1993) בעמ,יח`,,1,10.90,2.87
1765,סלמי סרוולט יחיעם (250 גרם),מעדני יחיעם (1993) בעמ,יח`,,1,34.90,13.96
1766,נקניקיות וינר 1 קג,מעדני יחיעם (1993) בעמ,יח`,,1,19.90,1.99
1767,קבנוס קלאסי יחיעם (125 גרם),מעדני יחיעם (1993) בעמ,יח`,,1,12.90,10.32
1768,קבנוס פפרוני יחיעם (125 גרם),מעדני יחיעם (1993) בעמ,יח`,,1,12.90,10.32
1769,משקה קל מנגו פסיפלורה ג`אמפ (1.5 ליטר),טמפו משקאות בעמ,יח`,,1,5.50,0.37
1770,מי סודה טמפו (1.5 ליטר),טמפו משקאות בעמ,יח`,,1,3,0.20
1771,צ`יפס למיקרוגל תפוגן (125x3 גרם),קבוצת אסם סחר שות. מוגבלת,יח`,,1,13.90,3.66
1772,תפוגן 2  קג`בדצ,קבוצת אסם סחר שות. מוגבלת,יח`,,1,32.90,16.45
1773,טבעות בצל תפוגן (700 גרם),קבוצת אסם סחר שות. מוגבלת,יח`,,1,16.90,2.41
1774,אמריקן צ`יפס תפוגן (1.5 קג),קבוצת אסם סחר שות. מוגבלת,יח`,,1,27.90,18.60
1775,תרכיז טבעי סיידר הגליל (330 מל),טמפו משקאות בעמ,יח`,,1,9.90,2.91
1776,רן אבקת הלבנה,יוניליוור ישראל שיווק בעמ,יח`,,1,21.90,6.26
1777,מרכך כביסה ורוד בדין (4 ליטר),יוניליוור ישראל שיווק בעמ,יח`,,1,19.90,4.98
1778,משחת כלים קלין 3.5 קג`,יוניליוור ישראל שיווק בעמ,יח`,,1,31.90,9.11
1779,משחת כלים קלין 500 גר`,יוניליוור ישראל שיווק בעמ,יח`,,1,9.90,1.98
1780,בדין בייבי 2 ליטר,יוניליוור ישראל שיווק בעמ,יח`,,1,20.90,10.45
1781,מרכך כביסה כחול בדין (4 ליטר),יוניליוור ישראל שיווק בעמ,יח`,,1,19.90,4.98
1782,תה 74,תה ויסוצקי (ישראל) בעמ,יח`,,1,13.10,10.48
1783,תה ארל גריי ויסוצקי (100 גרם),תה ויסוצקי (ישראל) בעמ,יח`,,1,13.90,13.90
1784,תה ארל גריי 200 גר`,תה ויסוצקי (ישראל) בעמ,יח`,,1,31.90,15.95
1785,תה מעודן ויסוצקי) (25,תה ויסוצקי (ישראל) בעמ,יח`,,1,6.90,27.60
1786,תה מעודן ויסוצקי (100),תה ויסוצקי (ישראל) בעמ,יח`,,1,16.90,16.90
1787,תה קלאסיק ויסוצקי) (25,תה ויסוצקי (ישראל) בעמ,יח`,,1,7.30,19.47
1788,תה קלאסיק ויסוצקי (100),תה ויסוצקי (ישראל) בעמ,יח`,,1,16.90,11.27
1789,תה ארל גריי ויסוצקי) (25,תה ויסוצקי (ישראל) בעמ,יח`,,1,15.90,42.40
1790,תה ארל גריי ויסוצקי (50),תה ויסוצקי (ישראל) בעמ,יח`,,1,27.90,37.20
1791,תה נענע ויסוצקי) (25,תה ויסוצקי (ישראל) בעמ,יח`,,1,16.90,45.07
1792,תה קמומיל בבונג ויסוצקי הגן הקסום) (50,תה ויסוצקי (ישראל) בעמ,יח`,,1,33.90,45.20
1793,תה קסם הקינמון ויסוצקי הגן הקסום) (25,תה ויסוצקי (ישראל) בעמ,יח`,,1,17.50,28
1794,תה הילולי פירות ויסוצקי הגן הקסום) (25,תה ויסוצקי (ישראל) בעמ,יח`,,1,17.50,28
1795,תה פירות היער ויסוצקי הגן הקסום) (25,תה ויסוצקי (ישראל) בעמ,יח`,,1,17.50,25.93
1796,תה מנטה ויסוצקי הגן הקסום) (25,תה ויסוצקי (ישראל) בעמ,יח`,,1,17.50,35
1797,תה ירוק נענע ויסוצקי (25),תה ויסוצקי (ישראל) בעמ,יח`,,1,24.90,66.40
1798,תה ירוק לימונית ולואיזה ויסוצקי (25),תה ויסוצקי (ישראל) בעמ,יח`,,1,24.90,66.40
1799,סלסולי כתף בקר 120 גר` טירת צבי,תנובה קפואים,יח`,,1,15.90,13.25
1800,סלסולי סלמי איטלקי 120 גר` טירת צבי,תנובה קפואים,יח`,,1,15.90,13.25
1801,סלסולי פסטרמה גחלים 120 גר` טירת צבי,תנובה קפואים,יח`,,1,15.90,13.25
1802,צמד כפרי 800 גר` טירת צבי,תנובה קפואים,יח`,,1,34.90,4.36
1803,כדורי גבינת פטה בשמנים ארומתיים,הגבינות של ניצן,יח`,,1,16.90,7.35
1804,חמאה 100גר ט.שוניים,הגבינות של ניצן,יח`,,1,12.90,12.90
1805,בוטנים מטוגנים קליית גת (200 גרם),ליימן שליסל בעמ,יח`,,1,7.90,3.95
1806,נאש צ אנס שקית 200 גר,ליימן שליסל בעמ,יח`,,1,8.90,4.45
1807,גרעיני אבטיח 200  גר`גת,ליימן שליסל בעמ,יח`,,1,13.90,6.95
1808,לחם אחיד פרוס (750 גרם פיקוח,שלמה א. אנג`ל בעמ,יח`,,1,6.60,0.88
1809,לחם עינן קל פרוס אנג`ל (500 גרם),שלמה א. אנג`ל בעמ,יח`,,1,14.80,2.96
1810,לחמניה אנג`ל,שלמה א. אנג`ל בעמ,יח`,,1,1.90,2.53
1811,לחמניה ארוכה שומשום אנג`ל,שלמה א. אנג`ל בעמ,יח`,,1,2.90,2.32
1812,לחם שחור פיקוח,שלמה א. אנג`ל בעמ,יח`,,1,3.90,0.52
1813,חלה רגילה אנג`ל/דגנית (500 גרם) מובי,שלמה א. אנג`ל בעמ,יח`,,1,4.45,0.89
1814,חלה קלועה,שלמה א. אנג`ל בעמ,יח`,,1,4.40,0.88
1815,חלה עגולה אנג`ל,שלמה א. אנג`ל בעמ,יח`,,1,4.40,0.88
1816,יוגורט ביו 3% דנונה (200 גרם),שטראוס גרופ בעמ/מצונן,יח`,,1,3.40,1.70
1817,דנונה פרי בר פיצפוצים,שטראוס גרופ בעמ/מצונן,יח`,,1,4.40,2.54
1818,נוזל לניקוי אסלות 00 סנו (1 ליטר),החברה הדרומית לשיווק בעמ,יח`,,1,8.90,8.90
1819,פזוטקס מעופפים,החברה הדרומית לשיווק בעמ,יח`,,1,18.90,3
1820,ממרח בטעם שוקולד השחר העולה (500 גרם),השחר העולה תעשית ממתקים בעמ,יח`,,1,12.90,2.58
1821,ממרח בטעם שוקולד השחר העולה (1 קג),השחר העולה תעשית ממתקים בעמ,יח`,,1,23.90,23.90
1822,צימקאו השחר העולה (400 גרם),השחר העולה תעשית ממתקים בעמ,יח`,,1,12.90,3.23
1823,ממרח 400 גר` פרווה השחר,השחר העולה תעשית ממתקים בעמ,יח`,,1,11.90,2.98
1824,ממרח פרווה 1 קג` השחר,השחר העולה תעשית ממתקים בעמ,יח`,,1,22.90,22.90
1825,ממרח חצי חצי 350 גר` השחר,השחר העולה תעשית ממתקים בעמ,יח`,,1,11.90,3.40
1826,אבקת קקאו השחר העולה (150 גרם),השחר העולה תעשית ממתקים בעמ,יח`,,1,9.90,6.60
1827,אבקת קקאו השחר העולה (500 גרם),השחר העולה תעשית ממתקים בעמ,יח`,,1,29.90,5.98
1828,ממרח נוגט אגוזים 350 גר` השחר,השחר העולה תעשית ממתקים בעמ,יח`,,1,12.90,3.69
1829,קפה שחור קפה לנדוור (200 גרם),קבוצת אסם סחר שות. מוגבלת,יח`,,1,15.90,7.95
1830,קפה שחור קפה לנדוור (100x3 גרם),קבוצת אסם סחר שות. מוגבלת,יח`,,1,22.90,7.63
1831,קפה לנדוור לבוקר שלישיה,קבוצת אסם סחר שות. מוגבלת,יח`,,1,22.90,7.63
1832,קפה לנדוור לבוקר 100,קבוצת אסם סחר שות. מוגבלת,יח`,,1,7.90,7.90
1833,קפה לנדוור אספרסו קפה טחון 100,קבוצת אסם סחר שות. מוגבלת,יח`,,1,7.90,7.90
1834,פופקורן פופסטאר חמישייה טבעי,דנשר (1963) בעמ,יח`,,1,16.90,3.38
1835,פופקורן פופסטאר חמישייה חמאה,דנשר (1963) בעמ,יח`,,1,16.90,3.38
1836,גלילונית לפח 60 יח`,דנשר (1963) בעמ,יח`,,1,19.90,19.90
1837,נרות שבת 4  יח`פאלאס,פאלאס תעשיות נטו (2014) בעמ,יח`,,1,3.90,2.79
1838,נרות 72 יח,פאלאס תעשיות נטו (2014) בעמ,יח`,,1,19.90,0.28
1839,נריות בפלסטיק 5 שעות 72 יח,פאלאס תעשיות נטו (2014) בעמ,יח`,,1,24.90,24.90
1840,משקה מוגז בטעם קולה פפסי (1.5 ליטר),טמפו משקאות בעמ,יח`,,1,5.90,0.39
1841,משקה מוגז בטעם ליים סבן אפ (1.5 ליטר),טמפו משקאות בעמ,יח`,,1,5.90,0.39
1842,פפסי סבן אפ דיאט 1.5 ליטר,טמפו משקאות בעמ,יח`,,1,5.90,0.39
1843,פפסי מקס 1.5 ליטר,טמפו משקאות בעמ,יח`,,1,5.90,0.39
1844,גינקו קרם רב שימושי 250 מל`,גורי ע.ע.ע בעמ,יח`,,1,19.90,9.05
1845,תרכיז 1.2 ליטר,בטר אנד דיפרנט בעמ,יח`,,1,32.90,2.74
1846,דייסת שיבולת שועל 200 גר,בטר אנד דיפרנט בעמ,יח`,,1,10.90,5.45
1847,חמאת בוטנים מתוקה בי & די (350 גרם),בטר אנד דיפרנט בעמ,יח`,,1,12.90,3.69
1848,חמאת בוטנים טבעית בי & די (350 גרם),בטר אנד דיפרנט בעמ,יח`,,1,12.90,3.69
1849,חמאת בוטנים טבעית בי   די (1 קג),בטר אנד דיפרנט בעמ,יח`,,1,25.90,5.08
1850,חמאת שקדים 100% 350 גר`,בטר אנד דיפרנט בעמ,יח`,,1,44.90,44.90
1851,ציפוי לשניצל ללא גלוטן 300 גר`,בטר אנד דיפרנט בעמ,יח`,,1,7.90,2.63
1852,נוזל לניקוי כללי פנטסטיק סיף (4 ליטר),יוניליוור ישראל שיווק בעמ,יח`,,1,24.90,0.62
1853,נתחי טונה בהירה בשמן פוסידון (108 גרם),נטו מלינדה סחר בעמ,יח`,,1,6.50,6.02
1854,שמרים טריים שמרית (50 גרם),שטראוס גרופ בעמ/מצונן,יח`,,1,4.50,9
1855,בצק פיצה דק מצונן ומוכן לאפייה 415 גר` ש,שטראוס גרופ בעמ/מצונן,יח`,,1,16.90,4.07
1856,בצק עלים מצונן ומוכן לאפייה 300 גר` שימר,שטראוס גרופ בעמ/מצונן,יח`,,1,15.90,5.30
1857,שמרים אקטיבים שימרית 500 גר`,שטראוס גרופ בעמ,יח`,,1,15.90,3.18
1858,נטורינה קוקוס 200  גר`שמרית,שטראוס גרופ בעמ/מצונן,יח`,,1,6.90,3.45
1859,מרגרינה ללא מלח לאפיה ובישול -שמרית,שטראוס גרופ בעמ/מצונן,יח`,,1,4.90,2.45
1860,מרגרינה בטעם חמאה -שמרית,שטראוס גרופ בעמ/מצונן,יח`,,1,4.90,2.45
1861,בייגלה שמונה שמונה 400 גר`,יוניליוור ישראל שיווק בעמ,יח`,,1,10.90,2.73
1862,בייגלה אחד אחד 400 גר`,יוניליוור ישראל שיווק בעמ,יח`,,1,10.90,2.73
1863,גדול גדול 400,יוניליוור ישראל שיווק בעמ,יח`,,1,12.90,3.23
1864,גדול גדול שומשום,יוניליוור ישראל שיווק בעמ,יח`,,1,12.90,3.23
1865,מקלות  ארוך- 150 גרם,יוניליוור ישראל שיווק בעמ,יח`,,1,5.90,3.93
1866,סחוג תימני,שטראוס גרופ בעמ/מצונן,יח`,,1,7.90,5.27
1867,סחוג זחוק ירוק תימני חריף זהבי (150 גרם),שטראוס גרופ בעמ/מצונן,יח`,,1,7.90,5.64
1868,זיתים מנס. ירוק ג.מ. 17-19 שום,קבוצת אסם סחר שות. מוגבלת,יח`,,1,10.90,1.95
1869,חרוזית בעשבי תיבול בית השיטה (560 גרם),קבוצת אסם סחר שות. מוגבלת,יח`,,1,10.90,1.95
1870,חרוזית מושחר A2,קבוצת אסם סחר שות. מוגבלת,יח`,,1,10.90,1.95
1871,קוקטייל זיתים בית השיטה (560 גרם),קבוצת אסם סחר שות. מוגבלת,יח`,,1,11.90,2.13
1872,זיתים ירוקים מבוקעים A2,קבוצת אסם סחר שות. מוגבלת,יח`,,1,10.90,1.95
1873,מלפפון במלח 10-12 A2,קבוצת אסם סחר שות. מוגבלת,יח`,,1,7.90,1.46
1874,מלפפון במלח בלאדי 13-17,קבוצת אסם סחר שות. מוגבלת,יח`,,1,9.90,2.91
1875,חומוס צבר סמיר הגדול,קבוצת אסם סחר שות. מוגבלת,יח`,,1,13.90,3.48
1876,מלפפון בחומץ 10-12 A2,קבוצת אסם סחר שות. מוגבלת,יח`,,1,7.90,2.72
1877,מלפפון בחומץ 13-17 A2,קבוצת אסם סחר שות. מוגבלת,יח`,,1,9.90,3.09
1878,מלפפון בחומץ 18-25 A2,קבוצת אסם סחר שות. מוגבלת,יח`,,1,10.90,3.41
1879,חומוס צבר אבו מרוואן,קבוצת אסם סחר שות. מוגבלת,יח`,,1,13.90,3.48
1880,פלפל חריף כבוש שיפקה בית השיטה (560 גרם),קבוצת אסם סחר שות. מוגבלת,יח`,,1,6.90,3
1881,חלב 1% בקרטון טרה (1  ליטר)פ,החב` המרכזית - טרה,יח`,,1,5.59,5.59
1882,שמנת חמוצה 15% טרה (200 מל),החב` המרכזית - טרה,יח`,,1,2.28,1.14
1883,גבינה לבנה 5% 250 גר` פיקוח,החב` המרכזית - טרה,יח`,,1,4.75,1.90
1884,גבינת טוב טעם,החב` המרכזית - טרה,יח`,,1,10.90,4.36
1885,גבינה צהובה מגורדת 28% נעם (500 גרם),החב` המרכזית - טרה,יח`,,1,32.90,6.58
1886,שיבולת שועל קוואקר (500 גרם),שטראוס פריטו ליי בעמ,יח`,,1,11.90,2.38
1887,10 פיתות בטעם ביתי דגנית עין בר,דגנית עין בר תעשיות מזון ואפיה,יח`,,1,9.90,0.99
1888,לחמניות חיטה מלאה דגנית עין בר (10),דגנית עין בר תעשיות מזון ואפיה,יח`,,1,11.90,1.59
1889,לחמניות אצבע דגנית עין בר (10),דגנית עין בר תעשיות מזון ואפיה,יח`,,1,11.90,1.59
1890,קוקי ענק שקיות צליה 5 יח,ש.שסטוביץ בעמ,יח`,,1,12.90,12.90
1891,אלוף הארק 50% 700 מל,יקב הגליל שיווק בעמ,יח`,,1,66.90,9.51
1892,עלית הארק יקב הגליל (700 מל),יקב הגליל שיווק בעמ,יח`,,1,59.90,7.95
1893,מאגדת מצופה דיאט שמינייה,פלקו בעמ,יח`,,1,27,6.75
1894,מאגדת שלגונים ציפוי שוקו 8יח,פלקו בעמ,יח`,,1,24.90,24.90
1895,מאגדת גלית 8 יח`,פלקו בעמ,יח`,,1,19.90,19.90
1896,רוטב פטריות אסם (30 גרם),קבוצת אסם סחר שות. מוגבלת,יח`,,1,4.90,16.33
1897,לחם אקטיב ברמן (750 גרם),י.את א. ברמן בעמ,יח`,,1,14.90,1.99
1898,לחם אחיד כהה פרוס ברמן (750  גרם)פי,י.את א. ברמן בעמ,יח`,,1,6.60,0.88
1899,פיתות אסלי ברמן) (10,י.את א. ברמן בעמ,יח`,,1,9.90,0.99
1900,לחם קל ברמן לענין קמח חיטה מלאה,י.את א. ברמן בעמ,יח`,,1,12.90,1.72
1901,לחם ברמן לעניין פרוס ברמן (750 גרם),י.את א. ברמן בעמ,יח`,,1,12.90,1.72
1902,דגני קלות פרוס ברמן (500 גרם),י.את א. ברמן בעמ,יח`,,1,12.90,2.58
1903,לחם מקמח כוסמין מלא 750 גר` E FREE,י.את א. ברמן בעמ,יח`,,1,15.50,2.07
1904,חלה קלועה מיוחדת .,י.את א. ברמן בעמ,יח`,,1,3.40,2.72
1905,10 לחמניות בשקית ברמן,י.את א. ברמן בעמ,יח`,,1,9.90,1.32
1906,לחם כהה פיקוח,י.את א. ברמן בעמ,יח`,,1,3.90,0.52
1907,לחם לבן אחיד פיקוח מוביל,י.את א. ברמן בעמ,יח`,,1,4.85,0.65
1908,חלה רגילה (500 גרם) פיקוח,י.את א. ברמן בעמ,יח`,,1,4.45,0.89
1909,חלה חלומית 500גר.,י.את א. ברמן בעמ,יח`,,1,12.10,2.42
1910,סוכרזית פטריה) (300,שטראוס גרופ בעמ,יח`,,1,7.90,3.21
1911,סוכרזית דיאט טיפ נוזל,שטראוס גרופ בעמ,יח`,,1,18.90,8.59
1912,סוכרזית פטנט) (700,שטראוס גרופ בעמ,יח`,,1,15.90,2.77
1913,קמח חיטה לבן בהיר באר שבע,טחנות קמח שטיבל בש בעמ,יח`,,1,4.90,4.90
1914,סולת וחבילות באר שבע,טחנות קמח שטיבל בש בעמ,יח`,,1,4.90,4.90
1915,יין אדום יבש של סגל (750 מל),טמפו משקאות בעמ,יח`,,1,21,2.76
1916,יין לבן יבש של סגל (750 מל),טמפו משקאות בעמ,יח`,,1,21,2.76
1917,קברנה סוביניון של סגל (750 מל),טמפו משקאות בעמ,יח`,,1,25,3.29
1918,מרום גליל סינגל קברנה סובניון 750 מל,טמפו משקאות בעמ,יח`,,1,39.90,5.28
1919,מלח ים יבש מלח הארץ (250 גרם),תה ויסוצקי (ישראל) בעמ,יח`,,1,5.90,2.95
1920,מלח ים יבש מלח הארץ (500 גרם),תה ויסוצקי (ישראל) בעמ,יח`,,1,7.90,1.58
1921,מלח ים יבש מופחת נתרן מלח הארץ (250 גרם),תה ויסוצקי (ישראל) בעמ,יח`,,1,10.50,5.25
1922,מלח הארץ מועשר ביוד 250 גר`,תה ויסוצקי (ישראל) בעמ,יח`,,1,5.90,2.95
1923,מלח עדין מלח הארץ (1 קג),תה ויסוצקי (ישראל) בעמ,יח`,,1,7.20,7.20
1924,מלח גס מלח הארץ (1 קג),תה ויסוצקי (ישראל) בעמ,יח`,,1,7.50,7.50
1925,מיץ תפוזים סחוט טבעי פרימור (1 ליטר),שטראוס גרופ בעמ/מצונן,יח`,,1,16.20,16.20
1926,נקניק סלמי מעושן 7000 זוגלובק (600 גרם),זוגלובק שיווק בעמ,יח`,,1,34.90,4.36
