,ItemName,ManufactureName,UnitQty,Quantity,QtyInPackage,ItemPrice,UnitOfMeasurePrice
2335,שניצל אותיות מאמא עוף (700 גרם),תנובה קפואים,יח`,,1,36.90,5.27
2336,שניצל כלי תחבורה מאמא עוף (700 גרם),תנובה קפואים,יח`,,1,36.90,5.27
2337,פסטה א-לה רומר להקפצה 450 גר` מאמא עוף,תנובה קפואים,יח`,,1,20.90,4.64
2338,חגיגה אסייתית להקפצה 450 גר` מאמא עוף,תנובה קפואים,יח`,,1,20.90,4.64
2339,ירוק גלילי להקפצה 450 גר` מאמא עוף,תנובה קפואים,יח`,,1,20.90,4.64
2340,אבקת שוקו 500 גר`,מיה תעשיות מזון מ.ת.מ. בעמ,יח`,,1,7.10,1.42
2341,מים בטעם פירות יער שוופס (1.5 ליטר),יפאורה,יח`,,1,6.70,0.45
2342,מים בטעם אפרסק שוופס (1.5 ליטר),יפאורה,יח`,,1,6.70,0.45
2343,שוופס ווטר אפרסק 500מל,יפאורה,יח`,,1,4.90,0.92
2344,מים בטעם ענבים שוופס (1.5 ליטר),יפאורה,יח`,,1,6.70,0.45
2345,שוופס ווטר ענבים 500מל,יפאורה,יח`,,1,4.90,0.92
2346,מים בטעם תפוח שוופס (1.5 ליטר),יפאורה,יח`,,1,6.70,0.45
2347,שוופס ווטר תפוח 500מל,יפאורה,יח`,,1,4.90,0.92
2348,משקה מוגז לימונייד שוופס (1.5 ליטר),יפאורה,יח`,,1,7.50,0.50
2349,משקה מוגז לימונדה ורודה שוופס (1.5 ליטר),יפאורה,יח`,,1,7.50,0.50
2350,משקה מוגז למון ליים שוופס (1.5 ליטר),יפאורה,יח`,,1,7.70,0.51
2351,שוופס דיאט למון ליים 1.5 ל`,יפאורה,יח`,,1,7.70,0.51
2352,שוופס מוגז עדין 1.5 ליטר אננס,יפאורה,יח`,,1,7.50,0.50
2353,שישיית שוופס למון ליים 1.5 ל`,יפאורה,יח`,,1,36.70,36.70
2354,שישיית שוופס דיאט למון ליים 1.5 ל`,יפאורה,יח`,,1,36.70,36.70
2355,משקה פירות בטעם גווארנה שוופס (1.5 ליטר),יפאורה,יח`,,1,7.50,5
2356,בירה ג`מס בקבוק פילס 330 מל,יורוסטנדרט בעמ,יח`,,1,13.90,4.12
2357,בירה ג`מס בקבוק חיטה 330 מל,יורוסטנדרט בעמ,יח`,,1,13.90,4.12
2358,בירה ג`מס בקבוק 8.80% אלכוהול ( 330 מל),יורוסטנדרט בעמ,יח`,,1,13.90,4.12
2359,משוקלדים חמוציות מריר 160 גר` בקופסא,דין שיווק וקליה בעמ,יח`,,1,13.20,8.25
2360,משוקלדים פקאן מריר 160 גר` בקופסא,דין שיווק וקליה בעמ,יח`,,1,13.20,8.25
2361,משוקלדים חמוציות חלב 160 גר` בקופסא,דין שיווק וקליה בעמ,יח`,,1,13.20,8.25
2362,משוקלדים שקד חלב 160 גר` בקופסא,דין שיווק וקליה בעמ,יח`,,1,13.20,8.25
2363,משוקלדים צימוק מריר 160 גר` בקופסא,דין שיווק וקליה בעמ,יח`,,1,13.20,8.25
2364,משוקלדים בוטן מריר 160 גר` בקופסא,דין שיווק וקליה בעמ,יח`,,1,13.20,8.25
2365,משוקלדים לוז חלב 160 גר` בקופסא,דין שיווק וקליה בעמ,יח`,,1,13.20,8.25
2366,משוקלדים לוז מריר 160 גר` בקופסא,דין שיווק וקליה בעמ,יח`,,1,13.20,8.25
2367,משוקלדים שומשום חלב 160 גר` בקופסא,דין שיווק וקליה בעמ,יח`,,1,13.20,8.25
2368,משוקלדים שומשום מריר 160 גר` בקופסא,דין שיווק וקליה בעמ,יח`,,1,13.20,8.25
2369,מגבונים לניקוי כללי סנו סושי (50),החברה הדרומית לשיווק בעמ,יח`,,1,11.20,11.20
2370,קרמה דאודורנט ספריי -קלאסי,החברה הדרומית לשיווק בעמ,יח`,,1,21.40,14.27
2371,דאודורנט ספריי מאסק קרמה (150 מל),החברה הדרומית לשיווק בעמ,יח`,,1,21.40,14.27
2372,קרמה דאודורנט ספריי -אורכידאה,החברה הדרומית לשיווק בעמ,יח`,,1,21.40,14.27
2373,משוקלדים צימוק חלב 160 גר` בקופסא,דין שיווק וקליה בעמ,יח`,,1,13.20,8.25
2374,משוקלדים בוטן חלב 160 גר` בקופסא,דין שיווק וקליה בעמ,יח`,,1,13.20,8.25
2375,נקניקיות פרגיות 300 גר` טירת צבי,תנובה קפואים,יח`,,1,16.30,5.43
2376,פסטרמה שום וצילי טירת צבי (400 גרם),תנובה קפואים,יח`,,1,34.60,8.65
2377,נקניקיות וינר 1 קג` טירת צבי,תנובה קפואים,יח`,,1,34.60,6.92
2378,סלמי גלבוע 400 גר` טירת צבי,תנובה קפואים,יח`,,1,25.40,6.35
2379,קבנוס 120 גר` טירת צבי,תנובה קפואים,יח`,,1,13.20,11
2380,קבנוס 120 גר` פיקנטי טירת צבי,תנובה קפואים,יח`,,1,13.20,11
2381,חטיפי קבנוס 120 גר` טירת צבי,תנובה קפואים,יח`,,1,13.20,11
2382,צמד כפרי ברבקיו ודבש 600 גר טירת צבי,תנובה קפואים,יח`,,1,31.60,5.27
2383,טרין מוס כבד עוף 120 גר` תנובה,תנובה קפואים,יח`,,1,17.30,14.42
2384,סירופ בטעם ענבים מועשר בויטמינים 1 ליטר,אחדות בעמ,יח`,,1,8.90,8.90
2385,סירופ בטעם פטל מועשר בויטמינים 1 ליטר אח,אחדות בעמ,יח`,,1,8.90,8.90
2386,סירופ בטעם אננס מועשר בויטמינים 1 ליטר א,אחדות בעמ,יח`,,1,8.90,8.90
2387,ממרח טחינה עם דבש 400 גר` אחווה,אחדות בעמ,יח`,,1,13.20,3.30
2388,עוגת שמרים קרנץ בטעם שוקולד 400  גר`אחוו,אחדות בעמ,יח`,,1,11.30,2.83
2389,ערק ג`באלנא מצדה 40%,בני פאוזי שמשום (2009) בעמ,יח`,,1,52,7.39
2390,צמד פסטרמות 600 גר` יחיעם,מעדני יחיעם (1993) בעמ,יח`,,1,26.50,4.42
2391,נשנושי קבנוס יחיעם (125 גרם),מעדני יחיעם (1993) בעמ,יח`,,1,13.20,10.56
2392,נקניקיות עוף 1.5 קג,מעדני יחיעם (1993) בעמ,יח`,,1,31.60,31.60
2393,פסטרמה ברביקיו דק דק יחיעם (140 גרם),מעדני יחיעם (1993) בעמ,יח`,,1,13.20,9.43
2394,פסטרמה בדבש דק דק יחיעם (140 גרם),מעדני יחיעם (1993) בעמ,יח`,,1,13.20,9.43
2395,פסטרמה של פעם דק דק יחיעם (140 גרם),מעדני יחיעם (1993) בעמ,יח`,,1,13.20,9.43
2396,פסטרמה מעודנת על גחלים יחיעם (300 גרם),מעדני יחיעם (1993) בעמ,יח`,,1,25.40,8.47
2397,סלמי תה יחיעם (300 גרם),מעדני יחיעם (1993) בעמ,יח`,,1,26.50,8.83
2398,סלמי פפרוני 200 גר` יחיעם,מעדני יחיעם (1993) בעמ,יח`,,1,15.20,7.60
2399,גבינת גאודה פרוסות 150 גר,ג.וילי-פוד אינטרנשיונל בעמ,יח`,,1,10.90,7.27
2400,אורז בסמטי אהרוני (1 קג),דין שיווק וקליה בעמ,יח`,,1,13.50,13.50
2401,שיבולת שועל דקה שקדיה (500 גרם),דין שיווק וקליה בעמ,יח`,,1,7.10,1.42
2402,משוקלדים שקד מריר 160 גר` בקופסא,דין שיווק וקליה בעמ,יח`,,1,13.20,8.25
2403,משוקלדים פקאן חלב 160 גר` בקופסא,דין שיווק וקליה בעמ,יח`,,1,13.20,8.25
2404,שיבולת שועל עבה שקדיה (500 גרם),דין שיווק וקליה בעמ,יח`,,1,7.10,1.42
2405,בישקוטים וניל קקאו בונומי (200 גרם),דנשר (1963) בעמ,יח`,,1,8.40,4.20
2406,מואי עוגיות קקאו ושוקלד מריר עם קרם אספר,דנשר (1963) בעמ,יח`,,1,18.60,10.33
2407,מואי עוגיות קקאו ושוקולד עם קרם ברולה,דנשר (1963) בעמ,יח`,,1,19.30,10.72
2408,אל סבון נוזלי פנינה רוזנבלום (500x3 גרם),פנינה רוזנבלום בעמ,יח`,,1,14.20,9.47
2409,גרנולה שוקולד מריר+לבן 400 גר` פנינה רוז,פנינה רוזנבלום בעמ,יח`,,1,31.60,7.90
2410,מרכך לאחר החלקה 750 מל פנינה רוזנבלום,פנינה רוזנבלום בעמ,יח`,,1,31.60,4.21
2411,שמפו לאחר החלקה 750 מל פנינה רוזנבלום,פנינה רוזנבלום בעמ,יח`,,1,31.60,4.21
2412,מסיכה לאחר החלקה 500 מל פנינה רוזנבלום,פנינה רוזנבלום בעמ,יח`,,1,36.70,7.34
2413,רוטב עוף 800 גרם,פנינה רוזנבלום בעמ,יח`,,1,19.30,2.41
2414,קריניאנו 750 מל BUZZ,אגודת הכורמים,יח`,,1,28.50,3.76
2415,מוסקטו 750 מל BUZZ,אגודת הכורמים,יח`,,1,28.50,3.76
2416,קורנפלור מיה (500 גרם),מיה תעשיות מזון מ.ת.מ. בעמ,יח`,,1,9.40,1.88
2417,שקיות מזון סנו סושי (300),החברה הדרומית לשיווק בעמ,יח`,,1,13.20,13.20
2418,מקסימה מרכך מרוכז חלב ודבש סנו (1 ליטר),החברה הדרומית לשיווק בעמ,יח`,,1,19.30,1.93
2419,סנו מקסימה מרכך 1 ליטר ורוד,החברה הדרומית לשיווק בעמ,יח`,,1,19.30,1.93
2420,אוקסיג`ן ג`ל 3 ליטר כביסה לבנה,החברה הדרומית לשיווק בעמ,יח`,,1,32.60,10.87
2421,סנופרש הום נטול גז 350 מל בניחוח בוקר א,החברה הדרומית לשיווק בעמ,יח`,,1,16.30,4.66
2422,מקסימה מרכך חלב ודבש סנו (4 ליטר),החברה הדרומית לשיווק בעמ,יח`,,1,22.40,5.60
2423,פוליויקס 3 ליטר,החברה הדרומית לשיווק בעמ,יח`,,1,24.40,12.20
2424,סנובון ג`ל בניחוח פריחה,החברה הדרומית לשיווק בעמ,יח`,,1,14.20,14.20
2425,מקסימה מרכך פריחה לבנה סנו (4 ליטר),החברה הדרומית לשיווק בעמ,יח`,,1,22.40,5.60
2426,מנקה אסלות 00 1 ליטר ניחוח רענן,החברה הדרומית לשיווק בעמ,יח`,,1,12.30,12.30
2427,סנובון מוצק WAVE בתוספת אקונומיקה,החברה הדרומית לשיווק בעמ,יח`,,1,11.20,11.20
2428,פרוסות צ`יפס תפוגן (1.5 קג),קבוצת אסם סחר שות. מוגבלת,יח`,,1,26.50,1.77
2429,הר חרמון אינדיגו,היכל היין שקד גולן בעמ,יח`,,1,31.90,4.21
2430,הר חרמון מוסקט יקב רמת הגולן (750 מל),היכל היין שקד גולן בעמ,יח`,,1,31.90,4.21
2431,יין גמלא מרלו,היכל היין שקד גולן בעמ,יח`,,1,61.10,61.10
2432,מוזלי בוטנים אגוזים ושקדים 1קג - שקדיה,דין שיווק וקליה בעמ,יח`,,1,21.40,2.14
2433,מוזלי עם פירות שקדיה (1 קג),דין שיווק וקליה בעמ,יח`,,1,21.40,2.14
2434,מוזלי צימוקים תפוח קינומון 1קג - שקדיה,דין שיווק וקליה בעמ,יח`,,1,21.40,2.14
2435,גרנולה אגוזים 1קג - שקדיה,דין שיווק וקליה בעמ,יח`,,1,21.40,2.14
2436,קונפיטוריה פטל אדום 450גר`.,דין שיווק וקליה בעמ,יח`,,1,11.90,2.64
2437,קונפיטוריה תות שדה 450 גר`,דין שיווק וקליה בעמ,יח`,,1,11.90,2.64
2438,קונפיטוריה פטל שחור 450 גר`,דין שיווק וקליה בעמ,יח`,,1,11.90,2.64
2439,קונפיטוריה משמש 450 גר` שקדיה,דין שיווק וקליה בעמ,יח`,,1,11.90,2.64
2440,יין אדום יבש יובלים יקב דלתון (750 מל),הכרם - משקאות חריפים בעמ,יח`,,1,50.90,6.75
2441,יין לבן יובלים יקב דלתון (750 מל),הכרם - משקאות חריפים בעמ,יח`,,1,50.90,6.75
2442,יין כנען רוזה יקב דלתון (750 מל),הכרם - משקאות חריפים בעמ,יח`,,1,50.90,6.75
2443,מרבה סלים פרוט בטעם יוגורט ותפוח,ש.שסטוביץ בעמ,יח`,,1,15.20,8.35
2444,מרבה סלים פרוט בטעם יוגורט ותות,ש.שסטוביץ בעמ,יח`,,1,15.20,8.35
2445,מרבה סלים פרוט בטעם פירות יער,ש.שסטוביץ בעמ,יח`,,1,15.20,8.35
2446,מרבה סלים פרוט בטעם יוגורט ופירות יער,ש.שסטוביץ בעמ,יח`,,1,15.20,12.67
2447,סלים דליס קריספי תות מרבה (125 גרם),ש.שסטוביץ בעמ,יח`,,1,15.20,12.67
2448,סלים דליס קריספי אוכמניות מרבה (125 גרם),ש.שסטוביץ בעמ,יח`,,1,15.20,12.16
2449,סלים דליס קריספי שוקולד מרבה (125 גרם),ש.שסטוביץ בעמ,יח`,,1,15.20,12.16
2450,מרבה שוקודליס בציפוי שוקולד חלב 145 גר`,ש.שסטוביץ בעמ,יח`,,1,13.90,9.59
2451,מרבה שוקודליס עו,ש.שסטוביץ בעמ,יח`,,1,13.90,7.90
2452,מרבה שוקודליס עו,ש.שסטוביץ בעמ,יח`,,1,13.90,7.90
2453,מרבה שוקודליס במילוי קרם בטעם קפוצינו 14,ש.שסטוביץ בעמ,יח`,,1,13.90,9.59
2454,לה פסטה פסטה צינור 400 גר`,תומר יבוא ושיווק מוצרי מזון (1,יח`,,1,2.90,0.73
2455,לה פסטה קונכיה 53 400 גר`,תומר יבוא ושיווק מוצרי מזון (1,יח`,,1,2.90,0.73
2456,לה פסטה פסטה פרפר 81 400 גר`,תומר יבוא ושיווק מוצרי מזון (1,יח`,,1,2.90,0.73
2457,לה פסטה פסטה בורג 64 400 גר`,תומר יבוא ושיווק מוצרי מזון (1,יח`,,1,2.90,0.73
2458,לה פסטה פסטה תלתל 65 400 גר`,תומר יבוא ושיווק מוצרי מזון (1,יח`,,1,2.90,0.73
2459,לה פסטה פסטה אטריות מרק 400 גר`,תומר יבוא ושיווק מוצרי מזון (1,יח`,,1,2.90,0.73
2460,מאגדת-מיני מגנום דאבל,גלידות שטראוס בעמ,יח`,,1,30.50,30.50
2461,שטראוס קרמיסימו סנדיי וניל,גלידות שטראוס בעמ,יח`,,1,20.50,15.41
2462,שטראוס קרמסימו מסטיגם 1.33 ליטר,גלידות שטראוס בעמ,יח`,,1,20.50,15.41
2463,פירורי לחם זהוב תבליני מימון (800 גרם),א.ל.ייצור ושיווק תבלינים בעמ,יח`,,1,18.30,2.29
2464,גבינת ברי 125 גר,ג.וילי-פוד אינטרנשיונל בעמ,יח`,,1,20.30,16.24
2465,גבינת קממבר 125 גר,ג.וילי-פוד אינטרנשיונל בעמ,יח`,,1,20.30,16.24
2466,שיני שום במי מלח 340 גרם,ג.וילי-פוד אינטרנשיונל בעמ,יח`,,1,13.20,3.88
2467,עגבניות מיובשות בשמן 340 גר,ג.וילי-פוד אינטרנשיונל בעמ,יח`,,1,13.20,3.88
2468,פתיתים מגורדת וילי פוד (500 גרם) GOLDEN,ג.וילי-פוד אינטרנשיונל בעמ,יח`,,1,23.40,4.68
2469,גבינת מוצרלה מגורדת סיי צ`יז (200 גרם),ג.וילי-פוד אינטרנשיונל בעמ,יח`,,1,15.20,7.60
2470,גבינה מוצרלה בייבי 150 גר` כפיר,צ.י תעשיות מזון יבנה בעמ,יח`,,1,14.90,9.93
2471,שניצל ביתי עם צ`יפס שמח 600 גר` עוף טוב,קבוצת אסם סחר שות. מוגבלת,יח`,,1,41.80,6.97
2472,שניצל עוף דקיק קריספי 700 גר` עוף טוב,קבוצת אסם סחר שות. מוגבלת,יח`,,1,37.70,5.39
2473,שניצל דק ענקיסטי 700 גר` עוף טוב,קבוצת אסם סחר שות. מוגבלת,יח`,,1,37.70,5.39
2474,שניצל עוף ביתי כזה 700 גר` עוף טוב,קבוצת אסם סחר שות. מוגבלת,יח`,,1,46.90,6.70
2475,שניצל עוף היער הקסום 600 גר` עוף טוב,קבוצת אסם סחר שות. מוגבלת,יח`,,1,33.90,5.65
2476,שניצל עוף ביתי שומשום 700 גר` עוף טוב,קבוצת אסם סחר שות. מוגבלת,יח`,,1,46.90,6.70
2477,שניצל עוף ביתי קריספי 700 גר` עוף טוב,קבוצת אסם סחר שות. מוגבלת,יח`,,1,46.90,6.70
2478,שניצל עוף ביתי מתובל 600 גר` עוף טוב,קבוצת אסם סחר שות. מוגבלת,יח`,,1,38.90,6.48
2479,שניצל עוף ביתי עדין כזה 700 גר` עוף טוב,קבוצת אסם סחר שות. מוגבלת,יח`,,1,46.90,6.70
2480,צונגו רצועות שניצל ציפס 600 גר` עוף טוב,קבוצת אסם סחר שות. מוגבלת,יח`,,1,43.90,7.32
2481,צונגו רצועות שניצל חריף מתוק 600 גר` עוף,קבוצת אסם סחר שות. מוגבלת,יח`,,1,43.90,7.32
2482,צונגו רצועות שניצל גריל 600 גר` עוף טוב,קבוצת אסם סחר שות. מוגבלת,יח`,,1,43.90,7.32
2483,יוגורט ביו 3% תנובה (150x8 גרם),תנובה - חלב,יח`,,1,16.50,1.38
2484,יוגורט ביו 1.5% תנובה (150x8 גרם),תנובה - חלב,יח`,,1,16.50,1.38
2485,משקה שקדים טרי תנובה (1 ליטר),תנובה - חלב,יח`,,1,12.20,1.22
2486,יופלה דיאט תות ב,תנובה - חלב,יח`,,1,5,3.33
2487,מעדן שוקולד חלב יולו (123 גרם),תנובה - חלב,יח`,,1,4.50,3.66
2488,מעדן שוקולד מריר יולו (123 גרם),תנובה - חלב,יח`,,1,4.50,3.66
2489,מעדן שוקולד לבן יולו (123 גרם),תנובה - חלב,יח`,,1,4.50,3.66
2490,יולו מעדן שכבות שוקולד חלבי לבן,תנובה - חלב,יח`,,1,4.50,3.66
2491,יולו מעדן שכבות שוקולד מריר לבן,תנובה - חלב,יח`,,1,4.50,3.66
2492,דייאט יופלה 0% אוכמניות בתחתית,תנובה - חלב,יח`,,1,5,3.33
2493,משקה טעם וניל תנובה GO,תנובה - חלב,יח`,,1,6.10,2.44
2494,תה קר בטעם ענבים ספרינג (1.5 ליטר),יפאורה,יח`,,1,6.70,4.47
2495,שוופס ווטר 0 קלוריות תפוח 1.5 ליטר,יפאורה,יח`,,1,6.70,0.45
2496,שוופס ווטר 0 קלוריות אפרסק 1.5 ליטר,יפאורה,יח`,,1,6.70,0.45
2497,משקה מוגז בטעם ענבים שוופס (1.5 ליטר),יפאורה,יח`,,1,7.50,5
2498,משקה קל לימונדה נענע תפוזינה (1.5 ליטר),יפאורה,יח`,,1,6.90,0.46
2499,שוופס סודה נענע ליים 1.5 ליטר,יפאורה,יח`,,1,4.30,0.29
2500,משקה בטעם ענבים פרוט ווטר (1.5 ליטר),יפאורה,יח`,,1,8.10,0.54
2501,משקה בטעם אננס פרוט ווטר (1.5 ליטר),יפאורה,יח`,,1,8.10,0.54
2502,משקה בטעם אפרסק פרוט ווטר (1.5 ליטר),יפאורה,יח`,,1,8.10,0.54
2503,משקה בטעם אבטיח פרוט ווטר (1.5 ליטר),יפאורה,יח`,,1,8.10,0.54
2504,משקה בטעם תות פרוט ווטר (1.5 ליטר),יפאורה,יח`,,1,8.10,0.54
2505,מגבונים בייביסיטר רביעייה,שקד תבל בעמ,יח`,,1,19.30,19.30
2506,מגבונים בייביסיטר רביעייה,שקד תבל בעמ,יח`,,1,19.30,19.30
2507,שמפו קרטין 750 מל סטייל,גורי ע.ע.ע בעמ,יח`,,1,31.60,4.21
2508,מרכך קרטין 750 מל סטייל,גורי ע.ע.ע בעמ,יח`,,1,31.60,4.21
2509,מסיכה קרטין 500 מל סטייל,גורי ע.ע.ע בעמ,יח`,,1,41.80,8.36
2510,אקווה פרש מברשת שיניים גוניור,גורי ע.ע.ע בעמ,יח`,,1,13.50,13.50
2511,אקוה פרש הגנה כוללת 100 מל,גורי ע.ע.ע בעמ,יח`,,1,18.90,18.90
2512,מלפפונים במלח 690 גר` לינה,יורוסטנדרט בעמ,יח`,,1,11.20,1.62
2513,קורנישונים במלח 690 גר` לינה,יורוסטנדרט בעמ,יח`,,1,11.20,1.62
2514,ערק יודה 700 מל,יורוסטנדרט בעמ,יח`,,1,55.90,7.94
2515,לחם פשוט מלא לילדים פרוס אנג`ל (750 גרם),שלמה א. אנג`ל בעמ,יח`,,1,14.20,2.84
2516,אוטן אקטיב ספריי יבש דוחה יתושים,דנשר (1963) בעמ,יח`,,1,21.70,21.70
2517,אוטן ג`וניור ג`ל לילדים דוחה יתושים,דנשר (1963) בעמ,יח`,,1,21.70,21.70
2518,אוטן אפטר בייט 25 מל - דוחה יתושים,דנשר (1963) בעמ,יח`,,1,26.50,26.50
2519,גביעי גלידה 24 יח -גילרו,רזיט שיווק בעמ,יח`,,1,6.90,6.90
2520,גביעי גלידריה ללא גלוטן 12 יח,רזיט שיווק בעמ,יח`,,1,14.90,14.90
2521,פרש וואנס רביעייה מגבונים לחים קשמיר קיי,דנשר (1963) בעמ,יח`,,1,16.90,16.90
2522,טונה בשמן רביעייה 160 גר - וילי פוד,ג.וילי-פוד אינטרנשיונל בעמ,יח`,,1,22.90,3.58
2523,טונה במים רביעייה 160 גר - וילי פוד,ג.וילי-פוד אינטרנשיונל בעמ,יח`,,1,22.90,3.58
2524,מיקסים בייגלה מצ,כרמית תעשיות ממתקים בעמ,יח`,,1,4,4
2525,מיקסים קוביות וופל 55 גר 16 בקרטון,כרמית תעשיות ממתקים בעמ,יח`,,1,4,4
2526,פאוץ` פרינוק תפוח 120 גר`,גורי מוצרי צריכה (1991) בעמ,יח`,,1,6.20,5.17
2527,פאוץ` פרינוק תפוח בננה 120 גר`,גורי מוצרי צריכה (1991) בעמ,יח`,,1,6.20,5.17
2528,פאוץ` פרינוק מחית סלט פירות 120 גר,גורי מוצרי צריכה (1991) בעמ,יח`,,1,6.20,5.17
2529,פאוץ` פרינוק תפוח אכומניות 120 גר`,גורי מוצרי צריכה (1991) בעמ,יח`,,1,6.20,5.17
2530,פאוץ` פרינוק פירות טרופיים 120 גר`,גורי מוצרי צריכה (1991) בעמ,יח`,,1,6.20,5.17
2531,פאוץ` פרינוק לפתן פירות 120 גר`,גורי מוצרי צריכה (1991) בעמ,יח`,,1,6.20,5.17
2532,פאוץ` פרינוק פירות מעורבים 120 גר`,גורי מוצרי צריכה (1991) בעמ,יח`,,1,6.20,5.17
2533,פלפל שחור גרוס 80 גר`,תבליני טעם וריח בעמ,יח`,,1,9.90,12.38
2534,פלפל שחור טחון 80 גר`,תבליני טעם וריח בעמ,יח`,,1,9.90,12.38
2535,פפריקה מתוקה בשמן 80 גר`,תבליני טעם וריח בעמ,יח`,,1,5.90,7.38
2536,פפריקה חריפה 80 גר`,תבליני טעם וריח בעמ,יח`,,1,5.90,7.38
2537,פפריקה מתוקה 80 גר`,תבליני טעם וריח בעמ,יח`,,1,5.90,7.38
2538,גריל עוף 80 גר`,תבליני טעם וריח בעמ,יח`,,1,5.90,7.38
2539,זעתר מעורב 80 גר`,תבליני טעם וריח בעמ,יח`,,1,5.90,7.38
2540,מלח לימון 80 גר`,תבליני טעם וריח בעמ,יח`,,1,5.90,7.38
2541,כמון טחון 80 גר`,תבליני טעם וריח בעמ,יח`,,1,5.90,7.38
2542,כורכום טחון 80 גר`,תבליני טעם וריח בעמ,יח`,,1,5.90,7.38
2543,בהרט 80 גר`,תבליני טעם וריח בעמ,יח`,,1,5.90,7.38
2544,שום גבישי 80 גר`,תבליני טעם וריח בעמ,יח`,,1,7.90,9.88
2545,חוואיג` למרק 80 גר`,תבליני טעם וריח בעמ,יח`,,1,5.90,7.38
2546,תיבול על האש 80 גר`,תבליני טעם וריח בעמ,יח`,,1,5.90,7.38
2547,תיבול לשווארמה 80 גר`,תבליני טעם וריח בעמ,יח`,,1,5.90,7.38
2548,מרינדת עוף קלאסי- פפריקה שום עגבניות 25,תבליני טעם וריח בעמ,יח`,,1,5.90,23.60
2549,מרינדת עוף פיקנטי- צ`ילי שום עגבניות 25,תבליני טעם וריח בעמ,יח`,,1,5.90,23.60
2550,מרינדת עוף איטלקי לימון- שום עשבי תיבול,תבליני טעם וריח בעמ,יח`,,1,5.90,23.60
2551,פפריקה מתוקה שקית 250 גרם,תבליני טעם וריח בעמ,יח`,,1,9.90,3.96
2552,כורכום שקית 250 גרם,תבליני טעם וריח בעמ,יח`,,1,9.90,3.96
2553,פפריקה מרוקאית מתוקה בשמן שקית 250גר`,תבליני טעם וריח בעמ,יח`,,1,9.90,3.96
2554,מלח לימון שקית 500 גר`,תבליני טעם וריח בעמ,יח`,,1,9.90,1.98
2555,סודה לשתיה 80 גר`,תבליני טעם וריח בעמ,יח`,,1,3.90,4.88
2556,תערובת במתיקות מעודנת 70 גר`,תבליני טעם וריח בעמ,יח`,,1,5.90,8.43
2557,תערובת הודית 70 גר`,תבליני טעם וריח בעמ,יח`,,1,5.90,8.43
2558,תערובת פרסית 70 גר`,תבליני טעם וריח בעמ,יח`,,1,5.90,8.43
2559,תערובת מזרחית 70 גר`,תבליני טעם וריח בעמ,יח`,,1,5.90,8.43
2560,תערובת מקסיקנית חריפה 70 גר`,תבליני טעם וריח בעמ,יח`,,1,5.90,8.43
2561,פלפל שחור שלם 80 גר`,תבליני טעם וריח בעמ,יח`,,1,9.90,12.38
2562,נטיפי שוקולד לאפייה שוקולדמריר 250גר,מיה תעשיות מזון מ.ת.מ. בעמ,יח`,,1,11.20,4.48
2563,אמיליאנו למברוסק,טמפו משקאות בעמ,יח`,,1,31.60,4.17
2564,יין למברסקו ביאנקו לבן 750 מל,טמפו משקאות בעמ,יח`,,1,31.60,4.17
2565,אמיליאנו למברוסק,טמפו משקאות בעמ,יח`,,1,31.60,4.17
2566,ריחן קברנה סוביניון 750 מל ברקן,טמפו משקאות בעמ,יח`,,1,67.30,8.93
2567,מרום גליל רוזה 750 מל,טמפו משקאות בעמ,יח`,,1,44.10,5.84
2568,ברנדי שטוק 84 דבש ( 750 מל),טמפו משקאות בעמ,יח`,,1,71.30,9.47
2569,רזרב מוסקט ורוד חצי יבש 750 מל יקבי ברק,טמפו משקאות בעמ,יח`,,1,53,7.03
2570,אקווה פרש הגנה כוללת מלבינה 100 מל,גורי ע.ע.ע בעמ,יח`,,1,18.90,18.90
2571,ספירה מכשיר חשמלי להרחקת יתושים,גורי ע.ע.ע בעמ,יח`,,1,37.70,37.70
