,ItemName,ManufactureName,UnitQty,Quantity,QtyInPackage,ItemPrice,UnitOfMeasurePrice
0,דג סלמון נורבגי טרי שלם - נקי,מאסטרפוד בעמ,"ק""ג",,1,59.90,59.90
1,דג לברק טרי נקי,מאסטרפוד בעמ,"ק""ג",,1,59.90,59.90
2,דג בורי טרי נקי,מאסטרפוד בעמ,"ק""ג",,1,39,39
3,דג ברמונדי נקי שלם,מאסטרפוד בעמ,"ק""ג",,1,49.90,49.90
4,פילה סלמון נורבגי שלם -טרי,מאסטרפוד בעמ,"ק""ג",,1,99,9.90
5,צלעות טלה פרוס חלק קפוא כבש,אדום גרופ למזון שיווק והפצה בע,"ק""ג",,1,129,129
6,נקניקיות מן הצומח זוגלובק (2 קג),זוגלובק שיווק בעמ,יח`,,1,59.90,3
7,בירה גולדסטאר 330 מל בקבוק שישייה,טמפו משקאות בעמ,יח`,,1,37.90,1.82
