,ItemName,ManufactureName,UnitQty,Quantity,QtyInPackage,ItemPrice,UnitOfMeasurePrice
928,מש.שיניים אורביטול שלישיה,החברה הדרומית לשיווק בעמ,יח`,,1,19.90,4.57
929,סנו דואופרש מבושם,החברה הדרומית לשיווק בעמ,יח`,,1,13.90,4.63
930,קינמון טחון 50 גר`,תבליני טעם וריח בעמ,יח`,,1,5.90,11.80
931,עלי דפנה 20 גר`,תבליני טעם וריח בעמ,יח`,,1,5.90,29.50
932,משקה אנרגיה תפוח אקסל (250 מל)TNX,טמפו משקאות בעמ,יח`,,1,4.50,1.68
933,משקה אנרגיה מנגו אקסל (250 מל) TEN,טמפו משקאות בעמ,יח`,,1,4.50,1.68
934,משקה אנרגיה אקסל נענע ליים (250 מל),טמפו משקאות בעמ,יח`,,1,4.50,1.68
935,סודה אפרסק 1.5 ליטר רביעייה נגיעות,טמפו משקאות בעמ,יח`,,1,10.90,10.90
936,משקה קל דיאט תפוזים ג`אמפ (1.5 ליטר),טמפו משקאות בעמ,יח`,,1,5.50,0.37
937,משקה קל תפוזים ג`אמפ (1.5 ליטר),טמפו משקאות בעמ,יח`,,1,5.50,0.37
938,משקה קל אשכוליות ג`אמפ (1.5 ליטר),טמפו משקאות בעמ,יח`,,1,5.50,0.37
939,משקה קל תות בננה ג`אמפ (1.5 ליטר),טמפו משקאות בעמ,יח`,,1,5.50,0.37
940,קרמיסימו גלידונית 60 יח`,גלידות שטראוס בעמ,יח`,,1,47.90,6.84
941,מאגדת-טעמקור 8 יח`,גלידות שטראוס בעמ,יח`,,1,37.90,37.90
942,שמן זית כתית מעולה 750 מל עץ הזית,שמן תעשיות בעמ,יח`,,1,34.90,4.65
943,משחת שיניים טום וג`רי 60 גר`,הנקל סוד בעמ,יח`,,1,8.90,14.83
944,משחת שיניים לילדים טום וג`רי (50 מל),הנקל סוד בעמ,יח`,,1,8.90,14.83
945,קשיו מטוגן שקית 200 גר,ליימן שליסל בעמ,יח`,,1,19.90,9.95
946,גרעיני חמניה 200 גר`,ליימן שליסל בעמ,יח`,,1,6.90,3.45
947,סבון מוצק לתינוק נקה 7 (100x4 גרם),החברה הדרומית לשיווק בעמ,יח`,,1,11.90,2.98
948,שניצל ביתי עם שומשום קופצני 700 גר` עוף,קבוצת אסם סחר שות. מוגבלת,יח`,,1,43.90,6.27
949,שניצל עוף מיני דיזוזאור 700 גר` עוף טוב,קבוצת אסם סחר שות. מוגבלת,יח`,,1,34.90,4.99
950,שניצל עוף דקיק ענקיסטי 700 עוף טוב,קבוצת אסם סחר שות. מוגבלת,יח`,,1,35.90,5.13
951,שניצל עוף דקיק עם צ`יפס שמח 700 גר` עוף,קבוצת אסם סחר שות. מוגבלת,יח`,,1,35.90,5.13
952,שניצל ביתי עדין כזה 700 גר` עוף טוב,קבוצת אסם סחר שות. מוגבלת,יח`,,1,43.90,6.27
953,שניצל עוף מיני דובונים 700 גר` עוף טוב,קבוצת אסם סחר שות. מוגבלת,יח`,,1,35.90,5.13
954,שניצל עוף ביתי קריספי 700 גר` עוף טוב,קבוצת אסם סחר שות. מוגבלת,יח`,,1,43.90,6.27
955,חזה עוף בתיבול 500 גר` BBQ עוף טוב,קבוצת אסם סחר שות. מוגבלת,יח`,,1,39.90,7.98
956,קליק בארים אין אאוט נוגט,יוניליוור ישראל שיווק בעמ,יח`,,1,4.90,12.89
957,קליק בארים אין אאוט קרם חלבי,יוניליוור ישראל שיווק בעמ,יח`,,1,4.90,12.89
958,רוטב לסלט חרדל ודבש לייט הלמנס (305 גרם),יוניליוור ישראל שיווק בעמ,יח`,,1,12.90,4.23
959,בדין אקסטרא 960 מרוכז בייבי בדין,יוניליוור ישראל שיווק בעמ,יח`,,1,16.90,1.76
960,מרכך מרכך לטיפול בשמני הזנה 400מל,יוניליוור ישראל שיווק בעמ,יח`,,1,15.90,3.98
961,קרם קרקר 210 גר`,יוניליוור ישראל שיווק בעמ,יח`,,1,8.90,4.24
962,פינוק תחליב רחצה ילדים 700 מל קמומיל,יוניליוור ישראל שיווק בעמ,יח`,,1,12.90,1.84
963,פינוק שמפו שמן אבוקדו 700 מל,יוניליוור ישראל שיווק בעמ,יח`,,1,12.90,1.84
964,פינוק מרכך שמן אבוקדו (700  מל),יוניליוור ישראל שיווק בעמ,יח`,,1,12.90,1.84
965,סיף פנטסטיק 4 ליטר כללי יסמין,יוניליוור ישראל שיווק בעמ,יח`,,1,24.90,0.62
966,ברנפלקס קרנצ`ים 375 גר` בדצ,יוניליוור ישראל שיווק בעמ,יח`,,1,22.90,6.11
967,שמפו מועשר בשמן מרוקאי פינוק (700 מל),יוניליוור ישראל שיווק בעמ,יח`,,1,12.90,1.84
968,מרכך מועשר בשמן מרוקאי פינוק (700 מל),יוניליוור ישראל שיווק בעמ,יח`,,1,12.90,1.84
969,פינוק תחליב רחצה 700 מל,יוניליוור ישראל שיווק בעמ,יח`,,1,12.90,1.84
970,רוטב קנור סויה בסגנון סיני,יוניליוור ישראל שיווק בעמ,יח`,,1,12.90,4.30
971,עוגי מופחת סוכר 500גר,יוניליוור ישראל שיווק בעמ,יח`,,1,18.90,3.78
972,שוקולד פרה חלב עלית (100 גרם),שטראוס גרופ בעמ,יח`,,1,4.90,4.90
973,שוקולד פרה מריר פרווה עלית (100 גרם),שטראוס גרופ בעמ,יח`,,1,4.90,4.90
974,טבלאות פרה במילוי קרם נוגט,שטראוס גרופ בעמ,יח`,,1,4.90,4.90
975,חטיף כיף כף עלית (45 גרם),שטראוס גרופ בעמ,יח`,,1,3.90,8.67
976,שוקולד פרה לבן עלית (100 גרם),שטראוס גרופ בעמ,יח`,,1,4.90,4.90
977,חטיף צ`יפס בטעם טבעי תפוצ`יפס (200 גרם),שטראוס פריטו ליי בעמ,יח`,,1,10.90,5.45
978,שוקולד פרה מריר עם אגוזים עלית (100 גרם),שטראוס גרופ בעמ,יח`,,1,4.90,4.90
979,ביסקוויט עד חצות חלבי 200 גר`,שטראוס גרופ בעמ,יח`,,1,13.90,6.95
980,כריות קרצוף חתוכות ניקול (12),קימברלי קלארק ישראל שיווק בעמ,יח`,,1,10.90,10.90
981,ממחטות אולטרה סופט קלינקס (80x2),קימברלי קלארק ישראל שיווק בעמ,יח`,,1,19.90,5.10
982,מגבת נייר ניקול (6),קימברלי קלארק ישראל שיווק בעמ,יח`,,1,11.90,11.90
983,מגבונים לחים בבישום עדין טיטולים (72x4),קימברלי קלארק ישראל שיווק בעמ,יח`,,1,19.90,19.90
984,ניקול תבניות מלבנית חזקה ועבה,קימברלי קלארק ישראל שיווק בעמ,יח`,,1,9.90,9.90
985,אשפתון 40,קימברלי קלארק ישראל שיווק בעמ,יח`,,1,20.90,0.52
986,מטליות לחות לניקוי כללי ניקול (50),קימברלי קלארק ישראל שיווק בעמ,יח`,,1,11.90,11.90
987,מטליות לחות לניקוי רצפה ניקול (10),קימברלי קלארק ישראל שיווק בעמ,יח`,,1,13.90,13.90
988,מפיות אירוח לילי סטייל ניקול (20),קימברלי קלארק ישראל שיווק בעמ,יח`,,1,8.90,8.73
989,מטליות לניקוי וחיטוי ניקול,קימברלי קלארק ישראל שיווק בעמ,יח`,,1,11.90,11.90
990,מפיות מודפסות ניקול (85x2),קימברלי קלארק ישראל שיווק בעמ,יח`,,1,12.90,12.90
991,ממחטות אף קלינקס (90x3),קימברלי קלארק ישראל שיווק בעמ,יח`,,1,10.90,10.90
992,מגן תחתון לילי (50),קימברלי קלארק ישראל שיווק בעמ,יח`,,1,10.90,10.90
993,תחבושות נובה-לי לילי (28),קימברלי קלארק ישראל שיווק בעמ,יח`,,1,10.90,10.90
994,תח` לילי נטורל לילה,קימברלי קלארק ישראל שיווק בעמ,יח`,,1,18.90,18.90
995,מגן תחתון נטורל נורמל לילי (60),קימברלי קלארק ישראל שיווק בעמ,יח`,,1,18.90,18.90
996,מגן תחתון נטורל לונג לילי (52),קימברלי קלארק ישראל שיווק בעמ,יח`,,1,18.90,18.90
997,מגן תחתון נטורל לייט לילי (62),קימברלי קלארק ישראל שיווק בעמ,יח`,,1,18.90,18.90
998,תחבושות נורמל עם כנפיים לילי (24),קימברלי קלארק ישראל שיווק בעמ,יח`,,1,17.90,17.90
999,תחבושות נטורל סופר עם כנפיים לילי (24),קימברלי קלארק ישראל שיווק בעמ,יח`,,1,17.90,17.90
1000,תחבושות לילי נטו,קימברלי קלארק ישראל שיווק בעמ,יח`,,1,17.90,17.90
1001,שקיות מזון גדולות עם ידית ניקול (200),קימברלי קלארק ישראל שיווק בעמ,יח`,,1,13.90,13.90
1002,מגבוני האגיס רביעייה ללא בישום,קימברלי קלארק ישראל שיווק בעמ,יח`,,1,19.90,19.90
1003,מגבונים לחים מבושמים האגיס (72x4),קימברלי קלארק ישראל שיווק בעמ,יח`,,1,19.90,19.90
1004,מגבוני האגיס רביעייה,קימברלי קלארק ישראל שיווק בעמ,יח`,,1,19.90,19.90
1005,מפת שולחן 110*180 סמ ניקול (2),קימברלי קלארק ישראל שיווק בעמ,יח`,,1,11.90,4.76
1006,ניילונית 150 מ,קימברלי קלארק ישראל שיווק בעמ,יח`,,1,36.90,0.25
1007,ניקול-רדיד אלומיניום זוג 45,קימברלי קלארק ישראל שיווק בעמ,יח`,,1,19.90,19.90
1008,חיתולי פרידום דריי שלב 3 האגיס (52),קימברלי קלארק ישראל שיווק בעמ,יח`,,1,39.90,39.90
1009,חיתולי פרידום דריי שלב 4 האגיס (44),קימברלי קלארק ישראל שיווק בעמ,יח`,,1,39.90,39.90
1010,חיתולי פרידום דריי שלב +4 האגיס (40),קימברלי קלארק ישראל שיווק בעמ,יח`,,1,39.90,39.90
1011,חיתולי פרידום דריי שלב 5 האגיס (36),קימברלי קלארק ישראל שיווק בעמ,יח`,,1,39.90,39.90
1012,חיתולי פרידום דריי שלב 6 האגיס (30),קימברלי קלארק ישראל שיווק בעמ,יח`,,1,39.90,39.90
1013,תחבושות קוטקס יאנג,קימברלי קלארק ישראל שיווק בעמ,יח`,,1,19.90,19.90
1014,טיטולי פרימיום שלב 2 (52יח),קימברלי קלארק ישראל שיווק בעמ,יח`,,1,39.90,39.90
1015,חיתולי פרימיום שלב 3 טיטולים (50),קימברלי קלארק ישראל שיווק בעמ,יח`,,1,39.90,39.90
1016,חיתולי פרימיום שלב 4 טיטולים (40),קימברלי קלארק ישראל שיווק בעמ,יח`,,1,39.90,39.90
1017,חיתולי פרימיום שלב 4+ טיטולים (38),קימברלי קלארק ישראל שיווק בעמ,יח`,,1,39.90,39.90
1018,חיתולי פרימיום שלב 5 טיטולים (34),קימברלי קלארק ישראל שיווק בעמ,יח`,,1,39.90,39.90
1019,חיתולי פרימיום שלב 6 טיטולים (30),קימברלי קלארק ישראל שיווק בעמ,יח`,,1,39.90,39.90
1020,כריות קרצוף סקוטש ניקול (3),קימברלי קלארק ישראל שיווק בעמ,יח`,,1,11.90,3.97
1021,כרית יפנית רביעייה ניקול,קימברלי קלארק ישראל שיווק בעמ,יח`,,1,11.90,2.98
1022,כריות יפניות ניקול (6),קימברלי קלארק ישראל שיווק בעמ,יח`,,1,11.90,1.98
1023,ניקול מטליות רצפה רביעיה,קימברלי קלארק ישראל שיווק בעמ,יח`,,1,12.90,3.23
1024,מטליות רב שימושיות לניקיון ניקול (9),קימברלי קלארק ישראל שיווק בעמ,יח`,,1,11.90,1.32
1025,מטליות לחות לרצפה בריח לימון 10 יח,קימברלי קלארק ישראל שיווק בעמ,יח`,,1,13.90,13.90
1026,ספוגית הקסם המקורית ניקול (6),קימברלי קלארק ישראל שיווק בעמ,יח`,,1,10.90,1.82
1027,פסגה לרצפה 2 ליטר,החברה הדרומית לשיווק בעמ,יח`,,1,11.90,5.95
1028,האגיס חיתולי אקסטרה קר 3 48 יח,קימברלי קלארק ישראל שיווק בעמ,יח`,,1,44.90,44.90
1029,האגיס חיתולי אקסטרה קר 40 יח,קימברלי קלארק ישראל שיווק בעמ,יח`,,1,44.90,44.90
1030,רוטב עגבניות 22% יכין (100 גרם),זנלכל בעמ,יח`,,1,1.90,1.90
1031,עגב` קוביות,זנלכל בעמ,יח`,,1,6.90,0.86
1032,עגבניות מרוסקות יכין (800 גרם),זנלכל בעמ,יח`,,1,6.90,0.86
1033,סירופ דיאט בטעם ענבים יכין (1 ליטר),זנלכל בעמ,יח`,,1,7.90,0.79
1034,רוטב עגבניות 22% יכין (260 גרם),זנלכל בעמ,יח`,,1,3.50,1.35
1035,עגבניות מרוסקות עם שום יכין (800 גרם),זנלכל בעמ,יח`,,1,6.90,0.86
1036,עגבניות מרוסקות עם בצל יכין (800 גרם),זנלכל בעמ,יח`,,1,6.90,0.86
1037,עגב. מרוסקות בזיליקום (800 גרם),זנלכל בעמ,יח`,,1,6.90,0.86
1038,רוטב לימון משומר לתיבול יכין (1 ליטר),זנלכל בעמ,יח`,,1,7.90,0.79
1039,סירופ דיאט בטעם לימון יכין (1 ליטר),זנלכל בעמ,יח`,,1,7.90,0.79
1040,סירופ דיאט בטעם פטל יכין (1 ליטר),זנלכל בעמ,יח`,,1,7.90,0.79
1041,סירופ 1 ליטר דיאט אשכולית,זנלכל בעמ,יח`,,1,7.90,0.79
1042,סירופ 1 ליטר דיאט תפוחים,זנלכל בעמ,יח`,,1,7.90,0.79
1043,סירופ דיאט בטעם אננס יכין (1 ליטר),זנלכל בעמ,יח`,,1,7.90,0.79
1044,עגבניות שלמות מקולפות יכין (800 גרם),זנלכל בעמ,יח`,,1,6.90,0.86
1045,אורז בסגנון תאילנדי סוגת (1 קג),סוגת תעשיות בעמ,יח`,,1,7.90,0.79
1046,קמח חיטה מלא סוגת (1 קג),סוגת תעשיות בעמ,יח`,,1,8.90,0.89
1047,בצק עלים צרפתי מרודד מעדנות (1 קג),תנובה קפואים,יח`,,1,21.90,2.19
1048,מלווח מעדנות (6 יח` - 700 גרם),תנובה קפואים,יח`,,1,16.90,2.41
1049,בורקס גבינה מעדנות,תנובה קפואים,יח`,,1,20.90,2.61
1050,בורקס תפוא מעדנות,תנובה קפואים,יח`,,1,19.90,2.49
1051,ריבועי בצק עלים מעדנות,תנובה קפואים,יח`,,1,25,3.13
1052,קרם ידיים ולוטה (80 גרם),הנקל סוד בעמ,יח`,,1,10.90,13.63
1053,מרכך כביסה בייבי סוד (4 ליטר),גורי שיווק בעמ,יח`,,1,17.90,0.45
1054,מרכך כביסה סוד סופט 4 ליטר סגול,גורי שיווק בעמ,יח`,,1,17.90,0.45
1055,מרכך כביסה סוד סופט 4 ליטר לבן,גורי שיווק בעמ,יח`,,1,17.90,0.45
1056,מרכך כביסה ורוד סוד (4 ליטר),גורי שיווק בעמ,יח`,,1,17.90,0.45
1057,מרכך כביסה כחול סוד (4 ליטר),גורי שיווק בעמ,יח`,,1,17.90,0.45
1058,האגיס חיתולי אקסטרה קר מידה 5 34,קימברלי קלארק ישראל שיווק בעמ,יח`,,1,44.90,44.90
1059,מגבונים ללא בישום פרימיום טיטולים (72x4),קימברלי קלארק ישראל שיווק בעמ,יח`,,1,19.90,19.90
1060,זוג רדי אלומניום עם הטבעה,קימברלי קלארק ישראל שיווק בעמ,יח`,,1,9.90,9.90
1061,חומוסטחינה צנובר צבר (400 גרם),קבוצת אסם סחר שות. מוגבלת,יח`,,1,13.90,3.48
1062,מי סודה שוופס (1.5 ליטר),יפאורה,יח`,,1,3.50,0.23
1063,מטלית לכל סנו סושי (9),החברה הדרומית לשיווק בעמ,יח`,,1,11.90,1.32
1064,ניילון נצמד סנו סושי (30x2 מטר),החברה הדרומית לשיווק בעמ,יח`,,1,10.90,10.90
1065,קל רסס וכבס סנו (750 מל),החברה הדרומית לשיווק בעמ,יח`,,1,19.90,3.32
1066,שמפו שטיחים ספריי סנו (600 מל),החברה הדרומית לשיווק בעמ,יח`,,1,23.90,3.98
1067,תרסיס רהיט סנו (300 מל),החברה הדרומית לשיווק בעמ,יח`,,1,16.90,5.54
1068,סופר פוליש נוזל לרצפה סנו (1 ליטר),החברה הדרומית לשיווק בעמ,יח`,,1,33.90,33.90
1069,סנובון תות לאסלה סנו (55x3 גרם),החברה הדרומית לשיווק בעמ,יח`,,1,11.90,7.21
1070,סנובון לאסלה לימון סנו (55x3 גרם),החברה הדרומית לשיווק בעמ,יח`,,1,11.90,7.21
1071,סנובון לאסלה לובר סנו (55x3 גרם),החברה הדרומית לשיווק בעמ,יח`,,1,11.90,7.21
1072,ז`אוול מרסס לניקוי כללי לבנדר סנו (1 ליט,החברה הדרומית לשיווק בעמ,יח`,,1,19.90,19.90
1073,קוטל מעופפים קיי 400 סנו (630 מל),החברה הדרומית לשיווק בעמ,יח`,,1,25,6.25
1074,קוטל חרקים קיי 300 סנו (630 מל),החברה הדרומית לשיווק בעמ,יח`,,1,21.90,3.48
1075,K500,החברה הדרומית לשיווק בעמ,יח`,,1,26,6.42
1076,סנו-די דוחה יתושים כדורי סנו (50 מל),החברה הדרומית לשיווק בעמ,יח`,,1,20.90,41.80
1077,סנו די תרסיס,החברה הדרומית לשיווק בעמ,יח`,,1,20.90,16.72
1078,סנו די נוזל+משאבה,החברה הדרומית לשיווק בעמ,יח`,,1,22.90,45.80
1079,מסיר שומנים ז`אוול קר,החברה הדרומית לשיווק בעמ,יח`,,1,19.90,2.65
1080,סנו ז`אוול מרסס 1 ליטר,החברה הדרומית לשיווק בעמ,יח`,,1,19.90,19.90
1081,מסיר שומנים פורטה פלוס סנו (750 מל),החברה הדרומית לשיווק בעמ,יח`,,1,16.90,2.25
1082,פוליויקס 2 ליטר,החברה הדרומית לשיווק בעמ,יח`,,1,22.90,11.45
1083,סנובון לאסלה קלאסיק כחול סנו (55x3 גרם),החברה הדרומית לשיווק בעמ,יח`,,1,18.90,11.45
1084,רסס ונגב לניקוי כללי תרסיס סנו (750 מל),החברה הדרומית לשיווק בעמ,יח`,,1,17.90,2.98
1085,סנוג`ט יכול הכל סחלבים סנו (4 ליטר),החברה הדרומית לשיווק בעמ,יח`,,1,19.90,4.98
1086,סנומוד מדונה,החברה הדרומית לשיווק בעמ,יח`,,1,11.90,7.93
1087,מטלית ריצפה זיגזג סנו סושי (3),החברה הדרומית לשיווק בעמ,יח`,,1,12.90,12.90
1088,כרית יפנית לכלים אקטיב סנו סושי (4),החברה הדרומית לשיווק בעמ,יח`,,1,11.90,11.90
1089,שקיות אשפה לפח 65x54 סנו סושי (60),החברה הדרומית לשיווק בעמ,יח`,,1,22.90,22.90
1090,אטבי כביסה איכות סנו (20),החברה הדרומית לשיווק בעמ,יח`,,1,9.90,9.90
1091,רב מגבת ג`מבו סנו סושי,החברה הדרומית לשיווק בעמ,יח`,,1,24.90,6.38
1092,סושי רדיד אלומיניום צמד,החברה הדרומית לשיווק בעמ,יח`,,1,12.90,12.90
1093,חטיפי כרובית בציפוי פריך טבעול (500 גרם),קבוצת אסם סחר שות. מוגבלת,יח`,,1,31.90,6.38
1094,פול מצרי 560 גר,ויטה -פרי גליל (החדשה) בעמ,יח`,,1,4.90,0.88
1095,שעועית לבנה אפויה,ויטה -פרי גליל (החדשה) בעמ,יח`,,1,5.90,1.07
1096,חומוס שלם A2,ויטה -פרי גליל (החדשה) בעמ,יח`,,1,5.90,0.98
1097,אפונה גדולה A2,ויטה -פרי גליל (החדשה) בעמ,יח`,,1,5.90,0.98
1098,אפונה וגזר A2,ויטה -פרי גליל (החדשה) בעמ,יח`,,1,5.90,1.07
1099,תירס גרעינים 550 גר`,ויטה -פרי גליל (החדשה) בעמ,יח`,,1,5.90,1.07
1100,ופלים מצופים מן (22x10 גרם),רוקחמן בעמ,יח`,,1,7.90,3.95
1101,חומוסטחינה פלפל חריף מטוגן 400גר,קבוצת אסם סחר שות. מוגבלת,יח`,,1,13.90,3.48
1102,קבנוס קלאסי יחיעם (125 גרם),מעדני יחיעם (1993) בעמ,יח`,,1,12.90,10.32
1103,קבנוס פפרוני יחיעם (125 גרם),מעדני יחיעם (1993) בעמ,יח`,,1,12.90,10.32
1104,משקה קל דיאט אשכוליות ג`אמפ (1.5 ליטר),טמפו משקאות בעמ,יח`,,1,5.50,0.37
1105,משקה קל מנגו פסיפלורה ג`אמפ (1.5 ליטר),טמפו משקאות בעמ,יח`,,1,5.50,0.37
1106,מי סודה טמפו (1.5 ליטר),טמפו משקאות בעמ,יח`,,1,3,0.20
1107,סודה בטעם פירות יער טמפו (1.5 ליטר),טמפו משקאות בעמ,יח`,,1,4,2.67
1108,סודה בטעם אננס טמפו (1.5 ליטר),טמפו משקאות בעמ,יח`,,1,4,2.67
1109,סלמי גליל 600 גר` טירת צבי,תנובה קפואים,יח`,,1,35.90,5.98
1110,נקניקיות פיקנטיות 400 גר` טירת צבי,תנובה קפואים,יח`,,1,13.90,3.48
1111,סלסולי כתף בקר 120 גר` טירת צבי,תנובה קפואים,יח`,,1,15.90,13.25
1112,סלסולי סלמי איטלקי 120 גר` טירת צבי,תנובה קפואים,יח`,,1,15.90,13.25
1113,דקניקים סלסולי הודו טירת צבי (120 גרם),תנובה קפואים,יח`,,1,15.90,13.25
1114,סלסולי פסטרמה גחלים 120 גר` טירת צבי,תנובה קפואים,יח`,,1,15.90,13.25
1115,נקניקיות עוף טירת צבי (400 גרם),תנובה קפואים,יח`,,1,13.90,3.48
1116,צמד כפרי 800 גר` טירת צבי,תנובה קפואים,יח`,,1,34.90,4.36
1117,לחם עינן קל פרוס אנג`ל (500 גרם),שלמה א. אנג`ל בעמ,יח`,,1,14.80,2.96
1118,נוזל לניקוי אסלות 00 סנו (1 ליטר),החברה הדרומית לשיווק בעמ,יח`,,1,8.90,8.90
1119,ממרח 400 גר` חלבי בדצ השחר,השחר העולה תעשית ממתקים בעמ,יח`,,1,13.90,3.48
1120,ממרח אגוזי לוז עם קקאו 350 גר` פרווה,השחר העולה תעשית ממתקים בעמ,יח`,,1,13.90,3.97
1121,שפורפרת לחיץ שוקולד 330 גר` השחר,השחר העולה תעשית ממתקים בעמ,יח`,,1,13.90,4.21
1122,ממרח 400 גר` פרווה השחר,השחר העולה תעשית ממתקים בעמ,יח`,,1,11.90,2.98
1123,ממרח חצי חצי 350 גר` השחר,השחר העולה תעשית ממתקים בעמ,יח`,,1,11.90,3.40
1124,אבקת קקאו השחר העולה (500 גרם),השחר העולה תעשית ממתקים בעמ,יח`,,1,29.90,5.98
1125,ממרח חלב 350 גר` השחר,השחר העולה תעשית ממתקים בעמ,יח`,,1,11.90,3.40
1126,ממרח נוגט אגוזים 350 גר` השחר,השחר העולה תעשית ממתקים בעמ,יח`,,1,12.90,3.69
1127,קפה שחור קפה לנדוור (100x3 גרם),קבוצת אסם סחר שות. מוגבלת,יח`,,1,22.90,7.63
1128,קפה לנדוור לבוקר שלישיה,קבוצת אסם סחר שות. מוגבלת,יח`,,1,22.90,7.63
1129,פופקורן פופסטאר חמישייה טבעי,דנשר (1963) בעמ,יח`,,1,16.90,3.38
1130,פופקורן פופסטאר חמישייה חמאה,דנשר (1963) בעמ,יח`,,1,16.90,3.38
1131,גלילונית לפח 60 יח`,דנשר (1963) בעמ,יח`,,1,19.90,19.90
1132,משקה מוגז בטעם קולה פפסי (1.5 ליטר),טמפו משקאות בעמ,יח`,,1,5.90,0.39
1133,משקה מוגז בטעם ליים סבן אפ (1.5 ליטר),טמפו משקאות בעמ,יח`,,1,5.90,0.39
1134,משקה אורנג` מירנדה (1.5 ליטר),טמפו משקאות בעמ,יח`,,1,5.90,0.39
1135,פפסי סבן אפ דיאט 1.5 ליטר,טמפו משקאות בעמ,יח`,,1,5.90,0.39
1136,פפסי מקס 1.5 ליטר,טמפו משקאות בעמ,יח`,,1,5.90,0.39
1137,נוזל לניקוי כללי פנטסטיק סיף (4 ליטר),יוניליוור ישראל שיווק בעמ,יח`,,1,24.90,0.62
1138,בייגלה שמונה שמונה 400 גר`,יוניליוור ישראל שיווק בעמ,יח`,,1,10.90,2.73
1139,בייגלה אחד אחד 400 גר`,יוניליוור ישראל שיווק בעמ,יח`,,1,10.90,2.73
1140,צבר חומוסיבוב ברוטב חריף 400 גרם,קבוצת אסם סחר שות. מוגבלת,יח`,,1,13.90,2.48
1141,חומוס צבר סמיר הגדול,קבוצת אסם סחר שות. מוגבלת,יח`,,1,13.90,3.48
1142,חומוס צבר אבו מרוואן,קבוצת אסם סחר שות. מוגבלת,יח`,,1,13.90,3.48
1143,לחמניות חיטה מלאה דגנית עין בר (10),דגנית עין בר תעשיות מזון ואפיה,יח`,,1,11.90,1.59
1144,לחמניות אצבע דגנית עין בר (10),דגנית עין בר תעשיות מזון ואפיה,יח`,,1,11.90,1.59
1145,לחם אקטיב ברמן (750 גרם),י.את א. ברמן בעמ,יח`,,1,14.90,1.99
1146,לחמניות אקטיב ברמן,י.את א. ברמן בעמ,יח`,,1,11.90,2.64
1147,יין אדום יבש של סגל (750 מל),טמפו משקאות בעמ,יח`,,1,21,2.76
1148,יין לבן יבש של סגל (750 מל),טמפו משקאות בעמ,יח`,,1,21,2.76
1149,יין לבן חצי יבש של סגל (750 מל),טמפו משקאות בעמ,יח`,,1,21,2.76
1150,מרום גליל סינגל קברנה סובניון 750 מל,טמפו משקאות בעמ,יח`,,1,39.90,5.28
1151,מרום גליל סינגל מרלו 750מל,טמפו משקאות בעמ,יח`,,1,39.90,5.28
