,ItemName,ManufactureName,UnitQty,Quantity,QtyInPackage,ItemPrice,UnitOfMeasurePrice
1955,שלישית פטריות חתוכות,ג.וילי-פוד אינטרנשיונל בעמ,יח`,,1,9.90,1.14
1956,צ`יפס מוקפא 1.5  קג`פרי גליל,ויטה -פרי גליל (החדשה) בעמ,יח`,,1,14.90,0.99
1957,צ`יפס מובחר 700 גר`,ויטה -פרי גליל (החדשה) בעמ,יח`,,1,9.90,1.41
1958,סילאן שקדיה (900 גרם),דין שיווק וקליה בעמ,יח`,,1,14.90,1.66
1959,אסטוניש מרסס צהוב למטבח,יעקב יעקבי ובניו בעמ,יח`,,1,11.90,1.59
1960,הפי בקבוק מדליק פחמים,יעקב יעקבי ובניו בעמ,יח`,,1,16.90,16.90
1961,תפוזינה תפוזים 500מל,יפאורה,יח`,,1,4.50,0.84
1962,תפוזינה ענבים 0.5 ליטר,יפאורה,יח`,,1,4.50,0.84
1963,משקה קל דיאט אשכוליות קריסטל (2 ליטר),יפאורה,יח`,,1,3.80,1.90
1964,משקה אקזוטי קריסטל (2 ליטר),יפאורה,יח`,,1,3.80,1.90
1965,משקה קל פירות טרופים ספרינג (1.5 ליטר),יפאורה,יח`,,1,6.40,0.43
1966,נקטר פירות טרופיים ספרינג (1 ליטר),יפאורה,יח`,,1,5.50,0.55
1967,מי סודה שוופס (1.5x4 ליטר),יפאורה,יח`,,1,11,1.83
1968,במבה אסם (15x20 גרם),קבוצת אסם סחר שות. מוגבלת,יח`,,1,23.90,7.97
1969,קוסקוס דק אסם (350 גרם),קבוצת אסם סחר שות. מוגבלת,יח`,,1,8.90,2.54
1970,גמדים רביעייה דגנים,שטראוס גרופ בעמ/מצונן,יח`,,1,11.40,2.85
1971,אקטימל 1.8% דנונה (100x14 מל),שטראוס גרופ בעמ/מצונן,יח`,,1,29.90,21.36
1972,קרם גבינה 5% סקי (750 גרם),שטראוס גרופ בעמ/מצונן,יח`,,1,14.25,1.90
1973,יוגורט ביו 3% תות דנונה (150 גרם),שטראוס גרופ בעמ/מצונן,יח`,,1,3.70,2.47
1974,אקטימל דנונה (100x8 מל),שטראוס גרופ בעמ/מצונן,יח`,,1,19.90,2.49
1975,יוגורט ביו 3% אפרסק דנונה (150 גרם),שטראוס גרופ בעמ/מצונן,יח`,,1,3.70,2.47
1976,יוגורט ביו 1.7% דנונה (150x8 גרם),שטראוס גרופ בעמ/מצונן,יח`,,1,16.80,14
1977,שטראוס קרמיסימו תות לימון,גלידות שטראוס בעמ,יח`,,1,18.90,14.21
1978,מאגדת-לייט מיני סנדוויץ,גלידות שטראוס בעמ,יח`,,1,27,10.80
1979,מאגדת אסקימו 10 יח,גלידות שטראוס בעמ,יח`,,1,16.90,1.69
1980,שטראוס קרמיסימו פירות יער,גלידות שטראוס בעמ,יח`,,1,18.90,14.21
1981,יין אדום מתוק מסורת אפרת (1 ליטר),יקב טפרברג 1870 בעמ (יינות ומש,יח`,,1,19.90,1.96
1982,תירוש ענבים טבעי מוסקט אפרת (1 ליטר),יקב טפרברג 1870 בעמ (יינות ומש,יח`,,1,12.90,1.26
1983,שושנים טריפל שוקולד לחמי (380 גרם),תה ויסוצקי (ישראל) בעמ,יח`,,1,17.90,4.71
1984,קבב זהב קפוא זוגלובק (8  יח`- 400 גרם),זוגלובק שיווק בעמ,יח`,,1,19.90,4.98
1985,שניצל תירס קלאסי זוגלובק (2 קג),זוגלובק שיווק בעמ,יח`,,1,49.90,0.02
1986,סלמי קוניאק זוגלובק (300 גרם),זוגלובק שיווק בעמ,יח`,,1,29.90,8.54
1987,סלמי איטלקי מעושן זוגלובק (300 גרם),זוגלובק שיווק בעמ,יח`,,1,28.90,9.63
1988,שניצל תירס זוגלובק (750 גרם),זוגלובק שיווק בעמ,יח`,,1,26.90,3.59
1989,נקניקיות מן הצומח זוגלובק (2 קג),זוגלובק שיווק בעמ,יח`,,1,59.90,3
1990,בורקס תפוא 800 בדצ,זוגלובק שיווק בעמ,יח`,,1,19.90,2.49
1991,מלוואח 700 גר` בדצ,זוגלובק שיווק בעמ,יח`,,1,16.90,2.41
1992,המבורגר מיזרחי,זוגלובק שיווק בעמ,יח`,,1,19.90,4.98
1993,קבב מזרחי ג 400ר,זוגלובק שיווק בעמ,יח`,,1,19.90,4.98
1994,חזה עוף ברביקיו 330 גר` 2% שומן זוגלובק,זוגלובק שיווק בעמ,יח`,,1,28.90,8.76
1995,בירה שחורה נשר מאלט חוזר (500 מל),טמפו משקאות בעמ,יח`,,1,5,0.76
1996,בירה גולדסטאר (500 מל),טמפו משקאות בעמ,יח`,,1,6.90,1.14
1997,בירה שחורה מאלט סטאר (1.5 ליטר),טמפו משקאות בעמ,יח`,,1,7.50,0.50
1998,ויסוצקי בוטן בקל,דין שיווק וקליה בעמ,יח`,,1,3.10,1.55
1999,עוגת מוס גבינה פרורים 850 גר,קפולסקי אדל בעמ,יח`,,1,59.90,7.05
2000,עוגת תפוז אחוה (450 גרם) אחוה,אחדות בעמ,יח`,,1,9.90,2.20
2001,עוגה אנגלית אחוה (450 גרם) אחוה,אחדות בעמ,יח`,,1,9.90,2.20
2002,עוגת שוקולד אחוה (450 גרם) אחוה,אחדות בעמ,יח`,,1,9.90,2.20
2003,עוגת שיש אחוה (450 גרם) אחוה,אחדות בעמ,יח`,,1,9.90,2.20
2004,עוגת שמרים שוקולד אחוה (400 גרם),אחדות בעמ,יח`,,1,9,2.25
2005,מאפינס שוקולד 50 גר` אחוה,אחדות בעמ,יח`,,1,1.50,3
2006,עוגת שמרים פרג אחוה (400 גרם),אחדות בעמ,יח`,,1,9,2.25
2007,מאפינס שוקוצ`יפס 45 גר` אחוה,אחדות בעמ,יח`,,1,1.50,3.33
2008,עוגת תפוח עץ אחוה (450 גרם),אחדות בעמ,יח`,,1,10,2.22
2009,רוגעלך אחוה (400 גרם),אחדות בעמ,יח`,,1,8.90,2.23
2010,עוגה ללא סוכר שיש 400  גר`אחווה,אחדות בעמ,יח`,,1,11.90,2.98
2011,לניקוי משטחי המטבח 1 ליטר סנט מוריץ,קומפלקס כימיקלים בעמ,יח`,,1,9.90,0.99
2012,שקית 20 פסטל רחבה,שמחה זה אנחנו בעמ,יח`,,1,5.90,5.90
2013,שמפו 10 קרליין,החברה הדרומית לשיווק בעמ,יח`,,1,11.90,1.70
2014,שמפו 10 קרליין,החברה הדרומית לשיווק בעמ,יח`,,1,11.90,1.70
2015,מרכך 10 קרליין,החברה הדרומית לשיווק בעמ,יח`,,1,11.90,1.70
2016,דאו נושם רול און קרליין,החברה הדרומית לשיווק בעמ,יח`,,1,12.90,17.20
2017,דאו נושם רול און קרליין - כחול,החברה הדרומית לשיווק בעמ,יח`,,1,12.90,25.80
2018,דאו נושם רול און קרליין כתום,החברה הדרומית לשיווק בעמ,יח`,,1,12.90,17.20
2019,דאו נושם רול און קרליין בורדו,החברה הדרומית לשיווק בעמ,יח`,,1,12.90,17.20
2020,דאו נושם ספריי קרליין,החברה הדרומית לשיווק בעמ,יח`,,1,12.90,6.45
2021,פילסברי תערובת כדורי שוקולד,ליימן שליסל בעמ,יח`,,1,18.90,3.78
2022,בירה שחורה מאלטי (1.5 ליטר),החברה המרכזית להפצת משקאות בעמ,יח`,,1,8.50,5.67
2023,לבן 3% טרה (150 מל),החב` המרכזית - טרה,יח`,,1,1.05,0.70
2024,מאמא עוף שניצל אמיתי ביתי כשלפ 700 גר`,תנובה קפואים,יח`,,1,42.90,6.13
2025,בוטן בקליפה 400 גר`,בוטנת בעמ,יח`,,1,12.90,3.23
2026,שקדים פיצוחי חממה (150 גרם),בוטנת בעמ,יח`,,1,16.90,11.27
2027,פיסטוק חלבי פיצוחי חממה (150 גרם),בוטנת בעמ,יח`,,1,16.90,11.27
2028,אגוזי קשיו קלויים פיצוחי חממה (150 גרם),בוטנת בעמ,יח`,,1,16.90,11.27
2029,חמנייה 400 גרם,בוטנת בעמ,יח`,,1,10.90,2.73
2030,קרקר לחמית שיפון אסם (230 גרם),קבוצת אסם סחר שות. מוגבלת,יח`,,1,8.90,3.87
2031,פלאפל בקלי קלות 90 גר`,קבוצת אסם סחר שות. מוגבלת,יח`,,1,10.90,12.11
2032,עוגת הבית בטעם שוקולד אסם (400 גרם),קבוצת אסם סחר שות. מוגבלת,יח`,,1,11.90,2.98
2033,עוגת הבית שיש אסם (400 גרם),קבוצת אסם סחר שות. מוגבלת,יח`,,1,11.90,2.98
2034,עוגת הבית שוקוצ`יפס אסם (400 גרם),קבוצת אסם סחר שות. מוגבלת,יח`,,1,11.90,2.98
2035,עוגת הבית תפוז אסם (400 גרם),קבוצת אסם סחר שות. מוגבלת,יח`,,1,11.90,2.98
2036,פריכונים בטעם מלוח אסם (80 גרם),קבוצת אסם סחר שות. מוגבלת,יח`,,1,7.90,9.88
2037,דייסת קורנפלור מטרנה (200 גרם),קבוצת אסם סחר שות. מוגבלת,יח`,,1,12.90,6.45
2038,דייסת אורז מטרנה (200 גרם),קבוצת אסם סחר שות. מוגבלת,יח`,,1,12.90,6.45
2039,דייסת דגנים מעורבים מטרנה (200 גרם),קבוצת אסם סחר שות. מוגבלת,יח`,,1,12.90,6.45
2040,דייסת וניל מטרנה (200 גרם),קבוצת אסם סחר שות. מוגבלת,יח`,,1,12.90,6.45
2041,ברבי משחת שיניים לילדים,גורי ע.ע.ע בעמ,יח`,,1,9.90,19.80
2042,שמפו לשיער רגיל פינוק (700 מל),יוניליוור ישראל שיווק בעמ,יח`,,1,12.90,1.84
2043,שמפו לשיער יבש ופגום פינוק (700 מל),יוניליוור ישראל שיווק בעמ,יח`,,1,12.90,1.84
2044,מרכך לשיער רגיל פינוק (700 מל),יוניליוור ישראל שיווק בעמ,יח`,,1,12.90,1.84
2045,מרכך לשיער יבש פינוק (700 מל),יוניליוור ישראל שיווק בעמ,יח`,,1,12.90,1.84
2046,שמפו ומרכך לשיער רגיל פינוק (700 מל),יוניליוור ישראל שיווק בעמ,יח`,,1,12.90,1.84
2047,סיף פנטסטיק שמפו רצפות 4 ליטר,יוניליוור ישראל שיווק בעמ,יח`,,1,19.90,0.50
2048,ליסטרין פרש מינט 500 מל,שקד תבל בעמ,יח`,,1,19.90,3.98
2049,שניצלונים 700 גר` עוף טוב,קבוצת אסם סחר שות. מוגבלת,יח`,,1,19.90,2.84
2050,חמאה מפינלנד ללא תוספת מלח (200 גרם),ג.וילי-פוד אינטרנשיונל בעמ,יח`,,1,11.90,5.95
2051,פרמז`נו מגורדת 90 גר`,ג.וילי-פוד אינטרנשיונל בעמ,יח`,,1,15.90,17.67
2052,איטריות נודלס 400 גר`,ג.וילי-פוד אינטרנשיונל בעמ,יח`,,1,5.90,1.48
2053,אגו משפחתי חלב בלמינט 130 גר` * 13 יח`,כרמית תעשיות ממתקים בעמ,יח`,,1,8.90,6.85
2054,ג`לטין דגים טהור,נטו מלינדה סחר בעמ,יח`,,1,10.90,38.93
2055,בצק פילו שלושת האופים (500 גרם),נטו מלינדה סחר בעמ,יח`,,1,19.90,3.98
2056,עלי בצק לסיגרים שלושת האופים (500 גרם),נטו מלינדה סחר בעמ,יח`,,1,11.90,2.38
2057,ג`חנון אפוי 650 גר`,נטו מלינדה סחר בעמ,יח`,,1,21.90,3.37
2058,סיגרים בשר 1 קג שלושת האופים,נטו מלינדה סחר בעמ,יח`,,1,16.90,1.69
2059,סיגרים תפוא 1 קג שלושת האופים,נטו מלינדה סחר בעמ,יח`,,1,16.90,1.69
2060,קובה בשר מטוגן 1 קג,נטו מלינדה סחר בעמ,יח`,,1,16.90,1.69
2061,פסטלים תפוא 1 קג שלושת האופים,נטו מלינדה סחר בעמ,יח`,,1,16.90,1.69
2062,כדורי פלאפל 1 קג-שלושת  האופים,נטו מלינדה סחר בעמ,יח`,,1,16.90,1.69
2063,המבורגר מיזרחי 400 גר` טיבונוויל,נטו מלינדה סחר בעמ,יח`,,1,20.90,5.23
2064,המבורגר 100% 400 גר` טיבונוויל,נטו מלינדה סחר בעמ,יח`,,1,20.90,5.23
2065,300 איקרה ביתית,נטו מלינדה סחר בעמ,יח`,,1,15.90,5.30
2066,סלט איקרה ביתית ורודה דלידג (300 גרם),נטו מלינדה סחר בעמ,יח`,,1,15.90,5.30
2067,אצבעות שניצל שומשום מאמא עוף (700 גרם),תנובה קפואים,יח`,,1,36,6
2068,שניצל ג`ונגל מאמא עוף (700 גרם),תנובה קפואים,יח`,,1,36,5.14
2069,שניצל דק דק פריך מאמא עוף (700 גרם),תנובה קפואים,יח`,,1,42.90,6.13
2070,שניצל עוף אמיתי מאמא עוף (700 גרם),תנובה קפואים,יח`,,1,42.90,6.13
2071,שניצל עוף ציפוי מעודן מאמא עוף,תנובה קפואים,יח`,,1,42.90,6.13
2072,שניצל עוף אמיתי ביתי מאמא עוף,תנובה קפואים,יח`,,1,42.90,6.13
2073,כוכבי עוף בציפוי מעודן 700 גר` מאמא עוף,תנובה קפואים,יח`,,1,36,5.14
2074,חומוס עם טחינה צבר (150 גרם),קבוצת אסם סחר שות. מוגבלת,יח`,,1,4.90,3.27
2075,צבר חומוס+חריף 150,קבוצת אסם סחר שות. מוגבלת,יח`,,1,4.90,3.27
2076,נקה 7 מרכך 750 מל ורוד,החברה הדרומית לשיווק בעמ,יח`,,1,10.90,1.45
2077,בירה לא מסוננת גולדסטאר (330x6 מל),טמפו משקאות בעמ,יח`,,1,40.90,1.97
2078,פיקסי תות ליים 275 מל,טמפו משקאות בעמ,יח`,,1,4.90,4.90
2079,פיקסי אפרסק 275 מל,טמפו משקאות בעמ,יח`,,1,4.90,4.90
2080,בירה בפחית גולדסטאר (500 מל),טמפו משקאות בעמ,יח`,,1,7.90,1.52
2081,בירה מכבי פחית 500 מל,טמפו משקאות בעמ,יח`,,1,6.90,1.32
2082,הייניקן פחית 500 מל,טמפו משקאות בעמ,יח`,,1,11.90,2.32
2083,בירה 7.9% אלכוהול מכבי (330x6 מל),טמפו משקאות בעמ,יח`,,1,34.90,16.72
2084,בירה מכבי (330x6 מל),טמפו משקאות בעמ,יח`,,1,33.90,16.21
2085,גולדסטאר סלו ברו שישייה בקבוק 330 מל.,טמפו משקאות בעמ,יח`,,1,40.90,19.75
2086,בירה גולדסטאר 330 מל בקבוק שישייה,טמפו משקאות בעמ,יח`,,1,37.90,1.82
2087,בירה היינקן (330x6 מל) שישייה,טמפו משקאות בעמ,יח`,,1,32.90,1.57
2088,סודה אננס 1.5 ליטר רביעייה טמפו,טמפו משקאות בעמ,יח`,,1,10.90,10.90
2089,מי סודה טמפו (1.5x6 ליטר),טמפו משקאות בעמ,יח`,,1,15.90,1.77
2090,מאיר בייגל פרורי גרסיני זהב 200גר,דיפלומט היינץ,יח`,,1,5.90,2.95
2091,צ`יפס זיגזג טוגן (800 גרם),קבוצת אסם סחר שות. מוגבלת,יח`,,1,10.90,1.36
2092,ניילון נצמד COOK שלישיה.,אינטרסן 1996 בעמ,יח`,,1,10,10
2093,טלק לתינוק 414 גר`,אינטרסן 1996 בעמ,יח`,,1,21.90,5.29
2094,קונפיטורה משמש 340 גר`,מיה תעשיות מזון מ.ת.מ. בעמ,יח`,,1,9.90,2.91
2095,אגוזי מלך גרוסים 100 גר`,מיה תעשיות מזון מ.ת.מ. בעמ,יח`,,1,11.90,11.90
2096,שקדים מולבנים שלמים 100 גר`,מיה תעשיות מזון מ.ת.מ. בעמ,יח`,,1,11.90,11.90
2097,חומוס אחלה (750 גרם),שטראוס גרופ בעמ/מצונן,יח`,,1,9.90,1.32
2098,יין מרלו רקנטי 750 מל,היכל היין שקד גולן בעמ,יח`,,1,55.20,7.32
2099,יסמין אדום רקנאטי 750 מל,היכל היין שקד גולן בעמ,יח`,,1,34.90,4.61
2100,יין יסמין לבן,היכל היין שקד גולן בעמ,יח`,,1,34.90,4.61
2101,קוקה קולה שישיה 1.75,החברה המרכזית להפצת משקאות בעמ,יח`,,1,34.90,3.32
2102,נקטר חמוציות אושן ספריי פריגת (1 ליטר),החברה המרכזית להפצת משקאות בעמ,יח`,,1,10.90,10.90
2103,דניאלה מעדן בטעם תות שטראוס (88 גרם),שטראוס גרופ בעמ/מצונן,יח`,,1,4,2.67
2104,לחם שבעה דגנים קל פרוס אנג`ל (500 גרם),שלמה א. אנג`ל בעמ,יח`,,1,13.90,2.78
2105,פיתות מארז עשירייה,שלמה א. אנג`ל בעמ,יח`,,1,8.90,8.90
2106,לחם שיפון עגול פרוס אחדות (750 גרם),שלמה א. אנג`ל בעמ,יח`,,1,11.90,1.59
2107,לחם שיפון כהה פרוס אחדות (750 גרם),שלמה א. אנג`ל בעמ,יח`,,1,11.90,1.59
2108,תפוצ`יפס 50 גר קראנץ`,שטראוס פריטו ליי בעמ,יח`,,1,3.90,7.09
2109,ממרח בטעם שוקולד מגדים עלית (500 גרם),שטראוס גרופ בעמ,יח`,,1,11.90,2.38
2110,טבלאות פרה במילוי תות,שטראוס גרופ בעמ,יח`,,1,4.90,4.90
2111,שוקולד ממולדה,שטראוס גרופ בעמ,יח`,,1,4.90,9.80
2112,תפוצ`יפס 200 גר` קראנץ`,שטראוס פריטו ליי בעמ,יח`,,1,10.90,5.45
2113,שוקולד מריר 70% ספלנדיד (100 גרם),שטראוס גרופ בעמ,יח`,,1,10.90,10.90
2114,בפלות 400  גר`שחור לבן,שטראוס גרופ בעמ,יח`,,1,16.90,4.23
2115,חטיף ופל טוב טעם עלית (30x20 גרם),שטראוס גרופ בעמ,יח`,,1,25.90,4.32
2116,שוקולד פרה לבן עם עוגיות עלית (100 גרם),שטראוס גרופ בעמ,יח`,,1,4.90,4.90
2117,טבלאות פרה ממולא תות מגדים,שטראוס גרופ בעמ,יח`,,1,4.90,4.90
2118,תפוצ`יפס 50 גר קראנץ` גריל,שטראוס פריטו ליי בעמ,יח`,,1,3.90,7.80
2119,תפוצ`יפס 50 גר קראנץ` מקסיקני,שטראוס פריטו ליי בעמ,יח`,,1,3.90,7.80
2120,בפלות 350  גר`גבינת פירורים,שטראוס גרופ בעמ,יח`,,1,16.90,4.83
2121,בפלות 350  גר`טראפלס ופירורים,שטראוס גרופ בעמ,יח`,,1,15.40,4.40
2122,שוקולד פרה חלב אוורירי עלית (85 גרם),שטראוס גרופ בעמ,יח`,,1,4.90,4.90
2123,מסטיק מאסט מנטה עדין 28 גרם,שטראוס גרופ בעמ,יח`,,1,4.90,17.50
2124,רולדה שוקולד מצופה,שטראוס גרופ בעמ,יח`,,1,13.90,3.97
2125,נקטר רימונים ספרינג (1 ליטר),יפאורה,יח`,,1,5.50,0.55
2126,ערגליות שוקו אסם (300 גרם),קבוצת אסם סחר שות. מוגבלת,יח`,,1,10.90,3.63
2127,ערגליות תות אסם (300 גרם),קבוצת אסם סחר שות. מוגבלת,יח`,,1,10.90,3.63
2128,סינר נשים למטבח,קונסיגנציה- ש. י גיספאן 1993,יח`,,1,25.90,25.90
2129,קויוטה מסז,קונסיגנציה- ש. י גיספאן 1993,יח`,,1,12.90,12.90
2130,קולבים נדבקים,קונסיגנציה- ש. י גיספאן 1993,יח`,,1,11.90,11.90
2131,נייר טואלט טאצ` 32 גלילים,שניב תעשיות נייר בעמ,יח`,,1,24.90,24.90
2132,נייר טואלט  טאצ`40 גלילים,שניב תעשיות נייר בעמ,יח`,,1,31.90,1.30
2133,קברנה/מרלו פי.סי אדום יבש 750 מל,אגודת הכורמים,יח`,,1,44.90,5.95
2134,יין אדום ייבש קרבנה סובניון 375 מל,אגודת הכורמים,יח`,,1,16.90,8.88
2135,סלקטד מרלו יקבי כרמל (750 מל),אגודת הכורמים,יח`,,1,26.90,3.55
2136,כרמל 120 אדום מתוק 750 מל קינג דיוויד,אגודת הכורמים,יח`,,1,19.90,2.61
2137,מוסקט מתוק 750 מל קינג דיוויד,אגודת הכורמים,יח`,,1,19.90,2.61
2138,סלקטד קברנה סובניון יקבי כרמל (750 מל),אגודת הכורמים,יח`,,1,26.90,3.55
2139,סלקטד אמרלד ריזלינג יקבי כרמל (750 מל),אגודת הכורמים,יח`,,1,26.90,3.55
2140,מרלו פי.סי אדום יבש 750 מל,אגודת הכורמים,יח`,,1,44.90,5.95
2141,קברנה סוביניון פי.סי אדום יבש 750 מל,אגודת הכורמים,יח`,,1,44.90,5.95
2142,אזורית גוורצטרמינר יין לבן חצי יבש,אגודת הכורמים,יח`,,1,57.90,7.68
2143,סלקטד זינפנדל סמוק יקבי כרמל (750 מל),אגודת הכורמים,יח`,,1,26.90,3.55
2144,סלקטד מוסקטו לבן יקבי כרמל (750 מל),אגודת הכורמים,יח`,,1,26.90,3.55
2145,שטראוס גלידונית 60 יח` פרווה,גלידות שטראוס בעמ,יח`,,1,47.90,7.60
2146,תירוש ענבים אפרת (1 ליטר),יקב טפרברג 1870 בעמ (יינות ומש,יח`,,1,12.90,1.26
2147,אוליביה ממרח פלפ,גורי ע.ע.ע בעמ,יח`,,1,13.90,7.51
2148,טפנד זיתים 180  גר`אוליביה,תנובה - חלב,יח`,,1,11.90,6.61
2149,פריגת 1.5 ליטר,החברה המרכזית להפצת משקאות בעמ,יח`,,1,7.20,4.80
2150,משקה אורנג` מנגו פאנטה (1.5 ליטר),החברה המרכזית להפצת משקאות בעמ,יח`,,1,7.70,5.13
2151,בירה רד לייבל טובורג (330x6 מל),החברה המרכזית להפצת משקאות בעמ,יח`,,1,40.90,19.75
2152,בקבוק זירו קוקה-קולה (1.5 ליטר),החברה המרכזית להפצת משקאות בעמ,יח`,,1,6.90,4.60
2153,מארז זירו קוקה-קולה (1.5x6 ליטר),החברה המרכזית להפצת משקאות בעמ,יח`,,1,37.90,4.21
2154,שקיות אשפה לפח ענק 90x75 גלילונית (50),דנשר (1963) בעמ,יח`,,1,15.90,15.90
2155,תחליף חלב שלב 3 מהדרין מטרנה (700 גרם),קבוצת אסם סחר שות. מוגבלת,יח`,,1,49.90,7.13
2156,בונזו כופתיות קטנות קג 3,דיפלומט היינץ,יח`,,1,39.90,13.30
2157,כוסברה טחונה 100 גר`,א.ל.ייצור ושיווק תבלינים בעמ,יח`,,1,10.90,10.90
2158,כורכום תבליני מימון (100 גרם),א.ל.ייצור ושיווק תבלינים בעמ,יח`,,1,11.90,11.90
2159,כמון טחון תבליני מימון (100 גרם),א.ל.ייצור ושיווק תבלינים בעמ,יח`,,1,11.90,11.90
2160,פלפל שחור גרוס דק תבליני מימון (90 גרם),א.ל.ייצור ושיווק תבלינים בעמ,יח`,,1,15.90,17.67
2161,פלפל שחור גרוס גס תבליני מימון (90 גרם),א.ל.ייצור ושיווק תבלינים בעמ,יח`,,1,15.90,17.67
2162,פפריקה הונגרית מתוקה 100 גר`,א.ל.ייצור ושיווק תבלינים בעמ,יח`,,1,11.90,11.90
2163,פפריקה מרוקאית מתוקה 100 גר`,א.ל.ייצור ושיווק תבלינים בעמ,יח`,,1,11.90,11.90
2164,קינמון טחון תבליני מימון (100 גרם),א.ל.ייצור ושיווק תבלינים בעמ,יח`,,1,10.90,10.90
2165,תבלין לגריל עוף תבליני מימון (100 גרם),א.ל.ייצור ושיווק תבלינים בעמ,יח`,,1,11.90,11.90
2166,תיבול לסטייק 100 גר`,א.ל.ייצור ושיווק תבלינים בעמ,יח`,,1,11.90,11.90
2167,תיבול לדג 100 גר`,א.ל.ייצור ושיווק תבלינים בעמ,יח`,,1,11.90,11.90
2168,אורגנו תבליני מימון (40 גרם),א.ל.ייצור ושיווק תבלינים בעמ,יח`,,1,10.90,27.25
2169,פפריקה הונגרית מתוקה 400 גר`,א.ל.ייצור ושיווק תבלינים בעמ,יח`,,1,24.90,6.23
2170,פפריקה מרוקאית מתוקה 400 גר`,א.ל.ייצור ושיווק תבלינים בעמ,יח`,,1,24.90,6.23
2171,פפריקה מתוקה תבליני מימון (80 גרם),א.ל.ייצור ושיווק תבלינים בעמ,יח`,,1,5.90,7.38
2172,פלפל שחור טחון תבליני מימון (50 גרם),א.ל.ייצור ושיווק תבלינים בעמ,יח`,,1,7.90,15.80
2173,כורכום טחון תבליני מימון (80 גרם),א.ל.ייצור ושיווק תבלינים בעמ,יח`,,1,5.90,7.38
2174,תבלין לגריל עוף תבליני מימון (80 גרם),א.ל.ייצור ושיווק תבלינים בעמ,יח`,,1,5.90,7.38
2175,מלח לימון תבליני מימון (100 גרם),א.ל.ייצור ושיווק תבלינים בעמ,יח`,,1,5.90,5.90
2176,זעתר ושומשום בשקית תבליני מימון (80 גרם),א.ל.ייצור ושיווק תבלינים בעמ,יח`,,1,5.90,7.38
2177,פטרוזיליה תבליני מימון (20 גרם),א.ל.ייצור ושיווק תבלינים בעמ,יח`,,1,5.90,7.38
2178,פפריקה מתוקה 250 גר`,א.ל.ייצור ושיווק תבלינים בעמ,יח`,,1,19.90,7.96
2179,ממרח כבד עם שום,יורוסטנדרט בעמ,יח`,,1,4.90,3.50
2180,תה לימונענע ויסוצקי הגן הקסום) (25,תה ויסוצקי (ישראל) בעמ,יח`,,1,17.50,35
2181,עוגיות חמאה פריכות לחמי (250 גרם),תה ויסוצקי (ישראל) בעמ,יח`,,1,17.90,7.16
2182,עוגיות מלבן שקדים לחמי (250 גרם),תה ויסוצקי (ישראל) בעמ,יח`,,1,17.90,6.39
2183,עוגיות נסיכה לחמי (250 גרם),תה ויסוצקי (ישראל) בעמ,יח`,,1,17.90,7.16
2184,מרמולייט תרכיז,דנשר (1963) בעמ,יח`,,1,9.90,9.90
2185,בזיליקום א.אדמה,א.אדמה (2007) בעמ,יח`,,1,4.90,4.90
2186,סלט ביבי מיקס בנספק,א.אדמה (2007) בעמ,יח`,,1,7.90,7.90
2187,טימין / קורנית,א.אדמה (2007) בעמ,יח`,,1,4.90,4.90
2188,תרד עלים אורגני א.אדמה,א.אדמה (2007) בעמ,יח`,,1,8.90,4.94
2189,סלרי ראש.,א.אדמה (2007) בעמ,יח`,,1,4.90,1.63
2190,חסה רומית נספק,א.אדמה (2007) בעמ,יח`,,1,10,10
2191,חסה משי אורגני א.אדמה,א.אדמה (2007) בעמ,יח`,,1,10,10
2192,לוף ארוז - א.אדמה,א.אדמה (2007) בעמ,יח`,,1,9.90,9.90
2193,לבבות חסה בשקית,א.אדמה (2007) בעמ,יח`,,1,9.90,9.90
2194,מחית פרינוק 190 גר`,גורי מוצרי צריכה (1991) בעמ,יח`,,1,5.90,3.11
