,ItemName,ManufactureName,UnitQty,Quantity,QtyInPackage,ItemPrice,UnitOfMeasurePrice
3252,רוטב עגבניות ופלפלים לשקשוקה 415 גר` קנו,יוניליוור ישראל שיווק בעמ,יח`,,1,13.90,3.35
3253,ברנפלקס אקסטרה פייבר 410 גר` תלמה,יוניליוור ישראל שיווק בעמ,יח`,,1,26.50,6.46
3254,קרמיסימו תותים ושוקולד לבן,גלידות שטראוס בעמ,יח`,,1,20.50,15.41
3255,שלישיית סבון אסלה ל5 פעולות בניחוח אוקיי,יוניליוור ישראל שיווק בעמ,יח`,,1,15.90,15.90
3256,שלישיית סבון אסלה ל5 פעולות בניחוח ים ד,יוניליוור ישראל שיווק בעמ,יח`,,1,15.90,15.90
3257,גלידת שוקולד מריר ושקדים 280 גר` גודיז,גלידות שטראוס בעמ,יח`,,1,19.50,6.96
3258,גלידת וניל עוגיות 280 גר` גודיז,גלידות שטראוס בעמ,יח`,,1,19.50,3.75
3259,גלידת שוקולד ציפס 280 גר` גודיס,גלידות שטראוס בעמ,יח`,,1,19.50,3.75
3260,גלידת וניל תות שדה 280 גר` גודיז,גלידות שטראוס בעמ,יח`,,1,19.50,6.96
3261,מאגדת טילון קורנטו ללא גלוטן כשלפ,גלידות שטראוס בעמ,יח`,,1,35.60,10.79
3262,מאגדת מיני סולרו קוקוס אננס,גלידות שטראוס בעמ,יח`,,1,23.40,4.88
3263,שטראוס קרמיסימו בננה טופי,גלידות שטראוס בעמ,יח`,,1,20.50,20.50
3264,קוקומן כדורים בדצ מופחת סוכר,יוניליוור ישראל שיווק בעמ,יח`,,1,22.40,4.48
3265,קוקומן חום לבן 20% פחות סוכר 375 גר`,יוניליוור ישראל שיווק בעמ,יח`,,1,23.40,6.24
3266,דגני פיצי מהדרין תלמה (500 גרם),יוניליוור ישראל שיווק בעמ,יח`,,1,22.40,4.48
3267,ברנפלקס ללא תוספת סוכר 500 גר` בדצ,יוניליוור ישראל שיווק בעמ,יח`,,1,23.40,4.68
3268,ברנפלקס מהדרין תלמה (500 גרם),יוניליוור ישראל שיווק בעמ,יח`,,1,23.40,4.68
3269,שוגי 500 גר`,יוניליוור ישראל שיווק בעמ,יח`,,1,20.30,4.06
3270,פינוק שמפו בתוספת תמצית תה ירוק וויטמין,יוניליוור ישראל שיווק בעמ,יח`,,1,13.20,1.89
3271,פינוק מרכך בתוספת תמצית תה ירוק וויטמין,יוניליוור ישראל שיווק בעמ,יח`,,1,13.20,1.89
3272,קליק קרם נוגט 38 גר`,יוניליוור ישראל שיווק בעמ,יח`,,1,5.40,14.21
3273,רוטב לעוף שום ועשבי תיבול 310 גר` קנור,יוניליוור ישראל שיווק בעמ,יח`,,1,15.20,4.90
3274,ברנפלקס קרנצ`ים קינמון 375 גר`,יוניליוור ישראל שיווק בעמ,יח`,,1,24.40,6.51
3275,ברנפלקס קרנצ`ים מייפל 375 גר`,יוניליוור ישראל שיווק בעמ,יח`,,1,24.40,6.51
3276,רוטב עגבניות בזיליקום 415 גר קנור,יוניליוור ישראל שיווק בעמ,יח`,,1,14.20,3.42
3277,רוטב פומודורו לפסטה 415 גר` קנור,יוניליוור ישראל שיווק בעמ,יח`,,1,14.20,3.42
3278,שמפו עם קמומיל ואלוורה 700 מל פינוק,יוניליוור ישראל שיווק בעמ,יח`,,1,13.20,1.89
3279,מרכך עם קמומיל ואלוורה 700 מל פינוק,יוניליוור ישראל שיווק בעמ,יח`,,1,13.20,1.89
3280,טבעות שומשום 300 גרם,יוניליוור ישראל שיווק בעמ,יח`,,1,11.50,3.83
3281,קליק קרם חלב 38 גר,יוניליוור ישראל שיווק בעמ,יח`,,1,5.40,14.21
3282,קליק טבלאות עם קורפלקס ופצפוצים 85 גר`,יוניליוור ישראל שיווק בעמ,יח`,,1,6.70,7.88
3283,קליק טבלאות שוקולד לבן קוקוס מקורמל 85 ג,יוניליוור ישראל שיווק בעמ,יח`,,1,6.70,7.88
3284,גלידת שטראוס 2 ליטר כשלפ,גלידות שטראוס בעמ,יח`,,1,27.50,1.38
3285,גלידת פרפה פיסטוק 280 גר` גודיס,גלידות שטראוס בעמ,יח`,,1,19.50,3.75
3286,גלידת קפוצ`ינו 280 גר` גודיס,גלידות שטראוס בעמ,יח`,,1,19.50,3.75
3287,שטראוס קרמיסימו טעם פיסטוק ושוקולד עם,גלידות שטראוס בעמ,יח`,,1,20.50,15.41
3288,פריכונים מאורז מלא אסם (310 גרם),קבוצת אסם סחר שות. מוגבלת,יח`,,1,14.20,4.58
3289,פסטה צינורות מהדרין אסם (500 גרם),קבוצת אסם סחר שות. מוגבלת,יח`,,1,6.10,1.22
3290,חומוס עם חריף צבר (400 גרם),קבוצת אסם סחר שות. מוגבלת,יח`,,1,13.30,3.33
3291,ביסלי חטיף בטעם גריל אסם (55x4 גרם),קבוצת אסם סחר שות. מוגבלת,יח`,,1,13.20,6
3292,במבה בומבה 60 גר.,קבוצת אסם סחר שות. מוגבלת,יח`,,1,4.30,4.30
3293,במבה 50 גר` שישייה אסם,קבוצת אסם סחר שות. מוגבלת,יח`,,1,17.30,5.77
3294,ביסלי ברביקיו מארז 4יח*55גרם,קבוצת אסם סחר שות. מוגבלת,יח`,,1,13.20,6
3295,במבה במילוי נוגט אסם (30x5 גרם),קבוצת אסם סחר שות. מוגבלת,יח`,,1,16.30,10.87
3296,קונפיטורת דובדבן יד מרדכי (340 גרם),שטראוס גרופ בעמ,יח`,,1,16.30,4.79
3297,שוקולד אקסטרא חלב 100 גר` בדצ,שטראוס גרופ בעמ,יח`,,1,8.10,8.10
3298,שוקולד פרה אקסטרא קרם יוגורט תות ועוגיות,שטראוס גרופ בעמ,יח`,,1,8.10,8.10
3299,פריכיות גדולות 3 דגנים אנרג`י,שטראוס גרופ בעמ,יח`,,1,14.20,10.52
3300,עד חצות עיגולים 225 גר`,שטראוס גרופ בעמ,יח`,,1,15.60,6.93
3301,חרדל דיז`ון גרגרים יד מרדכי (350 גרם),שטראוס גרופ בעמ,יח`,,1,13.20,3.77
3302,חרדל דיז`ון חלק 370 גרם,שטראוס גרופ בעמ,יח`,,1,13.20,3.57
3303,רבע לשבע אגוזים בודד 27 גרם,שטראוס גרופ בעמ,יח`,,1,4.30,15.93
3304,צנצנת קוביות ספירמינט גומי לעיסה 58גר,שטראוס גרופ בעמ,יח`,,1,11.20,19.31
3305,צנצנת קוביות פפירמינט גומי לעיסה 58גר,שטראוס גרופ בעמ,יח`,,1,11.20,19.31
3306,צנצנת קוביות בזוקה גומי לעיסה 58גר,שטראוס גרופ בעמ,יח`,,1,11.20,19.31
3307,קפסולות קפה עלית 100% גואטמלה (10),שטראוס גרופ בעמ,יח`,,1,18.30,36.60
3308,דוריטוס טקסס גריל70 גר,שטראוס פריטו ליי בעמ,יח`,,1,4,5.71
3309,דוריטוס שקשוקה 70 גר.,שטראוס פריטו ליי בעמ,יח`,,1,4,5.71
3310,רולדה קפה נמס ווסטהיים 350 גר`,שטראוס גרופ בעמ,יח`,,1,16.90,4.83
3311,רבע לשבע לבן 120 גר,שטראוס גרופ בעמ,יח`,,1,14.20,11.83
3312,אגוזי 45 גר` כשלפ,שטראוס גרופ בעמ,יח`,,1,4.30,4.30
3313,קונפיטורת משמש 340 גר,שטראוס גרופ בעמ,יח`,,1,16.30,4.79
3314,שוקולד פרה אקסטרה חלב עלית (100 גרם),שטראוס גרופ בעמ,יח`,,1,8.10,8.10
3315,פרה אקסטרא וניל ועוגיות שוקו 100 גרם,שטראוס גרופ בעמ,יח`,,1,8.10,8.10
3316,שוקולד פרה אקסטרא קרם יוגורט תות ועוגיות,שטראוס גרופ בעמ,יח`,,1,8.10,8.10
3317,שוקולד פרה אקסטרא צימוקים ואגוזים 100 גר,שטראוס גרופ בעמ,יח`,,1,8.10,8.10
3318,חטיף מקופלת ספלנדיד 23 גר` עלית,שטראוס גרופ בעמ,יח`,,1,4.30,18.70
3319,קונפיטורת שזיף 340 גר,שטראוס גרופ בעמ,יח`,,1,16.30,4.79
3320,שוקלוד פרה במילוי תות 50 גר כשלפ,שטראוס גרופ בעמ,יח`,,1,4.30,4.30
3321,מאסט באבלמינט מגדים 66 גר כשלפ,שטראוס גרופ בעמ,יח`,,1,11.20,16.97
3322,צנצנת קוביות ענבים 58 גר,שטראוס גרופ בעמ,יח`,,1,11.20,19.31
3323,קונפיטורת תאנה אגס 340 גר` יד מרדכי,שטראוס גרופ בעמ,יח`,,1,16.30,4.79
3324,קונפיטורת פירות יער 340 גר יד מרדכי,שטראוס גרופ בעמ,יח`,,1,16.30,4.79
3325,שוקולד חלב במתיקות מעודנת 100 גר` עלית,שטראוס גרופ בעמ,יח`,,1,8.90,8.90
3326,שוקולד אגוזים במתיקות מעודנת 100 גר` עלי,שטראוס גרופ בעמ,יח`,,1,8.90,8.90
3327,שוקולד קוקוס במתיקות מעודנת 100 גר` עלית,שטראוס גרופ בעמ,יח`,,1,8.90,8.90
3328,מאסט לארג אבטיח 80 גר`,שטראוס גרופ בעמ,יח`,,1,15.20,19
3329,מאסט לארג מנטה עדינה 80 גר`,שטראוס גרופ בעמ,יח`,,1,15.20,19
3330,קפסולות קפה עלית אספרסו בטעם קרמל,שטראוס גרופ בעמ,יח`,,1,18.30,36.60
3331,קפסולות אספרסו בטעם אגוזים עלית,שטראוס גרופ בעמ,יח`,,1,18.30,36.60
3332,קפסולות קפה עלית אוגנדה 13 למכונות נספרו,שטראוס גרופ בעמ,יח`,,1,18.30,36.60
3333,קפסולות קפה עלית אידונזיה מס` 12,שטראוס גרופ בעמ,יח`,,1,18.30,36.60
3334,צנצנת עלמה בטעם אוכמניות 66 גר`,שטראוס גרופ בעמ,יח`,,1,11.20,11.20
3335,צנצנת עלמה בטעם ספירמינט 66 גר`,שטראוס גרופ בעמ,יח`,,1,11.20,11.20
3336,רבע לשבע רולס שוקולד 120 גר` עלית,שטראוס גרופ בעמ,יח`,,1,14.20,11.83
3337,רבע לשבע רולס קרם קפה 120 גר` עלית,שטראוס גרופ בעמ,יח`,,1,14.20,11.83
3338,מארז עגבניות קצוצות דק שלישייה מנה מאסט,ש.שסטוביץ בעמ,יח`,,1,18.30,1.53
3339,עלי טורטיה קמח מלא 320 גר` מנה מאסטר שף,ש.שסטוביץ בעמ,יח`,,1,11.20,3.50
3340,עלי טורטיה קמח לבן 320 גר` מנה מאסטר שף,ש.שסטוביץ בעמ,יח`,,1,11.20,3.50
3341,ליידי ספיד סטיק אלוורה 45 גר,ש.שסטוביץ בעמ,יח`,,1,32.60,72.44
3342,ספיד סטיק כח הטבע אולנג ג`ל,ש.שסטוביץ בעמ,יח`,,1,18.30,28.15
3343,מנה רוטב סויה תסיסה טבעית 620 גר,ש.שסטוביץ בעמ,יח`,,1,21.40,3.45
3344,מנה רוטב סויה דל נתרן 620 גר,ש.שסטוביץ בעמ,יח`,,1,21.40,3.45
3345,פלמוליב סבון לומינוס אבוקדו 500 מל,ש.שסטוביץ בעמ,יח`,,1,21.40,4.28
3346,פלמוליב סבון לומינוס מקדמיה 500 מל,ש.שסטוביץ בעמ,יח`,,1,21.40,4.28
3347,מאסטר שף איטריות דקיקות 400 גר,ש.שסטוביץ בעמ,יח`,,1,7.10,1.78
3348,מאסטר שף איטריות דקות 400 גר,ש.שסטוביץ בעמ,יח`,,1,7.10,1.78
3349,מאסטר שף איטריות בינוניות 400 גר,ש.שסטוביץ בעמ,יח`,,1,7.10,1.78
3350,קראנצוס גריל 70 גר`,ש.שסטוביץ בעמ,יח`,,1,4,5.71
3351,קראנצוס פלאפל 70 גר`,ש.שסטוביץ בעמ,יח`,,1,4,5.71
3352,וניש גולד אבקה 1.35 קג ורוד,רקיט בנקיזר (ניר איסט) בעמ,יח`,,1,36.70,2.72
3353,וניש גולד אבקה 1.35 קג לבן,רקיט בנקיזר (ניר איסט) בעמ,יח`,,1,36.70,2.72
3354,וניש גולד אבקה 470גר` ורוד,רקיט בנקיזר (ניר איסט) בעמ,יח`,,1,21.40,4.55
3355,וניש גולד אבקה 470 גר` לבן,רקיט בנקיזר (ניר איסט) בעמ,יח`,,1,21.40,4.55
3356,אירוויק מקלות לבנדר,רקיט בנקיזר (ניר איסט) בעמ,יח`,,1,27.50,91.67
3357,קולון 101 אבקה 2.5 קג,רקיט בנקיזר (ניר איסט) בעמ,יח`,,1,26.50,26.50
3358,ג`ל להסרת כתמים גולד וניש קליה (2 ליטר),רקיט בנקיזר (ניר איסט) בעמ,יח`,,1,26.50,13.25
3359,וניש אבקה 1620 גר` ורוד,רקיט בנקיזר (ניר איסט) בעמ,יח`,,1,31.60,1.95
3360,דטול ספריי חיטוי בניוח כביסה 400,רקיט בנקיזר (ניר איסט) בעמ,יח`,,1,25.90,6.48
3361,וולייט ג`ל כביסה גולד 1.5 ליטר,רקיט בנקיזר (ניר איסט) בעמ,יח`,,1,21.40,1426.67
3362,וניש אבקה 1620 גר` לבן,רקיט בנקיזר (ניר איסט) בעמ,יח`,,1,31.60,1.95
3363,דטול ספריי חיטוי בניחוח פריחה 400,רקיט בנקיזר (ניר איסט) בעמ,יח`,,1,25.90,6.48
3364,וולייט ג`ל לכביסה עדינה 1.5 ליטר,רקיט בנקיזר (ניר איסט) בעמ,יח`,,1,21.40,1426.67
3365,דטול ספריי חיטוי בניחוח אביבי 400,רקיט בנקיזר (ניר איסט) בעמ,יח`,,1,25.90,6.48
3366,כרית קרצוף עם ספוג מקציף סנו סושי (6),החברה הדרומית לשיווק בעמ,יח`,,1,12.20,12.20
3367,סנובון מוצק דאבל אקשן בניחוח תפוז,החברה הדרומית לשיווק בעמ,יח`,,1,21.40,21.40
3368,סנו מקסימה מרכך 1 ליטר blue blossom,החברה הדרומית לשיווק בעמ,יח`,,1,19.30,1.93
3369,מקסימה מרכך כביסה סופט סילק סנו (1 ליטר),החברה הדרומית לשיווק בעמ,יח`,,1,19.30,1.93
3370,כיף פיות קרם להתרת קשרים 350מל,החברה הדרומית לשיווק בעמ,יח`,,1,21.40,6.11
3371,תרסיס מתיר קשרים לילדים כיף (350 מל),החברה הדרומית לשיווק בעמ,יח`,,1,21.40,6.11
3372,כיף בוב ספוג קרם להתרת קשרים 350מל,החברה הדרומית לשיווק בעמ,יח`,,1,21.40,6.11
3373,פורטה 750 מל free,החברה הדרומית לשיווק בעמ,יח`,,1,18.30,2.44
3374,סנובון שלישיה מוצק WAVE בניחוח אורנים,החברה הדרומית לשיווק בעמ,יח`,,1,18.30,18.30
3375,סנובון שלישיה מוצק WAVE בניחוח פרחים ור,החברה הדרומית לשיווק בעמ,יח`,,1,18.30,18.30
3376,סנובון שלישיה מוצק WAVE בניחוח למון מרענ,החברה הדרומית לשיווק בעמ,יח`,,1,18.30,18.30
3377,ג`ל מרוכז 500 מל פורטה פלוס,החברה הדרומית לשיווק בעמ,יח`,,1,15.20,3.04
3378,מרכך כביסה מקסימה Soft Silk,החברה הדרומית לשיווק בעמ,יח`,,1,22.40,5.60
3379,מרכך כביסה מקסימה 4 ליטר Blue Dlosson,החברה הדרומית לשיווק בעמ,יח`,,1,22.40,5.60
3380,מרכך לילדים מיניונים נקה 7 (750 מל),החברה הדרומית לשיווק בעמ,יח`,,1,16.30,2.17
3381,שמפו/מרכך מיניונים נקה 7 - קידס,החברה הדרומית לשיווק בעמ,יח`,,1,16.30,2.17
3382,אל סבון מיניונים נקה 7 - קידס,החברה הדרומית לשיווק בעמ,יח`,,1,16.30,2.17
3383,בייבי כיף אלסבון לפני השינה 750 מל,החברה הדרומית לשיווק בעמ,יח`,,1,25.90,3.45
3384,בייבי כיף קרם גוף לפני השינה 500 מל,החברה הדרומית לשיווק בעמ,יח`,,1,25.90,5.18
3385,נקה 7 שמפו שמני הזנה 750 מל,החברה הדרומית לשיווק בעמ,יח`,,1,14.20,1.89
3386,נקה 7 מרכך שמני הזנה 750 מל,החברה הדרומית לשיווק בעמ,יח`,,1,14.20,1.89
3387,תחליב רחצה כיף ניחוח שקד 700 מל,החברה הדרומית לשיווק בעמ,יח`,,1,13.50,1.93
3388,תחליב רחצה כיף ניחוח דבש 700 מל,החברה הדרומית לשיווק בעמ,יח`,,1,13.50,1.93
3389,תחליב רחצה כיף ניחוח קוקוס וניל 700 מל,החברה הדרומית לשיווק בעמ,יח`,,1,13.50,1.93
3390,תחליב רחצה כיף ניחוח לבנדר 700 מל,החברה הדרומית לשיווק בעמ,יח`,,1,13.50,1.93
3391,תחליב רחצה כיף ניחוח מאסק יסמין 700 מל,החברה הדרומית לשיווק בעמ,יח`,,1,13.50,1.93
3392,תחליב רחצה כיף ניחוח אוקיינס 700 מל,החברה הדרומית לשיווק בעמ,יח`,,1,13.50,1.93
3393,כיף שמפו לשיער רגיל תפוח זרעי צ`יה 700,החברה הדרומית לשיווק בעמ,יח`,,1,13.90,1.99
3394,כיף שמפו לשיער רגיל יבש רימונים ושמן ארג,החברה הדרומית לשיווק בעמ,יח`,,1,13.90,1.99
3395,כיף שמפו לשיער דק ושביר 700,החברה הדרומית לשיווק בעמ,יח`,,1,13.90,1.99
3396,כיף שמפו ומרכך 2+1 תאנה ומנטה 700,החברה הדרומית לשיווק בעמ,יח`,,1,13.90,1.99
3397,כיף שמפו לשיער מעוצב קרטין וחמאת שיאה 70,החברה הדרומית לשיווק בעמ,יח`,,1,13.90,1.99
3398,כיף מרכך לשיער רגיל תפוח זרעי צ`יה 700,החברה הדרומית לשיווק בעמ,יח`,,1,13.90,1.99
3399,כיף מרכך לשיער רגיל יבש רימונים ושמן ארג,החברה הדרומית לשיווק בעמ,יח`,,1,13.90,1.99
3400,כיף מרכך לשיער דק ושביר 700,החברה הדרומית לשיווק בעמ,יח`,,1,13.90,1.99
3401,כיף מרכך לשיער מעוצב קרטין וחמאת שיאה 70,החברה הדרומית לשיווק בעמ,יח`,,1,13.90,1.99
3402,בייבי קרם גוף כיף (500 מל),החברה הדרומית לשיווק בעמ,יח`,,1,25.90,5.18
3403,בייבי שמן לתינוק לעור עדין כיף (500 מל),החברה הדרומית לשיווק בעמ,יח`,,1,25.90,5.18
3404,בייבי כיף שמפו אל דמע (1 ליטר),החברה הדרומית לשיווק בעמ,יח`,,1,23.90,23.90
3405,בייבי כיף אלסבון 1 ליטר,החברה הדרומית לשיווק בעמ,יח`,,1,23.90,23.90
3406,גבינת גאודה מגורדת 500 גר` 28% שומן הולנ,ג.וילי-פוד אינטרנשיונל בעמ,יח`,,1,28.50,5.70
3407,גבינת מוצרלה פרוסות 150 גר` וילי פוד,ג.וילי-פוד אינטרנשיונל בעמ,יח`,,1,16.30,10.87
3408,גבינת חלומי 200 גר` SAY CHEESE וילי פוד,ג.וילי-פוד אינטרנשיונל בעמ,יח`,,1,26.50,13.25
3409,ממרח חמאה 250 גר` ללא מלח Euro spread ו,ג.וילי-פוד אינטרנשיונל בעמ,יח`,,1,12.90,5.16
3410,ממרח חמאה 250 גר` במליחות עדינה Euro spr,ג.וילי-פוד אינטרנשיונל בעמ,יח`,,1,12.90,5.16
3411,ממרח חמאה 250 גר` לייט לא מלח Euro sprea,ג.וילי-פוד אינטרנשיונל בעמ,יח`,,1,12.90,5.16
3412,ממרח חמאה 250 גר` לייט במליחות עדינה Eur,ג.וילי-פוד אינטרנשיונל בעמ,יח`,,1,12.90,5.16
3413,מאפה יוני במילוי קרם בטעם וניל 400 גר` ו,ג.וילי-פוד אינטרנשיונל בעמ,יח`,,1,20.90,5.23
3414,מאפה יוני במילוי גבינת פטה 400 גר` וילי,ג.וילי-פוד אינטרנשיונל בעמ,יח`,,1,20.90,5.23
3415,מאפה יוני במילוי תרד וגבינת פטה 400 גר`,ג.וילי-פוד אינטרנשיונל בעמ,יח`,,1,20.90,5.23
3416,חטיף שקדים וצימוקים HAPPY NUTS וילי פוד,ג.וילי-פוד אינטרנשיונל בעמ,יח`,,1,15.90,11.36
3417,חטיף שקדים וחמוציות HAPPY NUTS וילי פוד,ג.וילי-פוד אינטרנשיונל בעמ,יח`,,1,15.90,11.36
3418,גבינת עיזים רכה בציפוי תפוזים 29% שומן (,ג.וילי-פוד אינטרנשיונל בעמ,יח`,,1,15.90,14.45
3419,גבינת עיזים רכה בציפוי צ`לי 29% שומן (11,ג.וילי-פוד אינטרנשיונל בעמ,יח`,,1,15.90,14.45
3420,4 יח תחתיות לפיצה וילי פוד,ג.וילי-פוד אינטרנשיונל בעמ,יח`,,1,14.90,3.10
3421,גבינת שמנת טבעי 200 גר` EURO CHEESE,ג.וילי-פוד אינטרנשיונל בעמ,יח`,,1,13.90,6.95
3422,גבינת שמנת לייט טבעי 200 גר` EURO CHEESE,ג.וילי-פוד אינטרנשיונל בעמ,יח`,,1,13.90,6.95
3423,גבינת שמנת עשבי תיבול 200 גר` EURO CHEES,ג.וילי-פוד אינטרנשיונל בעמ,יח`,,1,13.90,6.95
3424,גבינת שמנת לייט עשבי תיבול 200 גר` EURO,ג.וילי-פוד אינטרנשיונל בעמ,יח`,,1,13.90,6.95
3425,גבינת שמנת שום 200 גר` EURO CHEESE,ג.וילי-פוד אינטרנשיונל בעמ,יח`,,1,13.90,6.95
3426,גבינת שמנת לייט שום 200 גר` EURO CHEESE,ג.וילי-פוד אינטרנשיונל בעמ,יח`,,1,13.90,6.95
3427,גבינת גאודה פרוסות 400 גר` וילי פוד,ג.וילי-פוד אינטרנשיונל בעמ,יח`,,1,20.90,5.23
3428,מלפפונים כבושים במלח 18-25 קטנים מאוד (8,ג.וילי-פוד אינטרנשיונל בעמ,יח`,,1,15.90,1.99
3429,פסטו בזיליקום 190 גר` וילי פוד,ג.וילי-פוד אינטרנשיונל בעמ,יח`,,1,10.90,5.74
3430,רוטב עגבניות עם זיתים וצלפים 400 גר` ויל,ג.וילי-פוד אינטרנשיונל בעמ,יח`,,1,10.90,2.73
3431,רוטב עגבניות עם פטריות פורצ`יני 400 גר`,ג.וילי-פוד אינטרנשיונל בעמ,יח`,,1,10.90,2.73
3432,רוטב עגבניות עם חצילים 400 גר`,ג.וילי-פוד אינטרנשיונל בעמ,יח`,,1,10.90,2.73
3433,רוטב עגבניות פיקנטי 400 גר` וילי פוד,ג.וילי-פוד אינטרנשיונל בעמ,יח`,,1,10.90,2.73
3434,מארז תפוחונים (3 יח +1 ),ג.וילי-פוד אינטרנשיונל בעמ,יח`,,1,13.90,13.90
3435,מדליוני גבינת עיזים 6 יח *20 גר` ( 120 ג,ג.וילי-פוד אינטרנשיונל בעמ,יח`,,1,15.90,13.25
3436,צנימים טעם טבעי 100 גר` melba toast,ג.וילי-פוד אינטרנשיונל בעמ,יח`,,1,8.90,8.90
3437,לזנה איטלקית 500 גר` (וילי פוד),ג.וילי-פוד אינטרנשיונל בעמ,יח`,,1,11.50,2.30
3438,צנימים עם שומשום 100 גר` melba toast,ג.וילי-פוד אינטרנשיונל בעמ,יח`,,1,8.90,8.90
3439,ממרח חמאה 250 גר` valio,ג.וילי-פוד אינטרנשיונל בעמ,יח`,,1,17.90,7.16
3440,ממרח חמאה 250 גר` לייט VALIO,ג.וילי-פוד אינטרנשיונל בעמ,יח`,,1,17.90,7.16
3441,פיצה מרגריטה 380 גר` וילי פוד,ג.וילי-פוד אינטרנשיונל בעמ,יח`,,1,14.90,3.92
3442,פיצה עם פטריות 390 גר` וילי פוד,ג.וילי-פוד אינטרנשיונל בעמ,יח`,,1,14.90,3.82
3443,פיצה עם זיתים 385 גר` וילי פוד,ג.וילי-פוד אינטרנשיונל בעמ,יח`,,1,14.90,3.87
3444,כדורי בייבי גבינת מוצרלה 200 גר` וילי פו,ג.וילי-פוד אינטרנשיונל בעמ,יח`,,1,20.90,10.45
3445,משקה יוגורט אפרסק 500 מל וילי פוד 0.1%,ג.וילי-פוד אינטרנשיונל בעמ,יח`,,1,10.90,10.90
3446,משקה יוגורט תות 500 מל וילי פוד 0.1%,ג.וילי-פוד אינטרנשיונל בעמ,יח`,,1,10.90,10.90
3447,משקה יוגורט תות ודודבן 500 מל וילי פוד,ג.וילי-פוד אינטרנשיונל בעמ,יח`,,1,10.90,10.90
3448,משקה יוגורט אוכמניות וסמבוק 500 מל וילי,ג.וילי-פוד אינטרנשיונל בעמ,יח`,,1,10.90,10.90
3449,גבינת שמנת עם זיתים 200 גר` EURO CHEESE,ג.וילי-פוד אינטרנשיונל בעמ,יח`,,1,13.90,6.95
3450,גבינת שמנת עם חלפיניו 200 גר` EURO CHEES,ג.וילי-פוד אינטרנשיונל בעמ,יח`,,1,13.90,6.95
3451,גבינת שמנת לייט עם זיתים 200 גר` EURO CH,ג.וילי-פוד אינטרנשיונל בעמ,יח`,,1,13.90,6.95
3452,גבינת שמנת לייט עם חלפיניו 200 גר` EURO,ג.וילי-פוד אינטרנשיונל בעמ,יח`,,1,13.90,6.95
3453,גבינת פטה 200 גר` טבעונית,ג.וילי-פוד אינטרנשיונל בעמ,יח`,,1,18.90,9.45
3454,גבינה טבעונית קוביות פטה במי מלח 200 גר,ג.וילי-פוד אינטרנשיונל בעמ,יח`,,1,18.90,9.45
3455,גבינה גוש מוצרלה 200 גר` טבעונית,ג.וילי-פוד אינטרנשיונל בעמ,יח`,,1,18.90,9.45
3456,גבינה פרוסות מוצרלה 200 גר` טבעונית,ג.וילי-פוד אינטרנשיונל בעמ,יח`,,1,18.90,9.45
3457,גבינה גוש גאודה 200 גר` טבעונית,ג.וילי-פוד אינטרנשיונל בעמ,יח`,,1,18.90,9.45
3458,גבינה פרוסות גאודה 200 גר` טבעונית,ג.וילי-פוד אינטרנשיונל בעמ,יח`,,1,18.90,9.45
3459,גבינה גוש גאודה מעושנת 200 גר` ולי פוד,ג.וילי-פוד אינטרנשיונל בעמ,יח`,,1,18.90,9.45
3460,גבינה גוש מוצרלה לפיצה 200 גר` טבעונית,ג.וילי-פוד אינטרנשיונל בעמ,יח`,,1,18.90,9.45
3461,גבינה גוש צ`דר כתום 200 גר`,ג.וילי-פוד אינטרנשיונל בעמ,יח`,,1,18.90,9.45
