,ItemName,ManufactureName,UnitQty,Quantity,QtyInPackage,ItemPrice,UnitOfMeasurePrice
928,מדליוני תרד סנפרוסט (800 גרם),תנובה קפואים,יח`,,1,26,3.25
929,שעועית לבנה מבושלת סנפרוסט (800 גרם),תנובה קפואים,יח`,,1,19.90,2.49
930,גרגרי חומוס מבושלים סנפרוסט (800 גרם),תנובה קפואים,יח`,,1,19.90,2.49
931,קלחוני תירס 1 קג סנפרוסט,תנובה קפואים,יח`,,1,21,21
932,לקט אפונה וגזר מוקפאים סנפרוסט (800 גרם),תנובה קפואים,יח`,,1,16.90,2.11
933,לקט נורמנדי מוקפא סנפרוסט (800 גרם),תנובה קפואים,יח`,,1,16.90,2.11
934,תחתיות ארטישוק סנפרוסט (400 גרם),תנובה קפואים,יח`,,1,22.90,5.73
935,ברוקולי סנפרוסט (800 גרם),תנובה קפואים,יח`,,1,24.90,3.11
936,כיפלי 70 גר` גריל,יוניליוור ישראל שיווק בעמ,יח`,,1,5.90,8.43
937,כיפלי חטיף בטעם בצל מהדרין תלמה (70 גרם),יוניליוור ישראל שיווק בעמ,יח`,,1,5.90,8.43
938,מרק עוף אמיתי בשרי קנור (400 גרם),יוניליוור ישראל שיווק בעמ,יח`,,1,25.90,6.48
939,כיפלי צ`יפסים מהדרין תלמה (50 גרם),יוניליוור ישראל שיווק בעמ,יח`,,1,5.90,11.80
940,כיפלי צ`יפסים קטשופ תלמה (50 גרם),יוניליוור ישראל שיווק בעמ,יח`,,1,5.90,11.80
941,ניקוי כללי אורנים פנטסטיק סיף (4 ליטר),יוניליוור ישראל שיווק בעמ,יח`,,1,24.90,0.62
942,מרק דגש זך טעם עוף קנור (1 קג),יוניליוור ישראל שיווק בעמ,יח`,,1,17.90,1.79
943,רוטב ברביקיו קנור (300 מל),יוניליוור ישראל שיווק בעמ,יח`,,1,12.90,6.45
944,רוטב צ`ילי מתוק קנור (300 מל),יוניליוור ישראל שיווק בעמ,יח`,,1,12.90,3.79
945,מיונז אמיתי הלמנס (394 גרם),יוניליוור ישראל שיווק בעמ,יח`,,1,12.90,2.98
946,מיונז לייט הלמנס (424 גרם),יוניליוור ישראל שיווק בעמ,יח`,,1,12.90,2.71
947,גבינה חתול 120ג,נטו מלינדה סחר בעמ,יח`,,1,10.90,9.08
948,מון בלאן שויצרית,נטו מלינדה סחר בעמ,יח`,,1,11.60,9.67
949,מון בלאן זיתים,נטו מלינדה סחר בעמ,יח`,,1,12.60,10.50
950,מון בלאן סלמון,נטו מלינדה סחר בעמ,יח`,,1,13.90,11.58
951,פתית בצל תלמה (250 גרם),יוניליוור ישראל שיווק בעמ,יח`,,1,17.90,7.16
952,רוטב סצ`ואן קנור (300 מל),יוניליוור ישראל שיווק בעמ,יח`,,1,12.90,4.30
953,שוקולד מריר פרווה ורד הגליל (100x6 גרם),יוניליוור ישראל שיווק בעמ,יח`,,1,22.90,3.82
954,תיבולית עישבי תיבול קנור,יוניליוור ישראל שיווק בעמ,יח`,,1,9.90,13.75
955,מש.שיניים אורביטול שלישיה,החברה הדרומית לשיווק בעמ,יח`,,1,19.90,4.57
956,סנו דואופרש מבושם,החברה הדרומית לשיווק בעמ,יח`,,1,13.90,4.63
957,קינמון טחון 50 גר`,תבליני טעם וריח בעמ,יח`,,1,5.90,11.80
958,עלי דפנה 20 גר`,תבליני טעם וריח בעמ,יח`,,1,5.90,29.50
959,משקה אנרגיה תפוח אקסל (250 מל)TNX,טמפו משקאות בעמ,יח`,,1,4.50,1.68
960,משקה אנרגיה מנגו אקסל (250 מל) TEN,טמפו משקאות בעמ,יח`,,1,4.50,1.68
961,משקה אנרגיה אקסל נענע ליים (250 מל),טמפו משקאות בעמ,יח`,,1,4.50,1.68
962,סודה אפרסק 1.5 ליטר רביעייה נגיעות,טמפו משקאות בעמ,יח`,,1,10.90,10.90
963,משקה קל דיאט תפוזים ג`אמפ (1.5 ליטר),טמפו משקאות בעמ,יח`,,1,5.50,0.37
964,משקה קל תפוזים ג`אמפ (1.5 ליטר),טמפו משקאות בעמ,יח`,,1,5.50,0.37
965,משקה קל אשכוליות ג`אמפ (1.5 ליטר),טמפו משקאות בעמ,יח`,,1,5.50,0.37
966,משקה קל תות בננה ג`אמפ (1.5 ליטר),טמפו משקאות בעמ,יח`,,1,5.50,0.37
967,קרמיסימו גלידונית 60 יח`,גלידות שטראוס בעמ,יח`,,1,47.90,6.84
968,מאגדת-טעמקור 8 יח`,גלידות שטראוס בעמ,יח`,,1,37.90,37.90
969,שמן זית כתית מעולה 750 מל עץ הזית,שמן תעשיות בעמ,יח`,,1,34.90,4.65
970,משחת שיניים טום וג`רי 60 גר`,הנקל סוד בעמ,יח`,,1,8.90,14.83
971,משחת שיניים לילדים טום וג`רי (50 מל),הנקל סוד בעמ,יח`,,1,8.90,14.83
972,קשיו מטוגן שקית 200 גר,ליימן שליסל בעמ,יח`,,1,19.90,9.95
973,גרעיני חמניה 200 גר`,ליימן שליסל בעמ,יח`,,1,6.90,3.45
974,סבון מוצק לתינוק נקה 7 (100x4 גרם),החברה הדרומית לשיווק בעמ,יח`,,1,11.90,2.98
975,שניצל ביתי עם שומשום קופצני 700 גר` עוף,קבוצת אסם סחר שות. מוגבלת,יח`,,1,43.90,6.27
976,שניצל עוף מיני דיזוזאור 700 גר` עוף טוב,קבוצת אסם סחר שות. מוגבלת,יח`,,1,34.90,4.99
977,שניצל עוף דקיק ענקיסטי 700 עוף טוב,קבוצת אסם סחר שות. מוגבלת,יח`,,1,35.90,5.13
978,שניצל עוף דקיק עם צ`יפס שמח 700 גר` עוף,קבוצת אסם סחר שות. מוגבלת,יח`,,1,35.90,5.13
979,שניצל ביתי עדין כזה 700 גר` עוף טוב,קבוצת אסם סחר שות. מוגבלת,יח`,,1,43.90,6.27
980,שניצל עוף מיני דובונים 700 גר` עוף טוב,קבוצת אסם סחר שות. מוגבלת,יח`,,1,35.90,5.13
981,שניצל עוף ביתי קריספי 700 גר` עוף טוב,קבוצת אסם סחר שות. מוגבלת,יח`,,1,43.90,6.27
982,חזה עוף בתיבול 500 גר` BBQ עוף טוב,קבוצת אסם סחר שות. מוגבלת,יח`,,1,39.90,7.98
983,קליק בארים אין אאוט נוגט,יוניליוור ישראל שיווק בעמ,יח`,,1,4.90,12.89
984,קליק בארים אין אאוט קרם חלבי,יוניליוור ישראל שיווק בעמ,יח`,,1,4.90,12.89
985,רוטב לסלט חרדל ודבש לייט הלמנס (305 גרם),יוניליוור ישראל שיווק בעמ,יח`,,1,12.90,4.23
986,בדין אקסטרא 960 מרוכז בייבי בדין,יוניליוור ישראל שיווק בעמ,יח`,,1,16.90,1.76
987,מרכך מרכך לטיפול בשמני הזנה 400מל,יוניליוור ישראל שיווק בעמ,יח`,,1,15.90,3.98
988,קרם קרקר 210 גר`,יוניליוור ישראל שיווק בעמ,יח`,,1,8.90,4.24
989,פינוק תחליב רחצה ילדים 700 מל קמומיל,יוניליוור ישראל שיווק בעמ,יח`,,1,12.90,1.84
990,פינוק שמפו שמן אבוקדו 700 מל,יוניליוור ישראל שיווק בעמ,יח`,,1,12.90,1.84
991,פינוק מרכך שמן אבוקדו (700  מל),יוניליוור ישראל שיווק בעמ,יח`,,1,12.90,1.84
992,סיף פנטסטיק 4 ליטר כללי יסמין,יוניליוור ישראל שיווק בעמ,יח`,,1,24.90,0.62
993,ברנפלקס קרנצ`ים 375 גר` בדצ,יוניליוור ישראל שיווק בעמ,יח`,,1,22.90,6.11
994,שמפו מועשר בשמן מרוקאי פינוק (700 מל),יוניליוור ישראל שיווק בעמ,יח`,,1,12.90,1.84
995,מרכך מועשר בשמן מרוקאי פינוק (700 מל),יוניליוור ישראל שיווק בעמ,יח`,,1,12.90,1.84
996,פינוק תחליב רחצה 700 מל,יוניליוור ישראל שיווק בעמ,יח`,,1,12.90,1.84
997,רוטב קנור סויה בסגנון סיני,יוניליוור ישראל שיווק בעמ,יח`,,1,12.90,4.30
998,עוגי מופחת סוכר 500גר,יוניליוור ישראל שיווק בעמ,יח`,,1,18.90,3.78
999,שוקולד פרה חלב עלית (100 גרם),שטראוס גרופ בעמ,יח`,,1,4.90,4.90
1000,שוקולד פרה מריר פרווה עלית (100 גרם),שטראוס גרופ בעמ,יח`,,1,4.90,4.90
1001,טבלאות פרה במילוי קרם נוגט,שטראוס גרופ בעמ,יח`,,1,4.90,4.90
1002,חטיף כיף כף עלית (45 גרם),שטראוס גרופ בעמ,יח`,,1,3.90,8.67
1003,שוקולד פרה לבן עלית (100 גרם),שטראוס גרופ בעמ,יח`,,1,4.90,4.90
1004,חטיף צ`יפס בטעם טבעי תפוצ`יפס (200 גרם),שטראוס פריטו ליי בעמ,יח`,,1,10.90,5.45
1005,שוקולד פרה מריר עם אגוזים עלית (100 גרם),שטראוס גרופ בעמ,יח`,,1,4.90,4.90
1006,ביסקוויט עד חצות חלבי 200 גר`,שטראוס גרופ בעמ,יח`,,1,13.90,6.95
1007,כריות קרצוף חתוכות ניקול (12),קימברלי קלארק ישראל שיווק בעמ,יח`,,1,10.90,10.90
1008,ממחטות אולטרה סופט קלינקס (80x2),קימברלי קלארק ישראל שיווק בעמ,יח`,,1,19.90,5.10
1009,מגבת נייר ניקול (6),קימברלי קלארק ישראל שיווק בעמ,יח`,,1,11.90,11.90
1010,מגבונים לחים בבישום עדין טיטולים (72x4),קימברלי קלארק ישראל שיווק בעמ,יח`,,1,19.90,19.90
1011,ניקול תבניות מלבנית חזקה ועבה,קימברלי קלארק ישראל שיווק בעמ,יח`,,1,9.90,9.90
1012,אשפתון 40,קימברלי קלארק ישראל שיווק בעמ,יח`,,1,20.90,0.52
1013,מטליות לחות לניקוי כללי ניקול (50),קימברלי קלארק ישראל שיווק בעמ,יח`,,1,11.90,11.90
1014,מטליות לחות לניקוי רצפה ניקול (10),קימברלי קלארק ישראל שיווק בעמ,יח`,,1,13.90,13.90
1015,מפיות אירוח לילי סטייל ניקול (20),קימברלי קלארק ישראל שיווק בעמ,יח`,,1,8.90,8.73
1016,מטליות לניקוי וחיטוי ניקול,קימברלי קלארק ישראל שיווק בעמ,יח`,,1,11.90,11.90
1017,מפיות מודפסות ניקול (85x2),קימברלי קלארק ישראל שיווק בעמ,יח`,,1,12.90,12.90
1018,ממחטות אף קלינקס (90x3),קימברלי קלארק ישראל שיווק בעמ,יח`,,1,10.90,10.90
1019,מגן תחתון לילי (50),קימברלי קלארק ישראל שיווק בעמ,יח`,,1,10.90,10.90
1020,תחבושות נובה-לי לילי (28),קימברלי קלארק ישראל שיווק בעמ,יח`,,1,10.90,10.90
1021,תח` לילי נטורל לילה,קימברלי קלארק ישראל שיווק בעמ,יח`,,1,18.90,18.90
1022,מגן תחתון נטורל נורמל לילי (60),קימברלי קלארק ישראל שיווק בעמ,יח`,,1,18.90,18.90
1023,מגן תחתון נטורל לונג לילי (52),קימברלי קלארק ישראל שיווק בעמ,יח`,,1,18.90,18.90
1024,מגן תחתון נטורל לייט לילי (62),קימברלי קלארק ישראל שיווק בעמ,יח`,,1,18.90,18.90
1025,תחבושות נורמל עם כנפיים לילי (24),קימברלי קלארק ישראל שיווק בעמ,יח`,,1,17.90,17.90
1026,תחבושות נטורל סופר עם כנפיים לילי (24),קימברלי קלארק ישראל שיווק בעמ,יח`,,1,17.90,17.90
1027,תחבושות לילי נטו,קימברלי קלארק ישראל שיווק בעמ,יח`,,1,17.90,17.90
1028,שקיות מזון גדולות עם ידית ניקול (200),קימברלי קלארק ישראל שיווק בעמ,יח`,,1,13.90,13.90
1029,מגבוני האגיס רביעייה ללא בישום,קימברלי קלארק ישראל שיווק בעמ,יח`,,1,19.90,19.90
1030,מגבונים לחים מבושמים האגיס (72x4),קימברלי קלארק ישראל שיווק בעמ,יח`,,1,19.90,19.90
1031,מגבוני האגיס רביעייה,קימברלי קלארק ישראל שיווק בעמ,יח`,,1,19.90,19.90
1032,מפת שולחן 110*180 סמ ניקול (2),קימברלי קלארק ישראל שיווק בעמ,יח`,,1,11.90,4.76
1033,ניילונית 150 מ,קימברלי קלארק ישראל שיווק בעמ,יח`,,1,36.90,0.25
1034,ניקול-רדיד אלומיניום זוג 45,קימברלי קלארק ישראל שיווק בעמ,יח`,,1,19.90,19.90
1035,חיתולי פרידום דריי שלב 3 האגיס (52),קימברלי קלארק ישראל שיווק בעמ,יח`,,1,39.90,39.90
1036,חיתולי פרידום דריי שלב 4 האגיס (44),קימברלי קלארק ישראל שיווק בעמ,יח`,,1,39.90,39.90
1037,חיתולי פרידום דריי שלב +4 האגיס (40),קימברלי קלארק ישראל שיווק בעמ,יח`,,1,39.90,39.90
1038,חיתולי פרידום דריי שלב 5 האגיס (36),קימברלי קלארק ישראל שיווק בעמ,יח`,,1,39.90,39.90
1039,חיתולי פרידום דריי שלב 6 האגיס (30),קימברלי קלארק ישראל שיווק בעמ,יח`,,1,39.90,39.90
1040,תחבושות קוטקס יאנג,קימברלי קלארק ישראל שיווק בעמ,יח`,,1,19.90,19.90
1041,טיטולי פרימיום שלב 2 (52יח),קימברלי קלארק ישראל שיווק בעמ,יח`,,1,39.90,39.90
1042,חיתולי פרימיום שלב 3 טיטולים (50),קימברלי קלארק ישראל שיווק בעמ,יח`,,1,39.90,39.90
1043,חיתולי פרימיום שלב 4 טיטולים (40),קימברלי קלארק ישראל שיווק בעמ,יח`,,1,39.90,39.90
1044,חיתולי פרימיום שלב 4+ טיטולים (38),קימברלי קלארק ישראל שיווק בעמ,יח`,,1,39.90,39.90
1045,חיתולי פרימיום שלב 5 טיטולים (34),קימברלי קלארק ישראל שיווק בעמ,יח`,,1,39.90,39.90
1046,חיתולי פרימיום שלב 6 טיטולים (30),קימברלי קלארק ישראל שיווק בעמ,יח`,,1,39.90,39.90
1047,כריות קרצוף סקוטש ניקול (3),קימברלי קלארק ישראל שיווק בעמ,יח`,,1,11.90,3.97
1048,כרית יפנית רביעייה ניקול,קימברלי קלארק ישראל שיווק בעמ,יח`,,1,11.90,2.98
1049,כריות יפניות ניקול (6),קימברלי קלארק ישראל שיווק בעמ,יח`,,1,11.90,1.98
1050,ניקול מטליות רצפה רביעיה,קימברלי קלארק ישראל שיווק בעמ,יח`,,1,12.90,3.23
1051,מטליות רב שימושיות לניקיון ניקול (9),קימברלי קלארק ישראל שיווק בעמ,יח`,,1,11.90,1.32
1052,מטליות לחות לרצפה בריח לימון 10 יח,קימברלי קלארק ישראל שיווק בעמ,יח`,,1,13.90,13.90
1053,ספוגית הקסם המקורית ניקול (6),קימברלי קלארק ישראל שיווק בעמ,יח`,,1,10.90,1.82
1054,פסגה לרצפה 2 ליטר,החברה הדרומית לשיווק בעמ,יח`,,1,11.90,5.95
1055,האגיס חיתולי אקסטרה קר 3 48 יח,קימברלי קלארק ישראל שיווק בעמ,יח`,,1,44.90,44.90
1056,האגיס חיתולי אקסטרה קר 40 יח,קימברלי קלארק ישראל שיווק בעמ,יח`,,1,44.90,44.90
1057,רוטב עגבניות 22% יכין (100 גרם),זנלכל בעמ,יח`,,1,1.90,1.90
1058,עגב` קוביות,זנלכל בעמ,יח`,,1,6.90,0.86
1059,עגבניות מרוסקות יכין (800 גרם),זנלכל בעמ,יח`,,1,6.90,0.86
1060,סירופ דיאט בטעם ענבים יכין (1 ליטר),זנלכל בעמ,יח`,,1,7.90,0.79
1061,גרעיני תירס מתוק יכין (550 גרם),זנלכל בעמ,יח`,,1,5.90,1.07
1062,רוטב עגבניות 22% יכין (260 גרם),זנלכל בעמ,יח`,,1,3.50,1.35
1063,עגבניות מרוסקות עם שום יכין (800 גרם),זנלכל בעמ,יח`,,1,6.90,0.86
1064,עגבניות מרוסקות עם בצל יכין (800 גרם),זנלכל בעמ,יח`,,1,6.90,0.86
1065,עגב. מרוסקות בזיליקום (800 גרם),זנלכל בעמ,יח`,,1,6.90,0.86
1066,חומוס שלם יכין (550 גרם),זנלכל בעמ,יח`,,1,5.90,1.07
1067,רוטב לימון משומר לתיבול יכין (1 ליטר),זנלכל בעמ,יח`,,1,7.90,0.79
1068,סירופ דיאט בטעם לימון יכין (1 ליטר),זנלכל בעמ,יח`,,1,7.90,0.79
1069,סירופ דיאט בטעם פטל יכין (1 ליטר),זנלכל בעמ,יח`,,1,7.90,0.79
1070,סירופ 1 ליטר דיאט אשכולית,זנלכל בעמ,יח`,,1,7.90,0.79
1071,סירופ 1 ליטר דיאט תפוחים,זנלכל בעמ,יח`,,1,7.90,0.79
1072,סירופ דיאט בטעם אננס יכין (1 ליטר),זנלכל בעמ,יח`,,1,7.90,0.79
1073,עגבניות שלמות מקולפות יכין (800 גרם),זנלכל בעמ,יח`,,1,6.90,0.86
1074,אורז בסגנון תאילנדי סוגת (1 קג),סוגת תעשיות בעמ,יח`,,1,7.90,0.79
1075,קמח חיטה מלא סוגת (1 קג),סוגת תעשיות בעמ,יח`,,1,8.90,0.89
1076,בצק עלים צרפתי מרודד מעדנות (1 קג),תנובה קפואים,יח`,,1,21.90,2.19
1077,מלווח מעדנות (6 יח` - 700 גרם),תנובה קפואים,יח`,,1,16.90,2.41
1078,בורקס גבינה מעדנות,תנובה קפואים,יח`,,1,20.90,2.61
1079,בורקס תפוא מעדנות,תנובה קפואים,יח`,,1,19.90,2.49
1080,ריבועי בצק עלים מעדנות,תנובה קפואים,יח`,,1,25,3.13
1081,קרם ידיים ולוטה (80 גרם),הנקל סוד בעמ,יח`,,1,10.90,13.63
1082,מרכך כביסה בייבי סוד (4 ליטר),גורי שיווק בעמ,יח`,,1,17.90,0.45
1083,מרכך כביסה סוד סופט 4 ליטר סגול,גורי שיווק בעמ,יח`,,1,17.90,0.45
1084,מרכך כביסה סוד סופט 4 ליטר לבן,גורי שיווק בעמ,יח`,,1,17.90,0.45
1085,מרכך כביסה ורוד סוד (4 ליטר),גורי שיווק בעמ,יח`,,1,17.90,0.45
1086,מרכך כביסה כחול סוד (4 ליטר),גורי שיווק בעמ,יח`,,1,17.90,0.45
1087,האגיס חיתולי אקסטרה קר מידה 5 34,קימברלי קלארק ישראל שיווק בעמ,יח`,,1,44.90,44.90
1088,מגבונים ללא בישום פרימיום טיטולים (72x4),קימברלי קלארק ישראל שיווק בעמ,יח`,,1,19.90,19.90
1089,זוג רדי אלומניום עם הטבעה,קימברלי קלארק ישראל שיווק בעמ,יח`,,1,9.90,9.90
1090,חומוסטחינה צנובר צבר (400 גרם),קבוצת אסם סחר שות. מוגבלת,יח`,,1,13.90,3.48
1091,מי סודה שוופס (1.5 ליטר),יפאורה,יח`,,1,3.50,0.23
1092,מטלית לכל סנו סושי (9),החברה הדרומית לשיווק בעמ,יח`,,1,11.90,1.32
1093,ניילון נצמד סנו סושי (30x2 מטר),החברה הדרומית לשיווק בעמ,יח`,,1,10.90,10.90
1094,קל רסס וכבס סנו (750 מל),החברה הדרומית לשיווק בעמ,יח`,,1,19.90,3.32
1095,שמפו שטיחים ספריי סנו (600 מל),החברה הדרומית לשיווק בעמ,יח`,,1,23.90,3.98
1096,תרסיס רהיט סנו (300 מל),החברה הדרומית לשיווק בעמ,יח`,,1,16.90,5.54
1097,סופר פוליש נוזל לרצפה סנו (1 ליטר),החברה הדרומית לשיווק בעמ,יח`,,1,33.90,33.90
1098,סנובון תות לאסלה סנו (55x3 גרם),החברה הדרומית לשיווק בעמ,יח`,,1,11.90,7.21
1099,סנובון לאסלה לימון סנו (55x3 גרם),החברה הדרומית לשיווק בעמ,יח`,,1,11.90,7.21
1100,סנובון לאסלה לובר סנו (55x3 גרם),החברה הדרומית לשיווק בעמ,יח`,,1,11.90,7.21
1101,ז`אוול מרסס לניקוי כללי לבנדר סנו (1 ליט,החברה הדרומית לשיווק בעמ,יח`,,1,19.90,19.90
1102,קוטל מעופפים קיי 400 סנו (630 מל),החברה הדרומית לשיווק בעמ,יח`,,1,25,6.25
1103,קוטל חרקים קיי 300 סנו (630 מל),החברה הדרומית לשיווק בעמ,יח`,,1,21.90,3.48
1104,K500,החברה הדרומית לשיווק בעמ,יח`,,1,26,6.42
1105,סנו-די דוחה יתושים כדורי סנו (50 מל),החברה הדרומית לשיווק בעמ,יח`,,1,20.90,41.80
1106,סנו די תרסיס,החברה הדרומית לשיווק בעמ,יח`,,1,20.90,16.72
1107,סנו די נוזל+משאבה,החברה הדרומית לשיווק בעמ,יח`,,1,22.90,45.80
1108,מסיר שומנים ז`אוול קר,החברה הדרומית לשיווק בעמ,יח`,,1,19.90,2.65
1109,סנו ז`אוול מרסס 1 ליטר,החברה הדרומית לשיווק בעמ,יח`,,1,19.90,19.90
1110,מסיר שומנים פורטה פלוס סנו (750 מל),החברה הדרומית לשיווק בעמ,יח`,,1,16.90,2.25
1111,פוליויקס 2 ליטר,החברה הדרומית לשיווק בעמ,יח`,,1,22.90,11.45
1112,סנובון לאסלה קלאסיק כחול סנו (55x3 גרם),החברה הדרומית לשיווק בעמ,יח`,,1,18.90,11.45
1113,רסס ונגב לניקוי כללי תרסיס סנו (750 מל),החברה הדרומית לשיווק בעמ,יח`,,1,17.90,2.98
1114,סנוג`ט יכול הכל סחלבים סנו (4 ליטר),החברה הדרומית לשיווק בעמ,יח`,,1,19.90,4.98
1115,סנומוד מדונה,החברה הדרומית לשיווק בעמ,יח`,,1,11.90,7.93
1116,מטלית ריצפה זיגזג סנו סושי (3),החברה הדרומית לשיווק בעמ,יח`,,1,12.90,12.90
1117,כרית יפנית לכלים אקטיב סנו סושי (4),החברה הדרומית לשיווק בעמ,יח`,,1,11.90,11.90
1118,שקיות אשפה לפח 65x54 סנו סושי (60),החברה הדרומית לשיווק בעמ,יח`,,1,22.90,22.90
1119,אטבי כביסה איכות סנו (20),החברה הדרומית לשיווק בעמ,יח`,,1,9.90,9.90
1120,רב מגבת ג`מבו סנו סושי,החברה הדרומית לשיווק בעמ,יח`,,1,24.90,6.38
1121,סושי רדיד אלומיניום צמד,החברה הדרומית לשיווק בעמ,יח`,,1,12.90,12.90
1122,חטיפי כרובית בציפוי פריך טבעול (500 גרם),קבוצת אסם סחר שות. מוגבלת,יח`,,1,31.90,6.38
1123,פול מצרי 560 גר,ויטה -פרי גליל (החדשה) בעמ,יח`,,1,4.90,0.88
1124,שעועית לבנה אפויה,ויטה -פרי גליל (החדשה) בעמ,יח`,,1,5.90,1.07
1125,חומוס שלם A2,ויטה -פרי גליל (החדשה) בעמ,יח`,,1,5.90,0.98
1126,אפונה גדולה A2,ויטה -פרי גליל (החדשה) בעמ,יח`,,1,5.90,0.98
1127,אפונה וגזר A2,ויטה -פרי גליל (החדשה) בעמ,יח`,,1,5.90,1.07
1128,תירס גרעינים 550 גר`,ויטה -פרי גליל (החדשה) בעמ,יח`,,1,5.90,1.07
1129,ופלים מצופים מן (22x10 גרם),רוקחמן בעמ,יח`,,1,7.90,3.95
1130,חומוסטחינה פלפל חריף מטוגן 400גר,קבוצת אסם סחר שות. מוגבלת,יח`,,1,13.90,3.48
1131,קבנוס קלאסי יחיעם (125 גרם),מעדני יחיעם (1993) בעמ,יח`,,1,12.90,10.32
1132,קבנוס פפרוני יחיעם (125 גרם),מעדני יחיעם (1993) בעמ,יח`,,1,12.90,10.32
1133,משקה קל דיאט אשכוליות ג`אמפ (1.5 ליטר),טמפו משקאות בעמ,יח`,,1,5.50,0.37
1134,משקה קל מנגו פסיפלורה ג`אמפ (1.5 ליטר),טמפו משקאות בעמ,יח`,,1,5.50,0.37
1135,מי סודה טמפו (1.5 ליטר),טמפו משקאות בעמ,יח`,,1,3,0.20
1136,סודה בטעם פירות יער טמפו (1.5 ליטר),טמפו משקאות בעמ,יח`,,1,4,2.67
1137,סודה בטעם אננס טמפו (1.5 ליטר),טמפו משקאות בעמ,יח`,,1,4,2.67
1138,סלמי גליל 600 גר` טירת צבי,תנובה קפואים,יח`,,1,35.90,5.98
1139,נקניקיות פיקנטיות 400 גר` טירת צבי,תנובה קפואים,יח`,,1,13.90,3.48
1140,סלסולי כתף בקר 120 גר` טירת צבי,תנובה קפואים,יח`,,1,15.90,13.25
1141,סלסולי סלמי איטלקי 120 גר` טירת צבי,תנובה קפואים,יח`,,1,15.90,13.25
1142,דקניקים סלסולי הודו טירת צבי (120 גרם),תנובה קפואים,יח`,,1,15.90,13.25
1143,סלסולי פסטרמה גחלים 120 גר` טירת צבי,תנובה קפואים,יח`,,1,15.90,13.25
1144,נקניקיות עוף טירת צבי (400 גרם),תנובה קפואים,יח`,,1,13.90,3.48
1145,צמד כפרי 800 גר` טירת צבי,תנובה קפואים,יח`,,1,34.90,4.36
1146,לחם עינן קל פרוס אנג`ל (500 גרם),שלמה א. אנג`ל בעמ,יח`,,1,14.80,2.96
1147,נוזל לניקוי אסלות 00 סנו (1 ליטר),החברה הדרומית לשיווק בעמ,יח`,,1,8.90,8.90
1148,ממרח בטעם שוקולד השחר העולה (1 קג),השחר העולה תעשית ממתקים בעמ,יח`,,1,23.90,23.90
1149,ממרח 400 גר` חלבי בדצ השחר,השחר העולה תעשית ממתקים בעמ,יח`,,1,13.90,3.48
1150,ממרח אגוזי לוז עם קקאו 350 גר` פרווה,השחר העולה תעשית ממתקים בעמ,יח`,,1,13.90,3.97
1151,שפורפרת לחיץ שוקולד 330 גר` השחר,השחר העולה תעשית ממתקים בעמ,יח`,,1,13.90,4.21
