,ItemName,ManufactureName,UnitQty,Quantity,QtyInPackage,ItemPrice,UnitOfMeasurePrice
3255,נפולינה רוטב עגבניות לפסטה 415 גר` קנור,יוניליוור ישראל שיווק בעמ,יח`,,1,14.20,3.42
3256,ארביאטה רוטב עגבניות חריף לפסטה 415 גר`,יוניליוור ישראל שיווק בעמ,יח`,,1,14.20,3.42
3257,רוטב עגבניות ופלפלים לשקשוקה 415 גר` קנו,יוניליוור ישראל שיווק בעמ,יח`,,1,13.90,3.35
3258,ברנפלקס אקסטרה פייבר 410 גר` תלמה,יוניליוור ישראל שיווק בעמ,יח`,,1,26.50,6.46
3259,קרמיסימו תותים ושוקולד לבן,גלידות שטראוס בעמ,יח`,,1,20.50,15.41
3260,שלישיית סבון אסלה ל5 פעולות בניחוח אוקיי,יוניליוור ישראל שיווק בעמ,יח`,,1,15.90,15.90
3261,שלישיית סבון אסלה ל5 פעולות בניחוח ים ד,יוניליוור ישראל שיווק בעמ,יח`,,1,15.90,15.90
3262,גלידת שוקולד מריר ושקדים 280 גר` גודיז,גלידות שטראוס בעמ,יח`,,1,19.50,6.96
3263,גלידת וניל עוגיות 280 גר` גודיז,גלידות שטראוס בעמ,יח`,,1,19.50,3.75
3264,גלידת שוקולד ציפס 280 גר` גודיס,גלידות שטראוס בעמ,יח`,,1,19.50,3.75
3265,גלידת וניל תות שדה 280 גר` גודיז,גלידות שטראוס בעמ,יח`,,1,19.50,6.96
3266,מאגדת טילון קורנטו ללא גלוטן כשלפ,גלידות שטראוס בעמ,יח`,,1,35.60,10.79
3267,מאגדת מיני סולרו קוקוס אננס,גלידות שטראוס בעמ,יח`,,1,23.40,4.88
3268,שטראוס קרמיסימו בננה טופי,גלידות שטראוס בעמ,יח`,,1,20.50,20.50
3269,קוקומן כדורים בדצ מופחת סוכר,יוניליוור ישראל שיווק בעמ,יח`,,1,22.40,4.48
3270,קוקומן חום לבן 20% פחות סוכר 375 גר`,יוניליוור ישראל שיווק בעמ,יח`,,1,23.40,6.24
3271,דגני פיצי מהדרין תלמה (500 גרם),יוניליוור ישראל שיווק בעמ,יח`,,1,22.40,4.48
3272,ברנפלקס ללא תוספת סוכר 500 גר` בדצ,יוניליוור ישראל שיווק בעמ,יח`,,1,23.40,4.68
3273,ברנפלקס מהדרין תלמה (500 גרם),יוניליוור ישראל שיווק בעמ,יח`,,1,23.40,4.68
3274,שוגי 500 גר`,יוניליוור ישראל שיווק בעמ,יח`,,1,20.30,4.06
3275,פינוק שמפו בתוספת תמצית תה ירוק וויטמין,יוניליוור ישראל שיווק בעמ,יח`,,1,13.20,1.89
3276,פינוק מרכך בתוספת תמצית תה ירוק וויטמין,יוניליוור ישראל שיווק בעמ,יח`,,1,13.20,1.89
3277,קליק קרם נוגט 38 גר`,יוניליוור ישראל שיווק בעמ,יח`,,1,5.40,14.21
3278,רוטב לעוף שום ועשבי תיבול 310 גר` קנור,יוניליוור ישראל שיווק בעמ,יח`,,1,15.20,4.90
3279,ברנפלקס קרנצ`ים קינמון 375 גר`,יוניליוור ישראל שיווק בעמ,יח`,,1,24.40,6.51
3280,ברנפלקס קרנצ`ים מייפל 375 גר`,יוניליוור ישראל שיווק בעמ,יח`,,1,24.40,6.51
3281,רוטב עגבניות בזיליקום 415 גר קנור,יוניליוור ישראל שיווק בעמ,יח`,,1,14.20,3.42
3282,רוטב פומודורו לפסטה 415 גר` קנור,יוניליוור ישראל שיווק בעמ,יח`,,1,14.20,3.42
3283,שמפו עם קמומיל ואלוורה 700 מל פינוק,יוניליוור ישראל שיווק בעמ,יח`,,1,13.20,1.89
3284,מרכך עם קמומיל ואלוורה 700 מל פינוק,יוניליוור ישראל שיווק בעמ,יח`,,1,13.20,1.89
3285,טבעות שומשום 300 גרם,יוניליוור ישראל שיווק בעמ,יח`,,1,11.50,3.83
3286,קליק קרם חלב 38 גר,יוניליוור ישראל שיווק בעמ,יח`,,1,5.40,14.21
3287,קליק טבלאות עם קורפלקס ופצפוצים 85 גר`,יוניליוור ישראל שיווק בעמ,יח`,,1,6.70,7.88
3288,קליק טבלאות שוקולד לבן קוקוס מקורמל 85 ג,יוניליוור ישראל שיווק בעמ,יח`,,1,6.70,7.88
3289,גלידת שטראוס 2 ליטר כשלפ,גלידות שטראוס בעמ,יח`,,1,27.50,1.38
3290,גלידת פרפה פיסטוק 280 גר` גודיס,גלידות שטראוס בעמ,יח`,,1,19.50,3.75
3291,גלידת קפוצ`ינו 280 גר` גודיס,גלידות שטראוס בעמ,יח`,,1,19.50,3.75
3292,שטראוס קרמיסימו טעם פיסטוק ושוקולד עם,גלידות שטראוס בעמ,יח`,,1,20.50,15.41
3293,פריכונים מאורז מלא אסם (310 גרם),קבוצת אסם סחר שות. מוגבלת,יח`,,1,14.20,4.58
3294,פסטה צינורות מהדרין אסם (500 גרם),קבוצת אסם סחר שות. מוגבלת,יח`,,1,6.10,1.22
3295,חומוס עם חריף צבר (400 גרם),קבוצת אסם סחר שות. מוגבלת,יח`,,1,13.30,3.33
3296,ביסלי חטיף בטעם גריל אסם (55x4 גרם),קבוצת אסם סחר שות. מוגבלת,יח`,,1,13.20,6
3297,במבה בומבה 60 גר.,קבוצת אסם סחר שות. מוגבלת,יח`,,1,4.30,4.30
3298,במבה 50 גר` שישייה אסם,קבוצת אסם סחר שות. מוגבלת,יח`,,1,17.30,5.77
3299,ביסלי ברביקיו מארז 4יח*55גרם,קבוצת אסם סחר שות. מוגבלת,יח`,,1,13.20,6
3300,במבה במילוי נוגט אסם (30x5 גרם),קבוצת אסם סחר שות. מוגבלת,יח`,,1,16.30,10.87
3301,קונפיטורת דובדבן יד מרדכי (340 גרם),שטראוס גרופ בעמ,יח`,,1,16.30,4.79
3302,שוקולד אקסטרא חלב 100 גר` בדצ,שטראוס גרופ בעמ,יח`,,1,8.10,8.10
3303,שוקולד פרה אקסטרא קרם יוגורט תות ועוגיות,שטראוס גרופ בעמ,יח`,,1,8.10,8.10
3304,פריכיות גדולות 3 דגנים אנרג`י,שטראוס גרופ בעמ,יח`,,1,14.20,10.52
3305,עד חצות עיגולים 225 גר`,שטראוס גרופ בעמ,יח`,,1,15.60,6.93
3306,חרדל דיז`ון גרגרים יד מרדכי (350 גרם),שטראוס גרופ בעמ,יח`,,1,13.20,3.77
3307,חרדל דיז`ון חלק 370 גרם,שטראוס גרופ בעמ,יח`,,1,13.20,3.57
3308,רבע לשבע אגוזים בודד 27 גרם,שטראוס גרופ בעמ,יח`,,1,4.30,15.93
3309,צנצנת קוביות ספירמינט גומי לעיסה 58גר,שטראוס גרופ בעמ,יח`,,1,11.20,19.31
3310,צנצנת קוביות פפירמינט גומי לעיסה 58גר,שטראוס גרופ בעמ,יח`,,1,11.20,19.31
3311,צנצנת קוביות בזוקה גומי לעיסה 58גר,שטראוס גרופ בעמ,יח`,,1,11.20,19.31
3312,קפסולות קפה עלית 100% גואטמלה (10),שטראוס גרופ בעמ,יח`,,1,18.30,36.60
3313,דוריטוס טקסס גריל70 גר,שטראוס פריטו ליי בעמ,יח`,,1,4,5.71
3314,דוריטוס שקשוקה 70 גר.,שטראוס פריטו ליי בעמ,יח`,,1,4,5.71
3315,רולדה קפה נמס ווסטהיים 350 גר`,שטראוס גרופ בעמ,יח`,,1,16.90,4.83
3316,רבע לשבע לבן 120 גר,שטראוס גרופ בעמ,יח`,,1,14.20,11.83
3317,אגוזי 45 גר` כשלפ,שטראוס גרופ בעמ,יח`,,1,4.30,4.30
3318,קונפיטורת משמש 340 גר,שטראוס גרופ בעמ,יח`,,1,16.30,4.79
3319,שוקולד פרה אקסטרה חלב עלית (100 גרם),שטראוס גרופ בעמ,יח`,,1,8.10,8.10
3320,פרה אקסטרא וניל ועוגיות שוקו 100 גרם,שטראוס גרופ בעמ,יח`,,1,8.10,8.10
3321,שוקולד פרה אקסטרא קרם יוגורט תות ועוגיות,שטראוס גרופ בעמ,יח`,,1,8.10,8.10
3322,שוקולד פרה אקסטרא צימוקים ואגוזים 100 גר,שטראוס גרופ בעמ,יח`,,1,8.10,8.10
3323,חטיף מקופלת ספלנדיד 23 גר` עלית,שטראוס גרופ בעמ,יח`,,1,4.30,18.70
3324,קונפיטורת שזיף 340 גר,שטראוס גרופ בעמ,יח`,,1,16.30,4.79
3325,שוקלוד פרה במילוי תות 50 גר כשלפ,שטראוס גרופ בעמ,יח`,,1,4.30,4.30
3326,מאסט באבלמינט מגדים 66 גר כשלפ,שטראוס גרופ בעמ,יח`,,1,11.20,16.97
3327,צנצנת קוביות ענבים 58 גר,שטראוס גרופ בעמ,יח`,,1,11.20,19.31
3328,קונפיטורת תאנה אגס 340 גר` יד מרדכי,שטראוס גרופ בעמ,יח`,,1,16.30,4.79
3329,קונפיטורת פירות יער 340 גר יד מרדכי,שטראוס גרופ בעמ,יח`,,1,16.30,4.79
3330,שוקולד חלב במתיקות מעודנת 100 גר` עלית,שטראוס גרופ בעמ,יח`,,1,8.90,8.90
3331,שוקולד אגוזים במתיקות מעודנת 100 גר` עלי,שטראוס גרופ בעמ,יח`,,1,8.90,8.90
3332,שוקולד קוקוס במתיקות מעודנת 100 גר` עלית,שטראוס גרופ בעמ,יח`,,1,8.90,8.90
3333,מאסט לארג אבטיח 80 גר`,שטראוס גרופ בעמ,יח`,,1,15.20,19
3334,מאסט לארג מנטה עדינה 80 גר`,שטראוס גרופ בעמ,יח`,,1,15.20,19
3335,קפסולות קפה עלית אספרסו בטעם קרמל,שטראוס גרופ בעמ,יח`,,1,18.30,36.60
3336,קפסולות אספרסו בטעם אגוזים עלית,שטראוס גרופ בעמ,יח`,,1,18.30,36.60
3337,קפסולות קפה עלית אוגנדה 13 למכונות נספרו,שטראוס גרופ בעמ,יח`,,1,18.30,36.60
3338,קפסולות קפה עלית אידונזיה מס` 12,שטראוס גרופ בעמ,יח`,,1,18.30,36.60
3339,צנצנת עלמה בטעם אוכמניות 66 גר`,שטראוס גרופ בעמ,יח`,,1,11.20,11.20
3340,צנצנת עלמה בטעם ספירמינט 66 גר`,שטראוס גרופ בעמ,יח`,,1,11.20,11.20
3341,רבע לשבע רולס שוקולד 120 גר` עלית,שטראוס גרופ בעמ,יח`,,1,14.20,11.83
3342,רבע לשבע רולס קרם קפה 120 גר` עלית,שטראוס גרופ בעמ,יח`,,1,14.20,11.83
3343,מארז עגבניות קצוצות דק שלישייה מנה מאסט,ש.שסטוביץ בעמ,יח`,,1,18.30,1.53
3344,עלי טורטיה קמח מלא 320 גר` מנה מאסטר שף,ש.שסטוביץ בעמ,יח`,,1,11.20,3.50
3345,עלי טורטיה קמח לבן 320 גר` מנה מאסטר שף,ש.שסטוביץ בעמ,יח`,,1,11.20,3.50
3346,מנה רוטב סויה תסיסה טבעית 620 גר,ש.שסטוביץ בעמ,יח`,,1,21.40,3.45
3347,מנה רוטב סויה דל נתרן 620 גר,ש.שסטוביץ בעמ,יח`,,1,21.40,3.45
3348,פלמוליב סבון לומינוס אבוקדו 500 מל,ש.שסטוביץ בעמ,יח`,,1,21.40,4.28
3349,פלמוליב סבון לומינוס מקדמיה 500 מל,ש.שסטוביץ בעמ,יח`,,1,21.40,4.28
3350,מאסטר שף איטריות דקיקות 400 גר,ש.שסטוביץ בעמ,יח`,,1,7.10,1.78
3351,מאסטר שף איטריות דקות 400 גר,ש.שסטוביץ בעמ,יח`,,1,7.10,1.78
3352,מאסטר שף איטריות בינוניות 400 גר,ש.שסטוביץ בעמ,יח`,,1,7.10,1.78
3353,קראנצוס גריל 70 גר`,ש.שסטוביץ בעמ,יח`,,1,4,5.71
3354,קראנצוס פלאפל 70 גר`,ש.שסטוביץ בעמ,יח`,,1,4,5.71
3355,וניש גולד אבקה 1.35 קג ורוד,רקיט בנקיזר (ניר איסט) בעמ,יח`,,1,36.70,2.72
3356,וניש גולד אבקה 1.35 קג לבן,רקיט בנקיזר (ניר איסט) בעמ,יח`,,1,36.70,2.72
3357,וניש גולד אבקה 470גר` ורוד,רקיט בנקיזר (ניר איסט) בעמ,יח`,,1,21.40,4.55
3358,וניש גולד אבקה 470 גר` לבן,רקיט בנקיזר (ניר איסט) בעמ,יח`,,1,21.40,4.55
3359,אירוויק מקלות לבנדר,רקיט בנקיזר (ניר איסט) בעמ,יח`,,1,27.50,91.67
3360,קולון 101 אבקה 2.5 קג,רקיט בנקיזר (ניר איסט) בעמ,יח`,,1,26.50,26.50
3361,ג`ל להסרת כתמים גולד וניש קליה (2 ליטר),רקיט בנקיזר (ניר איסט) בעמ,יח`,,1,26.50,13.25
3362,וניש אבקה 1620 גר` ורוד,רקיט בנקיזר (ניר איסט) בעמ,יח`,,1,31.60,1.95
3363,דטול ספריי חיטוי בניוח כביסה 400,רקיט בנקיזר (ניר איסט) בעמ,יח`,,1,25.90,6.48
3364,וולייט ג`ל כביסה גולד 1.5 ליטר,רקיט בנקיזר (ניר איסט) בעמ,יח`,,1,21.40,1426.67
3365,וניש אבקה 1620 גר` לבן,רקיט בנקיזר (ניר איסט) בעמ,יח`,,1,31.60,1.95
3366,דטול ספריי חיטוי בניחוח פריחה 400,רקיט בנקיזר (ניר איסט) בעמ,יח`,,1,25.90,6.48
3367,וולייט ג`ל לכביסה עדינה 1.5 ליטר,רקיט בנקיזר (ניר איסט) בעמ,יח`,,1,21.40,1426.67
3368,דטול ספריי חיטוי בניחוח אביבי 400,רקיט בנקיזר (ניר איסט) בעמ,יח`,,1,25.90,6.48
3369,כרית קרצוף עם ספוג מקציף סנו סושי (6),החברה הדרומית לשיווק בעמ,יח`,,1,12.20,12.20
3370,סנובון מוצק דאבל אקשן בניחוח תפוז,החברה הדרומית לשיווק בעמ,יח`,,1,21.40,21.40
3371,סנו מקסימה מרכך 1 ליטר blue blossom,החברה הדרומית לשיווק בעמ,יח`,,1,19.30,1.93
3372,מקסימה מרכך כביסה סופט סילק סנו (1 ליטר),החברה הדרומית לשיווק בעמ,יח`,,1,19.30,1.93
3373,כיף פיות קרם להתרת קשרים 350מל,החברה הדרומית לשיווק בעמ,יח`,,1,21.40,6.11
3374,תרסיס מתיר קשרים לילדים כיף (350 מל),החברה הדרומית לשיווק בעמ,יח`,,1,21.40,6.11
3375,כיף בוב ספוג קרם להתרת קשרים 350מל,החברה הדרומית לשיווק בעמ,יח`,,1,21.40,6.11
3376,פורטה 750 מל free,החברה הדרומית לשיווק בעמ,יח`,,1,18.30,2.44
3377,סנובון שלישיה מוצק WAVE בניחוח אורנים,החברה הדרומית לשיווק בעמ,יח`,,1,18.30,18.30
3378,סנובון שלישיה מוצק WAVE בניחוח פרחים ור,החברה הדרומית לשיווק בעמ,יח`,,1,18.30,18.30
3379,סנובון שלישיה מוצק WAVE בניחוח למון מרענ,החברה הדרומית לשיווק בעמ,יח`,,1,18.30,18.30
3380,ג`ל מרוכז 500 מל פורטה פלוס,החברה הדרומית לשיווק בעמ,יח`,,1,15.20,3.04
3381,מרכך כביסה מקסימה Soft Silk,החברה הדרומית לשיווק בעמ,יח`,,1,22.40,5.60
3382,מרכך כביסה מקסימה 4 ליטר Blue Dlosson,החברה הדרומית לשיווק בעמ,יח`,,1,22.40,5.60
3383,מרכך לילדים מיניונים נקה 7 (750 מל),החברה הדרומית לשיווק בעמ,יח`,,1,16.30,2.17
3384,שמפו/מרכך מיניונים נקה 7 - קידס,החברה הדרומית לשיווק בעמ,יח`,,1,16.30,2.17
3385,אל סבון מיניונים נקה 7 - קידס,החברה הדרומית לשיווק בעמ,יח`,,1,16.30,2.17
3386,בייבי כיף אלסבון לפני השינה 750 מל,החברה הדרומית לשיווק בעמ,יח`,,1,25.90,3.45
3387,בייבי כיף קרם גוף לפני השינה 500 מל,החברה הדרומית לשיווק בעמ,יח`,,1,25.90,5.18
3388,נקה 7 שמפו שמני הזנה 750 מל,החברה הדרומית לשיווק בעמ,יח`,,1,14.20,1.89
3389,נקה 7 מרכך שמני הזנה 750 מל,החברה הדרומית לשיווק בעמ,יח`,,1,14.20,1.89
3390,תחליב רחצה כיף ניחוח שקד 700 מל,החברה הדרומית לשיווק בעמ,יח`,,1,13.50,1.93
3391,תחליב רחצה כיף ניחוח דבש 700 מל,החברה הדרומית לשיווק בעמ,יח`,,1,13.50,1.93
3392,תחליב רחצה כיף ניחוח קוקוס וניל 700 מל,החברה הדרומית לשיווק בעמ,יח`,,1,13.50,1.93
3393,תחליב רחצה כיף ניחוח לבנדר 700 מל,החברה הדרומית לשיווק בעמ,יח`,,1,13.50,1.93
3394,תחליב רחצה כיף ניחוח מאסק יסמין 700 מל,החברה הדרומית לשיווק בעמ,יח`,,1,13.50,1.93
3395,תחליב רחצה כיף ניחוח אוקיינס 700 מל,החברה הדרומית לשיווק בעמ,יח`,,1,13.50,1.93
3396,כיף שמפו לשיער רגיל תפוח זרעי צ`יה 700,החברה הדרומית לשיווק בעמ,יח`,,1,13.90,1.99
3397,כיף שמפו לשיער רגיל יבש רימונים ושמן ארג,החברה הדרומית לשיווק בעמ,יח`,,1,13.90,1.99
3398,כיף שמפו לשיער דק ושביר 700,החברה הדרומית לשיווק בעמ,יח`,,1,13.90,1.99
3399,כיף שמפו ומרכך 2+1 תאנה ומנטה 700,החברה הדרומית לשיווק בעמ,יח`,,1,13.90,1.99
3400,כיף שמפו לשיער מעוצב קרטין וחמאת שיאה 70,החברה הדרומית לשיווק בעמ,יח`,,1,13.90,1.99
3401,כיף מרכך לשיער רגיל תפוח זרעי צ`יה 700,החברה הדרומית לשיווק בעמ,יח`,,1,13.90,1.99
3402,כיף מרכך לשיער רגיל יבש רימונים ושמן ארג,החברה הדרומית לשיווק בעמ,יח`,,1,13.90,1.99
3403,כיף מרכך לשיער דק ושביר 700,החברה הדרומית לשיווק בעמ,יח`,,1,13.90,1.99
3404,כיף מרכך לשיער מעוצב קרטין וחמאת שיאה 70,החברה הדרומית לשיווק בעמ,יח`,,1,13.90,1.99
3405,בייבי קרם גוף כיף (500 מל),החברה הדרומית לשיווק בעמ,יח`,,1,25.90,5.18
3406,בייבי שמן לתינוק לעור עדין כיף (500 מל),החברה הדרומית לשיווק בעמ,יח`,,1,25.90,5.18
3407,בייבי כיף שמפו אל דמע (1 ליטר),החברה הדרומית לשיווק בעמ,יח`,,1,23.90,23.90
3408,בייבי כיף אלסבון 1 ליטר,החברה הדרומית לשיווק בעמ,יח`,,1,23.90,23.90
3409,גבינת גאודה מגורדת 500 גר` 28% שומן הולנ,ג.וילי-פוד אינטרנשיונל בעמ,יח`,,1,28.50,5.70
3410,גבינת מוצרלה פרוסות 150 גר` וילי פוד,ג.וילי-פוד אינטרנשיונל בעמ,יח`,,1,16.30,10.87
3411,גבינת חלומי 200 גר` SAY CHEESE וילי פוד,ג.וילי-פוד אינטרנשיונל בעמ,יח`,,1,26.50,13.25
3412,ממרח חמאה 250 גר` ללא מלח Euro spread ו,ג.וילי-פוד אינטרנשיונל בעמ,יח`,,1,12.90,5.16
3413,ממרח חמאה 250 גר` במליחות עדינה Euro spr,ג.וילי-פוד אינטרנשיונל בעמ,יח`,,1,12.90,5.16
3414,ממרח חמאה 250 גר` לייט לא מלח Euro sprea,ג.וילי-פוד אינטרנשיונל בעמ,יח`,,1,12.90,5.16
3415,ממרח חמאה 250 גר` לייט במליחות עדינה Eur,ג.וילי-פוד אינטרנשיונל בעמ,יח`,,1,12.90,5.16
3416,מאפה יוני במילוי קרם בטעם וניל 400 גר` ו,ג.וילי-פוד אינטרנשיונל בעמ,יח`,,1,20.90,5.23
3417,מאפה יוני במילוי גבינת פטה 400 גר` וילי,ג.וילי-פוד אינטרנשיונל בעמ,יח`,,1,20.90,5.23
3418,מאפה יוני במילוי תרד וגבינת פטה 400 גר`,ג.וילי-פוד אינטרנשיונל בעמ,יח`,,1,20.90,5.23
3419,חטיף שקדים וצימוקים HAPPY NUTS וילי פוד,ג.וילי-פוד אינטרנשיונל בעמ,יח`,,1,15.90,11.36
3420,חטיף שקדים וחמוציות HAPPY NUTS וילי פוד,ג.וילי-פוד אינטרנשיונל בעמ,יח`,,1,15.90,11.36
3421,גבינת עיזים רכה בציפוי תפוזים 29% שומן (,ג.וילי-פוד אינטרנשיונל בעמ,יח`,,1,15.90,14.45
3422,גבינת עיזים רכה בציפוי צ`לי 29% שומן (11,ג.וילי-פוד אינטרנשיונל בעמ,יח`,,1,15.90,14.45
3423,4 יח תחתיות לפיצה וילי פוד,ג.וילי-פוד אינטרנשיונל בעמ,יח`,,1,14.90,3.10
3424,גבינת שמנת טבעי 200 גר` EURO CHEESE,ג.וילי-פוד אינטרנשיונל בעמ,יח`,,1,13.90,6.95
3425,גבינת שמנת לייט טבעי 200 גר` EURO CHEESE,ג.וילי-פוד אינטרנשיונל בעמ,יח`,,1,13.90,6.95
3426,גבינת שמנת עשבי תיבול 200 גר` EURO CHEES,ג.וילי-פוד אינטרנשיונל בעמ,יח`,,1,13.90,6.95
3427,גבינת שמנת לייט עשבי תיבול 200 גר` EURO,ג.וילי-פוד אינטרנשיונל בעמ,יח`,,1,13.90,6.95
3428,גבינת שמנת שום 200 גר` EURO CHEESE,ג.וילי-פוד אינטרנשיונל בעמ,יח`,,1,13.90,6.95
3429,גבינת שמנת לייט שום 200 גר` EURO CHEESE,ג.וילי-פוד אינטרנשיונל בעמ,יח`,,1,13.90,6.95
3430,גבינת גאודה פרוסות 400 גר` וילי פוד,ג.וילי-פוד אינטרנשיונל בעמ,יח`,,1,20.90,5.23
3431,מלפפונים כבושים במלח 18-25 קטנים מאוד (8,ג.וילי-פוד אינטרנשיונל בעמ,יח`,,1,15.90,1.99
3432,פסטו בזיליקום 190 גר` וילי פוד,ג.וילי-פוד אינטרנשיונל בעמ,יח`,,1,10.90,5.74
3433,רוטב עגבניות עם זיתים וצלפים 400 גר` ויל,ג.וילי-פוד אינטרנשיונל בעמ,יח`,,1,10.90,2.73
3434,רוטב עגבניות עם פטריות פורצ`יני 400 גר`,ג.וילי-פוד אינטרנשיונל בעמ,יח`,,1,10.90,2.73
3435,רוטב עגבניות עם חצילים 400 גר`,ג.וילי-פוד אינטרנשיונל בעמ,יח`,,1,10.90,2.73
3436,רוטב עגבניות פיקנטי 400 גר` וילי פוד,ג.וילי-פוד אינטרנשיונל בעמ,יח`,,1,10.90,2.73
3437,מארז תפוחונים (3 יח +1 ),ג.וילי-פוד אינטרנשיונל בעמ,יח`,,1,13.90,13.90
3438,מדליוני גבינת עיזים 6 יח *20 גר` ( 120 ג,ג.וילי-פוד אינטרנשיונל בעמ,יח`,,1,15.90,13.25
3439,צנימים טעם טבעי 100 גר` melba toast,ג.וילי-פוד אינטרנשיונל בעמ,יח`,,1,8.90,8.90
3440,לזנה איטלקית 500 גר` (וילי פוד),ג.וילי-פוד אינטרנשיונל בעמ,יח`,,1,11.50,2.30
3441,צנימים עם שומשום 100 גר` melba toast,ג.וילי-פוד אינטרנשיונל בעמ,יח`,,1,8.90,8.90
3442,ממרח חמאה 250 גר` valio,ג.וילי-פוד אינטרנשיונל בעמ,יח`,,1,17.90,7.16
3443,ממרח חמאה 250 גר` לייט VALIO,ג.וילי-פוד אינטרנשיונל בעמ,יח`,,1,17.90,7.16
3444,פיצה מרגריטה 380 גר` וילי פוד,ג.וילי-פוד אינטרנשיונל בעמ,יח`,,1,14.90,3.92
3445,פיצה עם פטריות 390 גר` וילי פוד,ג.וילי-פוד אינטרנשיונל בעמ,יח`,,1,14.90,3.82
3446,פיצה עם זיתים 385 גר` וילי פוד,ג.וילי-פוד אינטרנשיונל בעמ,יח`,,1,14.90,3.87
3447,כדורי בייבי גבינת מוצרלה 200 גר` וילי פו,ג.וילי-פוד אינטרנשיונל בעמ,יח`,,1,20.90,10.45
3448,משקה יוגורט אפרסק 500 מל וילי פוד 0.1%,ג.וילי-פוד אינטרנשיונל בעמ,יח`,,1,10.90,10.90
3449,משקה יוגורט תות 500 מל וילי פוד 0.1%,ג.וילי-פוד אינטרנשיונל בעמ,יח`,,1,10.90,10.90
3450,משקה יוגורט תות ודודבן 500 מל וילי פוד,ג.וילי-פוד אינטרנשיונל בעמ,יח`,,1,10.90,10.90
3451,משקה יוגורט אוכמניות וסמבוק 500 מל וילי,ג.וילי-פוד אינטרנשיונל בעמ,יח`,,1,10.90,10.90
3452,גבינת שמנת עם זיתים 200 גר` EURO CHEESE,ג.וילי-פוד אינטרנשיונל בעמ,יח`,,1,13.90,6.95
3453,גבינת שמנת עם חלפיניו 200 גר` EURO CHEES,ג.וילי-פוד אינטרנשיונל בעמ,יח`,,1,13.90,6.95
3454,גבינת שמנת לייט עם זיתים 200 גר` EURO CH,ג.וילי-פוד אינטרנשיונל בעמ,יח`,,1,13.90,6.95
3455,גבינת שמנת לייט עם חלפיניו 200 גר` EURO,ג.וילי-פוד אינטרנשיונל בעמ,יח`,,1,13.90,6.95
3456,גבינת פטה 200 גר` טבעונית,ג.וילי-פוד אינטרנשיונל בעמ,יח`,,1,18.90,9.45
3457,גבינה טבעונית קוביות פטה במי מלח 200 גר,ג.וילי-פוד אינטרנשיונל בעמ,יח`,,1,18.90,9.45
3458,גבינה גוש מוצרלה 200 גר` טבעונית,ג.וילי-פוד אינטרנשיונל בעמ,יח`,,1,18.90,9.45
3459,גבינה פרוסות מוצרלה 200 גר` טבעונית,ג.וילי-פוד אינטרנשיונל בעמ,יח`,,1,18.90,9.45
3460,גבינה גוש גאודה 200 גר` טבעונית,ג.וילי-פוד אינטרנשיונל בעמ,יח`,,1,18.90,9.45
3461,גבינה פרוסות גאודה 200 גר` טבעונית,ג.וילי-פוד אינטרנשיונל בעמ,יח`,,1,18.90,9.45
3462,גבינה גוש גאודה מעושנת 200 גר` ולי פוד,ג.וילי-פוד אינטרנשיונל בעמ,יח`,,1,18.90,9.45
3463,גבינה גוש מוצרלה לפיצה 200 גר` טבעונית,ג.וילי-פוד אינטרנשיונל בעמ,יח`,,1,18.90,9.45
3464,גבינה גוש צ`דר כתום 200 גר`,ג.וילי-פוד אינטרנשיונל בעמ,יח`,,1,18.90,9.45
