,ItemName,ManufactureName,UnitQty,Quantity,QtyInPackage,ItemPrice,UnitOfMeasurePrice
2356,תחליב רחצה נקה 7 וניל שקד,החברה הדרומית לשיווק בעמ,יח`,,1,9.90,1.32
2357,תחליב רחצה קוקוס,החברה הדרומית לשיווק בעמ,יח`,,1,9.70,1.29
2358,תחליב רחצה וניל,החברה הדרומית לשיווק בעמ,יח`,,1,9.70,1.29
2359,טיטניום ספרי גוף קלאסי 150 מל,החברה הדרומית לשיווק בעמ,יח`,,1,14.90,9.93
2360,טיטניום ספרי גוף בלק 150 מל,החברה הדרומית לשיווק בעמ,יח`,,1,9.90,6.60
2361,טיטניום דאודורנט,החברה הדרומית לשיווק בעמ,יח`,,1,9.80,6.53
2362,טיטניום דאודורנט,החברה הדרומית לשיווק בעמ,יח`,,1,14.90,9.93
2363,טיטניום גולד דאו,החברה הדרומית לשיווק בעמ,יח`,,1,9.80,6.53
2364,דאו ספריי קרליין נושם +,החברה הדרומית לשיווק בעמ,יח`,,1,12.90,8.60
2365,קרליין רול און נ,החברה הדרומית לשיווק בעמ,יח`,,1,9.80,13.07
2366,דאו ספריי נושם קרליין,החברה הדרומית לשיווק בעמ,יח`,,1,12.90,6.45
2367,דאו נושם רול און קרליין תכלת,החברה הדרומית לשיווק בעמ,יח`,,1,12.90,12.90
2368,קפסולות קפה עלית עשיר וארומטי (10),שטראוס גרופ בעמ,יח`,,1,16.90,16.90
2369,קפסולות 10 חזק ועוצמתי עלית (10),שטראוס גרופ בעמ,יח`,,1,16.90,33.80
2370,קפסולות 7 עדין וקטיפתי עלית (10),שטראוס גרופ בעמ,יח`,,1,16.90,33.80
2371,כיף כף לבן,שטראוס גרופ בעמ,יח`,,1,3.90,8.67
2372,כיף כף מגדים 45 גרם,שטראוס גרופ בעמ,יח`,,1,3.90,8.67
2373,ביסקוויט עד חצות לבן 200 גר`,שטראוס גרופ בעמ,יח`,,1,13.90,6.95
2374,סימפוניה פלפל שיפקה חריף,שטראוס גרופ בעמ/מצונן,יח`,,1,11.40,5.70
2375,סימפוניה בצל ירוק 5%,שטראוס גרופ בעמ/מצונן,יח`,,1,11.40,5.70
2376,צ`יטוס דולפינים עלית (55 גרם),שטראוס פריטו ליי בעמ,יח`,,1,3.50,6.36
2377,פלמוליב ספא קוקוס גרגרים 500 מל,ש.שסטוביץ בעמ,יח`,,1,19.90,3.98
2378,חרדל דיז`ון צרפתי מאסטר שף (370 גרם),ש.שסטוביץ בעמ,יח`,,1,11.90,3.22
2379,חרדל דיז`ון גרגרים מאסטר שף (370 גרם),ש.שסטוביץ בעמ,יח`,,1,11.90,3.22
2380,וודקה פינלנדיה 700 מל,מ. אקרמן בעמ,יח`,,1,65.20,9.27
2381,וויסקי ג`ק דניאלס 700 מל,מ. אקרמן בעמ,יח`,,1,129.90,18.51
2382,וויסקי פיימוס גראוס 700 מל,מ. אקרמן בעמ,יח`,,1,77,10.96
2383,וויסקי ג`ק דניאלס דבש 700 מל,מ. אקרמן בעמ,יח`,,1,129.90,18.51
2384,ליקר בוכא בוקובזה 700 מל,מ. אקרמן בעמ,יח`,,1,117.90,16.80
2385,במבה אסם (25x10 גרם),קבוצת אסם סחר שות. מוגבלת,יח`,,1,16.90,6.76
2386,ספגטי מהיר הכנה אסם (500 גרם),קבוצת אסם סחר שות. מוגבלת,יח`,,1,5.90,1.18
2387,פתיתים אפויים 500 גר` אורז עם אטריות אסם,קבוצת אסם סחר שות. מוגבלת,יח`,,1,6.90,6.90
2388,רוטב סויה קלאסי אסם (290 מל),קבוצת אסם סחר שות. מוגבלת,יח`,,1,17.90,6.17
2389,מנה חמה נודלס טעם פאד,קבוצת אסם סחר שות. מוגבלת,יח`,,1,7.90,11.29
2390,מנה חמה נודלס טעם צילי,קבוצת אסם סחר שות. מוגבלת,יח`,,1,3,4.29
2391,משקה פונץ בננה 1 ליטר מהדרין,שטראוס גרופ בעמ/מצונן,יח`,,1,11.60,1.16
2392,רביולי עם בטטה פרווה שטראוס (400 גרם),שטראוס גרופ בעמ/מצונן,יח`,,1,20.90,5.23
2393,רבע לשבע,שטראוס גרופ בעמ,יח`,,1,12.90,8.06
2394,שוקולית לאפיה 500 גר`,שטראוס גרופ בעמ,יח`,,1,14.90,2.98
2395,רבע לשבע אין סייד אוט 125 גר,שטראוס גרופ בעמ,יח`,,1,12.90,10.32
2396,קפסולות קפה עלית ברזיל) (10,שטראוס גרופ בעמ,יח`,,1,16.90,33.80
2397,קפסולות קפה עלית נטול קפאין אספרסו (10),שטראוס גרופ בעמ,יח`,,1,16.90,33.80
2398,קרקר לחמית חמישה דגנים אסם (190 גרם),קבוצת אסם סחר שות. מוגבלת,יח`,,1,8.90,4.68
2399,חטיפי טורטיה בטעם חמוץ מתוק אסם (60 גרם),קבוצת אסם סחר שות. מוגבלת,יח`,,1,5.70,9.50
2400,דובונים 40 גר` גן חיות,קבוצת אסם סחר שות. מוגבלת,יח`,,1,5,12.50
2401,מארז אפרופו קלאסי 25*5,קבוצת אסם סחר שות. מוגבלת,יח`,,1,12.90,10.32
2402,קריספי טאפאס זיתים,קבוצת אסם סחר שות. מוגבלת,יח`,,1,7.50,5
2403,קריספי טאפאס פלפלים קלוים אסם (150 גרם),קבוצת אסם סחר שות. מוגבלת,יח`,,1,11.90,7.93
2404,קריספי טאפאס פיזורים,קבוצת אסם סחר שות. מוגבלת,יח`,,1,7.50,5
2405,חומוס ירושלמי צבר (400 גרם),קבוצת אסם סחר שות. מוגבלת,יח`,,1,12,3
2406,חומוס לבנוני צבר (400 גרם),קבוצת אסם סחר שות. מוגבלת,יח`,,1,12,3
2407,חומוס עם טחינה צבר (400 גרם),קבוצת אסם סחר שות. מוגבלת,יח`,,1,12,3
2408,חומוס עם צנוברים צבר (400 גרם),קבוצת אסם סחר שות. מוגבלת,יח`,,1,12,3
2409,חומוס אבו גוש צבר (400 גרם),קבוצת אסם סחר שות. מוגבלת,יח`,,1,11.90,2.98
2410,פתיתים אפויים 400 גר` פלוס ירקות אסם,קבוצת אסם סחר שות. מוגבלת,יח`,,1,6.90,1.73
2411,אסם פתיתי בורגול,ספקים שונים,יח`,,1,6.90,1.73
2412,אפרופו שוקולד 40 גר,קבוצת אסם סחר שות. מוגבלת,יח`,,1,5,12.50
2413,חומוס צבר (400 גרם),קבוצת אסם סחר שות. מוגבלת,יח`,,1,11.90,2.38
2414,חומוס מסעדה צבר (700 גרם),קבוצת אסם סחר שות. מוגבלת,יח`,,1,13.90,1.99
2415,טחינה אמיתית צבר (400 גרם),קבוצת אסם סחר שות. מוגבלת,יח`,,1,11.90,2.98
2416,סלט חציל על האש בטחינה צבר (400 גרם),קבוצת אסם סחר שות. מוגבלת,יח`,,1,12.90,3.23
2417,חציל במיונז על האש צבר (400 גרם),קבוצת אסם סחר שות. מוגבלת,יח`,,1,11.90,2.98
2418,צבר מרובע קולסלו,ספקים שונים,יח`,,1,11.90,2.98
2419,סלט כרוב אדום צבר (400 גרם),קבוצת אסם סחר שות. מוגבלת,יח`,,1,10.90,2.73
2420,צבר מרובע מטבוחה,ספקים שונים,יח`,,1,12.90,3.23
2421,צבר מרובע חציל ע,ספקים שונים,יח`,,1,11.90,2.98
2422,במבה ביסלי מיקס 80 גר`,קבוצת אסם סחר שות. מוגבלת,יח`,,1,4.30,5.38
2423,פיתה קראנצ` בטעם זעתר עלית (300 גרם),שטראוס פריטו ליי בעמ,יח`,,1,13,4.33
2424,פופקורן בטעם טבעי עלית (65 גרם),שטראוס פריטו ליי בעמ,יח`,,1,3.90,6
2425,תפוצ`יפס 200 גר` אקסטרא,שטראוס פריטו ליי בעמ,יח`,,1,10.90,5.45
2426,טורטית מגדים,שטראוס גרופ בעמ,יח`,,1,3.90,9.75
2427,רביולי תרד וגבינה שטראוס (400 גרם),שטראוס גרופ בעמ/מצונן,יח`,,1,20.90,5.23
2428,מקופלת XL מריר 33 גר,שטראוס גרופ בעמ,יח`,,1,3.90,11.82
2429,עוגת רולדה טורטית עלית (350 גרם),שטראוס גרופ בעמ,יח`,,1,13.90,3.97
2430,רבע לשבע בוטנים,שטראוס גרופ בעמ,יח`,,1,12.90,10.75
2431,קונפיטורת תות לייט יד מרדכי (230 גרם),שטראוס גרופ בעמ,יח`,,1,14.90,5.96
2432,חטיף תירס בטעם פיצה דוריטוס (70 גרם),שטראוס פריטו ליי בעמ,יח`,,1,3.90,5.57
2433,טבלאות פרה חלבי  קורנפלקס- כשלפ,שטראוס גרופ בעמ,יח`,,1,4,4
2434,יד מרדכי מיץ לימון 250 מל,שטראוס גרופ בעמ,יח`,,1,8.90,3.56
2435,יוגורט 3% פירות יער דנונה (150 גרם),שטראוס גרופ בעמ/מצונן,יח`,,1,3.70,2.47
2436,קפסולות קפה עלית בטעם וניל 50 גר,שטראוס גרופ בעמ,יח`,,1,16.90,33.80
2437,מסטיק ללא סוכר בזוקה (66 גרם),שטראוס גרופ בעמ,יח`,,1,9.90,15
2438,מאסט ללא סוכר צנצנת,שטראוס גרופ בעמ,יח`,,1,9.90,15
2439,צנצנת ספירמינט צ`יקלט,שטראוס גרופ בעמ,יח`,,1,9.90,15
2440,טבלאות פרה לבן במילוי תות.,שטראוס גרופ בעמ,יח`,,1,4.90,4.90
2441,רבע לשבע חלבה,שטראוס גרופ בעמ,יח`,,1,12.90,10.75
2442,רבע לשבע בודד 27 גרם,שטראוס גרופ בעמ,יח`,,1,3.90,14.44
2443,סירופ מייפל טהור 189מל יד מורדכי,שטראוס גרופ בעמ,יח`,,1,29.90,15.82
2444,רבע לשבע אלפחורס 120 גר,שטראוס גרופ בעמ,יח`,,1,12.90,10.75
2445,יוגורט תות 3% דנונה (150x8 גרם),שטראוס גרופ בעמ/מצונן,יח`,,1,24.90,2.08
2446,מטליות לחות לניקוי כללי סושי סנו (50),החברה הדרומית לשיווק בעמ,יח`,,1,14,14
2447,מגבוני טואלט לחים סנו סופט (48x3),החברה הדרומית לשיווק בעמ,יח`,,1,19.90,19.90
2448,קרמה קרם ידיים,החברה הדרומית לשיווק בעמ,יח`,,1,10.90,10.90
2449,סנו ג`ט למקלחת 750 מל,החברה הדרומית לשיווק בעמ,יח`,,1,15.90,2.12
2450,סנו ג`ט למטבח 750 מל,החברה הדרומית לשיווק בעמ,יח`,,1,11.90,1.59
2451,ג`ט לניקוי כללי ורצפות סנו (2 ליטר),החברה הדרומית לשיווק בעמ,יח`,,1,9.70,0.49
2452,סנובון מוצק WAVEבניחוח פרחים ורודים,החברה הדרומית לשיווק בעמ,יח`,,1,9.60,9.60
2453,סנובון מוצק WAVEבניחוח לימון מרענן,החברה הדרומית לשיווק בעמ,יח`,,1,9.60,9.60
2454,סנובון מוצק WAVEבניחוח אורנים,החברה הדרומית לשיווק בעמ,יח`,,1,9.60,9.60
2455,ג`ל בייבי סנו אוקסיג`ן (3 ליטר),החברה הדרומית לשיווק בעמ,יח`,,1,29.90,9.97
2456,מקסימה ג`ל כביסה בלי להפריד,החברה הדרומית לשיווק בעמ,יח`,,1,24.90,8.30
2457,סנובון מוצק דאבל אקשן בניחוח פרחים ורודי,החברה הדרומית לשיווק בעמ,יח`,,1,19.90,19.90
2458,סנובון מוצק דאבל אקשן בניחוח לבנדר,החברה הדרומית לשיווק בעמ,יח`,,1,19.90,19.90
2459,נוזל לניקוי כלים לימון 700 מל,החברה הדרומית לשיווק בעמ,יח`,,1,7.90,1.13
2460,נוזל לניקוי כלים 700מל בניחוח לבנדר,החברה הדרומית לשיווק בעמ,יח`,,1,6.90,0.99
2461,נוזל לניקוי כלים קלאסי 700 מל,החברה הדרומית לשיווק בעמ,יח`,,1,7.90,1.13
2462,נוזל לניקוי כלים היפואלרגני,החברה הדרומית לשיווק בעמ,יח`,,1,7.90,1.05
2463,פינוק לגבר 3 ב  -1(שמפו /ג`ל/סבון  ),יוניליוור ישראל שיווק בעמ,יח`,,1,9.90,1.41
2464,פינוק לגבר 2ב -1 שמפו/מרכך,יוניליוור ישראל שיווק בעמ,יח`,,1,12.90,1.84
2465,פינוק מרכך שמני הזנה חיוניים 700 מל,יוניליוור ישראל שיווק בעמ,יח`,,1,10,1.43
2466,שמפו בתוספת שמן קוקוס פינוק (700 מל),יוניליוור ישראל שיווק בעמ,יח`,,1,9.90,1.41
2467,פינוק מרכך שמן קוקוס 700 מל,יוניליוור ישראל שיווק בעמ,יח`,,1,12.90,1.84
2468,תחליב רחצה בשמן קוקוס פינוק (700 מל),יוניליוור ישראל שיווק בעמ,יח`,,1,12.90,1.84
2469,מרק עוף רכיבים טבעיים 400 גר` קנור,יוניליוור ישראל שיווק בעמ,יח`,,1,27.90,6.98
2470,שמפו לגבר למניעת קשקשים פינוק (700 מל),יוניליוור ישראל שיווק בעמ,יח`,,1,13.60,1.94
2471,מרק בצל רכיבים טבעיים 400 גר` קנור,יוניליוור ישראל שיווק בעמ,יח`,,1,27.90,6.98
2472,מאגדת חטיפי שוגי קורנפלקס שישייה,יוניליוור ישראל שיווק בעמ,יח`,,1,14.90,9.55
2473,מאגדת חטיפי ילדים קוקומן פצפוצים שישייה,יוניליוור ישראל שיווק בעמ,יח`,,1,14.90,11.83
2474,מטליות לחות לניקוי רצפות בניחוח לימון,יוניליוור ישראל שיווק בעמ,יח`,,1,10.90,10.90
2475,מאגדת חטיפי ילדים שוגי שוקו שישייה,יוניליוור ישראל שיווק בעמ,יח`,,1,14.90,9.55
2476,מאגדת חטיפי ילדים שוגי פצפוצים שישייה,יוניליוור ישראל שיווק בעמ,יח`,,1,14.90,10.80
2477,נפולינה רוטב עגבניות לפסטה 415 גר` קנור,יוניליוור ישראל שיווק בעמ,יח`,,1,12.90,3.11
2478,ארביאטה רוטב עגבניות חריף לפסטה 415 גר`,יוניליוור ישראל שיווק בעמ,יח`,,1,12.90,3.11
2479,רוטב עגבניות ופלפלים לשקשוקה 415 גר` קנו,יוניליוור ישראל שיווק בעמ,יח`,,1,12.90,3.11
2480,ברנפלקס אקסטרה פייבר 410 גר` תלמה,יוניליוור ישראל שיווק בעמ,יח`,,1,24.90,6.07
2481,קרמיסימו תותים ושוקולד לבן,גלידות שטראוס בעמ,יח`,,1,18.90,14.21
2482,מאגדת טילון קורנטו ללא גלוטן כשלפ,גלידות שטראוס בעמ,יח`,,1,32.90,9.97
2483,שטראוס קרמיסימו בננה טופי,גלידות שטראוס בעמ,יח`,,1,18.90,18.90
2484,קוקומן כדורים בדצ מופחת סוכר,יוניליוור ישראל שיווק בעמ,יח`,,1,21.90,4.38
2485,קוקומן חום לבן 20% פחות סוכר 375 גר`,יוניליוור ישראל שיווק בעמ,יח`,,1,21.90,5.84
2486,דגני פיצי מהדרין תלמה (500 גרם),יוניליוור ישראל שיווק בעמ,יח`,,1,21.90,4.38
2487,ברנפלקס ללא תוספת סוכר 500 גר` בדצ,יוניליוור ישראל שיווק בעמ,יח`,,1,22.90,4.58
2488,ברנפלקס מהדרין תלמה (500 גרם),יוניליוור ישראל שיווק בעמ,יח`,,1,22.90,4.58
2489,שוגי 500 גר`,יוניליוור ישראל שיווק בעמ,יח`,,1,18.90,3.78
2490,פינוק שמפו בתוספת תמצית תה ירוק וויטמין,יוניליוור ישראל שיווק בעמ,יח`,,1,12.90,1.84
2491,פינוק מרכך בתוספת תמצית תה ירוק וויטמין,יוניליוור ישראל שיווק בעמ,יח`,,1,12.90,1.84
2492,מרכך כביסה גלמור בדין 4 ליטר,יוניליוור ישראל שיווק בעמ,יח`,,1,19.90,4.98
2493,מרכך כביסה אלגנס בדין 4 ליטר,יוניליוור ישראל שיווק בעמ,יח`,,1,19.90,4.98
2494,ברנפלקס קרנצ`ים קינמון 375 גר`,יוניליוור ישראל שיווק בעמ,יח`,,1,22.90,6.11
2495,ברנפלקס קרנצ`ים מייפל 375 גר`,יוניליוור ישראל שיווק בעמ,יח`,,1,22.90,6.11
2496,רוטב פומודורו לפסטה 415 גר` קנור,יוניליוור ישראל שיווק בעמ,יח`,,1,12.90,3.11
2497,שמפו עם קמומיל ואלוורה 700 מל פינוק,יוניליוור ישראל שיווק בעמ,יח`,,1,12.90,1.84
2498,מרכך עם קמומיל ואלוורה 700 מל פינוק,יוניליוור ישראל שיווק בעמ,יח`,,1,12.90,1.84
2499,גלידת שטראוס 2 ליטר כשלפ,גלידות שטראוס בעמ,יח`,,1,24.90,1.25
2500,שטראוס קרמיסימו טעם פיסטוק ושוקולד עם,גלידות שטראוס בעמ,יח`,,1,18.90,14.21
2501,פריכונים מאורז מלא אסם (310 גרם),קבוצת אסם סחר שות. מוגבלת,יח`,,1,13.90,4.48
2502,פסטה צינורות מהדרין אסם (500 גרם),קבוצת אסם סחר שות. מוגבלת,יח`,,1,5.90,1.18
2503,חומוס עם חריף צבר (400 גרם),קבוצת אסם סחר שות. מוגבלת,יח`,,1,12,3
2504,ביסלי חטיף בטעם גריל אסם (55x4 גרם),קבוצת אסם סחר שות. מוגבלת,יח`,,1,12.90,5.86
2505,במבה 50 גר` שישייה אסם,קבוצת אסם סחר שות. מוגבלת,יח`,,1,15.90,5.30
2506,ביסלי ברביקיו מארז 4יח*55גרם,קבוצת אסם סחר שות. מוגבלת,יח`,,1,12.90,5.86
2507,במבה במילוי נוגט אסם (30x5 גרם),קבוצת אסם סחר שות. מוגבלת,יח`,,1,14.90,9.93
2508,קונפיטורת דובדבן יד מרדכי (340 גרם),שטראוס גרופ בעמ,יח`,,1,14.90,4.38
2509,שוקולד אקסטרא חלב 100 גר` בדצ,שטראוס גרופ בעמ,יח`,,1,6.60,6.60
2510,שוקולד פרה אקסטרא קרם יוגורט תות ועוגיות,שטראוס גרופ בעמ,יח`,,1,6.90,6.90
2511,פריכיות גדולות 3 דגנים אנרג`י,שטראוס גרופ בעמ,יח`,,1,12.90,9.56
2512,אקטיביה יוגורט 1.5% דנונה (150x8 גרם),שטראוס גרופ בעמ/מצונן,יח`,,1,19.90,16.58
2513,עד חצות עיגולים 225 גר`,שטראוס גרופ בעמ,יח`,,1,14.90,6.62
2514,חרדל דיז`ון גרגרים יד מרדכי (350 גרם),שטראוס גרופ בעמ,יח`,,1,11.90,3.40
2515,חרדל דיז`ון חלק 370 גרם,שטראוס גרופ בעמ,יח`,,1,11.90,3.22
2516,רבע לשבע אגוזים בודד 27 גרם,שטראוס גרופ בעמ,יח`,,1,3.90,14.44
2517,צנצנת קוביות ספירמינט גומי לעיסה 58גר,שטראוס גרופ בעמ,יח`,,1,9.90,17.07
2518,צנצנת קוביות פפירמינט גומי לעיסה 58גר,שטראוס גרופ בעמ,יח`,,1,9.90,17.07
2519,צנצנת קוביות בזוקה גומי לעיסה 58גר,שטראוס גרופ בעמ,יח`,,1,9.90,17.07
2520,קפסולות קפה עלית 100% גואטמלה (10),שטראוס גרופ בעמ,יח`,,1,16.90,33.80
2521,דוריטוס טקסס גריל70 גר,שטראוס פריטו ליי בעמ,יח`,,1,3.90,5.57
2522,השוקו שלי - שוקו ללא תוספת סוכר,שטראוס גרופ בעמ/מצונן,יח`,,1,11.60,11.60
2523,דוריטוס שקשוקה 70 גר.,שטראוס פריטו ליי בעמ,יח`,,1,2.50,3.57
2524,רולדה קפה נמס ווסטהיים 350 גר`,שטראוס גרופ בעמ,יח`,,1,15.90,4.54
2525,רבע לשבע לבן 120 גר,שטראוס גרופ בעמ,יח`,,1,12.90,10.75
2526,אגוזי 45 גר` כשלפ,שטראוס גרופ בעמ,יח`,,1,3.90,3.90
2527,כד 2 ליטר חלב 1% מהדרין,שטראוס גרופ בעמ/מצונן,יח`,,1,14.90,7.45
2528,סימפוניה שום שמיר 5%,שטראוס גרופ בעמ/מצונן,יח`,,1,11.40,5.70
2529,קונפיטורת משמש 340 גר,שטראוס גרופ בעמ,יח`,,1,14.90,4.38
2530,שוקולד פרה אקסטרה חלב עלית (100 גרם),שטראוס גרופ בעמ,יח`,,1,6.90,6.90
2531,פרה אקסטרא וניל ועוגיות שוקו 100 גרם,שטראוס גרופ בעמ,יח`,,1,6.90,6.90
2532,שוקולד פרה אקסטרא קרם יוגורט תות ועוגיות,שטראוס גרופ בעמ,יח`,,1,6.90,6.90
2533,שוקולד פרה אקסטרא צימוקים ואגוזים 100 גר,שטראוס גרופ בעמ,יח`,,1,6.90,6.90
2534,חטיף מקופלת ספלנדיד 23 גר` עלית,שטראוס גרופ בעמ,יח`,,1,3.90,16.96
2535,קונפיטורת שזיף 340 גר,שטראוס גרופ בעמ,יח`,,1,14.90,4.38
2536,שוקלוד פרה במילוי תות 50 גר כשלפ,שטראוס גרופ בעמ,יח`,,1,3.90,3.90
2537,מאסט באבלמינט מגדים 66 גר כשלפ,שטראוס גרופ בעמ,יח`,,1,9.90,15
2538,צנצנת קוביות ענבים 58 גר,שטראוס גרופ בעמ,יח`,,1,9.90,17.07
2539,קונפיטורת תאנה אגס 340 גר` יד מרדכי,שטראוס גרופ בעמ,יח`,,1,14.90,4.38
2540,קונפיטורת פירות יער 340 גר יד מרדכי,שטראוס גרופ בעמ,יח`,,1,14.90,4.38
2541,שוקולד חלב במתיקות מעודנת 100 גר` עלית,שטראוס גרופ בעמ,יח`,,1,7.90,7.90
2542,שוקולד אגוזים במתיקות מעודנת 100 גר` עלי,שטראוס גרופ בעמ,יח`,,1,7.90,7.90
2543,שוקולד קוקוס במתיקות מעודנת 100 גר` עלית,שטראוס גרופ בעמ,יח`,,1,7.90,7.90
2544,מאסט לארג אבטיח 80 גר`,שטראוס גרופ בעמ,יח`,,1,9.90,12.38
2545,מאסט לארג מנטה עדינה 80 גר`,שטראוס גרופ בעמ,יח`,,1,9.90,12.38
2546,קפסולות קפה עלית אספרסו בטעם קרמל,שטראוס גרופ בעמ,יח`,,1,16.90,33.80
2547,קפסולות אספרסו בטעם אגוזים עלית,שטראוס גרופ בעמ,יח`,,1,16.90,33.80
2548,קפסולות קפה עלית אוגנדה 13 למכונות נספרו,שטראוס גרופ בעמ,יח`,,1,16.90,33.80
2549,קפסולות קפה עלית אידונזיה מס` 12,שטראוס גרופ בעמ,יח`,,1,16.90,33.80
2550,סימפוניה זיתים פיקנטים 200 גר`,שטראוס גרופ בעמ/מצונן,יח`,,1,11.40,5.70
2551,סימופניה עשבי תיבול 200 גר`,שטראוס גרופ בעמ/מצונן,יח`,,1,11.40,5.70
2552,מארז 8 דנונה מתיקות מעודנת ללא סוכר וממת,שטראוס גרופ בעמ/מצונן,יח`,,1,18.50,15.42
2553,רבע לשבע רולס שוקולד 120 גר` עלית,שטראוס גרופ בעמ,יח`,,1,12.90,10.75
2554,רבע לשבע רולס קרם קפה 120 גר` עלית,שטראוס גרופ בעמ,יח`,,1,12.90,10.75
2555,מעדן טחינה בטעם נוגט 125 גר` SOOM,שטראוס גרופ בעמ/מצונן,יח`,,1,3.90,3.12
2556,מעדן טחינה בטעם וניל 125 גר` SOOM,שטראוס גרופ בעמ/מצונן,יח`,,1,3.90,3.12
2557,מעדן טחינה בטעם שוקולד 125 גר` SOOM,שטראוס גרופ בעמ/מצונן,יח`,,1,3.90,3.12
2558,מארז עגבניות קצוצות דק שלישייה מנה מאסט,ש.שסטוביץ בעמ,יח`,,1,16.90,1.41
2559,פלמוליב סבון לומינוס אבוקדו 500 מל,ש.שסטוביץ בעמ,יח`,,1,19.90,3.98
2560,פלמוליב סבון לומינוס מקדמיה 500 מל,ש.שסטוביץ בעמ,יח`,,1,19.90,3.98
2561,מאסטר שף איטריות דקיקות 400 גר,ש.שסטוביץ בעמ,יח`,,1,5,1.25
2562,מאסטר שף איטריות דקות 400 גר,ש.שסטוביץ בעמ,יח`,,1,5,1.25
2563,מאסטר שף איטריות בינוניות 400 גר,ש.שסטוביץ בעמ,יח`,,1,5.70,1.43
2564,קראנצוס גריל 70 גר`,ש.שסטוביץ בעמ,יח`,,1,3.90,5.57
2565,קראנצוס פלאפל 70 גר`,ש.שסטוביץ בעמ,יח`,,1,3.90,5.57
2566,וניש גולד אבקה 1.35 קג ורוד,רקיט בנקיזר (ניר איסט) בעמ,יח`,,1,34.90,2.59
2567,וניש גולד אבקה 1.35 קג לבן,רקיט בנקיזר (ניר איסט) בעמ,יח`,,1,29.90,2.21
2568,וניש גולד אבקה 470גר` ורוד,רקיט בנקיזר (ניר איסט) בעמ,יח`,,1,19.90,4.23
2569,וניש גולד אבקה 470 גר` לבן,רקיט בנקיזר (ניר איסט) בעמ,יח`,,1,19.90,4.23
2570,קולון 101 אבקה 2.5 קג,רקיט בנקיזר (ניר איסט) בעמ,יח`,,1,24.90,24.90
2571,ג`ל להסרת כתמים גולד וניש קליה (2 ליטר),רקיט בנקיזר (ניר איסט) בעמ,יח`,,1,24.90,12.45
2572,דטול ספריי חיטוי בניוח כביסה 400,רקיט בנקיזר (ניר איסט) בעמ,יח`,,1,19.90,4.98
2573,וולייט ג`ל כביסה גולד 1.5 ליטר,רקיט בנקיזר (ניר איסט) בעמ,יח`,,1,19.90,1326.67
2574,דטול ספריי חיטוי בניחוח פריחה 400,רקיט בנקיזר (ניר איסט) בעמ,יח`,,1,19.90,4.98
2575,וולייט ג`ל לכביסה עדינה 1.5 ליטר,רקיט בנקיזר (ניר איסט) בעמ,יח`,,1,19.90,1326.67
2576,דטול ספריי חיטוי בניחוח אביבי 400,רקיט בנקיזר (ניר איסט) בעמ,יח`,,1,19.90,4.98
2577,כרית קרצוף עם ספוג מקציף סנו סושי (6),החברה הדרומית לשיווק בעמ,יח`,,1,9.30,9.30
2578,סנובון מוצק דאבל אקשן בניחוח תפוז,החברה הדרומית לשיווק בעמ,יח`,,1,19.90,19.90
2579,סנו מקסימה מרכך 1 ליטר blue blossom,החברה הדרומית לשיווק בעמ,יח`,,1,17.90,1.79
2580,מקסימה מרכך כביסה סופט סילק סנו (1 ליטר),החברה הדרומית לשיווק בעמ,יח`,,1,17.90,1.79
2581,כיף פיות קרם להתרת קשרים 350מל,החברה הדרומית לשיווק בעמ,יח`,,1,14.90,4.26
