,ItemName,ManufactureName,UnitQty,Quantity,QtyInPackage,ItemPrice,UnitOfMeasurePrice
930,מיקס דובדבן חמוץ מוקפאים 300 גר סנפרוסט,תנובה קפואים,יח`,,1,15.90,5.30
931,לקט לפשטידה 800 גר` סנפרוסט,תנובה קפואים,יח`,,1,20.90,2.61
932,גרעיני תירס מוקפאים סנפרוסט (800 גרם),תנובה קפואים,יח`,,1,17.90,2.24
933,גזר גמדי מוקפא סנפרוסט (800 גרם),תנובה קפואים,יח`,,1,17.90,2.24
934,שעועית ירוקה חתוכה סנפרוסט (800 גרם),תנובה קפואים,יח`,,1,19.90,2.49
935,שעועית צהובה 800 גר` סנפרוסט,תנובה קפואים,יח`,,1,19.90,2.49
936,עלי תרד סנפרוסט (800 גרם),תנובה קפואים,יח`,,1,26,3.25
937,מדליוני תרד סנפרוסט (800 גרם),תנובה קפואים,יח`,,1,26,3.25
938,שעועית לבנה מבושלת סנפרוסט (800 גרם),תנובה קפואים,יח`,,1,19.90,2.49
939,גרגרי חומוס מבושלים סנפרוסט (800 גרם),תנובה קפואים,יח`,,1,19.90,2.49
940,קלחוני תירס 1 קג סנפרוסט,תנובה קפואים,יח`,,1,21,21
941,לקט אפונה וגזר מוקפאים סנפרוסט (800 גרם),תנובה קפואים,יח`,,1,16.90,2.11
942,לקט נורמנדי מוקפא סנפרוסט (800 גרם),תנובה קפואים,יח`,,1,16.90,2.11
943,תחתיות ארטישוק סנפרוסט (400 גרם),תנובה קפואים,יח`,,1,22.90,5.73
944,ברוקולי סנפרוסט (800 גרם),תנובה קפואים,יח`,,1,24.90,3.11
945,כיפלי 70 גר` גריל,יוניליוור ישראל שיווק בעמ,יח`,,1,5.90,8.43
946,כיפלי חטיף בטעם בצל מהדרין תלמה (70 גרם),יוניליוור ישראל שיווק בעמ,יח`,,1,5.90,8.43
947,מרק עוף אמיתי בשרי קנור (400 גרם),יוניליוור ישראל שיווק בעמ,יח`,,1,25.90,6.48
948,כיפלי צ`יפסים מהדרין תלמה (50 גרם),יוניליוור ישראל שיווק בעמ,יח`,,1,5.90,11.80
949,כיפלי צ`יפסים קטשופ תלמה (50 גרם),יוניליוור ישראל שיווק בעמ,יח`,,1,5.90,11.80
950,ניקוי כללי אורנים פנטסטיק סיף (4 ליטר),יוניליוור ישראל שיווק בעמ,יח`,,1,24.90,0.62
951,מרק דגש זך טעם עוף קנור (1 קג),יוניליוור ישראל שיווק בעמ,יח`,,1,17.90,1.79
952,רוטב ברביקיו קנור (300 מל),יוניליוור ישראל שיווק בעמ,יח`,,1,12.90,6.45
953,רוטב צ`ילי מתוק קנור (300 מל),יוניליוור ישראל שיווק בעמ,יח`,,1,12.90,3.79
954,מיונז אמיתי הלמנס (394 גרם),יוניליוור ישראל שיווק בעמ,יח`,,1,12.90,2.98
955,מיונז לייט הלמנס (424 גרם),יוניליוור ישראל שיווק בעמ,יח`,,1,12.90,2.71
956,גבינה חתול 120ג,נטו מלינדה סחר בעמ,יח`,,1,10.90,9.08
957,מון בלאן שויצרית,נטו מלינדה סחר בעמ,יח`,,1,11.60,9.67
958,מון בלאן זיתים,נטו מלינדה סחר בעמ,יח`,,1,12.60,10.50
959,מון בלאן סלמון,נטו מלינדה סחר בעמ,יח`,,1,13.90,11.58
960,פתית בצל תלמה (250 גרם),יוניליוור ישראל שיווק בעמ,יח`,,1,17.90,7.16
961,רוטב סצ`ואן קנור (300 מל),יוניליוור ישראל שיווק בעמ,יח`,,1,12.90,4.30
962,שוקולד מריר פרווה ורד הגליל (100x6 גרם),יוניליוור ישראל שיווק בעמ,יח`,,1,22.90,3.82
963,תיבולית עישבי תיבול קנור,יוניליוור ישראל שיווק בעמ,יח`,,1,9.90,13.75
964,מש.שיניים אורביטול שלישיה,החברה הדרומית לשיווק בעמ,יח`,,1,19.90,4.57
965,סנו דואופרש מבושם,החברה הדרומית לשיווק בעמ,יח`,,1,13.90,4.63
966,קינמון טחון 50 גר`,תבליני טעם וריח בעמ,יח`,,1,5.90,11.80
967,עלי דפנה 20 גר`,תבליני טעם וריח בעמ,יח`,,1,5.90,29.50
968,משקה אנרגיה תפוח אקסל (250 מל)TNX,טמפו משקאות בעמ,יח`,,1,4.50,1.68
969,משקה אנרגיה מנגו אקסל (250 מל) TEN,טמפו משקאות בעמ,יח`,,1,4.50,1.68
970,משקה אנרגיה אקסל נענע ליים (250 מל),טמפו משקאות בעמ,יח`,,1,4.50,1.68
971,סודה אפרסק 1.5 ליטר רביעייה נגיעות,טמפו משקאות בעמ,יח`,,1,10.90,10.90
972,משקה קל דיאט תפוזים ג`אמפ (1.5 ליטר),טמפו משקאות בעמ,יח`,,1,5.50,0.37
973,משקה קל תפוזים ג`אמפ (1.5 ליטר),טמפו משקאות בעמ,יח`,,1,5.50,0.37
974,משקה קל אשכוליות ג`אמפ (1.5 ליטר),טמפו משקאות בעמ,יח`,,1,5.50,0.37
975,משקה קל תות בננה ג`אמפ (1.5 ליטר),טמפו משקאות בעמ,יח`,,1,5.50,0.37
976,קרמיסימו גלידונית 60 יח`,גלידות שטראוס בעמ,יח`,,1,47.90,6.84
977,מאגדת-טעמקור 8 יח`,גלידות שטראוס בעמ,יח`,,1,37.90,37.90
978,שמן זית כתית מעולה 750 מל עץ הזית,שמן תעשיות בעמ,יח`,,1,34.90,4.65
979,משחת שיניים טום וג`רי 60 גר`,הנקל סוד בעמ,יח`,,1,8.90,14.83
980,משחת שיניים לילדים טום וג`רי (50 מל),הנקל סוד בעמ,יח`,,1,8.90,14.83
981,קשיו מטוגן שקית 200 גר,ליימן שליסל בעמ,יח`,,1,19.90,9.95
982,גרעיני חמניה 200 גר`,ליימן שליסל בעמ,יח`,,1,6.90,3.45
983,סבון מוצק לתינוק נקה 7 (100x4 גרם),החברה הדרומית לשיווק בעמ,יח`,,1,11.90,2.98
984,שניצל ביתי עם שומשום קופצני 700 גר` עוף,קבוצת אסם סחר שות. מוגבלת,יח`,,1,43.90,6.27
985,שניצל עוף מיני דיזוזאור 700 גר` עוף טוב,קבוצת אסם סחר שות. מוגבלת,יח`,,1,34.90,4.99
986,שניצל עוף דקיק ענקיסטי 700 עוף טוב,קבוצת אסם סחר שות. מוגבלת,יח`,,1,35.90,5.13
987,שניצל עוף דקיק עם צ`יפס שמח 700 גר` עוף,קבוצת אסם סחר שות. מוגבלת,יח`,,1,35.90,5.13
988,שניצל ביתי עדין כזה 700 גר` עוף טוב,קבוצת אסם סחר שות. מוגבלת,יח`,,1,43.90,6.27
989,שניצל עוף מיני דובונים 700 גר` עוף טוב,קבוצת אסם סחר שות. מוגבלת,יח`,,1,35.90,5.13
990,שניצל עוף ביתי קריספי 700 גר` עוף טוב,קבוצת אסם סחר שות. מוגבלת,יח`,,1,43.90,6.27
991,חזה עוף בתיבול 500 גר` BBQ עוף טוב,קבוצת אסם סחר שות. מוגבלת,יח`,,1,39.90,7.98
992,קליק בארים אין אאוט נוגט,יוניליוור ישראל שיווק בעמ,יח`,,1,4.90,12.89
993,קליק בארים אין אאוט קרם חלבי,יוניליוור ישראל שיווק בעמ,יח`,,1,4.90,12.89
994,רוטב לסלט חרדל ודבש לייט הלמנס (305 גרם),יוניליוור ישראל שיווק בעמ,יח`,,1,12.90,4.23
995,בדין אקסטרא 960 מרוכז בייבי בדין,יוניליוור ישראל שיווק בעמ,יח`,,1,16.90,1.76
996,מרכך מרכך לטיפול בשמני הזנה 400מל,יוניליוור ישראל שיווק בעמ,יח`,,1,15.90,3.98
997,קרם קרקר 210 גר`,יוניליוור ישראל שיווק בעמ,יח`,,1,8.90,4.24
998,פינוק תחליב רחצה ילדים 700 מל קמומיל,יוניליוור ישראל שיווק בעמ,יח`,,1,12.90,1.84
999,פינוק שמפו שמן אבוקדו 700 מל,יוניליוור ישראל שיווק בעמ,יח`,,1,12.90,1.84
1000,פינוק מרכך שמן אבוקדו (700  מל),יוניליוור ישראל שיווק בעמ,יח`,,1,12.90,1.84
1001,סיף פנטסטיק 4 ליטר כללי יסמין,יוניליוור ישראל שיווק בעמ,יח`,,1,24.90,0.62
1002,ברנפלקס קרנצ`ים 375 גר` בדצ,יוניליוור ישראל שיווק בעמ,יח`,,1,22.90,6.11
1003,שמפו מועשר בשמן מרוקאי פינוק (700 מל),יוניליוור ישראל שיווק בעמ,יח`,,1,12.90,1.84
1004,מרכך מועשר בשמן מרוקאי פינוק (700 מל),יוניליוור ישראל שיווק בעמ,יח`,,1,12.90,1.84
1005,פינוק תחליב רחצה 700 מל,יוניליוור ישראל שיווק בעמ,יח`,,1,12.90,1.84
1006,רוטב קנור סויה בסגנון סיני,יוניליוור ישראל שיווק בעמ,יח`,,1,12.90,4.30
1007,עוגי מופחת סוכר 500גר,יוניליוור ישראל שיווק בעמ,יח`,,1,18.90,3.78
1008,שוקולד פרה חלב עלית (100 גרם),שטראוס גרופ בעמ,יח`,,1,4.90,4.90
1009,שוקולד פרה מריר פרווה עלית (100 גרם),שטראוס גרופ בעמ,יח`,,1,4.90,4.90
1010,טבלאות פרה במילוי קרם נוגט,שטראוס גרופ בעמ,יח`,,1,4.90,4.90
1011,חטיף כיף כף עלית (45 גרם),שטראוס גרופ בעמ,יח`,,1,3.90,8.67
1012,שוקולד פרה לבן עלית (100 גרם),שטראוס גרופ בעמ,יח`,,1,4.90,4.90
1013,חטיף צ`יפס בטעם טבעי תפוצ`יפס (200 גרם),שטראוס פריטו ליי בעמ,יח`,,1,10.90,5.45
1014,שוקולד פרה מריר עם אגוזים עלית (100 גרם),שטראוס גרופ בעמ,יח`,,1,4.90,4.90
1015,ביסקוויט עד חצות חלבי 200 גר`,שטראוס גרופ בעמ,יח`,,1,13.90,6.95
1016,כריות קרצוף חתוכות ניקול (12),קימברלי קלארק ישראל שיווק בעמ,יח`,,1,10.90,10.90
1017,ממחטות אולטרה סופט קלינקס (80x2),קימברלי קלארק ישראל שיווק בעמ,יח`,,1,19.90,5.10
1018,מגבת נייר ניקול (6),קימברלי קלארק ישראל שיווק בעמ,יח`,,1,11.90,11.90
1019,מגבונים לחים בבישום עדין טיטולים (72x4),קימברלי קלארק ישראל שיווק בעמ,יח`,,1,19.90,19.90
1020,ניקול תבניות מלבנית חזקה ועבה,קימברלי קלארק ישראל שיווק בעמ,יח`,,1,9.90,9.90
1021,אשפתון 40,קימברלי קלארק ישראל שיווק בעמ,יח`,,1,20.90,0.52
1022,מטליות לחות לניקוי כללי ניקול (50),קימברלי קלארק ישראל שיווק בעמ,יח`,,1,11.90,11.90
1023,מטליות לחות לניקוי רצפה ניקול (10),קימברלי קלארק ישראל שיווק בעמ,יח`,,1,13.90,13.90
1024,מפיות אירוח לילי סטייל ניקול (20),קימברלי קלארק ישראל שיווק בעמ,יח`,,1,8.90,8.73
1025,מטליות לניקוי וחיטוי ניקול,קימברלי קלארק ישראל שיווק בעמ,יח`,,1,11.90,11.90
1026,מפיות מודפסות ניקול (85x2),קימברלי קלארק ישראל שיווק בעמ,יח`,,1,12.90,12.90
1027,ממחטות אף קלינקס (90x3),קימברלי קלארק ישראל שיווק בעמ,יח`,,1,10.90,10.90
1028,מגן תחתון לילי (50),קימברלי קלארק ישראל שיווק בעמ,יח`,,1,10.90,10.90
1029,תחבושות נובה-לי לילי (28),קימברלי קלארק ישראל שיווק בעמ,יח`,,1,10.90,10.90
1030,תח` לילי נטורל לילה,קימברלי קלארק ישראל שיווק בעמ,יח`,,1,18.90,18.90
1031,מגן תחתון נטורל נורמל לילי (60),קימברלי קלארק ישראל שיווק בעמ,יח`,,1,18.90,18.90
1032,מגן תחתון נטורל לונג לילי (52),קימברלי קלארק ישראל שיווק בעמ,יח`,,1,18.90,18.90
1033,מגן תחתון נטורל לייט לילי (62),קימברלי קלארק ישראל שיווק בעמ,יח`,,1,18.90,18.90
1034,תחבושות נורמל עם כנפיים לילי (24),קימברלי קלארק ישראל שיווק בעמ,יח`,,1,17.90,17.90
1035,תחבושות נטורל סופר עם כנפיים לילי (24),קימברלי קלארק ישראל שיווק בעמ,יח`,,1,17.90,17.90
1036,תחבושות לילי נטו,קימברלי קלארק ישראל שיווק בעמ,יח`,,1,17.90,17.90
1037,שקיות מזון גדולות עם ידית ניקול (200),קימברלי קלארק ישראל שיווק בעמ,יח`,,1,13.90,13.90
1038,מגבוני האגיס רביעייה ללא בישום,קימברלי קלארק ישראל שיווק בעמ,יח`,,1,19.90,19.90
1039,מגבונים לחים מבושמים האגיס (72x4),קימברלי קלארק ישראל שיווק בעמ,יח`,,1,19.90,19.90
1040,מגבוני האגיס רביעייה,קימברלי קלארק ישראל שיווק בעמ,יח`,,1,19.90,19.90
1041,מפת שולחן 110*180 סמ ניקול (2),קימברלי קלארק ישראל שיווק בעמ,יח`,,1,11.90,4.76
1042,ניילונית 150 מ,קימברלי קלארק ישראל שיווק בעמ,יח`,,1,36.90,0.25
1043,ניקול-רדיד אלומיניום זוג 45,קימברלי קלארק ישראל שיווק בעמ,יח`,,1,19.90,19.90
1044,חיתולי פרידום דריי שלב 3 האגיס (52),קימברלי קלארק ישראל שיווק בעמ,יח`,,1,39.90,39.90
1045,חיתולי פרידום דריי שלב 4 האגיס (44),קימברלי קלארק ישראל שיווק בעמ,יח`,,1,39.90,39.90
1046,חיתולי פרידום דריי שלב +4 האגיס (40),קימברלי קלארק ישראל שיווק בעמ,יח`,,1,39.90,39.90
1047,חיתולי פרידום דריי שלב 5 האגיס (36),קימברלי קלארק ישראל שיווק בעמ,יח`,,1,39.90,39.90
1048,חיתולי פרידום דריי שלב 6 האגיס (30),קימברלי קלארק ישראל שיווק בעמ,יח`,,1,39.90,39.90
1049,תחבושות קוטקס יאנג,קימברלי קלארק ישראל שיווק בעמ,יח`,,1,19.90,19.90
1050,טיטולי פרימיום שלב 2 (52יח),קימברלי קלארק ישראל שיווק בעמ,יח`,,1,39.90,39.90
1051,חיתולי פרימיום שלב 3 טיטולים (50),קימברלי קלארק ישראל שיווק בעמ,יח`,,1,39.90,39.90
1052,חיתולי פרימיום שלב 4 טיטולים (40),קימברלי קלארק ישראל שיווק בעמ,יח`,,1,39.90,39.90
1053,חיתולי פרימיום שלב 4+ טיטולים (38),קימברלי קלארק ישראל שיווק בעמ,יח`,,1,39.90,39.90
1054,חיתולי פרימיום שלב 5 טיטולים (34),קימברלי קלארק ישראל שיווק בעמ,יח`,,1,39.90,39.90
1055,חיתולי פרימיום שלב 6 טיטולים (30),קימברלי קלארק ישראל שיווק בעמ,יח`,,1,39.90,39.90
1056,כריות קרצוף סקוטש ניקול (3),קימברלי קלארק ישראל שיווק בעמ,יח`,,1,11.90,3.97
1057,כרית יפנית רביעייה ניקול,קימברלי קלארק ישראל שיווק בעמ,יח`,,1,11.90,2.98
1058,כריות יפניות ניקול (6),קימברלי קלארק ישראל שיווק בעמ,יח`,,1,11.90,1.98
1059,ניקול מטליות רצפה רביעיה,קימברלי קלארק ישראל שיווק בעמ,יח`,,1,12.90,3.23
1060,מטליות רב שימושיות לניקיון ניקול (9),קימברלי קלארק ישראל שיווק בעמ,יח`,,1,11.90,1.32
1061,מטליות לחות לרצפה בריח לימון 10 יח,קימברלי קלארק ישראל שיווק בעמ,יח`,,1,13.90,13.90
1062,ספוגית הקסם המקורית ניקול (6),קימברלי קלארק ישראל שיווק בעמ,יח`,,1,10.90,1.82
1063,פסגה לרצפה 2 ליטר,החברה הדרומית לשיווק בעמ,יח`,,1,11.90,5.95
1064,האגיס חיתולי אקסטרה קר 3 48 יח,קימברלי קלארק ישראל שיווק בעמ,יח`,,1,44.90,44.90
1065,האגיס חיתולי אקסטרה קר 40 יח,קימברלי קלארק ישראל שיווק בעמ,יח`,,1,44.90,44.90
1066,רוטב עגבניות 22% יכין (100 גרם),זנלכל בעמ,יח`,,1,1.90,1.90
1067,עגב` קוביות,זנלכל בעמ,יח`,,1,6.90,0.86
1068,עגבניות מרוסקות יכין (800 גרם),זנלכל בעמ,יח`,,1,6.90,0.86
1069,סירופ דיאט בטעם ענבים יכין (1 ליטר),זנלכל בעמ,יח`,,1,7.90,0.79
1070,גרעיני תירס מתוק יכין (550 גרם),זנלכל בעמ,יח`,,1,5.90,1.07
1071,רוטב עגבניות 22% יכין (260 גרם),זנלכל בעמ,יח`,,1,3.50,1.35
1072,עגבניות מרוסקות עם שום יכין (800 גרם),זנלכל בעמ,יח`,,1,6.90,0.86
1073,עגבניות מרוסקות עם בצל יכין (800 גרם),זנלכל בעמ,יח`,,1,6.90,0.86
1074,עגב. מרוסקות בזיליקום (800 גרם),זנלכל בעמ,יח`,,1,6.90,0.86
1075,חומוס שלם יכין (550 גרם),זנלכל בעמ,יח`,,1,5.90,1.07
1076,רוטב לימון משומר לתיבול יכין (1 ליטר),זנלכל בעמ,יח`,,1,7.90,0.79
1077,סירופ דיאט בטעם לימון יכין (1 ליטר),זנלכל בעמ,יח`,,1,7.90,0.79
1078,סירופ דיאט בטעם פטל יכין (1 ליטר),זנלכל בעמ,יח`,,1,7.90,0.79
1079,סירופ 1 ליטר דיאט אשכולית,זנלכל בעמ,יח`,,1,7.90,0.79
1080,סירופ 1 ליטר דיאט תפוחים,זנלכל בעמ,יח`,,1,7.90,0.79
1081,סירופ דיאט בטעם אננס יכין (1 ליטר),זנלכל בעמ,יח`,,1,7.90,0.79
1082,עגבניות שלמות מקולפות יכין (800 גרם),זנלכל בעמ,יח`,,1,6.90,0.86
1083,אורז בסגנון תאילנדי סוגת (1 קג),סוגת תעשיות בעמ,יח`,,1,7.90,0.79
1084,קמח חיטה מלא סוגת (1 קג),סוגת תעשיות בעמ,יח`,,1,8.90,0.89
1085,בצק עלים צרפתי מרודד מעדנות (1 קג),תנובה קפואים,יח`,,1,21.90,2.19
1086,מלווח מעדנות (6 יח` - 700 גרם),תנובה קפואים,יח`,,1,16.90,2.41
1087,בורקס גבינה מעדנות,תנובה קפואים,יח`,,1,20.90,2.61
1088,בורקס תפוא מעדנות,תנובה קפואים,יח`,,1,19.90,2.49
1089,ריבועי בצק עלים מעדנות,תנובה קפואים,יח`,,1,25,3.13
1090,קרם ידיים ולוטה (80 גרם),הנקל סוד בעמ,יח`,,1,10.90,13.63
1091,מרכך כביסה בייבי סוד (4 ליטר),גורי שיווק בעמ,יח`,,1,17.90,0.45
1092,מרכך כביסה סוד סופט 4 ליטר סגול,גורי שיווק בעמ,יח`,,1,17.90,0.45
1093,מרכך כביסה סוד סופט 4 ליטר לבן,גורי שיווק בעמ,יח`,,1,17.90,0.45
1094,מרכך כביסה ורוד סוד (4 ליטר),גורי שיווק בעמ,יח`,,1,17.90,0.45
1095,מרכך כביסה כחול סוד (4 ליטר),גורי שיווק בעמ,יח`,,1,17.90,0.45
1096,האגיס חיתולי אקסטרה קר מידה 5 34,קימברלי קלארק ישראל שיווק בעמ,יח`,,1,44.90,44.90
1097,מגבונים ללא בישום פרימיום טיטולים (72x4),קימברלי קלארק ישראל שיווק בעמ,יח`,,1,19.90,19.90
1098,זוג רדי אלומניום עם הטבעה,קימברלי קלארק ישראל שיווק בעמ,יח`,,1,9.90,9.90
1099,חומוסטחינה צנובר צבר (400 גרם),קבוצת אסם סחר שות. מוגבלת,יח`,,1,13.90,3.48
1100,מי סודה שוופס (1.5 ליטר),יפאורה,יח`,,1,3.50,0.23
1101,מטלית לכל סנו סושי (9),החברה הדרומית לשיווק בעמ,יח`,,1,11.90,1.32
1102,ניילון נצמד סנו סושי (30x2 מטר),החברה הדרומית לשיווק בעמ,יח`,,1,10.90,10.90
1103,קל רסס וכבס סנו (750 מל),החברה הדרומית לשיווק בעמ,יח`,,1,19.90,3.32
1104,שמפו שטיחים ספריי סנו (600 מל),החברה הדרומית לשיווק בעמ,יח`,,1,23.90,3.98
1105,תרסיס רהיט סנו (300 מל),החברה הדרומית לשיווק בעמ,יח`,,1,16.90,5.54
1106,סופר פוליש נוזל לרצפה סנו (1 ליטר),החברה הדרומית לשיווק בעמ,יח`,,1,33.90,33.90
1107,סנובון תות לאסלה סנו (55x3 גרם),החברה הדרומית לשיווק בעמ,יח`,,1,11.90,7.21
1108,סנובון לאסלה לימון סנו (55x3 גרם),החברה הדרומית לשיווק בעמ,יח`,,1,11.90,7.21
1109,סנובון לאסלה לובר סנו (55x3 גרם),החברה הדרומית לשיווק בעמ,יח`,,1,11.90,7.21
1110,ז`אוול מרסס לניקוי כללי לבנדר סנו (1 ליט,החברה הדרומית לשיווק בעמ,יח`,,1,19.90,19.90
1111,קוטל מעופפים קיי 400 סנו (630 מל),החברה הדרומית לשיווק בעמ,יח`,,1,25,6.25
1112,קוטל חרקים קיי 300 סנו (630 מל),החברה הדרומית לשיווק בעמ,יח`,,1,21.90,3.48
1113,K500,החברה הדרומית לשיווק בעמ,יח`,,1,26,6.42
1114,סנו-די דוחה יתושים כדורי סנו (50 מל),החברה הדרומית לשיווק בעמ,יח`,,1,20.90,41.80
1115,סנו די תרסיס,החברה הדרומית לשיווק בעמ,יח`,,1,20.90,16.72
1116,סנו די נוזל+משאבה,החברה הדרומית לשיווק בעמ,יח`,,1,22.90,45.80
1117,מסיר שומנים ז`אוול קר,החברה הדרומית לשיווק בעמ,יח`,,1,19.90,2.65
1118,סנו ז`אוול מרסס 1 ליטר,החברה הדרומית לשיווק בעמ,יח`,,1,19.90,19.90
1119,מסיר שומנים פורטה פלוס סנו (750 מל),החברה הדרומית לשיווק בעמ,יח`,,1,16.90,2.25
1120,פוליויקס 2 ליטר,החברה הדרומית לשיווק בעמ,יח`,,1,22.90,11.45
1121,סנובון לאסלה קלאסיק כחול סנו (55x3 גרם),החברה הדרומית לשיווק בעמ,יח`,,1,18.90,11.45
1122,רסס ונגב לניקוי כללי תרסיס סנו (750 מל),החברה הדרומית לשיווק בעמ,יח`,,1,17.90,2.98
1123,סנוג`ט יכול הכל סחלבים סנו (4 ליטר),החברה הדרומית לשיווק בעמ,יח`,,1,19.90,4.98
1124,סנומוד מדונה,החברה הדרומית לשיווק בעמ,יח`,,1,11.90,7.93
1125,מטלית ריצפה זיגזג סנו סושי (3),החברה הדרומית לשיווק בעמ,יח`,,1,12.90,12.90
1126,כרית יפנית לכלים אקטיב סנו סושי (4),החברה הדרומית לשיווק בעמ,יח`,,1,11.90,11.90
1127,שקיות אשפה לפח 65x54 סנו סושי (60),החברה הדרומית לשיווק בעמ,יח`,,1,22.90,22.90
1128,אטבי כביסה איכות סנו (20),החברה הדרומית לשיווק בעמ,יח`,,1,9.90,9.90
1129,רב מגבת ג`מבו סנו סושי,החברה הדרומית לשיווק בעמ,יח`,,1,24.90,6.38
1130,סושי רדיד אלומיניום צמד,החברה הדרומית לשיווק בעמ,יח`,,1,12.90,12.90
1131,חטיפי כרובית בציפוי פריך טבעול (500 גרם),קבוצת אסם סחר שות. מוגבלת,יח`,,1,31.90,6.38
1132,פול מצרי 560 גר,ויטה -פרי גליל (החדשה) בעמ,יח`,,1,4.90,0.88
1133,שעועית לבנה אפויה,ויטה -פרי גליל (החדשה) בעמ,יח`,,1,5.90,1.07
1134,חומוס שלם A2,ויטה -פרי גליל (החדשה) בעמ,יח`,,1,5.90,0.98
1135,אפונה גדולה A2,ויטה -פרי גליל (החדשה) בעמ,יח`,,1,5.90,0.98
1136,אפונה וגזר A2,ויטה -פרי גליל (החדשה) בעמ,יח`,,1,5.90,1.07
1137,תירס גרעינים 550 גר`,ויטה -פרי גליל (החדשה) בעמ,יח`,,1,5.90,1.07
1138,ופלים מצופים מן (22x10 גרם),רוקחמן בעמ,יח`,,1,7.90,3.95
1139,חומוסטחינה פלפל חריף מטוגן 400גר,קבוצת אסם סחר שות. מוגבלת,יח`,,1,13.90,3.48
1140,קבנוס קלאסי יחיעם (125 גרם),מעדני יחיעם (1993) בעמ,יח`,,1,12.90,10.32
1141,קבנוס פפרוני יחיעם (125 גרם),מעדני יחיעם (1993) בעמ,יח`,,1,12.90,10.32
1142,משקה קל דיאט אשכוליות ג`אמפ (1.5 ליטר),טמפו משקאות בעמ,יח`,,1,5.50,0.37
1143,משקה קל מנגו פסיפלורה ג`אמפ (1.5 ליטר),טמפו משקאות בעמ,יח`,,1,5.50,0.37
1144,מי סודה טמפו (1.5 ליטר),טמפו משקאות בעמ,יח`,,1,3,0.20
1145,סודה בטעם פירות יער טמפו (1.5 ליטר),טמפו משקאות בעמ,יח`,,1,4,2.67
1146,סודה בטעם אננס טמפו (1.5 ליטר),טמפו משקאות בעמ,יח`,,1,4,2.67
1147,סלמי גליל 600 גר` טירת צבי,תנובה קפואים,יח`,,1,35.90,5.98
1148,נקניקיות פיקנטיות 400 גר` טירת צבי,תנובה קפואים,יח`,,1,13.90,3.48
1149,סלסולי כתף בקר 120 גר` טירת צבי,תנובה קפואים,יח`,,1,15.90,13.25
1150,סלסולי סלמי איטלקי 120 גר` טירת צבי,תנובה קפואים,יח`,,1,15.90,13.25
1151,דקניקים סלסולי הודו טירת צבי (120 גרם),תנובה קפואים,יח`,,1,15.90,13.25
1152,סלסולי פסטרמה גחלים 120 גר` טירת צבי,תנובה קפואים,יח`,,1,15.90,13.25
1153,נקניקיות עוף טירת צבי (400 גרם),תנובה קפואים,יח`,,1,13.90,3.48
1154,צמד כפרי 800 גר` טירת צבי,תנובה קפואים,יח`,,1,34.90,4.36
