,ItemName,ManufactureName,UnitQty,Quantity,QtyInPackage,ItemPrice,UnitOfMeasurePrice
2104,מלית תות שדה 400 גר`,מימונס אפיה בעמ,יח`,,1,19.90,4.98
2105,מלית שוקולד,מימונס אפיה בעמ,יח`,,1,11.90,2.98
2106,ממרח קרם נוגט,מימונס אפיה בעמ,יח`,,1,15.90,4.54
2107,מארז 8 יח תחתיות מרנג 10 גר` מימונס,מימונס אפיה בעמ,יח`,,1,18.90,18.90
2108,תחתיות בצק פריך לאפייה ומילוי -טארטלטים,מימונס אפיה בעמ,יח`,,1,18.90,18.90
2109,סירופ בטעם קרמל מלוח 500 גר` מימונס,מימונס אפיה בעמ,יח`,,1,17.90,3.58
2110,כוכבים תכלת ירוק לבן לקישוט 60 גר` מימונ,מימונס אפיה בעמ,יח`,,1,10.90,18.17
2111,אטריות צבעוניות לקישוט 55 גר` מימונס,מימונס אפיה בעמ,יח`,,1,10.90,19.82
2112,סוכריות לב סגול לבן לקישוט 60 מימונס,מימונס אפיה בעמ,יח`,,1,10.90,18.17
2113,מיקס טרופי א.מ שרון (500 גרם),א.מ. שרון שיווק (2014) בעמ,יח`,,1,24.90,4.98
2114,דובדבן קפוא א.מ שרון (500 גרם),א.מ. שרון שיווק (2014) בעמ,יח`,,1,19.90,3.98
2115,פטל אדום א.מ שרון (500 גרם),א.מ. שרון שיווק (2014) בעמ,יח`,,1,24.90,4.98
2116,דומדמנית שחורה א.מ שרון (500 גרם),א.מ. שרון שיווק (2014) בעמ,יח`,,1,24.90,4.98
2117,מיקס פירות שדה א.מ שרון (500 גרם),א.מ. שרון שיווק (2014) בעמ,יח`,,1,24.90,4.98
2118,פטל שחור א.מ שרון (500 גרם),א.מ. שרון שיווק (2014) בעמ,יח`,,1,24.90,4.98
2119,חמוצית גן א.מ שרון (400 גרם),א.מ. שרון שיווק (2014) בעמ,יח`,,1,24.90,6.23
2120,דומדמנית אדומה 500 גרם,א.מ. שרון שיווק (2014) בעמ,יח`,,1,24.90,4.98
2121,מיקס פירות יער א.מ שרון (500 גרם),א.מ. שרון שיווק (2014) בעמ,יח`,,1,24.90,4.98
2122,תות שדה א.מ שרון (500 גרם),א.מ. שרון שיווק (2014) בעמ,יח`,,1,24.90,4.98
2123,אוכמנית א.מ שרון (400 גרם),א.מ. שרון שיווק (2014) בעמ,יח`,,1,24.90,6.23
2124,אננס קפוא 500 גר`,א.מ. שרון שיווק (2014) בעמ,יח`,,1,24.90,4.98
2125,מנגו קפוא 500 גר`,א.מ. שרון שיווק (2014) בעמ,יח`,,1,24.90,4.98
2126,מלון קפוא 500 גר`,א.מ. שרון שיווק (2014) בעמ,יח`,,1,24.90,4.98
2127,שטראוס קרמיסימו,גלידות שטראוס בעמ,יח`,,1,18.90,14.21
2128,מאגדת מיני סולרו פירות טרופי,גלידות שטראוס בעמ,יח`,,1,21.90,4.56
2129,סנו מקסימה מרכך 1 ליטר כחול פסים,החברה הדרומית לשיווק בעמ,יח`,,1,17.90,1.79
2130,סנו מקסימה מרכך 1 ליטר סגול,החברה הדרומית לשיווק בעמ,יח`,,1,17.90,1.79
2131,ריצפז פרש 2 ליטר מאסק,החברה הדרומית לשיווק בעמ,יח`,,1,21.90,10.95
2132,אוקסיג`ן ג`ל 3 ליטר,החברה הדרומית לשיווק בעמ,יח`,,1,29.90,9.97
2133,סנובון שלישיה מאסק,החברה הדרומית לשיווק בעמ,יח`,,1,11.90,6.10
2134,מקסימה מרכך סופר מרוכז ביו סנו (1 ליטר),החברה הדרומית לשיווק בעמ,יח`,,1,17.90,1.79
2135,מטליות לחות למוצרי עור סנו (20),החברה הדרומית לשיווק בעמ,יח`,,1,19.90,19.90
2136,ריצפז פרש מטליות חד פעמיות 10 יח`,החברה הדרומית לשיווק בעמ,יח`,,1,12.90,12.90
2137,ריצפז 3 ליטר פנטזיה,החברה הדרומית לשיווק בעמ,יח`,,1,17.90,5.97
2138,סנובון ג`ל בניחוח לימון,החברה הדרומית לשיווק בעמ,יח`,,1,12.90,19.85
2139,סנובון ג`ל בניחוח אוקיינוס,החברה הדרומית לשיווק בעמ,יח`,,1,12.90,19.85
2140,אורביטול מברשת שיניים פיות,החברה הדרומית לשיווק בעמ,יח`,,1,12.90,12.90
2141,מפות שולחן 120*180 סמ סנו (2),החברה הדרומית לשיווק בעמ,יח`,,1,9.90,9.90
2142,קוטל חרקים קיי 333 סנו (750 מל),החברה הדרומית לשיווק בעמ,יח`,,1,36.90,4.92
2143,קוטל מעופפים קיי פירטרום סנו (400 מל),החברה הדרומית לשיווק בעמ,יח`,,1,24.90,6.23
2144,בירה נגב אואזיס 330 מל,הכרם - משקאות חריפים בעמ,יח`,,1,13.90,4.12
2145,בירה נגב אמבר אייל 330 מל,הכרם - משקאות חריפים בעמ,יח`,,1,13.90,4.12
2146,פירורי לחם מוזהבים מאסטר שף (320גרם),ש.שסטוביץ בעמ,יח`,,1,7.90,2.47
2147,פירורי לחם פנקו מוזהבים 300 גר` מנה מאסט,ש.שסטוביץ בעמ,יח`,,1,9.90,3.30
2148,פירורי לחם פנקו מוזהבים שום 300 גר` מנה,ש.שסטוביץ בעמ,יח`,,1,9.90,3.30
2149,רוטב טריאקי מאסטר שף (300 מל),ש.שסטוביץ בעמ,יח`,,1,11.90,3.97
2150,רוטב צ`ילי מתוק מאסטר שף (700 מל),ש.שסטוביץ בעמ,יח`,,1,12.90,1.84
2151,רוטב צ`ילי חריף מאסטר שף (700 מל),ש.שסטוביץ בעמ,יח`,,1,12.90,1.84
2152,חצאי אפרסקים 820 גר` מהדרין,ג.וילי-פוד אינטרנשיונל בעמ,יח`,,1,7.90,0.96
2153,סירופ 1 ליטר דיאט לימונענע,זנלכל בעמ,יח`,,1,7.90,0.79
2154,פחית דיאט ספרייט 330 מל,החברה המרכזית להפצת משקאות בעמ,יח`,,1,4.50,1.27
2155,משקה קל לימונענע פריגת (1.5 ליטר),החברה המרכזית להפצת משקאות בעמ,יח`,,1,7.20,0.48
2156,ספרייט זירו 330 מל סילק,החברה המרכזית להפצת משקאות בעמ,יח`,,1,4.50,1.27
2157,מארז מיוחד בירה קרלסברג (330x6 מל),החברה המרכזית להפצת משקאות בעמ,יח`,,1,36.90,1.77
2158,מארז סודה קינלי 1.5 ליטר שישייה,החברה המרכזית להפצת משקאות בעמ,יח`,,1,19.90,0.22
2159,מארז ספרייט 6 פחיות FRIDGE PACK,החברה המרכזית להפצת משקאות בעמ,יח`,,1,19.90,19.90
2160,ויסוצקי ice נענע 1.5 ליטר,החברה המרכזית להפצת משקאות בעמ,יח`,,1,7.90,5.27
2161,ויסוצקי ice לימונית לואיזה 1.5 ליטר,החברה המרכזית להפצת משקאות בעמ,יח`,,1,7.90,5.27
2162,ויסוצקי ice היביסקוס פ.אדומים 1.5 ליטר,החברה המרכזית להפצת משקאות בעמ,יח`,,1,7.90,5.27
2163,ויסוצקי ice ארל גריי 1.5 ליטר,החברה המרכזית להפצת משקאות בעמ,יח`,,1,7.90,5.27
2164,מיץ רימונים סחוט פרימור (1 ליטר),שטראוס גרופ בעמ/מצונן,יח`,,1,23.20,23.20
2165,מיץ תפוזים אורגני 750 מל פרימור 100%,שטראוס גרופ בעמ/מצונן,יח`,,1,14.90,14.90
2166,מיץ אשכולית אדומה אורגני 750 מל,שטראוס גרופ בעמ/מצונן,יח`,,1,14.90,14.90
2167,שניצל אותיות מאמא עוף (700 גרם),תנובה קפואים,יח`,,1,34.90,4.99
2168,שניצל כלי תחבורה מאמא עוף (700 גרם),תנובה קפואים,יח`,,1,34.90,4.99
2169,פסטה א-לה רומר להקפצה 450 גר` מאמא עוף,תנובה קפואים,יח`,,1,19.90,4.42
2170,חגיגה אסייתית להקפצה 450 גר` מאמא עוף,תנובה קפואים,יח`,,1,19.90,4.42
2171,ירוק גלילי להקפצה 450 גר` מאמא עוף,תנובה קפואים,יח`,,1,19.90,4.42
2172,אבקת שוקו 500 גר`,מיה תעשיות מזון מ.ת.מ. בעמ,יח`,,1,6.90,1.38
2173,מים בטעם פירות יער שוופס (1.5 ליטר),יפאורה,יח`,,1,6.30,0.42
2174,מים בטעם אפרסק שוופס (1.5 ליטר),יפאורה,יח`,,1,6.30,0.42
2175,שוופס ווטר אפרסק 500מל,יפאורה,יח`,,1,4.80,0.90
2176,מים בטעם ענבים שוופס (1.5 ליטר),יפאורה,יח`,,1,6.30,0.42
2177,שוופס ווטר ענבים 500מל,יפאורה,יח`,,1,4.80,0.90
2178,מים בטעם תפוח שוופס (1.5 ליטר),יפאורה,יח`,,1,6.30,0.42
2179,שוופס ווטר תפוח 500מל,יפאורה,יח`,,1,4.80,0.90
2180,משקה מוגז לימונייד שוופס (1.5 ליטר),יפאורה,יח`,,1,6.90,0.46
2181,משקה מוגז לימונדה ורודה שוופס (1.5 ליטר),יפאורה,יח`,,1,6.90,0.46
2182,משקה מוגז למון ליים שוופס (1.5 ליטר),יפאורה,יח`,,1,6.90,0.46
2183,שוופס דיאט למון ליים 1.5 ל`,יפאורה,יח`,,1,6.90,0.46
2184,שוופס מוגז עדין 1.5 ליטר אננס,יפאורה,יח`,,1,6.90,0.46
2185,שישיית שוופס למון ליים 1.5 ל`,יפאורה,יח`,,1,34.90,34.90
2186,שישיית שוופס דיאט למון ליים 1.5 ל`,יפאורה,יח`,,1,34.90,34.90
2187,משקה פירות בטעם גווארנה שוופס (1.5 ליטר),יפאורה,יח`,,1,6.90,4.60
2188,בירה ג`מס בקבוק פילס 330 מל,יורוסטנדרט בעמ,יח`,,1,12.90,3.82
2189,בירה ג`מס בקבוק חיטה 330 מל,יורוסטנדרט בעמ,יח`,,1,12.90,3.82
2190,בירה ג`מס בקבוק 8.80% אלכוהול ( 330 מל),יורוסטנדרט בעמ,יח`,,1,12.90,3.82
2191,משוקלדים חמוציות מריר 160 גר` בקופסא,דין שיווק וקליה בעמ,יח`,,1,11.90,7.44
2192,משוקלדים פקאן מריר 160 גר` בקופסא,דין שיווק וקליה בעמ,יח`,,1,11.90,7.44
2193,משוקלדים חמוציות חלב 160 גר` בקופסא,דין שיווק וקליה בעמ,יח`,,1,11.90,7.44
2194,משוקלדים שקד חלב 160 גר` בקופסא,דין שיווק וקליה בעמ,יח`,,1,11.90,7.44
2195,משוקלדים צימוק מריר 160 גר` בקופסא,דין שיווק וקליה בעמ,יח`,,1,11.90,7.44
2196,משוקלדים בוטן מריר 160 גר` בקופסא,דין שיווק וקליה בעמ,יח`,,1,11.90,7.44
2197,משוקלדים לוז חלב 160 גר` בקופסא,דין שיווק וקליה בעמ,יח`,,1,11.90,7.44
2198,משוקלדים לוז מריר 160 גר` בקופסא,דין שיווק וקליה בעמ,יח`,,1,11.90,7.44
2199,משוקלדים שומשום חלב 160 גר` בקופסא,דין שיווק וקליה בעמ,יח`,,1,11.90,7.44
2200,משוקלדים שומשום מריר 160 גר` בקופסא,דין שיווק וקליה בעמ,יח`,,1,11.90,7.44
2201,מגבונים לניקוי כללי סנו סושי (50),החברה הדרומית לשיווק בעמ,יח`,,1,9.90,9.90
2202,קרמה דאודורנט ספריי -קלאסי,החברה הדרומית לשיווק בעמ,יח`,,1,19.90,13.27
2203,דאודורנט ספריי מאסק קרמה (150 מל),החברה הדרומית לשיווק בעמ,יח`,,1,19.90,13.27
2204,קרמה דאודורנט ספריי -אורכידאה,החברה הדרומית לשיווק בעמ,יח`,,1,19.90,13.27
2205,משוקלדים צימוק חלב 160 גר` בקופסא,דין שיווק וקליה בעמ,יח`,,1,11.90,7.44
2206,משוקלדים בוטן חלב 160 גר` בקופסא,דין שיווק וקליה בעמ,יח`,,1,11.90,7.44
2207,נקניקיות פרגיות 300 גר` טירת צבי,תנובה קפואים,יח`,,1,13.90,4.63
2208,פסטרמה שום וצילי טירת צבי (400 גרם),תנובה קפואים,יח`,,1,31.90,7.98
2209,נקניקיות וינר 1 קג` טירת צבי,תנובה קפואים,יח`,,1,32.90,6.58
2210,סלמי גלבוע 400 גר` טירת צבי,תנובה קפואים,יח`,,1,23.90,5.98
2211,קבנוס 120 גר` טירת צבי,תנובה קפואים,יח`,,1,11.90,9.92
2212,קבנוס 120 גר` פיקנטי טירת צבי,תנובה קפואים,יח`,,1,11.90,9.92
2213,חטיפי קבנוס 120 גר` טירת צבי,תנובה קפואים,יח`,,1,11.90,9.92
2214,צמד כפרי ברבקיו ודבש 600 גר טירת צבי,תנובה קפואים,יח`,,1,29.90,4.98
2215,טרין מוס כבד עוף 120 גר` תנובה,תנובה קפואים,יח`,,1,15.90,13.25
2216,סירופ בטעם ענבים מועשר בויטמינים 1 ליטר,אחדות בעמ,יח`,,1,8.50,8.50
2217,סירופ בטעם פטל מועשר בויטמינים 1 ליטר אח,אחדות בעמ,יח`,,1,8.50,8.50
2218,סירופ בטעם אננס מועשר בויטמינים 1 ליטר א,אחדות בעמ,יח`,,1,8.50,8.50
2219,ממרח טחינה עם דבש 400 גר` אחווה,אחדות בעמ,יח`,,1,11.90,2.98
2220,נשנושי קבנוס יחיעם (125 גרם),מעדני יחיעם (1993) בעמ,יח`,,1,12.90,10.32
2221,נקניקיות עוף 1.5 קג,מעדני יחיעם (1993) בעמ,יח`,,1,29.90,29.90
2222,פסטרמה ברביקיו דק דק יחיעם (140 גרם),מעדני יחיעם (1993) בעמ,יח`,,1,12.90,9.21
2223,פסטרמה בדבש דק דק יחיעם (140 גרם),מעדני יחיעם (1993) בעמ,יח`,,1,12.90,9.21
2224,פסטרמה של פעם דק דק יחיעם (140 גרם),מעדני יחיעם (1993) בעמ,יח`,,1,12.90,9.21
2225,פסטרמה מעודנת על גחלים יחיעם (300 גרם),מעדני יחיעם (1993) בעמ,יח`,,1,23.90,7.97
2226,סלמי תה יחיעם (300 גרם),מעדני יחיעם (1993) בעמ,יח`,,1,25.90,8.63
2227,סלמי פפרוני 200 גר` יחיעם,מעדני יחיעם (1993) בעמ,יח`,,1,14.90,7.45
2228,גבינת גאודה פרוסות 150 גר,ג.וילי-פוד אינטרנשיונל בעמ,יח`,,1,9.90,6.60
2229,אורז בסמטי אהרוני (1 קג),דין שיווק וקליה בעמ,יח`,,1,12.90,12.90
2230,שיבולת שועל דקה שקדיה (500 גרם),דין שיווק וקליה בעמ,יח`,,1,5.90,1.18
2231,משוקלדים שקד מריר 160 גר` בקופסא,דין שיווק וקליה בעמ,יח`,,1,11.90,7.44
2232,משוקלדים פקאן חלב 160 גר` בקופסא,דין שיווק וקליה בעמ,יח`,,1,11.90,7.44
2233,שיבולת שועל עבה שקדיה (500 גרם),דין שיווק וקליה בעמ,יח`,,1,5.90,1.18
2234,בישקוטים וניל קקאו בונומי (200 גרם),דנשר (1963) בעמ,יח`,,1,7.90,3.95
2235,מואי עוגיות קקאו ושוקלד מריר עם קרם אספר,דנשר (1963) בעמ,יח`,,1,17.90,9.94
2236,מואי עוגיות קקאו ושוקולד עם קרם ברולה,דנשר (1963) בעמ,יח`,,1,17.90,9.94
2237,אל סבון נוזלי פנינה רוזנבלום (500x3 גרם),פנינה רוזנבלום בעמ,יח`,,1,13.90,9.27
2238,גרנולה שוקולד מריר+לבן 400 גר` פנינה רוז,פנינה רוזנבלום בעמ,יח`,,1,29.90,7.48
2239,מרכך לאחר החלקה 750 מל פנינה רוזנבלום,פנינה רוזנבלום בעמ,יח`,,1,29.90,3.99
2240,שמפו לאחר החלקה 750 מל פנינה רוזנבלום,פנינה רוזנבלום בעמ,יח`,,1,29.90,3.99
2241,מסיכה לאחר החלקה 500 מל פנינה רוזנבלום,פנינה רוזנבלום בעמ,יח`,,1,34.90,6.98
2242,רוטב עוף 800 גרם,פנינה רוזנבלום בעמ,יח`,,1,17.90,2.24
2243,קריניאנו 750 מל BUZZ,אגודת הכורמים,יח`,,1,26.90,3.55
2244,מוסקטו 750 מל BUZZ,אגודת הכורמים,יח`,,1,26.90,3.55
2245,קורנפלור מיה (500 גרם),מיה תעשיות מזון מ.ת.מ. בעמ,יח`,,1,8.90,1.78
2246,שקיות מזון סנו סושי (300),החברה הדרומית לשיווק בעמ,יח`,,1,11.90,11.90
2247,מקסימה מרכך מרוכז חלב ודבש סנו (1 ליטר),החברה הדרומית לשיווק בעמ,יח`,,1,17.90,1.79
2248,סנו מקסימה מרכך 1 ליטר ורוד,החברה הדרומית לשיווק בעמ,יח`,,1,17.90,1.79
2249,אוקסיג`ן ג`ל 3 ליטר כביסה לבנה,החברה הדרומית לשיווק בעמ,יח`,,1,29.90,9.97
2250,סנופרש הום נטול גז 350 מל בניחוח בוקר א,החברה הדרומית לשיווק בעמ,יח`,,1,14.90,4.26
2251,פוליויקס 3 ליטר,החברה הדרומית לשיווק בעמ,יח`,,1,22.90,11.45
2252,סנובון ג`ל בניחוח פריחה,החברה הדרומית לשיווק בעמ,יח`,,1,12.90,12.90
2253,מנקה אסלות 00 1 ליטר ניחוח רענן,החברה הדרומית לשיווק בעמ,יח`,,1,10.90,10.90
2254,סנובון מוצק WAVE בתוספת אקונומיקה,החברה הדרומית לשיווק בעמ,יח`,,1,9.90,9.90
2255,פרוסות צ`יפס תפוגן (1.5 קג),קבוצת אסם סחר שות. מוגבלת,יח`,,1,24.90,1.66
2256,הר חרמון אינדיגו,היכל היין שקד גולן בעמ,יח`,,1,30.90,4.08
2257,הר חרמון מוסקט יקב רמת הגולן (750 מל),היכל היין שקד גולן בעמ,יח`,,1,30.90,4.08
2258,מוזלי בוטנים אגוזים ושקדים 1קג - שקדיה,דין שיווק וקליה בעמ,יח`,,1,19.90,1.99
2259,מוזלי עם פירות שקדיה (1 קג),דין שיווק וקליה בעמ,יח`,,1,19.90,1.99
2260,מוזלי צימוקים תפוח קינומון 1קג - שקדיה,דין שיווק וקליה בעמ,יח`,,1,19.90,1.99
2261,גרנולה אגוזים 1קג - שקדיה,דין שיווק וקליה בעמ,יח`,,1,19.90,1.99
2262,קונפיטוריה פטל אדום 450גר`.,דין שיווק וקליה בעמ,יח`,,1,10.90,2.42
2263,קונפיטוריה תות שדה 450 גר`,דין שיווק וקליה בעמ,יח`,,1,10.90,2.42
2264,קונפיטוריה פטל שחור 450 גר`,דין שיווק וקליה בעמ,יח`,,1,10.90,2.42
2265,קונפיטוריה משמש 450 גר` שקדיה,דין שיווק וקליה בעמ,יח`,,1,10.90,2.42
2266,יין אדום יבש יובלים יקב דלתון (750 מל),הכרם - משקאות חריפים בעמ,יח`,,1,48.90,6.48
2267,יין לבן יובלים יקב דלתון (750 מל),הכרם - משקאות חריפים בעמ,יח`,,1,48.90,6.48
2268,יין כנען רוזה יקב דלתון (750 מל),הכרם - משקאות חריפים בעמ,יח`,,1,48.90,6.48
2269,מרבה סלים פרוט בטעם יוגורט ותפוח,ש.שסטוביץ בעמ,יח`,,1,10.90,5.99
2270,מרבה סלים פרוט בטעם יוגורט ותות,ש.שסטוביץ בעמ,יח`,,1,10.90,5.99
2271,מרבה סלים פרוט בטעם פירות יער,ש.שסטוביץ בעמ,יח`,,1,10.90,5.99
2272,מרבה סלים פרוט בטעם יוגורט ופירות יער,ש.שסטוביץ בעמ,יח`,,1,10.90,9.08
2273,סלים דליס קריספי תות מרבה (125 גרם),ש.שסטוביץ בעמ,יח`,,1,10.90,9.08
2274,סלים דליס קריספי אוכמניות מרבה (125 גרם),ש.שסטוביץ בעמ,יח`,,1,10.90,8.72
2275,סלים דליס קריספי שוקולד מרבה (125 גרם),ש.שסטוביץ בעמ,יח`,,1,10.90,8.72
2276,מרבה שוקודליס בציפוי שוקולד חלב 145 גר`,ש.שסטוביץ בעמ,יח`,,1,12.90,8.90
2277,מרבה שוקודליס עו,ש.שסטוביץ בעמ,יח`,,1,12.90,7.33
2278,מרבה שוקודליס עו,ש.שסטוביץ בעמ,יח`,,1,12.90,7.33
2279,מרבה שוקודליס במילוי קרם בטעם קפוצינו 14,ש.שסטוביץ בעמ,יח`,,1,12.90,8.90
2280,לה פסטה פסטה צינור 400 גר`,תומר יבוא ושיווק מוצרי מזון (1,יח`,,1,2.50,0.63
2281,לה פסטה קונכיה 53 400 גר`,תומר יבוא ושיווק מוצרי מזון (1,יח`,,1,2.50,0.63
2282,לה פסטה פסטה פרפר 81 400 גר`,תומר יבוא ושיווק מוצרי מזון (1,יח`,,1,2.50,0.63
2283,לה פסטה פסטה בורג 64 400 גר`,תומר יבוא ושיווק מוצרי מזון (1,יח`,,1,2.50,0.63
2284,לה פסטה פסטה תלתל 65 400 גר`,תומר יבוא ושיווק מוצרי מזון (1,יח`,,1,2.50,0.63
2285,לה פסטה פסטה אטריות מרק 400 גר`,תומר יבוא ושיווק מוצרי מזון (1,יח`,,1,2.50,0.63
2286,שמן שומשום בי   די (250 מל),בטר אנד דיפרנט בעמ,יח`,,1,19.90,7.96
2287,מאגדת-מיני מגנום דאבל,גלידות שטראוס בעמ,יח`,,1,27.90,27.90
2288,שטראוס קרמיסימו סנדיי וניל,גלידות שטראוס בעמ,יח`,,1,18.90,14.21
2289,שטראוס קרמסימו מסטיגם 1.33 ליטר,גלידות שטראוס בעמ,יח`,,1,18.90,14.21
2290,פירורי לחם זהוב תבליני מימון (800 גרם),א.ל.ייצור ושיווק תבלינים בעמ,יח`,,1,16.90,2.11
2291,גבינת ברי 125 גר,ג.וילי-פוד אינטרנשיונל בעמ,יח`,,1,18.90,15.12
2292,גבינת קממבר 125 גר,ג.וילי-פוד אינטרנשיונל בעמ,יח`,,1,18.90,15.12
2293,שיני שום במי מלח 340 גרם,ג.וילי-פוד אינטרנשיונל בעמ,יח`,,1,11.90,3.50
2294,עגבניות מיובשות בשמן 340 גר,ג.וילי-פוד אינטרנשיונל בעמ,יח`,,1,11.90,3.50
2295,פתיתים מגורדת וילי פוד (500 גרם) GOLDEN,ג.וילי-פוד אינטרנשיונל בעמ,יח`,,1,21.90,4.38
2296,גבינת מוצרלה מגורדת סיי צ`יז (200 גרם),ג.וילי-פוד אינטרנשיונל בעמ,יח`,,1,13.90,6.95
2297,גבינה מוצרלה בייבי 150 גר` כפיר,צ.י תעשיות מזון יבנה בעמ,יח`,,1,13.90,9.27
2298,שניצל ביתי עם צ`יפס שמח 600 גר` עוף טוב,קבוצת אסם סחר שות. מוגבלת,יח`,,1,38.90,6.48
2299,שניצל עוף דקיק קריספי 700 גר` עוף טוב,קבוצת אסם סחר שות. מוגבלת,יח`,,1,35.90,5.13
2300,שניצל דק ענקיסטי 700 גר` עוף טוב,קבוצת אסם סחר שות. מוגבלת,יח`,,1,35.90,5.13
2301,שניצל עוף ביתי כזה 700 גר` עוף טוב,קבוצת אסם סחר שות. מוגבלת,יח`,,1,43.90,6.27
2302,שניצל עוף היער הקסום 600 גר` עוף טוב,קבוצת אסם סחר שות. מוגבלת,יח`,,1,32.90,5.48
2303,שניצל עוף ביתי שומשום 700 גר` עוף טוב,קבוצת אסם סחר שות. מוגבלת,יח`,,1,43.90,6.27
2304,שניצל עוף ביתי קריספי 700 גר` עוף טוב,קבוצת אסם סחר שות. מוגבלת,יח`,,1,43.90,6.27
2305,שניצל עוף ביתי מתובל 600 גר` עוף טוב,קבוצת אסם סחר שות. מוגבלת,יח`,,1,37.90,6.32
2306,שניצל עוף ביתי עדין כזה 700 גר` עוף טוב,קבוצת אסם סחר שות. מוגבלת,יח`,,1,43.90,6.27
2307,צונגו רצועות שניצל ציפס 600 גר` עוף טוב,קבוצת אסם סחר שות. מוגבלת,יח`,,1,42.90,7.15
2308,צונגו רצועות שניצל חריף מתוק 600 גר` עוף,קבוצת אסם סחר שות. מוגבלת,יח`,,1,42.90,7.15
2309,צונגו רצועות שניצל גריל 600 גר` עוף טוב,קבוצת אסם סחר שות. מוגבלת,יח`,,1,42.90,7.15
2310,יוגורט ביו 3% תנובה (150x8 גרם),תנובה - חלב,יח`,,1,16.50,1.38
2311,יוגורט ביו 1.5% תנובה (150x8 גרם),תנובה - חלב,יח`,,1,16.50,1.38
2312,משקה שקדים טרי תנובה (1 ליטר),תנובה - חלב,יח`,,1,11.90,1.19
2313,יופלה דיאט תות ב,תנובה - חלב,יח`,,1,4.90,3.27
2314,מעדן שוקולד חלב יולו (123 גרם),תנובה - חלב,יח`,,1,4.50,3.66
2315,מעדן שוקולד מריר יולו (123 גרם),תנובה - חלב,יח`,,1,4.50,3.66
2316,מעדן שוקולד לבן יולו (123 גרם),תנובה - חלב,יח`,,1,4.50,3.66
2317,יולו מעדן שכבות שוקולד חלבי לבן,תנובה - חלב,יח`,,1,4.50,3.66
2318,יולו מעדן שכבות שוקולד מריר לבן,תנובה - חלב,יח`,,1,4.50,3.66
2319,דייאט יופלה 0% אוכמניות בתחתית,תנובה - חלב,יח`,,1,4.90,3.27
2320,משקה טעם וניל תנובה GO,תנובה - חלב,יח`,,1,5.90,2.36
2321,תה קר בטעם ענבים ספרינג (1.5 ליטר),יפאורה,יח`,,1,6.40,4.27
2322,שוופס ווטר 0 קלוריות תפוח 1.5 ליטר,יפאורה,יח`,,1,6.30,0.42
2323,שוופס ווטר 0 קלוריות אפרסק 1.5 ליטר,יפאורה,יח`,,1,6.30,0.42
2324,משקה מוגז בטעם ענבים שוופס (1.5 ליטר),יפאורה,יח`,,1,6.90,4.60
2325,משקה קל לימונדה נענע תפוזינה (1.5 ליטר),יפאורה,יח`,,1,6.50,0.43
2326,שוופס סודה נענע ליים 1.5 ליטר,יפאורה,יח`,,1,3.90,0.26
2327,משקה בטעם ענבים פרוט ווטר (1.5 ליטר),יפאורה,יח`,,1,6.90,0.46
2328,משקה בטעם אננס פרוט ווטר (1.5 ליטר),יפאורה,יח`,,1,6.90,0.46
2329,משקה בטעם אפרסק פרוט ווטר (1.5 ליטר),יפאורה,יח`,,1,6.90,0.46
2330,משקה בטעם אבטיח פרוט ווטר (1.5 ליטר),יפאורה,יח`,,1,6.90,0.46
2331,משקה בטעם תות פרוט ווטר (1.5 ליטר),יפאורה,יח`,,1,6.90,0.46
2332,מגבונים בייביסיטר רביעייה,שקד תבל בעמ,יח`,,1,17.90,17.90
2333,מגבונים בייביסיטר רביעייה,שקד תבל בעמ,יח`,,1,17.90,17.90
2334,שמפו קרטין 750 מל סטייל,גורי ע.ע.ע בעמ,יח`,,1,29.90,3.99
