,ItemName,ManufactureName,UnitQty,Quantity,QtyInPackage,ItemPrice,UnitOfMeasurePrice
3602,מולר מיקס קרמי בתוספת קורנפלקס,החב` המרכזית - טרה,יח`,,1,6.10,4.07
3603,מה עז 180 גר` 9%,החב` המרכזית - טרה,יח`,,1,22.50,12.50
3604,גבינה צהובה ואקום 28%,החב` המרכזית - טרה,יח`,,1,28,5.60
3605,גבינה צהובה דק דק 28% אדם,החב` המרכזית - טרה,יח`,,1,16.50,8.25
3606,גבינה צהובה דק דק 9%,החב` המרכזית - טרה,יח`,,1,17.50,8.75
3607,ממרח גבינה ושוקולד מוו (200 גרם),החב` המרכזית - טרה,יח`,,1,11.30,11.30
3608,מאגדת שמיניי ה במתיקות מעודנת 2%,החב` המרכזית - טרה,יח`,,1,20.90,20.90
3609,יוגורט ביו נטורל 1.7% מולר (150x8 גרם),החב` המרכזית - טרה,יח`,,1,17.90,1.49
3610,יוגורט ביו נטורל 2.8% מולר (150x8 גרם),החב` המרכזית - טרה,יח`,,1,17.90,17.90
3611,מאגדת שמינייה מולר סיפלי תות,החב` המרכזית - טרה,יח`,,1,29.90,29.90
3612,גבינה צהובה קלאסית 28% נעם (360 גרם),החב` המרכזית - טרה,יח`,,1,19.90,5.53
3613,מאגדת שמינייה מולר סיפלי פרוט,החב` המרכזית - טרה,יח`,,1,29.90,29.90
3614,מעדן בטעם וניל עם קצפת מוו (123 גרם),החב` המרכזית - טרה,יח`,,1,2.80,2.80
3615,מעדן בטעם שוקולד קצפת מוו (123 גרם),החב` המרכזית - טרה,יח`,,1,2.80,2.80
3616,מולר סימפלי פרויט אננס,החב` המרכזית - טרה,יח`,,1,5,3.33
3617,מעדן בטעם שוקולד מוו (100x8 גרם),החב` המרכזית - טרה,יח`,,1,13.50,1.69
3618,מעדן בטעם וניל מוו (100x8 גרם),החב` המרכזית - טרה,יח`,,1,13.50,1.69
3619,מעדן בטעם שוקולד 1.5% שומן מוו (125 גרם),החב` המרכזית - טרה,יח`,,1,2.70,2.16
3620,מעדן בטעם וניל 1.5% שומן מוו (125 גרם),החב` המרכזית - טרה,יח`,,1,2.70,2.16
3621,מעדן מוו שוקולד ומוס שוקולד,החב` המרכזית - טרה,יח`,,1,2.80,2.28
3622,מעדן מוו וניל ומוס שוקולד,החב` המרכזית - טרה,יח`,,1,2.80,2.28
3623,גבינה צהובה דקה דקה 15% נעם (200 גרם),החב` המרכזית - טרה,יח`,,1,16.90,8.45
3624,גבינה צהובה נעם דק דק 9% פתח סגור 360 ג,החב` המרכזית - טרה,יח`,,1,26.90,7.47
3625,יוגורט 0% תות סימפלי מולר (150 גרם),החב` המרכזית - טרה,יח`,,1,5,3.33
3626,מאגדת שמינייה מולר סיפלי 0%,החב` המרכזית - טרה,יח`,,1,29.90,29.90
3627,גבינה צהובה נעם דק דק פתח סגור 200 גר,החב` המרכזית - טרה,יח`,,1,16.90,8.45
3628,מולר מיקס שקדים ובוטנים בקרמל 170 גרם,החב` המרכזית - טרה,יח`,,1,6.10,3.59
3629,מולר מיקס קליק 170 גרם,החב` המרכזית - טרה,יח`,,1,6.10,3.59
3630,קוטג` וחצי 5% 375 גר,החב` המרכזית - טרה,יח`,,1,8.10,2.16
3631,גבינה צהובה אמנטל 30% נעם (200 גרם),החב` המרכזית - טרה,יח`,,1,16.90,8.45
3632,מוצרלה נעם פתיחה חוזרת 200 גר`,החב` המרכזית - טרה,יח`,,1,18.90,9.45
3633,חלב שקית 3% 1 ליטר מהדרין וסט,החב` המרכזית - טרה,יח`,,1,5.17,5.17
3634,חלב קרטון 2 ליטר 3% מהדרין וסט,החב` המרכזית - טרה,יח`,,1,11.88,5.94
3635,חלב הומוגני 3% 1 ליטר מהדרין וסט,החב` המרכזית - טרה,יח`,,1,5.94,5.94
3636,מולר רייס בטעם במתיקות עדינה 170 גר`,החב` המרכזית - טרה,יח`,,1,4.90,2.88
3637,מולר רייס בטעם תות 170 גר`,החב` המרכזית - טרה,יח`,,1,4.90,2.88
3638,חלב מועשר דל לקטוז 1 ליטר טרה,החב` המרכזית - טרה,יח`,,1,7.30,7.30
3639,מולר מיקס תות בתופסת כריות 170 גר`,החב` המרכזית - טרה,יח`,,1,4.90,2.88
3640,מולר רייס בטעם תפוח קינמון 170 גר`,החב` המרכזית - טרה,יח`,,1,4.90,2.88
3641,משקה שוקו מועשר בבקבוק 1 ליטר טרה,החב` המרכזית - טרה,יח`,,1,11.50,11.50
3642,שוקו מעושר בבקבוק 250 מל טרה,החב` המרכזית - טרה,יח`,,1,4.90,4.90
3643,משקה סויה בטעם וניל 1 ליטר משק צוריאל,החב` המרכזית - טרה,יח`,,1,10.90,0.01
3644,מולר סימפלי פרויט מנגו 1.5%,החב` המרכזית - טרה,יח`,,1,5,3.33
3645,מאגדת שמינייה מולר סיפלי מנגו ואננס 1.5%,החב` המרכזית - טרה,יח`,,1,29.90,29.90
3646,פודינג בטעם שוקולד 85 גר` מיה,מיה תעשיות מזון מ.ת.מ. בעמ,יח`,,1,5,5.88
3647,ג`לי בטעם משמש 90 גר` מיה,מיה תעשיות מזון מ.ת.מ. בעמ,יח`,,1,5,5.56
3648,קולגייט סנסיטיב פרו ריליף 75 מל,ש.שסטוביץ בעמ,יח`,,1,21.40,19.45
3649,צמרונים לתינוק בלונס) (50,ש.שסטוביץ בעמ,יח`,,1,7.10,7.10
3650,ספיד סטיק ג`ל אי,ש.שסטוביץ בעמ,יח`,,1,19.30,22.71
3651,מפות שולחן עבה במיוחד 135/300 לפיד) (6,פאלאס תעשיות נטו (2014) בעמ,יח`,,1,12.20,12.20
3652,כף צבעונית לפיד (100),פאלאס תעשיות נטו (2014) בעמ,יח`,,1,11.20,11.20
3653,מזלג צבעוני לפיד (100),פאלאס תעשיות נטו (2014) בעמ,יח`,,1,11.20,11.20
3654,סכין צבעוני לפיד (100),פאלאס תעשיות נטו (2014) בעמ,יח`,,1,11.20,11.20
3655,כפות חד פעמיות לפיד (100),פאלאס תעשיות נטו (2014) בעמ,יח`,,1,6.10,6.10
3656,כפיות לפיד) (100,פאלאס תעשיות נטו (2014) בעמ,יח`,,1,6.10,6.10
3657,מזלג חד פעמי לפיד (100),פאלאס תעשיות נטו (2014) בעמ,יח`,,1,6.10,6.10
3658,סכין חד פעמי לפיד (100),פאלאס תעשיות נטו (2014) בעמ,יח`,,1,6.10,6.10
3659,כוס יהלום לפיד (40),פאלאס תעשיות נטו (2014) בעמ,יח`,,1,11.20,11.20
3660,צלחות גדולות 1 קילו -פאלאס,פאלאס תעשיות נטו (2014) בעמ,יח`,,1,21.40,21.40
3661,כרוב לבן 400 ג בדצ ירקות שטראוס טעם הטבע,שטראוס גרופ בעמ/מצונן,יח`,,1,9,2.25
3662,סלט קולסלאו 400 ג בדצ ירקות שטראוס טעם ה,שטראוס גרופ בעמ/מצונן,יח`,,1,9,2.25
3663,קפה PLATINUM אפריקאי 200 גר,שטראוס גרופ בעמ,יח`,,1,26.50,13.25
3664,קפה PLATINUM ברזילאי 200 גר,שטראוס גרופ בעמ,יח`,,1,21.90,10.95
3665,אצבעות שוקולד עם קרם חלב עלית (96 גרם),שטראוס גרופ בעמ,יח`,,1,8.40,8.75
3666,שמיניית אצבעות שוקולד מגדים סוכריות קופצ,שטראוס גרופ בעמ,יח`,,1,8.40,8.75
3667,מקופלת XL חלבי 33 גר,שטראוס גרופ בעמ,יח`,,1,4.30,13.03
3668,גרנולה קראנצי שילוב דגנים עם מייפל ופקאן,שטראוס גרופ בעמ,יח`,,1,20.30,5.08
3669,עלי חסה ערבית שטופים 250 גר טעם הטבע,שטראוס גרופ בעמ/מצונן,יח`,,1,10.10,4.04
3670,הר שיראז אדום 750 מל,החב` המרכזית - טרה,יח`,,1,37.90,5.01
3671,טאצ ממחטות כיס,שניב תעשיות נייר בעמ,יח`,,1,7.10,7.10
3672,מפיות טאצ` 150 יח,שניב תעשיות נייר בעמ,יח`,,1,7.90,7.90
3673,ממחטות טאצ` חמישייה צבעוני 500 דף,שניב תעשיות נייר בעמ,יח`,,1,12.90,12.90
3674,חומוס עם טחינה אחלה (400 גרם),שטראוס גרופ בעמ/מצונן,יח`,,1,12.10,3.03
3675,חומוס וזעתר אחלה (400 גרם),שטראוס גרופ בעמ/מצונן,יח`,,1,12.10,3.03
3676,חומוס עם צנובר אחלה (400 גרם),שטראוס גרופ בעמ/מצונן,יח`,,1,12.10,3.03
3677,חומוס וחריף אחלה (400 גרם),שטראוס גרופ בעמ/מצונן,יח`,,1,12.10,3.03
3678,מעדן בטעם תות בננה גמדים (100x8 גרם),שטראוס גרופ בעמ/מצונן,יח`,,1,19.20,2.40
3679,קפה נמס מוקה עלית (200 גרם),שטראוס גרופ בעמ,יח`,,1,21.90,10.95
3680,עלי רוקט שטראוס 150 גר`-טעם הטבע,שטראוס גרופ בעמ/מצונן,יח`,,1,10.10,6.73
3681,מילקי טופ עדשים,שטראוס גרופ בעמ/מצונן,יח`,,1,4.70,2.76
3682,טחינה משומשום מלא אחלה (500 גרם),שטראוס גרופ בעמ/מצונן,יח`,,1,15.60,3.12
3683,ספלנדיד תפוז בדצ,שטראוס גרופ בעמ,יח`,,1,12.20,12.20
3684,אפרופו 50 גר` איטליאנו,קבוצת אסם סחר שות. מוגבלת,יח`,,1,5.70,11.40
3685,פודינג בטעם וניל צרפתי 80  גר`אסם,קבוצת אסם סחר שות. מוגבלת,יח`,,1,6.80,8.50
3686,מיני מאפינס שוקו צ`יפס בונז`ור,קבוצת אסם סחר שות. מוגבלת,יח`,,1,8.90,8.90
3687,מיני מאפינס שוקו בונז`ור,קבוצת אסם סחר שות. מוגבלת,יח`,,1,8.90,8.90
3688,עוגת הבית בראוניס שבת שוקולד ריבת חלב 38,קבוצת אסם סחר שות. מוגבלת,יח`,,1,19.60,5.16
3689,דובונים חטיף תפוחי אדמה אסם (20x5 גרם),קבוצת אסם סחר שות. מוגבלת,יח`,,1,15.20,15.20
3690,גביעי גלידה אסם) (24,קבוצת אסם סחר שות. מוגבלת,יח`,,1,15.20,16
3691,גביעי גלידה אמריקאים אסם) (24,קבוצת אסם סחר שות. מוגבלת,יח`,,1,15.20,12.67
3692,במבה אסם (200 גרם),קבוצת אסם סחר שות. מוגבלת,יח`,,1,10.50,5.25
3693,ממרח תמרים 450 גר בדץ,בני ג`ורג` שוקחה (חיפה) בעמ,יח`,,1,5.90,1.31
3694,מארז 8 דני וניל,שטראוס גרופ בעמ/מצונן,יח`,,1,16.80,16.80
3695,רצועות פלפלים קלויים אחלה (400 גרם),שטראוס גרופ בעמ/מצונן,יח`,,1,17.20,4.30
3696,קפה טורקי עלית (85x3 גרם),שטראוס גרופ בעמ,יח`,,1,19.90,7.80
3697,לקט מסולסלים 350 גרם שטראוס טעם הטבע,שטראוס גרופ בעמ/מצונן,יח`,,1,13.50,3.86
3698,תפוצ`יפס 200 גר` שמנת בצל,שטראוס פריטו ליי בעמ,יח`,,1,11.20,5.60
3699,מארז 4 דני לשתייה,שטראוס גרופ בעמ/מצונן,יח`,,1,11.30,2.26
3700,מילקי שמיניה,שטראוס גרופ בעמ/מצונן,יח`,,1,20.90,2.41
3701,שוקולד מריר עלית (100x5 גרם),שטראוס גרופ בעמ,יח`,,1,24.40,4.88
3702,שמן זית כתית מעולה יד מרדכי (750 מל),שטראוס גרופ בעמ,יח`,,1,32.90,4.39
3703,שוקולד פרה חלב עלית (100x5 גרם),שטראוס גרופ בעמ,יח`,,1,24.40,4.88
3704,צלחת מרק קרם 25 יח פאלאס,פאלאס תעשיות נטו (2014) בעמ,יח`,,1,6.90,6.90
3705,צלחת קטנה קרם 25 יח פאלאס,פאלאס תעשיות נטו (2014) בעמ,יח`,,1,6.90,6.90
3706,קערית אובלית קרם 25 יח פאלאס,פאלאס תעשיות נטו (2014) בעמ,יח`,,1,4.90,4.90
3707,נר נשמה בפחית פאלאס,פאלאס תעשיות נטו (2014) בעמ,יח`,,1,2,2
3708,נרות שבת 6 יח 140 גר,פאלאס תעשיות נטו (2014) בעמ,יח`,,1,4,2.86
3709,תבנית אלומניום קטנה R29 פאלאס 13 יח,פאלאס תעשיות נטו (2014) בעמ,יח`,,1,13.20,13.20
3710,תבנית אלומניום קטנה R29 + מכסה,פאלאס תעשיות נטו (2014) בעמ,יח`,,1,12.20,12.20
3711,מפיות אירוח נקודות 80 יח לפיד,פאלאס תעשיות נטו (2014) בעמ,יח`,,1,5.90,5.90
3712,כוסות נייר B8 פאלס (50),פאלאס תעשיות נטו (2014) בעמ,יח`,,1,8.10,8.10
3713,כוסות קרטון לשתיה חמה אספרסו פאלאס) (50,פאלאס תעשיות נטו (2014) בעמ,יח`,,1,6.10,6.10
3714,מפיות לבנות 100 יח לפיד,פאלאס תעשיות נטו (2014) בעמ,יח`,,1,4.90,4.90
3715,כוסות שתיה קרה 330 מל 40 יח,פאלאס תעשיות נטו (2014) בעמ,יח`,,1,7.10,7.10
3716,תבנית אלומניום ענק R99 פאלאס 4 יח,פאלאס תעשיות נטו (2014) בעמ,יח`,,1,9.90,9.90
3717,תבנית אלומניום אינגליש R88 פאלאס 14 יח,פאלאס תעשיות נטו (2014) בעמ,יח`,,1,9.90,9.90
3718,תבנית אלומניום בינונית R2 פאלאס 7 יח,פאלאס תעשיות נטו (2014) בעמ,יח`,,1,9.90,9.90
3719,תבנית אלומניום עמוקה R64 פאלאס 8 יח,פאלאס תעשיות נטו (2014) בעמ,יח`,,1,9.90,9.90
3720,תבנית אלומניום בינונית R2 פאלאס 5יח,פאלאס תעשיות נטו (2014) בעמ,יח`,,1,9.90,9.90
3721,תחליב רחצה נקה 7 ירוק אלוורה,החברה הדרומית לשיווק בעמ,יח`,,1,13.20,1.76
3722,ספריי תחליב לילדים 300/50,החברה הדרומית לשיווק בעמ,יח`,,1,50.90,50.90
3723,טיטניום ספרי גוף קלאסי 150 מל,החברה הדרומית לשיווק בעמ,יח`,,1,10.90,7.27
3724,מרכך קרטין נטורל פורמולה (400 מל),החברה הדרומית לשיווק בעמ,יח`,,1,31.60,7.90
3725,סופטקר מגבונים רביעייה,החברה הדרומית לשיווק בעמ,יח`,,1,19.30,19.30
3726,סקינגארד סקין ספריי שקוף 300/50,החברה הדרומית לשיווק בעמ,יח`,,1,55.90,18.63
3727,סקינגארד רולאון 70/50 מל,החברה הדרומית לשיווק בעמ,יח`,,1,30.90,30.90
3728,תח הגנה 250-50 ילדים s.g,החברה הדרומית לשיווק בעמ,יח`,,1,42.90,42.90
3729,סקינגארד סקין משפחתי 300/50 ווט,החברה הדרומית לשיווק בעמ,יח`,,1,55.90,18.63
3730,סט מגבות מטבח זוג,טומי,יח`,,1,9.90,9.90
3731,קפסולות קפה עלית עשיר וארומטי (10),שטראוס גרופ בעמ,יח`,,1,18.30,18.30
3732,קפסולות 10 חזק ועוצמתי עלית (10),שטראוס גרופ בעמ,יח`,,1,18.30,36.60
3733,קפסולות 7 עדין וקטיפתי עלית (10),שטראוס גרופ בעמ,יח`,,1,18.30,36.60
3734,שמנת לבישול 15% יטבתה (250 מל),שטראוס גרופ בעמ/מצונן,יח`,,1,8.20,3.28
3735,מקלות כיף כף קלאסי עלית (40 גרם),שטראוס גרופ בעמ,יח`,,1,5.70,14.25
3736,חטיף פרה  קראנצ`שוקולד לבן ביסקוויט,שטראוס גרופ בעמ,יח`,,1,6.90,6.90
3737,ביסקוויט עד חצות לבן 200 גר`,שטראוס גרופ בעמ,יח`,,1,14.50,7.25
3738,חצילים בטעם כבד אחלה (400 גרם),שטראוס גרופ בעמ/מצונן,יח`,,1,16.20,4.05
3739,טחינה לבנה אחלה (400 גרם),שטראוס גרופ בעמ/מצונן,יח`,,1,16.20,4.05
3740,סימפוניה פלפל שיפקה חריף,שטראוס גרופ בעמ/מצונן,יח`,,1,11.70,5.85
3741,חומוס עם פלפל שיפקה אחלה (400 גרם),שטראוס גרופ בעמ/מצונן,יח`,,1,12.10,3.03
3742,שום ישראלי קלוף 120  גר`ירקות שטראוס,שטראוס גרופ בעמ/מצונן,יח`,,1,12.90,10.75
3743,שמנת חמוצה 9% יטבתה (200 מל),שטראוס גרופ בעמ/מצונן,יח`,,1,3.20,1.60
3744,משקה פונץ בננה 250 מל,שטראוס גרופ בעמ/מצונן,יח`,,1,5.50,2.20
3745,סימפוניה בצל ירוק 5%,שטראוס גרופ בעמ/מצונן,יח`,,1,11.70,5.85
3746,צ`יטוס דולפינים עלית (55 גרם),שטראוס פריטו ליי בעמ,יח`,,1,3.90,7.09
3747,סבון נוזלי חלב שקדים פלמוליב (750 מל),ש.שסטוביץ בעמ,יח`,,1,21.40,2.85
3748,ליידי ספיד סטיק,ש.שסטוביץ בעמ,יח`,,1,14.90,29.80
3749,ספיד סטיק נוטרו,ש.שסטוביץ בעמ,יח`,,1,17.30,17.30
3750,ספיד סטיק כחול א,ש.שסטוביץ בעמ,יח`,,1,26.50,26.50
3751,מיונז הולנדי מאסטר שף (483 גר`),ש.שסטוביץ בעמ,יח`,,1,11.20,2.32
3752,חרדל דיז`ון צרפתי מאסטר שף (370 גרם),ש.שסטוביץ בעמ,יח`,,1,13.20,3.57
3753,לה קט מעדן פטה מולטיפק 100 גר`,דיפלומט היינץ,יח`,,1,16.30,16.30
3754,וודקה פינלנדיה 700 מל,מ. אקרמן בעמ,יח`,,1,67.90,9.66
3755,חטיף טורטיה שום ובצל אסם (60 גרם),קבוצת אסם סחר שות. מוגבלת,יח`,,1,9,15
3756,חטיף טורטיה תירס אסם (60 גרם),קבוצת אסם סחר שות. מוגבלת,יח`,,1,9,15
3757,חרוזית בתיבול לימון בית השיטה (560 גרם),קבוצת אסם סחר שות. מוגבלת,יח`,,1,11,4
3758,עוגיות ביס בטעם חמאה,קבוצת אסם סחר שות. מוגבלת,יח`,,1,12.20,4.07
3759,במבה אסם (25x10 גרם),קבוצת אסם סחר שות. מוגבלת,יח`,,1,17.30,6.92
3760,עוגת הבית דמקה שוקו וניל 320 גר` בחושות,קבוצת אסם סחר שות. מוגבלת,יח`,,1,12.20,3.81
3761,פירורית זהב שומשום אסם (200 גרם),קבוצת אסם סחר שות. מוגבלת,יח`,,1,7.10,3.55
3762,מרק פטריות רכיבים טבעיים אסם (220 גרם),קבוצת אסם סחר שות. מוגבלת,יח`,,1,18.30,8.32
3763,מרק בצל רכיבים טבעיים אסם (220 גרם),קבוצת אסם סחר שות. מוגבלת,יח`,,1,18.30,8.32
3764,פתיתים אפויים 500 גר` אורז עם אטריות אסם,קבוצת אסם סחר שות. מוגבלת,יח`,,1,7.70,7.70
3765,משקה פונץ בננה 1 ליטר מהדרין,שטראוס גרופ בעמ/מצונן,יח`,,1,11.90,1.19
3766,שוקולד מריר 85% ספלנדיד (100 גרם),שטראוס גרופ בעמ,יח`,,1,12.20,12.20
3767,סחוג חריף מאוד 220 גרם,שטראוס גרופ בעמ/מצונן,יח`,,1,14.50,6.59
3768,חומוס אחלה (400 גרם),שטראוס גרופ בעמ/מצונן,יח`,,1,9.10,2.28
3769,בונבוניירה ספלנדיד מיקס משפחתית,שטראוס גרופ בעמ,יח`,,1,29.60,13.70
3770,דנונה לשתיה תות בננה,שטראוס גרופ בעמ/מצונן,יח`,,1,5,1.90
3771,חומץ בלסמי ממודנה יד מרדכי (250 מל),שטראוס גרופ בעמ,יח`,,1,17.30,6.92
3772,רביולי עם בטטה פרווה שטראוס (400 גרם),שטראוס גרופ בעמ/מצונן,יח`,,1,21.70,5.43
3773,רבע לשבע,שטראוס גרופ בעמ,יח`,,1,14.20,8.88
3774,דנונה פרו תות,שטראוס גרופ בעמ/מצונן,יח`,,1,4.70,3.13
3775,עוגה אישית מילקי  -CAKE רביעייה,שטראוס גרופ בעמ/מצונן,יח`,,1,11.20,8.24
3776,סלט טורקי אחלה (400 גרם),שטראוס גרופ בעמ/מצונן,יח`,,1,17.20,4.30
3777,קוביות סלק אחלה (400 גרם),שטראוס גרופ בעמ/מצונן,יח`,,1,16.20,4.05
3778,חטיף טורטית עלית (40x4  גרם)מגדים,שטראוס גרופ בעמ,יח`,,1,15.20,15.20
3779,חטיף פופס תפוצ`יפס (60 גרם),שטראוס פריטו ליי בעמ,יח`,,1,4,6.67
3780,שוקולית לאפיה 500 גר`,שטראוס גרופ בעמ,יח`,,1,15.20,3.04
3781,קפסולות קפה עלית ברזיל) (10,שטראוס גרופ בעמ,יח`,,1,18.30,36.60
3782,קפסולות קפה עלית נטול קפאין אספרסו (10),שטראוס גרופ בעמ,יח`,,1,18.30,36.60
3783,אנרג`י פריכיות תחתית שוקולד,שטראוס גרופ בעמ,יח`,,1,9.40,13.43
3784,אנרג`י פריכיות תחתית מצופה שוקולד,שטראוס גרופ בעמ,יח`,,1,9.40,13.43
3785,סלט ערוגות שטראוס 450 גר`-טעם הטבע,שטראוס גרופ בעמ/מצונן,יח`,,1,11.80,2.62
3786,מאגדת גומיגם,נגה גלידות שותפות מוגבלת,יח`,,1,29.50,6.56
3787,רוטב לסלט צ`ילי מתוק,קבוצת אסם סחר שות. מוגבלת,יח`,,1,14.20,4.90
3788,עוגיות פיטנס שוקולד ציפס,קבוצת אסם סחר שות. מוגבלת,יח`,,1,13.20,7.33
3789,קרקר לחמית חמישה דגנים אסם (190 גרם),קבוצת אסם סחר שות. מוגבלת,יח`,,1,10,5.26
3790,קריספי טאפאס זיתים,קבוצת אסם סחר שות. מוגבלת,יח`,,1,13.20,8.80
3791,קריספי טאפאס פלפלים קלוים אסם (150 גרם),קבוצת אסם סחר שות. מוגבלת,יח`,,1,13.20,8.80
3792,חומוס עם טחינה צבר (400 גרם),קבוצת אסם סחר שות. מוגבלת,יח`,,1,13.30,3.33
3793,חומוס עם צנוברים צבר (400 גרם),קבוצת אסם סחר שות. מוגבלת,יח`,,1,13.30,3.33
3794,חומוס אבו גוש צבר (400 גרם),קבוצת אסם סחר שות. מוגבלת,יח`,,1,13.20,3.30
3795,עוגת הבית שוקוצ`יפס אסם (350 גרם),קבוצת אסם סחר שות. מוגבלת,יח`,,1,12.20,3.49
3796,בייגלה שטוחים עם שומשום,קבוצת אסם סחר שות. מוגבלת,יח`,,1,10.10,3.37
3797,בייגלה שטוחים טבעות עם מלח אסם (300 גרם),קבוצת אסם סחר שות. מוגבלת,יח`,,1,10.10,3.37
3798,עוגת הבית סופלה טעם שוקולד,קבוצת אסם סחר שות. מוגבלת,יח`,,1,12.20,3.59
3799,עוגת הבית סופלה טעם שוקו וניל,קבוצת אסם סחר שות. מוגבלת,יח`,,1,12.20,3.59
3800,אפרופו שוקולד 40 גר,קבוצת אסם סחר שות. מוגבלת,יח`,,1,5.70,14.25
3801,חומוס צבר (400 גרם),קבוצת אסם סחר שות. מוגבלת,יח`,,1,12.20,2.44
3802,חומוס מסעדה צבר (700 גרם),קבוצת אסם סחר שות. מוגבלת,יח`,,1,13.20,1.89
3803,לה קרמריה 1.4 וניל,נגה גלידות שותפות מוגבלת,יח`,,1,23.40,1.67
3804,לה קרמריה 1.4 ריבת חלב,נגה גלידות שותפות מוגבלת,יח`,,1,23.40,1.67
3805,לה קרמריה 1.4 פונטש בננה,נגה גלידות שותפות מוגבלת,יח`,,1,23.40,16.71
3806,לה קרמריה 1.4 שוקולד,נגה גלידות שותפות מוגבלת,יח`,,1,23.40,1.67
3807,טחינה אמיתית צבר (400 גרם),קבוצת אסם סחר שות. מוגבלת,יח`,,1,12.50,3.13
3808,סלט חציל על האש בטחינה צבר (400 גרם),קבוצת אסם סחר שות. מוגבלת,יח`,,1,13.50,3.38
3809,חציל במיונז על האש צבר (400 גרם),קבוצת אסם סחר שות. מוגבלת,יח`,,1,12.50,3.13
3810,סלט כרוב אדום צבר (400 גרם),קבוצת אסם סחר שות. מוגבלת,יח`,,1,11.80,2.95
3811,עוגת בראוניס תפוחים בונז`ור,קבוצת אסם סחר שות. מוגבלת,יח`,,1,21.90,21.90
3812,דגני בוקר שיבולת שועל 340 גר`,קבוצת אסם סחר שות. מוגבלת,יח`,,1,19.30,5.68
3813,דובונים חטיף תפוחי אדמה אסם (100 גרם),קבוצת אסם סחר שות. מוגבלת,יח`,,1,11.20,11.20
3814,עוגת הבית שמרים שוקולד קלסית,קבוצת אסם סחר שות. מוגבלת,יח`,,1,19.30,5.51
3815,שלישיית פסק זמן קלאסי מגדים,שטראוס גרופ בעמ,יח`,,1,14.20,14.20
3816,לקט לסלט אסייתי 350 גר`-טעם הטבע,שטראוס גרופ בעמ/מצונן,יח`,,1,11.20,3.20
3817,מארז מילקי CAKE שמיניה,שטראוס גרופ בעמ/מצונן,יח`,,1,20.30,7.46
3818,תפוצ`יפס 50 גר` אקסטרא,שטראוס פריטו ליי בעמ,יח`,,1,4,4
3819,פופקורן בטעם טבעי עלית (65 גרם),שטראוס פריטו ליי בעמ,יח`,,1,5,7.69
3820,בפלות טורטית מהדרין עלית (360 גרם),שטראוס גרופ בעמ,יח`,,1,18.30,5.08
3821,חיוכים שוקו 600 גר בדצ,שטראוס גרופ בעמ,יח`,,1,19.30,3.22
3822,תפוצ`יפס 200 גר` אקסטרא,שטראוס פריטו ליי בעמ,יח`,,1,11.20,5.60
3823,טורטית מגדים,שטראוס גרופ בעמ,יח`,,1,4.30,10.75
3824,חטיף תירס ובוטנים צ`יטוס (80 גרם),שטראוס פריטו ליי בעמ,יח`,,1,4.90,6.13
3825,בפלות טוב טעם מצופים עם קרם בטעם שוקולד,שטראוס גרופ בעמ,יח`,,1,19.30,4.34
3826,טורטית נשנושים עלית (130  גרם)* *,שטראוס גרופ בעמ,יח`,,1,13.20,10.15
3827,עוגה אישית מילקי  -CAKE בודד,שטראוס גרופ בעמ/מצונן,יח`,,1,3,3
3828,רוטב צ`ילי מתוק יד מרדכי (320 גר`),שטראוס גרופ בעמ,יח`,,1,16.30,5.09
3829,רוטב שמנת עם פטריות 9% יטבתה (250 מל),שטראוס גרופ בעמ/מצונן,יח`,,1,10.10,4.04
3830,פסק זמן  קלאסיק- כשלפ,שטראוס גרופ בעמ,יח`,,1,5.40,12.56
3831,חטיף תירס חמוץ חריף דוריטוס (185 גרם),שטראוס פריטו ליי בעמ,יח`,,1,8.10,4.38
3832,יד מרדכי מיץ לימון 250 מל,שטראוס גרופ בעמ,יח`,,1,10.10,4.04
3833,יוגורט 3% פירות יער דנונה (150 גרם),שטראוס גרופ בעמ/מצונן,יח`,,1,3.80,2.53
