,ItemName,ManufactureName,UnitQty,Quantity,QtyInPackage,ItemPrice,UnitOfMeasurePrice
476,עדשים ירוקות מבושלות סנפרוסט (800 גרם),תנובה קפואים,יח`,,1,20.90,2.61
477,במיה 600 גר` סנפרוסט,תנובה קפואים,יח`,,1,18.90,3.15
478,אפונה 800 גר` סנפרוסט,תנובה קפואים,יח`,,1,16.90,2.11
479,גרעיני תירס מוקפאים סנפרוסט (800 גרם),תנובה קפואים,יח`,,1,17.90,2.24
480,עלי תרד סנפרוסט (800 גרם),תנובה קפואים,יח`,,1,26,3.25
481,שעועית לבנה מבושלת סנפרוסט (800 גרם),תנובה קפואים,יח`,,1,19.90,2.49
482,גרגרי חומוס מבושלים סנפרוסט (800 גרם),תנובה קפואים,יח`,,1,19.90,2.49
483,שעועית עדינה שלמה סנפרוסט (600 גרם),תנובה קפואים,יח`,,1,22.90,3.82
484,לקט נורמנדי מוקפא סנפרוסט (800 גרם),תנובה קפואים,יח`,,1,16.90,2.11
485,חגיגה ירוקה להקפצה 800 גר` סנפרוסט,תנובה קפואים,יח`,,1,24,3
486,קינואה עדשים וירקות 800 גר` סנפרוסט,תנובה קפואים,יח`,,1,23,2.88
487,חטיף סויה אדממה סנפרוסט (400 גרם),תנובה קפואים,יח`,,1,14,3.50
488,ברוקולי סנפרוסט (800 גרם),תנובה קפואים,יח`,,1,24.90,3.11
489,פסטה וירקות אל איטליה 800 גר` סנפרוסט,תנובה קפואים,יח`,,1,23,2.88
490,כיפלי 70 גר` גריל,יוניליוור ישראל שיווק בעמ,יח`,,1,5.90,8.43
491,כיפלי חטיף בטעם בצל מהדרין תלמה (70 גרם),יוניליוור ישראל שיווק בעמ,יח`,,1,5.90,8.43
492,מיונז אמיתי תלמה (250 גרם),יוניליוור ישראל שיווק בעמ,יח`,,1,5.90,2.36
493,מיונז אמיתי תלמה (500 גרם),יוניליוור ישראל שיווק בעמ,יח`,,1,9.90,1.98
494,מיונז אמיתי תלמה (1 קג),יוניליוור ישראל שיווק בעמ,יח`,,1,17.90,17.90
495,חרדל אמיתי תלמה (250 גרם),יוניליוור ישראל שיווק בעמ,יח`,,1,6.90,2.76
496,טחינה 100% שומשום טהור בארכה (1 קג),קבוצת אסם סחר שות. מוגבלת,יח`,,1,24.90,2.49
497,כיפלי צ`יפסים מהדרין תלמה (50 גרם),יוניליוור ישראל שיווק בעמ,יח`,,1,5.90,11.80
498,כיפלי צ`יפסים קטשופ תלמה (50 גרם),יוניליוור ישראל שיווק בעמ,יח`,,1,5.90,11.80
499,רוטב ברביקיו קנור (300 מל),יוניליוור ישראל שיווק בעמ,יח`,,1,12.90,6.45
500,רוטב צ`ילי מתוק קנור (300 מל),יוניליוור ישראל שיווק בעמ,יח`,,1,12.90,3.79
501,מרק נמס בכוס פטריות קנור (21.5x2 גרם),יוניליוור ישראל שיווק בעמ,יח`,,1,6.90,16.05
502,מיונז אמיתי הלמנס (394 גרם),יוניליוור ישראל שיווק בעמ,יח`,,1,12.90,2.98
503,מיונז לייט הלמנס (424 גרם),יוניליוור ישראל שיווק בעמ,יח`,,1,12.90,2.71
504,רוטב פטריות קנור (28 גרם),יוניליוור ישראל שיווק בעמ,יח`,,1,4.90,17.50
505,מוסקט טחון 40 גר`,תבליני טעם וריח בעמ,יח`,,1,12.90,32.25
506,קינמון טחון 50 גר`,תבליני טעם וריח בעמ,יח`,,1,5.90,11.80
507,פפריקה בשמן 90 גר`,תבליני טעם וריח בעמ,יח`,,1,8.90,9.89
508,עלי דפנה 20 גר`,תבליני טעם וריח בעמ,יח`,,1,5.90,29.50
509,תיבול לתפוא 100 גר`,תבליני טעם וריח בעמ,יח`,,1,8.90,8.90
510,כמון טחון 100 גר`,תבליני טעם וריח בעמ,יח`,,1,8.90,8.90
511,פפריקה מתוקה 100 גר`,תבליני טעם וריח בעמ,יח`,,1,8.90,8.90
512,פלפל שחור טחון 100 גר`,תבליני טעם וריח בעמ,יח`,,1,11.90,11.90
513,פלפל שחור גרוס 90 גר`,תבליני טעם וריח בעמ,יח`,,1,11.90,13.22
514,טימין 20 גר`,תבליני טעם וריח בעמ,יח`,,1,5.90,29.50
515,קרמיסימו גלידונית 60 יח`,גלידות שטראוס בעמ,יח`,,1,47.90,6.84
516,מיץ סחוט תפוזים טבעי פריגת (2 ליטר),החב` המרכזית - טרה,יח`,,1,27.90,1.40
517,גרעיני דלעת שקית 200 גר`,ליימן שליסל בעמ,יח`,,1,9.90,4.95
518,גרעיני חמניה 200 גר`,ליימן שליסל בעמ,יח`,,1,6.90,3.45
519,שקדים קלויים קליית גת (200 גרם),ליימן שליסל בעמ,יח`,,1,22.90,11.45
520,ברנפלקס קרנצ`ים 375 גר` בדצ,יוניליוור ישראל שיווק בעמ,יח`,,1,22.90,6.11
521,עוגי מופחת סוכר 500גר,יוניליוור ישראל שיווק בעמ,יח`,,1,18.90,3.78
522,שוקולד פרה מריר פרווה עלית (100 גרם),שטראוס גרופ בעמ,יח`,,1,4.90,4.90
523,טבלאות פרה במילוי קרם נוגט,שטראוס גרופ בעמ,יח`,,1,4.90,4.90
524,חטיף כיף כף עלית (45 גרם),שטראוס גרופ בעמ,יח`,,1,3.90,8.67
525,בפלות בטעם לימון עלית (500 גרם),שטראוס גרופ בעמ,יח`,,1,12.90,2.58
526,שוקולית אבקת שוקו עלית (500 גרם),שטראוס גרופ בעמ,יח`,,1,11.90,2.38
527,קפה טורקי עלית (100 גרם),שטראוס גרופ בעמ,יח`,,1,8.90,8.90
528,קפה טורקי עם הל עלית (100 גרם),שטראוס גרופ בעמ,יח`,,1,8.90,8.90
529,קפה טורקי בוואקום עלית (1 קג),שטראוס גרופ בעמ,יח`,,1,74.90,74.90
530,נס קפה קטן פח,שטראוס גרופ בעמ,יח`,,1,9.90,19.80
531,קפה נמס עלית (200 גרם),שטראוס גרופ בעמ,יח`,,1,19.90,9.95
532,קפה נמס נטול קפאין האג עלית (200 גרם),שטראוס גרופ בעמ,יח`,,1,34.90,17.45
533,שוקולד פרה מריר עם אגוזים עלית (100 גרם),שטראוס גרופ בעמ,יח`,,1,4.90,4.90
534,ביסקוויט עד חצות חלבי 200 גר`,שטראוס גרופ בעמ,יח`,,1,13.90,6.95
535,נייר טואלט פסטל לילי 32 גלילים,קימברלי קלארק ישראל שיווק בעמ,יח`,,1,32.90,1.67
536,אשפתון 40,קימברלי קלארק ישראל שיווק בעמ,יח`,,1,20.90,0.52
537,זוג אשפתון 90x78 ניקול) (10x2,קימברלי קלארק ישראל שיווק בעמ,יח`,,1,23.90,23.90
538,קוטקס מגן תחתון נורמל בניחוח עדין 50 יח,קימברלי קלארק ישראל שיווק בעמ,יח`,,1,21.90,21.90
539,מפיות אירוח לילי סטייל ניקול (20),קימברלי קלארק ישראל שיווק בעמ,יח`,,1,8.90,8.73
540,ממחטות טישו לילי) (100x5,קימברלי קלארק ישראל שיווק בעמ,יח`,,1,12.90,2.18
541,מגבוני האגיס רביעייה ללא בישום,קימברלי קלארק ישראל שיווק בעמ,יח`,,1,19.90,19.90
542,מגבוני האגיס רביעייה,קימברלי קלארק ישראל שיווק בעמ,יח`,,1,19.90,19.90
543,רדיד אלומיניום זוג רגיל ניקול,קימברלי קלארק ישראל שיווק בעמ,יח`,,1,14.90,7.45
544,חיתולי פרידום דריי שלב 3 האגיס (52),קימברלי קלארק ישראל שיווק בעמ,יח`,,1,39.90,39.90
545,זוג סנדוויצ`ון ניקול (150x2),קימברלי קלארק ישראל שיווק בעמ,יח`,,1,14.90,7.45
546,חיתולי פרידום דריי שלב 4 האגיס (44),קימברלי קלארק ישראל שיווק בעמ,יח`,,1,39.90,39.90
547,חיתולי פרידום דריי שלב +4 האגיס (40),קימברלי קלארק ישראל שיווק בעמ,יח`,,1,39.90,39.90
548,חיתולי פרידום דריי שלב 5 האגיס (36),קימברלי קלארק ישראל שיווק בעמ,יח`,,1,39.90,39.90
549,חיתולי פרידום דריי שלב 6 האגיס (30),קימברלי קלארק ישראל שיווק בעמ,יח`,,1,39.90,39.90
550,זוג ניילון נצמד ניקול (30x2 מטר),קימברלי קלארק ישראל שיווק בעמ,יח`,,1,12.90,12.90
551,תחבושות קוטקס יאנג,קימברלי קלארק ישראל שיווק בעמ,יח`,,1,19.90,19.90
552,כרית יפנית רביעייה ניקול,קימברלי קלארק ישראל שיווק בעמ,יח`,,1,11.90,2.98
553,כריות יפניות ניקול (6),קימברלי קלארק ישראל שיווק בעמ,יח`,,1,11.90,1.98
554,ניקול מטליות רצפה רביעיה,קימברלי קלארק ישראל שיווק בעמ,יח`,,1,12.90,3.23
555,רוטב עגבניות 22% יכין (100 גרם),זנלכל בעמ,יח`,,1,1.90,1.90
556,עגבניות מרוסקות יכין (800 גרם),זנלכל בעמ,יח`,,1,6.90,0.86
557,אפונת גינה גדולה יכין (550 גרם),זנלכל בעמ,יח`,,1,5.90,1.07
558,אפונת גינה וגזר יכין (550 גרם),זנלכל בעמ,יח`,,1,5.90,1.07
559,שעועית צ`ילי מקסיקני חריף יכין (550 גרם),זנלכל בעמ,יח`,,1,6.90,1.19
560,גרעיני תירס מתוק יכין (550 גרם),זנלכל בעמ,יח`,,1,5.90,1.07
561,רוטב עגבניות 22% יכין (260 גרם),זנלכל בעמ,יח`,,1,3.50,1.35
562,עגב. מרוסקות בזיליקום (800 גרם),זנלכל בעמ,יח`,,1,6.90,0.86
563,חומוס שלם יכין (550 גרם),זנלכל בעמ,יח`,,1,5.90,1.07
564,חומץ 5% יכין (1 ליטר),זנלכל בעמ,יח`,,1,5.90,0.59
565,רוטב לימון משומר לתיבול יכין (1 ליטר),זנלכל בעמ,יח`,,1,7.90,0.79
566,מארז גרעיני תירס מתוק יכין (165x3 גרם),זנלכל בעמ,יח`,,1,9.90,6
567,סירופ דיאט בטעם פטל יכין (1 ליטר),זנלכל בעמ,יח`,,1,7.90,0.79
568,רוטב מתובל לשקשוקה יכין (260 גרם),זנלכל בעמ,יח`,,1,4.90,1.88
569,רוטב לפיצה יכין (260 גרם),זנלכל בעמ,יח`,,1,4.90,1.88
570,רוטב בולונז יכין (260 גרם),זנלכל בעמ,יח`,,1,4.90,1.88
571,קמח חיטה מלא סוגת (1 קג),סוגת תעשיות בעמ,יח`,,1,8.90,0.89
572,אורז בסגנון פרסי קלאסי סוגת (1 קג),סוגת תעשיות בעמ,יח`,,1,9.90,9.90
573,סוכר לבן סוגת (1 קג),סוגת תעשיות בעמ,יח`,,1,3.90,0.39
574,אורז ריזוטו עגול סוגת (1 קג),סוגת תעשיות בעמ,יח`,,1,9.90,0.99
575,בצק עלים צרפתי מרודד מעדנות (1 קג),תנובה קפואים,יח`,,1,21.90,2.19
576,מלווח מעדנות (6 יח` - 700 גרם),תנובה קפואים,יח`,,1,16.90,2.41
577,בורקס גבינה מעדנות,תנובה קפואים,יח`,,1,20.90,2.61
578,בורקס תפוא מעדנות,תנובה קפואים,יח`,,1,19.90,2.49
579,ריבועי בצק עלים מעדנות,תנובה קפואים,יח`,,1,25,3.13
580,משקה קל תפוזים ספרינג (1.5 ליטר),יפאורה,יח`,,1,6.40,0.43
581,נייר טואלט לב מולט) (32,קימברלי קלארק ישראל שיווק בעמ,יח`,,1,26.90,1.45
582,דלעת מקולפת 150  גר`השף,דין שיווק וקליה בעמ,יח`,,1,9.90,6.60
583,חומץ 5% עסיס (1 ליטר),קבוצת אסם סחר שות. מוגבלת,יח`,,1,7.90,7.90
584,בקבוק קוקה-קולה (1.5 ליטר),החברה המרכזית להפצת משקאות בעמ,יח`,,1,6.50,0.43
585,מי סודה שוופס (1.5 ליטר),יפאורה,יח`,,1,3.50,0.23
586,מטלית לכל סנו סושי (9),החברה הדרומית לשיווק בעמ,יח`,,1,11.90,1.32
587,סנו X לימון במיכל,החברה הדרומית לשיווק בעמ,יח`,,1,9.90,1.65
588,ניילון נצמד סנו סושי (30x2 מטר),החברה הדרומית לשיווק בעמ,יח`,,1,10.90,10.90
589,שמפו שטיחים ספריי סנו (600 מל),החברה הדרומית לשיווק בעמ,יח`,,1,23.90,3.98
590,סנובון תות לאסלה סנו (55x3 גרם),החברה הדרומית לשיווק בעמ,יח`,,1,11.90,7.21
591,סנובון לאסלה לימון סנו (55x3 גרם),החברה הדרומית לשיווק בעמ,יח`,,1,11.90,7.21
592,סנובון לאסלה לובר סנו (55x3 גרם),החברה הדרומית לשיווק בעמ,יח`,,1,11.90,7.21
593,אנטי קאלק לאסלה 750 מל,החברה הדרומית לשיווק בעמ,יח`,,1,15.90,2.12
594,אקונומיקה ז`אוול לימון סנו (4 ליטר),החברה הדרומית לשיווק בעמ,יח`,,1,15.90,0.40
595,ז`אוול מרסס לניקוי כללי לבנדר סנו (1 ליט,החברה הדרומית לשיווק בעמ,יח`,,1,19.90,19.90
596,סנומט 30 טבליות,החברה הדרומית לשיווק בעמ,יח`,,1,14.90,14.90
597,סנומט +30טבליות,החברה הדרומית לשיווק בעמ,יח`,,1,36.90,36.90
598,קוטל חרקים קיי 300 סנו (630 מל),החברה הדרומית לשיווק בעמ,יח`,,1,21.90,3.48
599,קוטל זבובים יתושים קיי 600 סנו (500 מל),החברה הדרומית לשיווק בעמ,יח`,,1,24,5.05
600,סנו-די דוחה יתושים כדורי סנו (50 מל),החברה הדרומית לשיווק בעמ,יח`,,1,20.90,41.80
601,סנו מקסימה 4 ליטר ורוד פסים,החברה הדרומית לשיווק בעמ,יח`,,1,19.90,4.98
602,סנו די ג`ונג`ל 50 מל,החברה הדרומית לשיווק בעמ,יח`,,1,19.90,39.80
603,סנו מקסימה 1.25 קג`,החברה הדרומית לשיווק בעמ,יח`,,1,13.90,11.12
604,סנו ז`אוול מרסס 1 ליטר,החברה הדרומית לשיווק בעמ,יח`,,1,19.90,19.90
605,קרם לניקוי כללי לימון סנו (750 מל),החברה הדרומית לשיווק בעמ,יח`,,1,11.90,1.59
606,מסיר שומנים פורטה פלוס סנו (750 מל),החברה הדרומית לשיווק בעמ,יח`,,1,16.90,2.25
607,סנו k3 פיתיון ג`ל קוטל חרקים 10  גר`סנו,החברה הדרומית לשיווק בעמ,יח`,,1,49.90,49.90
608,קוטל נמלים קיי 800 סנו (300  מל),החברה הדרומית לשיווק בעמ,יח`,,1,16.90,5.63
609,סנומט דוחה יתושים מילוי סנו) (45,החברה הדרומית לשיווק בעמ,יח`,,1,21.90,21.90
610,קוטל חרקים K2000 ללא ריח סנו (750 מל),החברה הדרומית לשיווק בעמ,יח`,,1,31.90,4.25
611,סנובון לאסלה קלאסיק כחול סנו (55x3 גרם),החברה הדרומית לשיווק בעמ,יח`,,1,18.90,11.45
612,אקונומיקה ז`אוול סמיכה סנו (4 ליטר),החברה הדרומית לשיווק בעמ,יח`,,1,15.90,0.40
613,מטלית ריצפה זיגזג סנו סושי (3),החברה הדרומית לשיווק בעמ,יח`,,1,12.90,12.90
614,סנו מקסימה 1.25 קג`,החברה הדרומית לשיווק בעמ,יח`,,1,13.90,11.12
615,סנו מקסימה 1.25 קג`,החברה הדרומית לשיווק בעמ,יח`,,1,13.90,11.12
616,טבעול-שניצל תירס 750 גרם,קבוצת אסם סחר שות. מוגבלת,יח`,,1,24.90,3.32
617,חטיפי כרובית בציפוי פריך טבעול (500 גרם),קבוצת אסם סחר שות. מוגבלת,יח`,,1,31.90,6.38
618,שעועית לבנה אפויה,ויטה -פרי גליל (החדשה) בעמ,יח`,,1,5.90,1.07
619,רביעיות סלט טונה 160  גר`יונה,סטארקיסט דיפלומט היינץ,יח`,,1,17.90,2.80
620,אפונה וגזר A2,ויטה -פרי גליל (החדשה) בעמ,יח`,,1,5.90,1.07
621,שעועית ירוקה 550גר,ויטה -פרי גליל (החדשה) בעמ,יח`,,1,5.90,1.07
622,חברים זהבה 3 דובים שוקו,קבוצת אסם סחר שות. מוגבלת,יח`,,1,7.90,3.16
623,נודלס אטריות ביצים שטוחות אסם (300 גרם),קבוצת אסם סחר שות. מוגבלת,יח`,,1,9.90,3.30
624,נודלס אטריות מסולסלות אסם (50x4 גרם),קבוצת אסם סחר שות. מוגבלת,יח`,,1,9.90,4.95
625,קורנפלקס מלא בדצ 500 גר`,יוניליוור ישראל שיווק בעמ,יח`,,1,15.90,3.18
626,מי סודה טמפו (1.5 ליטר),טמפו משקאות בעמ,יח`,,1,3,0.20
627,טבעות בצל תפוגן (700 גרם),קבוצת אסם סחר שות. מוגבלת,יח`,,1,16.90,2.41
628,מרכך כביסה ורוד בדין (4 ליטר),יוניליוור ישראל שיווק בעמ,יח`,,1,19.90,4.98
629,מרכך כביסה צהוב בדין (4 ליטר),יוניליוור ישראל שיווק בעמ,יח`,,1,19.90,4.98
630,מרכך כביסה כחול בדין (4 ליטר),יוניליוור ישראל שיווק בעמ,יח`,,1,19.90,4.98
631,תה 74,תה ויסוצקי (ישראל) בעמ,יח`,,1,13.10,10.48
632,תה ארל גריי ויסוצקי (100 גרם),תה ויסוצקי (ישראל) בעמ,יח`,,1,13.90,13.90
633,תה ארל גריי 200 גר`,תה ויסוצקי (ישראל) בעמ,יח`,,1,31.90,15.95
634,תה מעודן ויסוצקי (100),תה ויסוצקי (ישראל) בעמ,יח`,,1,16.90,16.90
635,תה קלאסיק ויסוצקי (100),תה ויסוצקי (ישראל) בעמ,יח`,,1,16.90,11.27
636,תה ארל גריי ויסוצקי (50),תה ויסוצקי (ישראל) בעמ,יח`,,1,27.90,37.20
637,תה הילולי פירות ויסוצקי הגן הקסום) (25,תה ויסוצקי (ישראל) בעמ,יח`,,1,17.50,28
638,תה שומר ויסוצקי הגן הקסום) (25,תה ויסוצקי (ישראל) בעמ,יח`,,1,17.50,46.67
639,הגן הקסום ורד הבר 25 שקיקים,תה ויסוצקי (ישראל) בעמ,יח`,,1,17.50,23.33
640,תה לואיזה וורבנה ויסוצקי הגן הקסום) (25,תה ויסוצקי (ישראל) בעמ,יח`,,1,17.50,35
641,תה ירוק נענע ויסוצקי (25),תה ויסוצקי (ישראל) בעמ,יח`,,1,24.90,66.40
642,בוטנים מטוגנים קליית גת (200 גרם),ליימן שליסל בעמ,יח`,,1,7.90,3.95
643,נאש צ אנס שקית 200 גר,ליימן שליסל בעמ,יח`,,1,8.90,4.45
644,לחם אחיד פרוס (750 גרם פיקוח,שלמה א. אנג`ל בעמ,יח`,,1,6.60,0.88
645,יוגורט ביו 3% דנונה (200 גרם),שטראוס גרופ בעמ/מצונן,יח`,,1,3.40,1.70
646,דנונה פרי בר פיצפוצים,שטראוס גרופ בעמ/מצונן,יח`,,1,4.40,2.54
647,פזוטקס מעופפים,החברה הדרומית לשיווק בעמ,יח`,,1,18.90,3
648,ממרח בטעם שוקולד השחר העולה (500 גרם),השחר העולה תעשית ממתקים בעמ,יח`,,1,12.90,2.58
649,ממרח בטעם שוקולד השחר העולה (1 קג),השחר העולה תעשית ממתקים בעמ,יח`,,1,23.90,23.90
650,ממרח 400 גר` פרווה השחר,השחר העולה תעשית ממתקים בעמ,יח`,,1,11.90,2.98
651,ממרח פרווה 1 קג` השחר,השחר העולה תעשית ממתקים בעמ,יח`,,1,22.90,22.90
652,אבקת קקאו השחר העולה (150 גרם),השחר העולה תעשית ממתקים בעמ,יח`,,1,9.90,6.60
653,אבקת קקאו השחר העולה (500 גרם),השחר העולה תעשית ממתקים בעמ,יח`,,1,29.90,5.98
654,קפה שחור קפה לנדוור (100 גרם),קבוצת אסם סחר שות. מוגבלת,יח`,,1,7.90,7.90
655,קפה שחור קפה לנדוור (100x3 גרם),קבוצת אסם סחר שות. מוגבלת,יח`,,1,22.90,7.63
656,קפה לנדוור לבוקר 100,קבוצת אסם סחר שות. מוגבלת,יח`,,1,7.90,7.90
657,קפה לנדוור אספרסו קפה טחון 100,קבוצת אסם סחר שות. מוגבלת,יח`,,1,7.90,7.90
658,משקה מוגז בטעם קולה פפסי (1.5 ליטר),טמפו משקאות בעמ,יח`,,1,5.90,0.39
659,משקה אורנג` מירנדה (1.5 ליטר),טמפו משקאות בעמ,יח`,,1,5.90,0.39
660,נוזל לניקוי כללי פנטסטיק סיף (4 ליטר),יוניליוור ישראל שיווק בעמ,יח`,,1,24.90,0.62
661,שמרים טריים שמרית (50 גרם),שטראוס גרופ בעמ/מצונן,יח`,,1,4.50,9
662,שמרים אקטיבים שימרית 500 גר`,שטראוס גרופ בעמ,יח`,,1,15.90,3.18
663,נטורינה קוקוס 200  גר`שמרית,שטראוס גרופ בעמ/מצונן,יח`,,1,6.90,3.45
664,מרגרינה ללא מלח לאפיה ובישול -שמרית,שטראוס גרופ בעמ/מצונן,יח`,,1,4.90,2.45
665,מרגרינה בטעם חמאה -שמרית,שטראוס גרופ בעמ/מצונן,יח`,,1,4.90,2.45
666,סחוג תימני,שטראוס גרופ בעמ/מצונן,יח`,,1,7.90,5.27
667,סחוג תימני,שטראוס גרופ בעמ/מצונן,יח`,,1,7.90,5.27
668,סחוג זחוק ירוק תימני חריף זהבי (150 גרם),שטראוס גרופ בעמ/מצונן,יח`,,1,7.90,5.64
669,חומוס צבר סמיר הגדול,קבוצת אסם סחר שות. מוגבלת,יח`,,1,13.90,3.48
670,חלב 3% בשקית טרה (1  ליטר)פיקוח,החב` המרכזית - טרה,יח`,,1,5.17,5.17
671,חלב 1% בקרטון טרה (1  ליטר)פ,החב` המרכזית - טרה,יח`,,1,5.59,5.59
672,שמנת חמוצה 15% טרה (200 מל),החב` המרכזית - טרה,יח`,,1,2.28,1.14
673,גבינה לבנה 5% 250 גר` פיקוח,החב` המרכזית - טרה,יח`,,1,4.75,1.90
674,גבינת טוב טעם,החב` המרכזית - טרה,יח`,,1,10.90,4.36
675,גבינה צהובה מגורדת 28% נעם (500 גרם),החב` המרכזית - טרה,יח`,,1,32.90,6.58
676,שיבולת שועל קוואקר (500 גרם),שטראוס פריטו ליי בעמ,יח`,,1,11.90,2.38
677,לחמניות חיטה מלאה דגנית עין בר (10),דגנית עין בר תעשיות מזון ואפיה,יח`,,1,11.90,1.59
678,לחמניות אצבע דגנית עין בר (10),דגנית עין בר תעשיות מזון ואפיה,יח`,,1,11.90,1.59
679,עלית הארק יקב הגליל (700 מל),יקב הגליל שיווק בעמ,יח`,,1,59.90,7.95
680,רוטב פטריות אסם (30 גרם),קבוצת אסם סחר שות. מוגבלת,יח`,,1,4.90,16.33
681,לחם אקטיב ברמן (750 גרם),י.את א. ברמן בעמ,יח`,,1,14.90,1.99
682,לחם אחיד כהה פרוס ברמן (750  גרם)פי,י.את א. ברמן בעמ,יח`,,1,6.60,0.88
683,פיתות אסלי ברמן) (10,י.את א. ברמן בעמ,יח`,,1,9.90,0.99
684,לחמניות שישייה,י.את א. ברמן בעמ,יח`,,1,7.90,1.76
685,לחמניות אקטיב ברמן,י.את א. ברמן בעמ,יח`,,1,11.90,2.64
686,לחם קל ברמן לענין קמח חיטה מלאה,י.את א. ברמן בעמ,יח`,,1,12.90,1.72
687,חלה קלה פרוסה ברמן (500 גרם),י.את א. ברמן בעמ,יח`,,1,12.90,2.58
688,לחם ברמן לעניין פרוס ברמן (750 גרם),י.את א. ברמן בעמ,יח`,,1,12.90,1.72
689,דגני קלות פרוס ברמן (500 גרם),י.את א. ברמן בעמ,יח`,,1,12.90,2.58
690,רוגלך,י.את א. ברמן בעמ,יח`,,1,11.90,2.38
691,לחם מקמח כוסמין מלא 750 גר` E FREE,י.את א. ברמן בעמ,יח`,,1,15.50,2.07
692,10 לחמניות בשקית ברמן,י.את א. ברמן בעמ,יח`,,1,9.90,1.32
693,חלה רגילה (500 גרם) פיקוח,י.את א. ברמן בעמ,יח`,,1,4.45,0.89
694,סוכרזית פטריה) (300,שטראוס גרופ בעמ,יח`,,1,7.90,3.21
695,סוכרזית פטנט) (700,שטראוס גרופ בעמ,יח`,,1,15.90,2.77
696,יין אדום יבש של סגל (750 מל),טמפו משקאות בעמ,יח`,,1,21,2.76
697,יין לבן יבש של סגל (750 מל),טמפו משקאות בעמ,יח`,,1,21,2.76
698,מלח גס מלח הארץ (1 קג),תה ויסוצקי (ישראל) בעמ,יח`,,1,7.50,7.50
699,מיץ תפוזים סחוט טבעי פרימור (1 ליטר),שטראוס גרופ בעמ/מצונן,יח`,,1,16.20,16.20
700,נקניק סלמי בשן זוגלובק (470 גרם),זוגלובק שיווק בעמ,יח`,,1,28.90,4.13
701,נקניקיות וניר 1 קג` זוגלובק,זוגלובק שיווק בעמ,יח`,,1,29.90,29.90
702,נקניקיות וינר זוגלובק (500 גרם),זוגלובק שיווק בעמ,יח`,,1,16.90,3.38
703,מארז פסטרמה חרמון+תה,זוגלובק שיווק בעמ,יח`,,1,33.90,4.24
704,בורקס גבינה זוגלובק (16 יח` - 800 גרם),זוגלובק שיווק בעמ,יח`,,1,19.90,2.49
705,בצק עלים זוגלובק,זוגלובק שיווק בעמ,יח`,,1,19.90,19.90
706,שניצל מן הצומח זוגלובק (1 קג),זוגלובק שיווק בעמ,יח`,,1,35.90,3.59
707,נקניקיות עוף זוגלובק (400 גרם),זוגלובק שיווק בעמ,יח`,,1,13.90,3.48
708,נקניקיות עוף זוגלובק (1 קג),זוגלובק שיווק בעמ,יח`,,1,29.90,29.90
709,תה מעושן 200,זוגלובק שיווק בעמ,יח`,,1,14.90,7.45
710,מעדן חלב מלבי גד (160 גרם),מחלבות גד שיווק 1992 בעמ,יח`,,1,5.60,3.50
711,גבינה צפתית מעודנת 5% גד (200 גרם),מחלבות גד שיווק 1992 בעמ,יח`,,1,14.90,7.45
712,ירח מתוק-גד,מחלבות גד שיווק 1992 בעמ,יח`,,1,5.60,3.73
713,לבנה בשמן זית-גד - מדף,מחלבות גד שיווק 1992 בעמ,יח`,,1,13.90,5.56
