,ItemName,ManufactureName,UnitQty,Quantity,QtyInPackage,ItemPrice,UnitOfMeasurePrice
4085,מארזפופקורן למיקרוגל בטעם חמאה 1+5 במתנה,סוגת תעשיות בעמ,יח`,,1,12.90,12.90
4086,מארזפופקורן למיקרוגל בטעם טבעי 1+5 במתנה,סוגת תעשיות בעמ,יח`,,1,12.90,12.90
4087,טבלאות פרה סוכריות תות,שטראוס גרופ בעמ,יח`,,1,4.90,4.90
4088,מיקס מעורב 390 גר`,שטראוס גרופ בעמ,יח`,,1,22.90,5.87
4089,חטיף תירס נאצ`ו מקסיקני דוריטוס (70 גרם),שטראוס פריטו ליי בעמ,יח`,,1,3.90,5.57
4090,חטיף תירס חמוץ חריף דוריטוס (70 גרם),שטראוס פריטו ליי בעמ,יח`,,1,3.90,5.57
4091,חטיף תירס גריל דוריטוס (70 גרם),שטראוס פריטו ליי בעמ,יח`,,1,3.90,5.57
4092,חטיף תירס בטעם טבעי דוריטוס (70 גרם),שטראוס פריטו ליי בעמ,יח`,,1,3.90,5.57
4093,שוקולד פרה מריר 60% קקאו עלית (100 גרם),שטראוס גרופ בעמ,יח`,,1,8.90,8.90
4094,אבקת קקאו עלית (150 גרם),שטראוס גרופ בעמ,יח`,,1,10.90,7.27
4095,שמפו קרטין מחזק הוואי (700 מל),הנקל סוד בעמ,יח`,,1,8.90,1.27
4096,מרכך מועשר בקרטין הוואי (700 מל),הנקל סוד בעמ,יח`,,1,8.90,1.27
4097,סוד כדוריות נתלה לאסלה לימון,גורי שיווק בעמ,יח`,,1,8.90,8.90
4098,סוד כדוריות נתלה לאסלה אורנים,גורי שיווק בעמ,יח`,,1,8.90,8.90
4099,שמפו לשיער ולגוף ספורט הוואי (700 מל),הנקל סוד בעמ,יח`,,1,8.90,1.27
4100,הוואי סבון ידיים נוזלי מי קוקוס שלישייה,הנקל סוד בעמ,יח`,,1,14.90,0.99
4101,הוואי סבון מוצק מי קוקוס 100  גר`רביעייה,הנקל סוד בעמ,יח`,,1,11.90,2.98
4102,כדוריות שלישייה בניחוח לימון,גורי שיווק בעמ,יח`,,1,19.90,19.90
4103,מרכך כביסה מרוכז בייבי סוד (900 מל),גורי שיווק בעמ,יח`,,1,12.90,1.43
4104,נוזל כלים תפוח סוד (650 מל),גורי שיווק בעמ,יח`,,1,6.90,1.06
4105,נוזל כלים רימון ותאנים סוד (650 מל),גורי שיווק בעמ,יח`,,1,6.90,1.06
4106,מרכך כביסה סוד סופט 4 ליטר,גורי שיווק בעמ,יח`,,1,17.90,0.45
4107,א.כ סוד קולור 2.5 קג`,גורי שיווק בעמ,יח`,,1,19.90,0.80
4108,נוזל רצפות סוד 2 ליטר כחול,גורי שיווק בעמ,יח`,,1,17.90,0.90
4109,בליסימו שוקולד 1.3 ליטר מריר נוגט,פלקו בעמ,יח`,,1,17.90,13.77
4110,מאגדת שלגון יוגורט שישייה,פלקו בעמ,יח`,,1,20,20
4111,מאגדת אייס קפה 6יח פלדמן,פלקו בעמ,יח`,,1,24.90,24.90
4112,מאגדת שלגון פרוזן יוגורט תות אננס שישי,פלקו בעמ,יח`,,1,20,20
4113,מנגל נירוסטה גדול על רגל,אוהב ציון בעמ (מבצעים),יח`,,1,79.90,79.90
4114,פרשבוקס מארז 5 קופסאות מרובע כתום,אוהב ציון בעמ (מבצעים),יח`,,1,9.90,9.90
4115,פרשבוקס מארז 5 קופסאות מלבן ירוק,אוהב ציון בעמ (מבצעים),יח`,,1,9.90,9.90
4116,בקבוק שתייה דגם  שקוף-700  מל-מפרץ ההרפ,שמחה זה אנחנו בעמ,יח`,,1,24.90,24.90
4117,נר  מספר-  פרצוף-ספרה 0,שמחה זה אנחנו בעמ,יח`,,1,5.90,5.90
4118,פרי חטיפי בריאות מארז 5 דגנים עם שוקולד,ש.שסטוביץ בעמ,יח`,,1,17.90,19.89
4119,קפסולות 14 למכונות נספרו עלית (10),שטראוס גרופ בעמ,יח`,,1,16.90,33.80
4120,סילאן טבעי 700 גר` יד מרדכי,שטראוס גרופ בעמ,יח`,,1,21.90,3.13
4121,דנונה פרו 20 גר` אפרסק,שטראוס גרופ בעמ/מצונן,יח`,,1,5.90,2.95
4122,חטיף צ`יפס קידס תפוצ`יפס (10*20),שטראוס פריטו ליי בעמ,יח`,,1,12.90,6.45
4123,שוש אפוי חטיף בוטנים עלית (25X10),שטראוס פריטו ליי בעמ,יח`,,1,12.90,5.16
4124,מארז ציטוס דולפינים עשרייה עלית,שטראוס פריטו ליי בעמ,יח`,,1,12.90,6.45
4125,מארז צ`יטוס כאפה עשירייה עלית,שטראוס פריטו ליי בעמ,יח`,,1,12.90,6.45
4126,מארז צ`יטוס איקס עיגול,שטראוס פריטו ליי בעמ,יח`,,1,12.90,6.45
4127,דניאלה מעדן בטעם מנגו שטראוס (88 גרם),שטראוס גרופ בעמ/מצונן,יח`,,1,4,4.55
4128,סיליט באנג אקונומיקה 750 מל,רקיט בנקיזר (ניר איסט) בעמ,יח`,,1,9.90,1.32
4129,ספריי להסרת כתמים וניש קליה (750 מל),רקיט בנקיזר (ניר איסט) בעמ,יח`,,1,18.90,2.52
4130,נוזל הברקה למדיח כלים פיניש (800 מל),רקיט בנקיזר (ניר איסט) בעמ,יח`,,1,30.90,3.86
4131,ג`ל להסרת כתמים וניש קליה (3 ליטר),רקיט בנקיזר (ניר איסט) בעמ,יח`,,1,39.90,13.30
4132,קליה ג`ל 3 ליטר,רקיט בנקיזר (ניר איסט) בעמ,יח`,,1,39.90,1.33
4133,קולון 8 קג`,רקיט בנקיזר (ניר איסט) בעמ,יח`,,1,42.90,5.36
4134,פיניש נוזל הברקה 800 מל לימון,רקיט בנקיזר (ניר איסט) בעמ,יח`,,1,30.90,3.86
4135,פיניש ג`ל 600 מל לימון AIO,רקיט בנקיזר (ניר איסט) בעמ,יח`,,1,34.90,5.82
4136,ג`ל למדיח כלים All in 1 פיניש (1 ליטר),רקיט בנקיזר (ניר איסט) בעמ,יח`,,1,44.90,4.49
4137,מבשם אויר אוטומטי חלום אואזיס,רקיט בנקיזר (ניר איסט) בעמ,יח`,,1,54.90,54.90
4138,מבשם אויר אוטומטי חלום ליל קיץ,רקיט בנקיזר (ניר איסט) בעמ,יח`,,1,54.90,54.90
4139,מילוי מבשם אויר אוטומטי אואזיס,רקיט בנקיזר (ניר איסט) בעמ,יח`,,1,26.90,10.76
4140,מילוי מבשם אויר אוטומטי חלום ליל קיץ,רקיט בנקיזר (ניר איסט) בעמ,יח`,,1,26.90,10.76
4141,מבשם אוויר חשמלי מכשיר חלום ליל קיץ,רקיט בנקיזר (ניר איסט) בעמ,יח`,,1,29.90,29.90
4142,צלחת פולי מבחר מותגים שמחה זה אנחנו,שמחה זה אנחנו בעמ,יח`,,1,9.90,9.90
4143,נרות ספירלה עם סמיילי,שמחה זה אנחנו בעמ,יח`,,1,7.90,7.90
4144,נרות ג`מבו  כוכבים- מכוניות,שמחה זה אנחנו בעמ,יח`,,1,6.90,6.90
4145,נרות ג`מבו  כוכבים- הלו קיטי,שמחה זה אנחנו בעמ,יח`,,1,6.90,6.90
4146,תפוצ`יפס 200 גר` קראנץ` מקסיקני,שטראוס פריטו ליי בעמ,יח`,,1,10.90,5.45
4147,שמיניית אקטימל תות בננה,שטראוס גרופ בעמ/מצונן,יח`,,1,19.90,2.49
4148,קפה נמס וניל עלית (200 גרם),שטראוס גרופ בעמ,יח`,,1,19.90,9.95
4149,פסק זמן מיני עלית (18-20  יח`- 390 גרם),שטראוס גרופ בעמ,יח`,,1,23.90,5.98
4150,מסטיק ללא סוכר קלאסי בזוקה (28 גרם),שטראוס גרופ בעמ,יח`,,1,4.90,17.50
4151, משפחתי- מיני מקופלת חלבי 400 גר`,שטראוס גרופ בעמ,יח`,,1,23.90,5.98
4152,משחת שיניים אלמקס (100 מל),ש.שסטוביץ בעמ,יח`,,1,18.90,18.90
4153,גבינת צ`דר אנגלית כתומה 200 גרם,נטו מלינדה סחר בעמ,יח`,,1,21.70,10.85
4154,צדר לבן פרוס 200 גר`,נטו מלינדה סחר בעמ,יח`,,1,19.90,9.95
4155,גבינת צ`דר אנגלית 200 גרם,נטו מלינדה סחר בעמ,יח`,,1,19.90,9.95
4156,יוגורט ביו פרופ 3% תות מולר (150 גרם),החב` המרכזית - טרה,יח`,,1,5,3.33
4157,מולר מעדן אפרסק 150 מל,החב` המרכזית - טרה,יח`,,1,5,3.33
4158,יוגורט ביו פרופ 3% לימון מולר (150 גרם),החב` המרכזית - טרה,יח`,,1,5,3.33
4159,מולר יוגורט פרי פרופ יער 150 מל,החב` המרכזית - טרה,יח`,,1,5,3.33
4160,תבור גבינה לאפיה צוריאל,החב` המרכזית - טרה,יח`,,1,24.90,4.98
4161,חלב עיזים מלא 4.1% משק צוריאל (1 ליטר),החב` המרכזית - טרה,יח`,,1,16.50,16.50
4162,יוגורט ביו ביאנקו 2.8% מולר (200 גרם),החב` המרכזית - טרה,יח`,,1,3.80,1.90
4163,מולר מיקס יוגורט קרמי,החב` המרכזית - טרה,יח`,,1,5.90,3.47
4164,מולר סימפלי פרויט תות שדה,החב` המרכזית - טרה,יח`,,1,5,3.33
4165,מולר סימפלי פרויט אפרסק,החב` המרכזית - טרה,יח`,,1,5,3.33
4166,מולר סימפלי פרויט פירות היער,החב` המרכזית - טרה,יח`,,1,5,3.33
4167,גבינה לבנה 5% 750 גר` פיקוח,החב` המרכזית - טרה,יח`,,1,14.25,1.90
4168,מולר סימפלי פרויט קיווי,החב` המרכזית - טרה,יח`,,1,5,3.33
4169,מולר מיקס קרמי בתוספת קורנפלקס,החב` המרכזית - טרה,יח`,,1,5.90,3.93
4170,גבינה צהובה ואקום 28%,החב` המרכזית - טרה,יח`,,1,28,5.60
4171,גבינה צהובה דק דק 28% אדם,החב` המרכזית - טרה,יח`,,1,16.50,8.25
4172,ממרח גבינה ושוקולד מוו (200 גרם),החב` המרכזית - טרה,יח`,,1,11.30,11.30
4173,מאגדת שמיניי ה במתיקות מעודנת 2%,החב` המרכזית - טרה,יח`,,1,18.30,18.30
4174,יוגורט ביו נטורל 1.7% מולר (150x8 גרם),החב` המרכזית - טרה,יח`,,1,17.90,1.49
4175,יוגורט ביו נטורל 2.8% מולר (150x8 גרם),החב` המרכזית - טרה,יח`,,1,17.90,17.90
4176,מאגדת שמינייה מולר סיפלי תות,החב` המרכזית - טרה,יח`,,1,29.90,29.90
4177,מאגדת שמינייה מולר סיפלי פרוט,החב` המרכזית - טרה,יח`,,1,29.90,29.90
4178,מעדן בטעם וניל עם קצפת מוו (123 גרם),החב` המרכזית - טרה,יח`,,1,2.80,2.80
4179,מעדן בטעם שוקולד קצפת מוו (123 גרם),החב` המרכזית - טרה,יח`,,1,2.80,2.80
4180,מעדן בטעם שוקולד מוו (100x8 גרם),החב` המרכזית - טרה,יח`,,1,13.50,1.69
4181,מעדן בטעם שוקולד 1.5% שומן מוו (125 גרם),החב` המרכזית - טרה,יח`,,1,2.70,2.16
4182,מעדן בטעם וניל 1.5% שומן מוו (125 גרם),החב` המרכזית - טרה,יח`,,1,2.70,2.16
4183,יוגורט תות 3% שומן מוו (125 גרם),החב` המרכזית - טרה,יח`,,1,2.80,2.80
4184,מעדן מוו שוקולד ומוס שוקולד,החב` המרכזית - טרה,יח`,,1,2.80,2.28
4185,מעדן מוו וניל ומוס שוקולד,החב` המרכזית - טרה,יח`,,1,2.80,2.28
4186,גבינה צהובה דקה דקה 15% נעם (200 גרם),החב` המרכזית - טרה,יח`,,1,16.90,8.45
4187,יוגורט 0% תות סימפלי מולר (150 גרם),החב` המרכזית - טרה,יח`,,1,5,3.33
4188,יוגורט 0% אפרסק סימפלי מולר (150 גרם),החב` המרכזית - טרה,יח`,,1,5,3.33
4189,מאגדת שמינייה מולר סיפלי 0%,החב` המרכזית - טרה,יח`,,1,29.90,29.90
4190,בולגרית 5% בגביע 250 גר` צוריאל,החב` המרכזית - טרה,יח`,,1,22.90,9.16
4191,מולר נטורל+ פקאן גרעינים וחמוציות 150,החב` המרכזית - טרה,יח`,,1,5.90,3.93
4192,מולר מיקס שקדים ובוטנים בקרמל 170 גרם,החב` המרכזית - טרה,יח`,,1,5.90,3.47
4193,מולר מיקס קליק 170 גרם,החב` המרכזית - טרה,יח`,,1,5.90,3.47
4194, קוטג`וחצי 5% 375 גר,החב` המרכזית - טרה,יח`,,1,7.90,2.11
4195,מוצרלה נעם פתיחה חוזרת 200 גר`,החב` המרכזית - טרה,יח`,,1,18.90,9.45
4196,חלב שקית 3% 1 ליטר מהדרין וסט,החב` המרכזית - טרה,יח`,,1,5.17,5.17
4197,חלב קרטון 2 ליטר 3% מהדרין וסט,החב` המרכזית - טרה,יח`,,1,11.88,5.94
4198,חלב הומוגני 3% 1 ליטר מהדרין וסט,החב` המרכזית - טרה,יח`,,1,5.94,5.94
4199,מולר רייס בטעם במתיקות עדינה 170 גר`,החב` המרכזית - טרה,יח`,,1,4.90,2.88
4200,מולר רייס בטעם תות 170 גר`,החב` המרכזית - טרה,יח`,,1,4.90,2.88
4201,יוגורט ביו פרופ 0.9% תות מולר (150 גרם),החב` המרכזית - טרה,יח`,,1,5,3.33
4202,חלב מועשר דל לקטוז 1 ליטר טרה,החב` המרכזית - טרה,יח`,,1,7.10,7.10
4203,מולר רייס בטעם תפוח קינמון 170 גר`,החב` המרכזית - טרה,יח`,,1,4.90,2.88
4204,משקה שוקו בקבוק 1.5 ליטר בבקבוק,החב` המרכזית - טרה,יח`,,1,15.90,15.90
4205,משקה שוקו מועשר בבקבוק 1 ליטר טרה,החב` המרכזית - טרה,יח`,,1,11.50,11.50
4206,משקה חלב בטעם בננה 1 ליטר טרה,החב` המרכזית - טרה,יח`,,1,11.50,11.50
4207,משקה חלב בטעם מוקה 1 ליטר טרה,החב` המרכזית - טרה,יח`,,1,11.50,11.50
4208,משקה חלב בטעם שוקולד אגוזים 1 ליטר טרה,החב` המרכזית - טרה,יח`,,1,11.50,11.50
4209,משקה סויה קלאסי 1 ליטר משק צוריאל,החב` המרכזית - טרה,יח`,,1,9.90,9.90
4210,משקה סויה במתיקות מופחת 1 ליטר משק צוריא,החב` המרכזית - טרה,יח`,,1,9.90,0.01
4211,משקה סויה בטעם וניל 1 ליטר משק צוריאל,החב` המרכזית - טרה,יח`,,1,9.90,0.01
4212,משקה סויה לייט 1 ליטר משק צוריאל,החב` המרכזית - טרה,יח`,,1,9.90,0.01
4213,משקה שקדים קלאסי 1 ליטר משק צוריאל,החב` המרכזית - טרה,יח`,,1,11.90,11.90
4214,מולר יוגורט BIO מועשר חלבון ( 200 גר),החב` המרכזית - טרה,יח`,,1,5.90,2.95
4215,מולר Active מועשר בחלבון עם תות ( 150 גר,החב` המרכזית - טרה,יח`,,1,5.90,3.93
4216,מולר Active מועשר בחלבון עם פירות יער (,החב` המרכזית - טרה,יח`,,1,5.90,3.93
4217,קשקבל נועם פתיחה חוזרת 200 גר`,החב` המרכזית - טרה,יח`,,1,21.90,10.95
4218,מולר סימפלי פרויט מנגו 1.5%,החב` המרכזית - טרה,יח`,,1,5,3.33
4219,מאגדת שמינייה מולר סיפלי מנגו ואננס 1.5%,החב` המרכזית - טרה,יח`,,1,29.90,29.90
4220,אינסטנט פודינג בטעם וניל מיה (85 גרם),מיה תעשיות מזון מ.ת.מ. בעמ,יח`,,1,3.90,4.59
4221,פודינג בטעם שוקולד 85 גר` מיה,מיה תעשיות מזון מ.ת.מ. בעמ,יח`,,1,3.90,4.59
4222,ג`לי בטעם משמש 90 גר` מיה,מיה תעשיות מזון מ.ת.מ. בעמ,יח`,,1,3.90,4.33
4223,מאלבי קר 112גרם,דין שיווק וקליה בעמ,יח`,,1,7.90,7.05
4224,פלמוליב חלב ודבש 750מל חדש,ש.שסטוביץ בעמ,יח`,,1,19.90,2.65
4225,צמרונים לתינוק בלונס) (50,ש.שסטוביץ בעמ,יח`,,1,5.90,5.90
4226,צלחות גדולות זהב לפיד) (50,פאלאס תעשיות נטו (2014) בעמ,יח`,,1,16.90,16.90
4227,מפות שולחן עבה במיוחד 135/240 לפיד) (8,פאלאס תעשיות נטו (2014) בעמ,יח`,,1,11.90,11.90
4228,שקית אשפה קרם+ידית 75/90 לפיד 40 יח,פאלאס תעשיות נטו (2014) בעמ,יח`,,1,12.90,12.90
4229,גביעי איחסון 1/4 ליטר לפיד) (20,פאלאס תעשיות נטו (2014) בעמ,יח`,,1,9.90,9.90
4230,גביעי איחסון 1/2 ליטר לפיד) (15,פאלאס תעשיות נטו (2014) בעמ,יח`,,1,9.90,9.90
4231,מיכל אחסון 1 ליטר לפיד (5),פאלאס תעשיות נטו (2014) בעמ,יח`,,1,9.90,9.90
4232,מיכל אחסון 2 ליטר לפיד (4),פאלאס תעשיות נטו (2014) בעמ,יח`,,1,9.90,9.90
4233,תבניות אלומניום גדול 105,פאלאס תעשיות נטו (2014) בעמ,יח`,,1,1.50,1.50
4234,תבניות אלומניום עגולות 10,פאלאס תעשיות נטו (2014) בעמ,יח`,,1,1.50,1.50
4235,מפה 45 מטר סופר עבה פאלאס,פאלאס תעשיות נטו (2014) בעמ,יח`,,1,34.90,34.90
4236,מפה מעוטרת גליל לפיד,פאלאס תעשיות נטו (2014) בעמ,יח`,,1,29.90,29.90
4237,כף צבעונית לפיד (100),פאלאס תעשיות נטו (2014) בעמ,יח`,,1,9.90,9.90
4238,מזלג צבעוני לפיד (100),פאלאס תעשיות נטו (2014) בעמ,יח`,,1,9.90,9.90
4239,סכין צבעוני לפיד (100),פאלאס תעשיות נטו (2014) בעמ,יח`,,1,9.90,9.90
4240,כפות חד פעמיות לפיד (100),פאלאס תעשיות נטו (2014) בעמ,יח`,,1,5.90,5.90
4241,כפיות לפיד) (100,פאלאס תעשיות נטו (2014) בעמ,יח`,,1,5.90,5.90
4242,מזלג חד פעמי לפיד (100),פאלאס תעשיות נטו (2014) בעמ,יח`,,1,5.90,5.90
4243,סכין חד פעמי לפיד (100),פאלאס תעשיות נטו (2014) בעמ,יח`,,1,5.90,5.90
4244,כוס נייר+מכסה 14 יח`,פאלאס תעשיות נטו (2014) בעמ,יח`,,1,7.90,7.90
4245,כוס יהלום לפיד (40),פאלאס תעשיות נטו (2014) בעמ,יח`,,1,9.90,9.90
4246,צלחות גדולות 1 קילו -פאלאס,פאלאס תעשיות נטו (2014) בעמ,יח`,,1,19.90,19.90
4247,קפה PLATINUM אפריקאי 200 גר,שטראוס גרופ בעמ,יח`,,1,25.90,12.95
4248,קפה PLATINUM ברזילאי 200 גר,שטראוס גרופ בעמ,יח`,,1,21.90,10.95
4249,כרוב אדום במיונז אחלה (120 גרם),שטראוס גרופ בעמ/מצונן,יח`,,1,5,4.17
4250,שמיניית אצבעות שוקולד מגדים סוכריות קופצ,שטראוס גרופ בעמ,יח`,,1,7.90,8.23
4251,עלי חסה ערבית שטופים 250 גר טעם הטבע,שטראוס גרופ בעמ/מצונן,יח`,,1,9.90,3.96
4252,מגבות מטבח לובלי שמנייה,שניב תעשיות נייר בעמ,יח`,,1,12.90,12.90
4253,מפיות טאצ` 150 יח,שניב תעשיות נייר בעמ,יח`,,1,6.90,6.90
4254,טואלט לאבלי 32 לבן.,שניב תעשיות נייר בעמ,יח`,,1,29.90,29.90
4255,ממחטות טאצ` חמישייה צבעוני 500 דף,שניב תעשיות נייר בעמ,יח`,,1,11.90,11.90
4256,רבע לשבע אגוזים 120 גר`,שטראוס גרופ בעמ,יח`,,1,12.90,10.75
4257,חומוס עם טחינה אחלה (400 גרם),שטראוס גרופ בעמ/מצונן,יח`,,1,11.50,2.88
4258,חומוס וזעתר אחלה (400 גרם),שטראוס גרופ בעמ/מצונן,יח`,,1,11.50,2.88
4259,חומוס עם צנובר אחלה (400 גרם),שטראוס גרופ בעמ/מצונן,יח`,,1,11.50,2.88
4260,חומוס וחריף אחלה (400 גרם),שטראוס גרופ בעמ/מצונן,יח`,,1,11.50,2.88
4261,מעדן בטעם תות בננה גמדים (100x8 גרם),שטראוס גרופ בעמ/מצונן,יח`,,1,18.80,2.35
4262,קפה נמס מוקה עלית (200 גרם),שטראוס גרופ בעמ,יח`,,1,19.90,9.95
4263,עלי רוקט שטראוס 150 גר`-טעם הטבע,שטראוס גרופ בעמ/מצונן,יח`,,1,9.90,6.60
4264,מילקי טופ עדשים,שטראוס גרופ בעמ/מצונן,יח`,,1,4.60,2.71
4265,טחינה משומשום מלא אחלה (500 גרם),שטראוס גרופ בעמ/מצונן,יח`,,1,14.90,2.98
4266,ספלנדיד תפוז בדצ,שטראוס גרופ בעמ,יח`,,1,10.90,10.90
4267,מארז פן + מחליק,קנדי חשמל ונכסים בעמ,יח`,,1,79.90,79.90
4268,אפרופו 50 גר` איטליאנו,קבוצת אסם סחר שות. מוגבלת,יח`,,1,5,10
4269,פודינג בטעם וניל צרפתי 80  גר`אסם,קבוצת אסם סחר שות. מוגבלת,יח`,,1,5.90,7.38
4270,מיני מאפינס שוקו צ`יפס בונז`ור,קבוצת אסם סחר שות. מוגבלת,יח`,,1,8.50,8.50
4271,מיני מאפינס שוקו בונז`ור,קבוצת אסם סחר שות. מוגבלת,יח`,,1,8.50,8.50
4272,עוגת הבית בראוניס שבת שוקולד ריבת חלב 38,קבוצת אסם סחר שות. מוגבלת,יח`,,1,18.90,4.97
4273,דובונים חטיף תפוחי אדמה אסם (20x5 גרם),קבוצת אסם סחר שות. מוגבלת,יח`,,1,13.90,13.90
4274,גביעי גלידה אסם) (24,קבוצת אסם סחר שות. מוגבלת,יח`,,1,13.90,14.63
4275,גביעי גלידה אמריקאים אסם) (24,קבוצת אסם סחר שות. מוגבלת,יח`,,1,13.90,11.58
4276,במבה אסם (200 גרם),קבוצת אסם סחר שות. מוגבלת,יח`,,1,9.90,4.95
4277,מארז 8 דני וניל,שטראוס גרופ בעמ/מצונן,יח`,,1,16.40,16.40
4278,רצועות פלפלים קלויים אחלה (400 גרם),שטראוס גרופ בעמ/מצונן,יח`,,1,16.50,4.13
4279,קפה טורקי עלית (85x3 גרם),שטראוס גרופ בעמ,יח`,,1,19.90,7.80
4280,עוגת שוקולד עם קרם שוקולד,שטראוס גרופ בעמ,יח`,,1,17.90,5.42
4281,תפוצ`יפס 200 גר` שמנת בצל,שטראוס פריטו ליי בעמ,יח`,,1,10.90,5.45
4282,מארז 4 דני לשתייה,שטראוס גרופ בעמ/מצונן,יח`,,1,11,2.20
4283,מילקי שמיניה,שטראוס גרופ בעמ/מצונן,יח`,,1,19.90,2.29
4284,שוקולד מריר עלית (100x5 גרם),שטראוס גרופ בעמ,יח`,,1,22.90,4.58
4285,צ`יקו להכנת משקה צ`יקוריה עלית (130 גרם),שטראוס גרופ בעמ,יח`,,1,24.90,19.15
4286,שמנת עמידה לקצפת 38% שומן 250 מל,שטראוס גרופ בעמ/מצונן,יח`,,1,6.18,2.47
4287,שמן זית כתית מעולה יד מרדכי (750 מל),שטראוס גרופ בעמ,יח`,,1,32.90,4.39
4288,שוקולד פרה חלב עלית (100x5 גרם),שטראוס גרופ בעמ,יח`,,1,22.90,4.58
4289,צלחות ענק קרם) (25 פאלאס,פאלאס תעשיות נטו (2014) בעמ,יח`,,1,14.90,14.90
4290,צלחות ענק זהב פאלאס) (25,פאלאס תעשיות נטו (2014) בעמ,יח`,,1,14.90,14.90
4291,צלחת מרק קרם 25 יח פאלאס,פאלאס תעשיות נטו (2014) בעמ,יח`,,1,6.90,6.90
4292,צלחת מרק זהב 25 יח פאלאס,פאלאס תעשיות נטו (2014) בעמ,יח`,,1,6.90,6.90
4293,צלחת קטנה קרם 25 יח פאלאס,פאלאס תעשיות נטו (2014) בעמ,יח`,,1,5.90,5.90
4294,קערית אובלית זהב 25 יח פאלאס,פאלאס תעשיות נטו (2014) בעמ,יח`,,1,4.90,4.90
4295,נר נשמה בפחית פאלאס,פאלאס תעשיות נטו (2014) בעמ,יח`,,1,1.90,1.90
4296,נרות שבת 6 יח 140 גר,פאלאס תעשיות נטו (2014) בעמ,יח`,,1,3.90,2.79
4297,נרות שבת 8 יח 140 גר,פאלאס תעשיות נטו (2014) בעמ,יח`,,1,3.90,2.79
4298,נרות שבת 16 יח 140 גר,פאלאס תעשיות נטו (2014) בעמ,יח`,,1,3.90,2.79
4299,נרות שבת 20 יח 140 יח,פאלאס תעשיות נטו (2014) בעמ,יח`,,1,3.90,2.79
4300,תבנית אלומניום קטנה R29 + מכסה,פאלאס תעשיות נטו (2014) בעמ,יח`,,1,11.90,11.90
4301,כוסות נייר b8 פאלאס (50),פאלאס תעשיות נטו (2014) בעמ,יח`,,1,7.90,0.16
4302,קערה לסלט קרם פאלאס 10 10 יח,פאלאס תעשיות נטו (2014) בעמ,יח`,,1,9.90,9.90
4303,מפות  אלבד+ דוגמא 2יח 2.70*1.20,פאלאס תעשיות נטו (2014) בעמ,יח`,,1,12.90,12.90
4304,מפיות אירוח נקודות 80 יח לפיד,פאלאס תעשיות נטו (2014) בעמ,יח`,,1,5.90,5.90
4305,כוסות חד פעמיות לשתיה קרה פאלאס (100),פאלאס תעשיות נטו (2014) בעמ,יח`,,1,3.90,3.90
4306,מפיות לבנות 100 יח לפיד,פאלאס תעשיות נטו (2014) בעמ,יח`,,1,3.90,3.90
4307,סט סכום מוכסף 100 יח,פאלאס תעשיות נטו (2014) בעמ,יח`,,1,19.90,19.90
4308,כוסות שתיה קרה 330 מל 40 יח,פאלאס תעשיות נטו (2014) בעמ,יח`,,1,5.90,5.90
4309,תבנית אלומניום בינונית R2 פאלאס 5יח,פאלאס תעשיות נטו (2014) בעמ,יח`,,1,8.90,8.90
4310,תחליב רחצה נקה 7 ירוק אלוורה,החברה הדרומית לשיווק בעמ,יח`,,1,11.90,1.59
4311,תחליב רחצה נקה 7 וניל שקד,החברה הדרומית לשיווק בעמ,יח`,,1,11.90,1.59
4312,טיטניום ספרי גוף קלאסי 150 מל,החברה הדרומית לשיווק בעמ,יח`,,1,9.90,6.60
4313,טיטניום דאודורנט,החברה הדרומית לשיווק בעמ,יח`,,1,9.90,6.60
4314,שמפו קרטין טהור נטורל פורמולה (400 מל),החברה הדרומית לשיווק בעמ,יח`,,1,29.90,7.48
4315,דאודורנט גולד טיטניום (180 מל),החברה הדרומית לשיווק בעמ,יח`,,1,14.90,8.28
4316,סקינגארד סקין משפחתי 300/50 ווט,החברה הדרומית לשיווק בעמ,יח`,,1,54.90,18.30
4317,כובע קסקט ריקמה,טומי,יח`,,1,19.90,19.90
