,ItemName,ManufactureName,UnitQty,Quantity,QtyInPackage,ItemPrice,UnitOfMeasurePrice
1220,אקונומיקה ז`אוול לימון סנו (4 ליטר),החברה הדרומית לשיווק בעמ,יח`,,1,15.90,0.40
1221,ז`אוול מרסס לניקוי כללי לבנדר סנו (1 ליט,החברה הדרומית לשיווק בעמ,יח`,,1,14.90,14.90
1222,סנו מקסימה 1.25 קג`,החברה הדרומית לשיווק בעמ,יח`,,1,13.90,11.12
1223,סנומט 30 טבליות,החברה הדרומית לשיווק בעמ,יח`,,1,14.90,14.90
1224,קוטל חרקים קיי 300 סנו (630 מל),החברה הדרומית לשיווק בעמ,יח`,,1,21.90,3.48
1225,סנו-די דוחה יתושים כדורי סנו (50 מל),החברה הדרומית לשיווק בעמ,יח`,,1,17.70,35.40
1226,סנו די תרסיס,החברה הדרומית לשיווק בעמ,יח`,,1,20.90,16.72
1227,סנו די נוזל+משאבה,החברה הדרומית לשיווק בעמ,יח`,,1,22.90,45.80
1228,סנו מקסימה 4 ליטר ורוד פסים,החברה הדרומית לשיווק בעמ,יח`,,1,19.90,4.98
1229,סנו מקסימה 1.25 קג`,החברה הדרומית לשיווק בעמ,יח`,,1,13.90,11.12
1230,מים מזוקקים 2 ליטר לגיהוץ,החברה הדרומית לשיווק בעמ,יח`,,1,16.90,8.45
1231,סנו ז`אוול מרסס 1 ליטר,החברה הדרומית לשיווק בעמ,יח`,,1,14.90,14.90
1232,ז`אוול מונטבלאן ג`ל לאסלות סנו (750 מל),החברה הדרומית לשיווק בעמ,יח`,,1,9.90,1.32
1233,סושי שקיות אשפה גדולות 50 יח`,החברה הדרומית לשיווק בעמ,יח`,,1,19.90,19.90
1234,מש.שיניים אורביטול ילדים,החברה הדרומית לשיווק בעמ,יח`,,1,6.80,4.69
1235,סנומט דוחה יתושים מילוי סנו) (45,החברה הדרומית לשיווק בעמ,יח`,,1,14.80,14.80
1236,רסס ונגב לניקוי כללי תרסיס סנו (750 מל),החברה הדרומית לשיווק בעמ,יח`,,1,13.80,2.30
1237,סנו מקסימה 4 ליטר לבן,החברה הדרומית לשיווק בעמ,יח`,,1,19.90,4.98
1238,סופג  לחות-מילוי סנו,החברה הדרומית לשיווק בעמ,יח`,,1,13.90,4.09
1239,אנטי קלאק מרסס ברזים/ כיורים,החברה הדרומית לשיווק בעמ,יח`,,1,16.90,16.90
1240,סנומוד מדונה,החברה הדרומית לשיווק בעמ,יח`,,1,11.90,7.93
1241,אקונומיקה ז`אוול סמיכה סנו (4 ליטר),החברה הדרומית לשיווק בעמ,יח`,,1,15.90,0.40
1242,מטלית ריצפה זיגזג סנו סושי (3),החברה הדרומית לשיווק בעמ,יח`,,1,12.90,12.90
1243,כרית יפנית לכלים אקטיב סנו סושי (4),החברה הדרומית לשיווק בעמ,יח`,,1,11.90,11.90
1244,סנו מקסימה 1.25 קג`,החברה הדרומית לשיווק בעמ,יח`,,1,13.90,11.12
1245,שקיות אשפה לפח 65x54 סנו סושי (60),החברה הדרומית לשיווק בעמ,יח`,,1,22.90,22.90
1246,שקיות סנדביצ`ים סנו סושי (150x2),החברה הדרומית לשיווק בעמ,יח`,,1,13.90,13.90
1247,רב מגבת ג`מבו סנו סושי,החברה הדרומית לשיווק בעמ,יח`,,1,24.90,6.38
1248,סושי רדיד אלומיניום צמד,החברה הדרומית לשיווק בעמ,יח`,,1,12.90,12.90
1249,סנו סושי - רדיד אלומיניום צמד 7.5*45,החברה הדרומית לשיווק בעמ,יח`,,1,16.90,16.90
1250,טבעול-שניצל תירס 750 גרם,קבוצת אסם סחר שות. מוגבלת,יח`,,1,24.90,3.32
1251,חטיפי כרובית בציפוי פריך טבעול (500 גרם),קבוצת אסם סחר שות. מוגבלת,יח`,,1,31.90,6.38
1252,פול מצרי 560 גר,ויטה -פרי גליל (החדשה) בעמ,יח`,,1,4.90,0.88
1253,שעועית לבנה אפויה,ויטה -פרי גליל (החדשה) בעמ,יח`,,1,5.90,1.07
1254,חומוס שלם A2,ויטה -פרי גליל (החדשה) בעמ,יח`,,1,5.90,0.98
1255,אפונה גדולה A2,ויטה -פרי גליל (החדשה) בעמ,יח`,,1,5.90,0.98
1256,אפונה וגזר A2,ויטה -פרי גליל (החדשה) בעמ,יח`,,1,5.90,1.07
1257,תירס גרעינים 340,ויטה -פרי גליל (החדשה) בעמ,יח`,,1,4.90,1.09
1258,תירס גרעינים 550 גר`,ויטה -פרי גליל (החדשה) בעמ,יח`,,1,5.90,1.07
1259,וופלים מקמח חיטה מלאה מן,רוקחמן בעמ,יח`,,1,5.90,1.18
1260,עוגיות מובחרות בטעם חמאה מן (300 גרם),רוקחמן בעמ,יח`,,1,6.90,2.30
1261,וופל שוקולד מן (200 גרם),רוקחמן בעמ,יח`,,1,4.90,2.45
1262,וופלים לימון מן (200 גרם),רוקחמן בעמ,יח`,,1,4.90,2.45
1263,וופלים 200 גר` קפה מן,רוקחמן בעמ,יח`,,1,4.90,2.45
1264,וופל 200 גר` וניל מן,רוקחמן בעמ,יח`,,1,4.90,2.45
1265,ופל מן מצופה 250 גר מן,רוקחמן בעמ,יח`,,1,5.90,2.36
1266,וופלים מצופים מן (1 קג),רוקחמן בעמ,יח`,,1,19.90,19.90
1267,וופל שוקולד מן (500 גרם),רוקחמן בעמ,יח`,,1,8.90,1.78
1268,וופלים 500 גר לימון מן,רוקחמן בעמ,יח`,,1,8.90,1.78
1269,עוגיות חיטה מלאה מן (300 גרם),רוקחמן בעמ,יח`,,1,6.90,2.30
1270,עוגיות כוכבים בטעם שוקולד מן (300 גרם),רוקחמן בעמ,יח`,,1,6.90,2.30
1271,עוגיות בטעם וניל 300 גר` מן,רוקחמן בעמ,יח`,,1,6.90,2.30
1272,עוגיות בטעם קרמל מן (300 גרם),רוקחמן בעמ,יח`,,1,6.90,2.30
1273,עוגיות חיטה מלאה בטעם חלווה 250 גרם,רוקחמן בעמ,יח`,,1,6.90,2.76
1274,ופלים ללא תוספת סוכר בטעם שוקולד,רוקחמן בעמ,יח`,,1,7.90,4.39
1275,חברים זהבה 3 דובים שוקו,קבוצת אסם סחר שות. מוגבלת,יח`,,1,7.90,3.16
1276,נודלס אטריות ביצים שטוחות אסם (300 גרם),קבוצת אסם סחר שות. מוגבלת,יח`,,1,9.90,3.30
1277,נודלס אטריות מסולסלות אסם (50x4 גרם),קבוצת אסם סחר שות. מוגבלת,יח`,,1,9.90,4.95
1278,נקניקיות ביס יחיעם (380 גרם),מעדני יחיעם (1993) בעמ,יח`,,1,10.90,2.87
1279,סלמי סרוולט יחיעם (250 גרם),מעדני יחיעם (1993) בעמ,יח`,,1,34.90,13.96
1280,קבנוס קלאסי יחיעם (125 גרם),מעדני יחיעם (1993) בעמ,יח`,,1,12.90,10.32
1281,קבנוס פפרוני יחיעם (125 גרם),מעדני יחיעם (1993) בעמ,יח`,,1,12.90,10.32
1282,משקה קל מנגו פסיפלורה ג`אמפ (1.5 ליטר),טמפו משקאות בעמ,יח`,,1,5.50,0.37
1283,משקה מוגז בטעם קולה פפסי (1.5x6 ליטר),טמפו משקאות בעמ,יח`,,1,29.90,3.32
1284,צ`יפס מובחר תפוגן (700 גרם),קבוצת אסם סחר שות. מוגבלת,יח`,,1,14.90,2.13
1285,טבעות בצל תפוגן (700 גרם),קבוצת אסם סחר שות. מוגבלת,יח`,,1,16.90,2.41
1286,אמריקן צ`יפס תפוגן (1.5 קג),קבוצת אסם סחר שות. מוגבלת,יח`,,1,27.90,18.60
1287,אמריקן צ`יפס 1-2-3 תפוגן (750 גרם),קבוצת אסם סחר שות. מוגבלת,יח`,,1,23.90,3.19
1288,תרכיז טבעי סיידר הגליל (330 מל),טמפו משקאות בעמ,יח`,,1,9.90,2.91
1289,רן אבקת הלבנה,יוניליוור ישראל שיווק בעמ,יח`,,1,21.90,6.26
1290,מרכך כביסה ורוד בדין (4 ליטר),יוניליוור ישראל שיווק בעמ,יח`,,1,19.90,4.98
1291,מרכך כביסה צהוב בדין (4 ליטר),יוניליוור ישראל שיווק בעמ,יח`,,1,19.90,4.98
1292,תה ארל גריי ויסוצקי (100 גרם),תה ויסוצקי (ישראל) בעמ,יח`,,1,13.90,13.90
1293,תה מעודן ויסוצקי (100),תה ויסוצקי (ישראל) בעמ,יח`,,1,16.90,16.90
1294,תה קלאסיק ויסוצקי) (25,תה ויסוצקי (ישראל) בעמ,יח`,,1,7.30,19.47
1295,תה קלאסיק ויסוצקי (100),תה ויסוצקי (ישראל) בעמ,יח`,,1,16.90,11.27
1296,תה ארל גריי ויסוצקי) (25,תה ויסוצקי (ישראל) בעמ,יח`,,1,15.90,42.40
1297,תה ארל גריי ויסוצקי (50),תה ויסוצקי (ישראל) בעמ,יח`,,1,27.90,37.20
1298,תה נענע ויסוצקי) (25,תה ויסוצקי (ישראל) בעמ,יח`,,1,16.90,45.07
1299,תה אפרסק ויסוצקי) (25,תה ויסוצקי (ישראל) בעמ,יח`,,1,16.90,33.80
1300,תה קמומיל בבונג ויסוצקי הגן הקסום) (50,תה ויסוצקי (ישראל) בעמ,יח`,,1,33.90,45.20
1301,תה עינוגי התפוח ויסוצקי הגן הקסום) (25,תה ויסוצקי (ישראל) בעמ,יח`,,1,17.50,23.33
1302,תה שומר ויסוצקי הגן הקסום) (25,תה ויסוצקי (ישראל) בעמ,יח`,,1,17.50,46.67
1303,תה פירות היער ויסוצקי הגן הקסום) (25,תה ויסוצקי (ישראל) בעמ,יח`,,1,17.50,25.93
1304,תה קמומיל ויסוצקי הגן הקסום) (25,תה ויסוצקי (ישראל) בעמ,יח`,,1,17.50,46.67
1305,תה מנטה ויסוצקי הגן הקסום) (25,תה ויסוצקי (ישראל) בעמ,יח`,,1,17.50,35
1306,תה לואיזה וורבנה ויסוצקי הגן הקסום) (25,תה ויסוצקי (ישראל) בעמ,יח`,,1,17.50,35
1307,הגן הקסום ורד הבר 50 שקיקים,תה ויסוצקי (ישראל) בעמ,יח`,,1,33.90,22.60
1308,תה ירוק נענע ויסוצקי (25),תה ויסוצקי (ישראל) בעמ,יח`,,1,24.90,66.40
1309,תה ירוק לימונית ולואיזה ויסוצקי (25),תה ויסוצקי (ישראל) בעמ,יח`,,1,24.90,66.40
1310,נקניקיות פיקנטיות 400 גר` טירת צבי,תנובה קפואים,יח`,,1,13.90,3.48
1311,נקניקיות קרנץ אמריקאי 500  גר`טירת צבי,תנובה קפואים,יח`,,1,27.90,5.58
1312,נקניקיות עוף טירת צבי (1 קג),תנובה קפואים,יח`,,1,22.90,22.90
1313,נקניקיות עוף טירת צבי (400 גרם),תנובה קפואים,יח`,,1,10.90,2.73
1314,צמד כפרי 800 גר` טירת צבי,תנובה קפואים,יח`,,1,24.90,3.11
1315,בוטנים מטוגנים קליית גת (200 גרם),ליימן שליסל בעמ,יח`,,1,7.90,3.95
1316,נאש צ אנס שקית 200 גר,ליימן שליסל בעמ,יח`,,1,8.90,4.45
1317,גרעיני אבטיח 200  גר`גת,ליימן שליסל בעמ,יח`,,1,13.90,6.95
1318,לחם אחיד פרוס (750 גרם פיקוח,שלמה א. אנג`ל בעמ,יח`,,1,6.60,0.88
1319,לחם עינן אנגל 750גר,שלמה א. אנג`ל בעמ,יח`,,1,14.90,1.99
1320,לחם עינן קל פרוס אנג`ל (500 גרם),שלמה א. אנג`ל בעמ,יח`,,1,14.80,2.96
1321,לחמניה אנג`ל,שלמה א. אנג`ל בעמ,יח`,,1,1.90,2.53
1322,לחמניה ארוכה שומשום אנג`ל,שלמה א. אנג`ל בעמ,יח`,,1,2.90,2.32
1323,חלה רגילה אנג`ל/דגנית (500 גרם) מובי,שלמה א. אנג`ל בעמ,יח`,,1,4.45,0.89
1324,חלה קלועה,שלמה א. אנג`ל בעמ,יח`,,1,4.40,0.88
1325,יוגורט ביו 3% דנונה (200 גרם),שטראוס גרופ בעמ/מצונן,יח`,,1,3.40,1.70
1326,דנונה פרי בר פיצפוצים,שטראוס גרופ בעמ/מצונן,יח`,,1,4.40,2.54
1327,נוזל לניקוי אסלות 00 סנו (1 ליטר),החברה הדרומית לשיווק בעמ,יח`,,1,8.90,8.90
1328,פזוטקס מעופפים,החברה הדרומית לשיווק בעמ,יח`,,1,18.90,3
1329,ממרח בטעם שוקולד השחר העולה (500 גרם),השחר העולה תעשית ממתקים בעמ,יח`,,1,12.90,2.58
1330,ממרח בטעם שוקולד השחר העולה (1 קג),השחר העולה תעשית ממתקים בעמ,יח`,,1,23.90,23.90
1331,ממרח 400 גר` חלבי בדצ השחר,השחר העולה תעשית ממתקים בעמ,יח`,,1,13.90,3.48
1332,ממרח אגוזי לוז עם קקאו 350 גר` פרווה,השחר העולה תעשית ממתקים בעמ,יח`,,1,13.90,3.97
1333,ממרח 400 גר` פרווה השחר,השחר העולה תעשית ממתקים בעמ,יח`,,1,11.90,2.98
1334,ממרח פרווה 1 קג` השחר,השחר העולה תעשית ממתקים בעמ,יח`,,1,22.90,22.90
1335,קפה שחור קפה לנדוור (100x3 גרם),קבוצת אסם סחר שות. מוגבלת,יח`,,1,22.90,7.63
1336,פופקורן פופסטאר חמישייה טבעי,דנשר (1963) בעמ,יח`,,1,16.90,3.38
1337,גלילונית לפח 60 יח`,דנשר (1963) בעמ,יח`,,1,19.90,19.90
1338,נרות שבת 4  יח`פאלאס,פאלאס תעשיות נטו (2014) בעמ,יח`,,1,3.90,2.79
1339,נר נשמה בכוס 24 שעות פאלאס,פאלאס תעשיות נטו (2014) בעמ,יח`,,1,3.90,3.90
1340,נר זכרון 48 שעות פאלאס,פאלאס תעשיות נטו (2014) בעמ,יח`,,1,5.90,5.90
1341,נר נשמה 72 שעות,פאלאס תעשיות נטו (2014) בעמ,יח`,,1,6.90,6.90
1342,נר זכרון לשבוע נר ציון,פאלאס תעשיות נטו (2014) בעמ,יח`,,1,11.90,11.90
1343,משקה מוגז בטעם קולה פפסי (1.5 ליטר),טמפו משקאות בעמ,יח`,,1,5.90,0.39
1344,משקה מוגז בטעם ליים סבן אפ (1.5 ליטר),טמפו משקאות בעמ,יח`,,1,5.90,0.39
1345,משקה אורנג` מירנדה (1.5 ליטר),טמפו משקאות בעמ,יח`,,1,5.90,0.39
1346,פפסי סבן אפ דיאט 1.5 ליטר,טמפו משקאות בעמ,יח`,,1,5.90,0.39
1347,פפסי מקס 1.5 ליטר,טמפו משקאות בעמ,יח`,,1,5.90,0.39
1348,גינקו קרם רב שימושי 250 מל`,גורי ע.ע.ע בעמ,יח`,,1,19.90,9.05
1349,חמאת בוטנים טבעית בי & די (350 גרם),בטר אנד דיפרנט בעמ,יח`,,1,10.90,3.11
1350,חמאת בוטנים טבעית בי   די (1 קג),בטר אנד דיפרנט בעמ,יח`,,1,25.90,5.08
1351,נוזל לניקוי כללי פנטסטיק סיף (4 ליטר),יוניליוור ישראל שיווק בעמ,יח`,,1,24.90,0.62
1352,שמרים טריים שמרית (50 גרם),שטראוס גרופ בעמ/מצונן,יח`,,1,4.50,9
1353,שמרים טריים ומשפר אפיה שמרית (50x2 גרם),שטראוס גרופ בעמ/מצונן,יח`,,1,7.90,7.90
1354,שמרים אקטיבים שימרית 500 גר`,שטראוס גרופ בעמ,יח`,,1,15.90,3.18
1355,נטורינה קוקוס 200  גר`שמרית,שטראוס גרופ בעמ/מצונן,יח`,,1,6.90,3.45
1356,מרגרינה ללא מלח לאפיה ובישול -שמרית,שטראוס גרופ בעמ/מצונן,יח`,,1,4.90,2.45
1357,מרגרינה בטעם חמאה -שמרית,שטראוס גרופ בעמ/מצונן,יח`,,1,4.90,2.45
1358,בייגלה שמונה שמונה 400 גר`,יוניליוור ישראל שיווק בעמ,יח`,,1,10.90,2.73
1359,בייגלה אחד אחד 400 גר`,יוניליוור ישראל שיווק בעמ,יח`,,1,10.90,2.73
1360,גדול גדול 400,יוניליוור ישראל שיווק בעמ,יח`,,1,12.90,3.23
1361,סחוג תימני,שטראוס גרופ בעמ/מצונן,יח`,,1,7.90,5.27
1362,סחוג תימני,שטראוס גרופ בעמ/מצונן,יח`,,1,6.80,4.53
1363,סחוג זחוק ירוק תימני חריף זהבי (150 גרם),שטראוס גרופ בעמ/מצונן,יח`,,1,7.90,5.64
1364,זיתים מנס. ירוק בינוני 12-17 A2,קבוצת אסם סחר שות. מוגבלת,יח`,,1,7.90,1.41
1365,זיתים מנס. ירוק ג.מ. 17-19 שום,קבוצת אסם סחר שות. מוגבלת,יח`,,1,10.90,1.95
1366,זיתים ירוקים טבעות בית השיטה (560 גרם),קבוצת אסם סחר שות. מוגבלת,יח`,,1,9.90,1.77
1367,זיתים פיקנטי חרוזית בית השיטה (560 גרם),קבוצת אסם סחר שות. מוגבלת,יח`,,1,9.90,1.77
1368,חרוזית מושחר A2,קבוצת אסם סחר שות. מוגבלת,יח`,,1,10.90,1.95
1369,קוקטייל זיתים בית השיטה (560 גרם),קבוצת אסם סחר שות. מוגבלת,יח`,,1,11.90,2.13
1370,חרוזית במרינד,קבוצת אסם סחר שות. מוגבלת,יח`,,1,10.90,2.53
1371,זיתים ירוקים מבוקעים A2,קבוצת אסם סחר שות. מוגבלת,יח`,,1,10.90,1.95
1372,מלפפון במלח 10-12 A2,קבוצת אסם סחר שות. מוגבלת,יח`,,1,7.90,1.46
1373,מלפפון במלח 13-17 A2,קבוצת אסם סחר שות. מוגבלת,יח`,,1,9.90,3.09
1374,מלפפון במלח בלאדי 13-17,קבוצת אסם סחר שות. מוגבלת,יח`,,1,9.90,2.91
1375,חומוס צבר סמיר הגדול,קבוצת אסם סחר שות. מוגבלת,יח`,,1,13.90,3.48
1376,מלפפון בחומץ 10-12 A2,קבוצת אסם סחר שות. מוגבלת,יח`,,1,7.90,2.72
1377,מלפפון בחומץ 13-17 A2,קבוצת אסם סחר שות. מוגבלת,יח`,,1,9.90,3.09
1378,מלפפון בחומץ 18-25 A2,קבוצת אסם סחר שות. מוגבלת,יח`,,1,10.90,3.41
1379,חומוס צבר אבו מרוואן,קבוצת אסם סחר שות. מוגבלת,יח`,,1,13.90,3.48
1380,פלפל חריף כבוש שיפקה בית השיטה (560 גרם),קבוצת אסם סחר שות. מוגבלת,יח`,,1,6.90,3
1381,חלב 1% בקרטון טרה (1  ליטר)פ,החב` המרכזית - טרה,יח`,,1,5.59,5.59
1382,שמנת חמוצה 15% טרה (200 מל),החב` המרכזית - טרה,יח`,,1,2.28,1.14
1383,גבינה לבנה 5% 250 גר` פיקוח,החב` המרכזית - טרה,יח`,,1,4.75,1.90
1384,גבינת טוב טעם,החב` המרכזית - טרה,יח`,,1,10.90,4.36
1385,שיבולת שועל קוואקר (500 גרם),שטראוס פריטו ליי בעמ,יח`,,1,11.90,2.38
1386,10 פיתות בטעם ביתי דגנית עין בר,דגנית עין בר תעשיות מזון ואפיה,יח`,,1,9.90,0.99
1387,לחמניות חיטה מלאה דגנית עין בר (10),דגנית עין בר תעשיות מזון ואפיה,יח`,,1,11.90,1.59
1388,לחמניות אצבע דגנית עין בר (10),דגנית עין בר תעשיות מזון ואפיה,יח`,,1,11.90,1.59
1389,מרציפן חלה המרשלג (75 גרם),משה סידס ובנו בעמ,יח`,,1,7.90,10.53
1390,עלית הארק יקב הגליל (700 מל),יקב הגליל שיווק בעמ,יח`,,1,59.90,7.95
1391,מאגדת גלית 8 יח`,פלקו בעמ,יח`,,1,19.90,19.90
1392,רוטב פטריות אסם (30 גרם),קבוצת אסם סחר שות. מוגבלת,יח`,,1,3.50,11.67
1393,לחם אקטיב ברמן (750 גרם),י.את א. ברמן בעמ,יח`,,1,14.90,1.99
1394,לחם אחיד כהה פרוס ברמן (750  גרם)פי,י.את א. ברמן בעמ,יח`,,1,6.60,0.88
1395,פיתות אסלי ברמן) (10,י.את א. ברמן בעמ,יח`,,1,9.90,0.99
1396,לחמניות שישייה,י.את א. ברמן בעמ,יח`,,1,7.90,1.76
1397,לחמניות אקטיב ברמן,י.את א. ברמן בעמ,יח`,,1,11.90,2.64
1398,חלה קלה פרוסה ברמן (500 גרם),י.את א. ברמן בעמ,יח`,,1,12.90,2.58
1399,לחם ברמן לעניין פרוס ברמן (750 גרם),י.את א. ברמן בעמ,יח`,,1,12.90,1.72
1400,לחם מקמח מלא 750  גר`E FREE ברמן,י.את א. ברמן בעמ,יח`,,1,14.90,1.99
1401,לחם מקמח שיפון מלא 750  גר`E FREE ברמן,י.את א. ברמן בעמ,יח`,,1,14.90,1.99
1402,לחם מקמח כוסמין מלא 750 גר` E FREE,י.את א. ברמן בעמ,יח`,,1,15.50,2.07
1403,לחמניה רגילה,י.את א. ברמן בעמ,יח`,,1,1.90,2.53
1404,10 לחמניות בשקית ברמן,י.את א. ברמן בעמ,יח`,,1,9.90,1.32
1405,חלה רגילה (500 גרם) פיקוח,י.את א. ברמן בעמ,יח`,,1,4.45,0.89
1406,חלה מתוקה,י.את א. ברמן בעמ,יח`,,1,8.90,1.78
1407,סוכרזית פטריה) (300,שטראוס גרופ בעמ,יח`,,1,7.90,3.21
1408,סוכרזית קלאסי) (1200,שטראוס גרופ בעמ,יח`,,1,17.90,1.82
1409,סוכרזית דיאט טיפ נוזל,שטראוס גרופ בעמ,יח`,,1,18.90,8.59
1410,סוכרזית פטנט) (700,שטראוס גרופ בעמ,יח`,,1,13.90,2.42
1411,יין אדום יבש של סגל (750 מל),טמפו משקאות בעמ,יח`,,1,21,2.76
1412,יין לבן חצי יבש של סגל (750 מל),טמפו משקאות בעמ,יח`,,1,21,2.76
1413,מלח ים יבש מלח הארץ (250 גרם),תה ויסוצקי (ישראל) בעמ,יח`,,1,5.90,2.95
1414,מלח ים יבש מלח הארץ (500 גרם),תה ויסוצקי (ישראל) בעמ,יח`,,1,7.90,1.58
1415,מלח עדין מלח הארץ (1 קג),תה ויסוצקי (ישראל) בעמ,יח`,,1,7.20,7.20
1416,מלח גס מלח הארץ (1 קג),תה ויסוצקי (ישראל) בעמ,יח`,,1,7.50,7.50
1417,עוגיות מלוחות המותג (600 גרם),שיבולים מוצרי מאפה - המותג,יח`,,1,11.90,1.98
1418,כעכים עוגיות מלוחות/מתוקות ,שיבולים יצור ושיווק מוצרי מאפה,יח`,,1,14,4
1419,מיץ תפוזים סחוט טבעי פרימור (1 ליטר),שטראוס גרופ בעמ/מצונן,יח`,,1,14.60,14.60
1420,נקניק סלמי מעושן 7000 זוגלובק (600 גרם),זוגלובק שיווק בעמ,יח`,,1,34.90,4.36
1421,נקניק סלמי בשן זוגלובק (470 גרם),זוגלובק שיווק בעמ,יח`,,1,28.90,4.13
1422,המבורגר זהב,זוגלובק שיווק בעמ,יח`,,1,19.90,4.98
1423,נקניקיות וניר 1 קג` זוגלובק,זוגלובק שיווק בעמ,יח`,,1,29.90,29.90
1424,גוליבר חריפות 400 גר` זוגלובק,זוגלובק שיווק בעמ,יח`,,1,17.90,4.48
1425,מארז פסטרמה חרמון+תה,זוגלובק שיווק בעמ,יח`,,1,33.90,4.24
1426,סטייק בורגר,זוגלובק שיווק בעמ,יח`,,1,19.90,4.98
1427,בורקס גבינה זוגלובק (16 יח` - 800 גרם),זוגלובק שיווק בעמ,יח`,,1,19.90,2.49
1428,נקנקיות חריפות 1,זוגלובק שיווק בעמ,יח`,,1,32.90,32.90
1429,בצק עלים זוגלובק,זוגלובק שיווק בעמ,יח`,,1,19.90,19.90
1430,קריספי סטיקס תירס,זוגלובק שיווק בעמ,יח`,,1,14.90,2.98
1431,נקניקיות עוף זוגלובק (400 גרם),זוגלובק שיווק בעמ,יח`,,1,13.90,3.48
1432,נקניקיות עוף זוגלובק (1 קג),זוגלובק שיווק בעמ,יח`,,1,29.90,29.90
1433,תה מעושן 200,זוגלובק שיווק בעמ,יח`,,1,14.90,7.45
1434,לחמניה כפרי ארוך,שלמה א. אנג`ל בעמ,יח`,,1,3.30,2.64
1435,גבינה מוצרלה 22% גד (180 גרם),מחלבות גד שיווק 1992 בעמ,יח`,,1,15.10,8.39
1436,גבינה צפתית מעודנת 5% גד (200 גרם),מחלבות גד שיווק 1992 בעמ,יח`,,1,14.90,7.45
1437,מוצרלה מגורדת 22% גד (300 גרם),מחלבות גד שיווק 1992 בעמ,יח`,,1,24.50,8.17
1438,ירח מתוק-גד,מחלבות גד שיווק 1992 בעמ,יח`,,1,5.60,3.73
1439,לבנה בשמן זית-גד - מדף,מחלבות גד שיווק 1992 בעמ,יח`,,1,13.90,5.56
1440,גבינת ריקוטה 5% גד (250 גרם),מחלבות גד שיווק 1992 בעמ,יח`,,1,14.90,5.96
1441,ג`ל גילוח לעור רגיש אדג` (198 גרם),דנשר (1963) בעמ,יח`,,1,19.90,9.95
1442,חלבה וניל אחוה (100 גרם),אחדות בעמ,יח`,,1,2.90,2.90
1443,חלבה וניל אחוה (400 גרם),אחדות בעמ,יח`,,1,10.90,2.73
1444,חלבה בקופסא ללא סוכר 11 יח`,אחדות בעמ,יח`,,1,11.90,4.31
1445,חלבה וניל קקאו ואגוזים אחוה (25x12 גרם),אחדות בעמ,יח`,,1,11.90,3.97
1446,טחינה גולמית אחוה (1 קג),אחדות בעמ,יח`,,1,19.90,19.90
1447,לחם אחיד פרוס דגנית עין בר (750 גרם),דגנית עין בר תעשיות מזון ואפיה,יח`,,1,5.90,0.79
1448,לחם מלא פלוס שיפון דגנית,דגנית עין בר תעשיות מזון ואפיה,יח`,,1,13.90,1.85
1449,לחם חיטה מלאה 750  גר`דגנית,דגנית עין בר תעשיות מזון ואפיה,יח`,,1,13.90,1.85
1450,לחם קל חיטה מלאה 750  גר`דגנית,דגנית עין בר תעשיות מזון ואפיה,יח`,,1,14.90,1.99
1451,לחם שיפון אמיתי קל 750  גר`דגנית,דגנית עין בר תעשיות מזון ואפיה,יח`,,1,14.90,1.99
1452,לחם חיטה מלא +כוסמין דגנית,דגנית עין בר תעשיות מזון ואפיה,יח`,,1,13.90,1.85
1453,מטליות ריצפה שלישייה shiny,מ.א.ייצור ויבוא מטליות בעמ,יח`,,1,7.90,7.90
1454,מטליות 10 יח רב שימושיות classic,מ.א.ייצור ויבוא מטליות בעמ,יח`,,1,6.90,6.90
1455,כריות יפניות שישייה - שייני,מ.א.ייצור ויבוא מטליות בעמ,יח`,,1,7.90,7.90
1456,ספוג הפלא שישייה - shiny,מ.א.ייצור ויבוא מטליות בעמ,יח`,,1,6.90,6.90
1457,כרית יפנית תשיעיה shiny,מ.א.ייצור ויבוא מטליות בעמ,יח`,,1,9.90,110
1458,קמיל בלו משחה לתינוק דר. פישר (100 גרם),פישר תעשיות פרמצבטיות בעמ,יח`,,1,12.90,12.90
