,ItemName,ManufactureName,UnitQty,Quantity,QtyInPackage,ItemPrice,UnitOfMeasurePrice
1202,בפלות 400  גר`שחור לבן,שטראוס גרופ בעמ,יח`,,1,16.90,4.23
1203,שוקולד פרה לבן עם עוגיות עלית (100 גרם),שטראוס גרופ בעמ,יח`,,1,4.90,4.90
1204,תפוצ`יפס 50 גר קראנץ` גריל,שטראוס פריטו ליי בעמ,יח`,,1,3.90,7.80
1205,בפלות 350  גר`גבינת פירורים,שטראוס גרופ בעמ,יח`,,1,16.90,4.83
1206,בפלות 350  גר`טראפלס ופירורים,שטראוס גרופ בעמ,יח`,,1,15.40,4.40
1207,שוקולד פרה חלב אוורירי עלית (85 גרם),שטראוס גרופ בעמ,יח`,,1,4.90,4.90
1208,מסטיק מאסט מנטה עדין 28 גרם,שטראוס גרופ בעמ,יח`,,1,4.90,17.50
1209,נקטר רימונים ספרינג (1 ליטר),יפאורה,יח`,,1,5.50,0.55
1210,ערגליות שוקו אסם (300 גרם),קבוצת אסם סחר שות. מוגבלת,יח`,,1,10.90,3.63
1211,ערגליות תות אסם (300 גרם),קבוצת אסם סחר שות. מוגבלת,יח`,,1,10.90,3.63
1212,נייר טואלט טאצ` 32 גלילים,שניב תעשיות נייר בעמ,יח`,,1,24.90,24.90
1213,קברנה/מרלו פי.סי אדום יבש 750 מל,אגודת הכורמים,יח`,,1,44.90,5.95
1214,סלקטד מרלו יקבי כרמל (750 מל),אגודת הכורמים,יח`,,1,26.90,3.55
1215,קונקורד אדום מתוק 750 מל קינג דיוויד,אגודת הכורמים,יח`,,1,19.90,2.61
1216,מוסקט מתוק 750 מל קינג דיוויד,אגודת הכורמים,יח`,,1,19.90,2.61
1217,סלקטד קברנה סובניון יקבי כרמל (750 מל),אגודת הכורמים,יח`,,1,26.90,3.55
1218,סלקטד אמרלד ריזלינג יקבי כרמל (750 מל),אגודת הכורמים,יח`,,1,26.90,3.55
1219,וינו לבן 750 מל,אגודת הכורמים,יח`,,1,19.90,2.61
1220,קברנה סוביניון פי.סי אדום יבש 750 מל,אגודת הכורמים,יח`,,1,44.90,5.95
1221,סלקטד זינפנדל סמוק יקבי כרמל (750 מל),אגודת הכורמים,יח`,,1,26.90,3.55
1222,סלקטד מוסקטו לבן יקבי כרמל (750 מל),אגודת הכורמים,יח`,,1,26.90,3.55
1223,קברנה מרלו סלקטד אדום יבש 750 מל,אגודת הכורמים,יח`,,1,26.90,3.55
1224,שטראוס קרמיסימו שוקולד ציפ,גלידות שטראוס בעמ,יח`,,1,18.90,14.21
1225,גרנאש רוזה אפרת (750 מל),יקב טפרברג 1870 בעמ (יינות ומש,יח`,,1,19.50,2.56
1226,פריגת 1.5 ליטר,החברה המרכזית להפצת משקאות בעמ,יח`,,1,7.20,4.80
1227,בירה רד לייבל טובורג (330x6 מל),החברה המרכזית להפצת משקאות בעמ,יח`,,1,40.90,19.75
1228,בקבוק זירו קוקה-קולה (1.5 ליטר),החברה המרכזית להפצת משקאות בעמ,יח`,,1,6.90,4.60
1229,מארז זירו קוקה-קולה (1.5x6 ליטר),החברה המרכזית להפצת משקאות בעמ,יח`,,1,37.90,4.21
1230,שקיות אשפה לפח ענק 90x75 גלילונית (50),דנשר (1963) בעמ,יח`,,1,15.90,15.90
1231,כמון טחון תבליני מימון (100 גרם),א.ל.ייצור ושיווק תבלינים בעמ,יח`,,1,11.90,11.90
1232,פלפל שחור טחון תבליני מימון (100 גרם),א.ל.ייצור ושיווק תבלינים בעמ,יח`,,1,15.90,15.90
1233,פלפל שחור גרוס דק תבליני מימון (90 גרם),א.ל.ייצור ושיווק תבלינים בעמ,יח`,,1,15.90,17.67
1234,פפריקה הונגרית מתוקה 100 גר`,א.ל.ייצור ושיווק תבלינים בעמ,יח`,,1,11.90,11.90
1235,תיבול על האש 100 גר`,א.ל.ייצור ושיווק תבלינים בעמ,יח`,,1,11.90,11.90
1236,תבלין לגריל עוף תבליני מימון (100 גרם),א.ל.ייצור ושיווק תבלינים בעמ,יח`,,1,11.90,11.90
1237,תבלין מדראס קארי תבליני מימון (100 גרם),א.ל.ייצור ושיווק תבלינים בעמ,יח`,,1,11.90,11.90
1238,אורגנו תבליני מימון (40 גרם),א.ל.ייצור ושיווק תבלינים בעמ,יח`,,1,10.90,27.25
1239,טימין הררי תבליני מימון (40 גרם),א.ל.ייצור ושיווק תבלינים בעמ,יח`,,1,10.90,21.80
1240,עלי דפנה תבליני מימון (20 גרם),א.ל.ייצור ושיווק תבלינים בעמ,יח`,,1,10.90,54.50
1241,שום גבישי תבליני מימון (120 גרם),א.ל.ייצור ושיווק תבלינים בעמ,יח`,,1,14.90,12.42
1242,תבלין לפרגיות 100 גר`,א.ל.ייצור ושיווק תבלינים בעמ,יח`,,1,11.90,11.90
1243,ממרח כבד קלאסי 140ג,יורוסטנדרט בעמ,יח`,,1,4.90,3.50
1244,טושונקה 400 גר`,יורוסטנדרט בעמ,יח`,,1,18.90,4.73
1245,עוגיות חמאה פריכות לחמי (250 גרם),תה ויסוצקי (ישראל) בעמ,יח`,,1,17.90,7.16
1246,עוגיות מלבן שקדים לחמי (250 גרם),תה ויסוצקי (ישראל) בעמ,יח`,,1,17.90,6.39
1247,עוגיות נסיכה לחמי (250 גרם),תה ויסוצקי (ישראל) בעמ,יח`,,1,17.90,7.16
1248,פילטונה בשמן רביעיה,פילטונה תעשיות בעמ,יח`,,1,19.90,19.90
1249,פילטונה במים רביעיה,פילטונה תעשיות בעמ,יח`,,1,19.90,3.11
1250,פילטונה בשמן קנולה רביעיה,פילטונה תעשיות בעמ,יח`,,1,19.90,3.11
1251,פילטונה נתחי טונה בשמן זית רביעייה,פילטונה תעשיות בעמ,יח`,,1,25.90,4.05
1252,חטיף תירס חריף אש דוריטוס (70 גרם),שטראוס פריטו ליי בעמ,יח`,,1,3.90,5.57
1253,חטיף צ`יפס בטעם טבעי תפוצ`יפס (40x6 גרם),שטראוס פריטו ליי בעמ,יח`,,1,12.90,5.38
1254,קונפיטורה דובדבנים 340 גר`,מיה תעשיות מזון מ.ת.מ. בעמ,יח`,,1,9.90,2.91
1255,אורז בסמטי בסגנון הודי מיה (1 קג),מיה תעשיות מזון מ.ת.מ. בעמ,יח`,,1,9.90,0.99
1256,לימון בלאדי תבליני ביטון יוחאי (250 גרם),נטו מלינדה סחר בעמ,יח`,,1,15.90,6.36
1257,אריסה מתוקה תבליני ביטון יוחאי (250 גרם),נטו מלינדה סחר בעמ,יח`,,1,14.90,5.96
1258,עמבה תבליני ביטון יוחאי (250 גרם),נטו מלינדה סחר בעמ,יח`,,1,13.90,5.56
1259,צנובר 100 גרם שקית שקדיה,דין שיווק וקליה בעמ,יח`,,1,21.90,21.90
1260,מרלו יקב הרי גליל (750 מל),היכל היין שקד גולן בעמ,יח`,,1,34.90,4.61
1261,קברנה סובניון יקב הרי גליל (750 מל),היכל היין שקד גולן בעמ,יח`,,1,36.90,4.88
1262,שיראז יקב הרי גליל (750 מל),היכל היין שקד גולן בעמ,יח`,,1,34.90,4.61
1263,בירה שחורה נשר מאלט (1.5 ליטר),טמפו משקאות בעמ,יח`,,1,7.50,0.50
1264,בירה שחורה דיאט נשר מאלט (1.5 ליטר),טמפו משקאות בעמ,יח`,,1,7.50,5
1265,בירה הייניקן 330 בקבוק,טמפו משקאות בעמ,יח`,,1,10.10,2.97
1266,בירה היינקן (500 מל),טמפו משקאות בעמ,יח`,,1,8.50,1.46
1267,נודלס מסולסלות וילי פוד (200 גרם),ג.וילי-פוד אינטרנשיונל בעמ,יח`,,1,4.90,2.45
1268,מנת השף מרק+נודלס פיקנטי,ג.וילי-פוד אינטרנשיונל בעמ,יח`,,1,4.90,7
1269,צנימים וילי פוד (250 גרם),ג.וילי-פוד אינטרנשיונל בעמ,יח`,,1,7.90,3.16
1270,דנונה פרי בר קורנפלקס,שטראוס גרופ בעמ/מצונן,יח`,,1,4.40,2.51
1271,שעועית ירוקה שלמה 800 גר`,נ.ת.נ.ג.ב החזקות יעוץ וניהול ב,יח`,,1,6.80,0.85
1272,שעועית חתוכה ירוקה 800  גר`קפוא,נ.ת.נ.ג.ב החזקות יעוץ וניהול ב,יח`,,1,6.80,0.85
1273,אפונה קפוא 800 גר`,נ.ת.נ.ג.ב החזקות יעוץ וניהול ב,יח`,,1,9.90,1.24
1274, שיפוד*עבה* 30 סמ-חדש ,מ.א.ייצור ויבוא מטליות בעמ,יח`,,1,4.90,4.90
1275,4 כרות פלדה מתכת shiny,מ.א.ייצור ויבוא מטליות בעמ,יח`,,1,5.90,5.90
1276,גליל מטליות צהוב 40 יח shiny,מ.א.ייצור ויבוא מטליות בעמ,יח`,,1,16.90,16.90
1277,מטליות מיקרו רצפה שלישייה shiny,מ.א.ייצור ויבוא מטליות בעמ,יח`,,1,19.90,19.90
1278,מטליות מיקרו לניקוי כללי מעוצבות shiny,מ.א.ייצור ויבוא מטליות בעמ,יח`,,1,7.90,7.90
1279,סטיביה מרמולייט (100),דנשר (1963) בעמ,יח`,,1,27.90,0.28
1280,מטבוחה אחלה (500 גרם),שטראוס גרופ בעמ/מצונן,יח`,,1,14.90,2.98
1281,קוטג` 3% מועשר 250 גר`,החב` המרכזית - טרה,יח`,,1,5.30,2.12
1282,גבינה לבנה 3% 250 גר` פיקוח,החב` המרכזית - טרה,יח`,,1,4.75,1.90
1283,פחית קולה סליק קוקה-קולה (330 מל),החברה המרכזית להפצת משקאות בעמ,יח`,,1,4.50,1.27
1284,תה קר בטעם אפרסק פיוז-טי (1.5 ליטר),החברה המרכזית להפצת משקאות בעמ,יח`,,1,7.20,0.48
1285,תה קר דיאט בטעם אפרסק פיוז-טי (1.5 ליטר),החברה המרכזית להפצת משקאות בעמ,יח`,,1,7.20,0.48
1286,תה קר בטעם ענבים פיוז-טי (1.5 ליטר),החברה המרכזית להפצת משקאות בעמ,יח`,,1,7.20,4.80
1287,שוופס סודה לימון 1.5 ליטר,יפאורה,יח`,,1,3.90,2.60
1288,שוופס מוגז עדין 1.5 ליטר תפוח ליים,יפאורה,יח`,,1,6.90,0.46
1289,שוופס מוגז עדין 1.5 ליטר פירות יער,יפאורה,יח`,,1,6.90,0.46
1290,משקה מוגז עדין אפרסק שוופס (1.5 ליטר),יפאורה,יח`,,1,6.90,0.46
1291,תה ירוק לימון לואיזה ספרינג (1.5 ליטר),יפאורה,יח`,,1,6.40,4.27
1292,משקה קל תפוחים תפוזינה (1.5 ליטר),יפאורה,יח`,,1,6.50,0.43
1293,שטראוס קרמיסימו בטעמי 3 שוקלד,גלידות שטראוס בעמ,יח`,,1,18.90,14.21
1294,שטראוס קרמיסימו,גלידות שטראוס בעמ,יח`,,1,18.90,14.21
1295,תה קמומיל ונענע ויסוצקי הגן הקסום) (25,תה ויסוצקי (ישראל) בעמ,יח`,,1,17.50,46.67
1296,תה ירוק מרווה ויסוצקי) (25,תה ויסוצקי (ישראל) בעמ,יח`,,1,24.90,66.40
1297,תה ירוק ארל גריי ויסוצקי) (25,תה ויסוצקי (ישראל) בעמ,יח`,,1,24.90,66.40
1298,סאן בנדטו מוגז עדין בודד 500 מל,טמפו משקאות בעמ,יח`,,1,3.30,0.60
1299,לחם שיפון 550 גר`,מאפיית דואט בעמ,יח`,,1,10.90,1.98
1300,לחם שיפון כפרי 600 גר,מאפיית דואט בעמ,יח`,,1,10.90,1.82
1301,לחם שיפון ביתי 630 גר`,מאפיית דואט בעמ,יח`,,1,10.90,1.73
1302,לחם דגנים 630 גר`,מאפיית דואט בעמ,יח`,,1,10.90,1.73
1303,לחם שיפון פטרובסקי 700 גר`,מאפיית דואט בעמ,יח`,,1,11.90,1.70
1304,מארז לחמניות 450  גר`דואט,מאפיית דואט בעמ,יח`,,1,10.90,10.90
1305,מארז לחמניות מתוקות 450  גר`דואט,מאפיית דואט בעמ,יח`,,1,10.90,10.90
1306,לחם מרוקאי מסורתי 550 גר`,מאפיית דואט בעמ,יח`,,1,12.90,2.35
1307,לחם בריאות 630 גר`,מאפיית דואט בעמ,יח`,,1,10.90,1.73
1308,לחם כוסמין,מאפיית דואט בעמ,יח`,,1,14.90,14.90
1309,לחם שיפון  (900100%  גר`),מאפיית דואט בעמ,יח`,,1,14.90,1.66
1310,דניאלה מעדן בטעם בננה שטראוס (88 גרם),שטראוס גרופ בעמ/מצונן,יח`,,1,4,2.67
1311,גבינת  קוטג`5% שטראוס (250 גרם),שטראוס גרופ בעמ/מצונן,יח`,,1,5.90,2.36
1312,עלים לקרמשניט 300 גר`,דנשר (1963) בעמ,יח`,,1,17.90,5.97
1313,בישקוטים ליידיפינגרז בונומי (200 גרם),דנשר (1963) בעמ,יח`,,1,7.90,3.95
1314,קינואה מיה (500 גרם),מיה תעשיות מזון מ.ת.מ. בעמ,יח`,,1,19.90,3.98
1315,סובין חיטה 150 גר`,מיה תעשיות מזון מ.ת.מ. בעמ,יח`,,1,8.90,5.93
1316,ג`לטין טהור 25 גר`,מיה תעשיות מזון מ.ת.מ. בעמ,יח`,,1,11.90,47.60
1317,חלבה קלאסית שוקו וניל,קבוצת אסם סחר שות. מוגבלת,יח`,,1,13.90,3.97
1318,תחליף חלב שלב 1 חלבי מטרנה (700 גרם),קבוצת אסם סחר שות. מוגבלת,יח`,,1,49.90,7.13
1319,תחליף חלב שלב 3 חלבי מטרנה (700 גרם),קבוצת אסם סחר שות. מוגבלת,יח`,,1,49.90,7.13
1320,גבינה בולגרית מעודנת 5% גד (250 גרם),מחלבות גד שיווק 1992 בעמ,יח`,,1,23.90,9.56
1321,גבינת חלומי 24% מחלב בקר גד (200 גרם),מחלבות גד שיווק 1992 בעמ,יח`,,1,21.90,10.95
1322,גבינת שמנת 30% 200 גר` גד,מחלבות גד שיווק 1992 בעמ,יח`,,1,12.90,6.45
1323,נובי מימיה עם קשית ומכסה מתקפל,אינטרסן 1996 בעמ,יח`,,1,39.90,13.30
1324,זיתים סורי ירוק מבוקע 800 גר` סבא חביב,אבאל יזמות בעמ,יח`,,1,19.90,2.49
1325,סנו אנטי קאלק 4ב1 700 מל,החברה הדרומית לשיווק בעמ,יח`,,1,19.90,2.84
1326,קולון 1.25 קג 101 כתמים,רקיט בנקיזר (ניר איסט) בעמ,יח`,,1,19.90,15.92
1327,ס. מדיק היגניק ג`ל לניקוי יד +אלוורה 100,החברה הדרומית לשיווק בעמ,יח`,,1,12.90,12.90
1328,מתז עובש בניחוח לימון 1 לייטר סנו,החברה הדרומית לשיווק בעמ,יח`,,1,15.90,1.59
1329,מטבוחה מרוקאית רפי כהן צבר (400 גרם),קבוצת אסם סחר שות. מוגבלת,יח`,,1,15.90,3.98
1330,טחינה בלאדי רפי כהן צבר (400 גרם),קבוצת אסם סחר שות. מוגבלת,יח`,,1,15.90,3.98
1331,ביסבול כדורי פירה תפוגן (700 גרם),קבוצת אסם סחר שות. מוגבלת,יח`,,1,12.90,1.84
1332,אינסטלטור פותח סתימות סנו (200 גרם),החברה הדרומית לשיווק בעמ,יח`,,1,15.90,7.95
1333,ליסטרין טאגד פלוריד 500 מל,שקד תבל בעמ,יח`,,1,19.90,3.98
1334,זית ירוק בתיבול גלילי זיתא (215 גרם),תה ויסוצקי (ישראל) בעמ,יח`,,1,12.90,5.94
1335,מלח לימון 170 גר`,תבליני טעם וריח בעמ,יח`,,1,8.90,5.24
1336,תיבול על האש 100 גר`,תבליני טעם וריח בעמ,יח`,,1,8.90,8.90
1337,אצות נורי סילוור טעמי אסיה (10),טעמי אסיה בעמ,יח`,,1,7.90,31.60
1338,חומץ אורז לבן לסושי טעמי אסיה (250 מל),טעמי אסיה בעמ,יח`,,1,9.90,3.96
1339,מי קוקוס טעמי אסיה (400 מל),טעמי אסיה בעמ,יח`,,1,7.90,1.98
1340,רוטב פאד תאי טעמי אסיה (300 מל),טעמי אסיה בעמ,יח`,,1,16.90,4.62
1341,חרדל דיגון גרעינים 350 גרם,דיפלומט היינץ,יח`,,1,12.90,3.79
1342,פוליויקס גרניט פורצלן 2 ליטר,החברה הדרומית לשיווק בעמ,יח`,,1,22.90,11.45
1343,סנו די רולאון לתינוקות וילדים,החברה הדרומית לשיווק בעמ,יח`,,1,22.90,45.80
1344,ריצפז פרש 2 ליטר לילך,החברה הדרומית לשיווק בעמ,יח`,,1,21.90,10.95
1345,סנו מקסימה מרכך 1 ליטר כחול,החברה הדרומית לשיווק בעמ,יח`,,1,17.90,1.79
1346,סנו מקסימה מרכך 1 ליטר ורוד בהיר,החברה הדרומית לשיווק בעמ,יח`,,1,17.90,1.79
1347,כפפות לטקס מדיום סנו סושי (100),החברה הדרומית לשיווק בעמ,יח`,,1,26.90,26.90
1348,סנו מקסימה 4 ליטר,החברה הדרומית לשיווק בעמ,יח`,,1,19.90,4.98
1349,סנו קליר 750 מל לחלונות,החברה הדרומית לשיווק בעמ,יח`,,1,13.90,1.85
1350,מיונז לינה (430 גרם),יורוסטנדרט בעמ,יח`,,1,10,2.33
1351,מיונז לינה 860 גר`,יורוסטנדרט בעמ,יח`,,1,18,2.09
1352,נקניק סלמי מעושן פראג זוגלובק (400 גרם),זוגלובק שיווק בעמ,יח`,,1,21.90,5.48
1353,קבנוס זוגלובק (45x3 גרם),זוגלובק שיווק בעמ,יח`,,1,11.90,8.81
1354,קבנוס בטעם שום זוגלובק (45x3 גרם),זוגלובק שיווק בעמ,יח`,,1,11.90,8.81
1355,קבנוס 135 גר` עם צ`ילי חריף זוגלובק,זוגלובק שיווק בעמ,יח`,,1,11.90,8.81
1356,קבנוס בטעם בצל זוגלובק (45x3 גרם),זוגלובק שיווק בעמ,יח`,,1,11.90,8.81
1357,סלמי מעושן דק דק 120 גר` זוגלובק,זוגלובק שיווק בעמ,יח`,,1,13.50,11.25
1358,קבנוס מעודן 135 גרם,זוגלובק שיווק בעמ,יח`,,1,10.90,8.07
1359,פסטרמה בדבש 120 גר` זוגלובק,זוגלובק שיווק בעמ,יח`,,1,13.50,11.25
1360,חזה בקר 120 גר` זוגלובק,זוגלובק שיווק בעמ,יח`,,1,13.50,11.25
1361,פטרמה חזה עוף 120 גר` זוגלובק,זוגלובק שיווק בעמ,יח`,,1,13.50,11.25
1362,נקניקיות מרגז קפואות זוגלובק (450 גרם),זוגלובק שיווק בעמ,יח`,,1,29.90,6.64
1363,פסטרמה בדבש גריל מופחת נתרן 330גר,זוגלובק שיווק בעמ,יח`,,1,28.90,8.76
1364,נשנושים פסטרמה הודו עם צ`לי מתוק 130 גר`,זוגלובק שיווק בעמ,יח`,,1,16.90,13
1365,אקטיב פסטרמה הודו ברבקין 125 גר זוגלובק,זוגלובק שיווק בעמ,יח`,,1,16.90,13.52
1366,כרוב כבוש יבנה,קבוצת יבנה מוצרי מזון אגודה שי,יח`,,1,7.90,1.84
1367,זיתים קלמטה בחומץ יין,קבוצת יבנה מוצרי מזון אגודה שי,יח`,,1,9.90,1.77
1368,משקה ראשן שוופס (1.5 ליטר),יפאורה,יח`,,1,9.90,0.66
1369,משקה קל מנגו עסיסי תפוזינה (1.5 ליטר),יפאורה,יח`,,1,6.50,0.43
1370,משקה קל ענבים ספרינג (1.5 ליטר),יפאורה,יח`,,1,6.40,0.43
1371,תה ירוק צ`אי מסאלה ויסוצקי) (25,תה ויסוצקי (ישראל) בעמ,יח`,,1,24.90,66.40
1372,תה ירוק קמומיל ויסוצקי) (25,תה ויסוצקי (ישראל) בעמ,יח`,,1,24.90,66.40
1373,תה ירוק תות ויסוצקי) (25,תה ויסוצקי (ישראל) בעמ,יח`,,1,24.90,66.40
1374,שזיפים ללא גרעין 200  גר`מיה,מיה תעשיות מזון מ.ת.מ. בעמ,יח`,,1,9.90,4.95
1375,שניצל תירס ללא גלוטן טבעול (664 גרם),קבוצת אסם סחר שות. מוגבלת,יח`,,1,19.90,2.65
1376,קובה מרק 400 גר,חמים וטעים בעמ,יח`,,1,11.90,2.98
1377,רביולי בטטה,חמים וטעים בעמ,יח`,,1,11.90,2.98
1378,רביולי פטריות,חמים וטעים בעמ,יח`,,1,11.90,2.98
1379,סוכרלוז שקיות מרמולייט) (100,דנשר (1963) בעמ,יח`,,1,32.90,32.90
1380,וופל בלגי בטעם שוקולד 200 גרם,דנשר (1963) בעמ,יח`,,1,10.90,5.45
1381,וופל בלגי בטעם לימון 200 גרם,דנשר (1963) בעמ,יח`,,1,10.90,5.45
1382,סנו מקסימה מרכך 1 ליטר ורוד פסים,החברה הדרומית לשיווק בעמ,יח`,,1,17.90,1.79
1383,ריצפז פרש מטליות חד פעמיות 10 יח`,החברה הדרומית לשיווק בעמ,יח`,,1,12.90,12.90
1384,מטליות לחות לריצפה סנו סושי (10),החברה הדרומית לשיווק בעמ,יח`,,1,9.90,9.90
1385,פלפל חריף שיפקה המותג,פרי חן בעמ - המותג,יח`,,1,5.90,1.09
1386,ארוחת אטריות עם גבינה 206  גר`Doodles,מור-ים מרקטינג בעמ,יח`,,1,10.90,5.29
1387,ארוחת אטריות עם גבינה מסולסלים 156 גר`,מור-ים מרקטינג בעמ,יח`,,1,10.90,5.29
1388,רוטב טריאקי שומשום 300 מל,טעמי אסיה בעמ,יח`,,1,13.90,4.63
1389,קרם קוקוס טעמי אסיה (400 מל),טעמי אסיה בעמ,יח`,,1,9.90,2.48
1390,שמן שומשום טעמי אסיה (150 מל),טעמי אסיה בעמ,יח`,,1,14.90,9.93
1391,בירה אדמונית בירה מלכה (330 מל),הכרם - משקאות חריפים בעמ,יח`,,1,13.90,4.12
1392,תיבול לקוסקוס 50 גר`,א.ל.ייצור ושיווק תבלינים בעמ,יח`,,1,10.90,21.80
1393,מטרנה אקסטרא קייר 700 גר` שלב 2,קבוצת אסם סחר שות. מוגבלת,יח`,,1,59.90,8.56
1394,בורקס פילו גבינה מעדנות,תנובה קפואים,יח`,,1,21.90,3.65
1395,בורקס פילו תפוא מעדנות,תנובה קפואים,יח`,,1,21.90,3.65
1396,בצק פריך מלוח 900 גר` מעדנות,תנובה קפואים,יח`,,1,24,2.67
1397,בצק שמרים מתוק מעדנות,תנובה קפואים,יח`,,1,22.90,2.54
1398,לחם איטלקי 500  גר`ללא גלוטן,זוגלובק-גרין לייט,יח`,,1,18.90,3.78
1399,תערובת עוגת שוקולד 560 גר`,מימונס אפיה בעמ,יח`,,1,17.90,3.20
1400,צבע מאכל כחול מימונס (50 מל),מימונס אפיה בעמ,יח`,,1,4.90,9.80
1401,סירופ מייפל מימונס (500 גרם),מימונס אפיה בעמ,יח`,,1,14.90,2.98
1402,סירופ שוקולד מימונס (500 גרם),מימונס אפיה בעמ,יח`,,1,14.90,2.98
1403,שומשום מימונס (400 גרם),מימונס אפיה בעמ,יח`,,1,14.90,3.73
1404,טיפות לקישוט עוגה מימונס (60 גרם),מימונס אפיה בעמ,יח`,,1,15.90,26.50
1405,ג`ל טעם לימון 95 גר מימונס,מימונס אפיה בעמ,יח`,,1,5.90,6.21
1406,מארז 8 יח תחתיות מרנג 10 גר` מימונס,מימונס אפיה בעמ,יח`,,1,18.90,18.90
1407,קוקוס לבן מימונס 400 גר`,מימונס אפיה בעמ,יח`,,1,13.90,3.48
1408,מיץ הדרים מתקתק 100% ( 2 ליטר),החב` המרכזית - טרה,יח`,,1,22.90,22.90
1409,מיץ הדרים חמצמץ  (100% 2 ליטר),החב` המרכזית - טרה,יח`,,1,22.90,22.90
1410,דומדמנית שחורה א.מ שרון (500 גרם),א.מ. שרון שיווק (2014) בעמ,יח`,,1,24.90,4.98
1411,פטל שחור א.מ שרון (500 גרם),א.מ. שרון שיווק (2014) בעמ,יח`,,1,24.90,4.98
1412,חמוצית גן א.מ שרון (400 גרם),א.מ. שרון שיווק (2014) בעמ,יח`,,1,24.90,6.23
1413,סנו מקסימה מרכך 1 ליטר כחול פסים,החברה הדרומית לשיווק בעמ,יח`,,1,17.90,1.79
1414,פוליוויקס פרקט סנו בתוספת שמן ארגן (2 לי,החברה הדרומית לשיווק בעמ,יח`,,1,21.90,21.90
1415,ריצפז פרש 2 ליטר מאסק,החברה הדרומית לשיווק בעמ,יח`,,1,21.90,10.95
1416,אוקסיג`ן ג`ל 3 ליטר,החברה הדרומית לשיווק בעמ,יח`,,1,29.90,9.97
1417,סנובון שלישיה מאסק,החברה הדרומית לשיווק בעמ,יח`,,1,11.90,6.10
1418,מקסימה מרכך סופר מרוכז ביו סנו (1 ליטר),החברה הדרומית לשיווק בעמ,יח`,,1,17.90,1.79
1419,סנו מקסימה מרכך 1 ליטר כחול בייבי,החברה הדרומית לשיווק בעמ,יח`,,1,17.90,1.79
1420,מקסימה ג`ל כביסה 3 ליטר,החברה הדרומית לשיווק בעמ,יח`,,1,29.60,9.87
1421,מקסימה ג`ל כביסה 3 ליטר,החברה הדרומית לשיווק בעמ,יח`,,1,29.60,0.01
1422,פריניר מלפפון במלח 7-9 560ג.,אבאל יזמות בעמ,יח`,,1,5.90,1.05
1423,פריניר מלפפונים במלח 13-17 560ג,אבאל יזמות בעמ,יח`,,1,7.90,1.41
1424,פירורי לחם מוזהבים מאסטר שף (320גרם),ש.שסטוביץ בעמ,יח`,,1,7.90,2.47
1425,פירורי לחם פנקו מוזהבים 300 גר` מנה מאסט,ש.שסטוביץ בעמ,יח`,,1,9.90,3.30
1426,פירורי לחם פנקו מוזהבים שום 300 גר` מנה,ש.שסטוביץ בעמ,יח`,,1,9.90,3.30
1427,נודלס ביצים 400 גר` מנה מאסטר שף,ש.שסטוביץ בעמ,יח`,,1,8.90,2.23
1428,צ`יפס 2 קג פג,ויטה -פרי גליל (החדשה) בעמ,יח`,,1,20.90,1.05
1429,פריכיות כוסמת ללא מלח,זנבר טבע בעמ,יח`,,1,9.90,39.60
1430,ערמונים קלופים 100 גר`,ג.וילי-פוד אינטרנשיונל בעמ,יח`,,1,5.90,5.90
1431,רוטב פסטה לילדים יכין (260 גרם),זנלכל בעמ,יח`,,1,4.90,1.88
1432,שלישייה זיתים חרוזית יכין 200 גר,זנלכל בעמ,יח`,,1,11.90,5.95
1433,רוטב נפוליטנה יכין (260 גרם),זנלכל בעמ,יח`,,1,4.90,1.88
1434,שעועית לבנה מבושלת במים יכין (550 גרם),זנלכל בעמ,יח`,,1,5.90,1.07
1435,משקה קל לימונענע פריגת (1.5 ליטר),החברה המרכזית להפצת משקאות בעמ,יח`,,1,7.20,0.48
