,ItemName,ManufactureName,UnitQty,Quantity,QtyInPackage,ItemPrice,UnitOfMeasurePrice
0,דג סלמון נורבגי טרי שלם - נקי,מאסטרפוד בעמ,"ק""ג",,1,59.90,59.90
1,בולגרית 24% פח 3  קג`תנובה,תנובה - חלב,"ק""ג",,1,50,5
2,בלוז מעדנייה שטראוס,שטראוס גרופ בעמ/מצונן,"ק""ג",,1,50,5
3,פטינה מעדנייה שטראוס,שטראוס גרופ בעמ/מצונן,"ק""ג",,1,22,2.20
4,דג לברק טרי נקי,מאסטרפוד בעמ,"ק""ג",,1,59.90,59.90
5,דג בורי טרי נקי,מאסטרפוד בעמ,"ק""ג",,1,39,39
6,דג ברמונדי נקי שלם,מאסטרפוד בעמ,"ק""ג",,1,49.90,49.90
7,גבינה צפתית רכה 5% מעדנייה גד,מחלבות גד שיווק 1992 בעמ,"ק""ג",,1,60,6
8,שמנות 30% בטעמים מעדנייה גד,מחלבות גד שיווק 1992 בעמ,"ק""ג",,1,31,3.10
9,פילה סלמון נורבגי שלם -טרי,מאסטרפוד בעמ,"ק""ג",,1,99,9.90
10,פילסברי עוגת שמרים תפוע,קונסיגנציה ג`נרל מילס ישראל בע,יח`,,1,21.90,21.90
11,פילסברי עוגת שמרים שוקולד,קונסיגנציה ג`נרל מילס ישראל בע,יח`,,1,21.90,21.90
12,פילסברי עוגת שמרים אגוזים,קונסיגנציה ג`נרל מילס ישראל בע,יח`,,1,21.90,21.90
13,פילסברי עוגת שמרים קינמון,קונסיגנציה ג`נרל מילס ישראל בע,יח`,,1,21.90,21.90
14,פילסברי חלה מתוקה (חת כדורים),קונסיגנציה ג`נרל מילס ישראל בע,יח`,,1,11.90,11.90
15,פילסברי חלה שמינייה,קונסיגנציה ג`נרל מילס ישראל בע,יח`,,1,11.90,11.90
16,פילסברי לחם מחמצת לבן,קונסיגנציה ג`נרל מילס ישראל בע,יח`,,1,16.90,16.90
17,פילסברי לחם מחמצת דגנים,קונסיגנציה ג`נרל מילס ישראל בע,יח`,,1,16.90,16.90
18,ברי פקאן בלוק מעדנייה גד,מחלבות גד שיווק 1992 בעמ,"ק""ג",,1,119,11.90
19,כרעיים עוף טרי ארוז,טל הל יסכה בעמ,"ק""ג",,1,26.90,26.90
20,ירך עוף טרי ארוז,עוף עוז שיווק בעמ,"ק""ג",,1,26.90,26.90
21,סטייק פרגית ללא עור,טל הל יסכה בעמ,"ק""ג",,1,44.90,44.90
22,גבינת צדר אנגלית במשקל,נטו מלינדה סחר בעמ,"ק""ג",,1,104,10.40
23,גבינת צ`דר אנגלי כתום משקל,נטו מלינדה סחר בעמ,"ק""ג",,1,120,12
24,גבינת גאודה בתוספת תערובת בזיליקום ושום,ג.וילי-פוד אינטרנשיונל בעמ,"ק""ג",,1,80,8
25,גבינת ברי צרפתית מעדנייה וילי פוד,ג.וילי-פוד אינטרנשיונל בעמ,"ק""ג",,1,69,6.90
26,גבינת גרנה פנדו מעדנייה-וילי  פוד,ג.וילי-פוד אינטרנשיונל בעמ,"ק""ג",,1,80,8
27,פילסברי בייגל רומני,קונסיגנציה ג`נרל מילס ישראל בע,יח`,,1,4.20,4.20
28,פילסברי לחם כוסמין מלא בחוש,קונסיגנציה ג`נרל מילס ישראל בע,יח`,,1,16.90,16.90
29,פילסברי לחמניית בגט (רבע בגט),קונסיגנציה ג`נרל מילס ישראל בע,יח`,,1,1.70,1.70
30,פילסברי לחם מחמצת זיתי קלמנטה,קונסיגנציה ג`נרל מילס ישראל בע,יח`,,1,16.90,16.90
31,פילסברי לחם מחמצת מקמח מלא,קונסיגנציה ג`נרל מילס ישראל בע,יח`,,1,16.90,16.90
32,פילסברי לחם מחמצת כוסמין,קונסיגנציה ג`נרל מילס ישראל בע,יח`,,1,16.90,16.90
33,פילסברי מחמצת שיפון כהה וחמוציות,קונסיגנציה ג`נרל מילס ישראל בע,יח`,,1,16.90,16.90
34,פילסברי מחמצת טוסקאני דגנים,קונסיגנציה ג`נרל מילס ישראל בע,יח`,,1,16.90,16.90
35,פילסברי חליות,קונסיגנציה ג`נרל מילס ישראל בע,יח`,,1,2.20,2.20
36,פילסברי ג`בטה כפרית,קונסיגנציה ג`נרל מילס ישראל בע,יח`,,1,4.20,4.20
37,פילסברי לחם רוסטיק עגבניות מיובשות,קונסיגנציה ג`נרל מילס ישראל בע,יח`,,1,16.90,16.90
38,פילסברי מחמצת טוסקאני כפרי עגול,קונסיגנציה ג`נרל מילס ישראל בע,יח`,,1,16.90,16.90
39,פילסברי מחמצת טוסקאני לבן עגול,קונסיגנציה ג`נרל מילס ישראל בע,יח`,,1,16.90,16.90
40,חצי בגט כפרי פיל,קונסיגנציה ג`נרל מילס ישראל בע,יח`,,1,3,3
41,פילסברי חלה קלועה מתוקה,קונסיגנציה ג`נרל מילס ישראל בע,יח`,,1,11.90,11.90
42,סטייק אנטריקוט מוכשר מעובד מופשר,נטו בשרים,"ק""ג",,1,99,99
43,סטייק אנטריקוט חלק מעובד מופשר,נטו בשרים,"ק""ג",,1,79.90,79.90
44,דנאבלו גבינה+עובש משקל,נטו מלינדה סחר בעמ,"ק""ג",,1,110,11
45,גאודה בקר משולש מעדנייה גד,מחלבות גד שיווק 1992 בעמ,"ק""ג",,1,108,10.80
46,גאודה עיזים משולש מעדנייה גד,מחלבות גד שיווק 1992 בעמ,"ק""ג",,1,132,13.20
47,צפתית/מעודנת 5%,תנובה - חלב,"ק""ג",,1,45,4.50
48,סגנון פטה,נטו מלינדה סחר בעמ,"ק""ג",,1,30,3
49,צ`דר  טריפל- מעדנייה,נטו מלינדה סחר בעמ,"ק""ג",,1,119,11.90
50,צוריאל בולגרית מעודנת%5 מעדנייה,החב` המרכזית - טרה,"ק""ג",,1,35,3.50
51,גבינה קשה למחצה אמנטל 28% שומן,ג.וילי-פוד אינטרנשיונל בעמ,"ק""ג",,1,69,6.90
52,פילסברי בייגל סימיט,קונסיגנציה ג`נרל מילס ישראל בע,יח`,,1,4.20,4.20
53,פילסברי מחמצת שיפון אגוזים,קונסיגנציה ג`נרל מילס ישראל בע,יח`,,1,16.90,16.90
54,פילסברי כריך (ילדים) לבן,קונסיגנציה ג`נרל מילס ישראל בע,יח`,,1,1.50,1.50
55,פילסברי לחמניות כריך (ילדים) כפרי,קונסיגנציה ג`נרל מילס ישראל בע,יח`,,1,1.50,1.50
56,פילסברי בפרצל,קונסיגנציה ג`נרל מילס ישראל בע,יח`,,1,4.20,4.20
57,פילסברי עוגת שמרים גבינה,קונסיגנציה ג`נרל מילס ישראל בע,יח`,,1,21.90,21.90
58,חצי בגט פילסברי,קונסיגנציה ג`נרל מילס ישראל בע,יח`,,1,2.90,2.90
59,פילסברי שליש בגט לבן,קונסיגנציה ג`נרל מילס ישראל בע,יח`,,1,2.50,2.50
60,פילסברי שליש בגט כפרי,קונסיגנציה ג`נרל מילס ישראל בע,יח`,,1,2.50,2.50
61,פילסברי לחמניית שמינייה דגנים,קונסיגנציה ג`נרל מילס ישראל בע,יח`,,1,4.20,4.20
62,פילסברי לחמנייה דגנים וגרעינים,קונסיגנציה ג`נרל מילס ישראל בע,יח`,,1,4.20,4.20
63,פילסברי לחמניית שמינייה קלועה,קונסיגנציה ג`נרל מילס ישראל בע,יח`,,1,4.20,4.20
64,פילסברי לחמנייה עגולה לבנה,קונסיגנציה ג`נרל מילס ישראל בע,יח`,,1,4.20,4.20
65,פילסברי לחמניית קוראסול,קונסיגנציה ג`נרל מילס ישראל בע,יח`,,1,4.20,4.20
66,פופקורנס טעם בצל 50 גר,אבאל יזמות בעמ,יח`,,1,4.90,9.80
67,פופקורנס טעם גבינה 50 גר,אבאל יזמות בעמ,יח`,,1,4.90,9.80
68,פופקורנס טעם גריל 50 גר,אבאל יזמות בעמ,יח`,,1,4.90,9.80
69,פופקורנס קרמל מלוח 50 גר,אבאל יזמות בעמ,יח`,,1,4.90,9.80
70,וודקה סטוליצ`יניה (700 מל),הכרם - משקאות חריפים בעמ,יח`,,1,79.90,11.37
71,וודקה רוסקי יורוסטנדרט (700 מל),יורוסטנדרט בעמ,יח`,,1,59.90,8.51
72,הוט פופ 600 גר`,ליימן שליסל בעמ,יח`,,1,15.90,10.60
73,הוט פופ חמאה 600 גר`,ליימן שליסל בעמ,יח`,,1,15.90,2.65
74,הוט פופ לייט 600גר`,ליימן שליסל בעמ,יח`,,1,15.90,2.65
75,הוט פופ 600 גר`,ליימן שליסל בעמ,יח`,,1,15.90,2.65
76,פחמים 2קג,פחם קוואנגו סחר בעמ,יח`,,1,11.90,0.60
77,אפונה 800 גר` סנפרוסט,תנובה קפואים,יח`,,1,16.90,2.11
78,עלית הארק יקב הגליל (700 מל),יקב הגליל שיווק בעמ,יח`,,1,59.90,7.95
79,קרפלך בשר מטוגן 400 גר`,חמים וטעים בעמ,יח`,,1,11.90,2.98
80,סיגר בשר 400,חמים וטעים בעמ,יח`,,1,11.90,2.98
81,קובה בורגול במילוי בשר 400 גר` חמים וטמי,חמים וטעים בעמ,יח`,,1,11.90,2.98
82,קמח 1 קג,טחנת קמח רוט קרית גת,יח`,,1,3.70,3.70
83,סולת 1 קג,טחנת קמח רוט קרית גת,יח`,,1,4.90,4.90
84,קמח מלא 1 קג,טחנת קמח רוט קרית גת,יח`,,1,4.30,4.30
85,קמח תופח 1 קג,טחנת קמח רוט קרית גת,יח`,,1,4.30,4.30
86,טונה סטארקיסט במים 160 גר` רביעייה,סטארקיסט דיפלומט היינץ,יח`,,1,24.90,3.89
87,קובה מרק 400 גר,חמים וטעים בעמ,יח`,,1,11.90,2.98
88,רביולי בטטה,חמים וטעים בעמ,יח`,,1,11.90,2.98
89,רביולי פטריות,חמים וטעים בעמ,יח`,,1,11.90,2.98
90,זן בר פריכיות כוסמין ללא מלח 120 גר,אבאל יזמות בעמ,יח`,,1,7.90,6.58
91,זן בר פריכיות כוסמת עם מלח 120 גר,אבאל יזמות בעמ,יח`,,1,7.90,6.58
92,זן בר פריכיות כוסמת ללא מלח 120 גר,אבאל יזמות בעמ,יח`,,1,7.90,6.58
93,זן בר פריכיות תירס עם מלח 120 גר,אבאל יזמות בעמ,יח`,,1,7.90,6.58
94,פטרוזליה יבולי שהם מהדרין,י.ל.ת שיווק בעמ - קוסיגנציה,יח`,,1,5.90,5.90
95,כוסברה יבולי שהם מהדרין,י.ל.ת שיווק בעמ - קוסיגנציה,יח`,,1,5.90,5.90
96,חסה רגילה מהדרין,י.ל.ת שיווק בעמ - קוסיגנציה,יח`,,1,6.90,6.90
97,שוקולד מריר עלית (100x5 גרם),שטראוס גרופ בעמ,יח`,,1,22.90,4.58
98,שוקולד פרה חלב עלית (100x5 גרם),שטראוס גרופ בעמ,יח`,,1,22.90,4.58
99,וודקה פינלנדיה 700 מל,מ. אקרמן בעמ,יח`,,1,64.90,9.23
