,ItemName,ManufactureName,UnitQty,Quantity,QtyInPackage,ItemPrice,UnitOfMeasurePrice
2105,מואי שכבות ביסקוויט ושוקולד MOOI,דנשר (1963) בעמ,יח`,,1,17.90,9.94
2106,מואי שכבות ביסקוויט ושוקולד MOOI,דנשר (1963) בעמ,יח`,,1,17.90,9.94
2107,אל סבון נוזלי יסמין ולבנדר כיף (1 ליטר),החברה הדרומית לשיווק בעמ,יח`,,1,13.90,1.39
2108,אנטי קאלק מגבונים לניקוי כללי,החברה הדרומית לשיווק בעמ,יח`,,1,10.90,10.90
2109,סנו מקסימה מרכך 1 ליטר ורוד פסים,החברה הדרומית לשיווק בעמ,יח`,,1,17.90,1.79
2110,סנו פרש מטליות לחות לרצפה ריצפז (10),החברה הדרומית לשיווק בעמ,יח`,,1,11.90,11.90
2111,מטליות לחות לריצפה סנו סושי (10),החברה הדרומית לשיווק בעמ,יח`,,1,9.90,9.90
2112,ריצפז פרש 2 ליטר,החברה הדרומית לשיווק בעמ,יח`,,1,21.90,0.01
2113,רסס ונגב - מילוי סנו (750 מל),החברה הדרומית לשיווק בעמ,יח`,,1,11.90,1.59
2114,מחית תפוחי עץ שלב 3 בילובד (190 גרם),שקד תבל בעמ,יח`,,1,5.90,3.11
2115,מחית תפוחי עץ ואפרסק 190גר,שקד תבל בעמ,יח`,,1,5.90,3.11
2116,מחית סלט פירות שלב 3 בילובד (190 גרם),שקד תבל בעמ,יח`,,1,5.90,3.11
2117,קרם קוקוס טעמי אסיה (400 מל),טעמי אסיה בעמ,יח`,,1,9.90,2.48
2118,בירה בהירה בירה מלכה (330 מל),הכרם - משקאות חריפים בעמ,יח`,,1,13.90,4.12
2119,בירה אדמונית בירה מלכה (330 מל),הכרם - משקאות חריפים בעמ,יח`,,1,13.90,4.12
2120,בירה מלכה חיטה 330 מל,הכרם - משקאות חריפים בעמ,יח`,,1,13.90,4.12
2121,הלבנה עדינה סנסודיין (75 מל),גורי ע.ע.ע בעמ,יח`,,1,20,26.67
2122,משחת שיניים בטעם מנטה סנסודיין (75 מל),גורי ע.ע.ע בעמ,יח`,,1,20,26.67
2123,אקווה פרש מי פה 500 מל,גורי ע.ע.ע בעמ,יח`,,1,19.90,3.98
2124,משקה קל תפוחים ג`אמפ (1.5 ליטר),טמפו משקאות בעמ,יח`,,1,5.50,0.37
2125,מטרנה אקסטרא קייר 700 גר` שלב 1,קבוצת אסם סחר שות. מוגבלת,יח`,,1,59.90,8.56
2126,מטרנה אקסטרא קייר 700 גר` שלב 2,קבוצת אסם סחר שות. מוגבלת,יח`,,1,59.90,8.56
2127,מטרנה אקסטרא קייר 700 גר` שלב3,קבוצת אסם סחר שות. מוגבלת,יח`,,1,59.90,8.56
2128,בורקס פילו גבינה מעדנות,תנובה קפואים,יח`,,1,21.90,3.65
2129,בורקס פילו תפוא מעדנות,תנובה קפואים,יח`,,1,21.90,3.65
2130,בורקס פילו פיצה מעדנות,תנובה קפואים,יח`,,1,21.90,3.65
2131,בורקס פילו בולגרית מעדנות,תנובה קפואים,יח`,,1,21.90,3.65
2132,בצק פריך מתוק 900 גר` מעדנות,תנובה קפואים,יח`,,1,24,2.67
2133,בצק פריך מלוח 900 גר` מעדנות,תנובה קפואים,יח`,,1,24,2.67
2134,בצק שמרים מתוק מעדנות,תנובה קפואים,יח`,,1,22.90,2.54
2135,תערובת עוגת שוקולד 560 גר`,מימונס אפיה בעמ,יח`,,1,17.90,3.20
2136,תערובת בראוניס 600 גר`,מימונס אפיה בעמ,יח`,,1,15.90,2.65
2137,תערובת כדורי שוקולד 500 גר`,מימונס אפיה בעמ,יח`,,1,17.90,3.58
2138,תערובת להכנת פנקייק מימונס (400 גרם),מימונס אפיה בעמ,יח`,,1,15.90,3.98
2139,תערובת עוגת וניל מימונס (560 גרם),מימונס אפיה בעמ,יח`,,1,15.90,2.84
2140,תערובת עוגת שיש 560 גר`,מימונס אפיה בעמ,יח`,,1,15.90,2.84
2141,פודינג בטעם וניל 85 גר` מימונס,מימונס אפיה בעמ,יח`,,1,5.90,6.94
2142,פודינג בטעם שוקולד 95 גר` מימונס,מימונס אפיה בעמ,יח`,,1,5.90,6.21
2143,ג`לי בטעם תות 85 גר` מימונס,מימונס אפיה בעמ,יח`,,1,5.90,6.94
2144,גלילית וופל למילוי ג`וני,מימונס אפיה בעמ,יח`,,1,22.90,5.73
2145,סירופ מייפל אמיתי מימונס (236 מל),מימונס אפיה בעמ,יח`,,1,38.90,16.48
2146,אגוז מלך קלוף מימונס (100 גרם),מימונס אפיה בעמ,יח`,,1,11.90,11.90
2147,אגוז מלך טחון מימונס (100 גרם),מימונס אפיה בעמ,יח`,,1,11.90,11.90
2148,100%סירופ מייפל אמיתי 187 מל,מימונס אפיה בעמ,יח`,,1,29.90,15.99
2149,עלים לקרמשניט 300 גר,מימונס אפיה בעמ,יח`,,1,15.90,5.30
2150,ג`ל טעם לימון 95 גר מימונס,מימונס אפיה בעמ,יח`,,1,5.90,6.21
2151,פודינג בטעם וניל לבן 80 גר` מימונס,מימונס אפיה בעמ,יח`,,1,5.90,7.38
2152,פודינג בטעם שוקולד 80 גר` מימונס,מימונס אפיה בעמ,יח`,,1,5.90,7.38
2153,מלית פרג 400 גר`,מימונס אפיה בעמ,יח`,,1,19.90,4.98
2154,מלית אוכמניות 70% פרי 400 גר`,מימונס אפיה בעמ,יח`,,1,19.90,4.98
2155,מלית תפוח עץ 70% פרי 400 גר`.,מימונס אפיה בעמ,יח`,,1,19.90,4.98
2156,מלית דובדבנים 70% פרי 400 גר`,מימונס אפיה בעמ,יח`,,1,19.90,4.98
2157,מלית תות שדה 400 גר`,מימונס אפיה בעמ,יח`,,1,19.90,4.98
2158,מלית שוקולד,מימונס אפיה בעמ,יח`,,1,11.90,2.98
2159,ממרח קרם נוגט,מימונס אפיה בעמ,יח`,,1,15.90,4.54
2160,מארז 8 יח תחתיות מרנג 10 גר` מימונס,מימונס אפיה בעמ,יח`,,1,18.90,18.90
2161,תחתיות בצק פריך לאפייה ומילוי -טארטלטים,מימונס אפיה בעמ,יח`,,1,18.90,18.90
2162,סירופ בטעם קרמל מלוח 500 גר` מימונס,מימונס אפיה בעמ,יח`,,1,17.90,3.58
2163,כוכבים תכלת ירוק לבן לקישוט 60 גר` מימונ,מימונס אפיה בעמ,יח`,,1,10.90,18.17
2164,אטריות צבעוניות לקישוט 55 גר` מימונס,מימונס אפיה בעמ,יח`,,1,10.90,19.82
2165,סוכריות לב סגול לבן לקישוט 60 מימונס,מימונס אפיה בעמ,יח`,,1,10.90,18.17
2166,מיקס טרופי א.מ שרון (500 גרם),א.מ. שרון שיווק (2014) בעמ,יח`,,1,24.90,4.98
2167,דובדבן קפוא א.מ שרון (500 גרם),א.מ. שרון שיווק (2014) בעמ,יח`,,1,19.90,3.98
2168,פטל אדום א.מ שרון (500 גרם),א.מ. שרון שיווק (2014) בעמ,יח`,,1,24.90,4.98
2169,דומדמנית שחורה א.מ שרון (500 גרם),א.מ. שרון שיווק (2014) בעמ,יח`,,1,24.90,4.98
2170,מיקס פירות שדה א.מ שרון (500 גרם),א.מ. שרון שיווק (2014) בעמ,יח`,,1,24.90,4.98
2171,פטל שחור א.מ שרון (500 גרם),א.מ. שרון שיווק (2014) בעמ,יח`,,1,24.90,4.98
2172,חמוצית גן א.מ שרון (400 גרם),א.מ. שרון שיווק (2014) בעמ,יח`,,1,24.90,6.23
2173,דומדמנית אדומה 500 גרם,א.מ. שרון שיווק (2014) בעמ,יח`,,1,24.90,4.98
2174,מיקס פירות יער א.מ שרון (500 גרם),א.מ. שרון שיווק (2014) בעמ,יח`,,1,24.90,4.98
2175,תות שדה א.מ שרון (500 גרם),א.מ. שרון שיווק (2014) בעמ,יח`,,1,24.90,4.98
2176,אוכמנית א.מ שרון (400 גרם),א.מ. שרון שיווק (2014) בעמ,יח`,,1,24.90,6.23
2177,אננס קפוא 500 גר`,א.מ. שרון שיווק (2014) בעמ,יח`,,1,24.90,4.98
2178,מנגו קפוא 500 גר`,א.מ. שרון שיווק (2014) בעמ,יח`,,1,24.90,4.98
2179,מלון קפוא 500 גר`,א.מ. שרון שיווק (2014) בעמ,יח`,,1,24.90,4.98
2180,שטראוס קרמיסימו,גלידות שטראוס בעמ,יח`,,1,18.90,14.21
2181,מאגדת מיני סולרו פירות טרופי,גלידות שטראוס בעמ,יח`,,1,21.90,4.56
2182,סנו מקסימה מרכך 1 ליטר כחול פסים,החברה הדרומית לשיווק בעמ,יח`,,1,17.90,1.79
2183,סנו מקסימה מרכך 1 ליטר סגול,החברה הדרומית לשיווק בעמ,יח`,,1,17.90,1.79
2184,פוליוויקס פרקט סנו בתוספת שמן ארגן (2 לי,החברה הדרומית לשיווק בעמ,יח`,,1,21.90,21.90
2185,ריצפז פרש 2 ליטר מאסק,החברה הדרומית לשיווק בעמ,יח`,,1,21.90,10.95
2186,אוקסיג`ן ג`ל 3 ליטר,החברה הדרומית לשיווק בעמ,יח`,,1,29.90,9.97
2187,מקסימה ג`ל כביסה 3 ליטר,החברה הדרומית לשיווק בעמ,יח`,,1,29.60,9.87
2188,סנובון שלישיה מאסק,החברה הדרומית לשיווק בעמ,יח`,,1,11.90,6.10
2189,מקסימה מרכך סופר מרוכז ביו סנו (1 ליטר),החברה הדרומית לשיווק בעמ,יח`,,1,17.90,1.79
2190,מטליות לחות למוצרי עור סנו (20),החברה הדרומית לשיווק בעמ,יח`,,1,19.90,19.90
2191,מקסימה ג`ל כביסה 3 ליטר,החברה הדרומית לשיווק בעמ,יח`,,1,29.60,9.87
2192,מקסימה ג`ל כביסה 3 ליטר,החברה הדרומית לשיווק בעמ,יח`,,1,29.60,0.01
2193,ריצפז פרש מטליות חד פעמיות 10 יח`,החברה הדרומית לשיווק בעמ,יח`,,1,12.90,12.90
2194,ריצפז 3 ליטר פנטזיה,החברה הדרומית לשיווק בעמ,יח`,,1,17.90,5.97
2195,סנובון ג`ל בניחוח לימון,החברה הדרומית לשיווק בעמ,יח`,,1,12.90,19.85
2196,סנובון ג`ל בניחוח אוקיינוס,החברה הדרומית לשיווק בעמ,יח`,,1,12.90,19.85
2197,אורביטול מברשת שיניים פיות,החברה הדרומית לשיווק בעמ,יח`,,1,12.90,12.90
2198,מפות שולחן 120*180 סמ סנו (2),החברה הדרומית לשיווק בעמ,יח`,,1,9.90,9.90
2199,קוטל חרקים קיי 333 סנו (750 מל),החברה הדרומית לשיווק בעמ,יח`,,1,36.90,4.92
2200,קוטל מעופפים קיי פירטרום סנו (400 מל),החברה הדרומית לשיווק בעמ,יח`,,1,24.90,6.23
2201,בירה נגב אואזיס 330 מל,הכרם - משקאות חריפים בעמ,יח`,,1,13.90,4.12
2202,בירה נגב אמבר אייל 330 מל,הכרם - משקאות חריפים בעמ,יח`,,1,13.90,4.12
2203,פירורי לחם מוזהבים מאסטר שף (320גרם),ש.שסטוביץ בעמ,יח`,,1,7.90,2.47
2204,פירורי לחם פנקו מוזהבים 300 גר` מנה מאסט,ש.שסטוביץ בעמ,יח`,,1,9.90,3.30
2205,פירורי לחם פנקו מוזהבים שום 300 גר` מנה,ש.שסטוביץ בעמ,יח`,,1,9.90,3.30
2206,רוטב טריאקי מאסטר שף (300 מל),ש.שסטוביץ בעמ,יח`,,1,11.90,3.97
2207,רוטב צ`ילי מתוק מאסטר שף (700 מל),ש.שסטוביץ בעמ,יח`,,1,12.90,1.84
2208,רוטב צ`ילי חריף מאסטר שף (700 מל),ש.שסטוביץ בעמ,יח`,,1,12.90,1.84
2209,חצאי אפרסקים 820 גר` מהדרין,ג.וילי-פוד אינטרנשיונל בעמ,יח`,,1,7.90,0.96
2210,סירופ 1 ליטר דיאט לימונענע,זנלכל בעמ,יח`,,1,7.90,0.79
2211,פחית דיאט ספרייט 330 מל,החברה המרכזית להפצת משקאות בעמ,יח`,,1,4.50,1.27
2212,משקה קל לימונענע פריגת (1.5 ליטר),החברה המרכזית להפצת משקאות בעמ,יח`,,1,7.20,0.48
2213,ספרייט זירו 330 מל סילק,החברה המרכזית להפצת משקאות בעמ,יח`,,1,4.50,1.27
2214,מארז מיוחד בירה קרלסברג (330x6 מל),החברה המרכזית להפצת משקאות בעמ,יח`,,1,36.90,1.77
2215,מארז סודה קינלי 1.5 ליטר שישייה,החברה המרכזית להפצת משקאות בעמ,יח`,,1,19.90,0.22
2216,מארז ספרייט 6 פחיות FRIDGE PACK,החברה המרכזית להפצת משקאות בעמ,יח`,,1,19.90,19.90
2217,ויסוצקי ice נענע 1.5 ליטר,החברה המרכזית להפצת משקאות בעמ,יח`,,1,7.90,5.27
2218,ויסוצקי ice לימונית לואיזה 1.5 ליטר,החברה המרכזית להפצת משקאות בעמ,יח`,,1,7.90,5.27
2219,ויסוצקי ice היביסקוס פ.אדומים 1.5 ליטר,החברה המרכזית להפצת משקאות בעמ,יח`,,1,7.90,5.27
2220,ויסוצקי ice ארל גריי 1.5 ליטר,החברה המרכזית להפצת משקאות בעמ,יח`,,1,7.90,5.27
2221,מיץ רימונים סחוט פרימור (1 ליטר),שטראוס גרופ בעמ/מצונן,יח`,,1,23.20,23.20
2222,מיץ תפוזים אורגני 750 מל פרימור 100%,שטראוס גרופ בעמ/מצונן,יח`,,1,14.90,14.90
2223,מיץ אשכולית אדומה אורגני 750 מל,שטראוס גרופ בעמ/מצונן,יח`,,1,14.90,14.90
2224,שניצל אותיות מאמא עוף (700 גרם),תנובה קפואים,יח`,,1,34.90,4.99
2225,שניצל כלי תחבורה מאמא עוף (700 גרם),תנובה קפואים,יח`,,1,34.90,4.99
2226,פסטה א-לה רומר להקפצה 450 גר` מאמא עוף,תנובה קפואים,יח`,,1,19.90,4.42
2227,חגיגה אסייתית להקפצה 450 גר` מאמא עוף,תנובה קפואים,יח`,,1,19.90,4.42
2228,ירוק גלילי להקפצה 450 גר` מאמא עוף,תנובה קפואים,יח`,,1,19.90,4.42
2229,אבקת שוקו 500 גר`,מיה תעשיות מזון מ.ת.מ. בעמ,יח`,,1,6.90,1.38
2230,מים בטעם פירות יער שוופס (1.5 ליטר),יפאורה,יח`,,1,6.30,0.42
2231,מים בטעם אפרסק שוופס (1.5 ליטר),יפאורה,יח`,,1,6.30,0.42
2232,שוופס ווטר אפרסק 500מל,יפאורה,יח`,,1,4.80,0.90
2233,מים בטעם ענבים שוופס (1.5 ליטר),יפאורה,יח`,,1,6.30,0.42
2234,שוופס ווטר ענבים 500מל,יפאורה,יח`,,1,4.80,0.90
2235,מים בטעם תפוח שוופס (1.5 ליטר),יפאורה,יח`,,1,6.30,0.42
2236,שוופס ווטר תפוח 500מל,יפאורה,יח`,,1,4.80,0.90
2237,משקה מוגז לימונייד שוופס (1.5 ליטר),יפאורה,יח`,,1,6.90,0.46
2238,משקה מוגז לימונדה ורודה שוופס (1.5 ליטר),יפאורה,יח`,,1,6.90,0.46
2239,משקה מוגז למון ליים שוופס (1.5 ליטר),יפאורה,יח`,,1,6.90,0.46
2240,שוופס דיאט למון ליים 1.5 ל`,יפאורה,יח`,,1,6.90,0.46
2241,שוופס מוגז עדין 1.5 ליטר אננס,יפאורה,יח`,,1,6.90,0.46
2242,שישיית שוופס למון ליים 1.5 ל`,יפאורה,יח`,,1,34.90,34.90
2243,שישיית שוופס דיאט למון ליים 1.5 ל`,יפאורה,יח`,,1,34.90,34.90
2244,משקה פירות בטעם גווארנה שוופס (1.5 ליטר),יפאורה,יח`,,1,6.90,4.60
2245,בירה ג`מס בקבוק פילס 330 מל,יורוסטנדרט בעמ,יח`,,1,12.90,3.82
2246,בירה ג`מס בקבוק חיטה 330 מל,יורוסטנדרט בעמ,יח`,,1,12.90,3.82
2247,בירה ג`מס בקבוק 8.80% אלכוהול ( 330 מל),יורוסטנדרט בעמ,יח`,,1,12.90,3.82
2248,משוקלדים חמוציות מריר 160 גר` בקופסא,דין שיווק וקליה בעמ,יח`,,1,11.90,7.44
2249,משוקלדים פקאן מריר 160 גר` בקופסא,דין שיווק וקליה בעמ,יח`,,1,11.90,7.44
2250,משוקלדים חמוציות חלב 160 גר` בקופסא,דין שיווק וקליה בעמ,יח`,,1,11.90,7.44
2251,משוקלדים שקד חלב 160 גר` בקופסא,דין שיווק וקליה בעמ,יח`,,1,11.90,7.44
2252,משוקלדים צימוק מריר 160 גר` בקופסא,דין שיווק וקליה בעמ,יח`,,1,11.90,7.44
2253,משוקלדים בוטן מריר 160 גר` בקופסא,דין שיווק וקליה בעמ,יח`,,1,11.90,7.44
2254,משוקלדים לוז חלב 160 גר` בקופסא,דין שיווק וקליה בעמ,יח`,,1,11.90,7.44
2255,משוקלדים לוז מריר 160 גר` בקופסא,דין שיווק וקליה בעמ,יח`,,1,11.90,7.44
2256,משוקלדים שומשום חלב 160 גר` בקופסא,דין שיווק וקליה בעמ,יח`,,1,11.90,7.44
2257,משוקלדים שומשום מריר 160 גר` בקופסא,דין שיווק וקליה בעמ,יח`,,1,11.90,7.44
2258,מגבונים לניקוי כללי סנו סושי (50),החברה הדרומית לשיווק בעמ,יח`,,1,9.90,9.90
2259,קרמה דאודורנט ספריי -קלאסי,החברה הדרומית לשיווק בעמ,יח`,,1,19.90,13.27
2260,דאודורנט ספריי מאסק קרמה (150 מל),החברה הדרומית לשיווק בעמ,יח`,,1,19.90,13.27
2261,קרמה דאודורנט ספריי -אורכידאה,החברה הדרומית לשיווק בעמ,יח`,,1,19.90,13.27
2262,משוקלדים צימוק חלב 160 גר` בקופסא,דין שיווק וקליה בעמ,יח`,,1,11.90,7.44
2263,משוקלדים בוטן חלב 160 גר` בקופסא,דין שיווק וקליה בעמ,יח`,,1,11.90,7.44
2264,נקניקיות פרגיות 300 גר` טירת צבי,תנובה קפואים,יח`,,1,13.90,4.63
2265,פסטרמה שום וצילי טירת צבי (400 גרם),תנובה קפואים,יח`,,1,31.90,7.98
2266,נקניקיות וינר 1 קג` טירת צבי,תנובה קפואים,יח`,,1,32.90,6.58
2267,סלמי גלבוע 400 גר` טירת צבי,תנובה קפואים,יח`,,1,23.90,5.98
2268,קבנוס 120 גר` טירת צבי,תנובה קפואים,יח`,,1,11.90,9.92
2269,קבנוס 120 גר` פיקנטי טירת צבי,תנובה קפואים,יח`,,1,11.90,9.92
2270,חטיפי קבנוס 120 גר` טירת צבי,תנובה קפואים,יח`,,1,11.90,9.92
2271,צמד כפרי ברבקיו ודבש 600 גר טירת צבי,תנובה קפואים,יח`,,1,29.90,4.98
2272,טרין מוס כבד עוף 120 גר` תנובה,תנובה קפואים,יח`,,1,15.90,13.25
2273,סירופ בטעם ענבים מועשר בויטמינים 1 ליטר,אחדות בעמ,יח`,,1,8.50,8.50
2274,סירופ בטעם פטל מועשר בויטמינים 1 ליטר אח,אחדות בעמ,יח`,,1,8.50,8.50
2275,סירופ בטעם אננס מועשר בויטמינים 1 ליטר א,אחדות בעמ,יח`,,1,8.50,8.50
2276,ממרח טחינה עם דבש 400 גר` אחווה,אחדות בעמ,יח`,,1,11.90,2.98
2277,עוגת שמרים קרנץ בטעם שוקולד 400  גר`אחוו,אחדות בעמ,יח`,,1,10,2.50
2278,נשנושי קבנוס יחיעם (125 גרם),מעדני יחיעם (1993) בעמ,יח`,,1,12.90,10.32
2279,נקניקיות עוף 1.5 קג,מעדני יחיעם (1993) בעמ,יח`,,1,29.90,29.90
2280,פסטרמה ברביקיו דק דק יחיעם (140 גרם),מעדני יחיעם (1993) בעמ,יח`,,1,12.90,9.21
2281,פסטרמה בדבש דק דק יחיעם (140 גרם),מעדני יחיעם (1993) בעמ,יח`,,1,12.90,9.21
2282,פסטרמה של פעם דק דק יחיעם (140 גרם),מעדני יחיעם (1993) בעמ,יח`,,1,12.90,9.21
2283,פסטרמה מעודנת על גחלים יחיעם (300 גרם),מעדני יחיעם (1993) בעמ,יח`,,1,23.90,7.97
2284,סלמי תה יחיעם (300 גרם),מעדני יחיעם (1993) בעמ,יח`,,1,25.90,8.63
2285,סלמי פפרוני 200 גר` יחיעם,מעדני יחיעם (1993) בעמ,יח`,,1,14.90,7.45
2286,גבינת גאודה פרוסות 150 גר,ג.וילי-פוד אינטרנשיונל בעמ,יח`,,1,9.90,6.60
2287,אורז בסמטי אהרוני (1 קג),דין שיווק וקליה בעמ,יח`,,1,12.90,12.90
2288,שיבולת שועל דקה שקדיה (500 גרם),דין שיווק וקליה בעמ,יח`,,1,5.90,1.18
2289,משוקלדים שקד מריר 160 גר` בקופסא,דין שיווק וקליה בעמ,יח`,,1,11.90,7.44
2290,משוקלדים פקאן חלב 160 גר` בקופסא,דין שיווק וקליה בעמ,יח`,,1,11.90,7.44
2291,שיבולת שועל עבה שקדיה (500 גרם),דין שיווק וקליה בעמ,יח`,,1,5.90,1.18
2292,בישקוטים וניל קקאו בונומי (200 גרם),דנשר (1963) בעמ,יח`,,1,7.90,3.95
2293,מואי עוגיות קקאו ושוקלד מריר עם קרם אספר,דנשר (1963) בעמ,יח`,,1,17.90,9.94
2294,מואי עוגיות קקאו ושוקולד עם קרם ברולה,דנשר (1963) בעמ,יח`,,1,17.90,9.94
2295,אל סבון נוזלי פנינה רוזנבלום (500x3 גרם),פנינה רוזנבלום בעמ,יח`,,1,13.90,9.27
2296,גרנולה שוקולד מריר+לבן 400 גר` פנינה רוז,פנינה רוזנבלום בעמ,יח`,,1,29.90,7.48
2297,מרכך לאחר החלקה 750 מל פנינה רוזנבלום,פנינה רוזנבלום בעמ,יח`,,1,29.90,3.99
2298,שמפו לאחר החלקה 750 מל פנינה רוזנבלום,פנינה רוזנבלום בעמ,יח`,,1,29.90,3.99
2299,מסיכה לאחר החלקה 500 מל פנינה רוזנבלום,פנינה רוזנבלום בעמ,יח`,,1,34.90,6.98
2300,רוטב עוף 800 גרם,פנינה רוזנבלום בעמ,יח`,,1,17.90,2.24
2301,קריניאנו 750 מל BUZZ,אגודת הכורמים,יח`,,1,26.90,3.55
2302,מוסקטו 750 מל BUZZ,אגודת הכורמים,יח`,,1,26.90,3.55
2303,קורנפלור מיה (500 גרם),מיה תעשיות מזון מ.ת.מ. בעמ,יח`,,1,8.90,1.78
2304,שקיות מזון סנו סושי (300),החברה הדרומית לשיווק בעמ,יח`,,1,11.90,11.90
2305,מקסימה מרכך מרוכז חלב ודבש סנו (1 ליטר),החברה הדרומית לשיווק בעמ,יח`,,1,17.90,1.79
2306,סנו מקסימה מרכך 1 ליטר ורוד,החברה הדרומית לשיווק בעמ,יח`,,1,17.90,1.79
2307,אוקסיג`ן ג`ל 3 ליטר כביסה לבנה,החברה הדרומית לשיווק בעמ,יח`,,1,29.90,9.97
2308,סנופרש הום נטול גז 350 מל בניחוח בוקר א,החברה הדרומית לשיווק בעמ,יח`,,1,14.90,4.26
2309,פוליויקס 3 ליטר,החברה הדרומית לשיווק בעמ,יח`,,1,22.90,11.45
2310,סנובון ג`ל בניחוח פריחה,החברה הדרומית לשיווק בעמ,יח`,,1,12.90,12.90
2311,מנקה אסלות 00 1 ליטר ניחוח רענן,החברה הדרומית לשיווק בעמ,יח`,,1,10.90,10.90
2312,סנובון מוצק WAVE בתוספת אקונומיקה,החברה הדרומית לשיווק בעמ,יח`,,1,9.90,9.90
2313,פרוסות צ`יפס תפוגן (1.5 קג),קבוצת אסם סחר שות. מוגבלת,יח`,,1,24.90,1.66
2314,הר חרמון אינדיגו,היכל היין שקד גולן בעמ,יח`,,1,30.90,4.08
2315,הר חרמון מוסקט יקב רמת הגולן (750 מל),היכל היין שקד גולן בעמ,יח`,,1,30.90,4.08
2316,מוזלי בוטנים אגוזים ושקדים 1קג - שקדיה,דין שיווק וקליה בעמ,יח`,,1,19.90,1.99
2317,מוזלי עם פירות שקדיה (1 קג),דין שיווק וקליה בעמ,יח`,,1,19.90,1.99
2318,מוזלי צימוקים תפוח קינומון 1קג - שקדיה,דין שיווק וקליה בעמ,יח`,,1,19.90,1.99
2319,גרנולה אגוזים 1קג - שקדיה,דין שיווק וקליה בעמ,יח`,,1,19.90,1.99
2320,קונפיטוריה פטל אדום 450גר`.,דין שיווק וקליה בעמ,יח`,,1,10.90,2.42
2321,קונפיטוריה תות שדה 450 גר`,דין שיווק וקליה בעמ,יח`,,1,10.90,2.42
2322,קונפיטוריה פטל שחור 450 גר`,דין שיווק וקליה בעמ,יח`,,1,10.90,2.42
2323,קונפיטוריה משמש 450 גר` שקדיה,דין שיווק וקליה בעמ,יח`,,1,10.90,2.42
2324,יין אדום יבש יובלים יקב דלתון (750 מל),הכרם - משקאות חריפים בעמ,יח`,,1,48.90,6.48
2325,יין לבן יובלים יקב דלתון (750 מל),הכרם - משקאות חריפים בעמ,יח`,,1,48.90,6.48
2326,יין כנען רוזה יקב דלתון (750 מל),הכרם - משקאות חריפים בעמ,יח`,,1,48.90,6.48
2327,מרבה סלים פרוט בטעם יוגורט ותפוח,ש.שסטוביץ בעמ,יח`,,1,10.90,5.99
2328,מרבה סלים פרוט בטעם יוגורט ותות,ש.שסטוביץ בעמ,יח`,,1,10.90,5.99
2329,מרבה סלים פרוט בטעם פירות יער,ש.שסטוביץ בעמ,יח`,,1,10.90,5.99
2330,מרבה סלים פרוט בטעם יוגורט ופירות יער,ש.שסטוביץ בעמ,יח`,,1,10.90,9.08
2331,סלים דליס קריספי תות מרבה (125 גרם),ש.שסטוביץ בעמ,יח`,,1,10.90,9.08
2332,סלים דליס קריספי אוכמניות מרבה (125 גרם),ש.שסטוביץ בעמ,יח`,,1,10.90,8.72
2333,סלים דליס קריספי שוקולד מרבה (125 גרם),ש.שסטוביץ בעמ,יח`,,1,10.90,8.72
2334,מרבה שוקודליס בציפוי שוקולד חלב 145 גר`,ש.שסטוביץ בעמ,יח`,,1,12.90,8.90
2335,מרבה שוקודליס עו,ש.שסטוביץ בעמ,יח`,,1,12.90,7.33
2336,מרבה שוקודליס עו,ש.שסטוביץ בעמ,יח`,,1,12.90,7.33
2337,מרבה שוקודליס במילוי קרם בטעם קפוצינו 14,ש.שסטוביץ בעמ,יח`,,1,12.90,8.90
