,ItemName,ManufactureName,UnitQty,Quantity,QtyInPackage,ItemPrice,UnitOfMeasurePrice
2338,ויסוצקי ice ארל גריי 1.5 ליטר,החברה המרכזית להפצת משקאות בעמ,יח`,,1,9.10,6.07
2339,מיץ רימונים סחוט פרימור (1 ליטר),שטראוס גרופ בעמ/מצונן,יח`,,1,23.70,23.70
2340,מיץ תפוזים אורגני 750 מל פרימור 100%,שטראוס גרופ בעמ/מצונן,יח`,,1,15.90,15.90
2341,מיץ אשכולית אדומה אורגני 750 מל,שטראוס גרופ בעמ/מצונן,יח`,,1,15.90,15.90
2342,שניצל אותיות מאמא עוף (700 גרם),תנובה קפואים,יח`,,1,36.90,5.27
2343,שניצל כלי תחבורה מאמא עוף (700 גרם),תנובה קפואים,יח`,,1,36.90,5.27
2344,פסטה א-לה רומר להקפצה 450 גר` מאמא עוף,תנובה קפואים,יח`,,1,20.90,4.64
2345,חגיגה אסייתית להקפצה 450 גר` מאמא עוף,תנובה קפואים,יח`,,1,20.90,4.64
2346,ירוק גלילי להקפצה 450 גר` מאמא עוף,תנובה קפואים,יח`,,1,20.90,4.64
2347,אבקת שוקו 500 גר`,מיה תעשיות מזון מ.ת.מ. בעמ,יח`,,1,7.10,1.42
2348,מים בטעם פירות יער שוופס (1.5 ליטר),יפאורה,יח`,,1,6.70,0.45
2349,מים בטעם אפרסק שוופס (1.5 ליטר),יפאורה,יח`,,1,6.70,0.45
2350,שוופס ווטר אפרסק 500מל,יפאורה,יח`,,1,4.90,0.92
2351,מים בטעם ענבים שוופס (1.5 ליטר),יפאורה,יח`,,1,6.70,0.45
2352,שוופס ווטר ענבים 500מל,יפאורה,יח`,,1,4.90,0.92
2353,מים בטעם תפוח שוופס (1.5 ליטר),יפאורה,יח`,,1,6.70,0.45
2354,שוופס ווטר תפוח 500מל,יפאורה,יח`,,1,4.90,0.92
2355,משקה מוגז לימונייד שוופס (1.5 ליטר),יפאורה,יח`,,1,7.50,0.50
2356,משקה מוגז לימונדה ורודה שוופס (1.5 ליטר),יפאורה,יח`,,1,7.50,0.50
2357,משקה מוגז למון ליים שוופס (1.5 ליטר),יפאורה,יח`,,1,7.70,0.51
2358,שוופס דיאט למון ליים 1.5 ל`,יפאורה,יח`,,1,7.70,0.51
2359,שוופס מוגז עדין 1.5 ליטר אננס,יפאורה,יח`,,1,7.50,0.50
2360,שישיית שוופס למון ליים 1.5 ל`,יפאורה,יח`,,1,36.70,36.70
2361,שישיית שוופס דיאט למון ליים 1.5 ל`,יפאורה,יח`,,1,36.70,36.70
2362,משקה פירות בטעם גווארנה שוופס (1.5 ליטר),יפאורה,יח`,,1,7.50,5
2363,בירה ג`מס בקבוק פילס 330 מל,יורוסטנדרט בעמ,יח`,,1,13.90,4.12
2364,בירה ג`מס בקבוק חיטה 330 מל,יורוסטנדרט בעמ,יח`,,1,13.90,4.12
2365,בירה ג`מס בקבוק 8.80% אלכוהול ( 330 מל),יורוסטנדרט בעמ,יח`,,1,13.90,4.12
2366,משוקלדים חמוציות מריר 160 גר` בקופסא,דין שיווק וקליה בעמ,יח`,,1,13.20,8.25
2367,משוקלדים פקאן מריר 160 גר` בקופסא,דין שיווק וקליה בעמ,יח`,,1,13.20,8.25
2368,משוקלדים חמוציות חלב 160 גר` בקופסא,דין שיווק וקליה בעמ,יח`,,1,13.20,8.25
2369,משוקלדים שקד חלב 160 גר` בקופסא,דין שיווק וקליה בעמ,יח`,,1,13.20,8.25
2370,משוקלדים צימוק מריר 160 גר` בקופסא,דין שיווק וקליה בעמ,יח`,,1,13.20,8.25
2371,משוקלדים בוטן מריר 160 גר` בקופסא,דין שיווק וקליה בעמ,יח`,,1,13.20,8.25
2372,משוקלדים לוז חלב 160 גר` בקופסא,דין שיווק וקליה בעמ,יח`,,1,13.20,8.25
2373,משוקלדים לוז מריר 160 גר` בקופסא,דין שיווק וקליה בעמ,יח`,,1,13.20,8.25
2374,משוקלדים שומשום חלב 160 גר` בקופסא,דין שיווק וקליה בעמ,יח`,,1,13.20,8.25
2375,משוקלדים שומשום מריר 160 גר` בקופסא,דין שיווק וקליה בעמ,יח`,,1,13.20,8.25
2376,מגבונים לניקוי כללי סנו סושי (50),החברה הדרומית לשיווק בעמ,יח`,,1,11.20,11.20
2377,קרמה דאודורנט ספריי -קלאסי,החברה הדרומית לשיווק בעמ,יח`,,1,21.40,14.27
2378,דאודורנט ספריי מאסק קרמה (150 מל),החברה הדרומית לשיווק בעמ,יח`,,1,21.40,14.27
2379,קרמה דאודורנט ספריי -אורכידאה,החברה הדרומית לשיווק בעמ,יח`,,1,21.40,14.27
2380,משוקלדים צימוק חלב 160 גר` בקופסא,דין שיווק וקליה בעמ,יח`,,1,13.20,8.25
2381,משוקלדים בוטן חלב 160 גר` בקופסא,דין שיווק וקליה בעמ,יח`,,1,13.20,8.25
2382,נקניקיות פרגיות 300 גר` טירת צבי,תנובה קפואים,יח`,,1,16.30,5.43
2383,פסטרמה שום וצילי טירת צבי (400 גרם),תנובה קפואים,יח`,,1,34.60,8.65
2384,נקניקיות וינר 1 קג` טירת צבי,תנובה קפואים,יח`,,1,34.60,6.92
2385,סלמי גלבוע 400 גר` טירת צבי,תנובה קפואים,יח`,,1,25.40,6.35
2386,קבנוס 120 גר` טירת צבי,תנובה קפואים,יח`,,1,13.20,11
2387,קבנוס 120 גר` פיקנטי טירת צבי,תנובה קפואים,יח`,,1,13.20,11
2388,חטיפי קבנוס 120 גר` טירת צבי,תנובה קפואים,יח`,,1,13.20,11
2389,צמד כפרי ברבקיו ודבש 600 גר טירת צבי,תנובה קפואים,יח`,,1,31.60,5.27
2390,טרין מוס כבד עוף 120 גר` תנובה,תנובה קפואים,יח`,,1,17.30,14.42
2391,סירופ בטעם ענבים מועשר בויטמינים 1 ליטר,אחדות בעמ,יח`,,1,8.90,8.90
2392,סירופ בטעם פטל מועשר בויטמינים 1 ליטר אח,אחדות בעמ,יח`,,1,8.90,8.90
2393,סירופ בטעם אננס מועשר בויטמינים 1 ליטר א,אחדות בעמ,יח`,,1,8.90,8.90
2394,ממרח טחינה עם דבש 400 גר` אחווה,אחדות בעמ,יח`,,1,13.20,3.30
2395,ערק ג`באלנא מצדה 40%,בני פאוזי שמשום (2009) בעמ,יח`,,1,52,7.39
2396,צמד פסטרמות 600 גר` יחיעם,מעדני יחיעם (1993) בעמ,יח`,,1,26.50,4.42
2397,נשנושי קבנוס יחיעם (125 גרם),מעדני יחיעם (1993) בעמ,יח`,,1,13.20,10.56
2398,נקניקיות עוף 1.5 קג,מעדני יחיעם (1993) בעמ,יח`,,1,31.60,31.60
2399,פסטרמה ברביקיו דק דק יחיעם (140 גרם),מעדני יחיעם (1993) בעמ,יח`,,1,13.20,9.43
2400,פסטרמה בדבש דק דק יחיעם (140 גרם),מעדני יחיעם (1993) בעמ,יח`,,1,13.20,9.43
2401,פסטרמה של פעם דק דק יחיעם (140 גרם),מעדני יחיעם (1993) בעמ,יח`,,1,13.20,9.43
2402,פסטרמה מעודנת על גחלים יחיעם (300 גרם),מעדני יחיעם (1993) בעמ,יח`,,1,25.40,8.47
2403,סלמי תה יחיעם (300 גרם),מעדני יחיעם (1993) בעמ,יח`,,1,26.50,8.83
2404,סלמי פפרוני 200 גר` יחיעם,מעדני יחיעם (1993) בעמ,יח`,,1,15.20,7.60
2405,גבינת גאודה פרוסות 150 גר,ג.וילי-פוד אינטרנשיונל בעמ,יח`,,1,10.90,7.27
2406,אורז בסמטי אהרוני (1 קג),דין שיווק וקליה בעמ,יח`,,1,13.50,13.50
2407,שיבולת שועל דקה שקדיה (500 גרם),דין שיווק וקליה בעמ,יח`,,1,7.10,1.42
2408,משוקלדים שקד מריר 160 גר` בקופסא,דין שיווק וקליה בעמ,יח`,,1,13.20,8.25
2409,משוקלדים פקאן חלב 160 גר` בקופסא,דין שיווק וקליה בעמ,יח`,,1,13.20,8.25
2410,שיבולת שועל עבה שקדיה (500 גרם),דין שיווק וקליה בעמ,יח`,,1,7.10,1.42
2411,בישקוטים וניל קקאו בונומי (200 גרם),דנשר (1963) בעמ,יח`,,1,8.40,4.20
2412,מואי עוגיות קקאו ושוקלד מריר עם קרם אספר,דנשר (1963) בעמ,יח`,,1,18.60,10.33
2413,מואי עוגיות קקאו ושוקולד עם קרם ברולה,דנשר (1963) בעמ,יח`,,1,19.30,10.72
2414,אל סבון נוזלי פנינה רוזנבלום (500x3 גרם),פנינה רוזנבלום בעמ,יח`,,1,14.20,9.47
2415,גרנולה שוקולד מריר+לבן 400 גר` פנינה רוז,פנינה רוזנבלום בעמ,יח`,,1,31.60,7.90
2416,מרכך לאחר החלקה 750 מל פנינה רוזנבלום,פנינה רוזנבלום בעמ,יח`,,1,31.60,4.21
2417,שמפו לאחר החלקה 750 מל פנינה רוזנבלום,פנינה רוזנבלום בעמ,יח`,,1,31.60,4.21
2418,מסיכה לאחר החלקה 500 מל פנינה רוזנבלום,פנינה רוזנבלום בעמ,יח`,,1,36.70,7.34
2419,רוטב עוף 800 גרם,פנינה רוזנבלום בעמ,יח`,,1,19.30,2.41
2420,קריניאנו 750 מל BUZZ,אגודת הכורמים,יח`,,1,28.50,3.76
2421,מוסקטו 750 מל BUZZ,אגודת הכורמים,יח`,,1,28.50,3.76
2422,קורנפלור מיה (500 גרם),מיה תעשיות מזון מ.ת.מ. בעמ,יח`,,1,9.40,1.88
2423,שקיות מזון סנו סושי (300),החברה הדרומית לשיווק בעמ,יח`,,1,13.20,13.20
2424,מקסימה מרכך מרוכז חלב ודבש סנו (1 ליטר),החברה הדרומית לשיווק בעמ,יח`,,1,19.30,1.93
2425,סנו מקסימה מרכך 1 ליטר ורוד,החברה הדרומית לשיווק בעמ,יח`,,1,19.30,1.93
2426,אוקסיג`ן ג`ל 3 ליטר כביסה לבנה,החברה הדרומית לשיווק בעמ,יח`,,1,32.60,10.87
2427,סנופרש הום נטול גז 350 מל בניחוח בוקר א,החברה הדרומית לשיווק בעמ,יח`,,1,16.30,4.66
2428,מקסימה מרכך חלב ודבש סנו (4 ליטר),החברה הדרומית לשיווק בעמ,יח`,,1,22.40,5.60
2429,פוליויקס 3 ליטר,החברה הדרומית לשיווק בעמ,יח`,,1,24.40,12.20
2430,סנובון ג`ל בניחוח פריחה,החברה הדרומית לשיווק בעמ,יח`,,1,14.20,14.20
2431,מקסימה מרכך פריחה לבנה סנו (4 ליטר),החברה הדרומית לשיווק בעמ,יח`,,1,22.40,5.60
2432,מנקה אסלות 00 1 ליטר ניחוח רענן,החברה הדרומית לשיווק בעמ,יח`,,1,12.30,12.30
2433,סנובון מוצק WAVE בתוספת אקונומיקה,החברה הדרומית לשיווק בעמ,יח`,,1,11.20,11.20
2434,פרוסות צ`יפס תפוגן (1.5 קג),קבוצת אסם סחר שות. מוגבלת,יח`,,1,26.50,1.77
2435,הר חרמון אינדיגו,היכל היין שקד גולן בעמ,יח`,,1,31.90,4.21
2436,הר חרמון מוסקט יקב רמת הגולן (750 מל),היכל היין שקד גולן בעמ,יח`,,1,31.90,4.21
2437,יין גמלא מרלו,היכל היין שקד גולן בעמ,יח`,,1,61.10,61.10
2438,מוזלי בוטנים אגוזים ושקדים 1קג - שקדיה,דין שיווק וקליה בעמ,יח`,,1,21.40,2.14
2439,מוזלי עם פירות שקדיה (1 קג),דין שיווק וקליה בעמ,יח`,,1,21.40,2.14
2440,מוזלי צימוקים תפוח קינומון 1קג - שקדיה,דין שיווק וקליה בעמ,יח`,,1,21.40,2.14
2441,גרנולה אגוזים 1קג - שקדיה,דין שיווק וקליה בעמ,יח`,,1,21.40,2.14
2442,קונפיטוריה פטל אדום 450גר`.,דין שיווק וקליה בעמ,יח`,,1,11.90,2.64
2443,קונפיטוריה תות שדה 450 גר`,דין שיווק וקליה בעמ,יח`,,1,11.90,2.64
2444,קונפיטוריה פטל שחור 450 גר`,דין שיווק וקליה בעמ,יח`,,1,11.90,2.64
2445,קונפיטוריה משמש 450 גר` שקדיה,דין שיווק וקליה בעמ,יח`,,1,11.90,2.64
2446,יין אדום יבש יובלים יקב דלתון (750 מל),הכרם - משקאות חריפים בעמ,יח`,,1,50.90,6.75
2447,יין לבן יובלים יקב דלתון (750 מל),הכרם - משקאות חריפים בעמ,יח`,,1,50.90,6.75
2448,יין כנען רוזה יקב דלתון (750 מל),הכרם - משקאות חריפים בעמ,יח`,,1,50.90,6.75
2449,מרבה סלים פרוט בטעם יוגורט ותפוח,ש.שסטוביץ בעמ,יח`,,1,15.20,8.35
2450,מרבה סלים פרוט בטעם יוגורט ותות,ש.שסטוביץ בעמ,יח`,,1,15.20,8.35
2451,מרבה סלים פרוט בטעם פירות יער,ש.שסטוביץ בעמ,יח`,,1,15.20,8.35
2452,מרבה סלים פרוט בטעם יוגורט ופירות יער,ש.שסטוביץ בעמ,יח`,,1,15.20,12.67
2453,סלים דליס קריספי תות מרבה (125 גרם),ש.שסטוביץ בעמ,יח`,,1,15.20,12.67
2454,סלים דליס קריספי אוכמניות מרבה (125 גרם),ש.שסטוביץ בעמ,יח`,,1,15.20,12.16
2455,סלים דליס קריספי שוקולד מרבה (125 גרם),ש.שסטוביץ בעמ,יח`,,1,15.20,12.16
2456,מרבה שוקודליס בציפוי שוקולד חלב 145 גר`,ש.שסטוביץ בעמ,יח`,,1,13.90,9.59
2457,מרבה שוקודליס עו,ש.שסטוביץ בעמ,יח`,,1,13.90,7.90
2458,מרבה שוקודליס עו,ש.שסטוביץ בעמ,יח`,,1,13.90,7.90
2459,מרבה שוקודליס במילוי קרם בטעם קפוצינו 14,ש.שסטוביץ בעמ,יח`,,1,13.90,9.59
2460,לה פסטה פסטה צינור 400 גר`,תומר יבוא ושיווק מוצרי מזון (1,יח`,,1,2.90,0.73
2461,לה פסטה קונכיה 53 400 גר`,תומר יבוא ושיווק מוצרי מזון (1,יח`,,1,2.90,0.73
2462,לה פסטה פסטה פרפר 81 400 גר`,תומר יבוא ושיווק מוצרי מזון (1,יח`,,1,2.90,0.73
2463,לה פסטה פסטה בורג 64 400 גר`,תומר יבוא ושיווק מוצרי מזון (1,יח`,,1,2.90,0.73
2464,לה פסטה פסטה תלתל 65 400 גר`,תומר יבוא ושיווק מוצרי מזון (1,יח`,,1,2.90,0.73
2465,לה פסטה פסטה אטריות מרק 400 גר`,תומר יבוא ושיווק מוצרי מזון (1,יח`,,1,2.90,0.73
2466,מאגדת-מיני מגנום דאבל,גלידות שטראוס בעמ,יח`,,1,30.50,30.50
2467,שטראוס קרמיסימו סנדיי וניל,גלידות שטראוס בעמ,יח`,,1,20.50,15.41
2468,שטראוס קרמסימו מסטיגם 1.33 ליטר,גלידות שטראוס בעמ,יח`,,1,20.50,15.41
2469,פירורי לחם זהוב תבליני מימון (800 גרם),א.ל.ייצור ושיווק תבלינים בעמ,יח`,,1,18.30,2.29
2470,גבינת ברי 125 גר,ג.וילי-פוד אינטרנשיונל בעמ,יח`,,1,20.30,16.24
2471,גבינת קממבר 125 גר,ג.וילי-פוד אינטרנשיונל בעמ,יח`,,1,20.30,16.24
2472,שיני שום במי מלח 340 גרם,ג.וילי-פוד אינטרנשיונל בעמ,יח`,,1,13.20,3.88
2473,עגבניות מיובשות בשמן 340 גר,ג.וילי-פוד אינטרנשיונל בעמ,יח`,,1,13.20,3.88
2474,פתיתים מגורדת וילי פוד (500 גרם) GOLDEN,ג.וילי-פוד אינטרנשיונל בעמ,יח`,,1,23.40,4.68
2475,גבינת מוצרלה מגורדת סיי צ`יז (200 גרם),ג.וילי-פוד אינטרנשיונל בעמ,יח`,,1,15.20,7.60
2476,גבינה מוצרלה בייבי 150 גר` כפיר,צ.י תעשיות מזון יבנה בעמ,יח`,,1,14.90,9.93
2477,שניצל ביתי עם צ`יפס שמח 600 גר` עוף טוב,קבוצת אסם סחר שות. מוגבלת,יח`,,1,41.80,6.97
2478,שניצל עוף דקיק קריספי 700 גר` עוף טוב,קבוצת אסם סחר שות. מוגבלת,יח`,,1,37.70,5.39
2479,שניצל דק ענקיסטי 700 גר` עוף טוב,קבוצת אסם סחר שות. מוגבלת,יח`,,1,37.70,5.39
2480,שניצל עוף ביתי כזה 700 גר` עוף טוב,קבוצת אסם סחר שות. מוגבלת,יח`,,1,46.90,6.70
2481,שניצל עוף היער הקסום 600 גר` עוף טוב,קבוצת אסם סחר שות. מוגבלת,יח`,,1,33.90,5.65
2482,שניצל עוף ביתי שומשום 700 גר` עוף טוב,קבוצת אסם סחר שות. מוגבלת,יח`,,1,46.90,6.70
2483,שניצל עוף ביתי קריספי 700 גר` עוף טוב,קבוצת אסם סחר שות. מוגבלת,יח`,,1,46.90,6.70
2484,שניצל עוף ביתי מתובל 600 גר` עוף טוב,קבוצת אסם סחר שות. מוגבלת,יח`,,1,38.90,6.48
2485,שניצל עוף ביתי עדין כזה 700 גר` עוף טוב,קבוצת אסם סחר שות. מוגבלת,יח`,,1,46.90,6.70
2486,צונגו רצועות שניצל ציפס 600 גר` עוף טוב,קבוצת אסם סחר שות. מוגבלת,יח`,,1,43.90,7.32
2487,צונגו רצועות שניצל חריף מתוק 600 גר` עוף,קבוצת אסם סחר שות. מוגבלת,יח`,,1,43.90,7.32
2488,צונגו רצועות שניצל גריל 600 גר` עוף טוב,קבוצת אסם סחר שות. מוגבלת,יח`,,1,43.90,7.32
2489,יוגורט ביו 3% תנובה (150x8 גרם),תנובה - חלב,יח`,,1,16.50,1.38
2490,יוגורט ביו 1.5% תנובה (150x8 גרם),תנובה - חלב,יח`,,1,16.50,1.38
2491,משקה שקדים טרי תנובה (1 ליטר),תנובה - חלב,יח`,,1,12.20,1.22
2492,יופלה דיאט תות ב,תנובה - חלב,יח`,,1,5,3.33
2493,מעדן שוקולד חלב יולו (123 גרם),תנובה - חלב,יח`,,1,4.50,3.66
2494,מעדן שוקולד מריר יולו (123 גרם),תנובה - חלב,יח`,,1,4.50,3.66
2495,מעדן שוקולד לבן יולו (123 גרם),תנובה - חלב,יח`,,1,4.50,3.66
2496,יולו מעדן שכבות שוקולד חלבי לבן,תנובה - חלב,יח`,,1,4.50,3.66
2497,יולו מעדן שכבות שוקולד מריר לבן,תנובה - חלב,יח`,,1,4.50,3.66
2498,דייאט יופלה 0% אוכמניות בתחתית,תנובה - חלב,יח`,,1,5,3.33
2499,משקה טעם וניל תנובה GO,תנובה - חלב,יח`,,1,6.10,2.44
2500,תה קר בטעם ענבים ספרינג (1.5 ליטר),יפאורה,יח`,,1,6.70,4.47
2501,שוופס ווטר 0 קלוריות תפוח 1.5 ליטר,יפאורה,יח`,,1,6.70,0.45
2502,שוופס ווטר 0 קלוריות אפרסק 1.5 ליטר,יפאורה,יח`,,1,6.70,0.45
2503,משקה מוגז בטעם ענבים שוופס (1.5 ליטר),יפאורה,יח`,,1,7.50,5
2504,משקה קל לימונדה נענע תפוזינה (1.5 ליטר),יפאורה,יח`,,1,6.90,0.46
2505,שוופס סודה נענע ליים 1.5 ליטר,יפאורה,יח`,,1,4.30,0.29
2506,משקה בטעם ענבים פרוט ווטר (1.5 ליטר),יפאורה,יח`,,1,8.10,0.54
2507,משקה בטעם אננס פרוט ווטר (1.5 ליטר),יפאורה,יח`,,1,8.10,0.54
2508,משקה בטעם אפרסק פרוט ווטר (1.5 ליטר),יפאורה,יח`,,1,8.10,0.54
2509,משקה בטעם אבטיח פרוט ווטר (1.5 ליטר),יפאורה,יח`,,1,8.10,0.54
2510,משקה בטעם תות פרוט ווטר (1.5 ליטר),יפאורה,יח`,,1,8.10,0.54
2511,מגבונים בייביסיטר רביעייה,שקד תבל בעמ,יח`,,1,19.30,19.30
2512,מגבונים בייביסיטר רביעייה,שקד תבל בעמ,יח`,,1,19.30,19.30
2513,שמפו קרטין 750 מל סטייל,גורי ע.ע.ע בעמ,יח`,,1,31.60,4.21
2514,מרכך קרטין 750 מל סטייל,גורי ע.ע.ע בעמ,יח`,,1,31.60,4.21
2515,מסיכה קרטין 500 מל סטייל,גורי ע.ע.ע בעמ,יח`,,1,41.80,8.36
2516,אקווה פרש מברשת שיניים גוניור,גורי ע.ע.ע בעמ,יח`,,1,13.50,13.50
2517,אקוה פרש הגנה כוללת 100 מל,גורי ע.ע.ע בעמ,יח`,,1,18.90,18.90
2518,מלפפונים במלח 690 גר` לינה,יורוסטנדרט בעמ,יח`,,1,11.20,1.62
2519,קורנישונים במלח 690 גר` לינה,יורוסטנדרט בעמ,יח`,,1,11.20,1.62
2520,ערק יודה 700 מל,יורוסטנדרט בעמ,יח`,,1,55.90,7.94
2521,לחם פשוט מלא לילדים פרוס אנג`ל (750 גרם),שלמה א. אנג`ל בעמ,יח`,,1,14.20,2.84
2522,אוטן אקטיב ספריי יבש דוחה יתושים,דנשר (1963) בעמ,יח`,,1,21.70,21.70
2523,אוטן ג`וניור ג`ל לילדים דוחה יתושים,דנשר (1963) בעמ,יח`,,1,21.70,21.70
2524,אוטן אפטר בייט 25 מל - דוחה יתושים,דנשר (1963) בעמ,יח`,,1,26.50,26.50
2525,גביעי גלידה 24 יח -גילרו,רזיט שיווק בעמ,יח`,,1,6.90,6.90
2526,גביעי גלידריה ללא גלוטן 12 יח,רזיט שיווק בעמ,יח`,,1,14.90,14.90
2527,פרש וואנס רביעייה מגבונים לחים קשמיר קיי,דנשר (1963) בעמ,יח`,,1,16.90,16.90
2528,טונה בשמן רביעייה 160 גר - וילי פוד,ג.וילי-פוד אינטרנשיונל בעמ,יח`,,1,22.90,3.58
2529,טונה במים רביעייה 160 גר - וילי פוד,ג.וילי-פוד אינטרנשיונל בעמ,יח`,,1,22.90,3.58
2530,מיקסים בייגלה מצ,כרמית תעשיות ממתקים בעמ,יח`,,1,4,4
2531,מיקסים קוביות וופל 55 גר 16 בקרטון,כרמית תעשיות ממתקים בעמ,יח`,,1,4,4
2532,פאוץ` פרינוק תפוח 120 גר`,גורי מוצרי צריכה (1991) בעמ,יח`,,1,6.20,5.17
2533,פאוץ` פרינוק תפוח בננה 120 גר`,גורי מוצרי צריכה (1991) בעמ,יח`,,1,6.20,5.17
2534,פאוץ` פרינוק מחית סלט פירות 120 גר,גורי מוצרי צריכה (1991) בעמ,יח`,,1,6.20,5.17
2535,פאוץ` פרינוק תפוח אכומניות 120 גר`,גורי מוצרי צריכה (1991) בעמ,יח`,,1,6.20,5.17
2536,פאוץ` פרינוק פירות טרופיים 120 גר`,גורי מוצרי צריכה (1991) בעמ,יח`,,1,6.20,5.17
2537,פאוץ` פרינוק לפתן פירות 120 גר`,גורי מוצרי צריכה (1991) בעמ,יח`,,1,6.20,5.17
2538,פאוץ` פרינוק פירות מעורבים 120 גר`,גורי מוצרי צריכה (1991) בעמ,יח`,,1,6.20,5.17
2539,פלפל שחור גרוס 80 גר`,תבליני טעם וריח בעמ,יח`,,1,9.90,12.38
2540,פלפל שחור טחון 80 גר`,תבליני טעם וריח בעמ,יח`,,1,9.90,12.38
2541,פפריקה מתוקה בשמן 80 גר`,תבליני טעם וריח בעמ,יח`,,1,5.90,7.38
2542,פפריקה חריפה 80 גר`,תבליני טעם וריח בעמ,יח`,,1,5.90,7.38
2543,פפריקה מתוקה 80 גר`,תבליני טעם וריח בעמ,יח`,,1,5.90,7.38
2544,גריל עוף 80 גר`,תבליני טעם וריח בעמ,יח`,,1,5.90,7.38
2545,זעתר מעורב 80 גר`,תבליני טעם וריח בעמ,יח`,,1,5.90,7.38
2546,מלח לימון 80 גר`,תבליני טעם וריח בעמ,יח`,,1,5.90,7.38
2547,כמון טחון 80 גר`,תבליני טעם וריח בעמ,יח`,,1,5.90,7.38
2548,כורכום טחון 80 גר`,תבליני טעם וריח בעמ,יח`,,1,5.90,7.38
2549,בהרט 80 גר`,תבליני טעם וריח בעמ,יח`,,1,5.90,7.38
2550,שום גבישי 80 גר`,תבליני טעם וריח בעמ,יח`,,1,7.90,9.88
2551,חוואיג` למרק 80 גר`,תבליני טעם וריח בעמ,יח`,,1,5.90,7.38
2552,תיבול על האש 80 גר`,תבליני טעם וריח בעמ,יח`,,1,5.90,7.38
2553,תיבול לשווארמה 80 גר`,תבליני טעם וריח בעמ,יח`,,1,5.90,7.38
2554,מרינדת עוף קלאסי- פפריקה שום עגבניות 25,תבליני טעם וריח בעמ,יח`,,1,5.90,23.60
2555,מרינדת עוף פיקנטי- צ`ילי שום עגבניות 25,תבליני טעם וריח בעמ,יח`,,1,5.90,23.60
2556,מרינדת עוף איטלקי לימון- שום עשבי תיבול,תבליני טעם וריח בעמ,יח`,,1,5.90,23.60
2557,פפריקה מתוקה שקית 250 גרם,תבליני טעם וריח בעמ,יח`,,1,9.90,3.96
2558,כורכום שקית 250 גרם,תבליני טעם וריח בעמ,יח`,,1,9.90,3.96
2559,פפריקה מרוקאית מתוקה בשמן שקית 250גר`,תבליני טעם וריח בעמ,יח`,,1,9.90,3.96
2560,מלח לימון שקית 500 גר`,תבליני טעם וריח בעמ,יח`,,1,9.90,1.98
2561,סודה לשתיה 80 גר`,תבליני טעם וריח בעמ,יח`,,1,3.90,4.88
2562,תערובת במתיקות מעודנת 70 גר`,תבליני טעם וריח בעמ,יח`,,1,5.90,8.43
2563,תערובת הודית 70 גר`,תבליני טעם וריח בעמ,יח`,,1,5.90,8.43
2564,תערובת פרסית 70 גר`,תבליני טעם וריח בעמ,יח`,,1,5.90,8.43
2565,תערובת מזרחית 70 גר`,תבליני טעם וריח בעמ,יח`,,1,5.90,8.43
2566,תערובת מקסיקנית חריפה 70 גר`,תבליני טעם וריח בעמ,יח`,,1,5.90,8.43
2567,פלפל שחור שלם 80 גר`,תבליני טעם וריח בעמ,יח`,,1,9.90,12.38
2568,נטיפי שוקולד לאפייה שוקולדמריר 250גר,מיה תעשיות מזון מ.ת.מ. בעמ,יח`,,1,11.20,4.48
2569,אמיליאנו למברוסק,טמפו משקאות בעמ,יח`,,1,31.60,4.17
2570,יין למברסקו ביאנקו לבן 750 מל,טמפו משקאות בעמ,יח`,,1,31.60,4.17
2571,אמיליאנו למברוסק,טמפו משקאות בעמ,יח`,,1,31.60,4.17
2572,ריחן קברנה סוביניון 750 מל ברקן,טמפו משקאות בעמ,יח`,,1,67.30,8.93
2573,מרום גליל רוזה 750 מל,טמפו משקאות בעמ,יח`,,1,44.10,5.84
2574,ברנדי שטוק 84 דבש ( 750 מל),טמפו משקאות בעמ,יח`,,1,71.30,9.47
