,ItemName,ManufactureName,UnitQty,Quantity,QtyInPackage,ItemPrice,UnitOfMeasurePrice
0,דג פילה סלמון טרי,ח.י. מעדני גורמה בעמ,"ק""ג",,1,99.90,99.90
1,בשר טחון טרי מנתח מובחר,ח.י. מעדני גורמה בעמ,"ק""ג",,1,59.90,59.90
2,"קוקומן בד""ץ 500 כדורים",יוניליוור ישראל שיווק בעמ,"י""ח",,1,19.90,3.98
3,נמס בכוס לייט ירוק 34גר,יוניליוור ישראל שיווק בעמ,"י""ח",,1,6.50,19.12
4,קוקומן חום לבן 375גרם,יוניליוור ישראל שיווק בעמ,"י""ח",,1,19.90,5.31
5,קוקומן כדורים 500גרם,יוניליוור ישראל שיווק בעמ,"י""ח",,1,19.90,3.98
6,פטריות נמס 43 גרם,יוניליוור ישראל שיווק בעמ,"י""ח",,1,6.50,15.12
7,נמס בכוס ברוקולי 42גרם,יוניליוור ישראל שיווק בעמ,"י""ח",,1,6.50,15.48
8,שניצל עוף ביתי בציפוי שומשום עוף טוב,קבוצת אוסם סחר-שות.מוגבלת,"י""ח",,1,39.90,5.70
9,שניצל אמיתי מעודן עוף טוב,קבוצת אוסם סחר-שות.מוגבלת,"י""ח",,1,40.50,5.79
10,שניצל אמיתי קריספי עוף טוב,קבוצת אוסם סחר-שות.מוגבלת,"י""ח",,1,40.50,5.79
11,"עוגי  500  ג`בד""ץ",יוניליוור ישראל שיווק בעמ,"י""ח",,1,19.90,3.98
12,שוגי 20% פחות סוכר 500  גר,יוניליוור ישראל שיווק בעמ,"י""ח",,1,19.90,3.98
13,"קוקומן בד""ץ 500 כדורים 20% פחות סוכר",יוניליוור ישראל שיווק בעמ,"י""ח",,1,19.90,3.98
14,נמס בכוס מרק ירקות עם קרוטונים 56 ג בדץ,יוניליוור ישראל שיווק בעמ,"י""ח",,1,6.50,19.12
15,נמס בכוס מרק עגבניות עם קרוטונים 62  ג`ב,יוניליוור ישראל שיווק בעמ,"י""ח",,1,6.50,19.12
16,קוקומן חום לבן 20% פחות סוכר 375 גרם ב,יוניליוור ישראל שיווק בעמ,"י""ח",,1,19.90,5.31
17,"עוגי מופחת סוכר  500 ג בד""ץ",יוניליוור ישראל שיווק בעמ,"י""ח",,1,19.90,3.98
18,בצק עלים  צרפתי מעדנות 1 קג,תנובה בשר,"י""ח",,1,21.90,21.90
19,בורקס גבינה מעדנות 800 ג`,תנובה בשר,"י""ח",,1,19.90,2.49
20,"בורקס מעדנות תפו""א",תנובה בשר,"י""ח",,1,19.90,2.49
21,"מלווח חיסכוני 1.4 ק""ג",תנובה בשר,"י""ח",,1,27.90,19.93
22,ריבועי בצק עלים,תנובה בשר,"י""ח",,1,21.90,2.74
23,בלינצ ס עלים,תנובה בשר,"י""ח",,1,25.90,3.70
24,מרכך  כביסה]סוד[,גורי שיווק בעמ,"י""ח",,1,18.90,4.73
25,מרכך כביסה לתינוק 4 ליטר,גורי שיווק בעמ,"י""ח",,1,18.90,4.73
26,מרכך כביסה סוד 4 ליטר,גורי שיווק בעמ,"י""ח",,1,18.90,4.73
27,מרכך כביסה סוד 4 ל,גורי שיווק בעמ,"י""ח",,1,18.90,4.73
28,מרכך כביסה סוד צהוב 4 ל,גורי שיווק בעמ,"י""ח",,1,18.90,4.73
29,מרכך כביסה סוד ורוד 4 ליטר,גורי שיווק בעמ,"י""ח",,1,18.90,4.73
30,מרכך כביסה כחול 4 ליטר,גורי שיווק בעמ,"י""ח",,1,18.90,4.73
31,שניצל תירס 750 גרם,קבוצת אוסם סחר-שות.מוגבלת,"י""ח",,1,25.90,3.45
32,"קוקומן חום לבן 375 גרם בד""ץ",יוניליוור ישראל שיווק בעמ,"י""ח",,1,19.90,5.31
33,בייגלה ]400בייגל שמיניות מלוחות,יוניליוור ישראל שיווק בעמ,"י""ח",,1,9.90,2.48
34,בייגלה אחד אחד 400,יוניליוור ישראל שיווק בעמ,"י""ח",,1,9.90,2.48
35,כבד  פטם}קפוא{,נטו מלינדה סחר בעמ,"ק""ג",,1,14.90,14.90
36,עוף טרי שלם מוכשר(קצביה)**.,ח.י. מעדני גורמה בעמ,"ק""ג",,1,19.90,19.90
37,כבד עוף קפוא,תנובה בשר,"ק""ג",,1,12.90,12.90
38,כרעיים עוף טרי(קצביה )**.,ח.י. מעדני גורמה בעמ,"ק""ג",,1,27.90,27.90
39,כבד עוף קפוא.,טל-הל יסכה בעמ,"ק""ג",,1,15.90,15.90
40,פילה אמנון גדלים שונים נטו,נטו מלינדה סחר בעמ,"ק""ג",,1,32.90,32.90
41,פילה אמנון מאסטאר פוד,נטו מלינדה סחר בעמ,"ק""ג",,1,40,40
42,קולפן פרסה אלומיניום,אוהב ציון בעמ,"י""ח",,1,7.90,7.90
43,פילה אמנון קפוא,בלדי בעמ,"ק""ג",,1,32.90,32.90
44,פילה נקי נקי ענק,נטו מלינדה סחר בעמ,"ק""ג",,1,34.90,34.90
45,פילה אמנון גדלים שונים נטו,נטו מלינדה סחר בעמ,"ק""ג",,1,32.90,32.90
46,פילה אמנון גדלים שונים נטו,נטו מלינדה סחר בעמ,"ק""ג",,1,32.90,32.90
47,בייגלה שמיניות  שומשום  300ג,יוניליוור ישראל שיווק בעמ,"י""ח",,1,10.90,3.63
48,פילה אמנון דלידג גדלים שונים,נטו מלינדה סחר בעמ,"ק""ג",,1,32.90,32.90
49,פילה אמנון גדלים שונים,נטו מלינדה סחר בעמ,"ק""ג",,1,32.90,32.90
50,כבד עוף קפוא,טרי וחלק 2 בעמ,"ק""ג",,1,12.90,12.90
51,פילה אמנון גדלים שונים בלדי,בלדי בעמ,"ק""ג",,1,32.90,32.90
52,פילה אמנון בלדי גדלים שונים,בלדי בעמ,"ק""ג",,1,32.90,32.90
53,פילה אמנון גדלים שונים נטו דלידג,נטו מלינדה סחר בעמ,"ק""ג",,1,32.90,32.90
54,פילה אמנון בוואקום,בלדי בעמ,"ק""ג",,1,32.90,32.90
55,"קמח כוסמין  1ק""ג ישראליות",טחנות ישראליות בעמ,"י""ח",,1,11.90,11.90
56,"קמח כוסמין מעושר בחנקן 1ק""ג",טחנות ישראליות בעמ,"י""ח",,1,13.90,13.90
57,דג פילה אמנון,נטו מלינדה סחר בעמ,"ק""ג",,1,32.90,32.90
58,פילה אמנון גדלים שונים נטו,נטו מלינדה סחר בעמ,"ק""ג",,1,32.90,32.90
59,פילה אמנון קפוא,נטו מלינדה סחר בעמ,"ק""ג",,1,32.90,32.90
60,פילה אמנון גדלים שונים בלדי,בלדי בעמ,"ק""ג",,1,32.90,32.90
61,פילה אמנון פרמיום 5-7,בלדי בעמ,"ק""ג",,1,32.90,32.90
62,מרק פטריות מוקרם 400גרם פסח,יוניליוור ישראל שיווק בעמ,"י""ח",,1,24.90,6.23
63,"עוגי שוקו 500 ג בד""ץ",יוניליוור ישראל שיווק בעמ,"י""ח",,1,19.90,3.98
64,מרק בצל 400 X 12,יוניליוור ישראל שיווק בעמ,"י""ח",,1,24.90,6.23
65,"פיצי בד""צ 500 ג",יוניליוור ישראל שיווק בעמ,"י""ח",,1,19.90,3.98
66,"שוגי 500  גר}בד""ץ{",יוניליוור ישראל שיווק בעמ,"י""ח",,1,19.90,3.98
67,"קוקומן פיצפוצים 500גר בד""ץ",יוניליוור ישראל שיווק בעמ,"י""ח",,1,19.90,3.98
68,נמס בכוס ועוד עגבניות 64גרם,יוניליוור ישראל שיווק בעמ,"י""ח",,1,6.90,10.78
69,פילה אמנון גדלים שונים בלדי,בלדי בעמ,"ק""ג",,1,32.90,32.90
70,רולדת שוקולד מצופה,שטראוס גרופ בעמ,"י""ח",,1,15.90,3.98
71,סוכריות   M M   שוקו.,מרס ריגלי ישראל בעמ,"י""ח",,1,4.90,4.90
72,פילה אמנון גדלים שונים נטו,נטו מלינדה סחר בעמ,"ק""ג",,1,32.90,32.90
73,פילה אמנון דלידג,נטו מלינדה סחר בעמ,"ק""ג",,1,32.90,16.45
74,פילה אמנון דלי דג,נטו מלינדה סחר בעמ,"ק""ג",,1,32.90,32.90
75,פילה אמנון גדלים שונים תיבול פלפל,נטו מלינדה סחר בעמ,"ק""ג",,1,32.90,32.90
76,פילה אמנון קפוא,נטו מלינדה סחר בעמ,"ק""ג",,1,32.90,32.90
77,פילה אמנון קפוא,נטו מלינדה סחר בעמ,"ק""ג",,1,32.90,32.90
78,פילה אמנון גדלים שונים קפוא,נטו מלינדה סחר בעמ,"ק""ג",,1,32.90,32.90
79,פילה אמנון גדלים שונים  קפוא,נטו מלינדה סחר בעמ,"ק""ג",,1,32.90,32.90
80,פילה אמנון  קפוא(דלידג),נטו מלינדה סחר בעמ,"ק""ג",,1,32.90,32.90
81,פילה אמנון קפוא,נטו מלינדה סחר בעמ,"ק""ג",,1,32.90,32.90
82,פילה אמנון קפוא בווקום גדלים שונים,בלדי בעמ,"ק""ג",,1,32.90,32.90
83,גל גל 400 גרם טבעות,יוניליוור ישראל שיווק בעמ,"י""ח",,1,9.90,2.48
84,קוקטייל מלוח 350 גרם,יוניליוור ישראל שיווק בעמ,"י""ח",,1,12.90,3.69
85,"נשנשים תפו""א בצל 300 גרם",יוניליוור ישראל שיווק בעמ,"י""ח",,1,11.90,3.97
86,נשנשים תירס 325 גרם,יוניליוור ישראל שיווק בעמ,"י""ח",,1,11.90,3.66
87,נשנשים זעתר 300 גרם,יוניליוור ישראל שיווק בעמ,"י""ח",,1,11.90,3.97
88,נשנשים 6דגנים 326 גרם,יוניליוור ישראל שיווק בעמ,"י""ח",,1,11.90,3.66
89,נשנשים עגול מלוח 350 גר.,יוניליוור ישראל שיווק בעמ,"י""ח",,1,11.90,3.40
90,נשנושים משולש שומשום,יוניליוור ישראל שיווק בעמ,"י""ח",,1,11.90,3.40
91,קוקטייל שומשום 350 גרם,יוניליוור ישראל שיווק בעמ,"י""ח",,1,12.90,3.69
92,בלינצ ס גבינה,תנובה בשר,"י""ח",,1,26.90,5.38
93,נקניקיות בבצק]מעדנות[,תנובה בשר,"י""ח",,1,26.90,3.36
94,בורקיטס פריך גבינה,תנובה בשר,"י""ח",,1,26.90,4.14
95,בורקס  פיצה}מעדנות{,תנובה בשר,"י""ח",,1,24.90,3.56
96,אמפנדס בשר]מעדנות[,תנובה בשר,"י""ח",,1,26.90,4.14
97,פיצה משפחתית גבינה 500 ג מעדנות,תנובה בשר,"י""ח",,1,23.90,4.78
98,"פיצה משפחתית זיתים 550ג""ר מעדנות",תנובה בשר,"י""ח",,1,23.90,4.35
99,פיצה אישית גבינה,תנובה בשר,"י""ח",,1,36.90,4.92
100,פיצה אישית עגולה זיתים,תנובה בשר,"י""ח",,1,36.90,4.34
101,פיצה משולשת 750 גרם,תנובה בשר,"י""ח",,1,36.90,4.92
102,פיצה משולש זיתים,תנובה בשר,"י""ח",,1,36.90,4.34
103,חטיפי פיצה מעדנות,תנובה בשר,"י""ח",,1,33,5.08
104,בצק פילאס טורקי,תנובה בשר,"י""ח",,1,21.90,3.65
105,"יין הר חרמון לבן 750 מ""ל",היכל היין שקד גולן בעמ,"י""ח",,1,29.90,3.95
106,פילה אמנון גדלים שונים,נטו מלינדה סחר בעמ,"ק""ג",,1,32.90,32.90
107,פילה אמנון גדולים שונים בלדי,בלדי בעמ,"ק""ג",,1,32.90,32.90
108,ג חנון  בצק}מעדנות 700 ג,תנובה בשר,"י""ח",,1,17.90,2.56
109,ג חנון מעדנות אפוי למיקרוגל 750 ג,תנובה בשר,"י""ח",,1,23.90,3.19
110,"מיני בורקס תפו""א מעדנות",תנובה בשר,"י""ח",,1,24,3
111,מיני בורקס גבינה מעדנות,תנובה בשר,"י""ח",,1,27,3.38
112,ריבועי פיצה זיתים,תנובה בשר,"י""ח",,1,34.20,4.82
113,"מיני בורקס תפו""א",תנובה בשר,"י""ח",,1,22.90,3.52
114,מיני בורקס גבינה,תנובה בשר,"י""ח",,1,24.90,3.11
115,"בצק עלים קמח מלא 1 ק""ג",תנובה בשר,"י""ח",,1,21.90,21.90
116,"ג חנון בצק 1 ק""ג",תנובה בשר,"י""ח",,1,21.90,21.90
117,מיני ג חנון אפוי,תנובה בשר,"י""ח",,1,22,3.67
118,בצק עלים חמאה,תנובה בשר,"י""ח",,1,26.90,4.48
119,מלווח פלופק 700 ג`,תנובה בשר,"י""ח",,1,12.70,1.81
120,קונפיטורה תות יד מרדכי,שטראוס גרופ בעמ,"י""ח",,1,12.90,3.79
121,כבד עוף ארוז קפוא.,נטו מלינדה סחר בעמ,"ק""ג",,1,14.90,14.90
122,פילה אמנון גדלים שונים נטו דלידג,נטו מלינדה סחר בעמ,"ק""ג",,1,32.90,32.90
123,"רקאנטי יסמין אדום 750מ""ל",היכל היין שקד גולן בעמ,"י""ח",,1,31.90,4.21
124,"רקאנטי יסמין לבן 750מ""ל",היכל היין שקד גולן בעמ,"י""ח",,1,31.90,4.21
125,רולדה קוקוס,שטראוס גרופ בעמ,"י""ח",,1,15.90,4.54
126,פינצטה נירוסטה,אוהב ציון בעמ,"י""ח",,1,4.90,4.90
127,סוכריות   M M   קריספי,לפ מרס מולטיסיילס ישראל,"י""ח",,1,4.90,4.90
128,MNM  סוכריות שוקולד בטיוב,לפ מרס מולטיסיילס ישראל,"י""ח",,1,3.90,3.90
129,סוכריות   M M   קריספי.,לפ מרס מולטיסיילס ישראל,"י""ח",,1,4.90,4.90
130,סוכריות M M  פינאטס,לפ מרס מולטיסיילס ישראל,"י""ח",,1,4.90,4.90
131,סוכריות   M M   שוקו.,לפ מרס מולטיסיילס ישראל,"י""ח",,1,4.90,4.90
132,סוכריות M M  פינאטס 48 ג,מרס ריגלי ישראל בעמ,"י""ח",,1,4.90,4.90
133,סוכריות M M  לבן 48גר,מרס ריגלי ישראל בעמ,"י""ח",,1,4.90,4.90
134,מסכה כירורגית מארז חמישייה.,נריאל ריהוט אומנותי בעמ,"י""ח",,1,19.90,19.90
135,אורביט בקבוקון WHITE טעם פירות,לפ מרס מולטיסיילס ישראל,"י""ח",,1,10.50,11.67
136,אורביט בקבוקון WHITE קלאסי,לפ מרס מולטיסיילס ישראל,"י""ח",,1,10.50,11.67
137,אורביט בקבוקון WHITE טעם מנטה,לפ מרס מולטיסיילס ישראל,"י""ח",,1,10.50,11.67
138,אורביט בקבוקון פרופשיונל פפרמינט,לפ מרס מולטיסיילס ישראל,"י""ח",,1,10.50,11.67
139,אורביט בקבוקון WHITE טעם הדרים,לפ מרס מולטיסיילס ישראל,"י""ח",,1,10.50,11.67
140,אורביט בקבוקון WHITE טעם אוכמניות,לפ מרס מולטיסיילס ישראל,"י""ח",,1,10.50,11.67
141,אורביט בקבוקון באבל מינט,לפ מרס מולטיסיילס ישראל,"י""ח",,1,10.50,11.67
142,אורביט שקית ספירמינט.,לפ מרס מולטיסיילס ישראל,"י""ח",,1,7.90,13.62
143,אורביט שקית פפרמינט.,לפ מרס מולטיסיילס ישראל,"י""ח",,1,7.90,13.62
144,אורביט בקבוקון WHITE תפוז,לפ מרס מולטיסיילס ישראל,"י""ח",,1,10.50,11.67
145,אורביט בקבוקון WHITE טעם תפוז,לפ מרס מולטיסיילס ישראל,"י""ח",,1,10.50,11.67
146,מסטיק פייב בוקס פפרמינט 69גר,מרס ריגלי ישראל בעמ,"י""ח",,1,10.50,10.50
147,מסטיק פייב בוקס אבטיח 69גר,מרס ריגלי ישראל בעמ,"י""ח",,1,10.50,10.50
148,אורביט  בקבוקון תות,לפ מרס מולטיסיילס ישראל,"י""ח",,1,10.50,11.67
149,אורביט שקית בבלמינט.,לפ מרס מולטיסיילס ישראל,"י""ח",,1,7.90,13.62
150,איירוויבז בקבוקון טעם אקסטרים,לפ מרס מולטיסיילס ישראל,"י""ח",,1,10.50,11.67
151,מסטיק פייב בוקס אבטיח 69גר,מרס ריגלי ישראל בעמ,"י""ח",,1,10.50,10.50
152,אורביט בקבוקון WHITE טעם תות,לפ מרס מולטיסיילס ישראל,"י""ח",,1,10.50,11.67
153,אורביט בקבוקון פרופשיונל ספירמינט,לפ מרס מולטיסיילס ישראל,"י""ח",,1,10.50,11.67
154,מלטיזרס ממתק,לפ מרס מולטיסיילס ישראל,"י""ח",,1,4.90,13.24
155,מרס רביעייה 180ג,לפ מרס מולטיסיילס ישראל,"י""ח",,1,12.90,7.17
156,סניקרס רביעייה 180ג,לפ מרס מולטיסיילס ישראל,"י""ח",,1,12.90,7.17
157,טויקס רביעייה 200גר,לפ מרס מולטיסיילס ישראל,"י""ח",,1,12.90,6.45
158,באונטי  רביעייה 228ג,לפ מרס מולטיסיילס ישראל,"י""ח",,1,12.90,5.66
159,באונטי מארז 4+1,לפ מרס מולטיסיילס ישראל,"י""ח",,1,12.90,7.17
160,טוויקס מארז 4+1,לפ מרס מולטיסיילס ישראל,"י""ח",,1,12.90,7.17
161,מארס מארז 4+1,לפ מרס מולטיסיילס ישראל,"י""ח",,1,12.90,7.17
162,סניקרס מארז 4+1,לפ מרס מולטיסיילס ישראל,"י""ח",,1,12.90,7.17
163,סניקרס רביעייה 180ג,לפ מרס מולטיסיילס ישראל,"י""ח",,1,12.90,7.17
164,סיני מיניס מהדורת קיץ,קבוצת אוסם סחר-שות.מוגבלת,"י""ח",,1,11.90,3.40
165,צ`יריוס האני נאט 375גר,קבוצת אוסם סחר-שות.מוגבלת,"י""ח",,1,11.90,3.40
166,סט 10 מסכות הגנה.,אוצרות בית יוסף בעמ,"י""ח",,1,29.90,29.90
167,"קמח כוסמין  מלא מעושר בחנקן 1ק""ג 80%",טחנות ישראליות בעמ,"י""ח",,1,13.90,13.90
168,טונה בשמן צמחי 414 גרם פילטונה,תעשיות פילטונה בעמ,"י""ח",,1,13.90,3.36
169,מעדן משמש 100% פרי 250גר,שטראוס גרופ בעמ,"י""ח",,1,14.90,5.96
170,מעדן תות 100% פרי 250גר,שטראוס גרופ בעמ,"י""ח",,1,13.90,5.56
171,מעדן 100% פירות יער 250גר,שטראוס גרופ בעמ,"י""ח",,1,14.90,5.96
172,מעדן שזיף 100% פרי 250גר,שטראוס גרופ בעמ,"י""ח",,1,14.90,5.96
173,טבעות שומשום 300גר`,יוניליוור ישראל שיווק בעמ,"י""ח",,1,9.90,3.30
174,מעדן 100% פרי תפוז 250גר,שטראוס גרופ בעמ,"י""ח",,1,14.90,5.96
175,"נוזל כלים 750מ""ל Green power",החב הדרומית לשיווק,"י""ח",,1,9.90,1.32
176,בורקס פילו במילוי גבינה 600 גר`מעדנות,תנובה בשר,"י""ח",,1,19.90,3.32
177,"בורקס פילו במילוי תפו""א 600גר`",תנובה בשר,"י""ח",,1,19.90,3.32
178,בורקס פילו פיצה 600גר`,תנובה בשר,"י""ח",,1,19.90,3.32
179,בורקס פילו בולגרית 600גר`,תנובה בשר,"י""ח",,1,19.90,3.32
180,בורקס פילו במילוי תרד וגבינה 600גר`,תנובה בשר,"י""ח",,1,19.90,3.32
181,בצק עלים  900גרם  }מעדנות{,תנובה בשר,"י""ח",,1,21.90,2.43
182,בצק עלים פריך   מתוק}מעדנות{900גר,תנובה בשר,"י""ח",,1,22.90,2.54
183,בצק עלים פריך   מלוח}מעדנות{900גר,תנובה בשר,"י""ח",,1,22.90,2.54
184,בורקס פילו במילוי פטריות 600גר`,תנובה בשר,"י""ח",,1,19.90,3.32
185,בורקס פילו במילוי תרד 600גרם,תנובה בשר,"י""ח",,1,19.90,3.32
186,בצק שמרים למאפים מתוקים 900גרם,תנובה בשר,"י""ח",,1,21.40,2.38
187,מארז 3 פיצות גבינה,תנובה בשר,"י""ח",,1,40,33.33
188,בורקס פילו ארבע גבינות 500ג,תנובה בשר,"י""ח",,1,21.90,2.74
189,אצבעות פילו גבינה וניל,תנובה בשר,"י""ח",,1,15.90,1.99
190,מאפה פילו במילוי עוף 700גר,תנובה בשר,"י""ח",,1,35.90,5.13
191,"מאפה פילו במילוי תפו""א 740גר",תנובה בשר,"י""ח",,1,25.50,3.45
192,פיצה טוסט גבינה 800ג,תנובה בשר,"י""ח",,1,28.50,3.56
193,פיצה טוסט גבינה וזיתים 800ג,תנובה בשר,"י""ח",,1,28.50,3.56
194,בצק לפיצה דק 400גר,תנובה בשר,"י""ח",,1,19,2.11
195,בצק לפיצה עבה 400גר,תנובה בשר,"י""ח",,1,19,2.11
196,בייגלה דקים דקים מלח ים  300 גר`,יוניליוור ישראל שיווק בעמ,"י""ח",,1,9.90,3.30
197,בייגלה דקים טעם שמנת בצל  300גר,יוניליוור ישראל שיווק בעמ,"י""ח",,1,10.90,3.63
198,בייגלה דקים דקים שומשום קלאסי  300 גר`,יוניליוור ישראל שיווק בעמ,"י""ח",,1,9.90,3.30
199,טונה בשמן קנולה 414 גרם פילטונה,תעשיות פילטונה בעמ,"י""ח",,1,13.90,3.36
200,זוג פיצה משפחתי בחבק,תנובה בשר,"י""ח",,1,30.90,61.80
201,פיצה מקמח מלא 500ג,תנובה בשר,"י""ח",,1,25.90,51.80
202,פיצה דקה מעדנות{,תנובה בשר,"י""ח",,1,14.90,3.92
203,פיצה דקה בתיבול שום 410ג,תנובה בשר,"י""ח",,1,14.90,3.63
204,פיצה אישית מלבן  200ג,תנובה בשר,"י""ח",,1,5.50,2.75
205,מיני מלאווח 530 ג}מעדנות{,תנובה בשר,"י""ח",,1,11.90,2.25
206,מלוואח 234ג,תנובה בשר,"י""ח",,1,5.50,2.35
207,"בורקס תפו""א   200ג",תנובה בשר,"י""ח",,1,5.50,3.06
208,בורקס גבינה   200ג,תנובה בשר,"י""ח",,1,5.50,3.06
209,בצק פילו 500גר,תנובה בשר,"י""ח",,1,21.90,4.38
210,בצק פילו עם קמח מלא 500גר,תנובה בשר,"י""ח",,1,21.90,4.38
211,"מאגדת בורקס עלים תפו""א 1.6ק""ג",תנובה בשר,"י""ח",,1,28.90,18.06
212,בורקס  יפו מעדנות גבינה 600ג,תנובה בשר,"י""ח",,1,17.90,2.98
213,"בורקס יפו מעדנות תפו""א  600ג",תנובה בשר,"י""ח",,1,15.90,2.65
214,בצק שמרים עלים חמאה,תנובה בשר,"י""ח",,1,26.90,4.48
215,בצק פריך מתוק חמאה,תנובה בשר,"י""ח",,1,26.90,4.48
216,חטיפי פיצה גבינה על בסיס קמח מלא מעדנות,תנובה בשר,"י""ח",,1,29.90,4.60
217,"חטיפי פיצה גבינה בד""צ650ג",תנובה בשר,"י""ח",,1,34.90,5.37
218,"פיצה משפחתית גבינה 500ג בד""צ",תנובה בשר,"י""ח",,1,23.90,22.13
219,שלישיית פיצות בחבק *360ג,תנובה בשר,"י""ח",,1,29.90,27.69
220,"בצק עלים מופחת שומן 1ק""ג",תנובה בשר,"י""ח",,1,21.90,21.90
221,פיצה ביאנקה ברוטב שמנת ותרד,תנובה בשר,"י""ח",,1,24.90,4.45
222,בורקס  יפו תרד וגבינה600ג,תנובה בשר,"י""ח",,1,19.90,3.32
223,שטרודל תפוח עץ  600ג,תנובה בשר,"י""ח",,1,19.90,3.32
224,פוקצה 600ג,תנובה בשר,"י""ח",,1,13.90,2.32
225,פוקצה מקמח מלא 600ג,תנובה בשר,"י""ח",,1,13.90,2.32
226,פיצה עם בצק עגבניות מעדנות 460ג,תנובה בשר,"י""ח",,1,23.90,5.20
227,פיצה עם בצק תרד מעדנות 460ג,תנובה בשר,"י""ח",,1,23.90,5.20
228,פיצה עם בצק פלפלים מעדנות 460ג,תנובה בשר,"י""ח",,1,23.90,5.20
229,פיצה פוקציה מרגריטה,תנובה בשר,"י""ח",,1,23.90,4.88
230,פיצה פוקציה בסגנון יווני,תנובה בשר,"י""ח",,1,24.90,5.08
231,בורקס  יפו משפחתי שבלול גבינה500ג,תנובה בשר,"י""ח",,1,17.90,3.58
232,"בורקס  יפו משפחתי שבלול תפו""א 500ג",תנובה בשר,"י""ח",,1,15.90,3.18
233,בורקס  יפו משפחתי שבלול תרד גבינה 500ג,תנובה בשר,"י""ח",,1,20.90,4.18
234,שטרודל תפוחי עץ   קפוא,תנובה בשר,"י""ח",,1,19.90,3.98
235,פיצה פוקציה ביאנקה בזיליקום,תנובה בשר,"י""ח",,1,23.90,4.88
236,עוגת קראנץ שמרים שוקולד קפוא,תנובה בשר,"י""ח",,1,19.90,3.98
237,עוגת קראנץ שמרים שוקולד קפוא,תנובה בשר,"י""ח",,1,19.90,3.98
238,עוגת קראנץ שמרים חלבה שוקולד  קפוא,תנובה בשר,"י""ח",,1,19.90,3.98
239,עוגת קראנץ שמרים נוגט קפוא,תנובה בשר,"י""ח",,1,19.90,3.98
240,שטרודל גבינה   קפוא,תנובה בשר,"י""ח",,1,19.90,3.98
241,בורקס גבינה מופחת שומן 800ג.,תנובה בשר,"י""ח",,1,22.90,2.86
242,"בורקס תפו""א  מופחת שומן 800ג",תנובה בשר,"י""ח",,1,22.90,2.86
243,חטיפי פיצה  עם זיתים מעדנות,תנובה בשר,"י""ח",,1,32.90,4.63
244,"יין הר חרמון אינדיגו 750 מ""ל",היכל היין שקד גולן בעמ,"י""ח",,1,29.90,3.95
245,"יין הר חרמון מוסקטו 750 מ""ל",היכל היין שקד גולן בעמ,"י""ח",,1,29.90,3.95
246,שניצל עוף טוב ביתי ציפוי צ`יפס רכיבים,קבוצת אוסם סחר-שות.מוגבלת,"י""ח",,1,40.50,5.79
247,שניצל עוף דק פחות מלח 700גר רכיבים טבע,קבוצת אוסם סחר-שות.מוגבלת,"י""ח",,1,39.90,5.70
248,אצבעות שניצל שומשום פחות מלח 700 עוף ט,קבוצת אוסם סחר-שות.מוגבלת,"י""ח",,1,36.90,5.27
249,שניצל ביתי מעודן פחות מלח 700גר עוף טו,קבוצת אוסם סחר-שות.מוגבלת,"י""ח",,1,39.90,5.70
250,עוף טוב שניצל עוף ביתי מתובל ר.טבע 600,קבוצת אוסם סחר-שות.מוגבלת,"י""ח",,1,37.90,6.32
251,"יין הר חרמון קברנה סוביניון 750 מ""ל.",היכל היין שקד גולן בעמ,"י""ח",,1,29.90,3.95
252,סטארקיסט טונה טו גו 80גר עם עגבניות,דיפלומט בעמ,"י""ח",,1,9.90,12.38
253,סטארקיסט טונה טו גו 80גר עם לימון ותימין,דיפלומט בעמ,"י""ח",,1,9.90,12.38
254,סטארקיסט טונה טו גו 80גר צילי ושום,דיפלומט בעמ,"י""ח",,1,9.90,12.38
255,"מקלות פילו תפו""א  450ג קפוא",תנובה בשר,"י""ח",,1,17.90,3.98
256,שבלולי שמרים במילוי ממרח קינמון 350ג,תנובה בשר,"י""ח",,1,16.90,4.83
