,ItemName,ManufactureName,UnitQty,Quantity,QtyInPackage,ItemPrice,UnitOfMeasurePrice
0,דג פילה סלמון טרי,ח.י. מעדני גורמה בעמ,"ק""ג",,1,99.90,99.90
1,קנה 3יינות יקב רמת הגולן/הרי גליל קבל,היכל היין שקד גולן בעמ,"י""ח",,1,7.90,7.90
2,קישואים,פלאפל הגשר מרכז,"ק""ג",,1,7.90,7.90
3,בשר טחון טרי מנתח מובחר,ח.י. מעדני גורמה בעמ,"ק""ג",,1,59.90,59.90
4,דג סלמון קפוא מנות תנובה 6*200גר,תנובה בשר,"ק""ג",,1,99.90,99.90
5,"פפסי מקס ליים שישייה פחיות 330מ""ל דל ק",טמפו משקאות בעמ,"י""ח",,1,16.90,7.63
6,פפסי מקס ליים 1.5ליטר רביעייה דל קלורי,טמפו משקאות בעמ,"י""ח",,1,24.10,3.82
7,בצק עלים  צרפתי מעדנות 1 קג,תנובה בשר,"י""ח",,1,21.90,21.90
8,בורקס גבינה מעדנות 800 ג`,תנובה בשר,"י""ח",,1,19.90,2.49
9,"בורקס מעדנות תפו""א",תנובה בשר,"י""ח",,1,19.90,2.49
10,"מלווח חיסכוני 1.4 ק""ג",תנובה בשר,"י""ח",,1,27.90,19.93
11,ריבועי בצק עלים,תנובה בשר,"י""ח",,1,21.90,2.74
12,בלינצ ס עלים,תנובה בשר,"י""ח",,1,25.90,3.70
13,שניצל תירס 750 גרם,קבוצת אוסם סחר-שות.מוגבלת,"י""ח",,1,25.90,3.45
14,בטטה,תוצרת המושב בעמ,"י""ח",,1,10.90,10.90
15,כבד  פטם}קפוא{,נטו מלינדה סחר בעמ,"ק""ג",,1,14.90,14.90
16,כבד עוף קפוא,תנובה בשר,"ק""ג",,1,12.90,12.90
17,כרעיים עוף טרי(קצביה )**.,ח.י. מעדני גורמה בעמ,"ק""ג",,1,27.90,27.90
18,פילה אמנון 5-7 1005 דג פרמיום,תנובה בשר,"ק""ג",,1,34.90,34.90
19,זוג סלמון קפוא ללא עור 100% דג,תנובה בשר,"ק""ג",,1,89.90,89.90
20,פילה סלמון מעושן פרוס 60גר,תנובה בשר,"י""ח",,1,7.90,13.17
21,פילה אמנון 7-9 1005 דג פרמיום,תנובה בשר,"ק""ג",,1,34.90,34.90
22,רסק עגב  28% פריניר,ח.כהן סוכנות מזון ומשקאות בע,"י""ח",,1,6.90,1.19
23,עגבניות מרוסקות800 גר,ח.כהן סוכנות מזון ומשקאות בע,"י""ח",,1,6.90,0.86
24,כבד עוף קפוא.,טל-הל יסכה בעמ,"ק""ג",,1,15.90,15.90
25,פילה אמנון גדלים שונים נטו,נטו מלינדה סחר בעמ,"ק""ג",,1,32.90,32.90
26,פילה אמנון מאסטאר פוד,נטו מלינדה סחר בעמ,"ק""ג",,1,40,40
27,קולפן פרסה אלומיניום,אוהב ציון בעמ,"י""ח",,1,7.90,7.90
28,פילה אמנון קפוא,בלדי בעמ,"ק""ג",,1,32.90,32.90
29,פילה נקי נקי ענק,נטו מלינדה סחר בעמ,"ק""ג",,1,34.90,34.90
30,פילה אמנון גדלים שונים נטו,נטו מלינדה סחר בעמ,"ק""ג",,1,32.90,32.90
31,פילה אמנון גדלים שונים נטו,נטו מלינדה סחר בעמ,"ק""ג",,1,32.90,32.90
32,טרופיות 40 יח,ח.כהן סוכנות מזון ומשקאות בע,"י""ח",,1,24.90,24.90
33,פילה אמנון דלידג גדלים שונים,נטו מלינדה סחר בעמ,"ק""ג",,1,32.90,32.90
34,פילה אמנון גדלים שונים,נטו מלינדה סחר בעמ,"ק""ג",,1,32.90,32.90
35,כבד עוף קפוא,טרי וחלק 2 בעמ,"ק""ג",,1,12.90,12.90
36,פילה אמנון גדלים שונים בלדי,בלדי בעמ,"ק""ג",,1,32.90,32.90
37,פילה אמנון בלדי גדלים שונים,בלדי בעמ,"ק""ג",,1,32.90,32.90
38,פילה אמנון גדלים שונים נטו דלידג,נטו מלינדה סחר בעמ,"ק""ג",,1,32.90,32.90
39,פילה אמנון בוואקום,בלדי בעמ,"ק""ג",,1,32.90,32.90
40,דג פילה אמנון,נטו מלינדה סחר בעמ,"ק""ג",,1,32.90,32.90
41,פילה אמנון גדלים שונים נטו,נטו מלינדה סחר בעמ,"ק""ג",,1,32.90,32.90
42,עגבניות קוביות 900גר,ח.כהן סוכנות מזון ומשקאות בע,"י""ח",,1,6.90,0.86
43,פילה אמנון קפוא,נטו מלינדה סחר בעמ,"ק""ג",,1,32.90,32.90
44,פילה אמנון גדלים שונים בלדי,בלדי בעמ,"ק""ג",,1,32.90,32.90
45,פילה אמנון פרמיום 5-7,בלדי בעמ,"ק""ג",,1,32.90,32.90
46,פילה אמנון גדלים שונים בלדי,בלדי בעמ,"ק""ג",,1,32.90,32.90
47,פילה אמנון גדלים שונים נטו,נטו מלינדה סחר בעמ,"ק""ג",,1,32.90,32.90
48,פילה אמנון דלידג,נטו מלינדה סחר בעמ,"ק""ג",,1,32.90,16.45
49,פילה אמנון דלי דג,נטו מלינדה סחר בעמ,"ק""ג",,1,32.90,32.90
50,פילה אמנון גדלים שונים תיבול פלפל,נטו מלינדה סחר בעמ,"ק""ג",,1,32.90,32.90
51,פילה אמנון קפוא,נטו מלינדה סחר בעמ,"ק""ג",,1,32.90,32.90
52,פילה אמנון קפוא,נטו מלינדה סחר בעמ,"ק""ג",,1,32.90,32.90
53,פילה אמנון גדלים שונים קפוא,נטו מלינדה סחר בעמ,"ק""ג",,1,32.90,32.90
54,פילה אמנון גדלים שונים  קפוא,נטו מלינדה סחר בעמ,"ק""ג",,1,32.90,32.90
55,פילה אמנון  קפוא(דלידג),נטו מלינדה סחר בעמ,"ק""ג",,1,32.90,32.90
56,פילה אמנון קפוא,נטו מלינדה סחר בעמ,"ק""ג",,1,32.90,32.90
57,פילה אמנון קפוא בווקום גדלים שונים,בלדי בעמ,"ק""ג",,1,32.90,32.90
58,בלינצ ס גבינה,תנובה בשר,"י""ח",,1,26.90,5.38
59,נקניקיות בבצק]מעדנות[,תנובה בשר,"י""ח",,1,26.90,3.36
60,בורקיטס פריך גבינה,תנובה בשר,"י""ח",,1,26.90,4.14
61,בורקס  פיצה}מעדנות{,תנובה בשר,"י""ח",,1,24.90,3.56
62,אמפנדס בשר]מעדנות[,תנובה בשר,"י""ח",,1,26.90,4.14
63,פיצה משפחתית גבינה 500 ג מעדנות,תנובה בשר,"י""ח",,1,23.90,4.78
64,"פיצה משפחתית זיתים 550ג""ר מעדנות",תנובה בשר,"י""ח",,1,23.90,4.35
65,פיצה אישית גבינה,תנובה בשר,"י""ח",,1,36.90,4.92
66,פיצה אישית עגולה זיתים,תנובה בשר,"י""ח",,1,36.90,4.34
67,פיצה משולשת 750 גרם,תנובה בשר,"י""ח",,1,36.90,4.92
68,פיצה משולש זיתים,תנובה בשר,"י""ח",,1,36.90,4.34
69,חטיפי פיצה מעדנות,תנובה בשר,"י""ח",,1,33,5.08
70,בצק פילאס טורקי,תנובה בשר,"י""ח",,1,21.90,3.65
71,"יין הר חרמון לבן 750 מ""ל",היכל היין שקד גולן בעמ,"י""ח",,1,29.90,3.95
72,פילה אמנון גדלים שונים,נטו מלינדה סחר בעמ,"ק""ג",,1,32.90,32.90
73,פילה אמנון גדולים שונים בלדי,בלדי בעמ,"ק""ג",,1,32.90,32.90
74,ג חנון  בצק}מעדנות 700 ג,תנובה בשר,"י""ח",,1,17.90,2.56
75,ג חנון מעדנות אפוי למיקרוגל 750 ג,תנובה בשר,"י""ח",,1,23.90,3.19
76,"מיני בורקס תפו""א מעדנות",תנובה בשר,"י""ח",,1,24,3
77,מיני בורקס גבינה מעדנות,תנובה בשר,"י""ח",,1,27,3.38
78,ריבועי פיצה זיתים,תנובה בשר,"י""ח",,1,34.20,4.82
79,"מיני בורקס תפו""א",תנובה בשר,"י""ח",,1,22.90,3.52
80,מיני בורקס גבינה,תנובה בשר,"י""ח",,1,24.90,3.11
81,"בצק עלים קמח מלא 1 ק""ג",תנובה בשר,"י""ח",,1,21.90,21.90
82,"ג חנון בצק 1 ק""ג",תנובה בשר,"י""ח",,1,21.90,21.90
83,מיני ג חנון אפוי,תנובה בשר,"י""ח",,1,22,3.67
84,בצק עלים חמאה,תנובה בשר,"י""ח",,1,26.90,4.48
85,מלווח פלופק 700 ג`,תנובה בשר,"י""ח",,1,12.70,1.81
86,כבד עוף ארוז קפוא.,נטו מלינדה סחר בעמ,"ק""ג",,1,14.90,14.90
87,מירנדה MIX IT תפוז אוכמניות 1.5 ליטר,טמפו משקאות בעמ,"י""ח",,1,5.50,3.67
88,מירנדה MIX IT טעם ענבים מלון 1.5 ליטר,טמפו משקאות בעמ,"י""ח",,1,5.50,3.67
89,פילה אמנון גדלים שונים נטו דלידג,נטו מלינדה סחר בעמ,"ק""ג",,1,32.90,32.90
90,"רקאנטי יסמין אדום 750מ""ל",היכל היין שקד גולן בעמ,"י""ח",,1,31.90,4.21
91,"רקאנטי יסמין לבן 750מ""ל",היכל היין שקד גולן בעמ,"י""ח",,1,31.90,4.21
92,פינצטה נירוסטה,אוהב ציון בעמ,"י""ח",,1,4.90,4.90
93,0405,לפ הוצ בולט תעשיו,"י""ח",,1,4.05,4.05
94,טמפקס פלאש סופר 30 יח,דיפלומט מפיצים 1968 בעמ,"י""ח",,1,34.70,34.70
95,מסכה כירורגית מארז חמישייה.,נריאל ריהוט אומנותי בעמ,"י""ח",,1,19.90,19.90
96,"בירה Blanc 1664 5% 330מ""ל שישייה",חברה המרכזית להפצת משקאות בעמ,"י""ח",,1,54.90,26.82
97,ריטר ספורט חלב עם שקדים שלמים,ליימן שליסל,"י""ח",,1,10.90,10.90
98,סט 10 מסכות הגנה.,אוצרות בית יוסף בעמ,"י""ח",,1,29.90,29.90
99,מנגל   נירוסטה+רשת,ציון תורגמן בעמ,"י""ח",,1,29.90,29.90
100,פס  500גר לייבוביץ,לייבוביץ,"י""ח",,1,34.90,6.98
101,טונה בשמן צמחי 414 גרם פילטונה,תעשיות פילטונה בעמ,"י""ח",,1,13.90,3.36
102,גביעי גלידה  24יח  אמריקה גילרו,ח.כהן סוכנות מזון ומשקאות בע,"י""ח",,1,8.90,0.37
103,חטיף קלאסי 30 יח גילרו,ח.כהן סוכנות מזון ומשקאות בע,"י""ח",,1,12.90,0.43
104,"נוזל כלים 750מ""ל Green power",החב הדרומית לשיווק,"י""ח",,1,9.90,1.32
105,נקסט טבק פיין סיגריות חפיסה.,פיליפ מוריס בעמ,"י""ח",,1,79.90,79.90
106,פקאן סיני 150 גרם,זארובי פיצוחי הגליל,"י""ח",,1,21.90,14.60
107,קשיו 170גר,זארובי פיצוחי הגליל,"י""ח",,1,14.90,8.76
108,בורקס פילו במילוי גבינה 600 גר`מעדנות,תנובה בשר,"י""ח",,1,19.90,3.32
109,"בורקס פילו במילוי תפו""א 600גר`",תנובה בשר,"י""ח",,1,19.90,3.32
110,בורקס פילו פיצה 600גר`,תנובה בשר,"י""ח",,1,19.90,3.32
111,בורקס פילו בולגרית 600גר`,תנובה בשר,"י""ח",,1,19.90,3.32
112,בורקס פילו במילוי תרד וגבינה 600גר`,תנובה בשר,"י""ח",,1,19.90,3.32
113,בצק עלים  900גרם  }מעדנות{,תנובה בשר,"י""ח",,1,21.90,2.43
114,בצק עלים פריך   מתוק}מעדנות{900גר,תנובה בשר,"י""ח",,1,22.90,2.54
115,בצק עלים פריך   מלוח}מעדנות{900גר,תנובה בשר,"י""ח",,1,22.90,2.54
116,בורקס פילו במילוי פטריות 600גר`,תנובה בשר,"י""ח",,1,19.90,3.32
117,בורקס פילו במילוי תרד 600גרם,תנובה בשר,"י""ח",,1,19.90,3.32
118,בצק שמרים למאפים מתוקים 900גרם,תנובה בשר,"י""ח",,1,21.40,2.38
119,מארז 3 פיצות גבינה,תנובה בשר,"י""ח",,1,40,33.33
120,בורקס פילו ארבע גבינות 500ג,תנובה בשר,"י""ח",,1,21.90,2.74
121,אצבעות פילו גבינה וניל,תנובה בשר,"י""ח",,1,15.90,1.99
122,מאפה פילו במילוי עוף 700גר,תנובה בשר,"י""ח",,1,35.90,5.13
123,"מאפה פילו במילוי תפו""א 740גר",תנובה בשר,"י""ח",,1,25.50,3.45
124,פיצה טוסט גבינה 800ג,תנובה בשר,"י""ח",,1,28.50,3.56
125,פיצה טוסט גבינה וזיתים 800ג,תנובה בשר,"י""ח",,1,28.50,3.56
126,בצק לפיצה דק 400גר,תנובה בשר,"י""ח",,1,19,2.11
127,בצק לפיצה עבה 400גר,תנובה בשר,"י""ח",,1,19,2.11
128,שומשום 400 גר`מימונס,מימונס אפיה בעמ,"י""ח",,1,11.90,2.98
129,רוטב פסטה 240גר פריניר,ח.כהן סוכנות מזון ומשקאות בע,"י""ח",,1,5.90,8.43
130,טונה בשמן קנולה 414 גרם פילטונה,תעשיות פילטונה בעמ,"י""ח",,1,13.90,3.36
131,זוג פיצה משפחתי בחבק,תנובה בשר,"י""ח",,1,30.90,61.80
132,פיצה מקמח מלא 500ג,תנובה בשר,"י""ח",,1,25.90,51.80
133,פיצה דקה מעדנות{,תנובה בשר,"י""ח",,1,14.90,3.92
134,פיצה דקה בתיבול שום 410ג,תנובה בשר,"י""ח",,1,14.90,3.63
135,פיצה אישית מלבן  200ג,תנובה בשר,"י""ח",,1,5.50,2.75
136,מיני מלאווח 530 ג}מעדנות{,תנובה בשר,"י""ח",,1,11.90,2.25
137,מלוואח 234ג,תנובה בשר,"י""ח",,1,5.50,2.35
138,"בורקס תפו""א   200ג",תנובה בשר,"י""ח",,1,5.50,3.06
139,בורקס גבינה   200ג,תנובה בשר,"י""ח",,1,5.50,3.06
140,בצק פילו 500גר,תנובה בשר,"י""ח",,1,21.90,4.38
141,בצק פילו עם קמח מלא 500גר,תנובה בשר,"י""ח",,1,21.90,4.38
142,"מאגדת בורקס עלים תפו""א 1.6ק""ג",תנובה בשר,"י""ח",,1,28.90,18.06
143,בורקס  יפו מעדנות גבינה 600ג,תנובה בשר,"י""ח",,1,17.90,2.98
144,"בורקס יפו מעדנות תפו""א  600ג",תנובה בשר,"י""ח",,1,15.90,2.65
145,בצק שמרים עלים חמאה,תנובה בשר,"י""ח",,1,26.90,4.48
146,בצק פריך מתוק חמאה,תנובה בשר,"י""ח",,1,26.90,4.48
147,חטיפי פיצה גבינה על בסיס קמח מלא מעדנות,תנובה בשר,"י""ח",,1,29.90,4.60
148,"חטיפי פיצה גבינה בד""צ650ג",תנובה בשר,"י""ח",,1,34.90,5.37
149,"פיצה משפחתית גבינה 500ג בד""צ",תנובה בשר,"י""ח",,1,23.90,22.13
150,שלישיית פיצות בחבק *360ג,תנובה בשר,"י""ח",,1,29.90,27.69
151,"בצק עלים מופחת שומן 1ק""ג",תנובה בשר,"י""ח",,1,21.90,21.90
152,פיצה ביאנקה ברוטב שמנת ותרד,תנובה בשר,"י""ח",,1,24.90,4.45
153,בורקס  יפו תרד וגבינה600ג,תנובה בשר,"י""ח",,1,19.90,3.32
154,שטרודל תפוח עץ  600ג,תנובה בשר,"י""ח",,1,19.90,3.32
155,פוקצה 600ג,תנובה בשר,"י""ח",,1,13.90,2.32
156,פוקצה מקמח מלא 600ג,תנובה בשר,"י""ח",,1,13.90,2.32
157,פיצה עם בצק עגבניות מעדנות 460ג,תנובה בשר,"י""ח",,1,23.90,5.20
158,פיצה עם בצק תרד מעדנות 460ג,תנובה בשר,"י""ח",,1,23.90,5.20
159,פיצה עם בצק פלפלים מעדנות 460ג,תנובה בשר,"י""ח",,1,23.90,5.20
160,פיצה פוקציה מרגריטה,תנובה בשר,"י""ח",,1,23.90,4.88
161,פיצה פוקציה בסגנון יווני,תנובה בשר,"י""ח",,1,24.90,5.08
162,בורקס  יפו משפחתי שבלול גבינה500ג,תנובה בשר,"י""ח",,1,17.90,3.58
163,"בורקס  יפו משפחתי שבלול תפו""א 500ג",תנובה בשר,"י""ח",,1,15.90,3.18
164,בורקס  יפו משפחתי שבלול תרד גבינה 500ג,תנובה בשר,"י""ח",,1,20.90,4.18
165,שטרודל תפוחי עץ   קפוא,תנובה בשר,"י""ח",,1,19.90,3.98
166,פיצה פוקציה ביאנקה בזיליקום,תנובה בשר,"י""ח",,1,23.90,4.88
167,עוגת קראנץ שמרים שוקולד קפוא,תנובה בשר,"י""ח",,1,19.90,3.98
168,עוגת קראנץ שמרים שוקולד קפוא,תנובה בשר,"י""ח",,1,19.90,3.98
169,עוגת קראנץ שמרים חלבה שוקולד  קפוא,תנובה בשר,"י""ח",,1,19.90,3.98
170,עוגת קראנץ שמרים נוגט קפוא,תנובה בשר,"י""ח",,1,19.90,3.98
171,שטרודל גבינה   קפוא,תנובה בשר,"י""ח",,1,19.90,3.98
172,בורקס גבינה מופחת שומן 800ג.,תנובה בשר,"י""ח",,1,22.90,2.86
173,"בורקס תפו""א  מופחת שומן 800ג",תנובה בשר,"י""ח",,1,22.90,2.86
174,חטיפי פיצה  עם זיתים מעדנות,תנובה בשר,"י""ח",,1,32.90,4.63
175,"יין הר חרמון אינדיגו 750 מ""ל",היכל היין שקד גולן בעמ,"י""ח",,1,29.90,3.95
176,"יין הר חרמון מוסקטו 750 מ""ל",היכל היין שקד גולן בעמ,"י""ח",,1,29.90,3.95
177,"יין הר חרמון קברנה סוביניון 750 מ""ל.",היכל היין שקד גולן בעמ,"י""ח",,1,29.90,3.95
178,רוטב עגבניות מתובל לפסטה  240גר פריניר,ח.כהן סוכנות מזון ומשקאות בע,"י""ח",,1,5.90,8.43
179,רוטב עגבניות מתובל לפסטה  240גר פריניר,ח.כהן סוכנות מזון ומשקאות בע,"י""ח",,1,5.90,8.43
180,רוטב עגבניות מתובל לפיצה  240גר פריניר,ח.כהן סוכנות מזון ומשקאות בע,"י""ח",,1,5.90,8.43
181,וופל קראנץ 30יח גילרו,ח.כהן סוכנות מזון ומשקאות בע,"י""ח",,1,12.90,0.43
182,סטארקיסט טונה טו גו 80גר עם עגבניות,דיפלומט בעמ,"י""ח",,1,9.90,12.38
183,סטארקיסט טונה טו גו 80גר עם לימון ותימין,דיפלומט בעמ,"י""ח",,1,9.90,12.38
184,סטארקיסט טונה טו גו 80גר צילי ושום,דיפלומט בעמ,"י""ח",,1,9.90,12.38
185,"יין הר חרמון מג נטה 750 מ""ל",היכל היין שקד גולן בעמ,"י""ח",,1,29.90,3.95
186,"מקלות פילו תפו""א  450ג קפוא",תנובה בשר,"י""ח",,1,17.90,3.98
187,שבלולי שמרים במילוי ממרח קינמון 350ג,תנובה בשר,"י""ח",,1,16.90,4.83
188,מקלות פילו פלפל קלוי וגבינה   450ג קפוא,תנובה בשר,"י""ח",,1,17.90,3.98
189,שבלולי שמרים במילוי ממרח שוקולד 350ג.,תנובה בשר,"י""ח",,1,16.90,4.83
190,מקלות פילו גבינה 450ג קפוא,תנובה בשר,"י""ח",,1,17.90,3.98
191,מקלות פילו חציל קלוי וגבינה   450ג קפו,תנובה בשר,"י""ח",,1,17.90,3.98
192,סט 4 סכיני חיתוך,אוהב ציון בעמ,"י""ח",,1,14.90,14.90
193,"מגבות לובלי  שישייה כשל""פ",שניב תעשיות נייר בעמ,"י""ח",,1,11.90,1.98
194,שולחן מתקפל,איי.סקסז בעמ,"י""ח",,1,139.90,139.90
195,"סנו אוקסיג ן אבקה 1.5 ק""ג",החב הדרומית לשיווק,"י""ח",,1,25.90,17.27
196,נוזל לניקוי אסלות  Green power,החב הדרומית לשיווק,"י""ח",,1,12.90,1.72
197,נוזל לניקוי חלונות  Green power,החב הדרומית לשיווק,"י""ח",,1,12.90,1.72
198,נוזל לניקוי כללי  Green power,החב הדרומית לשיווק,"י""ח",,1,15.90,3.18
199,נוזל לשטיפת רצפות  Green power,החב הדרומית לשיווק,"י""ח",,1,19.90,9.95
200,ג`ל כביסה 3ליטר   Green power,החב הדרומית לשיווק,"י""ח",,1,34.90,11.63
201,אוראו דקים שוקו  96ג,דיפלומט בעמ,"י""ח",,1,7.90,8.23
202,אוראו דקים וניל 96ג,דיפלומט בעמ,"י""ח",,1,7.90,8.23
203,קודראטיני טרמיסו,ליימן שליסל,"י""ח",,1,13.90,6.32
204,לואקר קוארדטיני קוקוס  250גר`,ליימן שליסל,"י""ח",,1,13.90,5.56
205,קוארדטיני וניל 250גר`,ליימן שליסל,"י""ח",,1,13.90,5.56
206,קוארדטיני שוק מריר 250ג,ליימן שליסל,"י""ח",,1,13.90,5.56
207,לואקר קוארדטיני שוקו חלב  250גר`.,ליימן שליסל,"י""ח",,1,13.90,5.56
208,אריאל גל כביסה 2.255ליטר בייבי,דיפלומט מפיצים 1968 בעמ,"י""ח",,1,34.90,15.48
209,אריאל גל קולור 2.36ל ניחוח הרים,דיפלומט מפיצים 1968 בעמ,"י""ח",,1,34.90,14.79
210,אריאל גל ניחוח מרענן  2.36ל.,דיפלומט מפיצים 1968 בעמ,"י""ח",,1,34.90,14.79
211,אריאל גל קולור 2.36ל,דיפלומט מפיצים 1968 בעמ,"י""ח",,1,34.90,14.79
212,קווה ג ום סרה זהב,היכל היין שקד גולן בעמ,"י""ח",,1,33.20,33.20
