,ItemName,ManufactureName,UnitQty,Quantity,QtyInPackage,ItemPrice,UnitOfMeasurePrice
0,מלון,ביכורי הנגב מ.ד בעמ,"ק""ג",,1,6.90,6.90
1,שזיף אדום,ביכורי הנגב מ.ד בעמ,"ק""ג",,1,10.90,10.90
2,פלפל כתום,ביכורי הנגב מ.ד בעמ,"ק""ג",,1,8.90,8.90
3,בשר טחון טרי מנתח מובחר,ח.י. מעדני גורמה בעמ,"ק""ג",,1,59.90,59.90
4,פפסי מקס ליים 1.5ליטר רביעייה דל קלורי,טמפו משקאות בעמ,"י""ח",,1,22.90,3.82
5,עוף טוב נתחי פילה אמיתי בתיבול ברביקיו,קבוצת אוסם סחר-שות.מוגבלת,"י""ח",,1,36.90,7.38
6,שניצל עוף ביתי בציפוי שומשום עוף טוב,קבוצת אוסם סחר-שות.מוגבלת,"י""ח",,1,36.90,5.27
7,שניצל אמיתי מעודן עוף טוב,קבוצת אוסם סחר-שות.מוגבלת,"י""ח",,1,36.90,5.27
8,שניצל אמיתי קריספי עוף טוב,קבוצת אוסם סחר-שות.מוגבלת,"י""ח",,1,36.90,5.27
9,בצק עלים  צרפתי מעדנות 1 קג,תנובה בשר,"י""ח",,1,21.90,21.90
10,בורקס גבינה מעדנות 800 ג`,תנובה בשר,"י""ח",,1,19.90,2.49
11,"בורקס מעדנות תפו""א",תנובה בשר,"י""ח",,1,19.90,2.49
12,"מלווח חיסכוני 1.4 ק""ג",תנובה בשר,"י""ח",,1,27.90,19.93
13,ריבועי בצק עלים,תנובה בשר,"י""ח",,1,21.90,2.74
14,בלינצ ס עלים,תנובה בשר,"י""ח",,1,25.90,3.70
15,שניצל תירס 750 גרם,קבוצת אוסם סחר-שות.מוגבלת,"י""ח",,1,25.90,3.45
16,כבד  פטם}קפוא{,נטו מלינדה סחר בעמ,"ק""ג",,1,14.90,14.90
17,כבד עוף קפוא,תנובה בשר,"ק""ג",,1,12.90,12.90
18,כרעיים עוף טרי(קצביה )**.,ח.י. מעדני גורמה בעמ,"ק""ג",,1,27.90,27.90
19,פילה אמנון 5-7 1005 דג פרמיום,תנובה בשר,"ק""ג",,1,34.90,34.90
20,זוג סלמון קפוא ללא עור 100% דג,תנובה בשר,"ק""ג",,1,89.90,89.90
21,פילה אמנון 7-9 1005 דג פרמיום,תנובה בשר,"ק""ג",,1,34.90,34.90
22,כבד עוף קפוא.,טל-הל יסכה בעמ,"ק""ג",,1,15.90,15.90
23,פילה אמנון גדלים שונים נטו,נטו מלינדה סחר בעמ,"ק""ג",,1,32.90,32.90
24,פילה אמנון מאסטאר פוד,נטו מלינדה סחר בעמ,"ק""ג",,1,40,40
25,פילה אמנון קפוא,בלדי בעמ,"ק""ג",,1,32.90,32.90
26,פילה נקי נקי ענק,נטו מלינדה סחר בעמ,"ק""ג",,1,34.90,34.90
27,פילה אמנון גדלים שונים נטו,נטו מלינדה סחר בעמ,"ק""ג",,1,32.90,32.90
28,פילה אמנון גדלים שונים נטו,נטו מלינדה סחר בעמ,"ק""ג",,1,32.90,32.90
29,פילה אמנון דלידג גדלים שונים,נטו מלינדה סחר בעמ,"ק""ג",,1,32.90,32.90
30,פילה אמנון גדלים שונים,נטו מלינדה סחר בעמ,"ק""ג",,1,32.90,32.90
31,כבד עוף קפוא,טרי וחלק 2 בעמ,"ק""ג",,1,12.90,12.90
32,פילה אמנון גדלים שונים בלדי,בלדי בעמ,"ק""ג",,1,32.90,32.90
33,פילה אמנון בלדי גדלים שונים,בלדי בעמ,"ק""ג",,1,32.90,32.90
34,פילה אמנון גדלים שונים נטו דלידג,נטו מלינדה סחר בעמ,"ק""ג",,1,32.90,32.90
35,פילה אמנון בוואקום,בלדי בעמ,"ק""ג",,1,32.90,32.90
36,דג פילה אמנון,נטו מלינדה סחר בעמ,"ק""ג",,1,32.90,32.90
37,פילה אמנון גדלים שונים נטו,נטו מלינדה סחר בעמ,"ק""ג",,1,32.90,32.90
38,פילה אמנון קפוא,נטו מלינדה סחר בעמ,"ק""ג",,1,32.90,32.90
39,פילה אמנון גדלים שונים בלדי,בלדי בעמ,"ק""ג",,1,32.90,32.90
40,פילה אמנון פרמיום 5-7,בלדי בעמ,"ק""ג",,1,32.90,32.90
41,פילה אמנון גדלים שונים בלדי,בלדי בעמ,"ק""ג",,1,32.90,32.90
42,פילה אמנון גדלים שונים נטו,נטו מלינדה סחר בעמ,"ק""ג",,1,32.90,32.90
43,פילה אמנון דלידג,נטו מלינדה סחר בעמ,"ק""ג",,1,32.90,16.45
44,פילה אמנון דלי דג,נטו מלינדה סחר בעמ,"ק""ג",,1,32.90,32.90
45,פילה אמנון גדלים שונים תיבול פלפל,נטו מלינדה סחר בעמ,"ק""ג",,1,32.90,32.90
46,פילה אמנון קפוא,נטו מלינדה סחר בעמ,"ק""ג",,1,32.90,32.90
47,פילה אמנון קפוא,נטו מלינדה סחר בעמ,"ק""ג",,1,32.90,32.90
48,פילה אמנון גדלים שונים קפוא,נטו מלינדה סחר בעמ,"ק""ג",,1,32.90,32.90
49,פילה אמנון גדלים שונים  קפוא,נטו מלינדה סחר בעמ,"ק""ג",,1,32.90,32.90
50,פילה אמנון  קפוא(דלידג),נטו מלינדה סחר בעמ,"ק""ג",,1,32.90,32.90
51,פילה אמנון קפוא,נטו מלינדה סחר בעמ,"ק""ג",,1,32.90,32.90
52,פילה אמנון קפוא בווקום גדלים שונים,בלדי בעמ,"ק""ג",,1,32.90,32.90
53,לחות קרמה למניעת קשקשים,החב הדרומית לשיווק,"י""ח",,1,19.90,4.98
54,בלינצ ס גבינה,תנובה בשר,"י""ח",,1,26.90,5.38
55,נקניקיות בבצק]מעדנות[,תנובה בשר,"י""ח",,1,26.90,3.36
56,בורקיטס פריך גבינה,תנובה בשר,"י""ח",,1,26.90,4.14
57,בורקס  פיצה}מעדנות{,תנובה בשר,"י""ח",,1,24.90,3.56
58,אמפנדס בשר]מעדנות[,תנובה בשר,"י""ח",,1,26.90,4.14
59,פיצה משפחתית גבינה 500 ג מעדנות,תנובה בשר,"י""ח",,1,23.90,4.78
60,"פיצה משפחתית זיתים 550ג""ר מעדנות",תנובה בשר,"י""ח",,1,23.90,4.35
61,פיצה אישית גבינה,תנובה בשר,"י""ח",,1,36.90,4.92
62,פיצה אישית עגולה זיתים,תנובה בשר,"י""ח",,1,36.90,4.34
63,פיצה משולשת 750 גרם,תנובה בשר,"י""ח",,1,36.90,4.92
64,פיצה משולש זיתים,תנובה בשר,"י""ח",,1,36.90,4.34
65,חטיפי פיצה מעדנות,תנובה בשר,"י""ח",,1,33,5.08
66,בצק פילאס טורקי,תנובה בשר,"י""ח",,1,21.90,3.65
67,פילה אמנון גדלים שונים,נטו מלינדה סחר בעמ,"ק""ג",,1,32.90,32.90
68,פילה אמנון גדולים שונים בלדי,בלדי בעמ,"ק""ג",,1,32.90,32.90
69,ג חנון  בצק}מעדנות 700 ג,תנובה בשר,"י""ח",,1,17.90,2.56
70,ג חנון מעדנות אפוי למיקרוגל 750 ג,תנובה בשר,"י""ח",,1,23.90,3.19
71,"מיני בורקס תפו""א מעדנות",תנובה בשר,"י""ח",,1,24,3
72,מיני בורקס גבינה מעדנות,תנובה בשר,"י""ח",,1,27,3.38
73,ריבועי פיצה זיתים,תנובה בשר,"י""ח",,1,34.20,4.82
74,"מיני בורקס תפו""א",תנובה בשר,"י""ח",,1,22.90,3.52
75,מיני בורקס גבינה,תנובה בשר,"י""ח",,1,24.90,3.11
76,"בצק עלים קמח מלא 1 ק""ג",תנובה בשר,"י""ח",,1,21.90,21.90
77,"ג חנון בצק 1 ק""ג",תנובה בשר,"י""ח",,1,21.90,21.90
78,מיני ג חנון אפוי,תנובה בשר,"י""ח",,1,22,3.67
79,בצק עלים חמאה,תנובה בשר,"י""ח",,1,26.90,4.48
80,מלווח פלופק 700 ג`,תנובה בשר,"י""ח",,1,12.70,1.81
81,כבד עוף ארוז קפוא.,נטו מלינדה סחר בעמ,"ק""ג",,1,14.90,14.90
82,פילה אמנון גדלים שונים נטו דלידג,נטו מלינדה סחר בעמ,"ק""ג",,1,32.90,32.90
83,פינצטה נירוסטה,אוהב ציון בעמ,"י""ח",,1,4.90,4.90
84,"דאו ג`ל 75מ""ל CW-PB.",דיפלומט מפיצים 1968 בעמ,"י""ח",,1,24.90,24.90
85,"דאו ג`ל 75מ""ל PR-PB.",דיפלומט מפיצים 1968 בעמ,"י""ח",,1,24.90,24.90
86,נקסט טבק פיין סיגריות חפיסה.,פיליפ מוריס בעמ,"י""ח",,1,79.90,79.90
87,בורקס פילו במילוי גבינה 600 גר`מעדנות,תנובה בשר,"י""ח",,1,19.90,3.32
88,"בורקס פילו במילוי תפו""א 600גר`",תנובה בשר,"י""ח",,1,19.90,3.32
89,בורקס פילו פיצה 600גר`,תנובה בשר,"י""ח",,1,19.90,3.32
90,בורקס פילו בולגרית 600גר`,תנובה בשר,"י""ח",,1,19.90,3.32
91,בורקס פילו במילוי תרד וגבינה 600גר`,תנובה בשר,"י""ח",,1,19.90,3.32
92,בצק עלים  900גרם  }מעדנות{,תנובה בשר,"י""ח",,1,21.90,2.43
93,בצק עלים פריך   מתוק}מעדנות{900גר,תנובה בשר,"י""ח",,1,22.90,2.54
94,בצק עלים פריך   מלוח}מעדנות{900גר,תנובה בשר,"י""ח",,1,22.90,2.54
95,בורקס פילו במילוי פטריות 600גר`,תנובה בשר,"י""ח",,1,19.90,3.32
96,בורקס פילו במילוי תרד 600גרם,תנובה בשר,"י""ח",,1,19.90,3.32
97,בצק שמרים למאפים מתוקים 900גרם,תנובה בשר,"י""ח",,1,21.40,2.38
98,מארז 3 פיצות גבינה,תנובה בשר,"י""ח",,1,40,33.33
99,בורקס פילו ארבע גבינות 500ג,תנובה בשר,"י""ח",,1,21.90,2.74
100,אצבעות פילו גבינה וניל,תנובה בשר,"י""ח",,1,15.90,1.99
101,מאפה פילו במילוי עוף 700גר,תנובה בשר,"י""ח",,1,35.90,5.13
102,"מאפה פילו במילוי תפו""א 740גר",תנובה בשר,"י""ח",,1,25.50,3.45
103,פיצה טוסט גבינה 800ג,תנובה בשר,"י""ח",,1,28.50,3.56
104,פיצה טוסט גבינה וזיתים 800ג,תנובה בשר,"י""ח",,1,28.50,3.56
105,בצק לפיצה דק 400גר,תנובה בשר,"י""ח",,1,19,2.11
106,בצק לפיצה עבה 400גר,תנובה בשר,"י""ח",,1,19,2.11
107,שומשום 400 גר`מימונס,מימונס אפיה בעמ,"י""ח",,1,11.90,2.98
108,רוטב פסטה 240גר פריניר,ח.כהן סוכנות מזון ומשקאות בע,"י""ח",,1,5.90,8.43
109,זוג פיצה משפחתי בחבק,תנובה בשר,"י""ח",,1,30.90,61.80
110,פיצה מקמח מלא 500ג,תנובה בשר,"י""ח",,1,25.90,51.80
111,פיצה דקה מעדנות{,תנובה בשר,"י""ח",,1,14.90,3.92
112,פיצה דקה בתיבול שום 410ג,תנובה בשר,"י""ח",,1,14.90,3.63
113,פיצה אישית מלבן  200ג,תנובה בשר,"י""ח",,1,5.50,2.75
114,מיני מלאווח 530 ג}מעדנות{,תנובה בשר,"י""ח",,1,11.90,2.25
115,מלוואח 234ג,תנובה בשר,"י""ח",,1,5.50,2.35
116,"בורקס תפו""א   200ג",תנובה בשר,"י""ח",,1,5.50,3.06
117,בורקס גבינה   200ג,תנובה בשר,"י""ח",,1,5.50,3.06
118,בצק פילו 500גר,תנובה בשר,"י""ח",,1,21.90,4.38
119,בצק פילו עם קמח מלא 500גר,תנובה בשר,"י""ח",,1,21.90,4.38
120,"מאגדת בורקס עלים תפו""א 1.6ק""ג",תנובה בשר,"י""ח",,1,28.90,18.06
121,בורקס  יפו מעדנות גבינה 600ג,תנובה בשר,"י""ח",,1,17.90,2.98
122,"בורקס יפו מעדנות תפו""א  600ג",תנובה בשר,"י""ח",,1,15.90,2.65
123,בצק שמרים עלים חמאה,תנובה בשר,"י""ח",,1,26.90,4.48
124,בצק פריך מתוק חמאה,תנובה בשר,"י""ח",,1,26.90,4.48
125,חטיפי פיצה גבינה על בסיס קמח מלא מעדנות,תנובה בשר,"י""ח",,1,29.90,4.60
126,"חטיפי פיצה גבינה בד""צ650ג",תנובה בשר,"י""ח",,1,34.90,5.37
127,"פיצה משפחתית גבינה 500ג בד""צ",תנובה בשר,"י""ח",,1,23.90,22.13
128,שלישיית פיצות בחבק *360ג,תנובה בשר,"י""ח",,1,29.90,27.69
129,"בצק עלים מופחת שומן 1ק""ג",תנובה בשר,"י""ח",,1,21.90,21.90
130,פיצה ביאנקה ברוטב שמנת ותרד,תנובה בשר,"י""ח",,1,24.90,4.45
131,בורקס  יפו תרד וגבינה600ג,תנובה בשר,"י""ח",,1,19.90,3.32
132,שטרודל תפוח עץ  600ג,תנובה בשר,"י""ח",,1,19.90,3.32
133,פוקצה 600ג,תנובה בשר,"י""ח",,1,13.90,2.32
134,פוקצה מקמח מלא 600ג,תנובה בשר,"י""ח",,1,13.90,2.32
135,פיצה עם בצק עגבניות מעדנות 460ג,תנובה בשר,"י""ח",,1,23.90,5.20
136,פיצה עם בצק תרד מעדנות 460ג,תנובה בשר,"י""ח",,1,23.90,5.20
137,פיצה עם בצק פלפלים מעדנות 460ג,תנובה בשר,"י""ח",,1,23.90,5.20
138,פיצה פוקציה מרגריטה,תנובה בשר,"י""ח",,1,23.90,4.88
139,פיצה פוקציה בסגנון יווני,תנובה בשר,"י""ח",,1,24.90,5.08
140,בורקס  יפו משפחתי שבלול גבינה500ג,תנובה בשר,"י""ח",,1,17.90,3.58
141,"בורקס  יפו משפחתי שבלול תפו""א 500ג",תנובה בשר,"י""ח",,1,15.90,3.18
142,בורקס  יפו משפחתי שבלול תרד גבינה 500ג,תנובה בשר,"י""ח",,1,20.90,4.18
143,שטרודל תפוחי עץ   קפוא,תנובה בשר,"י""ח",,1,19.90,3.98
144,פיצה פוקציה ביאנקה בזיליקום,תנובה בשר,"י""ח",,1,23.90,4.88
145,עוגת קראנץ שמרים שוקולד קפוא,תנובה בשר,"י""ח",,1,19.90,3.98
146,עוגת קראנץ שמרים שוקולד קפוא,תנובה בשר,"י""ח",,1,19.90,3.98
147,עוגת קראנץ שמרים חלבה שוקולד  קפוא,תנובה בשר,"י""ח",,1,19.90,3.98
148,עוגת קראנץ שמרים נוגט קפוא,תנובה בשר,"י""ח",,1,19.90,3.98
149,שטרודל גבינה   קפוא,תנובה בשר,"י""ח",,1,19.90,3.98
150,בורקס גבינה מופחת שומן 800ג.,תנובה בשר,"י""ח",,1,22.90,2.86
151,"בורקס תפו""א  מופחת שומן 800ג",תנובה בשר,"י""ח",,1,22.90,2.86
152,חטיפי פיצה  עם זיתים מעדנות,תנובה בשר,"י""ח",,1,32.90,4.63
153,שניצל עוף טוב ביתי ציפוי צ`יפס רכיבים,קבוצת אוסם סחר-שות.מוגבלת,"י""ח",,1,36.90,5.27
154,שניצל עוף דק פחות מלח 700גר רכיבים טבע,קבוצת אוסם סחר-שות.מוגבלת,"י""ח",,1,36.90,5.27
155,שניצל ביתי מעודן פחות מלח 700גר עוף טו,קבוצת אוסם סחר-שות.מוגבלת,"י""ח",,1,36.90,5.27
156,עוף טוב שניצל עוף ביתי מתובל ר.טבע 600,קבוצת אוסם סחר-שות.מוגבלת,"י""ח",,1,36.90,6.15
157,רוטב עגבניות מתובל לפסטה  240גר פריניר,ח.כהן סוכנות מזון ומשקאות בע,"י""ח",,1,5.90,8.43
158,רוטב עגבניות מתובל לפסטה  240גר פריניר,ח.כהן סוכנות מזון ומשקאות בע,"י""ח",,1,5.90,8.43
159,רוטב עגבניות מתובל לפיצה  240גר פריניר,ח.כהן סוכנות מזון ומשקאות בע,"י""ח",,1,5.90,8.43
160,"מקלות פילו תפו""א  450ג קפוא",תנובה בשר,"י""ח",,1,17.90,3.98
161,שבלולי שמרים במילוי ממרח קינמון 350ג,תנובה בשר,"י""ח",,1,16.90,4.83
162,מקלות פילו פלפל קלוי וגבינה   450ג קפוא,תנובה בשר,"י""ח",,1,17.90,3.98
163,שבלולי שמרים במילוי ממרח שוקולד 350ג.,תנובה בשר,"י""ח",,1,16.90,4.83
164,מקלות פילו גבינה 450ג קפוא,תנובה בשר,"י""ח",,1,17.90,3.98
165,מקלות פילו חציל קלוי וגבינה   450ג קפו,תנובה בשר,"י""ח",,1,17.90,3.98
