,ItemName,ManufactureName,UnitQty,Quantity,QtyInPackage,ItemPrice,UnitOfMeasurePrice
0,דובדבן אדום ארוז,ביכורי הנגב מ.ד בעמ,"י""ח",,1,19.90,19.90
1,דג פילה סלמון טרי,ח.י. מעדני גורמה בעמ,"ק""ג",,1,99.90,99.90
2,אבטיח,ביכורי הנגב מ.ד בעמ,"ק""ג",,1,6.90,6.90
3,תפוזון,ביכורי הנגב מ.ד בעמ,"ק""ג",,1,6.90,6.90
4,משמש,ביכורי הנגב מ.ד בעמ,"ק""ג",,1,29.90,29.90
5,קלמנטינה,ביכורי הנגב מ.ד בעמ,"ק""ג",,1,7.90,7.90
6,תפוז תבורי.,ביכורי הנגב מ.ד בעמ,"ק""ג",,1,6.90,6.90
7,בטטה,ביכורי הנגב מ.ד בעמ,"ק""ג",,1,10.90,10.90
8,מלפפון,ביכורי הנגב מ.ד בעמ,"ק""ג",,1,6.90,6.90
9,פלפל צהוב,ביכורי הנגב מ.ד בעמ,"ק""ג",,1,9.90,9.90
10,גמבה אדומה,ביכורי הנגב מ.ד בעמ,"ק""ג",,1,5.90,5.90
11,פלפל בהיר,ביכורי הנגב מ.ד בעמ,"ק""ג",,1,9.90,9.90
12,קולורבי,ביכורי הנגב מ.ד בעמ,"ק""ג",,1,7.90,7.90
13,תפוח אדמה אדום,ביכורי הנגב מ.ד בעמ,"ק""ג",,1,5.90,5.90
14,ענבים,ביכורי הנגב מ.ד בעמ,"ק""ג",,1,39.90,39.90
15,פלפל כתום,ביכורי הנגב מ.ד בעמ,"ק""ג",,1,9.90,9.90
16,דובדבן לבן ארוז,ביכורי הנגב מ.ד בעמ,"י""ח",,1,19.90,19.90
17,רמדיה סופר פורמולה מתנה,לפ פודליין בעמ קוד 4381775ספק,"י""ח",,1,7.90,7.90
18,אבטיח אישי,ביכורי הנגב מ.ד בעמ,"ק""ג",,1,6.90,6.90
19,בשר טחון טרי מנתח מובחר,ח.י. מעדני גורמה בעמ,"ק""ג",,1,59.90,59.90
20,דג סלמון קפוא מנות תנובה 6*200גר,תנובה בשר,"ק""ג",,1,99.90,99.90
21,"פפסי מקס ליים שישייה פחיות 330מ""ל דל ק",טמפו משקאות בעמ,"י""ח",,1,16.90,7.63
22,פפסי מקס ליים 1.5ליטר רביעייה דל קלורי,טמפו משקאות בעמ,"י""ח",,1,22.90,3.82
23,עוף טוב נתחי פילה אמיתי בתיבול ברביקיו,קבוצת אוסם סחר-שות.מוגבלת,"י""ח",,1,36.90,7.38
24,שניצל עוף ביתי בציפוי שומשום עוף טוב,קבוצת אוסם סחר-שות.מוגבלת,"י""ח",,1,36.90,5.27
25,שניצל אמיתי מעודן עוף טוב,קבוצת אוסם סחר-שות.מוגבלת,"י""ח",,1,36.90,5.27
26,שניצל אמיתי קריספי עוף טוב,קבוצת אוסם סחר-שות.מוגבלת,"י""ח",,1,36.90,5.27
27,בצק עלים  צרפתי מעדנות 1 קג,תנובה בשר,"י""ח",,1,21.90,21.90
28,בורקס גבינה מעדנות 800 ג`,תנובה בשר,"י""ח",,1,19.90,2.49
29,"בורקס מעדנות תפו""א",תנובה בשר,"י""ח",,1,19.90,2.49
30,"מלווח חיסכוני 1.4 ק""ג",תנובה בשר,"י""ח",,1,27.90,19.93
31,ריבועי בצק עלים,תנובה בשר,"י""ח",,1,21.90,2.74
32,בלינצ ס עלים,תנובה בשר,"י""ח",,1,25.90,3.70
33,שניצל תירס 750 גרם,קבוצת אוסם סחר-שות.מוגבלת,"י""ח",,1,25.90,3.45
34,בטטה,תוצרת המושב בעמ,"י""ח",,1,10.90,10.90
35,כבד  פטם}קפוא{,נטו מלינדה סחר בעמ,"ק""ג",,1,14.90,14.90
36,כבד עוף קפוא,תנובה בשר,"ק""ג",,1,12.90,12.90
37,כרעיים עוף טרי(קצביה )**.,ח.י. מעדני גורמה בעמ,"ק""ג",,1,27.90,27.90
38,פילה אמנון 5-7 1005 דג פרמיום,תנובה בשר,"ק""ג",,1,34.90,34.90
39,זוג סלמון קפוא ללא עור 100% דג,תנובה בשר,"ק""ג",,1,89.90,89.90
40,פילה סלמון מעושן פרוס 60גר,תנובה בשר,"י""ח",,1,7.90,13.17
41,פילה אמנון 7-9 1005 דג פרמיום,תנובה בשר,"ק""ג",,1,34.90,34.90
42,ענבים לבנים מארז,ביכורי הנגב מ.ד בעמ,"ק""ג",,1,39.90,39.90
43,שקדים מוכשר,נטו מלינדה סחר בעמ,"ק""ג",,1,229.90,229.90
44,רסק עגב  28% פריניר,ח.כהן סוכנות מזון ומשקאות בע,"י""ח",,1,6.90,1.19
45,עגבניות מרוסקות800 גר,ח.כהן סוכנות מזון ומשקאות בע,"י""ח",,1,6.90,0.86
46,כבד עוף קפוא.,טל-הל יסכה בעמ,"ק""ג",,1,15.90,15.90
47,פילה אמנון גדלים שונים נטו,נטו מלינדה סחר בעמ,"ק""ג",,1,32.90,32.90
48,פילה אמנון מאסטאר פוד,נטו מלינדה סחר בעמ,"ק""ג",,1,40,40
49,קולפן פרסה אלומיניום,אוהב ציון בעמ,"י""ח",,1,7.90,7.90
50,פילה אמנון קפוא,בלדי בעמ,"ק""ג",,1,32.90,32.90
51,פילה נקי נקי ענק,נטו מלינדה סחר בעמ,"ק""ג",,1,34.90,34.90
52,פילה אמנון גדלים שונים נטו,נטו מלינדה סחר בעמ,"ק""ג",,1,32.90,32.90
53,פילה אמנון גדלים שונים נטו,נטו מלינדה סחר בעמ,"ק""ג",,1,32.90,32.90
54,טרופיות 40 יח,ח.כהן סוכנות מזון ומשקאות בע,"י""ח",,1,24.90,24.90
55,פילה אמנון דלידג גדלים שונים,נטו מלינדה סחר בעמ,"ק""ג",,1,32.90,32.90
56,פילה אמנון גדלים שונים,נטו מלינדה סחר בעמ,"ק""ג",,1,32.90,32.90
57,כבד עוף קפוא,טרי וחלק 2 בעמ,"ק""ג",,1,12.90,12.90
58,פילה אמנון גדלים שונים בלדי,בלדי בעמ,"ק""ג",,1,32.90,32.90
59,פילה אמנון בלדי גדלים שונים,בלדי בעמ,"ק""ג",,1,32.90,32.90
60,פילה אמנון גדלים שונים נטו דלידג,נטו מלינדה סחר בעמ,"ק""ג",,1,32.90,32.90
61,פילה אמנון בוואקום,בלדי בעמ,"ק""ג",,1,32.90,32.90
62,דג פילה אמנון,נטו מלינדה סחר בעמ,"ק""ג",,1,32.90,32.90
63,פילה אמנון גדלים שונים נטו,נטו מלינדה סחר בעמ,"ק""ג",,1,32.90,32.90
64,עגבניות קוביות 900גר,ח.כהן סוכנות מזון ומשקאות בע,"י""ח",,1,6.90,0.86
65,פילה אמנון קפוא,נטו מלינדה סחר בעמ,"ק""ג",,1,32.90,32.90
66,פילה אמנון גדלים שונים בלדי,בלדי בעמ,"ק""ג",,1,32.90,32.90
67,פילה אמנון פרמיום 5-7,בלדי בעמ,"ק""ג",,1,32.90,32.90
68,פילה אמנון גדלים שונים בלדי,בלדי בעמ,"ק""ג",,1,32.90,32.90
69,פילה אמנון גדלים שונים נטו,נטו מלינדה סחר בעמ,"ק""ג",,1,32.90,32.90
70,פילה אמנון דלידג,נטו מלינדה סחר בעמ,"ק""ג",,1,32.90,16.45
71,פילה אמנון דלי דג,נטו מלינדה סחר בעמ,"ק""ג",,1,32.90,32.90
72,פילה אמנון גדלים שונים תיבול פלפל,נטו מלינדה סחר בעמ,"ק""ג",,1,32.90,32.90
73,פילה אמנון קפוא,נטו מלינדה סחר בעמ,"ק""ג",,1,32.90,32.90
74,פילה אמנון קפוא,נטו מלינדה סחר בעמ,"ק""ג",,1,32.90,32.90
75,פילה אמנון גדלים שונים קפוא,נטו מלינדה סחר בעמ,"ק""ג",,1,32.90,32.90
76,פילה אמנון גדלים שונים  קפוא,נטו מלינדה סחר בעמ,"ק""ג",,1,32.90,32.90
77,פילה אמנון  קפוא(דלידג),נטו מלינדה סחר בעמ,"ק""ג",,1,32.90,32.90
78,פילה אמנון קפוא,נטו מלינדה סחר בעמ,"ק""ג",,1,32.90,32.90
79,פילה אמנון קפוא בווקום גדלים שונים,בלדי בעמ,"ק""ג",,1,32.90,32.90
80,לחות לשיער קרמה-רגיל,החב הדרומית לשיווק,"י""ח",,1,19.90,4.98
81,לחות קרמה למניעת קשקשים,החב הדרומית לשיווק,"י""ח",,1,19.90,4.98
82,בלינצ ס גבינה,תנובה בשר,"י""ח",,1,26.90,5.38
83,נקניקיות בבצק]מעדנות[,תנובה בשר,"י""ח",,1,26.90,3.36
84,בורקיטס פריך גבינה,תנובה בשר,"י""ח",,1,26.90,4.14
85,בורקס  פיצה}מעדנות{,תנובה בשר,"י""ח",,1,24.90,3.56
86,אמפנדס בשר]מעדנות[,תנובה בשר,"י""ח",,1,26.90,4.14
87,פיצה משפחתית גבינה 500 ג מעדנות,תנובה בשר,"י""ח",,1,23.90,4.78
88,"פיצה משפחתית זיתים 550ג""ר מעדנות",תנובה בשר,"י""ח",,1,23.90,4.35
89,פיצה אישית גבינה,תנובה בשר,"י""ח",,1,36.90,4.92
90,פיצה אישית עגולה זיתים,תנובה בשר,"י""ח",,1,36.90,4.34
91,פיצה משולשת 750 גרם,תנובה בשר,"י""ח",,1,36.90,4.92
92,פיצה משולש זיתים,תנובה בשר,"י""ח",,1,36.90,4.34
93,חטיפי פיצה מעדנות,תנובה בשר,"י""ח",,1,33,5.08
94,בצק פילאס טורקי,תנובה בשר,"י""ח",,1,21.90,3.65
95,"יין הר חרמון לבן 750 מ""ל",היכל היין שקד גולן בעמ,"י""ח",,1,29.90,3.95
96,פילה אמנון גדלים שונים,נטו מלינדה סחר בעמ,"ק""ג",,1,32.90,32.90
97,פילה אמנון גדולים שונים בלדי,בלדי בעמ,"ק""ג",,1,32.90,32.90
98,ג חנון  בצק}מעדנות 700 ג,תנובה בשר,"י""ח",,1,17.90,2.56
99,ג חנון מעדנות אפוי למיקרוגל 750 ג,תנובה בשר,"י""ח",,1,23.90,3.19
100,"מיני בורקס תפו""א מעדנות",תנובה בשר,"י""ח",,1,24,3
101,מיני בורקס גבינה מעדנות,תנובה בשר,"י""ח",,1,27,3.38
102,ריבועי פיצה זיתים,תנובה בשר,"י""ח",,1,34.20,4.82
103,"מיני בורקס תפו""א",תנובה בשר,"י""ח",,1,22.90,3.52
104,מיני בורקס גבינה,תנובה בשר,"י""ח",,1,24.90,3.11
105,"בצק עלים קמח מלא 1 ק""ג",תנובה בשר,"י""ח",,1,21.90,21.90
106,"ג חנון בצק 1 ק""ג",תנובה בשר,"י""ח",,1,21.90,21.90
107,מיני ג חנון אפוי,תנובה בשר,"י""ח",,1,22,3.67
108,בצק עלים חמאה,תנובה בשר,"י""ח",,1,26.90,4.48
109,מלווח פלופק 700 ג`,תנובה בשר,"י""ח",,1,12.70,1.81
110,כבד עוף ארוז קפוא.,נטו מלינדה סחר בעמ,"ק""ג",,1,14.90,14.90
111,מירנדה MIX IT תפוז אוכמניות 1.5 ליטר,טמפו משקאות בעמ,"י""ח",,1,5.50,3.67
112,מירנדה MIX IT טעם ענבים מלון 1.5 ליטר,טמפו משקאות בעמ,"י""ח",,1,5.50,3.67
113,פילה אמנון גדלים שונים נטו דלידג,נטו מלינדה סחר בעמ,"ק""ג",,1,32.90,32.90
114,"רקאנטי יסמין אדום 750מ""ל",היכל היין שקד גולן בעמ,"י""ח",,1,31.90,4.21
115,"רקאנטי יסמין לבן 750מ""ל",היכל היין שקד גולן בעמ,"י""ח",,1,31.90,4.21
116,פינצטה נירוסטה,אוהב ציון בעמ,"י""ח",,1,4.90,4.90
117,דובדבן אדום ארוז,ביכורי הנגב מ.ד בעמ,"י""ח",,1,19.90,19.90
118,0405,לפ הוצ בולט תעשיו,"י""ח",,1,3.05,3.05
119,"בירה Blanc 1664 5% 330מ""ל שישייה",חברה המרכזית להפצת משקאות בעמ,"י""ח",,1,54.90,26.82
120,ריטר ספורט חלב עם שקדים שלמים,ליימן שליסל,"י""ח",,1,10.90,10.90
121,איירוויבז בקבוקון טעם דובדבן ומנטה,מרס ריגלי ישראל בעמ,"י""ח",,1,10,11.11
122,איירוויבז בקבוקון טעם מלון ומנטה,מרס ריגלי ישראל בעמ,"י""ח",,1,10,11.11
123,ענבים לבנים מארז,ביכורי הנגב מ.ד בעמ,"ק""ג",,1,39.90,39.90
124,סט 10 מסכות הגנה.,אוצרות בית יוסף בעמ,"י""ח",,1,29.90,29.90
125,מנגל   נירוסטה+רשת,ציון תורגמן בעמ,"י""ח",,1,29.90,29.90
126,טונה בשמן צמחי 414 גרם פילטונה,תעשיות פילטונה בעמ,"י""ח",,1,13.90,3.36
127,גביעי גלידה  24יח  אמריקה גילרו,ח.כהן סוכנות מזון ומשקאות בע,"י""ח",,1,8.90,0.37
128,חטיף קלאסי 30 יח גילרו,ח.כהן סוכנות מזון ומשקאות בע,"י""ח",,1,12.90,0.43
129,"נוזל כלים 750מ""ל Green power",החב הדרומית לשיווק,"י""ח",,1,9.90,1.32
130,בורקס פילו במילוי גבינה 600 גר`מעדנות,תנובה בשר,"י""ח",,1,19.90,3.32
131,"בורקס פילו במילוי תפו""א 600גר`",תנובה בשר,"י""ח",,1,19.90,3.32
132,בורקס פילו פיצה 600גר`,תנובה בשר,"י""ח",,1,19.90,3.32
133,בורקס פילו בולגרית 600גר`,תנובה בשר,"י""ח",,1,19.90,3.32
134,בורקס פילו במילוי תרד וגבינה 600גר`,תנובה בשר,"י""ח",,1,19.90,3.32
135,בצק עלים  900גרם  }מעדנות{,תנובה בשר,"י""ח",,1,21.90,2.43
136,בצק עלים פריך   מתוק}מעדנות{900גר,תנובה בשר,"י""ח",,1,22.90,2.54
137,בצק עלים פריך   מלוח}מעדנות{900גר,תנובה בשר,"י""ח",,1,22.90,2.54
138,בורקס פילו במילוי פטריות 600גר`,תנובה בשר,"י""ח",,1,19.90,3.32
139,בורקס פילו במילוי תרד 600גרם,תנובה בשר,"י""ח",,1,19.90,3.32
140,בצק שמרים למאפים מתוקים 900גרם,תנובה בשר,"י""ח",,1,21.40,2.38
141,מארז 3 פיצות גבינה,תנובה בשר,"י""ח",,1,40,33.33
142,בורקס פילו ארבע גבינות 500ג,תנובה בשר,"י""ח",,1,21.90,2.74
143,אצבעות פילו גבינה וניל,תנובה בשר,"י""ח",,1,15.90,1.99
144,מאפה פילו במילוי עוף 700גר,תנובה בשר,"י""ח",,1,35.90,5.13
145,"מאפה פילו במילוי תפו""א 740גר",תנובה בשר,"י""ח",,1,25.50,3.45
146,פיצה טוסט גבינה 800ג,תנובה בשר,"י""ח",,1,28.50,3.56
147,פיצה טוסט גבינה וזיתים 800ג,תנובה בשר,"י""ח",,1,28.50,3.56
148,בצק לפיצה דק 400גר,תנובה בשר,"י""ח",,1,19,2.11
149,בצק לפיצה עבה 400גר,תנובה בשר,"י""ח",,1,19,2.11
150,שומשום 400 גר`מימונס,מימונס אפיה בעמ,"י""ח",,1,11.90,2.98
151,פומלה,ביכורי הנגב מ.ד בעמ,"ק""ג",,1,9.90,9.90
152,רוטב פסטה 240גר פריניר,ח.כהן סוכנות מזון ומשקאות בע,"י""ח",,1,5.90,8.43
153,טונה בשמן קנולה 414 גרם פילטונה,תעשיות פילטונה בעמ,"י""ח",,1,13.90,3.36
154,עוגת שמרים קראנץ טעם שוקולד  (400 אחוה),אחדות בעמ,"י""ח",,1,10,2.50
155,זוג פיצה משפחתי בחבק,תנובה בשר,"י""ח",,1,30.90,61.80
156,פיצה מקמח מלא 500ג,תנובה בשר,"י""ח",,1,25.90,51.80
157,פיצה דקה מעדנות{,תנובה בשר,"י""ח",,1,14.90,3.92
158,פיצה דקה בתיבול שום 410ג,תנובה בשר,"י""ח",,1,14.90,3.63
159,פיצה אישית מלבן  200ג,תנובה בשר,"י""ח",,1,5.50,2.75
160,מיני מלאווח 530 ג}מעדנות{,תנובה בשר,"י""ח",,1,11.90,2.25
161,מלוואח 234ג,תנובה בשר,"י""ח",,1,5.50,2.35
162,"בורקס תפו""א   200ג",תנובה בשר,"י""ח",,1,5.50,3.06
163,בורקס גבינה   200ג,תנובה בשר,"י""ח",,1,5.50,3.06
164,בצק פילו 500גר,תנובה בשר,"י""ח",,1,21.90,4.38
165,בצק פילו עם קמח מלא 500גר,תנובה בשר,"י""ח",,1,21.90,4.38
166,"מאגדת בורקס עלים תפו""א 1.6ק""ג",תנובה בשר,"י""ח",,1,28.90,18.06
167,בורקס  יפו מעדנות גבינה 600ג,תנובה בשר,"י""ח",,1,17.90,2.98
168,"בורקס יפו מעדנות תפו""א  600ג",תנובה בשר,"י""ח",,1,15.90,2.65
169,בצק שמרים עלים חמאה,תנובה בשר,"י""ח",,1,26.90,4.48
170,בצק פריך מתוק חמאה,תנובה בשר,"י""ח",,1,26.90,4.48
171,חטיפי פיצה גבינה על בסיס קמח מלא מעדנות,תנובה בשר,"י""ח",,1,29.90,4.60
172,"חטיפי פיצה גבינה בד""צ650ג",תנובה בשר,"י""ח",,1,34.90,5.37
173,"פיצה משפחתית גבינה 500ג בד""צ",תנובה בשר,"י""ח",,1,23.90,22.13
174,שלישיית פיצות בחבק *360ג,תנובה בשר,"י""ח",,1,29.90,27.69
175,"בצק עלים מופחת שומן 1ק""ג",תנובה בשר,"י""ח",,1,21.90,21.90
176,פיצה ביאנקה ברוטב שמנת ותרד,תנובה בשר,"י""ח",,1,24.90,4.45
177,בורקס  יפו תרד וגבינה600ג,תנובה בשר,"י""ח",,1,19.90,3.32
178,שטרודל תפוח עץ  600ג,תנובה בשר,"י""ח",,1,19.90,3.32
179,פוקצה 600ג,תנובה בשר,"י""ח",,1,13.90,2.32
180,פוקצה מקמח מלא 600ג,תנובה בשר,"י""ח",,1,13.90,2.32
181,פיצה עם בצק עגבניות מעדנות 460ג,תנובה בשר,"י""ח",,1,23.90,5.20
182,פיצה עם בצק תרד מעדנות 460ג,תנובה בשר,"י""ח",,1,23.90,5.20
183,פיצה עם בצק פלפלים מעדנות 460ג,תנובה בשר,"י""ח",,1,23.90,5.20
184,פיצה פוקציה מרגריטה,תנובה בשר,"י""ח",,1,23.90,4.88
185,פיצה פוקציה בסגנון יווני,תנובה בשר,"י""ח",,1,24.90,5.08
186,בורקס  יפו משפחתי שבלול גבינה500ג,תנובה בשר,"י""ח",,1,17.90,3.58
187,"בורקס  יפו משפחתי שבלול תפו""א 500ג",תנובה בשר,"י""ח",,1,15.90,3.18
188,בורקס  יפו משפחתי שבלול תרד גבינה 500ג,תנובה בשר,"י""ח",,1,20.90,4.18
189,שטרודל תפוחי עץ   קפוא,תנובה בשר,"י""ח",,1,19.90,3.98
190,פיצה פוקציה ביאנקה בזיליקום,תנובה בשר,"י""ח",,1,23.90,4.88
191,עוגת קראנץ שמרים שוקולד קפוא,תנובה בשר,"י""ח",,1,19.90,3.98
192,עוגת קראנץ שמרים שוקולד קפוא,תנובה בשר,"י""ח",,1,19.90,3.98
193,עוגת קראנץ שמרים חלבה שוקולד  קפוא,תנובה בשר,"י""ח",,1,19.90,3.98
194,עוגת קראנץ שמרים נוגט קפוא,תנובה בשר,"י""ח",,1,19.90,3.98
195,שטרודל גבינה   קפוא,תנובה בשר,"י""ח",,1,19.90,3.98
196,בורקס גבינה מופחת שומן 800ג.,תנובה בשר,"י""ח",,1,22.90,2.86
197,"בורקס תפו""א  מופחת שומן 800ג",תנובה בשר,"י""ח",,1,22.90,2.86
198,חטיפי פיצה  עם זיתים מעדנות,תנובה בשר,"י""ח",,1,32.90,4.63
199,"יין הר חרמון אינדיגו 750 מ""ל",היכל היין שקד גולן בעמ,"י""ח",,1,29.90,3.95
200,"יין הר חרמון מוסקטו 750 מ""ל",היכל היין שקד גולן בעמ,"י""ח",,1,29.90,3.95
201,שניצל עוף טוב ביתי ציפוי צ`יפס רכיבים,קבוצת אוסם סחר-שות.מוגבלת,"י""ח",,1,36.90,5.27
202,שניצל עוף דק פחות מלח 700גר רכיבים טבע,קבוצת אוסם סחר-שות.מוגבלת,"י""ח",,1,36.90,5.27
203,שניצל ביתי מעודן פחות מלח 700גר עוף טו,קבוצת אוסם סחר-שות.מוגבלת,"י""ח",,1,36.90,5.27
204,עוף טוב שניצל עוף ביתי מתובל ר.טבע 600,קבוצת אוסם סחר-שות.מוגבלת,"י""ח",,1,36.90,6.15
205,"יין הר חרמון קברנה סוביניון 750 מ""ל.",היכל היין שקד גולן בעמ,"י""ח",,1,29.90,3.95
206,רוטב עגבניות מתובל לפסטה  240גר פריניר,ח.כהן סוכנות מזון ומשקאות בע,"י""ח",,1,5.90,8.43
207,רוטב עגבניות מתובל לפסטה  240גר פריניר,ח.כהן סוכנות מזון ומשקאות בע,"י""ח",,1,5.90,8.43
208,רוטב עגבניות מתובל לפיצה  240גר פריניר,ח.כהן סוכנות מזון ומשקאות בע,"י""ח",,1,5.90,8.43
209,וופל קראנץ 30יח גילרו,ח.כהן סוכנות מזון ומשקאות בע,"י""ח",,1,12.90,0.43
210,סטארקיסט טונה טו גו 80גר עם עגבניות,דיפלומט בעמ,"י""ח",,1,9.90,12.38
211,סטארקיסט טונה טו גו 80גר עם לימון ותימין,דיפלומט בעמ,"י""ח",,1,9.90,12.38
212,סטארקיסט טונה טו גו 80גר צילי ושום,דיפלומט בעמ,"י""ח",,1,9.90,12.38
213,"יין הר חרמון מג נטה 750 מ""ל",היכל היין שקד גולן בעמ,"י""ח",,1,29.90,3.95
214,"מקלות פילו תפו""א  450ג קפוא",תנובה בשר,"י""ח",,1,17.90,3.98
215,שבלולי שמרים במילוי ממרח קינמון 350ג,תנובה בשר,"י""ח",,1,16.90,4.83
216,מקלות פילו פלפל קלוי וגבינה   450ג קפוא,תנובה בשר,"י""ח",,1,17.90,3.98
217,שבלולי שמרים במילוי ממרח שוקולד 350ג.,תנובה בשר,"י""ח",,1,16.90,4.83
218,מקלות פילו גבינה 450ג קפוא,תנובה בשר,"י""ח",,1,17.90,3.98
219,מקלות פילו חציל קלוי וגבינה   450ג קפו,תנובה בשר,"י""ח",,1,17.90,3.98
220,סט 4 סכיני חיתוך,אוהב ציון בעמ,"י""ח",,1,14.90,14.90
221,"סנו אוקסיג ן אבקה 1.5 ק""ג",החב הדרומית לשיווק,"י""ח",,1,25.90,17.27
222,נוזל לניקוי אסלות  Green power,החב הדרומית לשיווק,"י""ח",,1,12.90,1.72
223,נוזל לניקוי חלונות  Green power,החב הדרומית לשיווק,"י""ח",,1,12.90,1.72
224,נוזל לניקוי כללי  Green power,החב הדרומית לשיווק,"י""ח",,1,15.90,3.18
225,נוזל לשטיפת רצפות  Green power,החב הדרומית לשיווק,"י""ח",,1,19.90,9.95
226,ג`ל כביסה 3ליטר   Green power,החב הדרומית לשיווק,"י""ח",,1,34.90,11.63
227,אוראו דקים שוקו  96ג,דיפלומט בעמ,"י""ח",,1,7.90,8.23
228,אוראו דקים וניל 96ג,דיפלומט בעמ,"י""ח",,1,7.90,8.23
229,קודראטיני טרמיסו,ליימן שליסל,"י""ח",,1,13.90,6.32
230,לואקר קוארדטיני קוקוס  250גר`,ליימן שליסל,"י""ח",,1,13.90,5.56
231,קוארדטיני וניל 250גר`,ליימן שליסל,"י""ח",,1,13.90,5.56
232,קוארדטיני שוק מריר 250ג,ליימן שליסל,"י""ח",,1,13.90,5.56
233,לואקר קוארדטיני שוקו חלב  250גר`.,ליימן שליסל,"י""ח",,1,13.90,5.56
234,קווה ג ום סרה זהב,היכל היין שקד גולן בעמ,"י""ח",,1,33.20,33.20
