,ItemName,ManufactureName,UnitQty,Quantity,QtyInPackage,ItemPrice,UnitOfMeasurePrice
489,נשנשים קרקר קוקטייל שומשום 300ג,יוניליוור ישראל שיווק בעמ,"י""ח",,1,12.90,4.30
490,ממרח פסטו בזיליקום 200ג,יוניליוור ישראל שיווק בעמ,"י""ח",,1,12.90,6.45
491,ממרח עגבניות מיובשות 200ג,יוניליוור ישראל שיווק בעמ,"י""ח",,1,12.90,6.45
492,בייגלה דקים דקים מלח  270גר`,יוניליוור ישראל שיווק בעמ,"י""ח",,1,9.90,3.67
493,"קוקומן כשל""פ 375גר ללא גלוטן",יוניליוור ישראל שיווק בעמ,"י""ח",,1,19.90,5.31
494,בייגלה דקים דקים שומשום  270 גר`,יוניליוור ישראל שיווק בעמ,"י""ח",,1,9.90,3.67
495,מולטי צ יריוס 375גר,קבוצת אוסם סחר-שות.מוגבלת,"י""ח",,1,11.90,3.17
496,אוראו דקים שוקו  96ג,דיפלומט בעמ,"י""ח",,1,7.90,8.23
497,אוראו דקים וניל 96ג,דיפלומט בעמ,"י""ח",,1,7.90,8.23
498,ריו מארה טונה בשמן זית 160ג זוג,ש.שסטוביץ בעמ,"י""ח",,1,29.90,9.34
499,קווה ג ום סרה זהב,היכל היין שקד גולן בעמ,"י""ח",,1,33.20,33.20
500,"קוקומן בד""ץ 500 כדורים 20% פחות סוכר",יוניליוור ישראל שיווק בעמ,"י""ח",,1,19.90,3.98
